id|user|created_at|text|lang|label|retweet_count|favorite_count
959176198290067456|55677432|Thu Feb 01 21:26:40 +0000 2018|Great news for the people of Monroe. @CenturyLink will create 150 new Louisiana jobs. Always good to see economic d… https://t.co/pB72KjpyfI|en|R|15|28
958769268346286081|55677432|Wed Jan 31 18:29:41 +0000 2018|Photos from the scene in Crozet, VA https://t.co/qYmIna355K|en|R|42|38
958754244147994624|55677432|Wed Jan 31 17:29:59 +0000 2018|There were 3 people in the truck that was straddling the track and which the train hit. One is dead. One I am told… https://t.co/IUg5qawoXG|en|R|167|267
958745389909278722|55677432|Wed Jan 31 16:54:48 +0000 2018|A scary moment. Laura and I are ok.|en|R|47|212
958498564384133120|55677432|Wed Jan 31 00:34:00 +0000 2018|Glad President Trump is recognizing these selfless heroes tonight https://t.co/QCrq9rbPfO|en|R|13|53
957019272768839687|55677432|Fri Jan 26 22:35:49 +0000 2018|#SchoolChoice lets parents decide what is best for their children. Whether a public, charter or private school educ… https://t.co/RuJ3MHoPR6|en|R|9|34
956660486195630080|55677432|Thu Jan 25 22:50:08 +0000 2018|"""Researchers also couldn't find evidence that savings hospitals derive from the 340B program were invested in safet… https://t.co/BJWiagRZgz"|en|R|4|10
956652176230805511|55677432|Thu Jan 25 22:17:07 +0000 2018|We need to make our health care system better for patients. https://t.co/flN68hVP2t|en|R|7|19
956216155345227776|55677432|Wed Jan 24 17:24:31 +0000 2018|"“driven by steep increases in prices.” (saved you a click)

This is one reason we need price transparency – so pati… https://t.co/tAf9nMOAj0"|en|R|7|12
956194548098764805|55677432|Wed Jan 24 15:58:40 +0000 2018|This @theadvocatebr editorial is worth reading https://t.co/J6qWzh9yrY|en|R|2|3
955977658424324097|55677432|Wed Jan 24 01:36:49 +0000 2018|We've got to have border security in any discussion about immigration. WATCH my interview with Fox News: https://t.co/97x0lKX1T5|en|R|10|26
955945350208073728|55677432|Tue Jan 23 23:28:26 +0000 2018|Great news for Louisiana families. The tax reform legislation we passed is yielding real results. https://t.co/1H9VHbKTdS|en|R|11|31
955892143515631618|55677432|Tue Jan 23 19:57:01 +0000 2018|When Schumer ended the shutdown he angered the hard left. I suppose that is why he reversed his border security off… https://t.co/p9c9Hkw7KB|en|R|50|193
954780373615042560|55677432|Sat Jan 20 18:19:14 +0000 2018|One year ago today, @realDonaldTrump was inaugurated. https://t.co/VfkJVVCNxM|en|R|6|45
954431151271235584|55677432|Fri Jan 19 19:11:33 +0000 2018|I cannot believe that Democrats are going to deny kids health insurance, beginning Sunday, because of a deal that d… https://t.co/UzaqXGpwwT|en|R|70|118
954401877331988480|55677432|Fri Jan 19 17:15:14 +0000 2018|I will always defend the right to life, especially for the most vulnerable among us. Thinking of all those from LA… https://t.co/V0uVcyquDB|en|R|12|24
954366928713330688|55677432|Fri Jan 19 14:56:21 +0000 2018|Glad the city council plans to reconsider this anti-#Israel measure, as I and many others in the #NewOrleans commun… https://t.co/AR9vqKDBZA|en|R|7|12
953790771123113984|55677432|Thu Jan 18 00:46:55 +0000 2018|A great bunch of students from Mount Carmel Academy in New Orleans, E.D. White HS in Thibodaux, and C.E. Byrd HS in… https://t.co/ogS2EjoSNK|en|R|3|26
952927479731245056|55677432|Mon Jan 15 15:36:30 +0000 2018|Keep moving forward. #MLKJrDay https://t.co/6dfFu4LV5b|en|R|7|19
952701552585773056|55677432|Mon Jan 15 00:38:45 +0000 2018|TOUCHDOWN! #GoSaints #whodat|en|R|5|12
952323584055283712|55677432|Sat Jan 13 23:36:50 +0000 2018|Prepping for BIG sports day tomorrow. @PelicansNBA play the @nyknicks &amp; the @Saints continue marching toward the Su… https://t.co/kXLtdv5DUA|en|R|2|15
951955483308457984|55677432|Fri Jan 12 23:14:08 +0000 2018|This measure is rooted in anti-Semitism and hatred of Israel. This measure stands in solidarity with a Palestinian… https://t.co/Ax5ehZcSA7|en|R|16|23
951633541510713344|55677432|Fri Jan 12 01:54:51 +0000 2018|The New York Times names #NewOrleans the number one place to visit in 2018! #NotFakeNews https://t.co/mzxI0sb8EG|en|R|4|16
951597496530296833|55677432|Thu Jan 11 23:31:37 +0000 2018|ICYMI: Tax Cuts Already Working Their Magic https://t.co/KPE4PyT9VI|en|R|2|4
951519828522782720|55677432|Thu Jan 11 18:23:00 +0000 2018|Walmart is the largest employer in Louisiana, providing jobs to roughly 37,000 workers. Now, thanks to the tax cut… https://t.co/ZNn2Xos7WI|en|R|46|108
951497415697330177|55677432|Thu Jan 11 16:53:56 +0000 2018|#TBT - Mardi Gras will be here before we know it! https://t.co/UL4jYrlo7o|en|R|1|8
950861150060720128|55677432|Tue Jan 09 22:45:38 +0000 2018|I'm glad President Trump is working to fix our country's outdated immigration system. It's clear from today's meeti… https://t.co/I0hNZsvlPH|en|R|8|30
950841638091403264|55677432|Tue Jan 09 21:28:06 +0000 2018|Thinking of my friend @SteveScalise as he continues his recovery. Please keep Steve, Jennifer and their family in y… https://t.co/ExpS9sBSrw|en|R|25|156
950782406004563968|55677432|Tue Jan 09 17:32:44 +0000 2018|Wow! Already, more than 1 million American workers are receiving bigger paychecks thanks to the tax cuts bill we pa… https://t.co/djas9wFNpD|en|R|7|15
950760421333618688|55677432|Tue Jan 09 16:05:23 +0000 2018|Thank you to all the brave men and women who dedicate their lives to keeping us safe. #NationalLawEnforcementDay|en|R|4|16
950485503060652034|55677432|Mon Jan 08 21:52:57 +0000 2018|#OTD: President George Washington delivered the first State of the Union speech. https://t.co/PkogEV4d9L|en|R|2|4
950179539338039301|55677432|Mon Jan 08 01:37:10 +0000 2018|Geaux Saints! #WhoDat|fr|R|3|15
950082926670221315|55677432|Sun Jan 07 19:13:16 +0000 2018|Who'd believe fountains freeze in the bayou? https://t.co/GdY72DY321|en|R|4|29
949721451296444417|55677432|Sat Jan 06 19:16:53 +0000 2018|Together, we can help end the opioid epidemic. LEARN THE FACTS: https://t.co/8sTut7iVWf|en|R|4|9
949425102357172224|55677432|Fri Jan 05 23:39:18 +0000 2018|The question is whether the Democrats are serious or whether they just want a political issue... https://t.co/5TwLdnFVXX|en|R|3|8
948936147786444801|55677432|Thu Jan 04 15:16:22 +0000 2018|Joining @Varneyco on @FoxBusiness to talk about the amazing success of tax cuts on our economy!|en|R|2|3
948589530143174658|55677432|Wed Jan 03 16:19:02 +0000 2018|"""Sen. Bill Cassidy and House Majority Whip Steve Scalise pushed for nearly $300 million for coastal restoration for… https://t.co/1XJRUboCLw"|en|R|29|82
948322741949730816|55677432|Tue Jan 02 22:38:55 +0000 2018|Spent a great afternoon with the family the other day at Knock Knock Children's Museum in Baton Rouge. https://t.co/GlkxJcXQmK|en|R|1|3
946178278385217538|55677432|Thu Dec 28 00:37:35 +0000 2017|Our companies are investing in their workers to keep us competitive. https://t.co/xuaY2Wrxry|en|R|5|20
944700071274262528|55677432|Sat Dec 23 22:43:43 +0000 2017|Before things get too crazy, let me be the first to wish you and those you love a very MERRY CHRISTMAS! https://t.co/JtUlHNk0eZ|en|R|4|35
944649900641439746|55677432|Sat Dec 23 19:24:21 +0000 2017|Companies are already announcing new investments and increased wages for their workers: https://t.co/KPE4PyT9VI|en|R|3|10
944244690844639232|55677432|Fri Dec 22 16:34:12 +0000 2017|President @realDonaldTrump signed the #TaxCutsandJobsAct into law today. Proud to be a part of this effort, letting… https://t.co/SoZinkQGZg|en|R|4|20
943905198577156097|55677432|Thu Dec 21 18:05:10 +0000 2017|The #TaxCutsandJobsAct is great for our economy, great for working families and great for Louisiana:  https://t.co/eB2fSVzpWg|en|R|4|16
943648582032347136|55677432|Thu Dec 21 01:05:28 +0000 2017|We doubled the standard deduction, simplified filing your taxes, and set the stage for more economic growth like we… https://t.co/Xs1oubdKSD|en|R|10|49
943275332391657472|55677432|Wed Dec 20 00:22:19 +0000 2017|The House just voted to pass tax cuts. The Senate is about to do the same. This will cut taxes for working families… https://t.co/oKpaoxlhVq|en|R|9|35
943233777668644865|55677432|Tue Dec 19 21:37:11 +0000 2017|On with @FoxBusiness now to talk about getting tax reform done for working families.|en|R|3|11
942882704697249794|55677432|Mon Dec 18 22:22:09 +0000 2017|Just realizing I missed #ThrowbackThursday. So here's a good Christmastime one. #tbt https://t.co/6UsOjSn8KQ|en|R|5|25
941827590393806850|55677432|Sat Dec 16 00:29:30 +0000 2017|Congratulations to a great Tiger &amp; a great young man - JD Moore. #GeauxTigers https://t.co/bOZzoY6Ipp|en|R|2|2
941669423852802048|55677432|Fri Dec 15 14:01:00 +0000 2017|Joining @Varneyco on @FoxBusiness soon to talk about cutting taxes and growing the economy.|en|R|4|8
941036969659858944|55677432|Wed Dec 13 20:07:51 +0000 2017|Honored to join MAJ David Brewer and his family for a @WhiteHouse tour today. As a military fellow in my Senate off… https://t.co/fmEjm6zBac|en|R|3|5
940683611812106240|55677432|Tue Dec 12 20:43:44 +0000 2017|Wishing all those who begin their celebration tonight a very happy Hanukkah. https://t.co/8uq1uHcQWd|en|R|5|21
940604742509694977|55677432|Tue Dec 12 15:30:20 +0000 2017|Hmmm... @Saints @NFL https://t.co/eL5Be9FHi1|und|R|11|31
940339917707730944|55677432|Mon Dec 11 21:58:01 +0000 2017|Saddened to hear of Judge Jim Brady's passing. Our prayers are with his wife Karen and their children during this d… https://t.co/y2xZw0K4sG|en|R|2|4
940183578763300864|55677432|Mon Dec 11 11:36:47 +0000 2017|On now with @SquawkCNBC speaking about the importance of tax reform for working families.|en|R|2|5
938894094180454400|55677432|Thu Dec 07 22:12:50 +0000 2017|Seems like just yesterday... #tbt https://t.co/WMPQkvLwjN|en|R|2|31
938808105160335362|55677432|Thu Dec 07 16:31:09 +0000 2017|"Today we remember a ""date which will live in infamy..."" #PearlHarborDay https://t.co/MULfpdb4fg"|en|R|10|23
938518804354748417|55677432|Wed Dec 06 21:21:34 +0000 2017|Congratulations to @JohnSchroderLA, Louisiana's new State Treasurer. I know you will work hard to serve the people of our state well.|en|R|9|14
938233449118339074|55677432|Wed Dec 06 02:27:40 +0000 2017|Let's finish this! https://t.co/C4bEIepoPh|en|R|8|26
937804662840979456|55677432|Mon Dec 04 22:03:49 +0000 2017|Interesting column: Why the U.S.-Yemen policy must be forced out into the sunlight https://t.co/8CJESctbZ9|en|R|4|4
937028914584719360|55677432|Sat Dec 02 18:41:17 +0000 2017|Proud to have @SecretaryZinke here in Louisiana to learn more about the importance of our coastline to U.S. energy… https://t.co/H0B4wLEqa9|en|R|35|113
936698324102598661|55677432|Fri Dec 01 20:47:38 +0000 2017|Looking forward to events with Secretary Zinke tomorrow! https://t.co/U0J0GmMpBm|en|R|3|5
936369414475337730|55677432|Thu Nov 30 23:00:39 +0000 2017|About to go on with @FoxBusiness tune in now!|en|R|2|3
936319132676579329|55677432|Thu Nov 30 19:40:51 +0000 2017|#TBT - Playing tennis with the kids https://t.co/y3rOVqY8Up|en|R|5|22
936247480248872961|55677432|Thu Nov 30 14:56:08 +0000 2017|Great to meet students from Ursuline Academy, Brother Martin High School and South Lafourche High School participat… https://t.co/1Qr7Wp1pRL|en|R|7|16
936047826894811142|55677432|Thu Nov 30 01:42:47 +0000 2017|In Louisiana, 78% of people who pay the Obamacare tax make less than $50,000 a year in income. It's time to get rid… https://t.co/xDsHvHfLOE|en|R|33|71
935590727643484162|55677432|Tue Nov 28 19:26:26 +0000 2017|Just had lunch with President Trump and other Senate Republicans. We are united in our goal to pass tax cuts for wo… https://t.co/EIGjsGsiEs|en|R|16|59
935542380215795712|55677432|Tue Nov 28 16:14:19 +0000 2017|Coming up on @FoxBusiness with @Varneyco. Tune in!|en|R|1|3
935202864754028544|55677432|Mon Nov 27 17:45:12 +0000 2017|Saddened by the loss of Matthew Chialastri and two other U.S. sailors who lost their lives serving our country. Ple… https://t.co/WSJykUHPQ1|en|R|8|14
935185343573356547|55677432|Mon Nov 27 16:35:35 +0000 2017|We must do more to address this. @GOPHELP committee hearing on opioid crisis this week will focus on perspectives f… https://t.co/IUvtVSxvM4|en|R|7|9
935164679990759431|55677432|Mon Nov 27 15:13:28 +0000 2017|Glad Zachary Wilson is finally home. Congressman Johnson and I were privileged to be involved. https://t.co/uJsfISnonS|en|R|5|9
934427768380588032|55677432|Sat Nov 25 14:25:15 +0000 2017|Are you participating in #SmallBusinessSaturday? Help support Louisiana businesses!|en|R|3|9
934224093867425792|55677432|Sat Nov 25 00:55:55 +0000 2017|"""From the Berlin Wall, to Vietnamese and Cuban boat people, to the DMZ, the prisoners of communism run in only one… https://t.co/VGswjr1yDm"|en|R|19|35
933698024718692352|55677432|Thu Nov 23 14:05:31 +0000 2017|Happy Thanksgiving! https://t.co/9safpMyHnx|en|R|6|32
933113116052688897|55677432|Tue Nov 21 23:21:17 +0000 2017|The criminals responsible for brutally killing Border Agent Rogelio Martinez and wounding his partner must be found… https://t.co/d9Lm6f9KAr|en|R|6|10
932286989088514048|55677432|Sun Nov 19 16:38:33 +0000 2017|#WhoDat! https://t.co/iti9P5J5Os|und|R|1|4
932050466657185792|55677432|Sun Nov 19 00:58:42 +0000 2017|#GeauxTigers - Beat Tennessee! https://t.co/kVRBjov9yY|en|R|1|7
931933947398905857|55677432|Sat Nov 18 17:15:42 +0000 2017|I'm glad to see the Trump Administration cracking down on violent gangs. We must get these criminals off our street… https://t.co/NCuoudFTCI|en|R|6|16
931905624677535744|55677432|Sat Nov 18 15:23:09 +0000 2017|Happy National Adoption Day. Adoption is a blessing to millions of lives!|en|R|32|92
931301604636221440|55677432|Thu Nov 16 23:22:59 +0000 2017|Sexual harassment and assault is wrong. The Senate Ethics Committee should review the allegations of improper conduct by Senator Franken.|en|R|8|49
931262637484077056|55677432|Thu Nov 16 20:48:09 +0000 2017|#TBT - You should see the one that got away! https://t.co/Qn1ASpMoy5|en|R|2|12
930891049698029568|55677432|Wed Nov 15 20:11:36 +0000 2017|This amendment will deliver vital tax relief to tens of thousands of Louisiana families hurt by last year’s devasta… https://t.co/uTtLjOezDK|en|R|3|6
930844301831131139|55677432|Wed Nov 15 17:05:50 +0000 2017|November is Military Family Appreciation Month. Thank you to all our military families who have sacrificed so much! #MilitaryFamilyMonth|en|R|7|16
930783085305761792|55677432|Wed Nov 15 13:02:35 +0000 2017|About to discuss the latest on #TaxReform with @HughHewitt. Listen live at https://t.co/H8hnYte2cx|en|R|2|5
930540457653948419|55677432|Tue Nov 14 20:58:28 +0000 2017|Repealing the individual mandate as part of tax reform will provide working families in Louisiana with even more ta… https://t.co/ohzRhNiZIs|en|R|9|20
930533545520586752|55677432|Tue Nov 14 20:31:00 +0000 2017|Happy Birthday to @CondoleezzaRice, America's 66th Secretary of State under President George W. Bush! https://t.co/wvsBnfhg3Z|en|R|11|17
930233759030566913|55677432|Tue Nov 14 00:39:45 +0000 2017|"""Working Families Need This...""

Check out my interview on @FoxNews with @HARRISFAULKNER earlier today. https://t.co/39dVBbbiO8"|en|R|6|30
930183198415482880|55677432|Mon Nov 13 21:18:51 +0000 2017|Predatory lenders should not be able to take advantage of veterans. I'm meeting with Secretary Shulkin tomorrow and… https://t.co/VNJHm6oWXK|en|R|4|14
930142313757671429|55677432|Mon Nov 13 18:36:23 +0000 2017|About to join @HARRISFAULKNER on @FoxNews to discuss our bill to cut taxes for working families in Louisiana. Tune in!|en|R|5|32
929506170636767233|55677432|Sun Nov 12 00:28:35 +0000 2017|Based on the allegations against Roy Moore, his response and what is known, I withdraw support.|en|R|6473|32401
929350802090676224|55677432|Sat Nov 11 14:11:12 +0000 2017|God bless the men and women who have served our great nation. Thank you for your service! #VeteransDay https://t.co/FT7zOytJX0|en|R|22|59
929061281365098496|55677432|Fri Nov 10 19:00:45 +0000 2017|November is Alzheimer's Awareness Month. Please advocate for the research needed and help build awareness. #ENDALZ https://t.co/jJ9vRaEFwW|en|R|12|45
928995692940529665|55677432|Fri Nov 10 14:40:07 +0000 2017|#SemperFi. Happy birthday to the @USMC! https://t.co/CCnjgei8ka|en|R|10|16
928780254528892928|55677432|Fri Nov 10 00:24:03 +0000 2017|It's all about giving working families a tax cut. Check out my interview on @FoxBusiness. https://t.co/ecEK9fLuoH|en|R|5|11
928675229127278592|55677432|Thu Nov 09 17:26:43 +0000 2017|#OTD: The Berlin Wall came down. I'll never forget where I was! https://t.co/b5DlNi9lwa|en|R|3|10
928642370597543936|55677432|Thu Nov 09 15:16:09 +0000 2017|On @FoxBusiness with @Varneyco. Tune in to hear about our plan to cut taxes for working families in Louisiana. #TaxReform|en|R|4|6
928315041467830273|55677432|Wed Nov 08 17:35:27 +0000 2017|Had a good meeting with @senorrinhatch about how #TaxReform can help Louisiana families. We must cut taxes and brin… https://t.co/LvHsWnZdC0|en|R|7|18
927925350914494467|55677432|Tue Nov 07 15:46:58 +0000 2017|Local officials, FEMA and the Trump Administration have made good progress in #PuertoRico, but there is still more… https://t.co/Lc5P1u6KPJ|en|R|12|24
927540999999709185|55677432|Mon Nov 06 14:19:41 +0000 2017|Wishing a speedy recovery to my Senate colleague @RandPaul, who was assaulted at his home this weekend.|en|R|4|18
927281090867400705|55677432|Sun Nov 05 21:06:54 +0000 2017|Our prayers are with everyone affected by the tragic event in Sutherland Springs, Texas.|en|R|15|57
926859683771617280|55677432|Sat Nov 04 17:12:23 +0000 2017|"It's game day! #GeauxTigers #BeatBama
https://t.co/K2W6L8Xucg"|en|R|4|11
926146069943193601|55677432|Thu Nov 02 17:56:44 +0000 2017|Democrats get 4 Pinocchios on their claim Gop Tax Reform will raise taxes on the middle class. https://t.co/2plAyL2SOX|en|R|4|9
925899213770240001|55677432|Thu Nov 02 01:35:49 +0000 2017|Where to go to college is a life changing decision. Students should be as informed as possible. #CollegeTransparencyAct #KnowB4UEnroll|en|R|4|24
925771666650693632|55677432|Wed Nov 01 17:08:59 +0000 2017|Spoke on how we can lower health costs, through price transparency and giving patients the power over their healthc… https://t.co/hwiX7CaJl4|en|R|7|5
925486943705714689|55677432|Tue Oct 31 22:17:36 +0000 2017|As more information is released on this tragedy, all Americans stand with the survivors &amp; we keep the victims in our thoughts &amp; prayers #NYC|en|R|6|23
924728018601422848|55677432|Sun Oct 29 20:01:54 +0000 2017|With early detection and the right resources, we can ensure that all our students have what they need to succeed.… https://t.co/aLxgEsRLT6|en|R|9|29
923954940783022081|55677432|Fri Oct 27 16:49:58 +0000 2017|Pro-growth tax reform will expand investment, increase jobs and wages, and leave more money in taxpayers’ pockets. https://t.co/82zhWP7hzN|en|R|7|17
923589488399519744|55677432|Thu Oct 26 16:37:48 +0000 2017|We are one step closer to securing tax reform for the American people https://t.co/9cOAdCsXuA|en|R|7|15
923266273278156801|55677432|Wed Oct 25 19:13:27 +0000 2017|The legacy of Fats Domino is engrained in the history and culture of Louisiana. https://t.co/ocfSIeM1Ow|en|R|6|23
923172195542732800|55677432|Wed Oct 25 12:59:37 +0000 2017|Speaking at the Washington @postlive Health event with @ChrisMurphyCT #202Live watch it here: https://t.co/Y9F3nzH8VE|en|R|2|3
922849933258035200|55677432|Tue Oct 24 15:39:04 +0000 2017|(2/2)...Investing in US energy creates better jobs for working families &amp; strengthens our energy independence. This is a win for Louisiana.|en|R|3|10
922849753188175872|55677432|Tue Oct 24 15:38:21 +0000 2017|(1/2) @SecretaryZinke announced the largest proposed oil &amp; gas lease sale in US history. 76,967,935 acres in the Gulf of Mexico...|en|R|2|3
921134868842582017|55677432|Thu Oct 19 22:04:01 +0000 2017|Haynesville Shale has resurfaced as a key natural-gas hot spot. LNG is cleaner, cheaper and creates good paying jobs https://t.co/aOV4hnjI4X|en|R|3|6
921114734501515267|55677432|Thu Oct 19 20:44:00 +0000 2017|Without stabilization package, market will collapse and premium tax credits will spike, increasing the cost to the American taxpayer.|en|R|6|17
921113306844233729|55677432|Thu Oct 19 20:38:20 +0000 2017|We need a package which stabilizes the insurance market in the short-term and lays the groundwork for a long-term solution like GCHJ|en|R|11|24
920744427282452480|55677432|Wed Oct 18 20:12:32 +0000 2017|Introduced legislation to fast-track #LNG exports, create American jobs &amp; provide cheaper energy w/ lower emissions https://t.co/vFNLJgwv0R|en|R|14|14
920629741463523334|55677432|Wed Oct 18 12:36:49 +0000 2017|Speaking now with @axios on the future of healthcare reform. #Axios360 https://t.co/hopsue0vUG|en|R|9|21
919766279694831616|55677432|Mon Oct 16 03:25:44 +0000 2017|Monitoring the situation closely. Praying for those injured. https://t.co/TCctMBoO29|en|R|7|8
919550490127552513|55677432|Sun Oct 15 13:08:15 +0000 2017|In this hour, I will be joining @FoxNewsSunday live from Baton Rouge. Talking about the current state and future of health care reform.|en|R|9|17
919350791999229954|55677432|Sat Oct 14 23:54:44 +0000 2017|LSU Wins! #GeauxTigers https://t.co/M0TvitSqbn|lt|R|1|25
918907297908383744|55677432|Fri Oct 13 18:32:26 +0000 2017|Our heartfelt condolences to the family of Officer Marcus McNeil. We are all grateful for his service to Louisiana. https://t.co/aGVDC3yHPX|en|R|9|23
918608818636050432|55677432|Thu Oct 12 22:46:23 +0000 2017|Once again tonight, and every Thursday in October, the Governor's Mansion will be lit up red in recognition of… https://t.co/9Y4AzyA3gh|en|R|25|66
918184960191860736|55677432|Wed Oct 11 18:42:08 +0000 2017|Received such a nice welcome from @BGCA_Clubs students when I visited Buchanan Elementary School in Baton Rouge. https://t.co/4vZUqwrQRO|en|R|4|17
915975532428144640|55677432|Thu Oct 05 16:22:39 +0000 2017|Speaking at @theAMGA about how to address the issues facing our doctors and health care providers. https://t.co/f514myDKIs|en|R|4|10
915225003959910400|55677432|Tue Oct 03 14:40:19 +0000 2017|Congratulation to @LIGO on earning the #NobelPrize2017! https://t.co/X0UJiALGNZ|en|R|3|23
914924006976999425|55677432|Mon Oct 02 18:44:16 +0000 2017|Please pray for Cpl. Middlebrook's family and law enforcement officers who risk their lives every day https://t.co/lZkGHp3Ph6|en|R|13|34
914820586584576000|55677432|Mon Oct 02 11:53:19 +0000 2017|Following closely the horrendous act of violence in Las Vegas. Our prayers are with those who were injured, killed and their families.|en|R|10|47
914673610303922176|55677432|Mon Oct 02 02:09:17 +0000 2017|Why Curtis Hill stands for the national anthem: https://t.co/Hc62Hwl7d5|en|R|3|16
913865794248994816|55677432|Fri Sep 29 20:39:18 +0000 2017|Today, my wife &amp; I celebrate our 28th wedding anniversary. She's my best friend &amp; most trusted advisor. I am blesse… https://t.co/wbCrPuiagI|en|R|10|97
913793551212924928|55677432|Fri Sep 29 15:52:14 +0000 2017|Geaux @SteveScalise ! https://t.co/5zA06CkqcD|fr|R|9|29
913479611706695681|55677432|Thu Sep 28 19:04:45 +0000 2017|All feel uplifted knowing @SteveScalise is back at work. His dedication to this country and Louisiana is unquestionable.|en|R|22|87
912669449496522752|55677432|Tue Sep 26 13:25:27 +0000 2017|Speaking now at #POLITICOHealth panel. Watch at: https://t.co/rgVD4NM55x https://t.co/JXGmbjHYUq|en|R|7|8
912499473997352961|55677432|Tue Sep 26 02:10:02 +0000 2017|The past year I met with Democrats on Obamacare to work on a solution. None wanted to engage in the effort. #healthcaredebate|en|R|128|237
912496579705278465|55677432|Tue Sep 26 01:58:32 +0000 2017|We need to bring health care closer to the patient. #healthcaredebate|en|R|35|89
912495774608568321|55677432|Tue Sep 26 01:55:20 +0000 2017|Bernie's single payer would do away with employer sponsored health insurance. #healthcaredebate #keepyourplan?|en|R|33|93
912488478398730240|55677432|Tue Sep 26 01:26:21 +0000 2017|#GrahamCassidy ensures protections for those with pre-existing conditions. #healthcaredebate on page 11 states must… https://t.co/dxefaAfyxK|en|R|24|29
912483902870183937|55677432|Tue Sep 26 01:08:10 +0000 2017|This debate is about whether you or a bureaucrat should have the decision making power over your family's health care. #HealthCareDebate|en|R|56|105
912482786895900672|55677432|Tue Sep 26 01:03:44 +0000 2017|Just got started on @CNN to debate the right path forward to address the failures of Obamacare. #healthcaredebate|en|R|8|22
911691451200868352|55677432|Sat Sep 23 20:39:15 +0000 2017|When you give a patient the power, the system lines up to serve her. #GrahamCassidy-Heller-Johnson puts patients an… https://t.co/1pG9jyyZfS|en|R|36|55
911599802206605317|55677432|Sat Sep 23 14:35:04 +0000 2017|I have been asked if #GrahamCassidy-Heller-Johnson protects those with pre-existing conditions. It does: https://t.co/LoLSqThtVs|en|R|95|158
911007029560520705|55677432|Thu Sep 21 23:19:36 +0000 2017|Joining @marthamaccallum on @FoxNews shortly.|en|R|5|30
910989621865189377|55677432|Thu Sep 21 22:10:25 +0000 2017|#GrahamCassidy-Heller-Johnson gives states the resources &amp; flexibility to address their unique healthcare challenge… https://t.co/EaBJS6OY60|en|R|45|116
910957022304198656|55677432|Thu Sep 21 20:00:53 +0000 2017|Doing nothing is not an option. Families who can't afford their $40,000 premiums need help. https://t.co/QloPdHT2ao|en|R|126|187
910831855280230400|55677432|Thu Sep 21 11:43:31 +0000 2017|Joining @foxandfriends shortly on @FoxNews tune in.|en|R|7|43
