id|user|created_at|text|lang|label|retweet_count|favorite_count
1507362422411178014|779104195|Fri Mar 25 14:23:01 +0000 2022|Today we remember the victims of slavery and the transatlantic slave trade history. It was a troubling time in hist… https://t.co/VXWS8Yka1z|en|R|20|122
1507071007110086659|779104195|Thu Mar 24 19:05:02 +0000 2022|From Day 1, @JoeBiden has been at war with our energy industry. This was one of his very first actions as President: https://t.co/y5LX2zgl9G|en|R|341|824
1507054139980791818|779104195|Thu Mar 24 17:58:01 +0000 2022|Finally something Congress can agree on. Daylight Savings Time is unnecessary, outdated, and unpopular.  Let's get… https://t.co/y5I76wJg3X|en|R|11|63
1507046088364249093|779104195|Thu Mar 24 17:26:01 +0000 2022|Education is the foundation of our society. I've fought to bolster our education system and put parents back in cha… https://t.co/mVHEDUuLSZ|en|R|14|101
1506775519274041346|779104195|Wed Mar 23 23:30:52 +0000 2022|"They've now replaced the blatant racism of the 60's with 'woke' liberal racism.

https://t.co/0mp7HNQ5A6"|en|R|41|152
1506715235763191808|779104195|Wed Mar 23 19:31:20 +0000 2022|No one understands what's best for a child quite like a parent does.|en|R|91|852
1506674395359723526|779104195|Wed Mar 23 16:49:03 +0000 2022|Today we honor Amelia Earhart! She was the first female aviator to fly solo across the Atlantic Ocean. Amelia made… https://t.co/QXX6gHnrl8|en|R|16|91
1506374006454247428|779104195|Tue Mar 22 20:55:24 +0000 2022|.@JoeBiden said this could be the most important midterm election of our time. @ByronDonalds and I tend to agree, a… https://t.co/Cryq4Abk6f|en|R|75|386
1506309737377320964|779104195|Tue Mar 22 16:40:01 +0000 2022|"Utahns want energy independence, and I will fight for it. 
https://t.co/AZUfFTlJMP"|en|R|25|193
1506122562559897604|779104195|Tue Mar 22 04:16:15 +0000 2022|As Ranking Member of Education &amp; Labor Sub-committee Pre K-12, it's a pleasure to visit schools like Hileah and see… https://t.co/TqJYxhzLM3|en|R|14|103
1505989123617742852|779104195|Mon Mar 21 19:26:01 +0000 2022|These were the gas prices in UT this weekend. What are you currently paying at the pump? https://t.co/1yi95HdbL1|en|R|22|135
1505962306232102923|779104195|Mon Mar 21 17:39:27 +0000 2022|This past weekend I was honored to take part in a meet and greet with some of our state delegates here in CD4. I pl… https://t.co/kM5gf7JJ58|en|R|10|72
1505939799802368004|779104195|Mon Mar 21 16:10:01 +0000 2022|"Joe Biden did this. ⬇️
https://t.co/6hqWVkLBGt"|en|R|45|172
1505917842075488261|779104195|Mon Mar 21 14:42:46 +0000 2022|This is the reason why November 2022 is so important, and we need a Republican majority. https://t.co/ifzunK39n1|en|R|24|126
1505633675752312832|779104195|Sun Mar 20 19:53:36 +0000 2022|Alice Coachman didn't have access to equipment so she'd run shoeless down dirt roads. Alice eventually received a s… https://t.co/2Ll7nOXdJk|en|R|113|786
1505286238194085889|779104195|Sat Mar 19 20:53:00 +0000 2022|"It's great to see our communities coming together. Go Jazz! 
https://t.co/Y76ULtCRuy"|en|R|9|55
1505009454999228421|779104195|Sat Mar 19 02:33:10 +0000 2022|Sad to hear my friend and colleague Rep Don Young passed away tonight. As the House Dean, he was both loved and res… https://t.co/X32pZKl16X|en|R|72|750
1504998311542984704|779104195|Sat Mar 19 01:48:53 +0000 2022|"We are literally seeing opportunities in this country being stolen from women athletes
No, sports is NOT an affirma… https://t.co/T8g2uvcPta"|en|R|158|577
1504844833273298974|779104195|Fri Mar 18 15:39:01 +0000 2022|"It is crucial we prioritize fairness over feelings and protect common sense values in this country!
https://t.co/boJOFcwr8k"|en|R|18|146
1504827530447974402|779104195|Fri Mar 18 14:30:16 +0000 2022|A biological man turns women sports upside down while the Feminist Left turn their backs on women everywhere. If Li… https://t.co/8he31M7qn9|en|R|39|234
1504539997818572806|779104195|Thu Mar 17 19:27:43 +0000 2022|I proudly stand with our law enforcement as they serve and protect our communities. Take a look at my record in Con… https://t.co/p9FenhEfPy|en|R|19|122
1504159333692674059|779104195|Wed Mar 16 18:15:05 +0000 2022|Jane Cooke Wright was a pioneering cancer researcher and surgeon. She was the highest ranking African American woma… https://t.co/N71HYeOW1T|en|R|12|94
1503842164177965057|779104195|Tue Mar 15 21:14:46 +0000 2022|Great job, DeSantis and the parents of Florida! Every state should follow your lead in 'curriculum transparency'. W… https://t.co/4X8AHRVZJs|en|R|54|229
1503832826071982083|779104195|Tue Mar 15 20:37:40 +0000 2022|What @JoeBiden has done to our border is appalling. Apprehensions are up 60% over the previous year! https://t.co/5Ouq1cXmyx|en|R|48|177
1503772012287873029|779104195|Tue Mar 15 16:36:01 +0000 2022|The WH continues to blame Russia for our high gas prices instead of taking responsibility for their poor policies.… https://t.co/WWnNakvhbD|en|R|52|265
1503565045782904833|779104195|Tue Mar 15 02:53:36 +0000 2022|Always remember this about the Hard Left: Without shame, they will ALWAYS use misery as a political strategy. More… https://t.co/EnyySWqpE9|en|R|116|424
1503459703799570437|779104195|Mon Mar 14 19:55:00 +0000 2022|"The American Dream is alive and we will fight to protect it! Great to see such strides being made for our country.
 https://t.co/cpEoKuENrL"|en|R|117|651
1503160727418322946|779104195|Mon Mar 14 00:06:59 +0000 2022|Sounds like even Hard Left Beto is running away from the cancerous anti-American CRT curriculum. Great Job, Moms an… https://t.co/G1K5ZXTHQJ|en|R|64|338
1503103862596583428|779104195|Sun Mar 13 20:21:01 +0000 2022|Mary Fields(1832-1914)after establishing Native American schools in the early 1880's went on the become the first f… https://t.co/SRVTp1sGaa|en|R|155|787
1502825220029227008|779104195|Sun Mar 13 01:53:48 +0000 2022|Even a (liberal) broken clock is right twice a day... https://t.co/u5on3R9NHj via @BreitbartNews|en|R|33|171
1502708252911579137|779104195|Sat Mar 12 18:09:01 +0000 2022|"Love to see this show of support from athletes at my alma mater!

https://t.co/aTluCmXjnR"|en|R|3|44
1502664929274433537|779104195|Sat Mar 12 15:16:51 +0000 2022|It was an honor to meet Justice Clarence Thomas last night and listen to him discuss topics ranging from his upbrin… https://t.co/uUOiXP9NhA|en|R|148|1357
1502373160636846087|779104195|Fri Mar 11 19:57:28 +0000 2022|.@JoeBiden with the stroke of a pen shut down our energy independence and now Utahns are paying record high gas pri… https://t.co/l8ptxzKQmQ|en|R|60|250
1502361718068060164|779104195|Fri Mar 11 19:12:00 +0000 2022|A nonprofit in UT was just chosen to analyze the remains of possible victims of the Tulsa Race Massacre. I hope thi… https://t.co/hIQLUYC58s|en|R|15|71
1502320482179244034|779104195|Fri Mar 11 16:28:09 +0000 2022|.@JoeBiden &amp; @KamalaHarris are supposed to be the leaders of the free world, instead their weak &amp; feckless response… https://t.co/fg4PfadnUt|en|R|44|215
1501998493828796424|779104195|Thu Mar 10 19:08:41 +0000 2022|Excited to see @shawncollins4ca take this big step and run for governor of California. https://t.co/FJ2orT6ZVx|en|R|20|78
1501996410388062213|779104195|Thu Mar 10 19:00:24 +0000 2022|Sandra Day O'Connor is one of the brightest legal minds our country has seen. In 1981, President Ronald Regan nomin… https://t.co/pWlG567LNz|en|R|9|88
1501944577523011595|779104195|Thu Mar 10 15:34:26 +0000 2022|It's time we prioritize fairness over feelings. This week in DC, I co-sponsored the Protection of Women and Girls S… https://t.co/Q1gOXxB5oP|en|R|52|355
1501765911031676934|779104195|Thu Mar 10 03:44:29 +0000 2022|"Being tough on one evil dictator by doing business with another...
Sounds about right for this administration.… https://t.co/a9L40VoDSB"|en|R|55|275
1501727289347874816|779104195|Thu Mar 10 01:11:01 +0000 2022|Marie Antoinette said “let them eat cake” in response to starving subjects. @JoeBiden and his Administration have s… https://t.co/urKjMHiyxa|en|R|100|488
1501619336930283524|779104195|Wed Mar 09 18:02:03 +0000 2022|Utahns stand with the people of Ukraine. We must do more to deter Vladimir Putin from committing any more war crime… https://t.co/4kGr437SIP|en|R|17|121
1501382077446430723|779104195|Wed Mar 09 02:19:16 +0000 2022|'We tried to warn you...' https://t.co/CK32VDaMRE|en|R|152|486
1501335961128611845|779104195|Tue Mar 08 23:16:01 +0000 2022|"Average gas prices in Utah under President Donald Trump: $2.73

Average gas prices in Utah under @JoeBiden: $4.01… https://t.co/vvJncSlH2O"|en|R|72|337
1501321895689351169|779104195|Tue Mar 08 22:20:07 +0000 2022|"Simple solution: Believe in America, Build in America and use/sell Energy from America. 
If only common sense were… https://t.co/BQ2vusSXWH"|en|R|93|365
1501320676803846146|779104195|Tue Mar 08 22:15:17 +0000 2022|"""[T]he real state of our union is this: Skyrocketing inflation, rising crime, a humanitarian crisis and security th… https://t.co/oXMGM43BJw"|en|R|48|192
1501268415662768137|779104195|Tue Mar 08 18:47:37 +0000 2022|Don’t forget - caucuses are tonight! It’s time for us to come off the sidelines and get involved, and tonight is ou… https://t.co/XyAonZcUX9|en|R|15|73
1500958848240128004|779104195|Mon Mar 07 22:17:30 +0000 2022|Protecting girls and women should never be a debate. I'm in DC fighting to ensure it's not. https://t.co/bFiPVasgJb|en|R|279|1880
1500894425362272259|779104195|Mon Mar 07 18:01:30 +0000 2022|"DUH... no kidding. Wait till these ""transfer of wealth"" Lefties get to my family: Black, White, Hispanic, American… https://t.co/7hdskaFC8Y"|en|R|30|146
1500655922833616896|779104195|Mon Mar 07 02:13:47 +0000 2022|Mary Jackson was a mathematician and aerospace engineer who became NASA's first black female engineer. Not only was… https://t.co/44d3IR63VR|en|R|106|827
1500626771800039425|779104195|Mon Mar 07 00:17:57 +0000 2022|Happy Sunday everyone... SO Proud to be an AMERICAN 😃🇺🇸 https://t.co/jPPawgzPG7|en|R|78|620
1500537954917302272|779104195|Sun Mar 06 18:25:01 +0000 2022|https://t.co/q60MKY5gL5|und|R|32|208
1499912749584945162|779104195|Sat Mar 05 01:00:41 +0000 2022|Big news! Today I filed for reelection in Utah's 4th District. Excited to continue all the great work we've been do… https://t.co/PS9h7WMfE9|en|R|147|1585
1499815692668964865|779104195|Fri Mar 04 18:35:01 +0000 2022|"Take a few minutes to read my latest op-ed: Cotton Gin, Slavery and America’s Corporatists. 

In the United States… https://t.co/nV8wQh9LyO"|en|R|27|104
1499444750562336773|779104195|Thu Mar 03 18:01:01 +0000 2022|"Congrats to @Utah_Football on a fantastic season! 
https://t.co/92skXzv7cR"|en|R|6|24
1499160628451282946|779104195|Wed Mar 02 23:12:01 +0000 2022|It's Women's History Month - and without Rosa Parks and her defiance of racist Jim Crow-era laws, our country would… https://t.co/Hwt9XpIowF|en|R|25|196
1499104704294383616|779104195|Wed Mar 02 19:29:48 +0000 2022|As President Biden prepared for SOTU by building fences on Capitol Hill to protect himself from the American people… https://t.co/CQGCOEYKHW|en|R|43|206
1499035554251423751|779104195|Wed Mar 02 14:55:01 +0000 2022|What did you think of Joe Biden's speech last night? Let me know here: https://t.co/tdhKNkTnM1|en|R|9|67
1498866826066935817|779104195|Wed Mar 02 03:44:33 +0000 2022|Tonight was an opportunity for Democrat politicians to clap at Joe Biden's fake accomplishments. What it should hav… https://t.co/tTyo7raH81|en|R|100|743
1498860891411922944|779104195|Wed Mar 02 03:20:58 +0000 2022|World is on fire. Democracy is hanging in the balance. He’s talking about build back broke and greener energy.|en|R|216|1325
1498856345906253826|779104195|Wed Mar 02 03:02:54 +0000 2022|Americans can't afford to fill their gas tank with record high inflation, but now we're forced to watch Democrat po… https://t.co/yLhdGYtBfL|en|R|132|929
1498852909068341251|779104195|Wed Mar 02 02:49:15 +0000 2022|"""My plan will not only lower costs, it will lower the deficit.” 

Anxiously waiting for the 'fact checkers' on that one..."|en|R|77|488
1498852401310175234|779104195|Wed Mar 02 02:47:14 +0000 2022|45 minutes in, no mention of the border...|en|R|131|1038
1498808071262404608|779104195|Tue Mar 01 23:51:05 +0000 2022|"State of the Union under a Democrat President means the ""fact checkers"" will take the night off."|en|R|1662|15101
1498789686633852930|779104195|Tue Mar 01 22:38:02 +0000 2022|Because the Black employer, who took the risk and built THEIR business, has the right to hire employees based on th… https://t.co/Ctiu2vbbNF|en|R|94|347
1498750457556213765|779104195|Tue Mar 01 20:02:09 +0000 2022|Maybe we should hold the State of the Union at the border. Then, Pres. Biden and VP Harris would have to see the damage they've caused.|en|R|253|1477
1498694053801648134|779104195|Tue Mar 01 16:18:01 +0000 2022|"Praying for all those affected by the current situation in Ukraine.  
https://t.co/wBUbr0kNXk"|en|R|7|74
1498481972410265601|779104195|Tue Mar 01 02:15:17 +0000 2022|Follow the... polling? https://t.co/1jqKQtj77y|en|R|99|308
1498443901824286725|779104195|Mon Feb 28 23:44:00 +0000 2022|"Join me in thanking these brave service members who are headed off to assist our allies. 
https://t.co/ta56ZXbFwW"|en|R|25|233
1498396099329110019|779104195|Mon Feb 28 20:34:03 +0000 2022|February is a short month, and Team Burgess is still behind on our monthly fundraising goal. Chip in today to help… https://t.co/W23B2PPP4Q|en|R|16|64
1496982639265390594|779104195|Thu Feb 24 22:57:28 +0000 2022|"My friends, 

It’s plain and simple: At the hands of Vladimir Putin, Russia is breaking international law and invad… https://t.co/lE0zDzuFTf"|en|R|34|242
1496875746907754498|779104195|Thu Feb 24 15:52:43 +0000 2022|"Cotton Gin, Slavery and America's Corporatist Greed

My op-ed in @townhallcom
https://t.co/tVLPRToUPH"|en|R|15|73
1496562761773592577|779104195|Wed Feb 23 19:09:01 +0000 2022|"No child should ever hear their skin color makes them ""privileged"" or ""un-privileged""."|en|R|1415|12371
1496509089652043776|779104195|Wed Feb 23 15:35:45 +0000 2022|A child's ability to get a quality education should not be determined by their Zip code.|en|R|110|1214
1496319998683643910|779104195|Wed Feb 23 03:04:22 +0000 2022|No child should ever be taught that they're born racist.|en|R|6821|55629
1496242146277564425|779104195|Tue Feb 22 21:55:01 +0000 2022|"Please keep this family and all our first responders in your prayers. 
https://t.co/g78KGlGnoE"|en|R|31|179
1496228064904478720|779104195|Tue Feb 22 20:59:03 +0000 2022|"Black babies lives matter too.

https://t.co/KOrd6zfHBR"|en|R|83|368
1496156603434913805|779104195|Tue Feb 22 16:15:06 +0000 2022|Do you plan to support Burgess this year? Now you can officially endorse his campaign to bring Utah values to Washi… https://t.co/J0uBIAUDv8|en|R|11|116
1495870674832867334|779104195|Mon Feb 21 21:18:55 +0000 2022|Happy Presidents' Day! https://t.co/rddtZg5u3R|en|R|15|188
1495498913603796993|779104195|Sun Feb 20 20:41:40 +0000 2022|Despite a childhood filled with tragedy and the barriers of segregation, J Mayo Williams was one of the first black… https://t.co/2rUtvJjz6e|en|R|50|329
1495434325713694720|779104195|Sun Feb 20 16:25:01 +0000 2022|https://t.co/ENxxKIuVtX|und|R|30|228
1495135970986901506|779104195|Sat Feb 19 20:39:28 +0000 2022|Elijah Abel, one of the early leaders of the Church of Jesus Christ of Latter-day Saints. A black missionary, Elija… https://t.co/TXwUVwdDyz|en|R|27|228
1495122272318853127|779104195|Sat Feb 19 19:45:02 +0000 2022|"Who else thinks Salt Lake City should host the next RNC? 
https://t.co/FcmXBqCSan"|en|R|11|117
1495094266468597760|779104195|Sat Feb 19 17:53:45 +0000 2022|Thank you moms and dads across our nation for standing up to this evil ideology. For too long through cowardly stea… https://t.co/xrmZIC9461|en|R|160|1346
1494790838391431171|779104195|Fri Feb 18 21:48:02 +0000 2022|The last two years have proven there has never been a better time in the history of our nation for School Choice sc… https://t.co/z16cwIoaLY|en|R|41|171
1494737238856552453|779104195|Fri Feb 18 18:15:03 +0000 2022|"2022 is our year to take back the House. In the words of Al Davis - Just Win, Baby!

Join me in the fight for a GOP… https://t.co/2McxYdg2ED"|en|R|13|136
1494437856185499662|779104195|Thu Feb 17 22:25:24 +0000 2022|Texas professor blasts faculty as they pass resolution promoting critical race theory https://t.co/Y9asrdfSWM #FoxNews|en|R|34|139
1494368050807812100|779104195|Thu Feb 17 17:48:01 +0000 2022|James Beckwourth grew up as a slave and went on to become one of the greatest frontiersmen of his time. A fur trapp… https://t.co/OE0F2iYCDT|en|R|27|129
1494364254346129410|779104195|Thu Feb 17 17:32:56 +0000 2022|Nothing to see here. Just the Washington Post staying on brand with racist stereotypes. https://t.co/QYNyKbTLfd|en|R|308|1395
1494347248657858560|779104195|Thu Feb 17 16:25:22 +0000 2022|Today we lost a hero. Gail Halvorsen 'The Candy Bomber' gave hope to numerous children through his own acts of self… https://t.co/JN3IHc9G0t|en|R|55|348
1494151199804702725|779104195|Thu Feb 17 03:26:20 +0000 2022|"The American people are awake. There's more legislation to come the State and Federal level to stop and/or defund ""… https://t.co/hZd5P9xNmI"|en|R|39|211
1494098267604406274|779104195|Wed Feb 16 23:56:00 +0000 2022|Fentanyl is being smuggled across our border like never before. This is the public health crisis we should be focus… https://t.co/Rtyt5ubMO8|en|R|134|366
1494054024055705601|779104195|Wed Feb 16 21:00:12 +0000 2022|The most demeaning and racist policy yet from Biden and the Progressive Left: in the name of 'EQUITY', free crack p… https://t.co/ZeczG6OqQy|en|R|61|212
1493687561834967041|779104195|Tue Feb 15 20:44:00 +0000 2022|"Great op-ed by my friend @StewartforUtah. Republicans in UT are leading the way! 
https://t.co/htpy4Ng8QI"|en|R|15|61
1493645846075768833|779104195|Tue Feb 15 17:58:14 +0000 2022|"It's my honor to be called a ""Cane"". It was a life changing decision that led to a life full of opportunities..🙌🏾 https://t.co/g2PyWdHcmp"|en|R|20|182
1493356884501442560|779104195|Mon Feb 14 22:50:01 +0000 2022|"It's great seeing the Olympic cauldron lit up in Salt Lake City again. 
https://t.co/4XYmFmFJgB"|en|R|6|56
1493307117209591808|779104195|Mon Feb 14 19:32:15 +0000 2022|Happy Valentine's Day from Team Burgess! https://t.co/SdEM5n54Ob|en|R|13|139
1493265765549498371|779104195|Mon Feb 14 16:47:56 +0000 2022|This is heartbreaking. Please keep this family in your prayers. Bullying in schools is at an all time high; the dev… https://t.co/NNC36R9i48|en|R|58|300
1493011272660500481|779104195|Sun Feb 13 23:56:40 +0000 2022|Proud of our own Erin Jackson for bringing home the gold! https://t.co/ugMx82o5jN|en|R|13|187
1492614150110920710|779104195|Sat Feb 12 21:38:39 +0000 2022|"Great spending time with NFL players, Hunters and Veterans.
 @don_peay @Haloti_Ngata92 Stephen Sloan, Rondo Fehlber… https://t.co/W3MCDUbPv8"|en|R|15|89
1492566428981018625|779104195|Sat Feb 12 18:29:01 +0000 2022|Happy birthday to the Great Emancipator. https://t.co/HW2Y77gvAn|en|R|90|662
1492283854475825152|779104195|Fri Feb 11 23:46:10 +0000 2022|Jessie Vargas is a fighter who isn't afraid to fight to stop the Biden liberal policies that are hurting Nevada.  H… https://t.co/byF74O5yag|en|R|21|82
1491828165441949701|779104195|Thu Feb 10 17:35:26 +0000 2022|For Black History Month, I wanted to share the story of my great-great grandfather Silas Burgess. He was brought to… https://t.co/QqM4vIdvEh|en|R|346|1718
1491572773541474307|779104195|Thu Feb 10 00:40:35 +0000 2022|Critical race theory doesn't combat racism, it spreads it.|en|R|3225|17967
1491485808909590528|779104195|Wed Feb 09 18:55:01 +0000 2022|"Utah is a great place to call home! 
https://t.co/fm0qwf8CBL"|en|R|4|58
1491198714912075776|779104195|Tue Feb 08 23:54:13 +0000 2022|The racist, condescending view of non-Whites by the Biden Administration. Imagine thinking taxpayer-funded crack pi… https://t.co/Ow8scEDDcK|en|R|181|558
1491051949764005893|779104195|Tue Feb 08 14:11:01 +0000 2022|Happy National Boy Scout Day to our next generation of young leaders. https://t.co/sDOaGKHrb3|en|R|12|84
1490842316717928448|779104195|Tue Feb 08 00:18:01 +0000 2022|Next time you're at the grocery store, you can thank Joe Biden. https://t.co/phaj0ql95f|en|R|78|344
1490776496679501824|779104195|Mon Feb 07 19:56:28 +0000 2022|I am proud to endorse Monica De La Cruz. Monica is a champion for securing our southern border and will be a tremen… https://t.co/2zrLLoDV0c|en|R|32|118
1490730699673911297|779104195|Mon Feb 07 16:54:29 +0000 2022|As a former Army Apache helicopter pilot, @WesleyHuntTX is no stranger to combat. I have full confidence that he wi… https://t.co/aSPXRfZQ5v|en|R|35|164
1490730043525402632|779104195|Mon Feb 07 16:51:53 +0000 2022|Sorry, BLM agitators...America is sick and tired of your destructive solutions to every problem. How about using th… https://t.co/JQHin6oqCu|en|R|86|431
1490003788261998595|779104195|Sat Feb 05 16:46:00 +0000 2022|"Help us out this primary election season! Sign up here to join Team Burgess:

https://t.co/ksWXqnr4hb"|en|R|22|91
1489802258673930241|779104195|Sat Feb 05 03:25:12 +0000 2022|What kind of person excuses genocide by equating voter integrity to child labor and concentration camps? This is th… https://t.co/C3TgnlvnBn|en|R|533|2431
1489333806825934848|779104195|Thu Feb 03 20:23:44 +0000 2022|BLM could care less about the victims of their dark ideology. https://t.co/J5AX7hgEHK|en|R|51|294
1489292854434447360|779104195|Thu Feb 03 17:41:00 +0000 2022|"Great to see so many gathered to protect Life right here in Salt Lake!
 
https://t.co/MaS4iyRCZb"|en|R|18|143
1489282648480620547|779104195|Thu Feb 03 17:00:27 +0000 2022|Today marks the 70th annual National Prayer Breakfast. I am proud to gather with my fellow Americans on this day of… https://t.co/9hfXPJMqcR|en|R|40|230
1488950170482098178|779104195|Wed Feb 02 18:59:18 +0000 2022|https://t.co/HCesky4Ts5 https://t.co/w6ZbZ6axLZ|und|R|18|119
1488883663223894028|779104195|Wed Feb 02 14:35:02 +0000 2022|Sports play an important role in many young girls' lives. They teach us leadership and how to work as a team, and b… https://t.co/90i851csRx|en|R|16|121
1488653391702151169|779104195|Tue Feb 01 23:20:01 +0000 2022|"Send some love to a veteran this Valentine's Day!
 
https://t.co/iR3fGOQT6y"|en|R|14|46
1488625720985362438|779104195|Tue Feb 01 21:30:03 +0000 2022|Today we kick off Black History Month! This month we celebrate the contributions made and honor the legacies left b… https://t.co/xHK2Gq1dA5|en|R|13|105
1488588055011287042|779104195|Tue Feb 01 19:00:23 +0000 2022|Today marks the anniversary of Abraham Lincoln signing the House and Senate resolution that later became the 13th A… https://t.co/9jIclHQwE2|en|R|116|532
1488350896543219715|779104195|Tue Feb 01 03:18:00 +0000 2022|"The Biden administration has abandoned any semblance of law and order at the border.  
https://t.co/57OVZxUvoX"|en|R|85|306
1488226128187703299|779104195|Mon Jan 31 19:02:13 +0000 2022|"They don't want their police ""defunded""... just ours.
https://t.co/fCzYgNwpNK"|en|R|215|671
1487594877206499331|779104195|Sun Jan 30 01:13:51 +0000 2022|"The courts have spoken. 
This was the only state I voted against certification. PA leads our nation in convicted po… https://t.co/waB5FzrHgc"|en|R|81|448
1487468941358235651|779104195|Sat Jan 29 16:53:26 +0000 2022|God bless our law enforcement officers.|en|R|94|1023
1487119920420712448|779104195|Fri Jan 28 17:46:33 +0000 2022|Jessie Vargas is a fighter who isn't afraid to fight to stop the Biden liberal policies that are hurting Nevada.  H… https://t.co/E3hgW7Fq5Q|en|R|22|139
1487103182274715650|779104195|Fri Jan 28 16:40:02 +0000 2022|It's School Choice Week! Too many of our kids are trapped in failing districts that can't provide them with a good… https://t.co/We0SmOEq6H|en|R|25|150
1486904260566552576|779104195|Fri Jan 28 03:29:35 +0000 2022|"Biden Administration is ""Betraying the American People"". https://t.co/bPzADHwavS #FoxNews"|en|R|110|405
1486748350087057410|779104195|Thu Jan 27 17:10:03 +0000 2022|Today, we remember the many Utahns and others across the West who lived downwind of nuclear testing sites and still… https://t.co/YQQp9uhSHL|en|R|14|107
1485331004684439561|779104195|Sun Jan 23 19:18:02 +0000 2022|https://t.co/T8AN1vB2tZ|und|R|65|501
1484626672724819970|779104195|Fri Jan 21 20:39:16 +0000 2022|"""Equality begins in the womb""
#MarchForLife"|en|R|115|813
1484550357917310978|779104195|Fri Jan 21 15:36:01 +0000 2022|I will always stand up to the evil that is human trafficking. Together we can end this practice once and for all.… https://t.co/8PlcqOe9GO|en|R|90|485
1484372169807187969|779104195|Fri Jan 21 03:47:58 +0000 2022|The only place Democrats don't want you to show ID is the voting booth...|en|R|4063|21371
1484218940054069248|779104195|Thu Jan 20 17:39:05 +0000 2022|"Is this what he means by ""build back better""? https://t.co/X1V7ychCqH"|en|R|241|727
1484191497847291904|779104195|Thu Jan 20 15:50:02 +0000 2022|It's been a full 365 days since Joe Biden took office. So I'm asking, are you better off now than you were a year a… https://t.co/2dckDh7jUo|en|R|44|208
1483954690010275843|779104195|Thu Jan 20 00:09:03 +0000 2022|"Joe Biden and the Democrats continue with their ""Jim Crow 2.0"" narrative. It's demeaning and insulting to those of… https://t.co/jwucffTT2p"|en|R|165|745
