id|user|created_at|text|lang|label|retweet_count|favorite_count
1351076021714509824|779104195|Mon Jan 18 07:56:40 +0000 2021|Humm..have you considered doing homework before commenting on Pa?Lived there for 23 years. Leads nation with number… https://t.co/i1hmNHfhou|en|R|195|917
1350891143362449410|779104195|Sun Jan 17 19:42:01 +0000 2021|Happy World Religion Day. Despite their differences, religions across the globe often share many similarities, incl… https://t.co/l8PiRzsvvF|en|R|51|411
1350557638874939392|779104195|Sat Jan 16 21:36:47 +0000 2021|You'll never agree with anyone on everything.|en|R|359|3694
1350484723659927552|779104195|Sat Jan 16 16:47:03 +0000 2021|Religious freedom is one of the many things that makes our country greatest. Happy National Religious Freedom Day. https://t.co/bDahJadCSs|en|R|141|871
1350225866526138368|779104195|Fri Jan 15 23:38:27 +0000 2021|"Remember when people used to ""agree to disagree""?"|en|R|1106|10734
1350223224462733313|779104195|Fri Jan 15 23:27:57 +0000 2021|Happy birthday @benshapiro|en|R|52|1154
1349923741736656896|779104195|Fri Jan 15 03:37:55 +0000 2021|"""Love is the only force capable of transforming an enemy into a friend.""

Martin Luther King Jr."|en|R|576|4011
1348697447267229705|779104195|Mon Jan 11 18:25:03 +0000 2021|Human trafficking is all too present in our state and nation. I'm on a mission to stop it. If you or someone you kn… https://t.co/D1S5cGFduu|en|R|227|783
1346825255734575104|779104195|Wed Jan 06 14:25:38 +0000 2021|"This is not about ""overturning an election"". This is about protecting the integrity of our elections. https://t.co/QKQFD0d8gt"|en|R|311|2174
1346624526491246603|779104195|Wed Jan 06 01:08:00 +0000 2021|With the new year comes new challenges, and I want to hear from YOU. Let me know what your top 2021 priorities are… https://t.co/sAwdzEH3AT|en|R|45|384
1346253583470178305|779104195|Tue Jan 05 00:34:01 +0000 2021|It's the start of a new year, and we need all the support we can get to keep up our fight for Utah! Help us start s… https://t.co/hRt6EIRKzL|en|R|21|215
1345924050950914050|779104195|Mon Jan 04 02:44:34 +0000 2021|Thank you for the opportunity to serve #UT04 https://t.co/e1RiQWVtIX|en|R|65|1130
1345871065474428928|779104195|Sun Jan 03 23:14:01 +0000 2021|My great great grandfather came to America in shackles, he died a successful entrepreneur. As a country we've made… https://t.co/fNB74PJId6|en|R|1881|10234
1345867234283909120|779104195|Sun Jan 03 22:58:48 +0000 2021|Grateful for the leadership of @GOPLeader https://t.co/GX5bZojyTg|en|R|69|823
1345817464370814977|779104195|Sun Jan 03 19:41:02 +0000 2021|But they that wait upon the Lord shall renew their strength. https://t.co/axHBZytQlO|en|R|75|613
1345785382940463107|779104195|Sun Jan 03 17:33:33 +0000 2021|Honored to be part of this exciting, patriotic team. https://t.co/LjT1UCfNFU|en|R|722|8012
1345570919587008514|779104195|Sun Jan 03 03:21:21 +0000 2021|If you only do what's easy, you will seldom do what's right.|en|R|6222|30743
1345432249638916105|779104195|Sat Jan 02 18:10:19 +0000 2021|Prayers for Coach Rose and his family. https://t.co/rD3QOe2Ra9|en|R|10|168
1345202025554853890|779104195|Sat Jan 02 02:55:30 +0000 2021|For those wanting to follow my congressional account it is @RepBurgessOwens|en|R|632|3808
1345139316113113094|779104195|Fri Jan 01 22:46:19 +0000 2021|What do you want to see out of 2021?|en|R|158|1678
1345138791808286720|779104195|Fri Jan 01 22:44:14 +0000 2021|Good luck to our local @zachkapono ! https://t.co/jQOc7OIUZZ|en|R|1|80
1345063522372362243|779104195|Fri Jan 01 17:45:08 +0000 2021|2020 sure was a weird year, huh? Bring on 2021! #HappyNewYear https://t.co/ENaHE5kYPD|en|R|29|557
1344804789071261696|779104195|Fri Jan 01 00:37:01 +0000 2021|It's the last day of 2020. Can you believe it? May you ring in the new year safely tonight with your loved ones. Ha… https://t.co/sgKgCtZVlb|en|R|87|1414
1344490586657603585|779104195|Thu Dec 31 03:48:29 +0000 2020|"""Freedom is never more than one generation away from extinction.""

Ronald Reagan"|en|R|1357|7259
1344451457718898693|779104195|Thu Dec 31 01:13:00 +0000 2020|My top priority will always be to fight for YOU, and my team needs your support to make sure we have the resources… https://t.co/BQEYWy1R1k|en|R|35|310
1344162910528888832|779104195|Wed Dec 30 06:06:25 +0000 2020|My heart breaks for the family of Rep-elect Letlow. An incredible leader with unwavering love for his country. He w… https://t.co/kHtzM8cKfE|en|R|90|1335
1344091082234224642|779104195|Wed Dec 30 01:21:00 +0000 2020|We are ONE WEEK AWAY from defending the Senate from a Democrat takeover. Will you help us hold the line? https://t.co/ntvriX6Nhu|en|R|58|518
1343622257445367809|779104195|Mon Dec 28 18:18:04 +0000 2020|One nation, under God. Happy Pledge of Allegiance Day to all those all across the nation. https://t.co/Qzt4cOLUBd|en|R|177|1358
1343275211899211777|779104195|Sun Dec 27 19:19:02 +0000 2020|#LightTheWorld https://t.co/vuti5fxFaj|und|R|54|599
1343072091453571072|779104195|Sun Dec 27 05:51:54 +0000 2020|How was everyone's Christmas?|en|R|57|1551
1342920516558995456|779104195|Sat Dec 26 19:49:36 +0000 2020|A sad loss. Prayers for his family at this time. https://t.co/R4AqE6hP3K|en|R|29|429
1342511720825282560|779104195|Fri Dec 25 16:45:11 +0000 2020|For unto you a child is born. Merry Christmas from my family to yours! I hope you all have a blessed day with your… https://t.co/7TyOYI5hpM|en|R|89|1360
1342277968865841153|779104195|Fri Dec 25 01:16:20 +0000 2020|Christmas is a beautiful time. No matter how divided we are, we come together in the spirit of giving. Republican,… https://t.co/VfJ5hLmIop|en|R|115|1692
1342255994450178049|779104195|Thu Dec 24 23:49:01 +0000 2020|Santa is getting ready for a big night! I hope you and your families are having a safe and blessed Christmas Eve. L… https://t.co/kI52ZAPWwm|en|R|39|494
1342232415125860352|779104195|Thu Dec 24 22:15:19 +0000 2020|One of my greatest passions has always been education and our youth.  THANK YOU @IvankaTrump for your heart in this… https://t.co/EwW2AyjwaL|en|R|156|1994
1342159230929813504|779104195|Thu Dec 24 17:24:31 +0000 2020|Merry Christmas Eve my friends.|en|R|624|10498
1342013847809314816|779104195|Thu Dec 24 07:46:49 +0000 2020|"Our past heroes fought for our right to Life, Liberty &amp; pursuit of Happiness.. 

This includes celebrating the birt… https://t.co/oN9jTpwuH2"|en|R|245|1768
1341987115547066369|779104195|Thu Dec 24 06:00:35 +0000 2020|We are elected to represent the American people, not special interests. It's time to start acting like it.|en|R|1630|10091
1341473668510089217|779104195|Tue Dec 22 20:00:20 +0000 2020|"“Gregory Smith, of Utah, to be the United States Commissioner of the Upper Colorado River Commission.”

https://t.co/IJu7UkXmSL"|en|R|5|74
1341451145001091072|779104195|Tue Dec 22 18:30:50 +0000 2020|Standing up for free and fair elections isn't Republican or Democrat, it's American. It's not about changing or ove… https://t.co/unKMo0kFaq|en|R|123|652
1341420790139465728|779104195|Tue Dec 22 16:30:13 +0000 2020|Just two weeks away from the must-win Georgia Senate Elections. Help us keep the Senate by joining the fight: https://t.co/n7i0PIM0Zb|en|R|24|172
1341263609783980039|779104195|Tue Dec 22 06:05:38 +0000 2020|Thank you @RandPaul https://t.co/rBaVkIVBSx|en|R|50|648
1341162319095549953|779104195|Mon Dec 21 23:23:09 +0000 2020|We need to prioritize those at risk. Right now, families are forced apart during the holidays, businesses are shut… https://t.co/yGwnoY3MKU|en|R|63|515
1340743277042159617|779104195|Sun Dec 20 19:38:01 +0000 2020|I hope you're having a blessed Sunday. #LightTheWorld https://t.co/RIxeRSoYS8|en|R|16|357
1340739704690360320|779104195|Sun Dec 20 19:23:49 +0000 2020|"I'm thankful we have a reason to celebrate this time of year.

#LightTheWorld https://t.co/OBoe8ZxbCL"|en|R|61|915
1340536486526009344|779104195|Sun Dec 20 05:56:19 +0000 2020|We live in the greatest country in the world. It's up to all of us to make sure our children are able to say the same.|en|R|513|4458
1340494012277374978|779104195|Sun Dec 20 03:07:32 +0000 2020|"""It's a great day to be alive"" ... Great seeing friends like @Travistritt supporting a great cause in GA! Let's get… https://t.co/7q1oGbW4nO"|en|R|68|950
1340492932181151744|779104195|Sun Dec 20 03:03:14 +0000 2020|Look who I ran into! @KristySwansonXO https://t.co/CpZTi50AJr|en|R|91|2352
1340475510556684288|779104195|Sun Dec 20 01:54:01 +0000 2020|I believe in the American Dream, do you? https://t.co/iY7vC5rh1R|en|R|926|7946
1340400865983803396|779104195|Sat Dec 19 20:57:24 +0000 2020|What an AWESOME team... working to keep our great nation free. Pulling for you Georgia to hold the line...👍🏾😊🇺🇸 https://t.co/PZmjB21OeE|en|R|78|897
1339750988132003840|779104195|Fri Dec 18 01:55:01 +0000 2020|What would you like to see the next Congress work on? I want to know what issues you care about, so take our poll t… https://t.co/YpUQg6IGWO|en|R|28|226
1339290028598386689|779104195|Wed Dec 16 19:23:20 +0000 2020|Thank you to everyone who came out to our drive-thru toy drive! https://t.co/eohBj6cguT|en|R|34|587
1338962838623191040|779104195|Tue Dec 15 21:43:12 +0000 2020|3 great patriots! https://t.co/XXXFSicUCX|en|R|417|4469
1338918516850794496|779104195|Tue Dec 15 18:47:04 +0000 2020|Tomorrow we will be hosting a drive-thru toy drive for children in the foster care system. Come say hi!… https://t.co/QswxVXmPhu|en|R|86|725
1338885034619654147|779104195|Tue Dec 15 16:34:02 +0000 2020|Happy Bill of Rights Day! As your Congressman-elect, I pledge to always fight for and defend your Constitutional ri… https://t.co/Cl18EFlX06|en|R|74|901
1338641928024363010|779104195|Tue Dec 15 00:28:01 +0000 2020|Tomorrow we face one of our last fundraising deadlines of the year. Can you chip in to help me fight for the Americ… https://t.co/hDFf673TU0|en|R|19|168
1338161012076388355|779104195|Sun Dec 13 16:37:01 +0000 2020|Happy birthday to the US National Guard. Thank you to all the men and women sacrificing to keep our country safe. https://t.co/BePAiFHroa|en|R|66|734
1337878645671489536|779104195|Sat Dec 12 21:55:00 +0000 2020|I'm grateful we have organizations in #UT04 like the Jordan Education Foundation to help take care of our children. https://t.co/4k0LIgflSw|en|R|37|602
1337260679623974913|779104195|Fri Dec 11 04:59:25 +0000 2020|Love this, thank you for stepping up for our kids @kimKBaltimore https://t.co/On75Yb26W1|en|R|123|1890
1337134266627600402|779104195|Thu Dec 10 20:37:06 +0000 2020|From all of us at Team Burgess, we want to wish you and your families a Happy Hanukkah. https://t.co/T17B3Z2QIU|en|R|39|678
1337058498467811329|779104195|Thu Dec 10 15:36:02 +0000 2020|Today we celebrate Human Rights Day, and commit to fighting for human rights wherever we find injustice. Our countr… https://t.co/0Bhnax5qiN|en|R|35|392
1336823137594314752|779104195|Thu Dec 10 00:00:47 +0000 2020|God bless my dear friend Congressman @RobBishopUT. Praying for a speedy recovery, my friend!|en|R|22|518
1336477666514526208|779104195|Wed Dec 09 01:08:00 +0000 2020|Are you ready for the Freedom Force? Conservatives are banding together to take on the far-left socialists in the H… https://t.co/EsGMv63Gby|en|R|256|2469
1336429532102868993|779104195|Tue Dec 08 21:56:44 +0000 2020|It's scary this even made it to the supreme court. Thank you Judge Barrett! https://t.co/cllIZuc1IH|en|R|130|1116
1336095271755808770|779104195|Mon Dec 07 23:48:30 +0000 2020|If we take our freedom for granted our children won't get that luxury.|en|R|1098|7051
1336034012557676550|779104195|Mon Dec 07 19:45:05 +0000 2020|Today we remember the heroes we lost at the attack on Pearl Harbor, December 7, 1941. It is a constant reminder tha… https://t.co/EVxvoqhHSN|en|R|245|1678
1335407776873369601|779104195|Sun Dec 06 02:16:39 +0000 2020|#LightTheWorld https://t.co/6nrVhafJkB|und|R|65|670
1335352339314716672|779104195|Sat Dec 05 22:36:21 +0000 2020|It was great to join Young America's Foundation for a conversation about our nation's future. Watch the full video… https://t.co/jFx7cwZbwU|en|R|21|212
1335281035425292289|779104195|Sat Dec 05 17:53:01 +0000 2020|Today is the 65th anniversary of Rosa Parks's arrest that accelerated the Civil Rights Movement in Montgomery, Alab… https://t.co/64ewpdGDXB|en|R|62|524
1335268961563234304|779104195|Sat Dec 05 17:05:03 +0000 2020|Teach correct principles and let people govern themselves.|en|R|967|7467
1335089571042750464|779104195|Sat Dec 05 05:12:13 +0000 2020|Friends in Georgia I hope you're making calls, texting friends and doing all you can for @KLoeffler and… https://t.co/XoxyfAPRzv|en|R|610|5006
1334948400014319616|779104195|Fri Dec 04 19:51:15 +0000 2020|You used to be a waitress, I was a chimney sweep. Both stand as a testament to the great opportunity we have in Ame… https://t.co/WU4SPSGSGW|en|R|1099|7684
1334941049215586304|779104195|Fri Dec 04 19:22:02 +0000 2020|Throughout the pandemic we've seen entrepreneurial innovation like never before. That's what our business owners do… https://t.co/fonudMlYlG|en|R|59|599
1334749192669995010|779104195|Fri Dec 04 06:39:40 +0000 2020|More of this 👇 America. https://t.co/1UXg5wwMDS|en|R|174|1709
1334729112640884736|779104195|Fri Dec 04 05:19:53 +0000 2020|#LightTheWorld https://t.co/sssTXDaO7P|und|R|51|525
1334718829365141505|779104195|Fri Dec 04 04:39:01 +0000 2020|"""Everything that is really great and inspiring is created by the individual who can labor in freedom.""

Albert Einstein"|en|R|258|2222
1334658428992712705|779104195|Fri Dec 04 00:39:00 +0000 2020|It's been a while since I played in the NFL, but it started a journey that I've been lucky to take. #TBT|en|R|66|1319
1333940197915041792|779104195|Wed Dec 02 01:05:01 +0000 2020|Nancy Pelosi led an impeachment of President Trump and put her own political interests over working Americans inste… https://t.co/9bHTZ8ApPn|en|R|101|731
1333098197619666945|779104195|Sun Nov 29 17:19:12 +0000 2020|Congrats @millermeeks ! Thank you Iowa for sending such a principled representative to Washington. https://t.co/V8jud30okf #FoxNews|en|R|41|345
1332870615829680128|779104195|Sun Nov 29 02:14:53 +0000 2020|Delivering some gifts to Toys for Tots. Challenged 3 friends.. I'd also like to challenge a few more! @JoeTalkShow… https://t.co/Ew44vvlbNE|en|R|272|2726
1332780938007285761|779104195|Sat Nov 28 20:18:32 +0000 2020|“He that would make his own liberty secure, must guard even his enemy from oppression; for if he violates this duty… https://t.co/6rdnTGJTYh|en|R|572|3297
1332743321823883264|779104195|Sat Nov 28 17:49:03 +0000 2020|Today is Small Business Saturday! Be sure to get out and support local businesses in your community today! https://t.co/NDymjrvtM9|en|R|36|312
1332735313064562688|779104195|Sat Nov 28 17:17:14 +0000 2020|It’s about TRUTH my friends. Might not like it, does not alway conform to our “personal” hopes but, like Laws of Gr… https://t.co/5Fc171stx4|en|R|44|479
1332468797853163520|779104195|Fri Nov 27 23:38:12 +0000 2020|Looking forward to working with proud, America First conservatives like @ByronDonalds https://t.co/x3E50Mc5xF|en|R|473|5339
1331988117658726401|779104195|Thu Nov 26 15:48:09 +0000 2020|Wishing you and your family a blessed Thanksgiving! https://t.co/5eBaGoUk67|en|R|65|1398
1331669327737569280|779104195|Wed Nov 25 18:41:23 +0000 2020|Due to commitment to faith, education, entrepreneurship and family, the 60's segregated black community led our nat… https://t.co/a2lXGZ8TpC|en|R|53|360
1331612387632320513|779104195|Wed Nov 25 14:55:08 +0000 2020|Thanks for the challenge my friends 🎄 🎁 🙌🏾 https://t.co/f8CWikdJfA|en|R|20|295
1331404745878212608|779104195|Wed Nov 25 01:10:02 +0000 2020|Secure elections are essential for a free country. Both Republicans and Democrats should be demanding that any pote… https://t.co/h4Ur0T6OpC|en|R|77|511
1331385364771008512|779104195|Tue Nov 24 23:53:01 +0000 2020|"Grateful to have such a great team joining me in DC. Excited to work with Keelie, Miriam and Nathaniel.
https://t.co/22UtvYXwhn"|en|R|36|522
1330268240967323652|779104195|Sat Nov 21 21:53:58 +0000 2020|So excited to work with @TeamObernolte . Jay is such an exciting part of a game changing freshman class. CA-8 is in… https://t.co/KdpJb5fYCw|en|R|58|622
1330215319059755013|779104195|Sat Nov 21 18:23:40 +0000 2020|I'm all in.  Grateful that our Congress has the much needed perspective of @MaElviraSalazar . Proud to stand with y… https://t.co/8kLntHyNRD|en|R|193|1408
1329977564513718272|779104195|Sat Nov 21 02:38:55 +0000 2020|Is there an Emmy award for best alternative history? https://t.co/Xb9r1qtLud|en|R|221|2159
1329856818193920000|779104195|Fri Nov 20 18:39:07 +0000 2020|I am thankful to have such a loving family. I'm thankful to live in a country where all things are possible, and I'… https://t.co/Zirepi3vvU|en|R|432|5723
1328929945515560961|779104195|Wed Nov 18 05:16:03 +0000 2020|Thank you @MiaBLove for your support throughout the campaign! https://t.co/l7KoN79VUm|en|R|39|666
1328871218494152704|779104195|Wed Nov 18 01:22:42 +0000 2020|Thank you @realDonaldTrump https://t.co/Wbw1f8yYPv|en|R|50|691
1328756117866889222|779104195|Tue Nov 17 17:45:20 +0000 2020|Now, it's time to get to work!|en|R|361|8150
1328533998339932160|779104195|Tue Nov 17 03:02:42 +0000 2020|Thank you @tee_reed for always working to bring a balanced approach to the news! https://t.co/NTX2fobJHU|en|R|13|243
1328521243214098435|779104195|Tue Nov 17 02:12:01 +0000 2020|WE DID IT! Thank you so much to every one of you for your unwavering support. It's been a long journey, and now the… https://t.co/Ccfqz4pavA|en|R|548|8531
1328501800912048128|779104195|Tue Nov 17 00:54:46 +0000 2020|Thank you Utah voters. I'm honored to have the opportunity to serve. I promise to be an open ear for all Utahns and… https://t.co/IlVze9NKN3|en|R|2923|35622
1328480012152967168|779104195|Mon Nov 16 23:28:11 +0000 2020|I received a call from @BenMcAdams he expressed appreciation for the opportunity to serve #UT04 and his commitment… https://t.co/Orzmf5Sxo7|en|R|920|10892
1328203015644459009|779104195|Mon Nov 16 05:07:30 +0000 2020|Thank you so much Sara....history will record you and your team as a true American Heroes. Thanks for your friendsh… https://t.co/Hj3bZxfDla|en|R|265|3879
1328200891653124097|779104195|Mon Nov 16 04:59:04 +0000 2020|“Thank you” NORTH CAROLINA for sending 1st Round Draft Choice Madison Cawthorn to DC. Promise you... this LOVE AMER… https://t.co/039ZTZtyEF|en|R|693|6519
1328191998562537473|779104195|Mon Nov 16 04:23:43 +0000 2020|“Thank you” ALABAMA for sending 1st Round Draft Choice Jerry Carl to DC. Promise you... this LOVE AMERICA Freshman… https://t.co/pAfbESQrBo|en|R|71|876
1328190083686658048|779104195|Mon Nov 16 04:16:07 +0000 2020|“Thank you” OKLAHOMA for sending 1st Round Draft Choice Stephenie Bice to DC. Promise you... this LOVE AMERICA Fres… https://t.co/NfFquXJtvF|en|R|188|1967
1328024040485892097|779104195|Sun Nov 15 17:16:19 +0000 2020|Soooo excited to team up with Nicole and my other Conservative Republican teammates..Our goal, regardless of which… https://t.co/D4ONnx76Pp|en|R|665|6047
1327373038640377859|779104195|Fri Nov 13 22:09:28 +0000 2020|YEP... glad we got THAT straight. As CNN would say... “let’s move on”  👍🏾😂😂 https://t.co/00CwICaAcd|en|R|18|311
1327280758533234689|779104195|Fri Nov 13 16:02:47 +0000 2020|"""If a nation expects to be ignorant &amp; free, in a state of civilization, it expects what never was &amp; never will be.""

Thomas Jefferson"|en|R|322|1972
1327116649795784704|779104195|Fri Nov 13 05:10:40 +0000 2020|In God we trust.|en|R|4170|43572
1327052918701264896|779104195|Fri Nov 13 00:57:25 +0000 2020|👇👇👇👇👇👇 https://t.co/6cDWiIWzkU|und|R|136|635
1327052167023263744|779104195|Fri Nov 13 00:54:26 +0000 2020|This is what we're trying to figure out.. https://t.co/kyzWXVc92M|en|R|174|919
1326561835475226626|779104195|Wed Nov 11 16:26:02 +0000 2020|Happy Veterans Day! Thanks to all the brave men and women who have served our country. We owe our freedom to you! https://t.co/urCn2hvXbW|en|R|126|1355
1326368203837071360|779104195|Wed Nov 11 03:36:37 +0000 2020|We are feeling optimistic. This has been the close race we all expected it to be. Looking forward to getting the fi… https://t.co/dLNZumRojg|en|R|1467|11149
1326322184550166528|779104195|Wed Nov 11 00:33:45 +0000 2020|"It's not a ""game"", more foreign wars isn't a ""game"" we're not in... Regardless of party we should be grateful for t… https://t.co/G3rKM2nYcj"|en|R|2416|10985
1326313518182793217|779104195|Tue Nov 10 23:59:19 +0000 2020|THANKS Gianno... prayers much appreciated 😊👍🏾 https://t.co/bPkEcuODwN|en|R|845|6392
1326275085032828928|779104195|Tue Nov 10 21:26:35 +0000 2020|This threat is nothing new from the divisive radical left. It's the natural next step when cowardly bullies feel sa… https://t.co/HyHzG2zO2M|en|R|163|698
1325120373550063619|779104195|Sat Nov 07 16:58:11 +0000 2020|"You've got this @KLoeffler
https://t.co/3rsqBIBFM5"|en|R|100|646
1324804753650380800|779104195|Fri Nov 06 20:04:01 +0000 2020|For 4 years the @DNC spent millions of dollars, and flooded our airwaves with warnings of how easily corrupted the… https://t.co/avHvXmlM40|en|R|1524|6271
1324771309608337409|779104195|Fri Nov 06 17:51:07 +0000 2020|"Check to see if your vote has been counted! 

https://t.co/xAoUtdcDXx"|en|R|187|641
1324513709469822977|779104195|Fri Nov 06 00:47:31 +0000 2020|Our race is separated by 18 votes! We're excited to see more ballots come in! https://t.co/XCWSsROOUV|en|R|506|4255
1324165137717104647|779104195|Thu Nov 05 01:42:25 +0000 2020|Exciting numbers out of Utah and Salt Lake County today! Momentum is on our side!|en|R|755|7471
1324011951421227008|779104195|Wed Nov 04 15:33:42 +0000 2020|Waiting to resume count of over 100,000 ballots. Anxious to hear the voice of District 4 and ready to serve if chos… https://t.co/cFPlzcyBHQ|en|R|146|1718
1323796713824538625|779104195|Wed Nov 04 01:18:26 +0000 2020|Polls close in less than 2 hours!|en|R|97|1277
1323741495703277568|779104195|Tue Nov 03 21:39:01 +0000 2020|Are you in line at the polls? Post a picture in the comments below of you doing your civic duty! #TeamBurgess #ElectionDay|en|R|564|3552
1323704255853830149|779104195|Tue Nov 03 19:11:02 +0000 2020|Have you already voted for Burgess Owens? Tell us in the comments below, and let us know why you support Burgess, t… https://t.co/FgRvFGEQlx|en|R|87|671
1323661163591168000|779104195|Tue Nov 03 16:19:48 +0000 2020|Thank you,  I'm humbled by the support I've received the last year. As final votes are being cast, know how gratefu… https://t.co/mD1SZqarF7|en|R|502|5198
1323659079525396480|779104195|Tue Nov 03 16:11:31 +0000 2020|Let's go @kimKBaltimore ! https://t.co/lLX2aHsLLT|en|R|331|3041
1323656442264563714|779104195|Tue Nov 03 16:01:02 +0000 2020|Today's the day we've been waiting for! If you haven't cast your ballot yet, make your voice heard by heading to th… https://t.co/ceAvYcaEbJ|en|R|82|583
1323497345854500864|779104195|Tue Nov 03 05:28:51 +0000 2020|Things are changing. The Republican Party is becoming the party of criminal justice reform, sensible foreign policy… https://t.co/QtWGDZHQ8f|en|R|2059|10591
1323450587749388288|779104195|Tue Nov 03 02:23:03 +0000 2020|Thank you so much @robsmithonline ... You are a true American hero! https://t.co/xAdEtOTSAY|en|R|65|786
1323374581030232071|779104195|Mon Nov 02 21:21:01 +0000 2020|Election Day is TOMORROW! Are you on #TeamBurgess? RT to show your support and remind your friends and loved ones t… https://t.co/FgTeTKh9iG|en|R|251|860
1323347650125598725|779104195|Mon Nov 02 19:34:01 +0000 2020|Something I think even Ben and I can agree on... https://t.co/d1pAVO8a7w|en|R|12|190
1323339096593375232|779104195|Mon Nov 02 19:00:01 +0000 2020|Thank you @MarcusGilbert88 and @madisongesiotto ! https://t.co/hqoRbncujQ|en|R|41|314
1323295844544794625|779104195|Mon Nov 02 16:08:09 +0000 2020|Election Day is TOMORROW! Have you voted yet? If you haven't, make a plan for when and where you're going to cast y… https://t.co/WBnDuqxPF5|en|R|49|307
1323153464063524864|779104195|Mon Nov 02 06:42:23 +0000 2020|If @DonaldJTrumpJr leaves his house without a mask he gets more negative press than all of Hunter Biden's scandals.… https://t.co/mrRpZJcphe|en|R|1472|8198
1323048976459837440|779104195|Sun Nov 01 23:47:11 +0000 2020|Thank you so much my friend! https://t.co/t1BHt38QZe|en|R|139|835
1322934398988111873|779104195|Sun Nov 01 16:11:54 +0000 2020|Burgess looks forward to teaming up with the Trump Administration, the Utah Delegation, Operation Undergroud Railro… https://t.co/5YTMGO0qMs|en|R|121|705
1322716710999224321|779104195|Sun Nov 01 01:46:53 +0000 2020|Former New York Jets Safety Burgess Owens Is In the Fourth Quarter of His Bid for Congress https://t.co/jJmcoB9Gcq via @KristianRDyer|en|R|733|4859
1322685979841363969|779104195|Sat Oct 31 23:44:46 +0000 2020|Did anyone realize there is an election next week? This one really snuck up on us didn't it?|en|R|272|3410
1322671232316108801|779104195|Sat Oct 31 22:46:10 +0000 2020|It has been 4 days since the @DeseretNews pulled factual ads drawing attention the @BenMcAdams FBI investigation in… https://t.co/jX8lsUctd2|en|R|107|526
1322647112505438208|779104195|Sat Oct 31 21:10:19 +0000 2020|Our freedom came from the hard work of farmers, merchants, physicians, ministers, scientists, soldiers and about ev… https://t.co/Kkdwo8UBDz|en|R|682|3252
