id|user|created_at|text|lang|label|retweet_count|favorite_count
1416110895697063936|779104195|Fri Jul 16 19:02:02 +0000 2021|We are not a white nation or a black nation... We are one nation, with one national anthem.|en|R|6279|33730
1415809823728300034|779104195|Thu Jul 15 23:05:41 +0000 2021|Great job, Kathy! @Kathy4Truth is leading the charge to take back the Senate. She has my full support! https://t.co/ZdMe8jd4Fg|en|R|37|238
1415359291662364675|779104195|Wed Jul 14 17:15:25 +0000 2021|Our freedom has been bought and paid for by men and women of all races. It's time we start teaching the stories of… https://t.co/IO7ujVhzm4|en|R|380|1675
1414970734527401986|779104195|Tue Jul 13 15:31:26 +0000 2021|Thank you to the Utah NAACP chapter for making a statement pushing back on Utah BLM's rhetoric that the American fl… https://t.co/1WzX0NsUpG|en|R|112|677
1414657411642630158|779104195|Mon Jul 12 18:46:24 +0000 2021|Have we seen enough yet? For years we've heard people like Bernie Sanders praise the evil policies of Communist Cas… https://t.co/WZVxvIYlma|en|R|1945|7624
1414335691715223558|779104195|Sun Jul 11 21:28:00 +0000 2021|Stand with me to ensure that every unborn baby has the right to life. https://t.co/wUbM6gPLW6|en|R|199|1173
1414044501018955776|779104195|Sun Jul 11 02:10:55 +0000 2021|"VP Harris is finally making Voter ID an equal opportunity insult. 

https://t.co/3Ug7xmNGPo"|en|R|394|1645
1413914415926239234|779104195|Sat Jul 10 17:34:00 +0000 2021|I wrote a piece in the @WashTimes about how we can transform our healthcare system coming out of the pandemic. I ho… https://t.co/s3lkFa4xVN|en|R|105|515
1413871543155793920|779104195|Sat Jul 10 14:43:39 +0000 2021|Happy to have sponsored this bill preventing the racist and divisive CRT from being taught by Federal employees. I'… https://t.co/YlmgNZTZIw|en|R|592|2937
1413606890655911936|779104195|Fri Jul 09 21:12:00 +0000 2021|Critical Race Theory undermines civil rights, constitutionally guaranteed equal protection before the law, and U.S.… https://t.co/8jrHJVMD7w|en|R|698|3146
1413291135401971713|779104195|Fri Jul 09 00:17:19 +0000 2021|"White House Secretary Jen Psaki blamed the GOP after the ""defund the police"" slogan backfired on Democrats. The Dem… https://t.co/rHY5a2WqhI"|en|R|217|968
1413213302495137794|779104195|Thu Jul 08 19:08:02 +0000 2021|My father, a proud black man, served with that flag on his right shoulder as this country saved the world from spea… https://t.co/tWEq5u6nxh|en|R|1012|4933
1412998129008345089|779104195|Thu Jul 08 04:53:00 +0000 2021|"Loved sharing the rich history of some of our early black Patriots with @JoeTalkShow 

https://t.co/1ffi6YOqED"|en|R|36|197
1412942260321366018|779104195|Thu Jul 08 01:11:00 +0000 2021|The Olympics are about patriotism and proudly representing our nation. We need to stand up to these cultural Marxis… https://t.co/GIh4RATluc|en|R|196|1392
1412922127905394691|779104195|Wed Jul 07 23:51:00 +0000 2021|"In the wake of the ""defund the police"" movement there has been an increase in crime across the nation. Take this po… https://t.co/xaM6Cissyv"|en|R|28|134
1412495429166526464|779104195|Tue Jul 06 19:35:27 +0000 2021|As Americans we don't destroy history; we learn from it.|en|R|1527|10900
1411742856591589382|779104195|Sun Jul 04 17:45:00 +0000 2021|"God bless America!

#HappyIndependenceDay"|en|R|189|2101
1411661575325356034|779104195|Sun Jul 04 12:22:01 +0000 2021|We're so lucky to live in the greatest country in the world. To all those who have sacrificed for our freedom and l… https://t.co/WCJ19clx3C|en|R|379|3025
1411499478016692227|779104195|Sun Jul 04 01:37:54 +0000 2021|In the 245 years since our founders risked it all by signing their names, America has been the home of countless in… https://t.co/18uS8SCQXT|en|R|1062|6011
1411379218521411584|779104195|Sat Jul 03 17:40:02 +0000 2021|Kamala finally visits the border 95 days after being put in charge of the crisis. And she missed it by about 1,000… https://t.co/fmr53vE8rb|en|R|211|1047
1411133619536498692|779104195|Sat Jul 03 01:24:07 +0000 2021|Surgery went well. Thanks for all the well wishes!|en|R|513|11163
1410989673376370694|779104195|Fri Jul 02 15:52:07 +0000 2021|Thanks to your incredible support, we are building a huge amount of momentum heading into next year's election. THA… https://t.co/MQ0sKhSPao|en|R|92|737
1410768649372147715|779104195|Fri Jul 02 01:13:51 +0000 2021|With an unprecedented humanitarian crisis at our border, soaring gas prices, and more out of control spending that… https://t.co/ACpdaHg8T3|en|R|331|1339
1410658726265208834|779104195|Thu Jul 01 17:57:03 +0000 2021|"This shouldn't be a hard question to answer. Unborn children are ""human beings"" whose rights should be defended. https://t.co/yfaXLgsPJR"|en|R|263|1399
1410453816500129793|779104195|Thu Jul 01 04:22:49 +0000 2021|Loved catching up with @DennisPrager and @thewillwitt while they were in Utah for Washington County Lincoln Days. https://t.co/cH0n6d6ccY|en|R|58|833
1410390706502393861|779104195|Thu Jul 01 00:12:02 +0000 2021|We are just hours away from the FEC's deadline, and we're still running behind on our goals! Will you help me out b… https://t.co/dvtLjLfk07|en|R|52|140
1410295317740855296|779104195|Wed Jun 30 17:53:00 +0000 2021|"As Americans we don't destroy history; we learn from it.

https://t.co/T96ITOmjUQ

W/ @JudgeJeanine @JakeBequette91"|en|R|69|342
1410081670766612484|779104195|Wed Jun 30 03:44:03 +0000 2021|Every single day, average-everyday Americans are given opportunities that past generations never knew possible than… https://t.co/WZvQNbMZgd|en|R|349|2700
1410041144898117644|779104195|Wed Jun 30 01:03:00 +0000 2021|"The same people who called voter ID laws ""Jim Crow."" https://t.co/ZtOyXVlne6"|en|R|1039|3463
1409960391233261570|779104195|Tue Jun 29 19:42:07 +0000 2021|Friends, I’m disappointed that I will be missing Independence Day festivities later this week, but I'm joining many… https://t.co/doJ0YpQMOz|en|R|458|6810
1409899969180487688|779104195|Tue Jun 29 15:42:01 +0000 2021|Want to stay up to date with the work we're doing in D.C. and on the trail? Sign up today to get email updates and… https://t.co/Cwppctodeo|en|R|14|64
1409670706023976960|779104195|Tue Jun 29 00:31:01 +0000 2021|I wrote about the horrors of Planned Parenthood and their destruction of the black community over the years. I hope… https://t.co/jeYf8MNBYq|en|R|176|541
1409666327992668160|779104195|Tue Jun 29 00:13:37 +0000 2021|"I remember lining up with my teammates, seeing that flag and getting teary-eyed... 

We felt the power in what it a… https://t.co/6GWhSfrnDt"|en|R|3971|24105
1409221060969451521|779104195|Sun Jun 27 18:44:17 +0000 2021|"I'd love to sit down @spidadmitchell and talk about both of our unique perspectives on this issue
https://t.co/u168VvMrLA
@FoxNews"|en|R|82|744
1409174184643678220|779104195|Sun Jun 27 15:38:01 +0000 2021|I hope you'll join me in raising awareness for the 8 million+ Americans who struggle with PTSD every year.… https://t.co/EAjghSbWBV|en|R|88|405
1408941402101227520|779104195|Sun Jun 27 00:13:01 +0000 2021|"A great new business in the 4th district. Looking forward to trying some of the ""founding flavors"" soon! https://t.co/VVPLYusMam"|en|R|27|284
1408883813770358784|779104195|Sat Jun 26 20:24:11 +0000 2021|"In the last two months, UNACCOMPANIED minors crossing the border: 

•4500 children between ages 7-12 
•4700 childre… https://t.co/zK1XGT3Dgj"|en|R|433|1715
1408454698722545672|779104195|Fri Jun 25 15:59:02 +0000 2021|I was happy to join @GiannoCaldwell  to talk about the hypocrisy coming from the left and what we're doing to fight… https://t.co/tRzvrxCyhA|en|R|61|267
1408166525417054211|779104195|Thu Jun 24 20:53:56 +0000 2021|Anytime you disagree with far left extremists, the only explanation is obviously racism, right? https://t.co/QxW80l0x7j|en|R|441|2272
1408117559191343107|779104195|Thu Jun 24 17:39:22 +0000 2021|Critical Race Theory pins Americans against each other based on the color of their skin. It does not belong in our… https://t.co/fC0LH6PqYs|en|R|323|1167
1407854756471705601|779104195|Thu Jun 24 00:15:05 +0000 2021|https://t.co/9xiDCNKTOi|und|R|508|3399
1407528777488371714|779104195|Wed Jun 23 02:39:45 +0000 2021|"Congrats @HerrimanHS !
https://t.co/zRi6y4qaEx"|en|R|9|82
1407510468068089862|779104195|Wed Jun 23 01:27:00 +0000 2021|The Biden/Harris Administration wants to do away with the Hyde Amendment to use taxpayer money to pay for abortions… https://t.co/ZovRUFcSWU|en|R|111|369
1407358295552118791|779104195|Tue Jun 22 15:22:19 +0000 2021|"Voter ID is Jim Crow, but all-white beach clubs are just ""tradition""... Seem backwards to anyone else? https://t.co/SRjv2dgSsv"|en|R|1883|5961
1407342034780831744|779104195|Tue Jun 22 14:17:42 +0000 2021|"Reminiscent of Jim Crow era, Democrat Senator defends ""Whites Only"" membership, and NFL admits to compensation disc… https://t.co/wXczBeeEp2"|en|R|389|924
1406993878188707847|779104195|Mon Jun 21 15:14:15 +0000 2021|This is exactly what we need. All in @Kathy4Truth ! https://t.co/psn0yVBoK6|en|R|94|366
1406623884124868608|779104195|Sun Jun 20 14:44:02 +0000 2021|One of the greatest blessings in life is being a father. I hope all the dads out there have a wonderful day! https://t.co/AJaGBQpbAW|en|R|179|1999
1406264262725619715|779104195|Sat Jun 19 14:55:02 +0000 2021|#Juneteenth #FreedomDay https://t.co/cpqEVhXYtm|und|R|96|908
1405994717754523650|779104195|Fri Jun 18 21:03:57 +0000 2021|"Biden and Harris are 'lost in space' and not worried about the needs of Americans.

https://t.co/EKct1JynU0"|en|R|66|375
1405948935705923585|779104195|Fri Jun 18 18:02:02 +0000 2021|Americans are struggling to afford the Biden/Harris Administration. https://t.co/cZmaMS0s1v|en|R|128|456
1405902521814691847|779104195|Fri Jun 18 14:57:36 +0000 2021|Tell Joe Biden and Kamala Harris to stop enabling human traffickers and smugglers at the southern border. Add your… https://t.co/sFLof0zZ9b|en|R|94|343
1405622206701268996|779104195|Thu Jun 17 20:23:43 +0000 2021|"“To live under the American Constitution is the greatest political privilege that was ever accorded to the human race.”

Calvin Coolidge"|en|R|255|1569
1405616429991272451|779104195|Thu Jun 17 20:00:46 +0000 2021|If you're not following @Kathy4Truth yet, now is the time! Excited to join her in PA this evening. She is going to… https://t.co/47LiBYNcML|en|R|35|220
1405334945304776704|779104195|Thu Jun 17 01:22:15 +0000 2021|All this virtue signaling, but when REAL racism rears its head, the mainstream media can't be bothered to expose it… https://t.co/NWLWmRVsmh|en|R|98|517
1405311229061742595|779104195|Wed Jun 16 23:48:01 +0000 2021|The President of Guatemala knows....Biden's policies at the border are enabling coyotes and human smugglers. It's a… https://t.co/X8SVCTJQyP|en|R|359|1382
1404943427934949379|779104195|Tue Jun 15 23:26:30 +0000 2021|Americans sacrificed livelihoods, their ability to worship, their children's education... Our sick were dying alone… https://t.co/e1xLXJwp94|en|R|375|1329
1404832600988991488|779104195|Tue Jun 15 16:06:07 +0000 2021|"So Hunter Biden gets caught using racial slurs and BLM and the ""woke"" crowd are silent. I think it's time Hunter Bi… https://t.co/ihENIdTYjT"|en|R|277|1139
1404473466552791044|779104195|Mon Jun 14 16:19:02 +0000 2021|Happy #FlagDay everyone! I cherish the time I spent with my teammates staring up at the flag, singing the National… https://t.co/MD8UaOJJJX|en|R|87|583
1404460134420652034|779104195|Mon Jun 14 15:26:04 +0000 2021|Today we celebrate the US Army's birthday. Thank you for being with us for every step of your 246-year history! https://t.co/FkA8Y4PGln|en|R|203|1640
1403392955688251392|779104195|Fri Jun 11 16:45:29 +0000 2021|Critical race theory creates more racism, not less.|en|R|1617|8618
1403386185846722569|779104195|Fri Jun 11 16:18:35 +0000 2021|"Great joining @HeyTammyBruce last night!

https://t.co/lfESNs2YxQ"|en|R|12|75
1403224539346079746|779104195|Fri Jun 11 05:36:15 +0000 2021|Having worked side by side with @ByronDonalds, any group not interested in his input does not have our Black commun… https://t.co/Bi8j15Ailz|en|R|295|1225
1403168861663469571|779104195|Fri Jun 11 01:55:00 +0000 2021|When Joe Biden and Democrat leadership incentivize people to stay home, this is the result: https://t.co/Khb9obiDvJ|en|R|73|409
1403045265565646850|779104195|Thu Jun 10 17:43:53 +0000 2021|I love seeing the diversity of conservative candidates running for office. Exciting things ahead for the Republican… https://t.co/SsV1gOL2Je|en|R|86|495
1402834000381550596|779104195|Thu Jun 10 03:44:23 +0000 2021|Words of courage standing up to the cowardice and evil of Critical Race Theory. Parents, it's time to fight for the… https://t.co/JXg1wb0E7Q|en|R|1155|4949
1402780316033560576|779104195|Thu Jun 10 00:11:04 +0000 2021|We are the greatest, freest country that has ever existed. But the Left wants to tear down what makes us great. I h… https://t.co/WVEua7VeHB|en|R|221|1143
1402623445314244611|779104195|Wed Jun 09 13:47:43 +0000 2021|You are going to be an incredible Senator, @Kathy4Truth. DC is finding out what the people of PA have known for a l… https://t.co/ccXaLQ4ICq|en|R|42|274
1402431753873149956|779104195|Wed Jun 09 01:06:00 +0000 2021|Dr. Fauci lied about gain of function research, yet the White House defends him. Do you think we'll ever get an apo… https://t.co/dynJWg94kN|en|R|307|1540
1402378233652203526|779104195|Tue Jun 08 21:33:20 +0000 2021|"This is disgusting and unacceptable. 

Can't help but notice the silence from CNN and countless ""woke"" celebrities.

https://t.co/wU3P5T98S5"|en|R|1067|3239
1402363731200253954|779104195|Tue Jun 08 20:35:42 +0000 2021|I still remember standing next to my teammates on the sideline as we almost choke up seeing that flag, thinking of… https://t.co/TLPu2ICCsr|en|R|320|2494
1402271635189739524|779104195|Tue Jun 08 14:29:45 +0000 2021|"Ahead of her(VP Harris) arrival, Guatemalan President Giammattei blasted the Biden Administration for ""family reuni… https://t.co/XsoAizZUgF"|en|R|464|1901
1402061062502031364|779104195|Tue Jun 08 00:33:00 +0000 2021|Another major cyberattack that disrupts the American economy. It demands a strong response from the Biden White Hou… https://t.co/LL5b1R2Fv5|en|R|98|542
1402046718770880513|779104195|Mon Jun 07 23:36:01 +0000 2021|Another terrible look for the NFL. Unfortunately, it will continue to happen if leadership doesn't change. https://t.co/Hw8Zu60U8E|en|R|30|178
1401563788273463296|779104195|Sun Jun 06 15:37:01 +0000 2021|On this date 77 years ago, America's greatest generation stormed the beaches of Normandy. We are forever in debt to… https://t.co/SOvxE3gWvo|en|R|372|2466
1401363264492249089|779104195|Sun Jun 06 02:20:12 +0000 2021|"It was great joining @RepKenBuck on his podcast ""Shooting Straight."" Be sure to check out our entire conversation… https://t.co/CWnjgz5kke"|en|R|45|225
1401358714460794883|779104195|Sun Jun 06 02:02:08 +0000 2021|"A message from my friend @DineshDSouza
""As India fights its #COVID19 crisis, it's important to continue to share ex… https://t.co/tjeuCPy41P"|en|R|78|660
1401015415422164994|779104195|Sat Jun 05 03:17:59 +0000 2021|Congrats to @SnowAthletics , their players and coaches for such a big year! https://t.co/ol3sfGfKII via @DeseretNews|en|R|12|75
1400876380460662794|779104195|Fri Jun 04 18:05:30 +0000 2021|I grew up facing real racism in the Deep South. We had to overcome obstacles to succeed in America, but we still di… https://t.co/Lyb914qpU9|en|R|694|2763
1400636428451778564|779104195|Fri Jun 04 02:12:01 +0000 2021|Critical Race Theory is the exact opposite of Dr. King's dream of not being judged by the color of one's skin but o… https://t.co/HciuyYcQxD|en|R|1058|4771
1400497571915649026|779104195|Thu Jun 03 17:00:15 +0000 2021|"Heartbreaking to see such tragedy come to this sweet girl. My heart goes out to her family.

We need to do more. https://t.co/FpN4xlulo0"|en|R|61|403
1400113079266910215|779104195|Wed Jun 02 15:32:25 +0000 2021|In the 70's and early 80's, black football players were banned from playing 'thinking positions' like QB, because o… https://t.co/Kp3afDYnFl|en|R|53|223
1400094357164810242|779104195|Wed Jun 02 14:18:01 +0000 2021|Many Americans, especially our nation's veterans, face PTSD head-on every day of their lives. This month, let's spr… https://t.co/nFDoGXuw0Q|en|R|92|458
1399900072968699912|779104195|Wed Jun 02 01:26:00 +0000 2021|Liberal dark-money groups are now pushing the Democrats' power-grab disguised as an election bill, otherwise known… https://t.co/TFTCAhrRI8|en|R|256|766
1399788767582449664|779104195|Tue Jun 01 18:03:43 +0000 2021|The Marxist inspired BLM, Inc was never about uplifting Black lives. Its commitment is to destroy black families, b… https://t.co/y3kov7RfvZ|en|R|785|2343
1399510646878728193|779104195|Mon May 31 23:38:34 +0000 2021|It is the Soldier, not the politician, Who has given us the right to vote... It is the Soldier who salutes the flag… https://t.co/SmtoyRsGCQ|en|R|2118|14768
1399383444602425347|779104195|Mon May 31 15:13:07 +0000 2021|Our freedom was earned through the blood, sweat, and sacrifice of so many brave patriots throughout our nation's hi… https://t.co/GvKfh0ZaEd|en|R|94|788
1398788977218310144|779104195|Sat May 29 23:50:55 +0000 2021|Thinking of all the men and women who have given their lives to protect the freedom we so often take for granted.… https://t.co/n1qRI4tLn0|en|R|1398|10210
1398700423696035840|779104195|Sat May 29 17:59:02 +0000 2021|When are we going to have the guts to stand up to China? https://t.co/L9dvmhKtzz|en|R|119|516
1398359430945771524|779104195|Fri May 28 19:24:03 +0000 2021|RT if you agree! https://t.co/Z2JNxoqHLp|en|R|3470|8560
1398066790513528833|779104195|Fri May 28 00:01:12 +0000 2021|"America is the land of promise, all things are possible regardless of the color of your skin...

My grandkids deser… https://t.co/LnWO71ON9B"|en|R|809|4959
1397743849485660160|779104195|Thu May 27 02:37:57 +0000 2021|When liberty is lost so is our ability to succeed.|en|R|882|7558
1397659163635818498|779104195|Wed May 26 21:01:26 +0000 2021|"""People don't call activists or politicians when in danger; they call the police. ""

@ByronDonalds"|en|R|191|1577
1397266486847148033|779104195|Tue May 25 19:01:05 +0000 2021|We need to stop acting like reckless government spending won't catch up to us.|en|R|994|8647
1397218191219335180|779104195|Tue May 25 15:49:10 +0000 2021|Today we remember the missing children across the country, and fight to end the horror that is human trafficking. https://t.co/SNcwPBSeVU|en|R|220|891
1397010321387130882|779104195|Tue May 25 02:03:10 +0000 2021|Big congrats to @SnowAthletics ! https://t.co/ewivMtwXvJ|en|R|6|46
1396992415437819906|779104195|Tue May 25 00:52:01 +0000 2021|Should critical race theory be taught in schools? I need to know your thoughts: https://t.co/iSi2QAfl6m|en|R|55|267
1396840823921078280|779104195|Mon May 24 14:49:39 +0000 2021|Author of 1619 project denied tenure after being debunked by historians and colleagues as calls to revoke Pulitzer… https://t.co/csCaCujOfU|en|R|1867|7083
1396157163106619394|779104195|Sat May 22 17:33:01 +0000 2021|This month and every month, let us show our appreciation for our military service members, past and present.… https://t.co/0JBBYx0z4U|en|R|96|669
1395779424856023044|779104195|Fri May 21 16:32:01 +0000 2021|The science is clear: schools should be open. Put politics aside and let's get America's kids back in the classroom. https://t.co/4DZabUklQt|en|R|126|532
1395773652440948743|779104195|Fri May 21 16:09:05 +0000 2021|Thank you for the invite, @kimKBaltimore - You’re doing great things! Amazing evening with an incredible group of f… https://t.co/H8pjHqkEZv|en|R|103|738
1395749974818893829|779104195|Fri May 21 14:35:00 +0000 2021|Kelvin King is a rising star in Georgia and the GOP! The country needs strong leaders like Kelvin. Check him out at… https://t.co/mm5voehqta|en|R|73|540
1395745143538339853|779104195|Fri May 21 14:15:48 +0000 2021|Did @VP just forget about the border crisis?|en|R|1270|9292
1395592113992048640|779104195|Fri May 21 04:07:43 +0000 2021|Great catching up with @kimKBaltimore and @GiannoCaldwell and many others for the Red Revolution! https://t.co/sOaVo7r3G1|en|R|404|3928
1395558215530815496|779104195|Fri May 21 01:53:01 +0000 2021|https://t.co/pE1RO8mYHk|und|R|158|905
1395382786068938758|779104195|Thu May 20 14:15:55 +0000 2021|Genocide and Slavery... NOT 200 years ago, but in 2021. It's time to stand against the EVIL of enslaving a people b… https://t.co/I2hKZz9qm3|en|R|1021|5196
1395171335622610948|779104195|Thu May 20 00:15:42 +0000 2021|Where are the social justice warriors when actual genocide is happening in China? https://t.co/aDr0vnKLS4 via @BreitbartNews|en|R|158|600
1395091473616367617|779104195|Wed May 19 18:58:21 +0000 2021|"""A Constitution of Government once changed from Freedom, can never be restored. Liberty, once lost, is lost forever.""

John Adams"|en|R|1117|4079
1394675404091371523|779104195|Tue May 18 15:25:02 +0000 2021|The pandemic showed us just how essential our first responders are and how much appreciation they deserve on a dail… https://t.co/T5pLfgjK2N|en|R|36|264
1394449657930072064|779104195|Tue May 18 00:28:00 +0000 2021|Critical race theory is a dangerous and prejudicial way of thinking, and it should not be taught in our schools. https://t.co/9ZlXZn9s13|en|R|1450|6265
1394336970545893377|779104195|Mon May 17 17:00:13 +0000 2021|I'm privileged... Privileged to have been taught I live in a country where all things are possible regardless of sk… https://t.co/JaYDukCwUX|en|R|3151|15287
1394020492076412929|779104195|Sun May 16 20:02:39 +0000 2021|I stand with Israel.|en|R|683|6181
1393994456571858944|779104195|Sun May 16 18:19:12 +0000 2021|"I stand with you @UtahRabbi and hope they find the pathetic person who did this. 

Racism has no place in our state… https://t.co/FFyevwDWdW"|en|R|91|497
1393636050984075264|779104195|Sat May 15 18:35:01 +0000 2021|We should be teaching this in schools. We should be teaching our children the opportunity each of them have the liv… https://t.co/Tzk05uedVW|en|R|1126|5679
1393607112345985024|779104195|Sat May 15 16:40:02 +0000 2021|Huge thank you to all those who serve in our nation's Armed Forces! May we never forget that freedom isn't free. https://t.co/1FuRUaUIcg|en|R|438|2758
1393564337672003586|779104195|Sat May 15 13:50:03 +0000 2021|Our brave officers put their lives on the line every day when they go to work, and they deserve the highest respect… https://t.co/xPCye0rWb6|en|R|138|804
1393270390584184834|779104195|Fri May 14 18:22:01 +0000 2021|I stand committed to ending human trafficking across our country. https://t.co/3Nwg6q7tpf|en|R|132|1190
1393261827379720192|779104195|Fri May 14 17:47:59 +0000 2021|"Racist critical race theory should have no place in our education system.

https://t.co/9ZlXZnr2SB"|en|R|1112|4816
1393225540409065475|779104195|Fri May 14 15:23:48 +0000 2021|"A President who believes he can make ""rules"" is a dangerous thing. https://t.co/Zo8HUuTScr"|en|R|1161|6898
1393019988882116608|779104195|Fri May 14 01:47:01 +0000 2021|We have thousands of unaccompanied minors brought here by human smugglers. Take action with me and find out how you… https://t.co/GMUnevPINW|en|R|95|409
1392620465013747714|779104195|Wed May 12 23:19:27 +0000 2021|Our children deserve better than the soft bigotry of critical race theory.|en|R|727|4308
1392502380776890379|779104195|Wed May 12 15:30:13 +0000 2021|Nurses across the globe stepped up in a big way throughout the coronavirus pandemic, and they deserve our recogniti… https://t.co/oEFyS0QZcG|en|R|26|179
1392498029219905536|779104195|Wed May 12 15:12:56 +0000 2021|After Biden canceled the Keystone XL pipeline, Energy Secretary Granholm says “pipe is the best way” to transport f… https://t.co/KMqo5I6cxN|en|R|431|1380
1392163999861469186|779104195|Tue May 11 17:05:37 +0000 2021|"Obtaining an ID, basic math, Dr. Seuss, historical statues, everything is racist these days... 

except actually be… https://t.co/FuWClTNMML"|en|R|684|5097
1392150292016386051|779104195|Tue May 11 16:11:09 +0000 2021|Every one of us has struggled or knows someone who has struggled with their mental health. I am committed to ending… https://t.co/osYr28aApQ|en|R|27|153
1392125362805501957|779104195|Tue May 11 14:32:05 +0000 2021|I expect @POTUS to pass the blame, but passing the blame on our business owners? That's too far. Government cannot… https://t.co/VpDI5ytYJV|en|R|95|499
1391883271861153799|779104195|Mon May 10 22:30:06 +0000 2021|We launched a page on our website to give you ways to help out at the southern border. I want you to join me in sol… https://t.co/CM78HBJgKr|en|R|36|198
1391557613251268610|779104195|Mon May 10 00:56:03 +0000 2021|"Motherhood is the closest mankind may come to knowing the pure love of Christ. 

I could not be more proud of the a… https://t.co/nLL2EKZLkP"|en|R|289|3551
1391418189708472325|779104195|Sun May 09 15:42:02 +0000 2021|Wishing a very happy Mother's Day to moms across the world! https://t.co/Qt5GghDGow|en|R|55|618
1390691652960989187|779104195|Fri May 07 15:35:02 +0000 2021|Military spouses deserve recognition for the sacrifices they and their families have to make on a constant basis. F… https://t.co/zD1pRs4kCB|en|R|140|802
1390365259437903873|779104195|Thu May 06 17:58:04 +0000 2021|Nurses have always deserved our thanks, but especially after all they have done for our communities throughout the… https://t.co/JpfvKXOHVv|en|R|30|171
