id|user|created_at|text|lang|label|retweet_count|favorite_count
1313279620574257153|779104195|Tue Oct 06 00:47:15 +0000 2020|Ben McAdams and Nancy Pelosi have put out so many lies, so we created a page dedicated to the FACTS. Check it out:… https://t.co/BM5S5RXrAU|en|R|720|2336
1313225960817389571|779104195|Mon Oct 05 21:14:02 +0000 2020|Happy World Teachers' Day to educators across the world! I still remember some of the teachers who impacted me the… https://t.co/joE4pbDJiI|en|R|23|108
1312868779697692672|779104195|Sun Oct 04 21:34:43 +0000 2020|Irishrygirl.. what is it about Dems and your inability to articulate yourselves without every other word being a “f… https://t.co/wH8ooUqDrH|en|R|110|794
1312793042852618245|779104195|Sun Oct 04 16:33:46 +0000 2020|No.. not several. Easy to find the Facts my friend “if sincerely interested”. https://t.co/DjndervYNG https://t.co/ZQ1V6FD7S6|en|R|31|184
1312432984310636544|779104195|Sat Oct 03 16:43:01 +0000 2020|With 1 month until Election Day, it's time to leave it all out on the field. RT if you're ready to celebrate a Team… https://t.co/FgtGgMOwYg|en|R|126|371
1312417194467262464|779104195|Sat Oct 03 15:40:17 +0000 2020|It's absurd Ben McAdams and Nancy Pelosi have put out so many lies that we needed to create a page dedicated to the… https://t.co/YGAQ2Z8efE|en|R|3197|9830
1312212987164254209|779104195|Sat Oct 03 02:08:50 +0000 2020|I vote we have @terrycrews emcee the next debate.|en|R|526|6367
1312187113262047232|779104195|Sat Oct 03 00:26:01 +0000 2020|I'm on a mission to end human trafficking, here in Utah and across the United States. Are you with me? https://t.co/wYuHBScwc8|en|R|174|949
1312176123850100741|779104195|Fri Oct 02 23:42:21 +0000 2020|Praying for @POTUS , @FLOTUS and @SenMikeLee to have speedy recoveries.|en|R|308|2394
1312174793907556352|779104195|Fri Oct 02 23:37:04 +0000 2020|Thank you @rudygobert27 for standing up. This isn't about politics it's about human rights. https://t.co/79q7jXmspJ|en|R|174|1079
1312075467856510979|779104195|Fri Oct 02 17:02:23 +0000 2020|Burgess Owens will proudly fight for better healthcare for all Utahns - for market-based solutions, lower drug pric… https://t.co/lIoBicFdi4|en|R|67|292
1312043672465219586|779104195|Fri Oct 02 14:56:02 +0000 2020|Burgess Owens is ready to be our champion in Congress. Learn more at the link, and vote #BurgessOwens for Utah's Fo… https://t.co/f6lDmuMo5B|en|R|123|643
1311847622668423169|779104195|Fri Oct 02 01:57:00 +0000 2020|Looking for ways to support #TeamBurgess? Chip in $4 for a conservative victory in Utah's Fourth District! #UT04 https://t.co/8UpUa1Xbdn|en|R|41|168
1311726835756138496|779104195|Thu Oct 01 17:57:03 +0000 2020|On this day in 1958, NASA was established! We have come such a long way since that time in the exploration of space. https://t.co/AYzCPMxWqU|en|R|25|150
1311724124285276160|779104195|Thu Oct 01 17:46:16 +0000 2020|"Isn't it racist to assume, that worrying about the suburbs is a racist dog whistle? 

Take a drive through the subu… https://t.co/HbU1H2fsvl"|en|R|969|3896
1311474416669384710|779104195|Thu Oct 01 01:14:01 +0000 2020|Especially this year, there is no excuse for not casting your vote this year. There is too much at stake to not mak… https://t.co/yhPx1Jp02J|en|R|119|619
1311322004444909571|779104195|Wed Sep 30 15:08:23 +0000 2020|Anything is possible in America. #Vote #TeamBurgess #UT04 https://t.co/RCXxCGLkIk|en|R|103|583
1311078840605855745|779104195|Tue Sep 29 23:02:08 +0000 2020|For me, out of failure came growth. That’s the America I’m fighting for, and why I need your support for my campaig… https://t.co/yJUvNs72ml|en|R|103|473
1310990243512885249|779104195|Tue Sep 29 17:10:05 +0000 2020|I am proud to have the support of the @NRA! I will always be committed to protecting our 2nd Amendment rights.… https://t.co/NbymujSc29|en|R|114|615
1310801892868464642|779104195|Tue Sep 29 04:41:39 +0000 2020|"Our nation is one of great second chances!

https://t.co/DqGqwKpLBc"|en|R|361|2409
1310724726311051271|779104195|Mon Sep 28 23:35:01 +0000 2020|To keep Americans safe, we need to secure our border - and fast. Sign the petition &amp; RT if you agree. #UT04 https://t.co/u9E36QsVs6|en|R|64|217
1310666832337084417|779104195|Mon Sep 28 19:44:58 +0000 2020|A truck crashed into my campaign’s headquarters, leaving half of it as a pile of bricks. Our staff &amp; volunteers wer… https://t.co/Dau7hcYFKu|en|R|384|792
1310365148943589376|779104195|Sun Sep 27 23:46:11 +0000 2020|https://t.co/UhE36K9P9N|und|R|16|84
1310258907802198016|779104195|Sun Sep 27 16:44:01 +0000 2020|Today on #GoldStarMothersDay, let us honor the mothers of our fallen heroes. May we never forget their sacrifice. https://t.co/yfhxcjyflp|en|R|55|305
1310093102355423232|779104195|Sun Sep 27 05:45:10 +0000 2020|Thankfully everyone is safe after a runaway truck drove into our headquarters. We're not slowing down! Still knocki… https://t.co/Fmsiv8cf4E|en|R|1208|5114
1309972757392785408|779104195|Sat Sep 26 21:46:58 +0000 2020|President @realDonaldTrump has officially nominated Amy Coney Barrett to the Supreme Court! SIGN YOUR NAME if you a… https://t.co/FkvuWrD5IO|en|R|100|761
1309713770592309250|779104195|Sat Sep 26 04:37:50 +0000 2020|"It's funny, the most racist comments I've ever seen come from people that have a ""black lives matter"" banner on the… https://t.co/Egc6WIPYKg"|en|R|1381|6332
1309690231176617984|779104195|Sat Sep 26 03:04:18 +0000 2020|Thank you @realDonaldTrump for your plan for black America. For too long politicians have pandered, you went to work.|en|R|1399|6083
1309628856131870721|779104195|Fri Sep 25 23:00:25 +0000 2020|Join me in the fight to protect the American Promise. Learn more about me and what I stand for at… https://t.co/oq4ZNt8iEX|en|R|96|344
1309565591162945539|779104195|Fri Sep 25 18:49:02 +0000 2020|What an “honor” to share this special time with true American loving Warriors https://t.co/hPv5HAh3KN|en|R|96|501
1309553597022003201|779104195|Fri Sep 25 18:01:22 +0000 2020|Does anyone trust @SpeakerPelosi ? So when she sees it fit to spend $7 million +- spreading negative messages in Ut… https://t.co/veNZXykAeD|en|R|140|682
1309552128549990400|779104195|Fri Sep 25 17:55:32 +0000 2020|Prayers going out for @RonPaul , @DrRandPaul  and their entire family.|en|R|194|1637
1309514256849739776|779104195|Fri Sep 25 15:25:03 +0000 2020|Are you on #TeamBurgess? Let's make it official! Show your support for Burgess today by officially endorsing him he… https://t.co/KrsY8CB0mH|en|R|69|294
1309150856063987714|779104195|Thu Sep 24 15:21:01 +0000 2020|Make your voice heard this election. Information on where &amp; how to vote is available at the link. https://t.co/RBOn9B9nUI|en|R|82|346
1308937701584973826|779104195|Thu Sep 24 01:14:01 +0000 2020|I am on a mission to end human trafficking in our state and nation, and I need your help to get it done. https://t.co/8dytHpvftb|en|R|142|744
1308811625080614912|779104195|Wed Sep 23 16:53:02 +0000 2020|It's time we elect leaders who care about more than just being reelected.|en|R|412|2567
1308788472250077185|779104195|Wed Sep 23 15:21:02 +0000 2020|https://t.co/dLhQZWkeUu|und|R|87|452
1308550454335463429|779104195|Tue Sep 22 23:35:14 +0000 2020|For me, out of failure came growth. That’s the America I’m fighting for, and why I need your support for my campaig… https://t.co/36hZXtFgXP|en|R|318|1447
1308451515217121281|779104195|Tue Sep 22 17:02:05 +0000 2020|It's National #VoterRegistrationDay! Are you registered?? https://t.co/XnyrjqDpCC|en|R|66|347
1308248879561756673|779104195|Tue Sep 22 03:36:53 +0000 2020|Children deserve the best education possible, regardless of zip code.|en|R|1461|9415
1308202859264200706|779104195|Tue Sep 22 00:34:01 +0000 2020|The American Government must always put Americans first. https://t.co/US2Lxb698Z|en|R|192|881
1308154793987317760|779104195|Mon Sep 21 21:23:01 +0000 2020|The double standards never cease to amaze me. https://t.co/xM3GCinvKt|en|R|439|1801
1307710009799839744|779104195|Sun Sep 20 15:55:37 +0000 2020|It is such an honor to have the endorsement of the @nrlc PAC. Defending life will be my duty and responsibility as… https://t.co/p7mgRTLr0g|en|R|101|556
1307423977602715650|779104195|Sat Sep 19 20:59:01 +0000 2020|Slavery still exists in our world. Many times, we don't even know it's going on in our own backyards. That's why I'… https://t.co/o5tnjiA1Uj|en|R|260|1477
1307339170822729729|779104195|Sat Sep 19 15:22:02 +0000 2020|"I'm tired of the ""woke"" mob dividing us. Aren't you? https://t.co/KkaQqszJTq"|en|R|368|1659
1307116065906929665|779104195|Sat Sep 19 00:35:29 +0000 2020|RIP Justice Ginsburg, as a father of 5 daughters I am grateful for your example to them of what can be achieved.|en|R|310|3781
1307070387000406021|779104195|Fri Sep 18 21:33:59 +0000 2020|I will always be thankful for the American promise.|en|R|258|1975
1307021877945282560|779104195|Fri Sep 18 18:21:13 +0000 2020|The American promise is that you can take a risk, fail, grow, and still come back and succeed. We must protect that. https://t.co/ZoGmKy3bpN|en|R|336|1312
1307000199278100481|779104195|Fri Sep 18 16:55:05 +0000 2020|Let us never forget the sacrifices made by the brave souls who have fought for our country, and those who never cam… https://t.co/b5wxq3zwGw|en|R|183|935
1306944844452028416|779104195|Fri Sep 18 13:15:07 +0000 2020|Wishing a happy birthday to the United States Air Force! May God bless all those who serve &amp; have served throughout… https://t.co/qzhmhonOj9|en|R|165|937
1306774699712618496|779104195|Fri Sep 18 01:59:01 +0000 2020|"""Defund the police"" is a dangerous and absurd movement. In DC, I pledge to defend our brothers and sisters in Blue… https://t.co/q3lLuheme2"|en|R|143|957
1306600991232385025|779104195|Thu Sep 17 14:28:46 +0000 2020|I'm proud to support the malouffoundation's new IAmOnWatch initiative. OnWatch is a survivor-led human trafficking… https://t.co/JgNjrMrViC|en|R|61|259
1306581930461335553|779104195|Thu Sep 17 13:13:01 +0000 2020|Cheers to our nation's Constitution, one of the most important documents in history, and to all those who have beco… https://t.co/M4H9a29bRm|en|R|128|618
1306293804715184129|779104195|Wed Sep 16 18:08:07 +0000 2020|"Learn how, when &amp; where to vote at the link! 
Remember, voting isn't just your right...it's your patriotic duty.… https://t.co/UVhjDCdrNJ"|en|R|54|256
1306251515741573122|779104195|Wed Sep 16 15:20:04 +0000 2020|https://t.co/LQaJZFd5w5|und|R|274|1575
1306020144620220423|779104195|Wed Sep 16 00:00:41 +0000 2020|America is the greatest country in the world. Do not let anyone tell you otherwise. https://t.co/DKcVCmx0A1|en|R|705|2868
1305975710029283328|779104195|Tue Sep 15 21:04:07 +0000 2020|There @BenMcAdams goes again ignoring the facts in the name of political grandstanding. No one is arguing the devas… https://t.co/kq0Q6j83Ro|en|R|56|229
1305940292160204801|779104195|Tue Sep 15 18:43:23 +0000 2020|Challenge to @TulsiGabbard ... find one time ANYONE mentioned explosive nuclear testing. It's been banned since the… https://t.co/PlKkR26J8O|en|R|171|761
1305919565637935104|779104195|Tue Sep 15 17:21:01 +0000 2020|My opponent votes with @NancyPelosi 85% in DC. Is that who told him to lie and say @realdonaldtrump is resuming a n… https://t.co/ghtwH1QsEx|en|R|362|1409
1305915035412201472|779104195|Tue Sep 15 17:03:01 +0000 2020|Want to know where I stand on the issues? I'm an open book. Read my thoughts on the important issues we face as a s… https://t.co/zgHs1b9zgG|en|R|38|170
1305894614960726024|779104195|Tue Sep 15 15:41:53 +0000 2020|I don't think my opponent is a bad guy, but he's obviously been in politics too long if his moral compass is ok wit… https://t.co/myX0c3CnxG|en|R|135|658
1305883520686985223|779104195|Tue Sep 15 14:57:48 +0000 2020|Dangerous pathetic fear mongering.  A sitting Congressman is actually trying to make people believe Republicans wan… https://t.co/DTAlFtWiGw|en|R|487|1640
1305686021833662464|779104195|Tue Sep 15 01:53:00 +0000 2020|Only 50 days until Election Day! Can you chip in $50 to help #TeamBurgess ensure an Election Day win? https://t.co/IHu3H1v7Wc|en|R|49|194
1305670066797555713|779104195|Tue Sep 15 00:49:36 +0000 2020|I don't want perfect people in office, I don't want people who have an answer to everything.... I just want someone… https://t.co/LvY2a1bDRs|en|R|1274|7468
1305638673795383296|779104195|Mon Sep 14 22:44:52 +0000 2020|I will always listen to and support the needs of our small businesses here in Utah. Thanks for your support, Justin… https://t.co/o9A8A5d3nd|en|R|77|362
1305342827002359809|779104195|Mon Sep 14 03:09:16 +0000 2020|So we're allowed to gather in large groups to protest racism... Isn't a rally for @realDonaldTrump also protesting the racism of @JoeBiden ?|en|R|1310|6701
1305337415230390273|779104195|Mon Sep 14 02:47:46 +0000 2020|"Who wants to help me fire Nancy Pelosi?

https://t.co/5oDSDKdUBk"|en|R|371|1673
1305292690871914497|779104195|Sun Sep 13 23:50:03 +0000 2020|So Mr. Biden do you anticipate gun laws being as effective as drug laws? I mean we haven't had any drug problems si… https://t.co/qvjsF8fRd9|en|R|505|2864
1305189036093353984|779104195|Sun Sep 13 16:58:10 +0000 2020|I am not a token. I am just part of a movement that will be seen loud and clear on election day.|en|R|6760|38089
1305166528946475008|779104195|Sun Sep 13 15:28:43 +0000 2020|"Nancy Pelosi's pac is spending millions in ads against me...

Shouldn't that win some votes knowing how badly… https://t.co/N2lDDzCHN5"|en|R|6334|23660
1304968859686858753|779104195|Sun Sep 13 02:23:15 +0000 2020|Americans are innovative, our small business owners want to succeed which drives them to make sure their customers… https://t.co/FOFEm3NWnS|en|R|138|564
1304939775179194368|779104195|Sun Sep 13 00:27:41 +0000 2020|"Look you ""woke"" hipsters, calling every person who isn't on board with the Green New Deal a ""white supremacist"" is… https://t.co/yjTpujD8ZC"|en|R|5023|22186
1304882730975535104|779104195|Sat Sep 12 20:41:01 +0000 2020|We live in a country where we’re encouraged to “Dream Big,” and where second chances are at the core of our America… https://t.co/EqwfuF7ElR|en|R|176|949
1304827414732664832|779104195|Sat Sep 12 17:01:12 +0000 2020|I'm so glad after living through segregation and the racial tensions of the 60's that I now have woke white college… https://t.co/HLTeGsIYiA|en|R|13425|56774
1304804499824009216|779104195|Sat Sep 12 15:30:09 +0000 2020|From Super Bowl Champion to Utah's Champion in Congress. SHARE if you're on #TeamBurgess! https://t.co/Hxy6AtelDN|en|R|294|1134
1304798116915281920|779104195|Sat Sep 12 15:04:47 +0000 2020|Race does not dictate thought.|en|R|1191|8129
1304795729710297090|779104195|Sat Sep 12 14:55:18 +0000 2020|AND..had the lowest unemployment for Blacks, Hispanics, Asians, Women, Teens &amp; Vets in the history of the USA. Also… https://t.co/tEUQh7TuPQ|en|R|162|557
1304672162482016258|779104195|Sat Sep 12 06:44:17 +0000 2020|This guy may not realize it's the other guy running for president who fought for segregation and praised a KKK lead… https://t.co/JaNNvadKbQ|en|R|1004|4500
1304651034250211328|779104195|Sat Sep 12 05:20:20 +0000 2020|While I think the criticism on the article is very fair. I'm noticing a lot of personal attacks on Andy I don't bel… https://t.co/UkoQ9kOXWI|en|R|29|492
1304628106632687616|779104195|Sat Sep 12 03:49:14 +0000 2020|This is sickening, disturbing and must be stood up to. I'm thankful for voices like @TulsiGabbard standing up again… https://t.co/ISrnSOmrxL|en|R|1114|5490
1304612154901897218|779104195|Sat Sep 12 02:45:50 +0000 2020|"Love having BLM Inc. and the riots ""whitesplained"" to me by a reporter who accuses someone who's lived through whit… https://t.co/p8MOZmihKS"|en|R|1750|7807
1304604617351868416|779104195|Sat Sep 12 02:15:53 +0000 2020|"How much do ""black lives matter"" to the people upset that a good man donated to the states ONLY BLACK CANDIDATE run… https://t.co/vSvpM3N3VG"|en|R|1968|7673
1304172642446970885|779104195|Thu Sep 10 21:39:22 +0000 2020|"Can't wait to start reading 'Liberal Privelege' from my friend @DonaldJTrumpJr 

https://t.co/1bsvrueUaR"|en|R|25|131
1304082966121984001|779104195|Thu Sep 10 15:43:02 +0000 2020|Today and every day, let us remind those who are suffering that they are not alone, and let us recommit ourselves t… https://t.co/iTm1eGozwD|en|R|79|318
1303797194177286144|779104195|Wed Sep 09 20:47:29 +0000 2020|Thanks for your support, @AWinderNewton. I am looking forward to working together and serving the people of Utah! https://t.co/SpiMs8iC2G|en|R|38|195
1303745291699384320|779104195|Wed Sep 09 17:21:14 +0000 2020|If someone is willing to roll in the mud to get elected, they probably shouldn't be in office.|en|R|45|494
1303723280465932289|779104195|Wed Sep 09 15:53:46 +0000 2020|"Biden is optimistically hoping data strategists agree that Trump voters ""ain't black"", because he is going down in… https://t.co/85RjDUmILb"|en|R|146|780
1303710267482800133|779104195|Wed Sep 09 15:02:04 +0000 2020|It's past time we end America's dependence on China, bring jobs home, and hold China accountable for their actions.… https://t.co/R3UplCVGAW|en|R|36|205
1303707141207777280|779104195|Wed Sep 09 14:49:38 +0000 2020|We are a people of empathy. We root for the little guy, our government doesn't always reflect that.|en|R|112|969
1303461151699656704|779104195|Tue Sep 08 22:32:10 +0000 2020|We need to have the back of our small business owners. People have had to close their doors permanently through no… https://t.co/ERflLgK6ZA|en|R|360|1415
1303461115679121408|779104195|Tue Sep 08 22:32:01 +0000 2020|It's time to secure our borders and #FinishTheWall. Do you agree? Sign your name on the petition:… https://t.co/OCSmzEnOdI|en|R|27|115
1303363826817970177|779104195|Tue Sep 08 16:05:26 +0000 2020|I carry the physical scars of racism. I know what racism looks like. I'm tired of the far left manipulating it for political gain.|en|R|804|3653
1303353927719501829|779104195|Tue Sep 08 15:26:06 +0000 2020|We are being told burning businesses is noble, but opening businesses is murder. All because division is good for politics. This is insane.|en|R|2381|7722
1303099453646102528|779104195|Mon Sep 07 22:34:54 +0000 2020|"I'm hoping to vote in a new speaker in 2021. Who's with me?

#firepelosi"|en|R|7122|42720
1303096483890176000|779104195|Mon Sep 07 22:23:06 +0000 2020|Now more than ever it's imperative that Americans stand up, reject the mob mentality and make sure we don't mess things up for our children.|en|R|239|1160
1303092701567410176|779104195|Mon Sep 07 22:08:05 +0000 2020|#burgess4utah|und|R|72|387
1303029860449746944|779104195|Mon Sep 07 17:58:22 +0000 2020|There was a time when democrats claimed to be anti war, claimed to support criminal justice reform and claimed to b… https://t.co/Xkyp7lPbre|en|R|296|1138
1303022720939032576|779104195|Mon Sep 07 17:30:00 +0000 2020|We have an epidemic of anti-Semitism. Celebrities and politicians say horrendous things about our Jewish friends wh… https://t.co/EjOvhDsqMV|en|R|2681|11312
1303002622211678208|779104195|Mon Sep 07 16:10:08 +0000 2020|"""The nine most terrifying words in the English language are: I'm from the Government, and I'm here to help. ""

Ronald Reagan"|en|R|616|2953
1302986258638082048|779104195|Mon Sep 07 15:05:07 +0000 2020|Thank you to laborers across our great state &amp; nation for your hard work &amp; many contributions throughout our nation… https://t.co/2MwVGs6uk6|en|R|45|247
1302789096385863680|779104195|Mon Sep 07 02:01:39 +0000 2020|"I learn outlandish new things about myself everyday from the press... so forgive me if I'm slightly skeptical of ""anonymous sources""..."|en|R|371|2459
1302756817441783812|779104195|Sun Sep 06 23:53:23 +0000 2020|My great great grandfather came here in the belly of a slave ship, and now his great great grandson is running for… https://t.co/pUps9BwEsP|en|R|1086|4931
1302751331652759552|779104195|Sun Sep 06 23:31:36 +0000 2020|One party tells me I'm not black if I think for myself, nominates a man who praised a klan leader decades after fig… https://t.co/3N6LQqfVwr|en|R|5247|17034
1302716210283413504|779104195|Sun Sep 06 21:12:02 +0000 2020|Hope you and your families are having a blessed Sunday. https://t.co/CZ6sn5MDst|en|R|53|407
1302409582539538432|779104195|Sun Sep 06 00:53:36 +0000 2020|Who would love to see Nancy Pelosi lose her power?|en|R|7912|65015
1302328609105821696|779104195|Sat Sep 05 19:31:51 +0000 2020|There was a time when real racism was fought. Now, it's become something you yell anytime someone has a conservative view point.|en|R|3172|14761
1302326384879116293|779104195|Sat Sep 05 19:23:00 +0000 2020|Last week, I shared my story with the American People at the @GOPconvention.  I invite everyone - and especially my… https://t.co/6QNuA4KS6U|en|R|57|268
1302316781927714817|779104195|Sat Sep 05 18:44:51 +0000 2020|Here in America we look at each other inside out not outside in... don't let the media change that.|en|R|401|1962
1302092596928536577|779104195|Sat Sep 05 03:54:01 +0000 2020|Slavery still exists, and I'm on a mission to stop it. Sign the petition if you're on board with stopping human tra… https://t.co/an16IHbUQy|en|R|170|647
1302064418558152705|779104195|Sat Sep 05 02:02:03 +0000 2020|"On a daily basis I'm called an ""uncle Tom"", ""House Slave"", Coon, and other vulgar epithets I'm not comfortable ment… https://t.co/5EVhlRZu40"|en|R|4189|16148
1302049802843090944|779104195|Sat Sep 05 01:03:58 +0000 2020|Career politicians use the tactic of filling the media with lies nonstop to distract from the message. I won't allo… https://t.co/mUWP1ZQe5N|en|R|190|764
1302015592191406081|779104195|Fri Sep 04 22:48:02 +0000 2020|...and we're just getting started. https://t.co/ZPyP0J8mpd|en|R|78|294
1302007829746921472|779104195|Fri Sep 04 22:17:11 +0000 2020|I don't doubt @teamjonia2020 &amp; @Gear6A @BenMcAdams are genuinely good people. We have an opportunity to show how go… https://t.co/1gRtOZfiCM|en|R|32|111
1301983656299229184|779104195|Fri Sep 04 20:41:08 +0000 2020|It's seems like the DNC thinks hyperbolic fear mongering is the key to winning.|en|R|529|2715
1301627784561930240|779104195|Thu Sep 03 21:07:01 +0000 2020|"#TBT to sharing my story last week at the @GOPconvention

I’m running for Congress because we don’t need more caree… https://t.co/3Wh8Ug4iQ0"|en|R|39|193
1301318483997843456|779104195|Thu Sep 03 00:37:58 +0000 2020|"#TBT to sharing my story last week at the @GOPConvention. 

I’m running for Congress because we don’t need more car… https://t.co/ybYd0OXb6n"|en|R|45|224
1301312720843702272|779104195|Thu Sep 03 00:15:04 +0000 2020|RT if you agree. https://t.co/6JQWg15jq8|en|R|1278|4093
1301171803813969921|779104195|Wed Sep 02 14:55:07 +0000 2020|I am committed to protecting our children, stopping human trafficking, and getting these heinous offenders off our… https://t.co/hiD0eHnZYw|en|R|83|396
1300976297234042882|779104195|Wed Sep 02 01:58:14 +0000 2020|ANYTHING is possible in America. https://t.co/khKPmywNbT|en|R|654|3416
1300898461437452288|779104195|Tue Sep 01 20:48:57 +0000 2020|Unbelievable. Do as I say, not as I do. #DemLeadership https://t.co/UTqRXK0adU|en|R|103|547
1300841101096611840|779104195|Tue Sep 01 17:01:01 +0000 2020|I STAND for the flag, now and always. Sign your name if you do, too. https://t.co/2WmUvbRLkL|en|R|307|2092
1300611085045817344|779104195|Tue Sep 01 01:47:01 +0000 2020|This November, we have an opportunity to stand up for the American Dream once and for all. Are you with me? https://t.co/S56ASWNTtZ|en|R|581|2575
1300535838242213888|779104195|Mon Aug 31 20:48:01 +0000 2020|The end of the month is TODAY! Will you help Team Burgess meet our August fundraising goal and hit the ground runni… https://t.co/tEwrpNZRSP|en|R|20|78
1300128887632850944|779104195|Sun Aug 30 17:50:56 +0000 2020|Republicans, Democrats and Independents. This is the time to unite and ask ourselves what direction we want our cou… https://t.co/grLqFKZ3MD|en|R|960|4506
1299786951269076992|779104195|Sat Aug 29 19:12:12 +0000 2020|White democrats keep telling me how racist @realDonaldTrump is... Black democrats keep telling me how excited they… https://t.co/G6tW5Ih6N9|en|R|3531|14422
1299727106285289473|779104195|Sat Aug 29 15:14:24 +0000 2020|So @KingJames you're about social justice? You want change? Call on the @NBA to end their relationship with China.… https://t.co/4XSlqtk2dy|en|R|4802|20646
1299716655832993798|779104195|Sat Aug 29 14:32:52 +0000 2020|We have a Democrat candidate for President who says that I'm not Black if I don't vote for him. Now more than ever… https://t.co/aZNZ4vh5fV|en|R|196|825
1299524124579041280|779104195|Sat Aug 29 01:47:49 +0000 2020|How many elected officials over the years lied, destroyed opponents lives to get elected and were just terrible? Ru… https://t.co/bBZg1AjrzL|en|R|479|2212
1299475707874086914|779104195|Fri Aug 28 22:35:26 +0000 2020|America is the land of opportunity - anything is possible. https://t.co/dYMlqHn96D|en|R|377|2150
1299443879553323009|779104195|Fri Aug 28 20:28:58 +0000 2020|I'm not running against someone. I'm running for something.|en|R|2156|13201
1299372377176907778|779104195|Fri Aug 28 15:44:50 +0000 2020|If they cared about reform at all, they'd realize @RandPaul has likely worked harder to reform our criminal justice… https://t.co/JMcwT5TWD2|en|R|515|1733
1299162609803915264|779104195|Fri Aug 28 01:51:18 +0000 2020|Love @jonboldted this guy always has very thoughtful pieces. https://t.co/LiHk0OvwSs|en|R|20|91
1299088126392938496|779104195|Thu Aug 27 20:55:19 +0000 2020|We know better! https://t.co/HD0dbV2xy3|en|R|493|2882
