id|user|created_at|text|lang|label|retweet_count|favorite_count
1108299714154291200|38254095|Wed Mar 20 09:30:17 +0000 2019|I am proud of the people who worked so hard on the entries. Don’t miss your chance to vote. Today is the last day t… https://t.co/TnntbAGQuc|en|D|5|13
1108162126068121600|38254095|Wed Mar 20 00:23:34 +0000 2019|Met with experts on behavioral health reform in our region today. The stigma surrounding mental health &amp; substance… https://t.co/FtjcPAQAUe|en|D|5|17
1108096168523980801|38254095|Tue Mar 19 20:01:28 +0000 2019|In honor of #WomensHistoryMonth, we recognize Maya Angelou, whose enduring work as an artist, poet, and Civil Right… https://t.co/FEUY3zJPd8|en|D|1|1
1108081090097348609|38254095|Tue Mar 19 19:01:33 +0000 2019|Spoke at @UCDavis this morning during the @3Rev_ITSDavis Conference. Looking forward to seeing what great innovativ… https://t.co/ETaz5gy9RH|en|D|3|24
1108021806567350273|38254095|Tue Mar 19 15:05:59 +0000 2019|Heading out to the @3Rev_ITSDavis Conference @UCDavis where we’ll be talking about innovation! #3Revolutions|en|D|1|6
1107772568310829056|38254095|Mon Mar 18 22:35:36 +0000 2019|I am proud of my friend @mulvaneyp for raising awareness and advocating for access to mental health and substance u… https://t.co/aiCqSwIoVB|en|D|3|23
1107679637457510402|38254095|Mon Mar 18 16:26:19 +0000 2019|Glad to speak at the Capital Region Executive Leadership Mission about the #Sacramento region leading on innovation… https://t.co/wzZe3hyt8R|en|D|4|12
1106978556511481858|38254095|Sat Mar 16 18:00:29 +0000 2019|I am proud that during #WomensHistoryMonth #Sacramento is getting the recognition it deserves as one of the best pl… https://t.co/aL0VsIxwDc|en|D|6|21
1106668897011408896|38254095|Fri Mar 15 21:30:00 +0000 2019|Yesterday, I introduced the Diesel Emissions Reduction Act (DERA) with my colleagues @RepLowenthal  @USRepLong &amp;… https://t.co/jc6m1QZ4f5|en|D|10|13
1106623599690072064|38254095|Fri Mar 15 18:30:00 +0000 2019|The tragedy in New Zealand is heartbreaking. We mourn the deaths of the 49 people killed and pray for the dozens of… https://t.co/IwL8PehheY|en|D|1|13
1106616471508144128|38254095|Fri Mar 15 18:01:41 +0000 2019|Jeannette Rankin was elected as the first woman in the House of Representatives in 1916 paved the way for the diver… https://t.co/6Yote03jwp|en|D|4|10
1106245159795200000|38254095|Thu Mar 14 17:26:13 +0000 2019|I just spoke about new #healthcare legislation I introduced today to extend and expand the funding for a program th… https://t.co/WLN3meLvzV|en|D|5|18
1105904724405075968|38254095|Wed Mar 13 18:53:27 +0000 2019|We all have a right to freedom and equality regardless of race, sex, age, and sexual orientation. That’s why I’m co… https://t.co/ZgeVkARxlp|en|D|2|17
1105845907155832833|38254095|Wed Mar 13 14:59:44 +0000 2019|Yesterday, I spoke out against President Trump’s 2020 budget that makes severe cuts to #Medicaid and the critical… https://t.co/sWZjVtGHU5|en|D|2|20
1105545182697668608|38254095|Tue Mar 12 19:04:46 +0000 2019|DACA recipients, individuals with TPS and DED are all dreamers who are trying to build a better life for themselves… https://t.co/sChR2V0MrD|en|D|12|21
1105530512691613697|38254095|Tue Mar 12 18:06:28 +0000 2019|Today I hosted the first Spectrum Caucus event this year. Thanks to FCC commissioners @JRosenworcel and @mikeofcc f… https://t.co/VNskqJVSPA|en|D|6|11
1105273089078775808|38254095|Tue Mar 12 01:03:34 +0000 2019|Proud to receive the Javits Award from the @APAPsychiatric tonight for my work improving access to #healthcare serv… https://t.co/BhNe0FJWkw|en|D|8|36
1105209844636758016|38254095|Mon Mar 11 20:52:15 +0000 2019|Great to meet with #Sacramento area firefighters today! https://t.co/E9x2VmKCPj|en|D|1|13
1104121482454675457|38254095|Fri Mar 08 20:47:29 +0000 2019|Happy #InternationalWomensDay! I’m proud of the progress and accomplishments women around the world have made to mo… https://t.co/jYK2oemteZ|en|D|4|10
1104108652200366080|38254095|Fri Mar 08 19:56:30 +0000 2019|Shirley Chisholm - one of the groundbreaking pioneers of Congress  #InternationalWomensDay https://t.co/H0pI75zVN9|en|D|2|5
1104094433132261376|38254095|Fri Mar 08 19:00:00 +0000 2019|Earlier this week, I questioned Peter Lee from @CoveredCA about the Trump Administration’s junk #healthcare plans,… https://t.co/pfoT5emubR|en|D|4|17
1103795210285391872|38254095|Thu Mar 07 23:11:00 +0000 2019|I spoke yesterday about ways to make #healthcare more affordable and drew attention to the Trump Administration’s j… https://t.co/Qn27xuNHtB|en|D|3|18
1103769864328671233|38254095|Thu Mar 07 21:30:17 +0000 2019|As the Congresswoman representing the #Sacramento community, I am proud that we have over 30 dedicated women leader… https://t.co/7i9BxzjR3q|en|D|9|32
1103368466764042240|38254095|Wed Mar 06 18:55:16 +0000 2019|I will be joining my colleagues in the effort to codify net neutrality protections for all Americans https://t.co/VvQ2UvBFcL|en|D|2|13
1103027866818744321|38254095|Tue Mar 05 20:21:51 +0000 2019|Great to meet with former #Sacramento Mayor Heather Fargo and advocates to discuss patients living with Multiple Sc… https://t.co/yQ4UWlvMCa|en|D|1|11
1102607133344841728|38254095|Mon Mar 04 16:30:00 +0000 2019|March is #WomensHistoryMonth where we reflect on the amazing progress and contributions women have made to our comm… https://t.co/6dYx1Y64cs|en|D|3|7
1101158294230654976|38254095|Thu Feb 28 16:32:50 +0000 2019|I look forward to co-sponsoring this critical legislation. #DreamAct https://t.co/jApm9Yp9uM|en|D|6|18
1100867504971354123|38254095|Wed Feb 27 21:17:20 +0000 2019|I’m proud to stand with my Democratic colleagues today to say enough is enough, it’s time to #EndGunViolence now. W… https://t.co/Xh9z3z3fZj|en|D|8|37
1100829166893711362|38254095|Wed Feb 27 18:45:00 +0000 2019|I’m please that we’re finally taking the critical action needed to combat the gun violence epidemic in our country.… https://t.co/hq8tKLWulc|en|D|6|12
1100813736997253120|38254095|Wed Feb 27 17:43:41 +0000 2019|Today the House is taking a historic step by voting in favor of universal background checks! #HR8 #EndGunViolence|en|D|5|14
1100519002810535936|38254095|Tue Feb 26 22:12:31 +0000 2019|Great meeting with SMUD today @SMUDUpdates https://t.co/H6yIwKlauB|en|D|1|5
1100496977589080068|38254095|Tue Feb 26 20:45:00 +0000 2019|The #PublicLands package is the biggest conservation agreement passed in years. 🌎 Today, @HouseDemocrats are voting… https://t.co/Fl5WkQWq7K|en|D|5|20
1100485656260870144|38254095|Tue Feb 26 20:00:01 +0000 2019|Participated in @EnergyCommerce hearing today on internet privacy.  It is important that we protect the privacy of Americans online.|en|D|5|7
1100478104907206656|38254095|Tue Feb 26 19:30:00 +0000 2019|Our #PublicLands package is a huge win for conservation &amp; the iconic treasures we all love 🌲 We’re passing this agr… https://t.co/4bWQRHVsgT|en|D|6|14
1100463005202972677|38254095|Tue Feb 26 18:30:00 +0000 2019|It’s time for change. The American people have had #enough of the gun violence in our communities. This week, the H… https://t.co/f0yAijz3LO|en|D|1|4
1100436579795886080|38254095|Tue Feb 26 16:45:00 +0000 2019|This week, the House will finally take action to confront America’s gun violence epidemic. The Bipartisan Backgroun… https://t.co/lQwInLoaMu|en|D|4|4
1100425462243840000|38254095|Tue Feb 26 16:00:49 +0000 2019|Today I introduced the Blockchain Promotion Act with my colleagues @RepGuthrie, @SenToddYoung and @SenMarkey https://t.co/mBRk5VgvaG|en|D|1|5
1100167226496307204|38254095|Mon Feb 25 22:54:41 +0000 2019|This is a made-up emergency to build an unpopular and wasteful border wall, which is taking money away from militar… https://t.co/mmzyu488tC|en|D|4|8
1100093069402222597|38254095|Mon Feb 25 18:00:01 +0000 2019|Today, I’m calling on Congress to fully fund the 9/11 Victim Compensation Fund and make it permanent, so that all 9… https://t.co/IUvFxuEXie|en|D|2|18
1099046180703690753|38254095|Fri Feb 22 20:40:03 +0000 2019|The Trump Administration's gag rule prevents millions of low-income women from getting access to the comprehensive… https://t.co/SD5Ah2xlPy|en|D|7|9
1098743270115487745|38254095|Fri Feb 22 00:36:23 +0000 2019|⁦@sacstate⁩ is an institutional leader in our region, constantly embracing new technology and finding unique ways t… https://t.co/GmuRRkUEmq|en|D|18|43
1098698382762070016|38254095|Thu Feb 21 21:38:01 +0000 2019|Today we celebrate innovation right at our fingertips. Olli shows the progressive mindset we have @SacState and the… https://t.co/aq6UE2atpK|en|D|6|19
1098674150497910784|38254095|Thu Feb 21 20:01:44 +0000 2019|Congrats @Chancellor_May on the @ucdavis collaboration with @IBM. The collaborative strategy embraced here means in… https://t.co/AJBfKwFLk8|en|D|10|44
1098630154828595204|38254095|Thu Feb 21 17:06:55 +0000 2019|Excited to speak at @sacstate today about driverless shuttles https://t.co/PywDoWiYWX|en|D|3|20
1098339346955071492|38254095|Wed Feb 20 21:51:21 +0000 2019|This day so beautifully symbolizes the American Dream. Today's new citizens help to create the patchwork of culture… https://t.co/7fsNVbHsOn|en|D|4|13
1098031222943506432|38254095|Wed Feb 20 01:26:58 +0000 2019|Met with our local community health center leaders today. We’ve worked hard to protect the #ACA, but there is more… https://t.co/Rn5SbGG0wi|en|D|1|13
1096468425105391618|38254095|Fri Feb 15 17:56:58 +0000 2019|I fought hard to ensure the safety of the #Sacramento region by working to make sure that $1.8 billion in flood pro… https://t.co/doZ8nirdY4|en|D|10|25
1096422418061709313|38254095|Fri Feb 15 14:54:09 +0000 2019|I spoke out last night about President Trump’s potential national emergency declaration and I will continue to defe… https://t.co/5g9GhX401R|en|D|10|42
1096144550014287872|38254095|Thu Feb 14 20:30:00 +0000 2019|Last night, for the first time in years, the Judiciary Committee voted for bipartisan legislation to… https://t.co/PUbpIZd78a|en|D|4|8
1096110170168528897|38254095|Thu Feb 14 18:13:23 +0000 2019|February 14th marks one year since the deadliest high school shooting in US History. We stand with the entire commu… https://t.co/pqPgiVSuu5|en|D|2|15
1095819526065803264|38254095|Wed Feb 13 22:58:29 +0000 2019|Proud to stand with my Democratic colleagues wearing red today to honor American Heart Month and bring attention to… https://t.co/U7RreeBC53|en|D|6|24
1095782161200885764|38254095|Wed Feb 13 20:30:00 +0000 2019|Basic health benefits such as access to prescription drugs and mental health treatment are in jeopardy if the Trump… https://t.co/6mvrBbTZXH|en|D|6|19
1095766022580105216|38254095|Wed Feb 13 19:25:52 +0000 2019|Thank you to the ⁦@AlzNorCalNorNev⁩ for stopping by today - I support your fight to #EndAlz with more funding for r… https://t.co/3bhyNKLIKD|en|D|8|19
1095736864126885889|38254095|Wed Feb 13 17:30:00 +0000 2019|The Trump Administration’s ACA sabotage undermines vital consumer protections, leaving the millions of Americans wi… https://t.co/mXQVOTfvjo|en|D|4|10
1095090137489436673|38254095|Mon Feb 11 22:40:09 +0000 2019|Proud of my friend Patrick for shining a light on the lack of mental health resources in the restaurant industry.   https://t.co/89MABNHXJk|en|D|3|19
1094022495642935296|38254095|Fri Feb 08 23:57:43 +0000 2019|John Dingell was a dear friend to me and my late husband Bob. It says something special about John that he served i… https://t.co/2VkvU6OE4a|en|D|3|27
1094005482828763142|38254095|Fri Feb 08 22:50:07 +0000 2019|"I won’t let the Trump Administration roll back these critical fuel efficiency standards. #ActOnClimate #CleanerCars
https://t.co/vEfwsssRiq"|en|D|5|19
1093914921572679680|38254095|Fri Feb 08 16:50:15 +0000 2019|#ClimateChange is real, and we must #ActOnClimate. That’s why I introduced the Clean and Efficient Cars Act this we… https://t.co/miKF6xg65e|en|D|3|8
1093691009387642882|38254095|Fri Feb 08 02:00:31 +0000 2019|I introduced the Clean and Efficient Cars Act to solidify the Obama era fuel efficiency standards into law.… https://t.co/DHIFN3jdjV|en|D|9|9
1093641843177414656|38254095|Thu Feb 07 22:45:08 +0000 2019|These fuel efficiency standards help reduce greenhouse gas emissions, protect #PublicHealth and save drivers money… https://t.co/eDdCHDQOXs|en|D|3|4
1093592887776956416|38254095|Thu Feb 07 19:30:37 +0000 2019|I won’t let the Trump Administration take us backwards in our fight to combat the climate crisis. It’s time to… https://t.co/2fid432Fau|en|D|4|6
1093553777125281794|38254095|Thu Feb 07 16:55:12 +0000 2019|We can’t go backwards in our fight to combat the climate crisis. I’m committed to defending these critical fuel eco… https://t.co/wCrB8x9UDi|en|D|4|13
1093287011350384641|38254095|Wed Feb 06 23:15:10 +0000 2019|The Trump Administration is trying to roll back critical environmental protections that’s why I’ve introduced the C… https://t.co/HLcgYWjoL9|en|D|6|7
1093219083573698562|38254095|Wed Feb 06 18:45:15 +0000 2019|#Climatechange is real, and we must #ActOnClimate now to address this crisis https://t.co/PAzRQSDFN5|en|D|7|13
1093183759636156418|38254095|Wed Feb 06 16:24:53 +0000 2019|#ClimateChange is a crisis we must address now. I’m proud to co-sponsor a bold vision #GreenNewDeal @AOC @SenMarkey… https://t.co/Ep7YCyAZZS|en|D|21|59
1092934066825879552|38254095|Tue Feb 05 23:52:41 +0000 2019|Great meeting with Jesus Limon Guzman and his wife Nellie. Jesus is joining me tonight for the #SOTU.  He’s a profe… https://t.co/pd3jTJ5VWS|en|D|14|46
1092893485009694720|38254095|Tue Feb 05 21:11:26 +0000 2019|Today, we wear suffragette white to send a strong message that we are fighting #ForThePeople and advancing women’s… https://t.co/pSjHL4U9TS|en|D|684|3168
1092876821710934016|38254095|Tue Feb 05 20:05:13 +0000 2019|These fuel efficiency standards protect the air we breathe, our health, and our pocket books. #ActOnClimate… https://t.co/iwDiUc5BQs|en|D|4|7
1092866425373499394|38254095|Tue Feb 05 19:23:54 +0000 2019|Proud to have Jesus join me for #sotu https://t.co/2FgCfh3fNC|en|D|6|41
1092838364020117504|38254095|Tue Feb 05 17:32:24 +0000 2019|I am pleased to announce my guest for #SOTU tonight will be Jesus Limon Guzman, an adjunct professor @sacstate, a l… https://t.co/iQ72cnbPdc|en|D|24|91
1092827735767040000|38254095|Tue Feb 05 16:50:10 +0000 2019|Congress must take action to preserve these important fuel efficiency standards that spur innovation in emission re… https://t.co/9O0sDgy16X|en|D|3|11
1092800556685500418|38254095|Tue Feb 05 15:02:10 +0000 2019|I’m proud to be introducing the Clean and Efficient Cars Act today, which will ensure that the Trump Administration… https://t.co/oEBfoG8qSG|en|D|6|14
1092558474175827974|38254095|Mon Feb 04 23:00:13 +0000 2019|A civil rights icon was born 106 years ago. #RosaParks changed the course of history by simply saying no.… https://t.co/LOkuBQkjFY|en|D|0|7
1092528052310077440|38254095|Mon Feb 04 20:59:20 +0000 2019|We’re celebrating #BlackHistoryMonth where we recognize the countless contributions African Americans have made to… https://t.co/DS7nGTlMxr|en|D|0|4
1092121999168593920|38254095|Sun Feb 03 18:05:49 +0000 2019|Great night at the 124th annual Sacramento Metro Chamber of Commerce dinner. Congratulations to all the awardees. W… https://t.co/fyb4HOG1rn|en|D|1|8
1091434818766696448|38254095|Fri Feb 01 20:35:13 +0000 2019|The 14th annual Women’s Heart Care Forum today is a great example of how to get the message out to all women: “Take… https://t.co/s7HUdH2Z9U|en|D|12|34
1091015813740531713|38254095|Thu Jan 31 16:50:14 +0000 2019|It’s time to close the pay gap by passing the #PaycheckFairness Act – remedying the fact that not all women are rec… https://t.co/QNVYw4drDC|en|D|2|8
1090780488430698497|38254095|Thu Jan 31 01:15:08 +0000 2019|It's past time for the #PaycheckFairness Act, which would help break harmful patterns of pay discrimination. The pu… https://t.co/l8yo5VqgxO|en|D|2|8
1090726784000249857|38254095|Wed Jan 30 21:41:44 +0000 2019|Proud to be appointed to Vice Chair of the @EnergyCommerce Telecom and Technology Subcommittee https://t.co/CsOpFO6nf4|en|D|5|21
1090713788947578891|38254095|Wed Jan 30 20:50:06 +0000 2019|I will fight to strengthen #SocialSecurity, I am proud to be an original cosponsor of Social Security 2100. #SECURE2100|en|D|2|17
1090695546044588032|38254095|Wed Jan 30 19:37:36 +0000 2019|Ten years after President Obama signed the Lilly Ledbetter #FairPay Act, women are still battling the #wagegap. It'… https://t.co/5AvZ9XmYwy|en|D|2|19
1090671108339257346|38254095|Wed Jan 30 18:00:30 +0000 2019|Great discussion with the @sacsheriff Youth Service Division about their community outreach work that supports posi… https://t.co/cFUm0gCGQh|en|D|3|14
1090338796737048578|38254095|Tue Jan 29 20:00:01 +0000 2019|Proud to stand with my #Democratic #House colleagues to support the Equal Rights Amendment (ERA) that guarantees ge… https://t.co/nWus2TNweK|en|D|8|17
1089918241525223424|38254095|Mon Jan 28 16:08:53 +0000 2019|"Wonderful event Saturday night
@SacState honoring #MLK.  Proud to award @vivek and @SacramentoKings the 2019 Robert… https://t.co/wOPwQtdMuf"|en|D|2|7
1088904813771935744|38254095|Fri Jan 25 21:01:53 +0000 2019|President Trump held our government hostage for far too long. We must pass this short-term spending bill immediatel… https://t.co/7kD8eizFeU|en|D|1|7
1088834628293672960|38254095|Fri Jan 25 16:22:59 +0000 2019|Yesterday, I highlighted the impacts the #TrumpShutdown is having on #Sacramento residents. #ShutdownStories… https://t.co/4YDNK9Cooe|en|D|1|9
1088541781669625856|38254095|Thu Jan 24 20:59:19 +0000 2019|Happy Birthday to my good friend @RepThompson https://t.co/SACBOZRDFh|en|D|0|4
1088523374224011264|38254095|Thu Jan 24 19:46:10 +0000 2019|Working with my two Mayors @Mayor_Steinberg @mayorcabaldon https://t.co/QZJgsyvqus|en|D|6|42
1088490761182539776|38254095|Thu Jan 24 17:36:35 +0000 2019|Congratulations to ⁦@elicahealth⁩ celebrating the grand opening of its new Halyard clinic in West Sacramento. It of… https://t.co/Mpxdx0tsIH|en|D|2|3
1088480361527398400|38254095|Thu Jan 24 16:55:15 +0000 2019|I will continue to do my job and vote for bipartisan bills that #EndTheShutdown. Now, Leader McConnell and Presiden… https://t.co/OnxiY67ips|en|D|3|10
1088217183174373377|38254095|Wed Jan 23 23:29:29 +0000 2019|I am so proud of the new American citizens we have today! As you celebrate this momentous occasion, know that I’m i… https://t.co/2XSVgvn8FH|en|D|0|12
1088194376038313984|38254095|Wed Jan 23 21:58:51 +0000 2019|I am honored to be re-appointed to the Smithsonian Board of Regents where I will continue to protect our national h… https://t.co/oKjUwjmHo9|en|D|2|22
1088163251052036097|38254095|Wed Jan 23 19:55:10 +0000 2019|Federal workers aren’t getting paid and small businesses can’t get the loans or permits they need. #EndTheShutdown https://t.co/legscANjQd|en|D|4|9
1088119297191350273|38254095|Wed Jan 23 17:00:31 +0000 2019|The government has been shut down for over a month and it’s taking a major toll on our economy. #EndTheShutdown https://t.co/UQ1arvEuMz|en|D|1|6
1087823203928436736|38254095|Tue Jan 22 21:23:57 +0000 2019|I’m still in our nation’s capitol working to #EndTheShutdown so congratulations to @DowntownSac for the great thing… https://t.co/ZKxYKs1DkX|en|D|2|16
1087477690385367040|38254095|Mon Jan 21 22:31:00 +0000 2019|On #MLKDay, we reflect on the unique strength, leadership and perseverance of #DrMartinLutherKingJr who never waver… https://t.co/kuwX5RjW1l|en|D|1|11
1087426673153212416|38254095|Mon Jan 21 19:08:16 +0000 2019|So proud of my friends, neighbors, and community honoring the legacy of #DrMartinLutherKing. We work every day to m… https://t.co/tiaI4IbbIA|en|D|1|8
1086746954711818240|38254095|Sat Jan 19 22:07:19 +0000 2019|#WomensMarch2019 Great that so many in Sacramento marched today! https://t.co/buZw0ln2m4|en|D|8|37
1086430565858009088|38254095|Sat Jan 19 01:10:06 +0000 2019|I joined my colleagues and sent a letter to President Trump regarding the millions of families at risk of being evi… https://t.co/FdPEKJH59q|en|D|6|27
1086379008709804032|38254095|Fri Jan 18 21:45:14 +0000 2019|It’s simple, our workers and our constituents need the government re-opened. #EndTheShutdown https://t.co/KneD8P5FBW|en|D|5|17
1086322491381956608|38254095|Fri Jan 18 18:00:39 +0000 2019|#Sacramento families are paying the price for the #TrumpShutdown. It’s time to get them back to work and our govern… https://t.co/BXxj0LGa5D|en|D|3|10
1086294700619976709|38254095|Fri Jan 18 16:10:13 +0000 2019|I’ve voted multiple times to re-open the government. It’s time for President Trump and Leader McConnell to… https://t.co/ZrqQd9zdpd|en|D|1|15
1086073232829014018|38254095|Fri Jan 18 01:30:11 +0000 2019|I will continue to vote to fully fund our government, now it’s time for the Senate and President Trump to re-open t… https://t.co/0icgMRB1om|en|D|7|20
1086048083249688576|38254095|Thu Jan 17 23:50:15 +0000 2019|Yesterday, I spoke out in @RulesDemocrats Committee about re-opening our government agencies so they can provide cr… https://t.co/wH0INX1Fab|en|D|5|20
1086030431798083584|38254095|Thu Jan 17 22:40:07 +0000 2019|27 days of the #TrumpShutdown has left American families wondering how they’ll cover their basic costs of living, l… https://t.co/X37MoOkYw3|en|D|0|4
1086014079574134791|38254095|Thu Jan 17 21:35:08 +0000 2019|This is the longest government shutdown in history and our furloughed federal workers are paying the price. It’s ti… https://t.co/kxrMq1VN9i|en|D|10|20
1085931755234910210|38254095|Thu Jan 17 16:08:00 +0000 2019|Honored to have been selected by the @nytimes for the cover of their special feature on the women of the… https://t.co/VCOzrCZoEt|en|D|37|202
1085710838613401600|38254095|Thu Jan 17 01:30:10 +0000 2019|House Democrats voted to provide over $12 billion in emergency funding to assist Americans impacted by national dis… https://t.co/GvuS4YtwhZ|en|D|2|17
1085676313317441536|38254095|Wed Jan 16 23:12:58 +0000 2019|Hey Sacramento! Be safe today. Leave work early if you can, get home safely, stay indoors, and make sure you have e… https://t.co/kpD4DvKpUz|en|D|4|11
1085568663774740491|38254095|Wed Jan 16 16:05:12 +0000 2019|I’m all for smart border security – but President Trump’s wall isn’t smart. It’s ineffective &amp; wasteful. And the wa… https://t.co/MIv73l4MkB|en|D|7|32
1085343402047295489|38254095|Wed Jan 16 01:10:06 +0000 2019|The #TrumpShutdown is putting hardworking Americans in dire situations. Why won’t President Trump and the #Senate… https://t.co/Pt57a8XG2U|en|D|4|5
1085309389920223232|38254095|Tue Jan 15 22:54:57 +0000 2019|#House #Democrats voted multiple times to re-open the government. Families &amp; businesses need the #Senate to hold a vote to #EndTheShutdown|en|D|5|10
1085261641963499523|38254095|Tue Jan 15 19:45:13 +0000 2019|Day 25 of the shutdown – making this the longest shutdown in our history. It’s time for President Trump and #Senate… https://t.co/p9a7uW3bp4|en|D|5|9
1085246522789371904|38254095|Tue Jan 15 18:45:08 +0000 2019|President Trump’s administration is #OutOfTouch about the real impacts the #TrumpShutdown is having on people’s liv… https://t.co/pmWgBV0Ic8|en|D|3|3
1085213835542384640|38254095|Tue Jan 15 16:35:15 +0000 2019|Reminder: Today is the last day to sign up for #health insurance on #California’s exchange @CoveredCA https://t.co/NGv8bpuOpi|en|D|3|6
1084905536867520512|38254095|Mon Jan 14 20:10:11 +0000 2019|It’s time to end the #TrumpShutdown by fully funding these critical government agencies to ensure our food, water,… https://t.co/U5Brlrllu7|en|D|4|11
1084622385611980800|38254095|Mon Jan 14 01:25:02 +0000 2019|I am fighting to keep #Sacramento’s flood protection funding for its intended purpose: Strengthening our levees and… https://t.co/gGLLGIRlEi|en|D|12|53
1084594705172754432|38254095|Sun Jan 13 23:35:03 +0000 2019|Don’t miss out on getting the critical #healthcare coverage you need! @CoveredCA https://t.co/gMXOjpj4Bd|en|D|1|1
1084251198369263619|38254095|Sun Jan 13 00:50:04 +0000 2019|It’s not too late to get covered @CoveredCA! #California’s #healthcare enrollment period is still open https://t.co/oLZEqsbXk1|en|D|5|3
1084193341015838722|38254095|Sat Jan 12 21:00:10 +0000 2019|President Trump is considering taking away funding for vital flood protection projects in #Sacramento and across th… https://t.co/RXsAhUCxj7|en|D|6|9
1083541535130615809|38254095|Fri Jan 11 01:50:07 +0000 2019|The #TrumpShutdown is hurting thousands of #Sacramento federal workers and small businesses. #EndTheShutdown https://t.co/kLBh5ETBCV|en|D|3|13
1083536493975605248|38254095|Fri Jan 11 01:30:05 +0000 2019|President Trump is considering taking #Sacramento’s flood protection funding away all to build his border wall, whi… https://t.co/bqaEfKkB8I|en|D|10|25
1083497504203829251|38254095|Thu Jan 10 22:55:10 +0000 2019|I joined @RepThompson and my fellow #California colleagues to call out President Trump for his cruel and inhumane t… https://t.co/3snqmeU9Gl|en|D|14|29
1083473581856751617|38254095|Thu Jan 10 21:20:06 +0000 2019|The #TrumpShutdown is putting the #health and safety of the American people at risk. #EndTheShutdown https://t.co/LN7cUMxI80|en|D|0|1
1083449706385211394|38254095|Thu Jan 10 19:45:14 +0000 2019|Day 20 of the #TrumpShutdown and it’s not only hurting our federal employees but costing our government &amp; damaging… https://t.co/b0JnlODvPH|en|D|5|9
