id|user|created_at|text|lang|label|retweet_count|favorite_count
887724550598930432|38254095|Wed Jul 19 17:23:20 +0000 2017|#SenecaFalls marked the beginning of the women’s suffrage movement; today we continue to fight for equality and build on their legacy.|en|D|3|17
887702861924192256|38254095|Wed Jul 19 15:57:09 +0000 2017|Watch my opening statement at today’s @EnergyCommerce subcommittee markup of self-driving cars legislation https://t.co/DdThBczvcV|en|D|2|7
887411555394101248|38254095|Tue Jul 18 20:39:36 +0000 2017|Because of the #CleanAirAct, we’ve reduced pollution and improved public health. I’m voting NO on Republican attempts to weaken it today.|en|D|6|18
887381204823154691|38254095|Tue Jul 18 18:39:00 +0000 2017|#GOPBudget fast tracks tax cuts for the wealthiest &amp; slashes funding for everything from Medicare to food stamps. https://t.co/qnd7qkb0EM|en|D|55|43
887315488052838400|38254095|Tue Jul 18 14:17:52 +0000 2017|It’s time for Republicans to stop their continued, cruel attempts to take health care away from millions of America… https://t.co/BlvPqqmdDa|en|D|4|14
887070297349902336|38254095|Mon Jul 17 22:03:34 +0000 2017|"#Trumpcare means:
-Higher Costs
-Less Coverage
-Key Protections Gutted
-A Crushing Age Tax
-Stealing from Medicaid"|en|D|20|27
887059176819740672|38254095|Mon Jul 17 21:19:23 +0000 2017|A must read from @JoeBiden on why we need to #ProtectOurCare: https://t.co/vorduaucIL|en|D|7|9
885911503819460608|38254095|Fri Jul 14 17:18:56 +0000 2017|Republicans continue to refuse to do their jobs and hold Trump Admin accountable. It’s time to #WakeUpGOP!|en|D|187|481
885627344219713536|38254095|Thu Jul 13 22:29:47 +0000 2017|Today, I shared my constituent Riley’s story, who wrote to me about how the ACA helped her grandmother have surgery… https://t.co/eM3x21ZROr|en|D|8|10
885589055861403649|38254095|Thu Jul 13 19:57:39 +0000 2017|Through Medicaid expansion, 1.6 mil Americans gained access to mental health &amp; substance abuse treatment; #Trumpcare defunds it.|en|D|9|4
885583671733964800|38254095|Thu Jul 13 19:36:15 +0000 2017|It’s all hands on deck to defeat #Trumpcare. I’m going to continue the fight to #ProtectOurCare!|en|D|5|27
885542493491691521|38254095|Thu Jul 13 16:52:37 +0000 2017|Thrilled by news that @WellSpaceHealth has received an over $1.2 million dollar grant to help run health centers in… https://t.co/SCacuLP5IM|en|D|3|11
885541589866627074|38254095|Thu Jul 13 16:49:02 +0000 2017|Senate Republican changes to their bill do not change fundamentals of #Trumpcare. Millions of Americans will suffer.|en|D|7|6
885495104127066112|38254095|Thu Jul 13 13:44:19 +0000 2017|"ICYMI:⚡️ “Net Neutrality Day of Action” by @EnergyCommerce

https://t.co/eihKS25gce"|en|D|3|9
885182895337484288|38254095|Wed Jul 12 17:03:42 +0000 2017|We’re raising our voices in support of strong #NetNeutrality rules that protect a free and open internet. https://t.co/cRgRjhoZkX|en|D|9|23
885147128523358209|38254095|Wed Jul 12 14:41:35 +0000 2017|#NetNeutrality is about protecting a free and open internet. Say no to online fast-lanes. https://t.co/A0lxtnH95B|en|D|10|11
885144971757617152|38254095|Wed Jul 12 14:33:01 +0000 2017|Don't wreck the net—stand up for a free and open internet. Protect #NetNeutrality https://t.co/xb2Wjv2Dq1|en|D|10|14
884832821541568513|38254095|Tue Jul 11 17:52:38 +0000 2017|My prayers are with the families and loved ones of the 16 service members killed in the tragic plane crash in Mississippi.|en|D|2|18
884536007126855680|38254095|Mon Jul 10 22:13:12 +0000 2017|Visit my Facebook page to learn more about my cover photo contest happening now -  the last day to submit photos is… https://t.co/OcxSVq2VT3|en|D|4|7
882591650593353728|38254095|Wed Jul 05 13:27:01 +0000 2017|Baby Boomers will be turning 80 about the same time that #Trumpcare's Medicaid cuts kick in. Our seniors can't affo… https://t.co/JqzOmxpcgL|en|D|594|739
882279018854322176|38254095|Tue Jul 04 16:44:44 +0000 2017|Happy 4th of July! As we celebrate #IndependenceDay, we honor the men and women who continue to protect our freedom.|en|D|9|27
880875303605809158|38254095|Fri Jun 30 19:46:52 +0000 2017|As Alzheimer’s &amp; Brain Awareness Month comes to a close, we will keep fighting for additional research funding to #ENDALZ|en|D|1|7
880826495148621824|38254095|Fri Jun 30 16:32:56 +0000 2017|Interested in learning more about what I’m working on? Be sure to follow me on Facebook and Instagram for updates! https://t.co/fpHKCn5gw1|en|D|0|2
880513654541733888|38254095|Thu Jun 29 19:49:49 +0000 2017|Introduced legislation today that helps reduce diesel emissions and improve air quality: https://t.co/QDN48GBYg0|en|D|5|13
880504228946620417|38254095|Thu Jun 29 19:12:21 +0000 2017|President Trump should do his job instead of constantly demeaning others. Enough.|en|D|15|65
880168860011438080|38254095|Wed Jun 28 20:59:43 +0000 2017|Congratulations @Chief_Hahn! https://t.co/2RuzzTXyDw|en|D|3|5
880079375626117120|38254095|Wed Jun 28 15:04:08 +0000 2017|Pleased to work on a bipartisan framework today for nuclear waste interim storage. Important for Sacramento's utility rates. #SMUD|en|D|7|15
879786884918018048|38254095|Tue Jun 27 19:41:53 +0000 2017|Your voices and your stories make a difference! Democrats are going to keep fighting to defeat this #Trumpcare bill. https://t.co/38bZsT0851|en|D|11|16
879469322627944448|38254095|Mon Jun 26 22:40:00 +0000 2017|Today we celebrate #LGBTEquality Day and recommit to working for full equality for all! #LoveIsLove https://t.co/o00rJKiYDW|en|D|6|18
879460808320851968|38254095|Mon Jun 26 22:06:10 +0000 2017|I urge my Republican colleagues to listen to their constituents and reject this harmful #Trumpcare legislation.… https://t.co/iPhamqlYdE|en|D|91|127
879454270113947650|38254095|Mon Jun 26 21:40:12 +0000 2017|CBO confirms Senate's cruel #Trumpcare bill will kick 22 million Americans off their coverage &amp; force families to pay more for less.|en|D|53|84
878272586551046144|38254095|Fri Jun 23 15:24:36 +0000 2017|Over 40% of children in California are covered under Medicaid &amp; CHIP. #ProtectMedicaid #KeepKidsCovered|en|D|4|5
878004269022052352|38254095|Thu Jun 22 21:38:24 +0000 2017|The Senate’s #Trumpcare bill puts the health and well-being of American families in jeopardy. https://t.co/JoG5IeNljc|en|D|11|13
877619628448428033|38254095|Wed Jun 21 20:09:59 +0000 2017|Thrilled property owners have helped us take next step w/ Sacramento’s streetcar project, which is critical to connectivity in our region|en|D|5|22
877270727459840001|38254095|Tue Jun 20 21:03:34 +0000 2017|Great example of Sacramento taking the lead in protecting our environment, improving public health, and boosting ou… https://t.co/QqCfPAHiPU|en|D|5|14
877265716868780033|38254095|Tue Jun 20 20:43:40 +0000 2017|Joining 195 other Members of Congress in standing against President Trump’s conflicts of interest. #NoOneAboveTheLaw https://t.co/5hn40L9qkz|en|D|5|18
877262917007290370|38254095|Tue Jun 20 20:32:32 +0000 2017|Welcoming people who come to our country for a better life is central to the American story. I am proud to stand #WithRefugees. #WRD2017|en|D|3|12
876891986732699648|38254095|Mon Jun 19 19:58:36 +0000 2017|.@SenateGOP effort to keep families in the dark about #Trumpcare is unacceptable &amp; irresponsible — Americans deserve transparency.|en|D|20|33
875398365151981569|38254095|Thu Jun 15 17:03:29 +0000 2017|#DACA gives young people an opportunity to pursue their American Dream. We must protect this critical program.|en|D|3|6
874971796633735168|38254095|Wed Jun 14 12:48:27 +0000 2017|My prayers are with @SteveScalise, my colleagues, their staff, and the Capitol Police after this morning’s horrific attack.|en|D|8|13
874657084473823232|38254095|Tue Jun 13 15:57:53 +0000 2017|Immigrants are a part of our American story and make our country stronger. #ImmigrantHeritageMonth #IStandWithImmigrants|en|D|5|13
874646894349361153|38254095|Tue Jun 13 15:17:24 +0000 2017|Thrilled to have @SiemensUSA representing the Sacramento region at today’s #IoT showcase! https://t.co/m5UdKLgAek|en|D|3|5
874391823850106880|38254095|Mon Jun 12 22:23:50 +0000 2017|Today we honor &amp; remember the 49 innocent lives lost at Pulse Nightclub, and commit to disarming hate.… https://t.co/8JqS7RxhEn|en|D|3|11
872913480071950336|38254095|Thu Jun 08 20:29:26 +0000 2017|#WrongChoiceAct would take us back to the days when predatory lenders abused consumers &amp; brought the economy to the… https://t.co/PcH6iFlgoG|en|D|5|12
872903081721303041|38254095|Thu Jun 08 19:48:07 +0000 2017|We are in the midst of a defining moment for our country &amp; we must #FollowTheFacts. The future of our democracy is… https://t.co/XDgM3bK2Sj|en|D|9|27
872175903161417728|38254095|Tue Jun 06 19:38:34 +0000 2017|11,000,000 lost their homes in the financial crisis. Now, Republicans want to put people at risk again. We must defeat the #WrongChoiceAct.|en|D|7|26
870693912788180992|38254095|Fri Jun 02 17:29:40 +0000 2017|Spoke about the future of technology in our region at @SacBiz #TechEdge yesterday. Great to be with so many inspiri… https://t.co/nR0yjUakfJ|en|D|0|11
870382699453837312|38254095|Thu Jun 01 20:53:01 +0000 2017|Joined @SEEC Co-Chairs in condemning decision to withdraw from #ParisAgreement https://t.co/zFOfYEtry3|en|D|7|19
870373088688472064|38254095|Thu Jun 01 20:14:49 +0000 2017|Despite President Trump’s reckless decision, we must keep fighting to #ActOnClimate and protect our planet. https://t.co/u9oWBceDaU|en|D|9|19
870342160654184449|38254095|Thu Jun 01 18:11:55 +0000 2017|Great to join with @verizon to announce another step forward as we make Sacramento a connected #SmartCity. https://t.co/vembT3Fz6y|en|D|2|6
869991995833556992|38254095|Wed May 31 19:00:30 +0000 2017|#TrumpCuts are cruel – particularly for women &amp; families. @nwlc sums up why https://t.co/0wQ15HCy6H|en|D|3|9
869930504426074112|38254095|Wed May 31 14:56:09 +0000 2017|Withdrawing from the #ParisAgreement puts the future of our country and our world at risk. https://t.co/k84ZahX1fe|en|D|10|23
869233969023397888|38254095|Mon May 29 16:48:22 +0000 2017|This #MemorialDay, we honor the brave men &amp; women who have lost their lives defending our country. We will never forget their sacrifices.|en|D|6|30
867756467323109376|38254095|Thu May 25 14:57:18 +0000 2017|Honored to join my colleagues &amp; passionate community service advocates for today’s ACTION for National Service Act… https://t.co/GhcBUju3mS|en|D|9|20
867522251364724736|38254095|Wed May 24 23:26:37 +0000 2017|Today, CBO confirmed that millions of families would lose health coverage under #TrumpCare. My statement: https://t.co/X8xyUU2C3M|en|D|10|14
867461526478835713|38254095|Wed May 24 19:25:19 +0000 2017|"Today I joined @HouseDemocrats in demanding Trump end efforts to undermine access to affordable, quality healthcare
https://t.co/krZbb2eNKz"|en|D|5|22
867087039451324416|38254095|Tue May 23 18:37:14 +0000 2017|President Trump’s proposed budget callously neglects the needs of hardworking families and America’s future.… https://t.co/7EhaRXWCB7|en|D|11|18
867029690925457408|38254095|Tue May 23 14:49:21 +0000 2017|My thoughts and prayers are with the families facing unimaginable grief in Manchester. We stand with you during this heartbreaking time.|en|D|0|14
866768128717488128|38254095|Mon May 22 21:30:00 +0000 2017|"Pres. Trump wants to make major cuts to Medicaid, ripping coverage away from those who need it the most. #TrumpCuts
https://t.co/1R5Nbc0qrh"|en|D|6|8
865638475667718145|38254095|Fri May 19 18:41:10 +0000 2017|Honored to be a Member of @CAPAC to advocate for #AAPI communities across the nation. #APAHM17 https://t.co/4dWb5I1b3o|en|D|2|3
865235362238562304|38254095|Thu May 18 15:59:20 +0000 2017|Today, Trump's @FCC is starting process to overturn #NetNeutrality. I’ll keep fighting to save your access to a free &amp; open internet.|en|D|24|56
864988032373542912|38254095|Wed May 17 23:36:32 +0000 2017|My statement on appointment of special prosecutor to investigate #TrumpRussia ties: https://t.co/3mlvyz4KWx|en|D|5|10
864909772042231809|38254095|Wed May 17 18:25:33 +0000 2017|A free and open internet is the foundation of free speech. Trump’s @FCC wants to take that away. #NetNeutrality https://t.co/WT09lWann8|en|D|58|70
864881861331439616|38254095|Wed May 17 16:34:39 +0000 2017|Protection of our democracy &amp; institutions should be placed above partisanship. The American people deserve answers. https://t.co/vaub9C2FM0|en|D|5|14
864519970545389569|38254095|Tue May 16 16:36:37 +0000 2017|Report of Trump’s alarming handling of classified info is deeply troubling. We need an independent investigation of #TrumpRussia ties.|en|D|138|332
863800241702801408|38254095|Sun May 14 16:56:40 +0000 2017|Happy #MothersDay to all of the amazing moms in Sacramento and across the country! https://t.co/uYDFQkZVpF|en|D|5|14
863107092986699776|38254095|Fri May 12 19:02:21 +0000 2017|Joined @AQMD &amp; @AirResources today to celebrate the deployment of 29 electric school buses that will serve students… https://t.co/SMas0kQzZU|en|D|9|14
862400824672215045|38254095|Wed May 10 20:15:53 +0000 2017|Great to celebrate Sacramento’s rich rail history today &amp; mark our city’s continued efforts to build transportation… https://t.co/avorL9sMr9|en|D|6|21
862142828029280256|38254095|Wed May 10 03:10:42 +0000 2017|"We must have an independent prosecutor to investigate Russian interference in our election. 

https://t.co/fwIGvLXIrw"|en|D|38|68
862062504985473024|38254095|Tue May 09 21:51:32 +0000 2017|Broke ground in West Sacramento today at the Southport Levee Improvement Project – another step in bolstering our f… https://t.co/GPpJh7Nlwu|en|D|8|34
862024052772417536|38254095|Tue May 09 19:18:44 +0000 2017|Honored to have art from Fern Bacon in my office for @officialSCUSD Art of Compassion project, thanks for sharing t… https://t.co/oVtG1eQBUF|en|D|6|14
860234655882244097|38254095|Thu May 04 20:48:19 +0000 2017|House Republicans and President Trump turned their backs on the American people today w/#TrumpCare passage: https://t.co/OGusg6QQf0|en|D|14|21
860176557171724290|38254095|Thu May 04 16:57:27 +0000 2017|House Republicans planning vote on #TrumpCare today, putting the coverage of millions of people on the line. I’ll b… https://t.co/7mesinJlYm|en|D|10|45
860144627025924096|38254095|Thu May 04 14:50:34 +0000 2017|For Americans with pre-existing conditions, #TrumpCare would mean ↑in premiums, ↑ in deductibles &amp; long waiting periods for coverage.|en|D|11|22
860136816795684865|38254095|Thu May 04 14:19:32 +0000 2017|What does #TrumpCare mean for older Americans? The bill would impose an age tax on people over 50.|en|D|14|12
860117075473379329|38254095|Thu May 04 13:01:05 +0000 2017|#TrumpCare means higher costs, less protections for American families – yet Republicans are rushing to pass it. Unbelievable.|en|D|32|30
859868348015935489|38254095|Wed May 03 20:32:44 +0000 2017|Senate Republicans are moving forward w/legislation today that will hurt people’s ability to save for retirement in California.|en|D|4|5
859837556673974272|38254095|Wed May 03 18:30:23 +0000 2017|#TrumpCare would still be devastating for people with pre-existing conditions. I will continue to fight this damaging proposal.|en|D|9|38
859515239167119360|38254095|Tue May 02 21:09:36 +0000 2017|This Mental Health Awareness Month, we must recommit to increasing access to mental health services in our communit… https://t.co/WBeVp7ueB8|en|D|18|33
859508923707084800|38254095|Tue May 02 20:44:30 +0000 2017|Proud to join @RepCicilline to introduce the Equality Act of 2017. #EqualityForward|en|D|4|10
859499710716944384|38254095|Tue May 02 20:07:54 +0000 2017|It was an honor to hear from Justice Kennedy at today’s #captocap17 leadership luncheon! https://t.co/6p5MZhCvax|en|D|2|10
859477827489542145|38254095|Tue May 02 18:40:57 +0000 2017|Thank you @jimmykimmel for reminding us why we must fight efforts to cut off protections for pre-existing conditions https://t.co/xXMrnAPOX4|en|D|7|23
859192301020745732|38254095|Mon May 01 23:46:22 +0000 2017|Had a productive meeting w/#captocap17 flood protection team about the importance of investing in strong flood cont… https://t.co/u2cdwobVid|en|D|3|10
859121363017224193|38254095|Mon May 01 19:04:29 +0000 2017|I signed on to a letter to @POTUS condemning #100days of attacks on women's health: https://t.co/xV5NjBQRep|en|D|7|31
859103927987580933|38254095|Mon May 01 17:55:12 +0000 2017|Kicked off #captocap17 meetings with a great discussion about importance of cont. collaboration on protecting acces… https://t.co/tU2dWxJUlB|en|D|2|16
857377056472133632|38254095|Wed Apr 26 23:33:14 +0000 2017|"President Trump’s first 100 days have been marked by nothing but broken promises. 

https://t.co/320SjhmbIP"|en|D|8|20
857348448961613827|38254095|Wed Apr 26 21:39:33 +0000 2017|Stood w/@EnergyCommerce Democrats, @MClyburnFCC against Trump Administration’s plan to attack a free and open inter… https://t.co/SCmmOEbcDT|en|D|5|15
857323634121216001|38254095|Wed Apr 26 20:00:57 +0000 2017|Pres.Trump took away your internet privacy rights. Now he plans to gut #NetNeutrality. We must protect the open int… https://t.co/Fs8doZYM2w|en|D|365|333
857014062294736896|38254095|Tue Apr 25 23:30:49 +0000 2017|Instead of putting up a senseless wall, we should be making investments in America’s future. #Trump100Days https://t.co/Ix6JotBydW|en|D|22|43
856623055019413504|38254095|Mon Apr 24 21:37:06 +0000 2017|On #YomHaShoah we mourn the loss of the 6 million Jews killed in the Holocaust. We must stop hatred &amp; intolerance in all forms. #NeverAgain|en|D|12|23
855798899906367489|38254095|Sat Apr 22 15:02:12 +0000 2017|We must keep up our fight to combat #ClimateChange &amp; make our planet healthier for future generations. #EarthDay|en|D|14|29
855535613323296768|38254095|Fri Apr 21 21:35:59 +0000 2017|Hosted roundtable w/ @alzassociation advocates in Sacramento today to discuss need for more research funding to… https://t.co/H79J1NVamA|en|D|8|25
855148999552229376|38254095|Thu Apr 20 19:59:44 +0000 2017|Inspired by my discussion with women leaders today about how we can bring more women into leadership positions in S… https://t.co/fYgwWGu3vD|en|D|9|28
855082640164216834|38254095|Thu Apr 20 15:36:02 +0000 2017|Yes, I signed the discharge petition b/c the American people deserve transparency from President Trump on his tax r… https://t.co/Uk7yGPs0GO|en|D|9|36
854851944606609408|38254095|Thu Apr 20 00:19:20 +0000 2017|At @SacNAHC to celebrate its grand reopening. ACA’s expansion of Medicaid is essential for community health centers… https://t.co/XupPKM1qJy|en|D|5|13
854811165062553600|38254095|Wed Apr 19 21:37:18 +0000 2017|With @Mayor_Steinberg &amp; @Vivek at @Golden1Center to discuss Sacramento as a testbed for #innovation &amp; driverless ca… https://t.co/l4frZajfx5|en|D|13|25
854765868017963009|38254095|Wed Apr 19 18:37:18 +0000 2017|More than 55 million women have gained access to no-cost birth control coverage thanks to the ACA. #HandsOffMyBC|en|D|15|41
854509786125160448|38254095|Wed Apr 19 01:39:43 +0000 2017|Great to be at @UCDavisChildren where groundbreaking work at the surgery center is giving families hope. https://t.co/u8ZbSHApN3|en|D|11|25
853354231587373056|38254095|Sat Apr 15 21:07:58 +0000 2017|Congratulations VFW Post 67 in Sacramento on your 100th anniversary! Thank you for your commitment to veterans in our community.|en|D|4|10
852966398783623169|38254095|Fri Apr 14 19:26:51 +0000 2017|On this historically significant day for Sikhs, I'm wishing our Sikh American friends a happy #Vaisakhi!|en|D|7|32
851527569988091905|38254095|Mon Apr 10 20:09:27 +0000 2017|Congratulations to @sacstate‘s talented jazz vocalists and musicians! https://t.co/jVvfomlAO5|en|D|6|19
850489199262355456|38254095|Fri Apr 07 23:23:21 +0000 2017|My statement on the U.S. airstrikes in Syria: https://t.co/bOJ11H8zjI|en|D|6|17
850063822786351105|38254095|Thu Apr 06 19:13:03 +0000 2017|.@DevinNunes’ recusal important step. But we need an independent commission to investigate Trump-Russia connection. #FollowTheFacts|en|D|126|252
849688998905884679|38254095|Wed Apr 05 18:23:38 +0000 2017|#SocialSecurity is a bedrock program for seniors, survivors &amp; the disabled. Proud to join @RepJohnLarson's bill to strengthen it.|en|D|8|26
849682303781613568|38254095|Wed Apr 05 17:57:02 +0000 2017|The American people have been clear – it’s time to #DemandAVote and finally reveal President Trump's tax returns. https://t.co/obN5CulLkN|en|D|17|33
849659142335758336|38254095|Wed Apr 05 16:25:00 +0000 2017|Discussed the importance of Year Round Pell Grants with @sacstate today. Thanks for coming by my office! #stingersup https://t.co/XYaB8nl9m3|en|D|4|9
849625209850212352|38254095|Wed Apr 05 14:10:09 +0000 2017|Introduced bill that would move more federal #spectrum into the pipeline, so the U.S. can lead the world in 5G: https://t.co/LHFGaPE86s|en|D|4|7
849307772407689216|38254095|Tue Apr 04 17:08:46 +0000 2017|The wage gap has barely budged in the last decade. Pass Paycheck Fairness now! #EqualPayDay https://t.co/4i12UF3r5Y|en|D|18|27
849284489121595395|38254095|Tue Apr 04 15:36:15 +0000 2017|On average, women STILL only make 80 cents to the $ of their male counterparts - this #EqualPayDay we MUST do more to close the pay gap!|en|D|48|113
849277619765997568|38254095|Tue Apr 04 15:08:58 +0000 2017|Today marks 49 years since Dr. King’s assassination. His belief in our common humanity &amp; enduring legacy of love lives on. #MLK|en|D|6|22
847561317988872192|38254095|Thu Mar 30 21:28:59 +0000 2017|"In a blatant attack on women's access to healthcare, Senate Republicans just voted to defund #TitleX. 

https://t.co/3dBOcdtMW8"|en|D|15|16
847530299185651712|38254095|Thu Mar 30 19:25:44 +0000 2017|Introduced CLIMATE Act today to protect progress we've made on #climatechange. #ActOnClimate https://t.co/Z39L4G41ay|en|D|21|34
847484415479398402|38254095|Thu Mar 30 16:23:24 +0000 2017|Great news: Sacramento named a #NextInTech city as we continue to grow our #innovation economy! https://t.co/T4wmy1gl1S|en|D|7|10
847141450357919744|38254095|Wed Mar 29 17:40:35 +0000 2017|Thanks for coming by my office. Together we can #ENDAlz! https://t.co/IKoAFV6a2R|en|D|6|14
846811146158006277|38254095|Tue Mar 28 19:48:04 +0000 2017|The President’s latest exec. order will reverse our progress on #climatechange and damage the health &amp; economic sec… https://t.co/QwZpwNbIcJ|en|D|26|24
846775404497174528|38254095|Tue Mar 28 17:26:03 +0000 2017|I stand with consumers and their right to #privacy. Corporations should not be able to sell your financial &amp; medica… https://t.co/HIET9izGKC|en|D|17|38
846716904526024706|38254095|Tue Mar 28 13:33:35 +0000 2017|I’ll be voting NO on SJ Res 34, which strips away important #broadbandprivacy protections for consumers.|en|D|25|96
845375540316045314|38254095|Fri Mar 24 20:43:29 +0000 2017|This is a victory for American families. Thank you to everyone for your calls, emails, and letters. Your voice matt… https://t.co/qhLaB85gqh|en|D|29|95
845304050660847616|38254095|Fri Mar 24 15:59:25 +0000 2017|Last minute Republican changes to #TrumpCare harm essential benefits that Americans depend on, like maternity care.… https://t.co/9uksPWMEjj|en|D|11|15
845274476526874624|38254095|Fri Mar 24 14:01:54 +0000 2017|Happening now: I’m speaking on the House floor against #TrumpCare, which will force families to pay more for less: https://t.co/CH1Zi5cqDz|en|D|16|71
845045000572416002|38254095|Thu Mar 23 22:50:02 +0000 2017|"My constituents in Sacramento overwhelmingly oppose the disastrous #Trumpcare bill. Emails/Calls/Letters so far:
Oppose: 1,598 
Support: 54"|en|D|445|946
844994219240574976|38254095|Thu Mar 23 19:28:15 +0000 2017|#TrumpCare will devastate the progress we have made on mental health reform. #ProtectOurCare https://t.co/CsHKuyxKYA|en|D|25|49
844929509774315521|38254095|Thu Mar 23 15:11:07 +0000 2017|RT if you oppose #TrumpCare, which would raise your premiums and out of pocket costs, forcing you to #PayMoreForLess https://t.co/DYsvLhT3vA|en|D|189|88
844607487898767360|38254095|Wed Mar 22 17:51:31 +0000 2017|Stood w/@JoeBiden and Democrats today in opposition to Republican’s #PayMoreForLess repeal bill. We will keep fight… https://t.co/JfXnxcZimX|en|D|13|39
844571680127242240|38254095|Wed Mar 22 15:29:14 +0000 2017|.@RulesReps are moving forward with #TrumpCare, putting 24 million people at risk of losing coverage &amp; forcing families to #PayMoreForLess|en|D|39|35
844281392242593792|38254095|Tue Mar 21 20:15:44 +0000 2017|Republican last min. changes to #TrumpCare will further gut #Medicaid &amp; accelerate tax breaks for the wealthiest. This bill must be stopped.|en|D|18|35
844199538525175808|38254095|Tue Mar 21 14:50:29 +0000 2017|Following #ComeyHearing, the American people need answers. @SpeakerRyan must create independent commission to #FollowTheFacts.|en|D|12|24
843886980286959618|38254095|Mon Mar 20 18:08:29 +0000 2017|Medicaid is a crucial tool in the fight against opioid addiction. We can’t let #GOPrepeal bill destroy it.… https://t.co/zc69w5YCdu|en|D|7|13
842507377102479364|38254095|Thu Mar 16 22:46:26 +0000 2017|Introduced #Innovation Corps Act today. My bill would est. national service program to help retrain workers for the… https://t.co/F8l388Jl1x|en|D|7|25
842428381119561728|38254095|Thu Mar 16 17:32:32 +0000 2017|#TrumpCuts reflect the President’s misguided values. My full statement on the President's budget proposal: https://t.co/J8NiuLQVcc|en|D|11|24
