id|user|created_at|text|lang|label|retweet_count|favorite_count
1395095323282903048|38254095|Wed May 19 19:13:39 +0000 2021|As part of the #AmericanRescuePlan, @samhsagov is distributing over $390M to help communities across California mee… https://t.co/KAu3f7HG8Z|en|D|9|18
1394800388440838150|38254095|Tue May 18 23:41:41 +0000 2021|Today, the House took a long overdue step towards addressing the disturbing spike in discrimination and violence ag… https://t.co/tCLKEFP735|en|D|7|35
1394464854107377666|38254095|Tue May 18 01:28:23 +0000 2021|Last week, the @HouseDemocrats Task Force on Aging and Families &amp; advocates discussed the need for investments in i… https://t.co/vY4UzdxjnT|en|D|4|16
1394034923594465284|38254095|Sun May 16 21:00:00 +0000 2021|"The American Jobs Plan will:

 🌉  modernize 20,000 miles of roads, bridges, &amp; more
☀️  provide investments in clean… https://t.co/YBEJVG3D2R"|en|D|6|17
1393642339009130497|38254095|Sat May 15 19:00:00 +0000 2021|"If you qualify, the @FCC's Emergency Broadband Benefit Program provides:

💰 Up to $50/month off your internet bill… https://t.co/qltrkRbb8y"|en|D|7|8
1393352278023839752|38254095|Fri May 14 23:47:24 +0000 2021|Today the House passed the Pregnant Workers Fairness Act, which will secure strong and clear protections for pregna… https://t.co/FC5solRCqx|en|D|4|20
1392956810949283849|38254095|Thu May 13 21:35:58 +0000 2021|"The @340BHealth program is critical to delivering life-saving drugs &amp; care to low-income patients. 

I'm proud to l… https://t.co/5tDchp9WVk"|en|D|0|8
1392559207518507015|38254095|Wed May 12 19:16:02 +0000 2021|The @FCC's Emergency Broadband Benefit program will help close the #DigitalDivide by providing a discount of $50/mo… https://t.co/BXE9aWvgCR|en|D|5|4
1392283385045950464|38254095|Wed May 12 01:00:01 +0000 2021|"EVERY caregiver deserves to have a safe working environment, strong benefits &amp; adequate pay. 

Join the… https://t.co/vnmT1r1Mc2"|en|D|1|8
1392225191107907590|38254095|Tue May 11 21:08:46 +0000 2021|The expanded #ChildTaxCredit under the #AmericanRescuePlan is here to help families and children put food on the ta… https://t.co/EhhyRFlQ9E|en|D|6|6
1392167662273404933|38254095|Tue May 11 17:20:10 +0000 2021|For my West Sac constituents: vaccines are here and the wonderful staff at @YoloCountyCA are ready to get you and y… https://t.co/9ti5vXIjwo|en|D|7|26
1391458579660500992|38254095|Sun May 09 18:22:32 +0000 2021|"Today we celebrate all of the mothers across the world. 
 
You are truly appreciated. Happy Mother’s Day! https://t.co/0oMFxVnXBL"|en|D|8|21
1390425828857577472|38254095|Thu May 06 21:58:45 +0000 2021|I’m grateful for the outstanding advocacy efforts of Sacramento's own @BeingCharisBlog. I introduced H.Res.135 to h… https://t.co/LXNgDsZzpq|en|D|5|32
1390088608007131137|38254095|Wed May 05 23:38:45 +0000 2021|Today, @EnergyCommerce held a hearing to talk about electric vehicles, how we can cut down on transportation emissi… https://t.co/HRp7Xlemei|en|D|12|23
1389978117964324865|38254095|Wed May 05 16:19:42 +0000 2021|Suicide is preventable with early intervention, but too often we miss the opportunity to reach a person in distress… https://t.co/HLuJ4oNut3|en|D|3|11
1389344996252340229|38254095|Mon May 03 22:23:54 +0000 2021|Today, I submitted testimony highlighting the need to fully fund local flood control projects. We must continue wor… https://t.co/QuZhQxF0Kl|en|D|9|35
1388983002647175168|38254095|Sun May 02 22:25:28 +0000 2021|Today, I joined @yasminv to talk about how Americans have united against AAPI discrimination and the importance of… https://t.co/orlHd6H3eO|en|D|5|19
1387212338760241154|38254095|Wed Apr 28 01:09:29 +0000 2021|Proud to honor Julie Omishakin as my virtual guest to @POTUS Biden’s Joint Address to Congress tomorrow. Hardworkin… https://t.co/Pl69H7maHd|en|D|4|24
1385710952058744833|38254095|Fri Apr 23 21:43:30 +0000 2021|For my West Sacramento constituents, vaccine appointments are available for @YoloCountyCA’s Sunday clinic. https://t.co/MY9JSmkiP4|en|D|4|15
1385315267337625601|38254095|Thu Apr 22 19:31:12 +0000 2021|51 years ago, people all over the world united in activism and environmentalism in the name of protecting and prese… https://t.co/lu7MuQFhcI|en|D|8|12
1384989465316261888|38254095|Wed Apr 21 21:56:35 +0000 2021|The House just PASSED the #NoBanAct! I serve a diverse and vibrant district and many of my own constituents were af… https://t.co/zB273E76PW|en|D|25|49
1384927423142277124|38254095|Wed Apr 21 17:50:03 +0000 2021|The American Rescue Plan brought lower health insurance premiums and @CoveredCA has started a new open enrollment p… https://t.co/i7ZvoJcYaJ|en|D|6|11
1384679195041624075|38254095|Wed Apr 21 01:23:40 +0000 2021|My statement on the verdict in the trial of Derek Chauvin for the murder of George Floyd: https://t.co/vvdXMYRS4k|en|D|7|33
1384278122963509251|38254095|Mon Apr 19 22:49:57 +0000 2021|High school students in the 6th Congressional District: the deadline is fast approaching for the Congressional Art… https://t.co/roC8GfP2v4|en|D|5|7
1383155132435599360|38254095|Fri Apr 16 20:27:36 +0000 2021|Yesterday, the House passed my bill, the TRANSPLANT Act, on an overwhelmingly bipartisan basis. The TRANSPLANT Act… https://t.co/25UbqkSZyO|en|D|4|36
1382797247654465538|38254095|Thu Apr 15 20:45:29 +0000 2021|Today, I went to the White House to meet with @POTUS, @VP, and @CAPAC  leaders to address the priorities of the AAP… https://t.co/DTCAMkKy7H|en|D|22|163
1382781214893895682|38254095|Thu Apr 15 19:41:47 +0000 2021|Today, we pass the Paycheck Fairness Act. It's time to take a stand against pay inequity and discrimination.  We ne… https://t.co/exsRr7TM8v|en|D|7|19
1382469610449072129|38254095|Wed Apr 14 23:03:34 +0000 2021|Today the House passed my bill, the FASTER Act, which  extends food allergen labeling protections to the nearly 1.6… https://t.co/b4mhH77J4O|en|D|9|89
1381736825463652354|38254095|Mon Apr 12 22:31:45 +0000 2021|"The American Rescue Plan is WORKING 🙌.
Over 150 MILLION Americans have been vaccinated in just 75 days.
Relief chec… https://t.co/emS1sN5dmB"|en|D|7|14
1380658670137004034|38254095|Fri Apr 09 23:07:33 +0000 2021|Beginning Monday, April 12th, @fema will begin accepting applications for financial assistance for COVID-19-related… https://t.co/l6QuPWRkXr|en|D|11|18
1380223559809765378|38254095|Thu Apr 08 18:18:34 +0000 2021|On #HolocaustRemembranceDay, #WeRemember and mourn the six million Jews who lost their lives in the Holocaust. We m… https://t.co/Q7pFQuBZVj|en|D|2|12
1379902855881035782|38254095|Wed Apr 07 21:04:12 +0000 2021|The #AmericanRescuePlan is meant to help you recover. The one-year expansion of the Child Tax Credit is one of the… https://t.co/42jc5Gbaov|en|D|10|19
1379546831634395138|38254095|Tue Apr 06 21:29:30 +0000 2021|Saddened to hear of the passing of my friend and colleague, Congressman Alcee Hastings. He devoted his life and car… https://t.co/DIlchzl19W|en|D|5|18
1378136862297104385|38254095|Sat Apr 03 00:06:47 +0000 2021|"It was a pleasure to have Dr. Fauci join me today for a conversation to answer your COVID-19 questions. 

The full… https://t.co/YtN1YoNDR3"|en|D|11|28
1378127645095825408|38254095|Fri Apr 02 23:30:09 +0000 2021|My heart is with the loved ones of Capitol Police Officer Billy Evans who lost his life today protecting our Capito… https://t.co/v4fYO37oOn|en|D|5|16
1377696019132076035|38254095|Thu Apr 01 18:55:01 +0000 2021|I am thrilled to have Dr. Anthony Fauci join me for a conversation on COVID-19. The full conversation will be avail… https://t.co/JlR0WE57MI|en|D|13|45
1377417920414801920|38254095|Thu Apr 01 00:29:58 +0000 2021|Today, on the last day of #WomensHistoryMonth, I had the pleasure of speaking with courageous leaders from Sacramen… https://t.co/qtPlPF1NE9|en|D|6|26
1376956517035950084|38254095|Tue Mar 30 17:56:30 +0000 2021|The Sacramento region has some of the most unique flood challenges in the country that require bold investments to… https://t.co/q94BXB0u2I|en|D|3|23
1376657274983215105|38254095|Mon Mar 29 22:07:26 +0000 2021|On Friday, I visited the vaccine distribution site at City Church of Sacramento in partnership with @UCDavisHealth.… https://t.co/PaFD5tuQhY|en|D|8|71
1375540286009438209|38254095|Fri Mar 26 20:08:55 +0000 2021|The surge in anti-Asian hate crimes is NOT an Asian American issue. It is an American issue. I stand with my @CAPAC… https://t.co/3pAnGrzr30|en|D|10|42
1375117418276691969|38254095|Thu Mar 25 16:08:35 +0000 2021|The @USWNT unites our nation &amp; inspires women &amp; girls across the country every time they take the field. Yesterday… https://t.co/Y1ArV8RYqR|en|D|6|18
1374810308951310338|38254095|Wed Mar 24 19:48:15 +0000 2021|After four years of reckless rollbacks of our auto fuel and clean air standards from the Trump Administration, it i… https://t.co/YWPum3B4TQ|en|D|25|100
1374797242171801601|38254095|Wed Mar 24 18:56:19 +0000 2021|Even with the same background, education, skills, hours, and jobs, a gender wage gap persists. Women deserve to be… https://t.co/PR7jVRoZI4|en|D|3|12
1374463382279974913|38254095|Tue Mar 23 20:49:41 +0000 2021|Happy Birthday to the Affordable Care Act! Making health care more affordable and accessible is especially importan… https://t.co/BuEpJ5HtxD|en|D|4|33
1374404613290352649|38254095|Tue Mar 23 16:56:09 +0000 2021|My heart grieves for the victims of yesterday’s mass shooting. This pain is too much to bear for Americans across t… https://t.co/lrXuJiwMvn|en|D|2|21
1373057634694131714|38254095|Fri Mar 19 23:43:44 +0000 2021|Today, I joined @PamelaBrownCNN on the @CNNSitRoom to talk about the importance of fighting the discrimination and… https://t.co/PixScWwj8E|en|D|19|55
1372994924849729538|38254095|Fri Mar 19 19:34:33 +0000 2021|ICYMI: Yesterday, we took a crucial step to support millions of immigrants who want to live out of the shadows and… https://t.co/Mz8gsezo57|en|D|4|28
1372658147970670603|38254095|Thu Mar 18 21:16:19 +0000 2021|I joined @jaketapper today to address the discrimination and violence that our AAPI communities have faced both his… https://t.co/UHbwN0ltZf|en|D|63|237
1372306756475445252|38254095|Wed Mar 17 22:00:01 +0000 2021|Since our country’s founding, women have been left out of the Constitution - intentionally. Today’s passage of HJ R… https://t.co/UhO1CS5lVh|en|D|12|44
1372270648005828610|38254095|Wed Mar 17 19:36:32 +0000 2021|My heart mourns for the eight lives, six of whom were Asian women, that were taken last night in GA. This horrific… https://t.co/Ljh78MozSp|en|D|29|144
1371958643961126915|38254095|Tue Mar 16 22:56:45 +0000 2021|This year’s tax season is complicated. That's why I joined my colleagues in urging the IRS to extend the April 15 f… https://t.co/jHnylZW57k|en|D|8|28
1371905702562689026|38254095|Tue Mar 16 19:26:22 +0000 2021|It is my favorite time of year - the Congressional Art Competition! My office is now accepting submissions on my we… https://t.co/61NCBXnwni|en|D|6|7
1370085323997253634|38254095|Thu Mar 11 18:52:50 +0000 2021|We #WearOrange to honor all those killed by gun violence. And today I voted to pass #HR8 so we take action in their… https://t.co/zok9FSLROL|en|D|6|24
1369746979044069383|38254095|Wed Mar 10 20:28:23 +0000 2021|"I just voted to pass the #AmericanRescuePlan. 

Next stop: @POTUS’ desk. 

The American Rescue Plan is a long-await… https://t.co/HeeqUl7I5N"|en|D|3|27
1369412573892841480|38254095|Tue Mar 09 22:19:34 +0000 2021|Today is the day in the new year that AAPI women finally catch up to what their white non-Hispanic male counterpart… https://t.co/S5iVJFLK1V|en|D|5|18
1369088318626033665|38254095|Tue Mar 09 00:51:06 +0000 2021|Today, on #InternationalWomensDay I was proud to introduce the GOALS Act, legislation to ensure the World Cup-winni… https://t.co/Iz3Il4wE6I|en|D|87|434
1369036489376497667|38254095|Mon Mar 08 21:25:09 +0000 2021|I am celebrating #InternationalWomensDay by honoring the women around the world who broke barriers, defied discrimi… https://t.co/RqX7WiNiGS|en|D|6|42
1367942263028867073|38254095|Fri Mar 05 20:57:05 +0000 2021|Today, I was joined by our wonderful @SacCountyCA Public Health Officer Dr. Olivia Kasirye and Kindra Montgomery-Bl… https://t.co/wILTkhm907|en|D|8|15
1367302616397475842|38254095|Thu Mar 04 02:35:21 +0000 2021|I just voted to pass the George Floyd #JusticeinPolicing Act, comprehensive legislation to hold police accountable,… https://t.co/lSIgkx4AWo|en|D|5|55
1367250695355703303|38254095|Wed Mar 03 23:09:02 +0000 2021|This evening, @HouseDemocrats are voting to pass the most transformational and comprehensive democracy reform legis… https://t.co/ADMuWOcqUV|en|D|3|14
1366841244786302977|38254095|Tue Mar 02 20:02:02 +0000 2021|The pandemic has fundamentally changed how we engage with our health care providers - leveraging telehealth is a lo… https://t.co/kMpnC8mnqG|en|D|8|29
1365563122300428288|38254095|Sat Feb 27 07:23:13 +0000 2021|"I just voted to pass the #AmericanRescuePlan. 

This bill is a bold, comprehensive package that meets the magnitude… https://t.co/dyoGhhtBJt"|en|D|20|70
1365440783176921088|38254095|Fri Feb 26 23:17:06 +0000 2021|American families have waited far too long for additional #COVID relief and they cannot afford any more delays. Tha… https://t.co/PKnfPwbC5T|en|D|11|26
1365056876883288064|38254095|Thu Feb 25 21:51:35 +0000 2021|I am proud to have just voted to pass the #EqualityAct to guarantee nondiscrimination protections for LGBTQ+ people… https://t.co/ddgsFw1qRN|en|D|12|81
1364740035963068417|38254095|Thu Feb 25 00:52:34 +0000 2021|Today, I met with @POTUS and @VP at the White House with a bipartisan group of colleagues to talk about how we can… https://t.co/9V0gKaQOIP|en|D|8|56
1364290269236002816|38254095|Tue Feb 23 19:05:22 +0000 2021|Renters in the City and County of Sacramento who are struggling with paying rent and utilities due to COVID-19 can… https://t.co/XCiFmOMMHa|en|D|11|19
1362931928026869762|38254095|Sat Feb 20 01:07:48 +0000 2021|Today is National #CaregiversDay – a day to honor the contributions of the many caregivers providing a beacon of ho… https://t.co/PjNrNqqvEh|en|D|16|40
1362880591184551939|38254095|Fri Feb 19 21:43:48 +0000 2021|79 years ago, Executive Order 9066 stripped over 120,000 Japanese Americans, including my parents, of their most ba… https://t.co/jlclDty5ER|en|D|62|181
1362506695730061312|38254095|Thu Feb 18 20:58:05 +0000 2021|I’m proud to co-sponsor the #USCitizenshipAct. For way too long, Congress has kicked the can down the road. Not any… https://t.co/dyoZ4fexZJ|en|D|11|29
1362116325682806785|38254095|Wed Feb 17 19:06:53 +0000 2021|I had the pleasure of visiting @sacstate’s COVID-19 vaccination clinic with @PrezNelsen. As we continue our efforts… https://t.co/c5unWmN09A|en|D|20|49
1361451642025955330|38254095|Mon Feb 15 23:05:40 +0000 2021|Today, I was joined by Britta Guerrero and Dr. Hakeem Adiniyi of @SacNAHC for an informative conversation on the CO… https://t.co/oLXJLcXz09|en|D|15|20
1360411882507567104|38254095|Sat Feb 13 02:14:02 +0000 2021|Our health system has failed to meet the needs of communities of color since far before the pandemic. This relief p… https://t.co/1uRgv0FiRi|en|D|5|14
1360397759115796482|38254095|Sat Feb 13 01:17:55 +0000 2021|#OTD in 1909, the @NAACP was founded. For 112 years the NAACP has been a leader in the fight for racial equality an… https://t.co/CyG3ouMrYf|en|D|2|7
1360331210648477697|38254095|Fri Feb 12 20:53:29 +0000 2021|To everyone in the 6th district and around the world, Happy Lunar New Year! The Sacramento region is home to a thri… https://t.co/bPBYwegEbe|en|D|10|54
1359686294998118407|38254095|Thu Feb 11 02:10:49 +0000 2021|As Co-Chair of the House Task Force on Aging and Families, I am working hard to make sure that our COVID response m… https://t.co/HOOQPyjoJq|en|D|9|36
1358927479734472706|38254095|Mon Feb 08 23:55:33 +0000 2021|"Last month, I joined my CA colleagues to call on the DOJ to drop its lawsuit against CA’s #netneutrality law. 

Tod… https://t.co/9sp0alLIE8"|en|D|5|19
1358891374498701314|38254095|Mon Feb 08 21:32:05 +0000 2021|As our nation continues to face the ongoing pandemic, schools are being confronted with the vast challenges of reop… https://t.co/5SdiLF29hT|en|D|5|18
1357828016487821313|38254095|Fri Feb 05 23:06:41 +0000 2021|Today, the House passed the National Apprenticeship Act of 2021 – a proposal to help Americans get back to work by… https://t.co/ejlWavTt0V|en|D|8|23
1357457982091456513|38254095|Thu Feb 04 22:36:17 +0000 2021|"Rosa Parks was born on this day 108 years ago. 

As we celebrate her life and legacy, her courage and strength cont… https://t.co/VbRES6FqvC"|en|D|2|13
1356704073265930247|38254095|Tue Feb 02 20:40:32 +0000 2021|I’m proud to join the Moms Task Force on Family Separation alongside @RepLoriTrahan, @RepEscobar, and my fellow mot… https://t.co/eVlr6eDyg5|en|D|9|39
1356391919912329216|38254095|Tue Feb 02 00:00:08 +0000 2021|Proud to join 99 of my colleagues in a letter calling for a pathway to citizenship for the estimated 5 million undo… https://t.co/pzEOxCmVNa|en|D|16|44
1356360184860315648|38254095|Mon Feb 01 21:54:02 +0000 2021|The disproportionate impact of the pandemic on communities of color reinforces the need to dismantle the racism &amp; s… https://t.co/RTk86T63Sa|en|D|3|18
1355255915608502272|38254095|Fri Jan 29 20:46:04 +0000 2021|Yesterday, the Biden administration rescinded the Global Gag Rule – a harmful policy that put reproductive health s… https://t.co/AowkIvl0qE|en|D|3|17
1355006328905719808|38254095|Fri Jan 29 04:14:18 +0000 2021|As we confront the ongoing pandemic, it is vital that we eliminate barriers to care and provide the avenues to keep… https://t.co/HDUbDvyLeK|en|D|9|21
1354528220964483073|38254095|Wed Jan 27 20:34:28 +0000 2021|Since day 1, @POTUS has taken bold climate action. As the Administration begins their work, it is time for healing.… https://t.co/uOsknCdcr0|en|D|5|19
1354146627120893952|38254095|Tue Jan 26 19:18:09 +0000 2021|The deadline to renew or enroll in health coverage through @CoveredCA is quickly approaching! You have between now… https://t.co/UbhlHizMEK|en|D|3|7
1352674322763149313|38254095|Fri Jan 22 17:47:44 +0000 2021|On the 48th anniversary of Roe v. Wade, we are reminded that the time to #ReimagineRoe is now. Barriers of systemat… https://t.co/XPFIdVoc6R|en|D|4|29
1351961931632939009|38254095|Wed Jan 20 18:36:57 +0000 2021|"Congratulations to President Joe Biden and Vice President Kamala Harris! 

Today, America starts a new chapter - le… https://t.co/dfgRqtcXCB"|en|D|11|83
1351250165277999106|38254095|Mon Jan 18 19:28:39 +0000 2021|Dr. King's work uplifted our nation. His vision valued all people &amp; brought us together with a common humanity that… https://t.co/QhQnWDdECL|en|D|7|41
1350222074535530496|38254095|Fri Jan 15 23:23:23 +0000 2021|I joined my colleagues in calling for an extension of the eviction ban immediately. https://t.co/gvoTwaIpeK|en|D|5|46
1349481877095251968|38254095|Wed Jan 13 22:22:06 +0000 2021|"Today, I voted to impeach President Trump for inciting a violent insurrection against our democracy. 

Read my stat… https://t.co/RnJKMDKgQT"|en|D|26|273
1349180377819197441|38254095|Wed Jan 13 02:24:03 +0000 2021|Today, I spoke on the floor urging my colleagues to defend the Constitution and support the removal of President Tr… https://t.co/4uk4f9JJg6|en|D|31|264
1348742300101353472|38254095|Mon Jan 11 21:23:17 +0000 2021|I co-sponsored @RepRaskin’s resolution calling on the @VP to take action and invoke the 25th Amendment. If the VP r… https://t.co/wmQvo6StNl|en|D|23|160
1347316123696390145|38254095|Thu Jan 07 22:56:10 +0000 2021|We cannot ignore yesterday's insurrection and every day that the President remains in office is a threat to our dem… https://t.co/NYJ3tVgq8o|en|D|332|1679
1346984041694732292|38254095|Thu Jan 07 00:56:35 +0000 2021|I am calling on the @VP to invoke the 25th Amendment and convene the cabinet to remove the President from office. T… https://t.co/hGmdZq4ket|en|D|252|1086
1346927824045674501|38254095|Wed Jan 06 21:13:12 +0000 2021|"My staff and I are safe in a secure location. 

This violent attempt to overthrow our democratic process must stop."|en|D|36|383
1346569984391086081|38254095|Tue Jan 05 21:31:16 +0000 2021|Trump’s @EPA anti-science rule purports improving transparency but instead blocks science that protects us from tox… https://t.co/3SySxr8zyO|en|D|7|17
1345923424909189122|38254095|Mon Jan 04 02:42:05 +0000 2021|It is an honor to continue serving the people of the Sacramento region in the #117thCongress alongside a historical… https://t.co/9rDdqpsnDg|en|D|9|133
1344730885032128512|38254095|Thu Dec 31 19:43:21 +0000 2020|For 20+ years there has been an #AAPI Cabinet Secretary. As President-elect Biden builds a cabinet to reflect the b… https://t.co/huL8Touusg|en|D|4|20
1344364659390861312|38254095|Wed Dec 30 19:28:06 +0000 2020|Today is the last day to sign up for health coverage beginning January 1st, 2021. Visit @CoveredCA to enroll now! https://t.co/wMb3NL4ISP|en|D|3|8
1343694146939314178|38254095|Mon Dec 28 23:03:43 +0000 2020|Today, I voted to pass a bill that would increase direct payment checks from $600 to $2,000. If the President is se… https://t.co/iUFyCjqj1F|en|D|9|75
1341509985721851907|38254095|Tue Dec 22 22:24:39 +0000 2020|Yesterday evening, the House passed a #COVIDrelief package that includes another round of direct payments worth up… https://t.co/jUy1D06zPl|en|D|1|8
1340386844811341830|38254095|Sat Dec 19 20:01:41 +0000 2020|In order to ensure continuity of government, the Attending Physician recommended that my colleagues and I receive t… https://t.co/6MqhmCAeSY|en|D|6|69
1339302044738310144|38254095|Wed Dec 16 20:11:05 +0000 2020|Julie Su has spent her career advancing workers’ rights &amp; creating opportunities for all. It is critical to nominat… https://t.co/V6L97Nmudi|en|D|9|30
1338628894505672704|38254095|Mon Dec 14 23:36:13 +0000 2020|My colleagues and I agree that now more than ever our community health centers need our support for long-term fundi… https://t.co/nkNvKx4kGj|en|D|12|46
1337869962615013376|38254095|Sat Dec 12 21:20:30 +0000 2020|Happy 5th Birthday to the #ParisAgreement! Today, the world recognizes how far we've come and how far we have left… https://t.co/Qy5Sd6a0WQ|en|D|2|13
1337144342469816325|38254095|Thu Dec 10 21:17:08 +0000 2020|Katherine Tai is a wonderful choice for @USTradeRep. She is a veteran international trade expert who has spent her… https://t.co/VOTGrpf3Rs|en|D|5|11
1336414154022813697|38254095|Tue Dec 08 20:55:38 +0000 2020|Our region faces some of the most unique and severe flood challenges in the country. That is why I'm pleased that t… https://t.co/NycNUj3wFt|en|D|3|18
1335309214340718592|38254095|Sat Dec 05 19:45:00 +0000 2020|As the Farm-to-Fork capital, the Sacramento restaurant scene is a vital part of our community fabric. During this c… https://t.co/MB9bfIjoJt|en|D|13|57
1334221600506269696|38254095|Wed Dec 02 19:43:12 +0000 2020|This is another important step in the @USWNT’s fight for equality. We must now all unite behind them to demand… https://t.co/0Pg0kptimg|en|D|4|10
1333868503388983297|38254095|Tue Dec 01 20:20:07 +0000 2020|On #WorldAIDSDay, we unite worldwide to show our support for people living with HIV and to remember those who we ha… https://t.co/V5rZbV56lO|en|D|1|12
1333847198396686336|38254095|Tue Dec 01 18:55:28 +0000 2020|Friends don’t let friends go without health insurance. During this COVID pandemic, don’t go uncovered. Last year, 2… https://t.co/RKVHoyMh9l|en|D|5|6
1332016421354795015|38254095|Thu Nov 26 17:40:37 +0000 2020|Happy Thanksgiving to all! While our celebrations might look different, I am thankful for the strength and compassi… https://t.co/n51VbNl9r1|en|D|3|20
1331325652981714945|38254095|Tue Nov 24 19:55:45 +0000 2020|This year, #COVID19 will require us to adjust our traditional Thanksgiving gatherings. It is critical that we take… https://t.co/vY0Jqun8BY|en|D|4|8
1329490746290827264|38254095|Thu Nov 19 18:24:29 +0000 2020|Are you a non-filer and haven’t received your Economic Impact Payment yet? Have you filed a 2019 tax return? If no,… https://t.co/qFiN1tAfEZ|en|D|1|3
1329102564340580353|38254095|Wed Nov 18 16:41:59 +0000 2020|Glad the FCC has voted to make critical modernizations to the 5.9GHz band. I have consistently called for these upd… https://t.co/6W8gIJN4u6|en|D|9|28
1328851981251670016|38254095|Wed Nov 18 00:06:15 +0000 2020|Today, the House passed two of my bills: the FASTER Act and MODERN Labeling Act. Both bills are bipartisan, common… https://t.co/7lHkdHCRM3|en|D|5|17
1326961945610612736|38254095|Thu Nov 12 18:55:56 +0000 2020|Joined @TheHillEvents today to talk about what proved important to 50+ voters this election and how we tackle their… https://t.co/aYMdsYeWYj|en|D|4|5
1326579476029796352|38254095|Wed Nov 11 17:36:08 +0000 2020|On Veterans Day, we honor all of the brave servicemembers who have answered the call to serve and defend our nation… https://t.co/WwiFBGwLxK|en|D|2|19
1326240440362807296|38254095|Tue Nov 10 19:08:55 +0000 2020|The ACA has been a literal lifeline – protecting 130 million Americans with pre-existing conditions, and making sur… https://t.co/GVqmjav0xl|en|D|8|20
1325207452963401730|38254095|Sat Nov 07 22:44:12 +0000 2020|"Congratulations President-elect Joe Biden and Vice President-elect Kamala Harris! 

The American people have spoken… https://t.co/yVX87XaCva"|en|D|9|74
