id|user|created_at|text|lang|label|retweet_count|favorite_count
1468233297675403270|13218102|Tue Dec 07 14:57:51 +0000 2021|GlaxoSmithKline said its antibody treatment retained effectiveness against the Omicron variant in laboratory studie… https://t.co/Eri4uF2LnY|en|R|5|14
1468225651324989440|13218102|Tue Dec 07 14:27:28 +0000 2021|“Honestly, I would just can this whole bill,” Tesla’s Elon Musk, appearing virtually at the WSJ’s CEO Council Summi… https://t.co/9cI1bjyn5h|en|R|444|2549
1468195215844560898|13218102|Tue Dec 07 12:26:31 +0000 2021|OPINION: Ike Dike funding will need ‘marathon’ effort https://t.co/emmhBEgOED via @BmtEnterprise|en|R|4|11
1468178755554316288|13218102|Tue Dec 07 11:21:07 +0000 2021|Deportations Plummet 90 Percent on Biden’s Watch https://t.co/EzkGHFdNOK|en|R|24|57
1468009893999349761|13218102|Tue Dec 07 00:10:07 +0000 2021|‘I Just Couldn’t Sit Down And Do Nothing About It’ Says Retired ICE Agent Who Pushed For New Law After He And Partn… https://t.co/gEpHBTqmSt|en|R|72|257
1467968783436374023|13218102|Mon Dec 06 21:26:46 +0000 2021|Great morning at the Ft. Worth Police &amp; Firefighter Memorial with my friend @MannyRamirez_TX to remember Jaime Zapa… https://t.co/fZrXkyWhbd|en|R|11|50
1467927361660370947|13218102|Mon Dec 06 18:42:10 +0000 2021|"This would help

@SenatorSinema and I introduced the bipartisan, bicameral Bipartisan Border Solutions Act with… https://t.co/lLWQLvFtiY"|en|R|13|39
1467924810508472327|13218102|Mon Dec 06 18:32:02 +0000 2021|"It was a privilege to honor the courage &amp; sacrifice of former ICE Agents @VicSurvivor11 &amp; Jaime Zapata.

I introduc… https://t.co/owRgsf8XFO"|en|R|19|51
1467923254891495429|13218102|Mon Dec 06 18:25:51 +0000 2021|Blinken says any move by China to invade Taiwan would have 'terrible consequences' https://t.co/hUvJ99uGEU|en|R|12|43
1467916687437705222|13218102|Mon Dec 06 17:59:45 +0000 2021|"Taiwan, Slovakia hold talks as island firms ties with Europe | AP News https://t.co/STS1LDvm1h"|en|R|9|24
1467845912898818050|13218102|Mon Dec 06 13:18:31 +0000 2021|Taiwan’s trade with the U.S. is expanding as the island and Washington move toward formally strengthening ties desp… https://t.co/7lqJ41jlSZ|en|R|13|54
1467565297863381001|13218102|Sun Dec 05 18:43:27 +0000 2021|"Another consequence of Biden's precipitous withdrawal: 

Facing Economic Collapse, Afghanistan Is Gripped by Starva… https://t.co/oTTFmHIt2j"|en|R|50|97
1467504857263316993|13218102|Sun Dec 05 14:43:17 +0000 2021|The number of undocumented immigrants in detention centers has increased by more than 50% since Biden took office… https://t.co/qIRffHTv7r|en|R|47|103
1467482929668534279|13218102|Sun Dec 05 13:16:09 +0000 2021|On Syria’s Ruins, a Drug Empire Flourishes https://t.co/2AYzJCclF0|en|R|23|43
1467480647497355280|13218102|Sun Dec 05 13:07:05 +0000 2021|GOP Senator Warns Of 'Grave Threat' Posed By China https://t.co/OIoeYkdivk via @YouTube|en|R|19|56
1467270684694953997|13218102|Sat Dec 04 23:12:46 +0000 2021|Looking a lot like Christmas https://t.co/MLh5piVnLw|en|R|28|380
1467174623087374345|13218102|Sat Dec 04 16:51:03 +0000 2021|Other Senate Democrats face risks in voting for Build Back Better https://t.co/0NMfes8mVF|en|R|8|33
1467172263787118597|13218102|Sat Dec 04 16:41:41 +0000 2021|Build Back Better is just more Obama stimulus on steroids https://t.co/GDqYFMhCIK via @AEI|en|R|40|121
1467119160614289412|13218102|Sat Dec 04 13:10:40 +0000 2021|Economic turmoil is ravaging Turkey’s poor and middle class. “Everyone here is outraged.” https://t.co/QlpP85Vmdb via @WSJ|en|R|3|20
1466938400695635974|13218102|Sat Dec 04 01:12:23 +0000 2021|A post-Roe abortion political 'revolution' is unlikely https://t.co/a0wWsQpWHT|en|R|7|20
1466936975160717317|13218102|Sat Dec 04 01:06:43 +0000 2021|Pro-China group advised by key Biden picks compared DOJ’s China Initiative to ‘McCarthyism’ https://t.co/lRDQXSCqJO|en|R|8|16
1466898246882705419|13218102|Fri Dec 03 22:32:50 +0000 2021|Ohio OD deaths up 26%; Portman blames open border https://t.co/530ESIVnX1|en|R|38|86
1466747126273265671|13218102|Fri Dec 03 12:32:20 +0000 2021|Twitter and Facebook hit back at Chinese propaganda campaigns. https://t.co/qyI9b22SXJ|en|R|7|20
1466498270675537921|13218102|Thu Dec 02 20:03:28 +0000 2021|"Words matter when it comes to the #CCP’s behavior.
 
When we hear of China’s desired unification with Taiwan – they… https://t.co/0JHKXmVu8I"|en|R|116|147
1466485240671703045|13218102|Thu Dec 02 19:11:42 +0000 2021|The return of MPP is awkward for the Biden administration, which is still formally preparing to end the program eve… https://t.co/gvQlyd8ayK|en|R|6|20
1466484725174968321|13218102|Thu Dec 02 19:09:39 +0000 2021|via @NYTimes https://t.co/NbEFnaiwxg|und|R|4|16
1466424859026731021|13218102|Thu Dec 02 15:11:45 +0000 2021|Why I’m Backing Charter Schools by @MikeBloomberg https://t.co/GN1LbOdul5|en|R|8|38
1466418005714386944|13218102|Thu Dec 02 14:44:31 +0000 2021|Americans Consider China Top National Security Risk https://t.co/5tEFETkf81|en|R|18|63
1466372876723003396|13218102|Thu Dec 02 11:45:12 +0000 2021|Schumer has declared repeatedly that he wants BBB through the Senate by Christmas. But as one senator joked with us… https://t.co/n2BLgwfBsS|en|R|41|273
1466365172780609540|13218102|Thu Dec 02 11:14:35 +0000 2021|Inflation Causing Hardship for 45% of U.S. Households https://t.co/HunzkwSGao|en|R|50|96
1466146039505854468|13218102|Wed Dec 01 20:43:50 +0000 2021|In a startling display of hypocrisy, Democrats want to force working Texans to subsidize the wealthiest Americans a… https://t.co/iGtkqCGBDe|en|R|118|377
1466078691067412488|13218102|Wed Dec 01 16:16:13 +0000 2021|He should focus on the Constitution itself, not public opinion, and the Court will be just fine. https://t.co/JotdLADg2d|en|R|30|196
1466056037513977859|13218102|Wed Dec 01 14:46:12 +0000 2021|"Not zero

A Permanent Build Back Better Act Could Cost $4.8 Trillion https://t.co/mvV3LHGEES via @budgethawks"|en|R|23|58
1466008154517430277|13218102|Wed Dec 01 11:35:55 +0000 2021|The European Centre for Disease Prevention and Control said yesterday that 44 Omicron variant cases had been confir… https://t.co/iOvDhZTLfu|en|R|63|173
1465861090601054208|13218102|Wed Dec 01 01:51:33 +0000 2021|Taliban responsible for executing more than 100 former police and intelligence officers in Afghanistan: Watchdog https://t.co/t6rPAh07WC|en|R|58|76
1465860600748257281|13218102|Wed Dec 01 01:49:36 +0000 2021|Daily on Energy: US beating emissions forecasts while China lags https://t.co/yGppgZ01nk|en|R|8|18
1465860124568924162|13218102|Wed Dec 01 01:47:42 +0000 2021|Democratic operative who pushed debunked Trump-Russia claims continued funding Steele and Fusion GPS last year https://t.co/Ryam8zXQCu|en|R|20|33
1465814227109695502|13218102|Tue Nov 30 22:45:19 +0000 2021|"The U.S. is one of only 7 countries to allow elective abortions after 20 weeks. 
 
Others on the list include China… https://t.co/SOIkLzxwSO"|en|R|51|197
1465763127056814087|13218102|Tue Nov 30 19:22:16 +0000 2021|Exclusive: Dell family foundation gives $38 million to 3 organizations to end homelessness https://t.co/VGjCBY4jd4 via @statesman|en|R|16|46
1465749360680054792|13218102|Tue Nov 30 18:27:34 +0000 2021|"In the words of Ronald Reagan, “The closest thing to eternal life on Earth is a government program.”
 
Dems are usi… https://t.co/91sHO3pRdw"|en|R|40|100
1465654756022566925|13218102|Tue Nov 30 12:11:39 +0000 2021|Of note, the vote for amendments to the Defense bill was bipartisan: U.S. Senate: U.S. Senate Roll Call Votes 117th… https://t.co/RvjhILbwZi|en|R|7|25
1465642371165700096|13218102|Tue Nov 30 11:22:26 +0000 2021|"Analysis | Is the United States one of seven countries that ‘allow elective abortions after 20 weeks of pregnancy?’ https://t.co/Hn73m3G6df"|en|R|11|28
1465501652337758208|13218102|Tue Nov 30 02:03:16 +0000 2021|😅 https://t.co/akwUv08x75|und|R|6|38
1465461878314962945|13218102|Mon Nov 29 23:25:13 +0000 2021|Easily solved by permitting amendment votes. https://t.co/MtL31nZ2XM|en|R|10|35
1465457414090723329|13218102|Mon Nov 29 23:07:29 +0000 2021|Funding the government, avoiding a debt crisis, strengthening our military... None of the Senate’s most basic respo… https://t.co/C4G9fbfL2v|en|R|19|65
1465396864178696193|13218102|Mon Nov 29 19:06:52 +0000 2021|Texas leaders want federal funding, say border infrastructure can't handle migrant surge https://t.co/Qm8n8UVVFL|en|R|40|155
1465396228095680517|13218102|Mon Nov 29 19:04:21 +0000 2021|Agree https://t.co/7OOtMGRe0J|en|R|28|122
1465396158247940109|13218102|Mon Nov 29 19:04:04 +0000 2021|Democrats are out of touch with the needs of American families &amp; are only focused on their partisan tax-and-spend s… https://t.co/cd0R7ZBUQA|en|R|10|29
1465285211005112320|13218102|Mon Nov 29 11:43:12 +0000 2021|Senate Democratic aides will huddle today with the Parliamentarian’s office over Byrd Rule issues likely to knock o… https://t.co/jee85mp9R6|en|R|45|144
1465282340846977036|13218102|Mon Nov 29 11:31:48 +0000 2021|Study warns that children of women who smoked weed during their pregnancy are at greater risk for development and b… https://t.co/Lr6eHAM1Kq|en|R|14|63
1465281907139174407|13218102|Mon Nov 29 11:30:04 +0000 2021|New Poll: 77% Of Americans Say Inflation Is Impacting Their Lives: Majority Blame Biden https://t.co/GWmJbnc7xt|en|R|40|140
1465280152431218689|13218102|Mon Nov 29 11:23:06 +0000 2021|"A lot of huff-and-puff from the CCP:

China blowback looms for Schumer’s Innovation and Competition Act… https://t.co/w345PjKXwU"|en|R|11|21
1465124534424645634|13218102|Mon Nov 29 01:04:44 +0000 2021|#greenlights https://t.co/1coPEBHHCe|und|R|9|49
1465101990791372802|13218102|Sun Nov 28 23:35:09 +0000 2021|Important distinction between science and scientists https://t.co/bpX0WigAia|en|R|18|92
1465099698809802761|13218102|Sun Nov 28 23:26:03 +0000 2021|"Tonight I am wishing all Texans who are celebrating #Chanukah a prosperous and blessed Festival of Lights.
 
Happy… https://t.co/P1QhaCmGwO"|en|R|20|97
1465012968039632899|13218102|Sun Nov 28 17:41:24 +0000 2021|For the developed world, as Glasgow demonstrated, climate is an overwhelming imperative—often described by politica… https://t.co/lIPSwKuyAT|en|R|6|26
1465005853828857859|13218102|Sun Nov 28 17:13:08 +0000 2021|Sen. BILL CASSIDY (R-La.) on the opioid crisis: “It is the southern border which is out of control — which, by the… https://t.co/CJMJSO6WLM|en|R|47|174
1465005252659318793|13218102|Sun Nov 28 17:10:45 +0000 2021|NIH Director FRANCIS COLLINS on the Omicron variant, on “Fox News Sunday”: “We expect that most likely the current… https://t.co/g8xtQSSOK3|en|R|6|31
1465004724315435008|13218102|Sun Nov 28 17:08:39 +0000 2021|"Hint. He isn’t even trying: Can Biden find the right balance on immigration? | AP News https://t.co/SeJ7cBiRle"|en|R|10|48
1464967728649932804|13218102|Sun Nov 28 14:41:38 +0000 2021|Transitioning away from fossil fuels might lead to major economic shocks, and several crises could result from stra… https://t.co/B3BP7Idr1u|en|R|13|50
1464714083123486723|13218102|Sat Nov 27 21:53:45 +0000 2021|China’s belt and road initiative https://t.co/ixReVWfsst|en|R|4|25
1464679956827590656|13218102|Sat Nov 27 19:38:08 +0000 2021|A Cure for Type 1 Diabetes? For One Man, It Seems to Have Worked. https://t.co/Uqf906hb9U|en|R|14|44
1464679150615203844|13218102|Sat Nov 27 19:34:56 +0000 2021|"There are about 280 million cars on US roads, avg value about $25K https://t.co/R0oKex7bmz. 
But Pres. Biden want y… https://t.co/3f9sb8LT1J"|en|R|28|73
1464634539003707393|13218102|Sat Nov 27 16:37:40 +0000 2021|"#Bipartisan 

U.S. lawmakers visit Taiwan; China conducts military patrols https://t.co/wBbG5nV3NA via @politico"|en|R|3|21
1464634102079012870|13218102|Sat Nov 27 16:35:56 +0000 2021|OPEC considers lowering production to account for oil reserve releases https://t.co/jpMSy4lXgV|en|R|24|51
1464633062088654858|13218102|Sat Nov 27 16:31:48 +0000 2021|Beijing Keeps Trying to Rewrite History https://t.co/HfTZwY4aqg|en|R|89|110
1464631480018255873|13218102|Sat Nov 27 16:25:31 +0000 2021|The University of Austin: a meteor aimed at higher ed? https://t.co/fkglOA1HPi|en|R|9|29
1464625779535396882|13218102|Sat Nov 27 16:02:51 +0000 2021|On this day in 1944, Macario García distinguished himself on the battlefield near Grosshau, Germany, while serving… https://t.co/fCkzkBKxv6|en|R|10|63
1464615554103357450|13218102|Sat Nov 27 15:22:13 +0000 2021|Evidence is building that immunity from Covid-19 infection is at least as strong as that from vaccination. Scientis… https://t.co/aoSRKdiN4F|en|R|15|56
1464607323666661381|13218102|Sat Nov 27 14:49:31 +0000 2021|When Federal Employees Telecommute, Why Are Agencies in D.C.? by @faithika https://t.co/ABv3MBO9zj via @WSJOpinion|en|R|12|24
1464606332565213188|13218102|Sat Nov 27 14:45:35 +0000 2021|Japan has gone significantly beyond 1% of GDP in this year’s defense spending, pushing aside a longstanding guideli… https://t.co/zYzF48oyK8|en|R|3|15
1464604862260383749|13218102|Sat Nov 27 14:39:44 +0000 2021|There Is Another Democrat A.O.C. Should Be Mad At https://t.co/gUhi5tpZqs|en|R|7|34
1464596978097086468|13218102|Sat Nov 27 14:08:25 +0000 2021|New Virus Variant Stokes Concern but Vaccines Still Likely to Work https://t.co/YDAkBVBan7|en|R|7|26
1464595442386227205|13218102|Sat Nov 27 14:02:18 +0000 2021|Markets fell over news of the Omicron Covid variant, but the biggest danger is more government lockdowns.… https://t.co/LOoZBAFTBi|en|R|45|136
1464383932770799625|13218102|Sat Nov 27 00:01:51 +0000 2021|Sen. John Cornyn wants the Congressional Budget Office to report the true cost of the House entitlement and climate… https://t.co/sjlfC9yjUj|en|R|61|215
1464327337101733899|13218102|Fri Nov 26 20:16:57 +0000 2021|Watching a great UT v KState game with Kiara Kabbara, UT Student Body President, aspiring lawyer and public servant… https://t.co/duWoamLFk4|en|R|5|63
1464284104317407233|13218102|Fri Nov 26 17:25:10 +0000 2021|UT vs KState https://t.co/BnMuOG7FGl|pl|R|7|57
1464242892877217794|13218102|Fri Nov 26 14:41:24 +0000 2021|'Afghan Girl' from National Geographic magazine cover granted refugee status in Italy https://t.co/zzgmzuT0Yx via @CNNStyle|en|R|6|42
1464241250660499468|13218102|Fri Nov 26 14:34:53 +0000 2021|"Good. 

The Biden administration invited Taiwan to participate in a meeting of democracies, further bucking Beijing… https://t.co/7AM6gboyMw"|en|R|44|312
1464239839650398229|13218102|Fri Nov 26 14:29:16 +0000 2021|More of this =&gt; https://t.co/vQd7XmrRAN|en|R|8|38
1464239075003703299|13218102|Fri Nov 26 14:26:14 +0000 2021|Another U.S. congressional delegation visits Taiwan, days after the White House invited Taipei to a meeting of demo… https://t.co/chhG1KZF0q|en|R|17|89
1464235299106603016|13218102|Fri Nov 26 14:11:14 +0000 2021|How Liberals Can Be Happier https://t.co/9S9WpSyoXx|en|R|8|25
1464233172280000524|13218102|Fri Nov 26 14:02:47 +0000 2021|"Juries - as a general rule - do a good job deciding cases on the facts and law: 

How a Prosecutor Addressed a Most… https://t.co/MTeA5NuXBj"|en|R|6|35
1464231817255473154|13218102|Fri Nov 26 13:57:24 +0000 2021|JPMorgan Chase CEO Jamie Dimon apologizes for a joke that hit a nerve about the Chinese Communist Party’s durabilit… https://t.co/JATms7p8LR|en|R|7|12
1464231210729811972|13218102|Fri Nov 26 13:54:59 +0000 2021|'This is going to be a marathon': Texas congressional delegation preps push for Ike Dike https://t.co/JZO6N8mO9h via @houstonchron|en|R|6|25
1463861683424837639|13218102|Thu Nov 25 13:26:37 +0000 2021|Tencent must get approval from Chinese regulators before publishing new apps and updates https://t.co/xoqK2BWKx3|en|R|4|10
1463860970309267456|13218102|Thu Nov 25 13:23:47 +0000 2021|Weekly jobless claims plunge to 199,000, the lowest level in more than 50 years https://t.co/bnyAsFdnop|en|R|1787|7252
1463857074186735620|13218102|Thu Nov 25 13:08:18 +0000 2021|Nearly 4 million Texans expected to travel this year for Thanksgiving holiday, AAA reports https://t.co/I9HgpzcnW3|en|R|6|28
1463846584345669638|13218102|Thu Nov 25 12:26:37 +0000 2021|"Happy Thanksgiving from my family to yours!
 
Today I hope folks from all across our great state are able to come t… https://t.co/lyXYC45BmN"|en|R|10|98
1463845064145358848|13218102|Thu Nov 25 12:20:34 +0000 2021|Hong Kong’s Universities Have Fallen. There May Be No Turning Back. https://t.co/zryJfc4kRa|en|R|74|106
1463683415811702792|13218102|Thu Nov 25 01:38:14 +0000 2021|This is under compulsion by courts. They intend to dismantle it, making #BidenBorderCrisis worse https://t.co/8bGY6ndFNt|en|R|55|210
1463674250414510093|13218102|Thu Nov 25 01:01:49 +0000 2021|RIP https://t.co/sTyx24KqvZ|und|R|7|41
1463672338432598017|13218102|Thu Nov 25 00:54:13 +0000 2021|Dinner? Or bait? https://t.co/7VfjC5K79a|en|R|12|288
1463637082383998977|13218102|Wed Nov 24 22:34:08 +0000 2021|Texas border landowners ask for federal funding for damage incurred during migrant crisis https://t.co/jcDQjwvAB4|en|R|77|284
1463636389958803456|13218102|Wed Nov 24 22:31:23 +0000 2021|Down 12 since April https://t.co/vT9fiwwPfC|en|R|20|93
1463597656702390280|13218102|Wed Nov 24 19:57:28 +0000 2021|Nearly two decades in the making, San Antonio’s new federal courthouse will soon open https://t.co/Hj0u7dPd86 via @expressnews|en|R|3|20
1463597395879637002|13218102|Wed Nov 24 19:56:26 +0000 2021|Just think about those great antibodies https://t.co/nPJCeMfQOB|en|R|2|27
1463574052757512192|13218102|Wed Nov 24 18:23:40 +0000 2021|Today 33 of my colleagues joined me in writing to @SecRaimondo, calling for Texas to be considered for the future s… https://t.co/yzPX6pqYxC|en|R|7|24
1463533634892279808|13218102|Wed Nov 24 15:43:04 +0000 2021|Italy's Draghi vetoes third Chinese takeover this year https://t.co/C2ZycvD6Xm|en|R|49|74
1463520232379764747|13218102|Wed Nov 24 14:49:48 +0000 2021|Ironic that Biden administration's response to high energy prices is to encourage Russia and Saudis to pump more oi… https://t.co/wP6pZM3vwf|en|R|24|92
1463515530246164481|13218102|Wed Nov 24 14:31:07 +0000 2021|Japan’s Revolution on Taiwan Affairs @WarOnTheRocks https://t.co/kUS9BCUkO7|en|R|7|17
1463513857507348482|13218102|Wed Nov 24 14:24:29 +0000 2021|Here's what you need to know about the Biden administration's move to tap the strategic oil reserve https://t.co/XliFB2dyIs via @WSJ|en|R|8|23
1463511668743454724|13218102|Wed Nov 24 14:15:47 +0000 2021|A group of U.S. federal agencies said they plan to begin delineating how banks can legally get involved in the grow… https://t.co/jBWt4vh3Ii|en|R|3|6
1463502371900825603|13218102|Wed Nov 24 13:38:50 +0000 2021|The semiconductor shortage is already impacting Texas families, but the problem also extends to our national securi… https://t.co/FWySDAieuX|en|R|64|294
1463308224090808330|13218102|Wed Nov 24 00:47:22 +0000 2021|Do Not Talk About Flight Club https://t.co/2aadkBeCuA|en|R|5|15
1463307570161061889|13218102|Wed Nov 24 00:44:46 +0000 2021|Samsung chooses Texas for $17 billion factory https://t.co/q12z222Z1Q|en|R|154|942
1463265880666775560|13218102|Tue Nov 23 21:59:06 +0000 2021|"Today I toured the new Federal Courthouse for the Western District of Texas w/ Judges Rodriguez &amp; Garcia.
 
This pr… https://t.co/4ck0FbdgqU"|en|R|5|41
1463238372223340546|13218102|Tue Nov 23 20:09:48 +0000 2021|The jury gave Rittenhouse the benefit of the doubt. That’s what advocates of criminal justice reform should have wa… https://t.co/sMWsfrek2Q|en|R|6|45
1463225968487714818|13218102|Tue Nov 23 19:20:30 +0000 2021|I was privileged to join the dedicated volunteers at @HavenForHope &amp; @SAFoodBank to prepare meals for those in need… https://t.co/NnYLPexss2|en|R|15|57
1463143007306276874|13218102|Tue Nov 23 13:50:51 +0000 2021|The Campaign to Distract Biden From Asia by @wrmead https://t.co/E2bNLbiAaf via @WSJOpinion|en|R|5|11
1463142295583305736|13218102|Tue Nov 23 13:48:01 +0000 2021|They don't get the supply-demand thing https://t.co/QuQwt5KosA|en|R|24|138
1463141039527665670|13218102|Tue Nov 23 13:43:02 +0000 2021|Chinese tennis player Peng Shuai makes an appearance on an International Olympic Committee video call—but it has do… https://t.co/ydFWQ0zHRC|en|R|57|85
1462955080198627334|13218102|Tue Nov 23 01:24:06 +0000 2021|EXCLUSIVE: U.S. Sen. John Cornyn meets with local leaders &amp; border patrol in Del Rio to discuss migrant crisis https://t.co/O9yGhVvXs8|en|R|9|52
1462948481224650752|13218102|Tue Nov 23 00:57:52 +0000 2021|Cornyn Asks for CBO Score of Build Back Better without Gimmicks https://t.co/dVwXKLVyEG|en|R|20|85
1462918033085812745|13218102|Mon Nov 22 22:56:53 +0000 2021|Might the Turkish Electorate Be Ready to Say Goodbye to Erdoğan After Two Decades in Power? https://t.co/t1OI58eeqD|en|R|11|43
1462900127736205316|13218102|Mon Nov 22 21:45:44 +0000 2021|Today I joined @USBPChiefDRT for a briefing &amp; tour of the Del Rio border sector, and to thank the Border Patrol age… https://t.co/ojJhFkydoY|en|R|15|30
1462899919132540936|13218102|Mon Nov 22 21:44:54 +0000 2021|"Great lunch today w/ the brave men &amp; women of @BPUnion &amp; U.S. CBP officers protecting our border.
 
In the past yea… https://t.co/i3zFchqEbz"|en|R|14|43
1462881391566364680|13218102|Mon Nov 22 20:31:17 +0000 2021|Today I was in @CityofDelRio to speak with law enforcement, community &amp; business leaders at a @DelRioChamber roundt… https://t.co/0URJZXIzXw|en|R|12|57
1462880790031867908|13218102|Mon Nov 22 20:28:54 +0000 2021|Today I wrote to @USCBO and @JCTGov to request the true cost estimate of President Biden's multi-trillion dollar pr… https://t.co/tvdPqjQvC5|en|R|7|14
1462880327056207874|13218102|Mon Nov 22 20:27:03 +0000 2021|Here is updated estimate from the Penn Wharton Budget Model (PWBM) of the House reconciliation bill from last week.… https://t.co/HNrvbN72Bm|en|R|158|299
1462785525945884687|13218102|Mon Nov 22 14:10:21 +0000 2021|The Power in Your Data: Big Tech, Privacy, and National Security - The Strauss Center https://t.co/k1ZkFv1dX7|en|R|5|17
1462777975217299457|13218102|Mon Nov 22 13:40:21 +0000 2021|.@thedispatch  BBB is designed with several expiration dates and sunset clauses intended to keep the topline cost of the legislation down.|en|R|11|40
1462776755782139910|13218102|Mon Nov 22 13:35:30 +0000 2021|Statement by Steve Simon, WTA Chairman &amp; CEO on recent video posted by China state-run media of Peng Shuai… via @WTA https://t.co/mcl0era8dh|en|R|9|19
1462775774746980356|13218102|Mon Nov 22 13:31:36 +0000 2021|Inflation: Thanksgiving Will Cost More This Year. That Could Cost Democrats, Too. https://t.co/jDpN2uOoZ2|en|R|8|67
1462775404377301000|13218102|Mon Nov 22 13:30:08 +0000 2021|Pelosi and Biden march swing-district House Democrats to the end of their careers with the passage of the tax and s… https://t.co/T8EXRd6rG0|en|R|46|158
1462774381235654663|13218102|Mon Nov 22 13:26:04 +0000 2021|U.S. Covid-19 deaths this year surpassed the known toll from 2020, with the Delta variant and low vaccination rates… https://t.co/NgRHVdO7UA|en|R|15|28
1462771356370616323|13218102|Mon Nov 22 13:14:02 +0000 2021|The Taliban say they want to eradicate Afghanistan’s multibillion-dollar drug industry. With drought and sanctions… https://t.co/nKTSexcywp|en|R|12|18
1462592451970015232|13218102|Mon Nov 22 01:23:08 +0000 2021|As of last year, 15 of the 19 cobalt-producing mines in Congo were owned or financed by Chinese companies, accordin… https://t.co/CjfkoCsxob|en|R|107|175
1462592103356289030|13218102|Mon Nov 22 01:21:45 +0000 2021|via ⁦@nytimes⁩  https://t.co/ZV1xDgTmGx|und|R|9|18
1462151674383015936|13218102|Sat Nov 20 20:11:39 +0000 2021|Washington, D.C., mayor Muriel Bowser suggested that “we’re moving from a pandemic to an endemic” and sounded downr… https://t.co/B6gum5baQJ|en|R|58|445
1462078825391611906|13218102|Sat Nov 20 15:22:10 +0000 2021|Fearless Champion has proudly served as a @TexasTech icon since 2013, appearing with 10 Masked Riders more than 2,6… https://t.co/5WgzZpOVGQ|en|R|6|51
1461801661941358602|13218102|Fri Nov 19 21:00:49 +0000 2021|"Despite their cries of taxing the rich, Democrats are plotting a massive handout to the wealthiest Americans.
 
Tod… https://t.co/PoF77vgros"|en|R|27|61
1461801565484896258|13218102|Fri Nov 19 21:00:26 +0000 2021|Families across Texas are planning their Thanksgiving menus, but under President Biden, celebrations will cost a lo… https://t.co/X889Xo7ewA|en|R|86|427
1461728648814374925|13218102|Fri Nov 19 16:10:42 +0000 2021|Another dubious budget gimmick in the Biden #recklesstaxandspendingspree According to Congressional Budget Office:… https://t.co/kL1qCLNF3K|en|R|77|174
1461714083888177156|13218102|Fri Nov 19 15:12:49 +0000 2021|Pelosi stuck her members out on a limb and sawed it off https://t.co/Q85HmHEJEX|en|R|18|96
1461684639609798661|13218102|Fri Nov 19 13:15:49 +0000 2021|A bipartisan coalition of state attorneys general said it is investigating how Instagram recruits and affects young… https://t.co/Xr7oNrJft7|en|R|7|10
1461683257586683913|13218102|Fri Nov 19 13:10:20 +0000 2021|Re­cent polls show Mr. Biden’s ap­proval rat­ings for his han­dling of im­mi­gra­tion are lower than for many other… https://t.co/Ma2shoaPs0|en|R|17|51
1461682645755170818|13218102|Fri Nov 19 13:07:54 +0000 2021|Biden promised a break from Trump-era immigration policies, but the government is struggling to manage a record num… https://t.co/FEHUSWyWzc|en|R|19|36
1461670448056446984|13218102|Fri Nov 19 12:19:25 +0000 2021|The battle to protect Taiwan’s democracy is already underway https://t.co/cJG3dUxjDH|en|R|23|62
