id|user|created_at|text|lang|label|retweet_count|favorite_count
1507375977172717573|13218102|Fri Mar 25 15:16:53 +0000 2022|Putin thrilled at this message https://t.co/JLkLTRaAoe|en|R|9|20
1507375713611096077|13218102|Fri Mar 25 15:15:50 +0000 2022|Churchill: “Only one thing in history is certain: that Mankind is unteachable.”’ https://t.co/UDa245XqvU|en|R|8|12
1507375254158651393|13218102|Fri Mar 25 15:14:00 +0000 2022|More American jobs, less Russian oil and gas, freedom from Russian coercion in Europe. https://t.co/3iSWdkaVQX|en|R|8|37
1507374959768838150|13218102|Fri Mar 25 15:12:50 +0000 2022|This week I had the opportunity to ask Judge Jackson some questions about how she would approach her role as a Supr… https://t.co/XOo8RUiJ3F|en|R|15|55
1507374559837700096|13218102|Fri Mar 25 15:11:15 +0000 2022|"Thrilled to see the @MohMuseum breaking ground today in the @CityOfArlington on #MedalofHonorDay.
 
America’s brave… https://t.co/lUFKRzKEsf"|en|R|6|13
1507369573787578370|13218102|Fri Mar 25 14:51:26 +0000 2022|Thanks to Europe, Putin’s War Is Paying for Itself https://t.co/tENws9VNeE|en|R|3|11
1507357992328572952|13218102|Fri Mar 25 14:05:25 +0000 2022|Betting on a Russian revolution is betting on an exceedingly rare event, even if the war continues to go badly for… https://t.co/ucmu7gC34T|en|R|5|14
1507353694592978944|13218102|Fri Mar 25 13:48:20 +0000 2022|BlackRock chief Larry Fink says Ukraine war marks end of globalisation https://t.co/WgFKic27ka|en|R|3|12
1507339126345015296|13218102|Fri Mar 25 12:50:27 +0000 2022|Biden, E.U. announce partnership to reduce Europe’s reliance on Russian energy https://t.co/8xCe5ouYKn|en|R|7|28
1507336876189011995|13218102|Fri Mar 25 12:41:30 +0000 2022|COVID-19 pandemic's impact on births and deaths results in a record number of counties experiencing natural decreas… https://t.co/KTqvXXG62y|en|R|4|5
1507331128390307851|13218102|Fri Mar 25 12:18:40 +0000 2022|Thousands of Ukrainians have been flying into Mexico as a transit point before seeking asylum at the U.S. border… https://t.co/IcwsiIezJA|en|R|8|24
1507330958063722501|13218102|Fri Mar 25 12:17:59 +0000 2022|The U.K. government said that Russian mercenary company Wagner Group is being used to try to assassinate Ukrainian… https://t.co/uzIngn899a|en|R|5|13
1507324818378694659|13218102|Fri Mar 25 11:53:36 +0000 2022|Initial jobless claims decreased last week to the lowest level since September 1969 https://t.co/3uMya9EvQw via @WSJ|en|R|28|103
1507324442317553674|13218102|Fri Mar 25 11:52:06 +0000 2022|With the world watching Ukraine, bad actors in Asia are on the march. https://t.co/W38T5RV6TP via @WSJOpinion|en|R|5|25
1507074858814951437|13218102|Thu Mar 24 19:20:21 +0000 2022|I was pleased that @USTreasury took action following a push from me and a bipartisan group of colleagues to help pr… https://t.co/coPMJzb2f2|en|R|12|28
1507047890140778499|13218102|Thu Mar 24 17:33:11 +0000 2022|This week, the American people have been able to hear directly from Judge Ketanji Brown Jackson, President Biden's… https://t.co/6feW7aDGib|en|R|30|78
1507023152668454918|13218102|Thu Mar 24 15:54:53 +0000 2022|Compared to Kavanaugh? Naw. https://t.co/vt3ceYqp06|en|R|59|365
1506981323864522755|13218102|Thu Mar 24 13:08:40 +0000 2022|Scoop: Senators to discuss freezing Russian gold with Yellen https://t.co/xp3Tw2OxDC|en|R|4|15
1506942405588754436|13218102|Thu Mar 24 10:34:01 +0000 2022|"Just do it!

U.S. airline CEOs urge Biden to lift COVID mask mandate -letter https://t.co/GUToCfP8S2"|en|R|25|94
1506941617537789956|13218102|Thu Mar 24 10:30:53 +0000 2022|"NATO: 7,000 to 15,000 Russian troops dead in Ukraine
https://t.co/5wB5xqLBZX"|en|R|6|16
1506938954444165121|13218102|Thu Mar 24 10:20:18 +0000 2022|President Biden and NATO are still too cautious in opposing Putin’s war in Ukraine. https://t.co/u0AiLzhe6F via @WSJOpinion|en|R|7|29
1506749894891032586|13218102|Wed Mar 23 21:49:03 +0000 2022|Just got off the phone with Treasury Secretary Yellen and Senators King, Hassan and Hagerty, to discuss our Russian… https://t.co/xaX7ge7pkz|en|R|18|62
1506735129741467652|13218102|Wed Mar 23 20:50:23 +0000 2022|"Without asylum reforms, the #BidenBorderCrisis will just get worse:

Border officials expect Biden to end Trump Tit… https://t.co/myn03HZMvP"|en|R|8|21
1506729525283110912|13218102|Wed Mar 23 20:28:07 +0000 2022|#BidenBorderCrisis https://t.co/eTYolJaZR7|und|R|20|54
1506659927405772803|13218102|Wed Mar 23 15:51:33 +0000 2022|A force of nature https://t.co/0BY8LrddPR|en|R|22|124
1506649245557964808|13218102|Wed Mar 23 15:09:06 +0000 2022|😳 https://t.co/Jj4XFanvC4|und|R|19|92
1506637564979347463|13218102|Wed Mar 23 14:22:42 +0000 2022|The Senate is not here to rubber-stamp the nominee. We are here to scrutinize her record, understand her thinking &amp;… https://t.co/3GSW6lqS7M|en|R|55|282
1506636837292544009|13218102|Wed Mar 23 14:19:48 +0000 2022|Biden’s war on domestic oil production expands to Wall Street https://t.co/NMaOFrAd0x|en|R|15|35
1506629515950317573|13218102|Wed Mar 23 13:50:43 +0000 2022|“Energy is the bedrock of nations’ economic prosperity, military strength and geopolitical power.” https://t.co/upTFtvWOQB|en|R|15|50
1506629300719599620|13218102|Wed Mar 23 13:49:51 +0000 2022|via @NYTOpinion https://t.co/BKQbynhqbI|und|R|3|3
1506578403142643712|13218102|Wed Mar 23 10:27:36 +0000 2022|A New Iran Deal Leaves Us Meeker and Weaker https://t.co/6swyjAVErv|en|R|17|55
1506576743565561859|13218102|Wed Mar 23 10:21:01 +0000 2022|As Russia Stalls in Ukraine, Dissent Brews Over Putin’s Leadership https://t.co/rNAX8P4cKo|en|R|4|26
1506415301386190856|13218102|Tue Mar 22 23:39:30 +0000 2022|Not arguing pro or con, just exposing judicial policymakers. Unelected, life tenured judges are consistently erodin… https://t.co/YSr3sGs4Y8|en|R|23|102
1506341089715830787|13218102|Tue Mar 22 18:44:36 +0000 2022|Today I asked Judge Jackson why in the world she would accuse Secretary of Defense Rumsfeld and George W. Bush of b… https://t.co/GCNs3IPOtv|en|R|594|1149
1506332552436592645|13218102|Tue Mar 22 18:10:41 +0000 2022|If you accuse someone of war crimes you are calling them war criminals. https://t.co/QAxO0peYP9|en|R|41|132
1506329756333182990|13218102|Tue Mar 22 17:59:34 +0000 2022|"False:
By the actions described above, Respondents’ acts directing, ordering, confirming,
ratifying, and/or conspir… https://t.co/lSOhiavPpp"|en|R|13|45
1506321047049621510|13218102|Tue Mar 22 17:24:58 +0000 2022|The law that let Russian entities keep much of their D.C. influence peddling outside public view https://t.co/tKUUG5HLQk via @politico|en|R|7|13
1506260372285706246|13218102|Tue Mar 22 13:23:52 +0000 2022|The Senate has begun its important constitutional role of ‘advice &amp; consent’ for Judge Ketanji Brown Jackson to ser… https://t.co/8xfxRotBa8|en|R|23|145
1506220153847128069|13218102|Tue Mar 22 10:44:03 +0000 2022|‘They own the long clock’ — How the Russian military is starting to adapt in Ukraine https://t.co/BEn654PrCI|en|R|4|16
1506076392781500420|13218102|Tue Mar 22 01:12:48 +0000 2022|Translation: yes https://t.co/NuB3wUWKgA|en|R|10|50
1506074502832312323|13218102|Tue Mar 22 01:05:17 +0000 2022|So why just talk about it? https://t.co/2mAKzoUziC|en|R|32|209
1506012482275786752|13218102|Mon Mar 21 20:58:50 +0000 2022|Let’s hope the federal government will do as well. https://t.co/sLiTDbuQYR|en|R|4|24
1506010884346318858|13218102|Mon Mar 21 20:52:29 +0000 2022|In considering a SCOTUS nominee, we should recall the wisdom of the Framers of our Constitution who established our… https://t.co/qvb9fw22CK|en|R|20|84
1505955239521890315|13218102|Mon Mar 21 17:11:23 +0000 2022|As the confirmation hearing for Judge Jackson began, I shared my initial concerns and my hopes of how this process… https://t.co/XFn4K8MyQV|en|R|6|28
1505954078525906950|13218102|Mon Mar 21 17:06:46 +0000 2022|Elon Musk's 'very effective' Starlink keeping Ukrainians online during Russian invasion https://t.co/vnhIErwxlY #FoxBusiness|en|R|5|31
1505953171176308745|13218102|Mon Mar 21 17:03:09 +0000 2022|Recriminations and finger-pointing have begun in Russia’s spy and defense agencies, as Ukraine invasion has turned… https://t.co/noN1YLmcSx|en|R|7|16
1505923384873566214|13218102|Mon Mar 21 15:04:48 +0000 2022|And so it begins…. #SCOTUS https://t.co/pN0j1deQVP|en|R|17|153
1505910307222437893|13218102|Mon Mar 21 14:12:50 +0000 2022|A formal conference committee of the House and Senate can address legitimate concerns about, especially, the House'… https://t.co/DKuCIHtQNj|en|R|9|14
1505867588542382084|13218102|Mon Mar 21 11:23:05 +0000 2022|“no matter how much Moscow might spend on its military, it could never match America’s advanced weapons.” https://t.co/NaHBrpjV2Y|en|R|6|29
1505856785374134273|13218102|Mon Mar 21 10:40:09 +0000 2022|A tech blockade will hurt Russia’s ability to get sophisticated semiconductors. The country’s chip-building technol… https://t.co/bleEhK56vn|en|R|8|27
1505855105379229698|13218102|Mon Mar 21 10:33:29 +0000 2022|U.S. officials see signs Russia is shifting strategy to secure territorial objectives and seek leverage to compel t… https://t.co/LJEiEM1Edw|en|R|4|22
1505689997697077251|13218102|Sun Mar 20 23:37:24 +0000 2022|Judge the CHIPs Act as defense policy, not industrial policy https://t.co/Jz9ry84rP8|en|R|8|49
1505525478160953345|13218102|Sun Mar 20 12:43:39 +0000 2022|👇 https://t.co/V9KNTm3O2u|und|R|103|429
1505497931964628992|13218102|Sun Mar 20 10:54:12 +0000 2022|Enjoyed meeting and thanking Texans serving forward in Germany in support of our @NATO allies. https://t.co/rAUOpGSY2N|en|R|20|114
1505427609731014656|13218102|Sun Mar 20 06:14:46 +0000 2022|Senators travel to Poland and Germany to discuss ongoing NATO efforts https://t.co/zJsIBd0y4K|en|R|17|75
1505250995705577476|13218102|Sat Mar 19 18:32:58 +0000 2022|Ask Germany what setting unrealistic green energy goals produces- reliance on Russian-produced energy.|en|R|43|199
1505220811585568769|13218102|Sat Mar 19 16:33:01 +0000 2022|With Senate colleagues in Wiesbaden, Germany https://t.co/Wew6rdOur0|en|R|8|65
1505219593240948737|13218102|Sat Mar 19 16:28:11 +0000 2022|Milny Refugee Center, Poland https://t.co/Fx4zoItoka|pl|R|20|149
1505113521721249795|13218102|Sat Mar 19 09:26:41 +0000 2022|Russia is now pursuing a strategy of attrition,” said Lieutenant General Jim Hockenhull, the U.K.’s Chief of Defence Intelligence. @business|en|R|7|26
1504908789392150529|13218102|Fri Mar 18 19:53:09 +0000 2022|Now more than ever, our Border Patrol agents put their lives at risk every day they put on their uniform, &amp; they de… https://t.co/u3SwbId8Bv|en|R|10|39
1504906163950817283|13218102|Fri Mar 18 19:42:43 +0000 2022|"US demands Russia allow access to detained Brittney Griner | AP News https://t.co/eBNPp9jWJt"|en|R|9|43
1504861339528810502|13218102|Fri Mar 18 16:44:36 +0000 2022|As the fires in Eastland County continue to burn, I urge all Texans in the area to monitor developments and follow… https://t.co/NrRDgGsrsd|en|R|10|34
1504566616939499520|13218102|Thu Mar 17 21:13:29 +0000 2022|Guided by his strong work ethic and commitment to the TX Panhandle, Gary Fletcher’s life is remembered by his servi… https://t.co/ETFG1ijbSh|en|R|3|15
1504544291145797642|13218102|Thu Mar 17 19:44:46 +0000 2022|Information can help the Russian population stay focused on the true cause of sanctions and the true cost of war.… https://t.co/qJId493OXL|en|R|8|17
1504403477128261632|13218102|Thu Mar 17 10:25:14 +0000 2022|As Russian Troop Deaths Climb, Morale Becomes an Issue, Officials Say https://t.co/QTGMkXOZrn|en|R|10|58
1504217291151626245|13218102|Wed Mar 16 22:05:23 +0000 2022|Expanding I-27 unleashes Texas’ energy &amp; agricultural markets, creating more jobs and future economic opportunities… https://t.co/gMcfpI8Gl2|en|R|10|27
1504217178358353930|13218102|Wed Mar 16 22:04:56 +0000 2022|Today I joined @POTUS at the White House to celebrate the signing of the Violence Against Women Act Reauthorization… https://t.co/8zuWQqQzZr|en|R|9|50
1504180038773653509|13218102|Wed Mar 16 19:37:22 +0000 2022|Mental health courts, crisis intervention teams &amp; other programs have helped law enforcement assist people experien… https://t.co/fFUn0ogljM|en|R|6|20
1504179840009789446|13218102|Wed Mar 16 19:36:34 +0000 2022|"This week I introduced a bill to honor the life and memory of former Rep. Ron Wright.
 
A public servant through an… https://t.co/ezUHFRoPIv"|en|R|3|12
1504151803851689994|13218102|Wed Mar 16 17:45:10 +0000 2022|This morning my colleagues &amp; I heard directly from @ZelenskyyUa about the horrors and war crimes being committed ag… https://t.co/WHv92G6MBw|en|R|21|116
1504081914143158277|13218102|Wed Mar 16 13:07:27 +0000 2022|President Zelensky speaking to US Congress https://t.co/SjmFO4zGpz|en|R|32|267
1503901422127095814|13218102|Wed Mar 16 01:10:14 +0000 2022|Senate passes resolution to scrap mask mandate for public travel https://t.co/ue1M7clA3Z|en|R|40|270
1503800138560679950|13218102|Tue Mar 15 18:27:46 +0000 2022|The U.S has taken important action to sanction Russia for their violent and unprovoked attacks on Ukraine, but more… https://t.co/4xQQ1dTiS4|en|R|4|10
1503800048714452992|13218102|Tue Mar 15 18:27:25 +0000 2022|TX families are paying more for everything from groceries to clothes to appliances, but one thing stands out – the… https://t.co/IZFZgHumCR|en|R|22|86
1503747427081367577|13218102|Tue Mar 15 14:58:19 +0000 2022|Good: MoneyGram Suspends Service in Russia - https://t.co/5fABkM2bok|en|R|6|23
1503684116398710786|13218102|Tue Mar 15 10:46:45 +0000 2022|The press should ask President Biden whether he’ll do everything possible to expand American energy production.… https://t.co/41SPaMKhy9|en|R|34|172
1503682809851957249|13218102|Tue Mar 15 10:41:33 +0000 2022|Tech's globalist dream is dying https://t.co/Mo27VWMbaz|en|R|3|16
1503678721357660164|13218102|Tue Mar 15 10:25:18 +0000 2022|An Airlift Could Save Ukraine by Douglas J. Feith and John Hannah https://t.co/GjjBhtemVs via @WSJOpinion|en|R|5|16
1503437945537277959|13218102|Mon Mar 14 18:28:33 +0000 2022|Biden’s War on Oil Hits Consumers by Harold Hamm https://t.co/7FJqoCaa47|en|R|27|81
1503409577869692936|13218102|Mon Mar 14 16:35:50 +0000 2022|Germany to buy dozens of US fighter jets in spending spree https://t.co/zeg8cZFOau via @FRANCE24|en|R|13|57
1503089810990321664|13218102|Sun Mar 13 19:25:11 +0000 2022|GOP Sen. Portman: 'I don't understand' why US not transferring jets to Ukraine https://t.co/sVgVM49bnN|en|R|58|183
1503024600426369034|13218102|Sun Mar 13 15:06:04 +0000 2022|The end of history – the peaceful victory of democracy over other systems of government – has definitively come to… https://t.co/d2pOjj4SIW|en|R|8|38
1503024074431381505|13218102|Sun Mar 13 15:03:58 +0000 2022|Standing Up to Putin: Inside Germany's Foreign and Security Policy Revolution https://t.co/ORFFdP9A88 via @derspiegel|en|R|11|24
1503019111164657673|13218102|Sun Mar 13 14:44:15 +0000 2022|via @NYTOpinion https://t.co/2cWYuDomhf|und|R|10|23
1502983000610549763|13218102|Sun Mar 13 12:20:46 +0000 2022|Russian serving propaganda https://t.co/kVZ5epD5Ea|in|R|15|62
1502981862502932481|13218102|Sun Mar 13 12:16:14 +0000 2022|Turning Down the Climate-Change Heat https://t.co/bfeYqXRbLy|en|R|9|38
1502835897674391555|13218102|Sun Mar 13 02:36:14 +0000 2022|NATO Needs More Guns and Less Butter by Glenn Hubbard https://t.co/nquHgF3d3x|en|R|8|45
1502634383764865026|13218102|Sat Mar 12 13:15:29 +0000 2022|Democratic Senators, including Elizabeth Warren, have proposed a windfall-profits tax that would reduce oil product… https://t.co/lamXGEGRjo|en|R|56|142
1502351064980414464|13218102|Fri Mar 11 18:29:40 +0000 2022|#BidenBorderCrisis #openborders https://t.co/iQoueEqiul|und|R|13|26
1502350575253565449|13218102|Fri Mar 11 18:27:44 +0000 2022|ICE report shows sharp drop in deportations, immigration arrests under Biden https://t.co/NTYev4KPX2|en|R|22|38
1502290697424093193|13218102|Fri Mar 11 14:29:48 +0000 2022|Latinas Are Pushing a Political Revolution in South Texas—to the Right https://t.co/fa7xqtXAHh|en|R|42|173
1502290243327832064|13218102|Fri Mar 11 14:27:59 +0000 2022|John Cornyn renews calls for Joe Biden to help Trevor Reed, a Texan detained in Russia for more than two years… https://t.co/1JDm8dh30O|en|R|16|40
1502284154418966529|13218102|Fri Mar 11 14:03:48 +0000 2022|Democrats want the oil industry to drill more. What does that mean for climate campaigners? https://t.co/yPaiYxzUoL|en|R|10|45
1502283172364623878|13218102|Fri Mar 11 13:59:54 +0000 2022|The Australian gov’t said on Thursday it would increase the size of its military 30% by 2040. “Our world is becomin… https://t.co/ouOPKcXtWP|en|R|13|30
1502278549650161665|13218102|Fri Mar 11 13:41:31 +0000 2022|"4 Falsehoods Russians Are Told About the War

https://t.co/Bzvg5SXFBS"|en|R|9|18
1502085716238553096|13218102|Fri Mar 11 00:55:16 +0000 2022|The earnings from oil and gas exports provide the financial foundation for the Russian state and Russian power—in n… https://t.co/ks7g6pyPXs|en|R|8|29
1502050885886742540|13218102|Thu Mar 10 22:36:52 +0000 2022|Ridiculous: TSA extended the mask mandate on planes, buses and trains by another 30 days. @axios|en|R|148|898
1502049836543225856|13218102|Thu Mar 10 22:32:42 +0000 2022|"Today I met with Judge Ketanji Brown Jackson, Pres. Biden's nominee to the Supreme Court.
 
She’s well-qualified by… https://t.co/Ub4dtpD1eZ"|en|R|47|315
1501945924871811073|13218102|Thu Mar 10 15:39:47 +0000 2022|President Biden recently agreed to ban the import of Russian oil. This is an important step, but there’s more we mu… https://t.co/GkkCssIRkV|en|R|11|79
1501945276486983686|13218102|Thu Mar 10 15:37:13 +0000 2022|With consumer prices rising faster than any time in the last 40 years, hard-working TX families are feeling the pin… https://t.co/t6gd9mltST|en|R|40|151
1501938001877692421|13218102|Thu Mar 10 15:08:18 +0000 2022|Senate Select Committee on Intelligence World Wide Threat hearing starts now https://t.co/9OjtVEJ97J|en|R|8|43
1501896150017789957|13218102|Thu Mar 10 12:22:00 +0000 2022|Now do planes. https://t.co/p8uw7qWIzx|en|R|20|87
1501892705819013124|13218102|Thu Mar 10 12:08:19 +0000 2022|More socialist craziness: Biden urged to unleash Defense Production Act to expand green energy rather than oil prod… https://t.co/A0sVbODDf7|en|R|73|159
1501886917713211392|13218102|Thu Mar 10 11:45:19 +0000 2022|Texas barbecue is a pillar of the state’s culture. Rising meat prices have some worried about its future. https://t.co/x1lepym4ai via @WSJ|en|R|17|59
1501880321075302401|13218102|Thu Mar 10 11:19:06 +0000 2022|The Bureau of Labor Statistics is releasing the February consumer price index this morning at 8:30 a.m., and needle… https://t.co/4UwpdPRZ6S|en|R|12|63
1501708700309934085|13218102|Wed Mar 09 23:57:09 +0000 2022|via @NYTimes https://t.co/IXUQqM3gF6|und|R|11|21
1501661653317918730|13218102|Wed Mar 09 20:50:12 +0000 2022|“We are on a war footing,” stated Energy Secretary Jennifer Granholm at the CERAWeek by S&amp;P Global energy conferenc… https://t.co/LY3SIi4NfP|en|R|14|45
1501659593465901058|13218102|Wed Mar 09 20:42:01 +0000 2022|Which is why we need an all-of-the-above energy strategy https://t.co/QRHyPtw9tm|en|R|16|62
1501569975571689480|13218102|Wed Mar 09 14:45:54 +0000 2022|Heard on the Street: Oil cartel producers can open their taps to help balance the market, but it would mean choosin… https://t.co/YMEGu1c6iW|en|R|7|22
1501558595456016395|13218102|Wed Mar 09 14:00:41 +0000 2022|Austin's music scene blasts out of the pandemic https://t.co/NJAIDE1pZm|en|R|4|18
1501547348501184519|13218102|Wed Mar 09 13:15:59 +0000 2022|Woman Hid Moscow Ties While Pushing ‘I Love Russia’ Propaganda, U.S. Says https://t.co/ZCBzVCBKVd|en|R|2|14
1501330575365394432|13218102|Tue Mar 08 22:54:37 +0000 2022|Today I joined nearly 150 of my House &amp; Senate colleagues in calling for essential semiconductor funding to address… https://t.co/LQekHsXbrh|en|R|20|82
1501328690151632900|13218102|Tue Mar 08 22:47:07 +0000 2022|Good. Now we need to get Trevor home. https://t.co/bdMNKNoeOL|en|R|16|62
1501303751130243073|13218102|Tue Mar 08 21:08:01 +0000 2022|"Ds planning for  shutdown?
“Even if the House votes on the [omnibus] bill before the chamber’s Democrats leave for… https://t.co/4GyIropjeG"|en|R|22|50
1501273688049606660|13218102|Tue Mar 08 19:08:34 +0000 2022|Hopefully as part of the omnibus https://t.co/0Q0mCaTLaM|en|R|7|28
1501227837050609665|13218102|Tue Mar 08 16:06:22 +0000 2022|UK says it will back Poland if decides to send jets to Ukraine https://t.co/Sttf6zj5YK|en|R|10|39
1501211352848912392|13218102|Tue Mar 08 15:00:52 +0000 2022|President Biden courts Venezuela and the Saudis for oil, but not U.S. or Canadian producers. https://t.co/eyzmLiPX58 via @WSJOpinion|en|R|37|109
1501202889032744963|13218102|Tue Mar 08 14:27:14 +0000 2022|As Russian President Vladimir Putin has violently attacked his democratic neighbor Ukraine, Russian oligarchs have… https://t.co/8F7R8vwL3d|en|R|154|225
1501202654609002499|13218102|Tue Mar 08 14:26:18 +0000 2022|Trevor Reed has been held in a Russian prison with little to no access to health care or communication with his fam… https://t.co/S3MzfDiznT|en|R|11|27
1501003918117122050|13218102|Tue Mar 08 01:16:36 +0000 2022|Biden, on veterans trip to Fort Worth, won’t meet parents of Trevor Reed, Marine jailed in Russia https://t.co/SQSlbnpwZe|en|R|43|50
1500966695355179008|13218102|Mon Mar 07 22:48:41 +0000 2022|"People around the world have rallied around Ukraine – offering support in ways big and small.
 
But blatant war cri… https://t.co/ngBOv2NpIm"|en|R|12|46
1500942108043137025|13218102|Mon Mar 07 21:10:59 +0000 2022|As the world stands up to Russia by banning their oil, it seems President Biden wants to make it easier to buy from… https://t.co/pq9tu5GySw|en|R|140|583
1500907107352289283|13218102|Mon Mar 07 18:51:54 +0000 2022|"Great meeting today with @SBAList President @marjoriesba to discuss our work to protect the right to life.
 
There’… https://t.co/Rm8VthXGv9"|en|R|12|53
1500881544252117001|13218102|Mon Mar 07 17:10:19 +0000 2022|Democrats at an ideological crossroads in Texas https://t.co/mOiOrlDeiV|en|R|26|97
1500841670815928328|13218102|Mon Mar 07 14:31:53 +0000 2022|A U.S. ban on Russian oil imports is only a distraction from Washington’s failure to employ stronger sanctions agai… https://t.co/Ypafs9evWN|en|R|13|65
1500840822715162624|13218102|Mon Mar 07 14:28:31 +0000 2022|ESG May Be an Antitrust Violation by @GeneralBrnovich https://t.co/mvCqPYClJC via @WSJOpinion|en|R|7|20
1500820563417350149|13218102|Mon Mar 07 13:08:00 +0000 2022|Good https://t.co/Ky5kyPe2Vi|en|R|6|82
1500636216940765185|13218102|Mon Mar 07 00:55:29 +0000 2022|via @NYTimes https://t.co/Nttxa7JQx3|und|R|8|44
1500574935860879361|13218102|Sun Mar 06 20:51:58 +0000 2022|Bob Gates: We need a more realistic strategy for the post-Cold War era https://t.co/DnBecLCDtQ|en|R|7|30
1500510978672414723|13218102|Sun Mar 06 16:37:50 +0000 2022|Investigate Russia's covert funding of US anti-fossil fuel groups https://t.co/XKVCBkJgfo|en|R|47|134
1500508888034160642|13218102|Sun Mar 06 16:29:31 +0000 2022|Russian Banks to Switch to Chinese Card System after Visa, Mastercard Suspend Operations in Russia https://t.co/U8Q3Mcugca|en|R|26|50
1500508316706951172|13218102|Sun Mar 06 16:27:15 +0000 2022|Now! https://t.co/imYcEd3gMw|und|R|3|20
1500507939156676611|13218102|Sun Mar 06 16:25:45 +0000 2022|Do it https://t.co/e3z9xijfT2|en|R|32|163
1500507705013903361|13218102|Sun Mar 06 16:24:49 +0000 2022|https://t.co/2oKeLxXfT0 https://t.co/dz3pCSl50B|und|R|6|25
1500507408094973956|13218102|Sun Mar 06 16:23:38 +0000 2022|Just as the US and NATO are providing other defensive weapons to Ukraine, we should also provide them airplanes to… https://t.co/xg50yUqb3I|en|R|26|109
1500504034263932930|13218102|Sun Mar 06 16:10:14 +0000 2022|As 8 Russian aircraft are shot down, captured troops condemn invasion https://t.co/NYaG0OKVLe via @MailOnline|en|R|15|47
1500501556189450241|13218102|Sun Mar 06 16:00:23 +0000 2022|Bravo: Visa, Mastercard suspend operations in Russia over Ukraine invasion https://t.co/AqfqNfXhxn|en|R|7|31
1500483032016375811|13218102|Sun Mar 06 14:46:47 +0000 2022|China says it seeks to ‘resolve’ Taiwan question, amid comparisons to Ukraine https://t.co/TWrJ6USsjC|en|R|10|23
1500471568903909380|13218102|Sun Mar 06 14:01:14 +0000 2022|"Imagine: ""You’re a 22-year-old Ukrainian who has just been handed a Kalashnikov, four magazines of thirty rounds, a… https://t.co/Cg1RhdRWtM"|en|R|111|691
1500470001320579074|13218102|Sun Mar 06 13:55:00 +0000 2022|Ukraine Changes Everything by  @DanHenninger https://t.co/4W5PsqwjWF via @WSJOpinion|en|R|7|26
1500461535507984391|13218102|Sun Mar 06 13:21:21 +0000 2022|Nuclear, coal, LNG: 'no taboos' in Germany's energy about-face https://t.co/747fiG6NoC|en|R|8|31
1500217549920911365|13218102|Sat Mar 05 21:11:51 +0000 2022|Former citizenship chief urges Biden to halt Russian visas https://t.co/StfZDQMdB4 via @washtimes|en|R|16|48
1499903373767626752|13218102|Sat Mar 05 00:23:25 +0000 2022|Remarkable https://t.co/xNTt6xXwtF|en|R|14|83
1499551665296486414|13218102|Fri Mar 04 01:05:51 +0000 2022|"Today the Senate passed my bill to rename the VA Clinic in San Angelo, Texas.
 
The new name honors Colonel Charles… https://t.co/mwQbDu0lkT"|en|R|10|45
1499551568873631752|13218102|Fri Mar 04 01:05:28 +0000 2022|Big thanks to @usmayors, @leagueofcities, @NACoTweets, @ICMA, @NatlGovsAssoc, @NCSLorg, @CSGovts &amp; @NCAI1944 for su… https://t.co/hfM9y4AASK|en|R|8|25
