id|user|created_at|text|lang|label|retweet_count|favorite_count
1450485993237147659|13218102|Tue Oct 19 15:36:24 +0000 2021|SEN. CORNYN: Do you agree with me that the decision by Secretary Mayorkas to no longer detain or deport people who… https://t.co/bApzpPS4pV|en|R|26|118
1450413737958125572|13218102|Tue Oct 19 10:49:17 +0000 2021|"Can't say the Biden Administration was surprised by supply chain disruptions (from June):

FACT SHEET: Biden-Harris… https://t.co/7ZmQW4XDED"|en|R|16|36
1450410558256259073|13218102|Tue Oct 19 10:36:39 +0000 2021|"And you thought this was just a #BidenBorderCrisis :

Biden secretly flying underage migrants into NY in dead of ni… https://t.co/tbpPFmAaae"|en|R|97|167
1450215182223937541|13218102|Mon Oct 18 21:40:17 +0000 2021|I had a good call this afternoon with the Texas Border Sheriff’s Coalition, whose members are being left to deal wi… https://t.co/0oA7jPDz3w|en|R|46|223
1450170632394747909|13218102|Mon Oct 18 18:43:16 +0000 2021|"Today our nation lost an exemplary leader and steadfast advocate in Colin Powell. 
 
General Powell served America… https://t.co/2Zry7y9YQD"|en|R|10|117
1450168902202298371|13218102|Mon Oct 18 18:36:23 +0000 2021|The State Department said that they “are unable to estimate how many SIV-eligible nor SIV-holder Afghans remain in… https://t.co/8UgCTY0KFl|en|R|13|30
1450144074527395844|13218102|Mon Oct 18 16:57:44 +0000 2021|Sinema Saving Seats of Silent Dems https://t.co/NcAu5CqhSE|en|R|11|39
1450111123148115968|13218102|Mon Oct 18 14:46:48 +0000 2021|‘The long, long goodbye.’ Investors and governments are shifting resources away from fossil fuels to clean energy s… https://t.co/fhg68sDdKk|en|R|10|36
1450110049003659266|13218102|Mon Oct 18 14:42:32 +0000 2021|"“It’s a perfect storm: supply-chain bottlenecks, tight labor markets, ultra-easy monetary and fiscal policies.""

—… https://t.co/rSYquCzIO1"|en|R|7|36
1450098834579800066|13218102|Mon Oct 18 13:57:58 +0000 2021|"Transitory? Nope.

Economists see supply-chain disruptions, labor shortages as bigger risks to economy into next ye… https://t.co/CmhajvQPre"|en|R|20|58
1450044864041787392|13218102|Mon Oct 18 10:23:30 +0000 2021|Americans Revert to Favoring Reduced Government Role https://t.co/6vSRzwFoKE|en|R|36|159
1450044267498545152|13218102|Mon Oct 18 10:21:08 +0000 2021|Here it is: https://t.co/t8qdvKa4ZD https://t.co/lzruW7Vx4U|en|R|34|101
1450043409142538247|13218102|Mon Oct 18 10:17:43 +0000 2021|Congress returns from recess today with 13 days until Speaker NANCY PELOSI’s new Halloween deadline to pass the par… https://t.co/BGmTLp9dSO|en|R|64|174
1449727957409337344|13218102|Sun Oct 17 13:24:14 +0000 2021|Cornyn meets with Afghans, who tell him of the many left behind in their homeland https://t.co/6u5J9f7J2U|en|R|48|169
1449724990211907586|13218102|Sun Oct 17 13:12:26 +0000 2021|Democrats Weigh Carbon Tax After Manchin Rejects Key Climate Provision https://t.co/BABzf1ABS3|en|R|8|43
1449722349746597891|13218102|Sun Oct 17 13:01:57 +0000 2021|The ‘Renewable’ Fallacy and Why I Blame Jimmy Carter https://t.co/b8EMzFGNuk via @commentary|en|R|11|43
1449721736921075713|13218102|Sun Oct 17 12:59:31 +0000 2021|Virginia Dad Takes On the School Board by @wjmcgurn https://t.co/pSENJBVKVx via @WSJOpinion|en|R|13|53
1449720081378942982|13218102|Sun Oct 17 12:52:56 +0000 2021|Partisan Science in America by Gary Saul Morson https://t.co/zuSkxe8n7F via @WSJOpinion|en|R|14|68
1449714529642876931|13218102|Sun Oct 17 12:30:52 +0000 2021|We Got Here Because of Cowardice. We Get Out With Courage https://t.co/aim1lLeL5S via @commentary|en|R|16|56
1449463129801375745|13218102|Sat Oct 16 19:51:54 +0000 2021|Enjoyed being with ⁦@Glynis_TFRW⁩ and all the other incredible Republican women today ⁦@TFRW⁩ #TFRWLeads #TFRWDazzle https://t.co/Vpta0Mb3Am|en|R|11|38
1449372223853273096|13218102|Sat Oct 16 13:50:40 +0000 2021|GOP gains among AAPI voters could jeopardize Democrats’ control of Congress https://t.co/gWzC7oWzlt via @theyappie|en|R|20|57
1449371786370588677|13218102|Sat Oct 16 13:48:56 +0000 2021|"""It now appears all but impossible for Democrats to enact a reconciliation package that’s anywhere near as far-reac… https://t.co/8f5gHddzAK"|en|R|22|91
1449356277373616131|13218102|Sat Oct 16 12:47:18 +0000 2021|Soros drops $1 million on anti-police effort in austin https://t.co/BgMGoTRSLy|en|R|177|204
1449353609276272641|13218102|Sat Oct 16 12:36:42 +0000 2021|Democrats have declared war on ‘school board moms’ https://t.co/DodbvBgGmf via @AEI|en|R|11|24
1449350985340669954|13218102|Sat Oct 16 12:26:17 +0000 2021|All pandemics end eventually. Covid-19 has started down that path and will gradually become endemic. @TheEconomist|en|R|42|321
1449339678835068930|13218102|Sat Oct 16 11:41:21 +0000 2021|Asked whether government should do more or less to solve the country’s problems, 52% of Americans said government i… https://t.co/CDWmGJjEcr|en|R|19|97
1449338436683550728|13218102|Sat Oct 16 11:36:25 +0000 2021|With China in mind, Japan vows to double military spending. https://t.co/fJcMFxEPhP via @WSJOpinion|en|R|9|41
1449338057837137924|13218102|Sat Oct 16 11:34:55 +0000 2021|After waging war on the oil industry, President Biden suddenly wants its help to reduce gas prices. https://t.co/tFRd0LVxhu via @WSJOpinion|en|R|64|168
1449134797843017731|13218102|Fri Oct 15 22:07:14 +0000 2021|https://t.co/MqSdc6bj38|und|R|11|25
1449101099403722754|13218102|Fri Oct 15 19:53:19 +0000 2021|Many of our Afghan allies, whose bravery kept America &amp; our troops safe, are being welcomed to Texas by dedicated a… https://t.co/LLFdssufWO|en|R|16|66
1449081956264824837|13218102|Fri Oct 15 18:37:15 +0000 2021|Kamala Harris came in to solve issues in Central America. But the problem is now much bigger. - CNNPolitics https://t.co/1alwxJ6rlR|en|R|13|35
1449058431088922626|13218102|Fri Oct 15 17:03:46 +0000 2021|Taliban Takes Revenge On Former Afghan Security Forces https://t.co/4Zj9y6aUhq via @GandharaRFE|en|R|20|33
1448809586186723333|13218102|Fri Oct 15 00:34:57 +0000 2021|Good. Terrible, destructive idea https://t.co/6dkXIVBSw2|en|R|26|129
1448774754199031810|13218102|Thu Oct 14 22:16:32 +0000 2021|"Nearly 2,000 Chemicals—Some Potentially Harmful—Found in Vaping Aerosols | Smart News | Smithsonian Magazine https://t.co/Gv8CUImsRm"|en|R|23|45
1448731972663234568|13218102|Thu Oct 14 19:26:33 +0000 2021|Thank you @kaitlynforshort for your bravery in sharing your story today and to @RAINN for empowering survivors like… https://t.co/fJywT2Ej06|en|R|13|34
1448731712133926912|13218102|Thu Oct 14 19:25:30 +0000 2021|After our recent Senate hearings with brave survivors of Larry Nassar’s abuse, the need to empower victims &amp; ensure… https://t.co/5PuWGLSlnv|en|R|12|35
1448637610801389568|13218102|Thu Oct 14 13:11:35 +0000 2021|"Biden’s response: Great time to raise taxes!

U.S. growth is expected to slow to 1.4% in the third quarter compared… https://t.co/2UQgh7adge"|en|R|62|176
1448636550099709978|13218102|Thu Oct 14 13:07:22 +0000 2021|Semiconductors 101: Computer chips shortages lead to national security concerns https://t.co/R1weA7sI1k #FoxNews|en|R|9|22
1448616304102068225|13218102|Thu Oct 14 11:46:55 +0000 2021|The most strik­ing num­ber in the re­cent, bleak Quin­nip-iac poll on Mr. Biden was the 23% sup­port for his bor­de… https://t.co/imYFgKo81k|en|R|17|42
1448615686817947649|13218102|Thu Oct 14 11:44:28 +0000 2021|Biden and Nothingness by @DanHenninger https://t.co/dF3hI4Nnls|en|R|8|23
1448614413645266945|13218102|Thu Oct 14 11:39:24 +0000 2021|Most migrants who cross the U.S. border from Mexico are poor, but more-affluent people from pandemic-stricken South… https://t.co/8HIml2UqkZ|en|R|19|49
1448472886415699971|13218102|Thu Oct 14 02:17:02 +0000 2021|https://t.co/5bgld25aqA https://t.co/qtzEVm3DRq|und|R|12|89
1448417825698242562|13218102|Wed Oct 13 22:38:14 +0000 2021|Having given up on bipartisan reforms, they have only themselves to blame:                                        D… https://t.co/y2xwTVo03i|en|R|15|53
1448412823122546699|13218102|Wed Oct 13 22:18:21 +0000 2021|Today I had the honor of presenting the Congressional Badge of Bravery to two @FBISanAntonio Agents. Their heroic a… https://t.co/dxfuEONhCv|en|R|23|109
1448412678888771584|13218102|Wed Oct 13 22:17:47 +0000 2021|"The pandemic has shown the important work done by emergency nurses is front and center.
 
On #EmergencyNursesDay, I… https://t.co/4eHtvzCDdL"|en|R|8|42
1448382226060746761|13218102|Wed Oct 13 20:16:46 +0000 2021|Most of these drugs are smuggled across the US-Mexico border: U.S. Drug Overdoses Reached Record High amid Pandemic… https://t.co/qGwIvgFCqE|en|R|28|55
1448309822055751684|13218102|Wed Oct 13 15:29:04 +0000 2021|https://t.co/VG7zfgTeYh|und|R|7|11
1448288715999268869|13218102|Wed Oct 13 14:05:12 +0000 2021|Biden administration orders halt to ICE raids at worksites https://t.co/uxSQR54Uls|en|R|30|73
1448277866483945472|13218102|Wed Oct 13 13:22:05 +0000 2021|On this day in 1845, the voters of the Republic of Texas approved an ordinance to accept annexation by a vote of 4,… https://t.co/NJ0Z7P9JyE|en|R|71|459
1448257309755547648|13218102|Wed Oct 13 12:00:24 +0000 2021|Wait, We Still Want Fossil Fuels? by Holman W. Jenkins, Jr. https://t.co/DE4Lx3dn1C via @WSJOpinion|en|R|6|20
1448257070898233346|13218102|Wed Oct 13 11:59:27 +0000 2021|China’s Communist Party is ratcheting up its control over news media and online commentary, warning away private in… https://t.co/P6vsaAQn8f|en|R|47|54
1448254195128221696|13218102|Wed Oct 13 11:48:02 +0000 2021|For the first time in 20 months, Canadian and Mexican citizens will be permitted to enter the U.S. at its land-bord… https://t.co/XTrjyHa0es|en|R|12|40
1448252526621511684|13218102|Wed Oct 13 11:41:24 +0000 2021|"In addition to non-enforcement of the law at the border, 
""Biden Ends Workplace Immigration Raids, Reversing Trump… https://t.co/nUpv2QSomW"|en|R|47|96
1448029808005468162|13218102|Tue Oct 12 20:56:23 +0000 2021|This morning I held a roundtable in Austin to showcase how #HSI grants are shaping opportunities for students.… https://t.co/mAYRpHc8rk|en|R|10|44
1447966320298020865|13218102|Tue Oct 12 16:44:07 +0000 2021|Lawless: DHS Secretary Mayorkas Halts Work-Site Immigration Enforcement Operations https://t.co/Q6RHcVkMdN|en|R|73|138
1447925322624667652|13218102|Tue Oct 12 14:01:12 +0000 2021|Oil prices are rising, and the Biden Administration shouldn’t compound the damage from its assault on fossil fuels… https://t.co/exccPxQ7wE|en|R|25|71
1447921027569360905|13218102|Tue Oct 12 13:44:08 +0000 2021|"These devices are nothing more than a nicotine - an addictive drug - delivery device.

The men behind Puff Bar, the… https://t.co/LNCPUCy11o"|en|R|20|45
1447614650514821123|13218102|Mon Oct 11 17:26:42 +0000 2021|Iraq announces arrest of top ISIS financial figure in operation abroad - The Washington Post https://t.co/S23MyGtSRv|en|R|16|25
1447576223895465990|13218102|Mon Oct 11 14:54:01 +0000 2021|“To say simply [that] being here illegally is no longer a criteria for removal is to excuse knowingly breaking the… https://t.co/XRYYlMtwN8|en|R|35|112
1447564354094829573|13218102|Mon Oct 11 14:06:51 +0000 2021|Liberal Democrats have become the mainstream of the party and less willing to compromise with dwindling moderates https://t.co/pTCaXC9b7E|en|R|9|28
1447556824165756937|13218102|Mon Oct 11 13:36:55 +0000 2021|Taiwanese president responds to Xi’s call for peaceful reunification: Island will not ‘bow to pressure’ https://t.co/bDloyiAwII|en|R|76|185
1447549130461663237|13218102|Mon Oct 11 13:06:21 +0000 2021|Here is what the @WSJ editorial board thinks about that: https://t.co/xHcMzd6c0H https://t.co/1rpBup1ZRU|en|R|5|12
1447548532764905475|13218102|Mon Oct 11 13:03:59 +0000 2021|"""Those who don’t like it can respond next month when they vote on Proposition A, which would require two officers f… https://t.co/ikMHSloy6l"|en|R|20|46
1447547874171047936|13218102|Mon Oct 11 13:01:21 +0000 2021|After budget and staffing cuts, the city’s police department is urging residents to only call 911 if it’s really, r… https://t.co/QKTdJHBIoZ|en|R|36|91
1447546731705606146|13218102|Mon Oct 11 12:56:49 +0000 2021|In Europe energy prices have risen by a factor of five this year, and Vladimir Putin is exploiting the Continent’s… https://t.co/EYx5scgwj2|en|R|20|35
1447545939565203466|13218102|Mon Oct 11 12:53:40 +0000 2021|As E-Scooters and E-Bikes Proliferate, Safety Challenges Grow https://t.co/46R86eL45z|en|R|4|7
1447545211350048780|13218102|Mon Oct 11 12:50:47 +0000 2021|Because it is a dumb idea to defund police: A Year After ‘Defund,’ Police Departments Get Their Money Back https://t.co/xtUEvpD4QA|en|R|19|61
1447544535605784583|13218102|Mon Oct 11 12:48:06 +0000 2021|Thinking about getting a Covid-19 booster shot? If you had the disease and you are fully vaccinated, you probably d… https://t.co/S9qA8Vp3IC|en|R|9|26
1447544121976098822|13218102|Mon Oct 11 12:46:27 +0000 2021|Rising energy prices could push up inflation, damp consumer spending and ultimately slow the U.S. recovery, economi… https://t.co/WSvrPRGjea|en|R|19|34
1447538461343469571|13218102|Mon Oct 11 12:23:57 +0000 2021|Treasury Secretary Janet Yellen said she expects Congress to take action to bring the U.S. into line with a global… https://t.co/DcWglmxwSd|en|R|53|75
1447222412664311816|13218102|Sun Oct 10 15:28:05 +0000 2021|"Thanks President Biden: Denying safe havens for terrorists was the point of US presence in Afghanistan.

Taliban sa… https://t.co/m5hPAYzg1C"|en|R|20|45
1447219588421365772|13218102|Sun Oct 10 15:16:52 +0000 2021|Czech voters oust communists from parliament for first time since 1948 https://t.co/7fijRbtocB|en|R|261|900
1447217328228294666|13218102|Sun Oct 10 15:07:53 +0000 2021|An energy crisis is gripping the world, with potentially grave consequences https://t.co/07KwJlT2K3|en|R|17|44
1447182189469356032|13218102|Sun Oct 10 12:48:15 +0000 2021|Disinformation undermines public confidence in science https://t.co/l78qbXOvgU|en|R|212|667
1446954132846358530|13218102|Sat Oct 09 21:42:03 +0000 2021|What Is Texas? https://t.co/pY39OpUrdX|en|R|41|220
1446952390004023302|13218102|Sat Oct 09 21:35:07 +0000 2021|A genuine patriot. RIP https://t.co/Q0N75glv8W|en|R|10|114
1446912353895845890|13218102|Sat Oct 09 18:56:02 +0000 2021|Also, Art 2,sec 2: He (POTUS) shall have Power, by and with the Advice and Consent of the Senate, to make Treaties,… https://t.co/wceZXDhBWV|en|R|10|56
1446872495412420610|13218102|Sat Oct 09 16:17:39 +0000 2021|"Art 1, Sec 8 US Constitution: 
“The Congress shall have Power To lay and collect Taxes…To regulate Commerce with fo… https://t.co/6acW3PKeVn"|en|R|36|132
1446839105397174275|13218102|Sat Oct 09 14:04:58 +0000 2021|The Last Days of Intervention https://t.co/X1SmVpZtw4 via @ForeignAffairs|en|R|4|13
1446837544914665475|13218102|Sat Oct 09 13:58:46 +0000 2021|Cartel violence spills into us as border patrol treats gunshot victims https://t.co/iAqekcaqWj|en|R|21|40
1446834058122629121|13218102|Sat Oct 09 13:44:54 +0000 2021|The average car has 1,400 semiconductors @business|en|R|10|50
1446826397608124424|13218102|Sat Oct 09 13:14:28 +0000 2021|How about American history and civics? https://t.co/4scW7soeRj|en|R|126|620
1446823935362928641|13218102|Sat Oct 09 13:04:41 +0000 2021|"Good for Joe, prompting this debate: 

Benefits for All or Just the Needy? Manchin’s Demand Focuses Debate https://t.co/zIqeQ5lWbq"|en|R|10|39
1446821562355757060|13218102|Sat Oct 09 12:55:15 +0000 2021|"Biden cuts a unenforceable ""deal""

Global Deal to End Tax Havens Moves Ahead as Nations Back 15% Rate https://t.co/U52SVgPET0"|en|R|9|23
1446820331612684289|13218102|Sat Oct 09 12:50:22 +0000 2021|The global corporate tax project is bad policy that will reduce tax competition. Congress shouldn’t compound the da… https://t.co/79L3dcCTky|en|R|28|98
1446818296167346184|13218102|Sat Oct 09 12:42:17 +0000 2021|Apparently, they don't support any border security measures. https://t.co/yuR2IywATS|en|R|61|189
1446641289886420994|13218102|Sat Oct 09 00:58:55 +0000 2021|Bravo https://t.co/CfPCstHD8P|pt|R|7|41
1446578169633464320|13218102|Fri Oct 08 20:48:06 +0000 2021|Great conversation at #TexasBlockchainSummit today with @NSmolenski from @txblockchain1 discussing the future of bl… https://t.co/Y7Bqc6b1co|en|R|13|61
1446507827896459270|13218102|Fri Oct 08 16:08:35 +0000 2021|On the way! https://t.co/W3xhCDwOD1|en|R|1|7
1446506160329265152|13218102|Fri Oct 08 16:01:58 +0000 2021|Frustrated voting-rights advocates claw for opening on Senate filibuster https://t.co/qEHRuRmxLQ via @politico|en|R|3|13
1446496806418980902|13218102|Fri Oct 08 15:24:47 +0000 2021|Poll: 75 percent of voters disapprove of kamala harris’s handling of border crisis https://t.co/84M7bd7Uz6|en|R|38|173
1446495425633075202|13218102|Fri Oct 08 15:19:18 +0000 2021|US thinks twice about sanctioning India for Russian missile system https://t.co/qGsabp82Eh via @scmpnews|en|R|6|10
1446495180140556290|13218102|Fri Oct 08 15:18:20 +0000 2021|Japan ruling party manifesto calls for sharp rise in defence spending https://t.co/3qOFHTweOt|en|R|5|14
1446459419974320130|13218102|Fri Oct 08 12:56:14 +0000 2021|Microsoft report finds Russia dominant force behind cyberattacks in past year https://t.co/vMWCkhZGTg|en|R|29|71
1446447144194428931|13218102|Fri Oct 08 12:07:27 +0000 2021|Fentanyl overtakes car crashes as top cause of death among teenagers in Arizona border county https://t.co/Wg65vWNQGr|en|R|125|170
1446277460811829249|13218102|Fri Oct 08 00:53:11 +0000 2021|Last July we told Democrats that as long as they're going to continue to spend money in a purely partisan way, they… https://t.co/rnrQYTAO1f|en|R|13|116
1446245984598642694|13218102|Thu Oct 07 22:48:07 +0000 2021|Senator John Cornyn weighs in on debt ceiling update https://t.co/0jccRYdrt7|en|R|5|30
1446195208178262016|13218102|Thu Oct 07 19:26:21 +0000 2021|#OpenBidenBorder https://t.co/fEwnBGuZs5|und|R|23|59
1446149941441728512|13218102|Thu Oct 07 16:26:28 +0000 2021|They are trying. https://t.co/3UZZvB0VvN|en|R|10|35
1446135304881000451|13218102|Thu Oct 07 15:28:19 +0000 2021|Durham Probes Pentagon Computer Contractors in Anti-Trump Conspiracy  https://t.co/VWGDVKhxev|en|R|41|97
1446069892784984064|13218102|Thu Oct 07 11:08:23 +0000 2021|Attorney General Merrick Garland is nosing the Justice Department into threats against school boards. But these are… https://t.co/PPwMKpoKWs|en|R|57|236
1446067823785222154|13218102|Thu Oct 07 11:00:10 +0000 2021|"DPS seized $23M in fentanyl this year, Abbott calls on Biden to do more for the border | KVEO-TV https://t.co/eVC6YzuVwr"|en|R|42|103
1446062758173237250|13218102|Thu Oct 07 10:40:02 +0000 2021|"Americans Give President Biden Lowest Marks Across The Board, Quinnipiac University National Poll Finds;
Majority S… https://t.co/Rf7vNFXH2l"|en|R|57|240
1445892693641469964|13218102|Wed Oct 06 23:24:16 +0000 2021|No.  Otherwise we would have already exceeded the debt limit. This is for future spending. https://t.co/GFzc6YqVMI|en|R|345|1218
1445840194779836428|13218102|Wed Oct 06 19:55:39 +0000 2021|"I am thankful for the swift reaction by first responders and law enforcement in responding to today’s shooting.
 
M… https://t.co/oRzE10JNg7"|en|R|15|109
1445766399276711938|13218102|Wed Oct 06 15:02:25 +0000 2021|"This headline should be amended to read: ""After throwing them under the bus"" Biden Scales Back His Agenda in Hopes… https://t.co/GwcAUZBKjQ"|en|R|7|44
1445701167019749377|13218102|Wed Oct 06 10:43:12 +0000 2021|GOP Now Viewed as Better Party for Security, Prosperity https://t.co/fVR4aZZmpk|en|R|113|548
1445695557041733642|13218102|Wed Oct 06 10:20:55 +0000 2021|"""It’s a preposterous position, albeit of the sort this Administration often tries to sell. Such as: The soaring num… https://t.co/w7tBsZNTiG"|en|R|31|117
1445695132053823489|13218102|Wed Oct 06 10:19:13 +0000 2021|President Biden gives away the real reason Democrats won’t use the budget bill to raise the debt limit, even though… https://t.co/D9GozMbxCg|en|R|72|144
1445493937922138119|13218102|Tue Oct 05 20:59:45 +0000 2021|DOJ opens investigation into FBI mishandling gymnasts’ sexual abuse claims https://t.co/GWuZZzzhiB via @ladailynews|en|R|9|59
1445439775092183053|13218102|Tue Oct 05 17:24:32 +0000 2021|To all our teachers in Texas and around the world, Happy #WorldTeachersDay. Teachers devote so much every day to in… https://t.co/8H7YhIPgKB|en|R|28|131
1445339066741006336|13218102|Tue Oct 05 10:44:21 +0000 2021|CNN: The sausage-making on display over the past week in Washington was bad enough for Democrats trying to preserve… https://t.co/p4X1XFjWQb|en|R|20|122
1445335639797510144|13218102|Tue Oct 05 10:30:44 +0000 2021|Covid-19 live updates: Pfizer vaccine 90% effective against hospitalization, death six months later, study says https://t.co/ciJjgpaw1C|en|R|15|64
1445333649658896384|13218102|Tue Oct 05 10:22:49 +0000 2021|The tax agency would like to look at your financial transactions above $600. What could go wrong? https://t.co/O9nVfP2cUK via @WSJOpinion|en|R|46|153
1445098059709493249|13218102|Mon Oct 04 18:46:40 +0000 2021|via @NYTimes https://t.co/4o19Z9N36w|und|R|9|26
1445090016062066695|13218102|Mon Oct 04 18:14:42 +0000 2021|Of course, and we do. But you gotta have a base load too, as Texas was reminded during the polar vortex. Energy div… https://t.co/DIZT6gvKe2|en|R|19|105
1445079756354072584|13218102|Mon Oct 04 17:33:56 +0000 2021|This is what happens when the Biden declares war on fossil fuels. https://t.co/NNTTWWg9G1|en|R|28|96
1445079017930039305|13218102|Mon Oct 04 17:31:00 +0000 2021|OPEC and a Russia-led group of oil producers agreed to continue increasing production in measured steps, deciding a… https://t.co/nlgzia0E2w|en|R|14|30
1444689922888249349|13218102|Sun Oct 03 15:44:53 +0000 2021|From paints to plastics, a chemical shortage ignites prices https://t.co/uXKCL4LUAT|en|R|16|39
1444656114625392647|13218102|Sun Oct 03 13:30:32 +0000 2021|Climate Policy Meets Cold Reality in Europe by Allysia Finley https://t.co/jXQy2Qcbjt|en|R|29|84
1444638983477153795|13218102|Sun Oct 03 12:22:28 +0000 2021|Exclusive-Some Afghan evacuees leaving military bases in U.S. before resettlement https://t.co/xZ3cZVbE03 via @YahooNews|en|R|19|37
1444632638229303300|13218102|Sun Oct 03 11:57:15 +0000 2021|HAIDT: Monomania Is Illiberal and Stupefying https://t.co/Lg9LO9UAxc|en|R|4|8
1444628227234873345|13218102|Sun Oct 03 11:39:43 +0000 2021|When Biden ventured to the Capitol on Friday to help House Democrats, he had to choose sides. He effectively chose the left... . @nytimes|en|R|89|389
1444283706827546630|13218102|Sat Oct 02 12:50:43 +0000 2021|Notable &amp; Quotable: Susan Collins on Work https://t.co/44aJ69duLi via @WSJOpinion|en|R|11|26
1444282147343376389|13218102|Sat Oct 02 12:44:32 +0000 2021|China is struggling with widespread power shortfalls, risking disruption to global supply chains and heightened inf… https://t.co/AYKahOBOlc|en|R|28|78
1444277655474409473|13218102|Sat Oct 02 12:26:41 +0000 2021|Inflation Warning Signs Flash Red, Posing Challenge for Washington https://t.co/ARFSKWh0xl|en|R|11|65
1444013294445080577|13218102|Fri Oct 01 18:56:12 +0000 2021|Key Inflation Measure Soars to 30-Year High https://t.co/Jc3gZWq3YI|en|R|78|142
1444012874393849860|13218102|Fri Oct 01 18:54:32 +0000 2021|Economic development initiatives discussed at Cornyn roundtable https://t.co/npImJ0FiYh via @RioGGuardian|en|R|2|11
1444012517710303258|13218102|Fri Oct 01 18:53:07 +0000 2021|"Austin City Council member sounds alarm on 'disastrous consequences' of defunding police | Fox News https://t.co/xCWogL4Kv3"|en|R|75|243
1443944372328873998|13218102|Fri Oct 01 14:22:20 +0000 2021|"""Both Manchin and Schumer signed the document""

Manchin proposed $1.5T top-line number to Schumer this summer… https://t.co/a2eafEqGGB"|en|R|23|71
1443943201925173259|13218102|Fri Oct 01 14:17:41 +0000 2021|"Brazen: Here is a Biden cabinet member saying he will not enforce the law: 

“The fact an individual is a removable… https://t.co/KccVQkmJTY"|en|R|28|84
1443938835256205319|13218102|Fri Oct 01 14:00:20 +0000 2021|The gist is that you can illegally immigrate without limits or conditions if you otherwise behave. More than a mill… https://t.co/2awNGC83bk|en|R|9|24
1443930070763048973|13218102|Fri Oct 01 13:25:30 +0000 2021|Fruity e-cigarettes are still popular with high-school students, with many preferring Puff Bar’s disposable e-cigar… https://t.co/QnN6aYy3Cu|en|R|6|14
1443925187049758767|13218102|Fri Oct 01 13:06:06 +0000 2021|Seizures come as the Taliban seek to consolidate their new regime and bolster it against simmering discontent… https://t.co/Kk3zTjJDwH|en|R|8|19
1443671644514537475|13218102|Thu Sep 30 20:18:36 +0000 2021|As of March 2020, there were an estimated 321,000 undocumented and asylum-seeking children from Mexico and the Nort… https://t.co/hhQDi53mQY|en|R|50|113
1443634559350984712|13218102|Thu Sep 30 17:51:15 +0000 2021|"Just when you think they couldn't be more clueless about the raging #BidenBorderCrisis they are.

Biden administrat… https://t.co/K0gBMXvPGo"|en|R|13|33
1443587156182659090|13218102|Thu Sep 30 14:42:53 +0000 2021|China's Belt and Road plans losing momentum as opposition, debt mount -study https://t.co/febMWJY0SJ|en|R|57|83
1443568744417071106|13218102|Thu Sep 30 13:29:43 +0000 2021|Why Shoplifting Is Now De Facto Legal In California https://t.co/V038fTn8sL via @hooverinst|en|R|13|23
1443561639022825476|13218102|Thu Sep 30 13:01:29 +0000 2021|Ds consider bipartisanship passé. The Senate parliamentarian said Democrats’ alternative plan for providing a path… https://t.co/tetQdhwN8x|en|R|10|36
