id|user|created_at|text|lang|label|retweet_count|favorite_count
1491435050369691653|13218102|Wed Feb 09 15:33:20 +0000 2022|Biden is blowing his COVID moment https://t.co/tJz1NL7jfK|en|R|4|27
1491374395440648197|13218102|Wed Feb 09 11:32:18 +0000 2022|.@playbookdc  A parade of Democratic governors in charge of some of the bluest states — including New Jersey Gov. P… https://t.co/AS19dwzosX|en|R|28|114
1491373676373356544|13218102|Wed Feb 09 11:29:27 +0000 2022|"Opinion | The time has come for cameras in the courtroom https://t.co/D3cKPxE5ms"|en|R|6|30
1491181382223396865|13218102|Tue Feb 08 22:45:20 +0000 2022|Happy to see (in person!) representatives of the National Association of Independent Colleges and Universities (NAI… https://t.co/JXTUdZEn32|en|R|9|25
1491161009306083328|13218102|Tue Feb 08 21:24:23 +0000 2022|"It was great to join the dedicated men &amp; women of @MCSheriffs today.
 
Members of our law enforcement community fac… https://t.co/Bcmd70NxGn"|en|R|5|19
1491122945355583488|13218102|Tue Feb 08 18:53:08 +0000 2022|https://t.co/SizPLyhAyD https://t.co/zP1BeiKUEH|und|R|2|8
1491109771142856709|13218102|Tue Feb 08 18:00:47 +0000 2022|Dr. Montserrat Fuentes, President of St. Edwards University dropped by the Senate to talk education issues https://t.co/stw7Kob9AO|en|R|6|40
1491077477145657345|13218102|Tue Feb 08 15:52:28 +0000 2022|Good: U.S. approves $100 million sale for Taiwan missile upgrades https://t.co/K0TNVYn11m|en|R|12|97
1491015634897063937|13218102|Tue Feb 08 11:46:43 +0000 2022|Both Sides of Taiwan Strait Are Closely Watching Ukraine’s Crisis https://t.co/eLdmnJapcT|en|R|6|29
1491010510867017729|13218102|Tue Feb 08 11:26:22 +0000 2022|Nord Stream 2 Pipeline won’t go forward if Russia invades Ukraine, Biden says during a joint press conference with … https://t.co/0yiGlvkVD4|en|R|5|28
1491009303427575813|13218102|Tue Feb 08 11:21:34 +0000 2022|Heard on the Street: Pipeline diplomacy with Moscow has built an interdependence that will take years to unwind… https://t.co/UYeh0LF9Pt|en|R|2|13
1490809733292474370|13218102|Mon Feb 07 22:08:32 +0000 2022|Border Patrol agents face situations like this too often &amp; they're a reminder of the tragic effects of the Biden Ad… https://t.co/NEFjM0TloW|en|R|6|28
1490793014171680772|13218102|Mon Feb 07 21:02:06 +0000 2022|"Great meeting today with the new President of The @Heritage Foundation, proud Texan @KevinRobertsTX.
 
I worked wit… https://t.co/PpnTWciIYe"|en|R|11|47
1490775059685941249|13218102|Mon Feb 07 19:50:46 +0000 2022|China’s Campaign to Shape Global Opinion https://t.co/PNCHeEL6Sw|en|R|3|9
1490753599005204488|13218102|Mon Feb 07 18:25:29 +0000 2022|World leaders need computer climate-change models to help craft greenhouse-gas limits, but the complexity of new su… https://t.co/XAkM5XUAm5|en|R|3|12
1490729851661295625|13218102|Mon Feb 07 16:51:07 +0000 2022|"The GOP is gaining among Texas Hispanics. Women are leading the charge. 

://politi.co/3LiFN4f via @politico"|en|R|107|922
1490653164781150208|13218102|Mon Feb 07 11:46:24 +0000 2022|All signs point to a new U.S.-Iran nuclear deal that is worse than the first one.  https://t.co/ZixCpuhSTa via @WSJOpinion|en|R|53|88
1490650228923510784|13218102|Mon Feb 07 11:34:44 +0000 2022|The most likely November election scenario is that Republicans win the House and Senate. On average since World War… https://t.co/c4zEJeDR41|en|R|34|256
1490486618569986050|13218102|Mon Feb 07 00:44:36 +0000 2022|Outrageous https://t.co/qncrG6kieM|fr|R|49|97
1490373563664244744|13218102|Sun Feb 06 17:15:22 +0000 2022|Planeloads of missiles, ammunition and arms from the U.S. and NATO allies to Ukraine aim to deter a Russian invasio… https://t.co/jt0FL525U2|en|R|12|39
1490332383949774850|13218102|Sun Feb 06 14:31:44 +0000 2022|Cotton Letter Lessons for the Biden Administration  https://t.co/XtdID0CV5Z|en|R|7|19
1490116916136058882|13218102|Sun Feb 06 00:15:32 +0000 2022|First US troops arrive in Poland to support NATO allies https://t.co/bTfaSgzbh1|en|R|6|35
1490116599281500167|13218102|Sun Feb 06 00:14:16 +0000 2022|Cassidy cites Europe energy crisis to make case against Biden Fed nominee https://t.co/SFnZky2ARe|en|R|7|27
1490053745803157509|13218102|Sat Feb 05 20:04:31 +0000 2022|How Dallas Police Department’s smart tactics bucked national crime wave https://t.co/KuwdTrhzHN via @nypost|en|R|27|100
1489974670665428996|13218102|Sat Feb 05 14:50:18 +0000 2022|Texas Trees Are Exploding Due to Cold Weather https://t.co/3Pkxu3E6sj|en|R|11|51
1489970644003471362|13218102|Sat Feb 05 14:34:18 +0000 2022|Whatever happened to diversity, as progressives try to disqualify Judge J. Michelle Childs from Supreme Court consi… https://t.co/zpsz59kMzV|en|R|13|49
1489969346092883969|13218102|Sat Feb 05 14:29:09 +0000 2022|Why Ukraine Matters https://t.co/djxGDnMNVO|en|R|10|16
1489958547949502468|13218102|Sat Feb 05 13:46:14 +0000 2022|"And Joe Biden doesn’t care:

Arrests at the Mexican border hit a record 1.9 million last year, but with fewer migra… https://t.co/tT9ljGbfCf"|en|R|20|55
1489949556334866433|13218102|Sat Feb 05 13:10:30 +0000 2022|Roll Over, Kierkegaard, It’s All “Existential” by Peter Funt https://t.co/yhlNlrOGHH via @WSJOpinion|en|R|4|7
1489948790165549062|13218102|Sat Feb 05 13:07:28 +0000 2022|Biden's Border Mess https://t.co/hBcPdujmnO|en|R|44|114
1489948108528181251|13218102|Sat Feb 05 13:04:45 +0000 2022|‘Genocide Games,’ Again https://t.co/1w0lLtWkgV|en|R|7|29
1489756175696646147|13218102|Sat Feb 05 00:22:05 +0000 2022|Ukraine Wouldn't Be Russia's First False-Flag War https://t.co/8ZkpTe9nDK|en|R|16|54
1489725144130109446|13218102|Fri Feb 04 22:18:46 +0000 2022|Transparency advocates are frustrated by the Biden administration's failure to publish guidance on the Freedom of I… https://t.co/6jkvykx3mv|en|R|9|22
1489708303529787405|13218102|Fri Feb 04 21:11:51 +0000 2022|"Claim: 

After review, U.S. maintains border policy of expelling migrants, citing Omicron https://t.co/siQSdKIiNq via @CBSNews"|en|R|4|18
1489685372909019140|13218102|Fri Feb 04 19:40:44 +0000 2022|In fairness, most Senators had left for the week to beat bad weather.  I was present only because my flight had bee… https://t.co/Ug3QoAQtUp|en|R|6|26
1489634844862726152|13218102|Fri Feb 04 16:19:57 +0000 2022|"Last year the Senate passed a bipartisan bill to restore chip manufacturing in US so we can compete with China.
 
S… https://t.co/EHq8gBcaeG"|en|R|19|44
1489606541602873346|13218102|Fri Feb 04 14:27:29 +0000 2022|"Wake up call

Russia and China line up against U.S. in ""no limits"" partnership https://t.co/0OerNxozx0"|en|R|10|31
1489605192081362947|13218102|Fri Feb 04 14:22:07 +0000 2022|"Opinion | On inflation, we can learn from the mistakes of the past — or repeat them https://t.co/4PvVUEd7Jr"|en|R|7|27
1489598958112591873|13218102|Fri Feb 04 13:57:21 +0000 2022|How Pfizer made an effective anti-covid pill https://t.co/zg1T1rKSgd|en|R|2|10
1489590035414405125|13218102|Fri Feb 04 13:21:54 +0000 2022|Biden continues caving: The U.S. expects a restored nuclear deal would leave Iran capable of amassing enough fuel f… https://t.co/CxI1h0KBAN|en|R|7|22
1489576914788532226|13218102|Fri Feb 04 12:29:46 +0000 2022|The striking message of this year’s Olympics so far is that the FBI has advised Americans to leave their iPhones an… https://t.co/djOTT5YKZk|en|R|14|29
1489575407846313989|13218102|Fri Feb 04 12:23:46 +0000 2022|Senators worry Russia will invade Ukraine before they finalize sanctions bill https://t.co/fWxQo936gb via @politico|en|R|8|21
1489575085828620289|13218102|Fri Feb 04 12:22:30 +0000 2022|China harvests masses of data on Western targets, documents show https://t.co/kg9egJ2YOx|en|R|19|34
1489392428717064195|13218102|Fri Feb 04 00:16:41 +0000 2022|As Texans across our great state continue to experience the effects of Winter Storm Landon, here are a few resource… https://t.co/fhvkcO4Tm1|en|R|8|35
1489330877243043842|13218102|Thu Feb 03 20:12:06 +0000 2022|https://t.co/iBMwj0QHlJ https://t.co/PW7MWmvd4u|und|R|12|42
1489300650534084612|13218102|Thu Feb 03 18:11:59 +0000 2022|via @NYTimes https://t.co/3ZvX6ZTgzI|und|R|5|17
1489266572657053696|13218102|Thu Feb 03 15:56:34 +0000 2022|Apple says Android has up to 47x more malware than iPhone in continued pushback against sideloading… https://t.co/oUyQIblvVS|en|R|4|12
1489253718042157063|13218102|Thu Feb 03 15:05:30 +0000 2022|U.S. is “dangerously dependent” on TSMC, based in Taiwan, which is in a “fragile situation”, Commerce Secretary Gin… https://t.co/NZkYtPLPUl|en|R|10|34
1489024497550254085|13218102|Wed Feb 02 23:54:39 +0000 2022|As the severe weather transitions and freezing starts to occur, I continue to urge all Texans to monitor local fore… https://t.co/4hx9ElrGxc|en|R|13|27
1489012943832469509|13218102|Wed Feb 02 23:08:44 +0000 2022|Huh? https://t.co/PfP4lWMrpL|und|R|20|65
1488996060408205314|13218102|Wed Feb 02 22:01:39 +0000 2022|Agent Doss led a distinguished career with the Border Patrol &amp; her loss was a solemn reminder of the courageous sac… https://t.co/jBA40mSSjU|en|R|4|17
1488954273404792836|13218102|Wed Feb 02 19:15:36 +0000 2022|"With dangerous winter weather forecast across Texas, I urge every Texan to be prepared.
 
Keep up with your local f… https://t.co/0BXFVf3zA6"|en|R|15|34
1488906501267800065|13218102|Wed Feb 02 16:05:47 +0000 2022|Former U.S. security officials urge Congress to act on China legislation https://t.co/MCyGTtkrt0|en|R|10|24
1488848885028200451|13218102|Wed Feb 02 12:16:50 +0000 2022|If you are going to the Olympics in China, consider this : An audit of the mandatory Olympics app determined that s… https://t.co/qs36FDP8i0|en|R|27|84
1488838589433712641|13218102|Wed Feb 02 11:35:55 +0000 2022|"Opinion | Biden blocked the first Black woman from the Supreme Court https://t.co/hOwoMO82Qn"|en|R|110|168
1488837298640887812|13218102|Wed Feb 02 11:30:47 +0000 2022|Putin wants to push NATO away from Russia. Instead, he’s getting more NATO troops on his border. https://t.co/BZobK8SXgp|en|R|14|29
1488833992749203458|13218102|Wed Feb 02 11:17:39 +0000 2022|First Groundhog Day https://t.co/GtIGYRiBal|en|R|4|7
1488615678148067328|13218102|Tue Feb 01 20:50:09 +0000 2022|"U.S. border draws migrants from Russia, Ukraine and many other countries

https://t.co/gpHFUsCyjv"|en|R|19|29
1488614204072415235|13218102|Tue Feb 01 20:44:18 +0000 2022|Our nation was founded on the principle that all men are created equal – as we begin #BlackHistoryMonth we recall t… https://t.co/TgBzFeg1B7|en|R|14|70
1488614151845027848|13218102|Tue Feb 01 20:44:05 +0000 2022|My friend Ms. Opal Lee has been a fierce advocate for the recognition of Juneteenth for many years, and I’m proud t… https://t.co/FzFiK5m7xX|en|R|10|18
1488586713328984066|13218102|Tue Feb 01 18:55:03 +0000 2022|I believe we have a responsibility to stand with Ukraine and help its people defend its sovereignty and its democra… https://t.co/DsJiuybEDB|en|R|10|39
1488568199545249792|13218102|Tue Feb 01 17:41:29 +0000 2022|Enjoyed catching up with Dr. Harrison Keller, Texas Higher Education Board Commissioner https://t.co/atjLfRziVj|en|R|6|38
1488510544436944897|13218102|Tue Feb 01 13:52:23 +0000 2022|Dallas chief popular with council and mayor after first year https://t.co/8pkQ1JbT53|en|R|6|32
1488479979096662019|13218102|Tue Feb 01 11:50:56 +0000 2022|Operation Warp Speed Slowly Gets Its Due by Allysia Finley https://t.co/mtYY8DecIF via @WSJOpinion|en|R|10|38
1488327472957513734|13218102|Tue Feb 01 01:44:55 +0000 2022|President Biden could nominate a justice whose stellar record is matched by a deep respect for the rule of law and… https://t.co/WaJPjZOvV4|en|R|51|213
1488149218292346889|13218102|Mon Jan 31 13:56:36 +0000 2022|Don't like majority rule? https://t.co/IwpVk00P0L|en|R|3|22
1488148564727451650|13218102|Mon Jan 31 13:54:00 +0000 2022|Ukraine sent letter to senators seeking specific Russia sanctions, military assistance https://t.co/88BapcQfsv|en|R|16|27
1487952092815929344|13218102|Mon Jan 31 00:53:18 +0000 2022|Former ACLU head blasts org for failing to defend free speech: 'What is the ACLU doing saying that?' - Fox News https://t.co/2h0Y46RH0P|en|R|27|55
1487933951658373122|13218102|Sun Jan 30 23:41:13 +0000 2022|Deal on Russia sanctions bill possible this week - U.S. senators https://t.co/eMXjvVQZZl|en|R|18|39
1487854935635120132|13218102|Sun Jan 30 18:27:14 +0000 2022|Over half of black Georgia voters confident casting ballots will be fair in 2022: Poll https://t.co/0co3sOkiIK|en|R|15|37
1487787259944448010|13218102|Sun Jan 30 13:58:19 +0000 2022|Manchin gets standing ovation from West Virginia legislators for defending the filibuster https://t.co/irwdyAsmEw|en|R|1168|5420
1487786805223215113|13218102|Sun Jan 30 13:56:30 +0000 2022|Arizona governor wants DHS secretary gone for ‘failure to protect’ border https://t.co/lpxWWbpjWh|en|R|36|133
1487785168421195776|13218102|Sun Jan 30 13:50:00 +0000 2022|Border Patrol agents get into heated exchange with leadership during Mayorkas visit, leaked video shows https://t.co/1YLAxKbrww #FoxNews|en|R|31|74
1487769174134988806|13218102|Sun Jan 30 12:46:27 +0000 2022|Has Peter Strzok testified before a Durham grand jury?, by @Techno_Fog https://t.co/Gb3yR1rYOa|en|R|24|65
1487759578431426564|13218102|Sun Jan 30 12:08:19 +0000 2022|Biden’s Criteria for Replacing Stephen Breyer by @JonathanTurley https://t.co/UiuxQSPtDF via @WSJOpinion|en|R|10|30
1487758852363853826|13218102|Sun Jan 30 12:05:26 +0000 2022|History Forces Biden’s Hand by @wrmead https://t.co/TAbZw4Ob3S via @WSJOpinion|en|R|5|20
1487528730624933892|13218102|Sat Jan 29 20:51:00 +0000 2022|Real question is: what will Israel do? https://t.co/OIPULmUArN|en|R|6|22
1487473296484540423|13218102|Sat Jan 29 17:10:44 +0000 2022|Chief Ruiz doing the best he can under the circumstances but there is no denying the fact the the… https://t.co/e2RB4aRFbo|en|R|26|75
1487465474480873476|13218102|Sat Jan 29 16:39:39 +0000 2022|No “agreement” will be binding absent ratification by the Senate https://t.co/onV0eELuXA          Iran nuclear talk… https://t.co/twuW19h9H6|en|R|42|71
1487451642920382468|13218102|Sat Jan 29 15:44:41 +0000 2022|Our heroic border patrol agents are doing the best they can with their hands tied by @SecMayorkas non enforcement p… https://t.co/MPWhbIUa9U|en|R|22|60
1487448751774273536|13218102|Sat Jan 29 15:33:12 +0000 2022|Putin Can’t Be Appeased https://t.co/UABM2wdUPV|en|R|7|34
1487415805692321792|13218102|Sat Jan 29 13:22:17 +0000 2022|The Trump Boom Lifted Black Americans by @jasonrileywsj https://t.co/JCcdpbUQ1Y|en|R|36|103
1487177609528098825|13218102|Fri Jan 28 21:35:47 +0000 2022|The Senate 8 to make Putin irate and Biden’s plans great  https://t.co/zbqSTtyK16 via @politico|en|R|4|14
1487153789358456837|13218102|Fri Jan 28 20:01:08 +0000 2022|Mayor Eric Johnson lauds ‘Operation Shut Down Corner’ partnership in Hamilton Park by Tristan Hallman https://t.co/AHtRwfTGOR|en|R|6|9
1487070603047837706|13218102|Fri Jan 28 14:30:34 +0000 2022|"Why bother?  They don’t listen or do anything to solve the problems created by the #BidenBorderCrisis 

DHS secreta… https://t.co/8L7m6NRLEY"|en|R|69|213
1487058938755440642|13218102|Fri Jan 28 13:44:13 +0000 2022|A new survey shows President Biden’s overheated speech in Atlanta on voting rights didn’t persuade Georgians. https://t.co/8ojznIs2Ai|en|R|37|135
1486844106798161924|13218102|Thu Jan 27 23:30:33 +0000 2022|TX is a leader in energy innovation &amp; our work to diversify our energy sources through the expansion of hydrogen is… https://t.co/AAHJY88LwP|en|R|9|30
1486737229913407493|13218102|Thu Jan 27 16:25:52 +0000 2022|Headline: Breyer throws Biden a lifeline @politico|en|R|8|22
1486732271495356418|13218102|Thu Jan 27 16:06:10 +0000 2022|#intimidation https://t.co/WgHUtnYQFV|und|R|34|78
1486719166824341525|13218102|Thu Jan 27 15:14:05 +0000 2022|Normalizing annexation, denying sovereignty to neighbors, undermining liberal ideas and democratic societies, and d… https://t.co/rKk057izKK|en|R|14|33
1486718340240347143|13218102|Thu Jan 27 15:10:48 +0000 2022|Vladimir Putin does not think like we do https://t.co/s2MkTr4Use|en|R|22|63
1486711604305481737|13218102|Thu Jan 27 14:44:02 +0000 2022|Most Tarrant commissioners court candidates in favor of 287(g), but want more data https://t.co/ML5yAoytAZ via @FortWorthReport|en|R|2|6
1486711218815471625|13218102|Thu Jan 27 14:42:30 +0000 2022|Man who authorities say sold gun to Colleyville synagogue hostage-taker faces federal charge   https://t.co/nP78oEpaoG|en|R|5|30
1486710751322681346|13218102|Thu Jan 27 14:40:39 +0000 2022|"There is simply no place for antisemitism in our communities.
 
As a member of the Senate Task Force for Combating… https://t.co/MtgDxz3f7a"|en|R|9|71
1486684527116394500|13218102|Thu Jan 27 12:56:27 +0000 2022|Europe’s climate obsessions have made it vulnerable to Russia on energy, so the Biden Administration is begging the… https://t.co/f6TRR69gPB|en|R|5|24
1486684360925450241|13218102|Thu Jan 27 12:55:47 +0000 2022|"President Xi's response: 
https://t.co/8eONyk452b https://t.co/b6clegAZ7C"|ca|R|5|14
1486470263243952137|13218102|Wed Jan 26 22:45:02 +0000 2022|Texas senator’s bill takes aim at reducing rape kit backlogs, improving post-conviction DNA testing  https://t.co/dE0KlABsxK|en|R|19|75
1486457137811312641|13218102|Wed Jan 26 21:52:53 +0000 2022|"Justice Breyer has faithfully served the US judicial system for more than 4 decades.
 
I thank Justice Breyer for h… https://t.co/vCm04N47GE"|en|R|5|50
1486438268082262021|13218102|Wed Jan 26 20:37:54 +0000 2022|Title 42? Has Biden administration declared #COVID19 pandemic over or just given up? https://t.co/24HejkuRsk|en|R|15|30
1486394386367852548|13218102|Wed Jan 26 17:43:32 +0000 2022|Europe's extreme vulnerability to Russia was totally preventable, by @AlexEpstein https://t.co/qrMGLcOAQo|en|R|17|54
1486393095906373638|13218102|Wed Jan 26 17:38:24 +0000 2022|"To all our friends celebrating today, Happy 73rd Republic Day.
 
On this important day, India celebrates the promis… https://t.co/TkgNgHI10v"|en|R|23|164
1486373181346746369|13218102|Wed Jan 26 16:19:16 +0000 2022|Our #BipartisanBorderSolutionsAct is the only proposal with bipartisan and bicameral support. @SenatorSinema… https://t.co/FYv4xNoiDm|en|R|24|79
1486365080438640640|13218102|Wed Jan 26 15:47:05 +0000 2022|Ukraine declares its independence https://t.co/Yvhrrn8l75|en|R|6|18
1486352359060086788|13218102|Wed Jan 26 14:56:32 +0000 2022|"Too much dependence on imported chips 

The Commerce Department report says companies typically maintained 40 days… https://t.co/vXtrj0xapv"|en|R|7|28
1486350862435950592|13218102|Wed Jan 26 14:50:35 +0000 2022|UK police arrest two more men over Texas synagogue attack https://t.co/f91Zh3H73r|en|R|27|64
1486350118639001608|13218102|Wed Jan 26 14:47:37 +0000 2022|Russia moves troops and U.S. sends weapons as fear of war mounts in Ukraine https://t.co/9PyPBPbZ8M|en|R|6|20
1486349506463555587|13218102|Wed Jan 26 14:45:12 +0000 2022|US shipment of military equipment, munitions arrives in Ukraine https://t.co/sRUmcjwKvE|en|R|5|16
1486343545741090825|13218102|Wed Jan 26 14:21:30 +0000 2022|The Supreme Court is addressing crucial, but often ignored, issues on the administrative state: separation of power… https://t.co/LGcQj91Gqy|en|R|8|30
1486342345842995202|13218102|Wed Jan 26 14:16:44 +0000 2022|This Poll Shows Just How Much Trouble Democrats Are In https://t.co/IKS666tOs8|en|R|11|46
1486341549353050114|13218102|Wed Jan 26 14:13:34 +0000 2022|It takes the threat of Russian invasion to wake up Biden Administration to energy extortion by Putin? What better r… https://t.co/fndWQFDlHU|en|R|12|54
1486341443157438464|13218102|Wed Jan 26 14:13:09 +0000 2022|U.S. to Bolster Europe’s Fuel Supply to Blunt Threat of Russian Cutoff https://t.co/jQmO23cfzf|en|R|14|26
1486339132150407169|13218102|Wed Jan 26 14:03:58 +0000 2022|Where Is Germany in the Ukraine Standoff? Its Allies Wonder. https://t.co/U5OFYGa5MO|en|R|10|20
1486153976957612036|13218102|Wed Jan 26 01:48:14 +0000 2022|"Sen. John Cornyn hosts roundtable on Justice For All Act | https://t.co/UOShfXWxHy https://t.co/ILfGrwruS1"|en|R|8|24
1486132311448035334|13218102|Wed Jan 26 00:22:08 +0000 2022|Texas senator’s bill designed to protect sexual assault survivors, those wrongfully convicted https://t.co/7TuMgIqS2i|en|R|12|36
1486109693516914690|13218102|Tue Jan 25 22:52:16 +0000 2022|"I visited with Rabbi Charlie Cytron-Walker from Congregation Beth Israel, the site of last week’s terror attack.
 … https://t.co/fXtR2PDOTB"|en|R|11|70
1486102680065957893|13218102|Tue Jan 25 22:24:24 +0000 2022|Great meeting with Ft. Worth @MayorMattie. I appreciate all the updates on @CityofFortWorth priorities and everythi… https://t.co/fLNPBJikSl|en|R|7|33
1486102556350853130|13218102|Tue Jan 25 22:23:54 +0000 2022|Thank you to the civic leaders &amp; stakeholders that joined me at @UNTHSC to discuss the Justice for All Reauthorizat… https://t.co/iz1vDm6Tfl|en|R|7|28
1485995361063821312|13218102|Tue Jan 25 15:17:57 +0000 2022|This is a scandal on top of the larger scandal of open borders by Biden Administration. What will make that change?… https://t.co/gdsAwefMiZ|en|R|23|79
1485994805117210639|13218102|Tue Jan 25 15:15:44 +0000 2022|Title 42? https://t.co/c9Y5WouSKo|en|R|261|378
1485950137008545793|13218102|Tue Jan 25 12:18:14 +0000 2022|NATO allies are bolstering the alliance’s eastern flank in response to Russia’s military buildup around Ukraine… https://t.co/ki0kV9l2YS|en|R|6|24
1485764743382110212|13218102|Tue Jan 25 00:01:33 +0000 2022|What a sad, bad joke https://t.co/BeDhxuUXKi|en|R|38|159
1485763563969040394|13218102|Mon Jan 24 23:56:52 +0000 2022|Good Zoom call today led by @BobMenendezNJ and @SenatorRisch of @SenateForeign on whole of US government response t… https://t.co/0at0I3x7ni|en|R|6|23
1485749129150095363|13218102|Mon Jan 24 22:59:30 +0000 2022|"Apparently, Defund the Police hasn't worked so well: 

""[T]he Biden administration attributes the rise in crime ...… https://t.co/JXDLcDnjcE"|en|R|28|148
1485747082803744768|13218102|Mon Jan 24 22:51:23 +0000 2022|As the COVID-19 pandemic continues to evolve, I got an update from some of the State’s top leaders @TDEM and… https://t.co/55tHZEJ2ar|en|R|10|27
1485611264973885440|13218102|Mon Jan 24 13:51:41 +0000 2022|A Centers for Disease Control found that, from mid-December when Omicron became the dominant variant through Januar… https://t.co/BgAnEIwi6V|en|R|28|137
1485422206347878404|13218102|Mon Jan 24 01:20:26 +0000 2022|Biden Weighs Deploying Thousands of Troops to Eastern Europe and Baltics https://t.co/LE6pck0Tnh|en|R|14|48
1485407824779923460|13218102|Mon Jan 24 00:23:17 +0000 2022|"Calling Joe Biden

https://t.co/tKa1fZzX4C via @politico"|en|R|6|21
1485407531350560772|13218102|Mon Jan 24 00:22:07 +0000 2022|"GOP senator: Dems need to worry about voting rights in their home states

https://t.co/hmq7eDDQP2 via @politico"|en|R|17|100
1485407051371229187|13218102|Mon Jan 24 00:20:13 +0000 2022|"Sanders backs Arizona Democrats' censure of Sinema

https://t.co/CQ2jOkFc4g via @politico"|en|R|6|37
1485403042157584384|13218102|Mon Jan 24 00:04:17 +0000 2022|Durham vs. Horowitz: Tension Over Truth and Consequences Grips the FBI's Trump-Russia Reckoning  https://t.co/HqhfOF7MQO|en|R|23|42
1485038043983667208|13218102|Sat Jan 22 23:53:55 +0000 2022|Laying out the welcome mat https://t.co/2L2Ax12yr3|en|R|55|151
1485025310173237255|13218102|Sat Jan 22 23:03:19 +0000 2022|Hunting in South Texas you don’t want to run into one of these https://t.co/B6NuxKURkU|en|R|70|813
1484890314821312518|13218102|Sat Jan 22 14:06:53 +0000 2022|Tax rebates, retention bonuses for healthcare workers and teachers, climate-change infrastructure. Many states have… https://t.co/48ldL3GrT6|en|R|7|30
1484730382792671233|13218102|Sat Jan 22 03:31:22 +0000 2022|Glad to join Brooke Rollins, @SenTedCruz &amp; liberty loving Texans for the @TPPF #PO2022 to discuss how the Biden Adm… https://t.co/YfvSqtg5C5|en|R|28|137
1484601181062242305|13218102|Fri Jan 21 18:57:58 +0000 2022|To those who braved the cold today in Washington, D.C. and those who show up in their own way to protect life each… https://t.co/xSA7rAMITM|en|R|28|148
1484588522791178243|13218102|Fri Jan 21 18:07:40 +0000 2022|Biden’s 77 executive orders in his first year is higher than the average number of executive orders issued each yea… https://t.co/UljfVEcpgl|en|R|36|152
1484584737431859208|13218102|Fri Jan 21 17:52:38 +0000 2022|"“We may have to rename it.”
— Speaker Nancy Pelosi on the future of Build Back Better Act, Wall Street Journal, 1/20 @nationaljournal"|en|R|10|40
1484532013025660930|13218102|Fri Jan 21 14:23:07 +0000 2022|"U.S. Clears The Way For Transferring Ex-Afghan Mi-17 Helicopters To Ukraine

https://t.co/VEgcBIbtqv"|en|R|9|28
1484524174290866180|13218102|Fri Jan 21 13:51:58 +0000 2022|via @NYTimes https://t.co/j6KnSCSiYP|und|R|11|43
1484304134606323713|13218102|Thu Jan 20 23:17:37 +0000 2022|Today, a bipartisan group of Senators &amp; I introduced the Ukraine Democracy Defense Lend-Lease Act in response to Ru… https://t.co/75EsNmYyEp|en|R|31|117
1484229059487965200|13218102|Thu Jan 20 18:19:18 +0000 2022|Senators introduce bill aimed at protecting Ukrainian civilians https://t.co/JGW95RoGjS|en|R|12|40
1483999272341233670|13218102|Thu Jan 20 03:06:12 +0000 2022|.@SenatorCollins is entirely correct in her debate with @SenOssoff about the Voting Rights Act.  Section 2, WHICH A… https://t.co/AK8QytBEh7|en|R|16|96
1483963756627509251|13218102|Thu Jan 20 00:45:04 +0000 2022|Her role is purely ceremonial as VPOTUS' vote counts only in the event of a tie. https://t.co/t4r3gKesLv|en|R|12|62
