id|user|created_at|text|lang|label|retweet_count|favorite_count
1108828845245980672|15954997|Thu Mar 21 20:32:52 +0000 2019|"At our community forum this evening, Oregonians will address skyrocketing cost of prescription drugs and what next steps will be taken. 

Affordable medicines are key to providing healthcare for all. Choosing between health and financial security must end."|en|D|2|25
1108790607273697280|15954997|Thu Mar 21 18:00:55 +0000 2019|"A tale of two countries. It took Congress 8 years &amp; Democrats taking control of the House to pass a simple universal background check bill, which @senatemajldr is now holding up in the Senate. 

The contrast is appalling and a signal on the need for political change. https://t.co/D2TvNwhv5j"|en|D|23|82
1108164034975674368|15954997|Wed Mar 20 00:31:09 +0000 2019|"Marijuana banking is the clearest example of the most out of touch &amp; destructive federal cannabis policies. 

47 states have taken steps toward legalization &amp; this committee action on the SAFE Banking Act is an important first step in our blueprint to end prohibition nationwide. https://t.co/SnwPKDXS21"|en|D|93|255
1108128952533450752|15954997|Tue Mar 19 22:11:44 +0000 2019|Thank you @OregonGovBrown &amp; @busproject for your efforts! Oregon is on the cutting edge of expanding voter access w/ vote-by-mail, automatic voter reg, &amp; soon paid postage ballots. These initiatives give us transparency, unmatched security, &amp; a stronger democracy for all people. https://t.co/v1UyYbAa0T|en|D|15|119
1107792161943117824|15954997|Mon Mar 18 23:53:27 +0000 2019|Protecting public lands is key to our future and to our children’s future.  After tonight’s public lands public forum with @mazamas and @RonWyden, I am even more committed to expanding our conservation vision for our families, our environment, and our planet. https://t.co/Prq73WvGoT|en|D|4|34
1107773044053803010|15954997|Mon Mar 18 22:37:29 +0000 2019|What a wonderful morning at the Portland Garden Club with the incomparable Thomas Lauderdale!  We got a chance to start our week with exciting discussions on #GreenNewDeal, alternative energy sources, &amp; all the ways they've been working to improve our environment. https://t.co/5xgHqLYMRD|en|D|2|13
1107728580002410502|15954997|Mon Mar 18 19:40:48 +0000 2019|"White nationalists found an enabler when Trump became president. They found an apologist when he said they were ""very fine people."" They found a protector when he dismissed white nationalism as a growing threat. 

Trump does not fight bigotry &amp; violence, he encourages it. https://t.co/fskjtuNbKm"|en|D|63|172
1106619981649735680|15954997|Fri Mar 15 18:15:38 +0000 2019|I am standing with the student climate strikers until their government stands with them.  They deserve to have a future. We have no excuse not to fight for them.  #ClimateActionNow #ClimateStrike #ActOnClimate #GreenNewDeal https://t.co/Gr211CVXu7|en|D|24|117
1106564666787069953|15954997|Fri Mar 15 14:35:50 +0000 2019|"As people awake to the appalling &amp; terrifying news out of New Zealand, mass murder fueled by racial hatred &amp; Islamophobia is a jarring reminder that hatred and violence know no national boundaries. 

This is why we must take the real scourge of islamophobia seriously."|en|D|17|55
1106330876504358913|15954997|Thu Mar 14 23:06:50 +0000 2019|My deepest condolences to the family of Senator Birch Bayh.  Our first encounter was when I testified before Congress as a college student working to lower the voting age to 18.  A selfless public servant &amp; voter participation champion, he will be missed.|en|D|7|33
1106296020873416716|15954997|Thu Mar 14 20:48:20 +0000 2019|"Today, I introduced the Captive Primate Safety Act with @RepBrianFitz . 

#TBT We need to pass this so we can move onto crocodiles and pythons.
https://t.co/kJsEjj4TTn"|en|D|4|9
1106261172427333633|15954997|Thu Mar 14 18:29:51 +0000 2019|"Trump was unable to fool Congress &amp; the American people into building his wasteful wall. 

We recognized the threat he's posing to our democracy &amp; the separation of powers, so we voted to reject his #FakeEmergency here in the House. 

Today, I hope Senate Republicans do the same."|en|D|6|78
1106249608559292416|15954997|Thu Mar 14 17:43:54 +0000 2019|"Agreed, @MeghanMcCain. The stigma around cannabis must go. The potential for treating chronic conditions is just one of the many reasons to legalize.  

In ending the federal prohibition of marijuana, there's too much to gain, with nothing to lose. https://t.co/CdoF70EOwW"|en|D|21|72
1105935312524591104|15954997|Wed Mar 13 20:55:00 +0000 2019|"Legislation combatting LGBTQ discrimination hasn't reached a vote since 1974. It's 2019 and still, 2/3 of self-identified LGBTQ Americans report experiencing discrimination. 

We introduced the #EqualityAct because we're long overdue to protect basic civil liberties of everyone."|en|D|13|59
1105586014314217474|15954997|Tue Mar 12 21:47:01 +0000 2019|"Nearly a million American citizens are at risk of going hungry over political squabbling. It's unconscionable. #PuertoRico has been neglected for far too long and we must deliver. 
https://t.co/TbvuVuT8Zu"|en|D|69|149
1105566271645667330|15954997|Tue Mar 12 20:28:34 +0000 2019|"People being hurt by the #TrumpBudget:
❌ Seniors

❌ Medicare and Medicaid recipients

❌ Farmers

❌ College students

❌ Low-income families

❌ People that care about the environment

People being helped by the #TrumpBudget:

Billionaires

Who is the priority?"|en|D|35|103
1105546552825839617|15954997|Tue Mar 12 19:10:12 +0000 2019|Add this to the infinite list of lies coming from this administration. #TrumpBudget https://t.co/SkEibmk4IA|en|D|8|20
1105515279000502279|15954997|Tue Mar 12 17:05:56 +0000 2019|This is a crucial step toward bringing our marijuana policies up to date with the American people. The @MinCannBusAssoc is doing outstanding work to make sure that social equity in the cannabis industry comes first. This continued effort will result in real change. https://t.co/BytBfDR1L0|en|D|10|33
1105224579528773632|15954997|Mon Mar 11 21:50:48 +0000 2019|"The #TrumpBudget confirms what we already knew.

He cares little for the health and safety of Americans or the planet, but he cares a lot about wasteful spending and racist fear-mongering. https://t.co/7DGB9jWP8U"|en|D|31|64
1105169056364224513|15954997|Mon Mar 11 18:10:10 +0000 2019|"This weekend, I was joined by @RepBarbaraLee to talk about fighting the failed war on drugs. 

We must repair what is broken, reinvest in communities &amp; provide real opportunities to participate in the cannabis industry. Legalization is not enough.
https://t.co/IzTCSX55tl"|en|D|11|44
1105126320009302028|15954997|Mon Mar 11 15:20:21 +0000 2019|Last week, I met with Nobel Peace Prize winner @BeaFihn to discuss ways we can work towards a safer world, free of nuclear weapons. I’m proud to support the Treaty on the Prohibition of Nuclear Weapons to reach that goal. @nuclearban https://t.co/yydaX9AeyB|en|D|19|72
1104191222606790661|15954997|Sat Mar 09 01:24:37 +0000 2019|And I thank you @busproject for your leadership making sure every eligible voter can exercise their right! https://t.co/fsCx7bqk0V|en|D|3|26
1104133662310834178|15954997|Fri Mar 08 21:35:53 +0000 2019|Women are equal &amp; valued members of society, w/o exception.  That means we will not allow their fundamental human rights to be cast aside. We must fight for private &amp; public sector transparency so we can close the #WageGap.  #ReproRightsAreHumanRights #InternationalWomensDay|en|D|2|23
1104126706863038465|15954997|Fri Mar 08 21:08:15 +0000 2019|As someone who started their career working to lower the voting age &amp; protect voting rights, today's passage of #HR1 was very moving. I'm proud to fight for the Oregon model of automatic voter registration &amp; paper ballots nationwide. We must ensure our democracy is #ForThePeople|en|D|38|218
1104087091867275264|15954997|Fri Mar 08 18:30:50 +0000 2019|"Enjoyed speaking with Captain America, @ChrisEvans, about marijuana reform, voting rights, and bipartisanship in times of division in the nation's capital. 

I can do this all day! https://t.co/eNy03QUvSB"|en|D|132|770
1104055636843745281|15954997|Fri Mar 08 16:25:50 +0000 2019|"I told @RepDebHaaland that I hope commenting about her presiding over the House can be a daily social media event. 

It makes me feel better about this institution and my colleagues. https://t.co/mle91YRiYC"|en|D|0|20
1103782883821527040|15954997|Thu Mar 07 22:22:01 +0000 2019|"Remarkable moment. 

Proud to have supported @RepDebHaaland from the beginning. Looking forward to witnessing the amazing work she will continue to do. https://t.co/5oamO6vRtH"|en|D|20|87
1103780339628027909|15954997|Thu Mar 07 22:11:54 +0000 2019|"I’m pleased to support @youthvgov &amp; the brave Juliana plaintiffs fighting for the future of our planet. Along w/ other Members of Congress, I submitted an amicus brief to the Ninth Circuit to urge that it allow the youth climate lawsuit proceed to trial. 
https://t.co/2Bj9cH0k1i"|en|D|20|38
1103770583215546368|15954997|Thu Mar 07 21:33:08 +0000 2019|Domestic &amp; sexual violence incidents are often underreported. Thanks to the Violence Against Women Act, reporting among survivors has increased &amp; criminal justice responses to gender-based violence have improved. We MUST reauthorize #VAWA to respect &amp; protect survivors of abuse.|en|D|12|30
1103443808316870656|15954997|Wed Mar 06 23:54:39 +0000 2019|Shameful.  We must protect these special creatures because once they’re gone, that’s it.  There won’t be a second chance. https://t.co/Vp3EMDKu91|en|D|26|108
1103383146244915200|15954997|Wed Mar 06 19:53:36 +0000 2019|#NetNeutrality is a free speech issue, an economic issue &amp; an issue of equity. There shouldn’t be a high-speed fast lane for some that leaves everyone else behind.  It's time to restore net neutrality. #SaveTheNet|en|D|20|53
1103379123005779968|15954997|Wed Mar 06 19:37:37 +0000 2019|After 8 years &amp; 404 committee meetings, today the @WaysMeansCmte  Democratic leadership did what the @GOP refused—hold a hearing on how to finance the rebuilding and renewing of America.  We must be willing to continue listening to the American people to MEET this challenge.|en|D|7|55
1103064619306926084|15954997|Tue Mar 05 22:47:53 +0000 2019|Seems to me that the ones who are most nervous about this ruling are the ones with something to hide... Transparency is the first step to real progress in actually closing this #WageGap. https://t.co/HT7tMh8Htg|en|D|15|36
1103055378516979713|15954997|Tue Mar 05 22:11:10 +0000 2019|Communities of all sizes are demanding better transportation options to get to work and it is past time that the federal government provides the flexibility and incentives needed to encourage the bike community. https://t.co/hbQLUa24ol|en|D|5|38
1103048440626339840|15954997|Tue Mar 05 21:43:36 +0000 2019|"We must offer more transportation choices that are better for the environment, cheaper for families and incentivize burning calories, not carbon. 

That’s why I worked with @VernBuchanan &amp; @RepPressley to introduce a bill that restores &amp; improves the bicycle commuter tax benefit."|en|D|20|102
1102757914710822917|15954997|Tue Mar 05 02:29:09 +0000 2019|"This is bad.

Good thing the newly confirmed EPA administrator was a former coal lobbyist. 

He’ll definitely know all the evasion tricks and stalling techniques. https://t.co/wYE5Mglt17"|en|D|43|63
1102649159281229825|15954997|Mon Mar 04 19:17:00 +0000 2019|The more @realDonaldTrump continues to promote climate denial, the more people will be put at risk. We MUST take bold action.|en|D|10|85
1102645555719749633|15954997|Mon Mar 04 19:02:41 +0000 2019|"Every community that has been devastated by a natural disaster should receive A+ treatment, including Puerto Rico &amp; California. 

And in order to get A+ treatment, $10 million should probably not have been taken from FEMA and given to ICE to fund inhumane family separation. https://t.co/ci8LbqCs7i"|en|D|41|134
1101624674147024897|15954997|Fri Mar 01 23:26:04 +0000 2019|Today @RonWyden and I met w/ Oregonians impacted by the #GOPTaxScam. Families depending on their returns for household expenses, education, &amp; medical bills now face smaller returns, penalties or fines b/c of this political stunt.  Sadly, this will be the norm across the country. https://t.co/CIZC1VzlsM|en|D|29|84
1101613754691665921|15954997|Fri Mar 01 22:42:40 +0000 2019|"This is a disgrace. Trump has no regard for national security, no respect for the office of president and no clue how to lead.  This trending hashtag is past due. #FireKushner 
https://t.co/uBPynA5bCy"|en|D|38|128
1101223112589393920|15954997|Thu Feb 28 20:50:24 +0000 2019|"The marijuana reform bills introduced in just the first few months of this Congress show that the end of prohibition is in sight. 

There will never be another president elected who is anti-cannabis. The sooner both parties get on board, the better it will be for the country."|en|D|192|742
1100873542810374144|15954997|Wed Feb 27 21:41:20 +0000 2019|"Today was the first step of many to #EndGunViolence by passing #HR8 for universal background checks. 

This movement has provided a better Congress &amp; given us leadership that leads, instead of thoughts and prayers with no progress. We MUST treat this public health crisis."|en|D|14|113
1100800403136892928|15954997|Wed Feb 27 16:50:42 +0000 2019|Some of us have the best healthcare in the world, but on average, Americans get sick more often, they take longer to get well, and they die sooner. I’m proud to join @RepJayapal and 100 of our colleagues in supporting #MedicareForAll. https://t.co/zeMpD2F86O|en|D|17|115
1100540034233655299|15954997|Tue Feb 26 23:36:05 +0000 2019|"I just voted with my colleagues to pass a resolution to end Trump's #FakeEmergency.

Hopefully this reminds him of some things.

1.) There is no emergency at the southern border 

2.) The Constitution includes a separation of powers

3.) He is not a dictator"|en|D|40|295
1100514872905949184|15954997|Tue Feb 26 21:56:06 +0000 2019|"Voting is the foundation of our democracy. Ever since the Voting Rights Act was gutted, people around the country have been denied the right to vote. 

We're fighting to make progress nationwide by introducing H.R. 4 to #RestoreTheVote https://t.co/3VjpMVEbQW"|en|D|8|23
1100498377320644609|15954997|Tue Feb 26 20:50:34 +0000 2019|"Oregon's public lands are what make our state so special. I'm voting YES on the #PublicLands package because it makes #LWCF permanent &amp; protects over 2 million acres of iconic places, including several in Oregon.

The only question is what took the @GOP so long?"|en|D|18|133
1100462860893868032|15954997|Tue Feb 26 18:29:26 +0000 2019|"Today I joined my dear friend @GabbyGiffords &amp; passionate young activists for a historic press conference ahead of the #HR8 vote for universal background checks tomorrow. 

The movement to end gun violence is gaining momentum all across the country. We must stop this epidemic. https://t.co/pEMgGTPUo6"|en|D|17|52
1100171165761523712|15954997|Mon Feb 25 23:10:20 +0000 2019|#FakeEmergency https://t.co/3pP2Zs9Mgb|und|D|10|55
1100163181287227397|15954997|Mon Feb 25 22:38:37 +0000 2019|"Everyone should have access to health care, no matter what. 

I'm proud to be leading the effort for universal care with @RepJayapal and over 100 of our colleagues. The time is now. #MedicareForAll https://t.co/fPwumI5kQ4"|en|D|84|425
1100136588477165568|15954997|Mon Feb 25 20:52:56 +0000 2019|"One-third of food produced in North America depends on pollination by bees and they alone account for $15 billion of the economy. 

In order to maintain a healthy food supply, bee-toxic insecticides have no place on our farms. I'm working with @RepMcGovern to #ProtectPollinators https://t.co/ebV1TKoEMX"|en|D|62|141
1099865944942292999|15954997|Mon Feb 25 02:57:30 +0000 2019|Well said @chefjoseandres! #Oscars|en|D|4|22
1099089803167952897|15954997|Fri Feb 22 23:33:23 +0000 2019|Gov’t should not interfere with decisions made between women, their families, and medical care providers. This gag order is a direct attack on 24,000 Oregonians who can’t afford the rising costs of health care and rely on providers like @PPFA. #NoGagRule|en|D|20|88
1099057920422170624|15954997|Fri Feb 22 21:26:42 +0000 2019|My bill with @RepMcGovern fixes this loophole. We need experts in charge of protecting the future of our pollinators, not insiders from the industries they are supposed to regulate. #ProtectPollinators https://t.co/kwauLVbE9v|en|D|19|55
1098724570075459589|15954997|Thu Feb 21 23:22:05 +0000 2019|When @realDonaldTrump's border wall rhetoric meets the reality of his budget and enforcement priorities, guess who loses... the fight against human trafficking.  Once again, Trump talks big and short changes important priorities.  https://t.co/6D1txqjigu|en|D|13|20
1098673455094992897|15954997|Thu Feb 21 19:58:58 +0000 2019|One in three bites you eat every day come from pollinators. Their decline is a dire threat to our food safety and security. We MUST act to #ProtectPollinators and #ProtectOurFood. https://t.co/ZvhFrFs7zf|en|D|36|95
1098265266511728640|15954997|Wed Feb 20 16:56:58 +0000 2019|This unsurprising news makes it even more clear that Trump is increasingly acting alone.  And that he’ll stop at nothing to undermine his own agencies.  Must be awfully lonely out there on your island of denial, Trump.  https://t.co/H2oRa8y96e|en|D|16|36
1097991183823863809|15954997|Tue Feb 19 22:47:52 +0000 2019|"Nasty Women strike again.  
Thanks, @NWGSDPDX, for the stylish #InOurAmerica bow tie! https://t.co/IqAH2eb0of"|en|D|9|34
1097943938751619072|15954997|Tue Feb 19 19:40:08 +0000 2019|"Don’t panic, take action — on the Green New Deal, resilient infrastructure, and real agriculture reform.  #ActOnClimate #GreenNewDeal 
https://t.co/1xOvYJtuEF"|en|D|9|25
1097585349549641728|15954997|Mon Feb 18 19:55:14 +0000 2019|This morning, @BlueStarDonuts, Sen. @RonWyden, and I celebrated the legalization of hemp by unveiling the new hemp-based CBD donut!  It’s a delicious win for our country, highlighting only one of the many versatile ways that hemp can now be used. https://t.co/qFQPeWLpky|en|D|42|206
1096512996086607873|15954997|Fri Feb 15 20:54:05 +0000 2019|"If Trump can call a national emergency for a fake crisis at the border, then surely Congress should call a national emergency for the very REAL crisis that is climate change. 

That's why I'm introducing a resolution to declare a national emergency on the climate crisis."|en|D|348|1485
1096455440035209216|15954997|Fri Feb 15 17:05:22 +0000 2019|"I don't think emergencies are optional. They also aren't normally followed by a weekend getaway to a Florida golf resort.

That's not how it works. 

This is just a wildly unrealistic attempt at fulfilling an unpopular campaign slogan. #FakeTrumpEmergency https://t.co/AjGGWmrm43"|en|D|331|986
1096128295761072128|15954997|Thu Feb 14 19:25:25 +0000 2019|https://t.co/bcIFj5DuiA|und|D|4|16
1096113528283561984|15954997|Thu Feb 14 18:26:44 +0000 2019|"One year ago, a senseless act of gun violence at Marjory Stoneman Douglas HS shook the community of Parkland, FL &amp; the entire country.

Gun violence in this country is far too common. We are making sure this Congress is the one to finally address it. #MSDStrong"|en|D|6|58
1096098846529257474|15954997|Thu Feb 14 17:28:24 +0000 2019|Proud to be an Oregonian. Happy birthday to the most beautiful state in the country! https://t.co/RVeetpW2vl|en|D|16|80
1096091260732035073|15954997|Thu Feb 14 16:58:15 +0000 2019|Rev. Patrick Conroy delivers the Homily revealing that he was well suited to be House of Representtaives Chaplain since he was teaching 9th graders when he was selected. https://t.co/VgaIR1K4w1|en|D|2|9
1096083206388891648|15954997|Thu Feb 14 16:26:15 +0000 2019|Bill Clinton closes out a remarkable memorial service for the legendary John Dingell. Testimony to his keen wit, passion, and commitment to his last minutes. All celebrate the honor to serve with him. https://t.co/mdyQiG2NSn|en|D|4|26
1095503733151158272|15954997|Wed Feb 13 02:03:38 +0000 2019|Great discussion with Ron Chernow about his terrific biography of Ulyses S. Grant. Powerful work from the author of the work that inspired the musical Hamilton. https://t.co/kF4FtAdAos|en|D|0|8
1095469162263130112|15954997|Tue Feb 12 23:46:15 +0000 2019|And we're actually willing to listen to the American public, who overwhelmingly support an end to this senseless prohibition. https://t.co/Q6665wzc5h|en|D|5|26
1095442898563276804|15954997|Tue Feb 12 22:01:54 +0000 2019|"Oregonians &amp; nearly every American will need to take time off to care for a loved one. 

Major life events like having a child or dealing w/ an illness should never plunge a family into poverty, which is why I'm supporting the #FAMILYAct for an inclusive national #paidleave plan."|en|D|11|108
1095065473664860160|15954997|Mon Feb 11 21:02:08 +0000 2019|"Confusion and complexity with smaller refunds and higher taxes for many.

All so we can explode the deficit to give billions in tax breaks to some of the largest, most profitable corporations &amp; wealthiest Americans.

No wonder people call it a #GOPTaxScam
https://t.co/FXoSjJdg5T"|en|D|25|98
1094693388023152641|15954997|Sun Feb 10 20:23:36 +0000 2019|"As our trade subcommittee starts to examine NAFTA 2.0, it is important to evaluate its environmental provisions in light of what happened, or more accurately, what didn’t happen in the enforcement of NAFTA 1.0 protecting the environment along the border.
https://t.co/YqRMzySuvS"|en|D|10|15
1094668117043789826|15954997|Sun Feb 10 18:43:11 +0000 2019|"The #GreenNewDeal calls for us to step into the 21st century and create a sustainable future. 

High speed rail, green infrastructure, and investing in transportation options is how we'll get there. https://t.co/hSEnZvgJsL"|en|D|37|185
1094398540405649408|15954997|Sun Feb 10 00:51:59 +0000 2019|Smart people gathering to share best practices and inspiration at @GEI_at_LClark conference. I appreciated an opportunity to discuss the role the #GreenNewDeal will play in overcoming Trump’s assault on climate policy and our future|en|D|7|26
1093580602702483458|15954997|Thu Feb 07 18:41:48 +0000 2019|"Just finished a press conference introducing the #GreenNewDeal resolution, which includes my food and farm ideas. 

I’m looking forward to working with @RepAOC &amp; @SenMarkey to help save our planet through equitable and just policies. https://t.co/MnkPHnxmts"|en|D|34|261
1093557538598150145|15954997|Thu Feb 07 17:10:09 +0000 2019|"The Trump admin continues to put industry before the people. We can no longer allow big phrama to decide the fate of your prescription drug prices. 

We must allow Medicare to negotiate on behalf of patients and combat the skyrocketing cost of Rx drugs. #EndRxMonopolyPrices https://t.co/YURxTVIGkM"|en|D|28|60
1093333287953666048|15954997|Thu Feb 07 02:19:03 +0000 2019|"Outside @HouseJudiciary today was a crowd of passionate gun violence activists. This is what democracy looks like. 

Shockingly, this is the first hearing in the House on gun violence in years. Dems in charge make a difference. 

I'm proud to support #HR8 to end this epidemic."|en|D|28|131
1093286650698960896|15954997|Wed Feb 06 23:13:44 +0000 2019|"For 8 years, the GOP talked about cutting benefits Americans earned through decades of hard work. Dems are serious about solving the social security crisis &amp; today's @WaysMeansCmte hearing was the first step. 

We must fulfill the promise of a retirement with dignity &amp; security."|en|D|3|39
1093238434586607616|15954997|Wed Feb 06 20:02:08 +0000 2019|Talking to other members, my strong first impression is that there’s a lot of work needed on access and cost of Rx drugs in NAFTA 2.0 to get committee support and House passage.|en|D|21|28
1092993951353790465|15954997|Wed Feb 06 03:50:39 +0000 2019|Well done @staceyabrams! Wish I could have attended your #SOTU19  #BoycottSOTU #SOTUBoycott #AbramsAddress #AbramsResponse|en|D|2|73
1092991849806131211|15954997|Wed Feb 06 03:42:18 +0000 2019|Now this is THE State of the Union @staceyabrams|en|D|30|218
1092959790295207936|15954997|Wed Feb 06 01:34:54 +0000 2019|"Enjoyed talking with my #SOTU guest @natemook about the outstanding work @WCKitchen has done to feed families in need at home and around the globe. 

Their philosophy to, in his words, “build longer tables, not walls” couldn’t ring more true tonight. https://t.co/O9WUdszHFj"|en|D|11|52
1092928615795314688|15954997|Tue Feb 05 23:31:02 +0000 2019|Tune into @TheBeatWithAri on @MSNBC to hear my thoughts on #SOTU https://t.co/A8z1iunc2Y|en|D|8|71
1092915581299224576|15954997|Tue Feb 05 22:39:14 +0000 2019|The most exciting thing happening today is the @sunrisemvmt's livestream of their #GreenNewDeal campaign kick off.  Unlike @realdonaldtrump's #SOTU,  the GND will be based on real facts and solutions for everyday people. Watch their livestream tonight: https://t.co/kd2oQ8ENzg|en|D|12|49
1092836585442344961|15954997|Tue Feb 05 17:25:20 +0000 2019|"Although I won’t be at the #SOTU⁠ ⁠ I’ve invited @natemook in my place.

Nate is the executive director of @WCKitchen, an organization founded by @chefjoseandres that provides millions of meals for those in need, like Hurricane Maria survivors &amp; furloughed federal workers."|en|D|53|471
1092615382362275840|15954997|Tue Feb 05 02:46:21 +0000 2019|I am beyond energized to move forward a #GreenNewDeal that is in line w/ what the world's top climate scientists say we need. Watch @sunrisemvmt’s livestream of their Green New Deal campaign kick off  tomorrow night:  https://t.co/kd2oQ8ENzg #ActOnClimate|en|D|23|119
