id|user|created_at|text|lang|label|retweet_count|favorite_count
1291495875609538562|15954997|Thu Aug 06 22:06:26 +0000 2020|"We are doing everything we can to stop Trump's continued sabotage of the #2020Census.

In the meantime, please help spread the word and make sure your friends and family get counted at https://t.co/GbXUbRm6hF. https://t.co/775sbjaKlK"|en|D|20|34
1291408603627302915|15954997|Thu Aug 06 16:19:38 +0000 2020|"With the addition of @RepKatiePorter, our bill to legalize marijuana and enact restorative justice now has 80 House co-sponsors!

Momentum is growing to end the failed prohibition of cannabis that has ruined countless lives and disproportionately impacted communities of color."|en|D|45|267
1291194853351718913|15954997|Thu Aug 06 02:10:16 +0000 2020|"Trump wants you to think more COVID testing is unnecessary while he is tested daily.

Trump wants you to think #VoteByMail is fraudulent while he does it often.

Trump wants your kid to go back to school while his kid's school stays closed.

We must vote this fraud out of office!"|en|D|97|286
1291093748303224832|15954997|Wed Aug 05 19:28:31 +0000 2020|"#VoteByMail is no longer just a good idea. It's essential in order to protect our democracy and public health during this pandemic.

I joined Portland Communities and Postal Workers United today to demand an end to partisan attacks on our mail and our vote.https://t.co/0Xpu5iuVzS"|en|D|93|278
1291072675532681223|15954997|Wed Aug 05 18:04:47 +0000 2020|"Devastated to learn about the killing of Aja Raquell Rhone-Spears in Portland.

The senseless violence that our trans neighbors face, especially Black trans women, is a tragedy. We must take steps now to stop this hate and bigotry.

#BlackTransLivesMatter

https://t.co/e2cwT4j1Cl"|en|D|16|42
1290834045962792960|15954997|Wed Aug 05 02:16:33 +0000 2020|Congratulations to my friend and fierce advocate for justice @RashidaTlaib on what appears to be a great primary victory tonight. We need you back in Congress for the battles ahead. https://t.co/lBU89eqe6d|en|D|35|404
1290744197369167875|15954997|Tue Aug 04 20:19:32 +0000 2020|"We can't lose sight of the fact that Trump is trying to sabotage our nation's postal service for his own political gain.

Let's be clear: USPS is here to stay and we will not allow partisan attacks to undermine our democracy or #VoteByMail.
https://t.co/OFvIA2Xvb2"|en|D|22|82
1290729233413808128|15954997|Tue Aug 04 19:20:04 +0000 2020|"As we work to ultimately end the senseless prohibition of cannabis and the failed war on drugs, we must ensure the protection of legal state and tribal cannabis programs.

Last week, the House passed my bill to do just that. The Senate must do the same.
https://t.co/KHWsW4GSXA"|en|D|30|77
1290692834601861122|15954997|Tue Aug 04 16:55:26 +0000 2020|Happy birthday to a real president. #HappyBirthdayObama https://t.co/lM2XdR4FFx|en|D|15|121
1290682369049939973|15954997|Tue Aug 04 16:13:51 +0000 2020|"Disgraceful. Trump thinks the staggering coronavirus death toll in the United States ""is what it is"".

Tell that to the hundreds of Oregonians who have lost loved ones in part because of the administration's refusal to take this pandemic seriously. https://t.co/jlxu2XZR0a"|en|D|19|59
1290673242181640192|15954997|Tue Aug 04 15:37:35 +0000 2020|When people want to legalize cannabis without ensuring restorative justice for those unfairly impacted by the failed war on drugs. https://t.co/dpITiMoiHw|en|D|220|1217
1290360304824713216|15954997|Mon Aug 03 18:54:05 +0000 2020|"Thank you @Morgan_Freeman and @AndrewZimmern for helping to spread the word about my #RESTAURANTSAct.

Time is running out to save our independent restaurants. We need to act NOW! #SaveRestaurants. https://t.co/XXDqrCc1uX"|en|D|53|107
1290337659425034240|15954997|Mon Aug 03 17:24:05 +0000 2020|The growing number of COVID-19 cases in our nation’s jails is a human rights crisis. We must take steps NOW to reduce jail populations. Countless lives are at stake. https://t.co/f7l1XlJVgG|en|D|22|50
1290299320147808256|15954997|Mon Aug 03 14:51:45 +0000 2020|"As we work to block the use of tear gas in our communities altogether, we need answers from EPA and the Department of Environmental Quality about how these dangerous chemicals impact public health and our environment.

@Karin_Power and I are demanding an immediate investigation⤵️ https://t.co/9ATNzNypRC"|en|D|50|155
1289410734363832320|15954997|Sat Aug 01 04:00:49 +0000 2020|Time for us all to make clear that we stand with our courageous commissioner. https://t.co/eXxqCKUBoM|en|D|60|351
1289346356268564480|15954997|Fri Jul 31 23:45:00 +0000 2020|"It's unfathomable that @SenateGOP has allowed $600/week in unemployment insurance to expire.

Millions of Americans are still unemployed because of Trump's disastrous COVID-19 response.

The Senate must join the House in extending this important lifeline.
https://t.co/Ytk1DPI6pm"|en|D|22|64
1288971517976403968|15954997|Thu Jul 30 22:55:32 +0000 2020|"Rep. @AOC and I won't stand for Trump's racist attack on fair housing policies.

Today, we scored a major victory when the House approved our amendment to block HUD from ending rules designed to stop housing discrimination.

https://t.co/her4gKKLm9"|en|D|26|173
1288905213374537730|15954997|Thu Jul 30 18:32:04 +0000 2020|"Tear gas, pepper spray &amp; other chemicals that have rained down on Portland endanger our environment and public health.

@Karin_Power and I are calling for an investigation by EPA and the Department of Environmental Quality to understand the full impact of law enforcement actions. https://t.co/XcLGKkEXXG"|en|D|200|565
1288839458461278216|15954997|Thu Jul 30 14:10:47 +0000 2020|Our Liar-in-Chief again makes clear that this election cannot come soon enough. https://t.co/QsJiKoyTxg|en|D|16|94
1288587432049483777|15954997|Wed Jul 29 21:29:19 +0000 2020|"NEWS: The House just advanced our amendments to defund the Trump admin's abuses of powers against protesters.

This will restrict use of force and tear gas, ban the use of unmarked cars and combat-style uniforms, prohibit surveillance of protesters, require identification &amp; more."|en|D|107|460
1288559757767380992|15954997|Wed Jul 29 19:39:21 +0000 2020|"1. This is totally crazy talk.
2. Anyone visiting Portland can see for themselves.
3. We are making progress despite you and your cronies escalating tensions for political gain. https://t.co/ZXULVJpskw"|en|D|137|663
1288518899718291457|15954997|Wed Jul 29 16:56:59 +0000 2020|"Promising developments but we still must do more to ensure no other city endures these Gestapo-like tactics and that Trump and his cronies are held accountable for their abuses of power.

At the same time, let's get back to the work of improving Black lives — because they matter. https://t.co/mdgLqOW65B"|en|D|22|114
1288473239979790337|15954997|Wed Jul 29 13:55:33 +0000 2020|"Gathering on the Capitol steps to say one last goodbye to our dear friend and colleague John Lewis.

Rest in Power, John. #GoodTrouble https://t.co/mfePaxFafI"|en|D|15|144
1288302853472256001|15954997|Wed Jul 29 02:38:30 +0000 2020|"Thank you again @RepPressley and @JoAnnPDX — two ""secret sisters"" — for a fabulous conversation today.

You both are inspirational and I am humbled to be fighting for justice together. https://t.co/IL9WsACCbC"|en|D|8|45
1288247567994834944|15954997|Tue Jul 28 22:58:49 +0000 2020|"Chatting in a few minutes with @RepPressley and @JoAnnPDX.

TUNE-IN LIVE: https://t.co/TmWCITHxV2"|en|D|6|17
1288238613642305538|15954997|Tue Jul 28 22:23:14 +0000 2020|I said it in May and I'll say it again: Bill Barr must resign.|en|D|116|855
1288212902898532354|15954997|Tue Jul 28 20:41:04 +0000 2020|"Thoughtful and important policy proposals from #ReimagineOregon.

Interested in dismantling racism and systemic injustices? 

Read this: 
https://t.co/F9i9GbEktW"|en|D|9|30
1288186629505548289|15954997|Tue Jul 28 18:56:40 +0000 2020|"Americans overwhelmingly support legalizing cannabis. And as our party works to address racial injustices, ending the failed war on drugs must be front &amp; center.

Despite this missed opportunity, we'll continue our work in Congress &amp; the states to end this senseless prohibition. https://t.co/NI3tjcLFGy"|en|D|38|144
1288124505680822274|15954997|Tue Jul 28 14:49:49 +0000 2020|"Big week in Washington, D.C. as we continue to grow support for our plan to #DefundSecretPolice through the House appropriations process.

Votes will take place this week. Learn more⤵️
https://t.co/03xn6fMPSr"|en|D|18|64
1286746723499507716|15954997|Fri Jul 24 19:35:00 +0000 2020|It's clear that Portland is a test run for what Donald Trump and his cronies want to do in other cities. We must stop them. https://t.co/wvFpexMZ63|en|D|64|240
1286720292719648774|15954997|Fri Jul 24 17:49:58 +0000 2020|"NEWS: I'm demanding the immediate resignation of Acting DHS Secretary Chad Wolf.

Any person who oversees the kidnapping of protesters and the violent occupation of American cities has no place in our government.

#GoHomeChad"|en|D|2309|6395
1286500894868217856|15954997|Fri Jul 24 03:18:10 +0000 2020|"We can't let Trump's lawless actions distract people from the key reason why Portlanders are protesting: generations of racism and police brutality.

If this president cared about Black lives as much as he did trampling 1st amendment rights, we'd be better off.

#BlackLivesMatter"|en|D|68|245
1286407362757234689|15954997|Thu Jul 23 21:06:30 +0000 2020|"Inspectors General for DOJ and DHS will grant our request to investigate Trump's lawless actions in Portland.

While we continue to work to defund this effort, this is another step to help determine how Trump's egregious abuses of power were allowed to happen in the first place."|en|D|30|184
1286313519827255297|15954997|Thu Jul 23 14:53:36 +0000 2020|"Quick update from D.C. on our work here to DEFUND President Trump’s lawless actions in Portland.

To those on the frontlines: We are with you! https://t.co/GW3KppoD6v"|en|D|108|404
1286058698780049408|15954997|Wed Jul 22 22:01:02 +0000 2020|"While we continue to fight President Trump's abuses of power in Portland, we also must fight this administration's hateful treatment of Muslims.

The House just passed the #NoBanAct to repeal President Trump's discriminatory Muslim ban.
https://t.co/ALtjTEZ9Ov"|en|D|5|35
1286036173048164352|15954997|Wed Jul 22 20:31:31 +0000 2020|The needless damage that Trump’s secret police did to @RiotRibs – a volunteer-led effort to feed and supply protesters and those in need – shows just how morally bankrupt and cruel this occupation is.|en|D|305|1209
1285749255542636544|15954997|Wed Jul 22 01:31:25 +0000 2020|Exciting and historic news in Gresham. Looking forward to working with Councilor Vince Jones! https://t.co/syVs3JjtXG|en|D|5|24
1285744336731340800|15954997|Wed Jul 22 01:11:52 +0000 2020|"Heard about the vile comments made toward my friend and colleague Rep. @AOC.

This type of misogyny and disrespect is unacceptable.

Rep. Yoho should apologize and then read a book to learn about the very real link between poverty and crime."|en|D|182|1495
1285736136573423617|15954997|Wed Jul 22 00:39:17 +0000 2020|"Just had a moving conversation w/ Chris David – the Navy veteran who was beaten by federal officers in Portland.

Chris is a man of principle despite his brutal treatment by the very government he has sacrificed so much for. He’s part of the reason why Portland won’t be defeated. https://t.co/df2oCoHpwn"|en|D|71|285
1285701083806027777|15954997|Tue Jul 21 22:20:00 +0000 2020|"We must defund Trump’s secret police that are currently in Portland and soon may arrive uninvited in other American cities.

I'm in D.C. working around the clock to build support for such a plan."|en|D|121|665
1285566335410470913|15954997|Tue Jul 21 13:24:33 +0000 2020|"The Gestapo-like tactics used by the Trump admin in Portland are likely a dress rehearsal for other communities around the country.

We can't let that happen.

Yesterday, I announced new legislation to block the Trump admin from using federal forces as secret military police. https://t.co/C90P8g916Q"|en|D|90|307
1284526594455814145|15954997|Sat Jul 18 16:33:00 +0000 2020|"So meaningful to introduce my grandson to a friend and a legend. 

Rest In Peace, @repjohnlewis. #goodtrouble https://t.co/u3bh8Y0jJC"|en|D|12|188
1284347181860663296|15954997|Sat Jul 18 04:40:04 +0000 2020|John Lewis’s courage, strength, compassion and humility inspired all who knew him.  #goodtrouble|en|D|19|148
1284332925820051459|15954997|Sat Jul 18 03:43:25 +0000 2020|As I just told @AliVelshi on @TheLastWord, evading responsibility is the operating mode of the Trump Administration. No more. We will hold them accountable for their lawless actions in Portland. https://t.co/pNFicpE0zX|en|D|51|159
1284316684677939200|15954997|Sat Jul 18 02:38:53 +0000 2020|Thank you for your support, Madam Speaker. https://t.co/5jcXLqs6C1|en|D|87|363
1284219829155540993|15954997|Fri Jul 17 20:14:01 +0000 2020|"UPDATE: Members of our Oregon Congressional delegation just announced that we are demanding an immediate Inspector General investigation into the violent actions of unrequested federal law enforcement officials here in Portland.

We need answers NOW."|en|D|3930|12673
1284178478745575424|15954997|Fri Jul 17 17:29:42 +0000 2020|I am working with both the OR Congressional Delegation and the House Judiciary Committee to not only demand answers but to make sure this stops IMMEDIATELY. https://t.co/zh0kISAhcf|en|D|466|1544
1283903449374117888|15954997|Thu Jul 16 23:16:50 +0000 2020|"BREAKING: Chad Wolf just arrived in Portland.

Here’s my message: #GoHomeChad and take your unlawful DHS agents with you.

The Trump admin has no place occupying and inciting violence in our community. https://t.co/BdmKbnc0L7"|en|D|2120|4483
1283428331149393923|15954997|Wed Jul 15 15:48:53 +0000 2020|🚨🚨🚨 The federal evictions moratorium will expire in 10 days. Without extending the moratorium and covering all households, the U.S. will face an avalanche of evictions, displacement, and homelessness. What are you waiting for, @senatemajldr?|en|D|34|110
1281987091082043399|15954997|Sat Jul 11 16:21:55 +0000 2020|Trump’s commutation of Roger Stone's prison sentence is a perversion of justice, another act of brazen corruption, and the next step in his determination to make the United States a banana republic.|en|D|29|165
1281349841348485120|15954997|Thu Jul 09 22:09:43 +0000 2020|"Proud of local organizers @CameronWhitten &amp; Salome Chimuku for forming @blackresiliency to provide immediate resources to Black Portlanders. Your tireless advocacy &amp; our community's outpouring of support give me great hope.
#BlackLivesMatter #WeDoHeal 

https://t.co/qSq645Bxnq"|en|D|18|54
1280930958384852993|15954997|Wed Jul 08 18:25:13 +0000 2020|My team and I have compiled a comprehensive election guide: ELECTION ACTION: Connect. Vote. Win. to increase engagement in the critical months before the election. I look forward to being your partner as we fight for the future of our democracy. https://t.co/a7JGbb6mdN|en|D|71|97
1280266052580990976|15954997|Mon Jul 06 22:23:07 +0000 2020|A victory not just for tribal sovereignty, but also for our climate. We must continue to fight against the Dakota Access Pipeline and for our tribal communities. https://t.co/EMWHVd2O8L|en|D|11|62
1278749858157953025|15954997|Thu Jul 02 17:58:18 +0000 2020|"Yesterday, the House passed a $1.5 trillion infrastructure spending package that included 9 bills I authored for a greener, more sustainable, and more livable future.

America’s infrastructure is crumbling. It’s time to rebuild and renew America. #MovingForward"|en|D|14|74
1278093813022625792|15954997|Tue Jun 30 22:31:25 +0000 2020|"Trump’s love affair with the Russian government consistently puts American citizens in danger and he needs to answer for it.

He is either a lying SOB or he’s displaying his dangerous ineptitude. Both could be true, but either way, our national security is at risk."|en|D|36|163
1277617374582038530|15954997|Mon Jun 29 14:58:13 +0000 2020|"Today #SCOTUS struck down a discriminatory clinic shutdown law in Louisiana - a major win in our fight for reproductive freedom, health care, and economic justice!  

This is a great victory, but our work isn’t done. 

#MyRightMyDecision"|en|D|5|59
1276571039779217413|15954997|Fri Jun 26 17:40:28 +0000 2020|"Rs opposed to #DCStatehood think that a federal district was part of the founders’ plan. Wrong! It was horse trading and political gamesmanship. 

Maybe they’ll learn what it’s like to be in the room if they watch @Lin_Manuel #Hamilfilm next week...
https://t.co/6zbNTPR8Ha"|en|D|6|12
1276255754949885955|15954997|Thu Jun 25 20:47:38 +0000 2020|"We must continue striving for equality by ending qualified immunity, providing resources for alternatives to policing, &amp; ending the failed war on drugs. 

We’re at a turning point in our nation's history. It's critical we remain focused &amp; keep up the fight. #JusticeInPolicing"|en|D|13|60
1276254910682673162|15954997|Thu Jun 25 20:44:17 +0000 2020|"We are poised to pass the George Floyd #JusticeInPolicing Act in the House today.

This crucial legislation will begin the process of holding police accountable for misconduct rooted in our nation's 400 years of systemic racism &amp; oppression, but we can't stop here."|en|D|23|111
1275941699689250816|15954997|Wed Jun 24 23:59:41 +0000 2020|"AG Barr has politicized DOJ by firing the prosecutors who investigated Trump &amp; his allies.

He’s interfered with state-legal cannabis industries under the guise of anti-trust investigations, once again putting his interests above those of the American people. 

It's outrageous!"|en|D|18|67
1272576556100022273|15954997|Mon Jun 15 17:07:48 +0000 2020|"Today’s landmark #SCOTUS decision is a massive victory for LGBTQIA+ rights. No one deserves to be discriminated against based on who they are or who they love. #PRIDE2020 

https://t.co/VOJ8SqIwZ5"|en|D|13|40
1270377760037486600|15954997|Tue Jun 09 15:30:35 +0000 2020|"I’ve developed a congressional action plan of federal legislation that I support to stop the senseless killings of Black Americans &amp; other people of color at the hands of law enforcement.

https://t.co/V2YzuDENOq https://t.co/5ZG8YO45If"|en|D|12|43
1267647261363843075|15954997|Tue Jun 02 02:40:33 +0000 2020|"Trump has waged war against the American citizens he is supposed to be leading. 

From his inadequate response to a global pandemic to stoking racial tensions to an intense high, his incompetence is making our country worse at every turn. 

This has to stop NOW!"|en|D|61|246
1267565296618962945|15954997|Mon Jun 01 21:14:51 +0000 2020|This thread from @MultAuditor is a must-read! ⬇️ https://t.co/yDcdjrWa84|en|D|9|18
1266423636086394885|15954997|Fri May 29 17:38:18 +0000 2020|"Trump is a racist and he needs to go. 

If it somehow wasn't clear that he does not care about black &amp; brown lives before, it should be now. 

#GeorgeFloyd deserves justice."|en|D|54|261
1266423465730543617|15954997|Fri May 29 17:37:37 +0000 2020|"4 years ago, some people defended Trump's overt racism. 

Now, when we hear from him on the tragedy of #GeorgeFloyd, he is actively urging authorities to shoot those seeking his justice."|en|D|11|45
1265732194623827968|15954997|Wed May 27 19:50:46 +0000 2020|"As Minneapolis Mayor @Jacob_Frey said: ""Being Black in America should not be a death sentence."" We must demand a thorough investigation into the death of #GeorgeFloyd."|en|D|5|30
1265695517901815808|15954997|Wed May 27 17:25:01 +0000 2020|"I voted against the Patriot Act and will continue to oppose inadequate efforts to prop it up. 

This harmful policy violates the rights of Americans, especially communities of color. We must put an end to it."|en|D|27|176
1263617570701299713|15954997|Thu May 21 23:48:00 +0000 2020|"The restaurants that make our communities unique have been hit the hardest by #COVID19.

My plan would give immediate relief to local, independent restaurants so they can stay afloat and keep our communities whole. Read about it here ⬇️
https://t.co/fHBfBj2dw4"|en|D|17|70
1263204518629695488|15954997|Wed May 20 20:26:41 +0000 2020|"Thanks for the support @andrewzimmern!

America's independent restaurants are the beating heart of our communities. They need relief now, more than ever. 

Looking forward to continuing our work together. https://t.co/0KbzFjEhZp"|en|D|7|35
1262945842253553664|15954997|Wed May 20 03:18:47 +0000 2020|"Tonight's victory shows that people want to actually solve the crises that we are facing (climate, housing, health care, the economy, etc) &amp; build broad coalitions to do so. 
They are not interested in Twitter talking points that are divisive &amp; devoid of actual policy solutions."|en|D|30|267
1262790600488652800|15954997|Tue May 19 17:01:55 +0000 2020|"Election Day is here!
The individual right to vote is the cornerstone of a representative democracy. 

Ballots are due by 8:00 pm TONIGHT.
It's too late to mail them in, so bring them to a dropbox near you ---&gt; https://t.co/RsPFrSNrnC"|en|D|10|31
1261738273128374272|15954997|Sat May 16 19:20:20 +0000 2020|"Such a loss. 
Rep. Greenlick was a wonderful human being and a powerful voice for progressive democratic values in Oregon.

https://t.co/0WCuBd4out"|en|D|9|48
1261339202714660864|15954997|Fri May 15 16:54:35 +0000 2020|"Ballots are due TUESDAY, May 19th by 8:00 pm.
It’s too late to mail them in, so bring them to a dropbox near you ---&gt; https://t.co/RsPFrSNrnC"|en|D|7|10
1260301521918418945|15954997|Tue May 12 20:11:12 +0000 2020|"Oregonians - Thursday is the last day to mail ballots in. Postage is no longer required. 

Voting should be easy and accessible, which is why I'm fighting for Oregon provisions like vote-by-mail, automatic voter registration, and postage-free ballots across the country."|en|D|53|148
1258538166065061889|15954997|Thu May 07 23:24:15 +0000 2020|"This just makes my blood boil. How can any decent person not be outraged?
https://t.co/1Zn1NlUR7D"|en|D|9|68
1258082780652552192|15954997|Wed May 06 17:14:43 +0000 2020|Thank you to Oregon nurses like @NurseTeriA and nurses across the world for being on the front lines every day. #NationalNursesDay #ThankYouNurses @OregonNurses https://t.co/uyflQjlZ3r|en|D|8|19
1257456059498799104|15954997|Mon May 04 23:44:21 +0000 2020|"Federal assistance needs to go to small businesses &amp; people, not big corporations. We must keep local economies afloat by covering 100% of the base payroll costs for small businesses.

@RepJayapal has a plan to do that. 

We’re working to make it happen.
https://t.co/PiywWSTjlM"|en|D|46|191
1256637855063048193|15954997|Sat May 02 17:33:06 +0000 2020|"Join @SMeieran, @SenBurdick, and me at 11 AM for a #COVID19 virtual town hall.

We’re going to discuss the work we’re doing at the federal, state, and local levels to beat this and come back stronger than ever. 

Watch here: https://t.co/sDw3CBFpyZ https://t.co/dmoCYD71ls"|en|D|1|0
1255596381785387008|15954997|Wed Apr 29 20:34:39 +0000 2020|"Our values haven’t changed. They’ve only gotten stronger.  
The real change that was important before is even more important now.

That’s what our campaign is about. https://t.co/CgW2RGlR8O"|en|D|11|32
1255193692421455874|15954997|Tue Apr 28 17:54:31 +0000 2020|New York's decision to cancel the Democratic presidential primary is wrong on politics, wrong on policy, and wrong for democracy.|en|D|11|99
1254118939061338112|15954997|Sat Apr 25 18:43:50 +0000 2020|"At a time when so many Americans are dependent on the post office more than ever, this is precisely the wrong time to inject Trump’s chaos and interference into America’s most trusted federal program. 

We must resist his efforts to blackmail his way into a post office takeover."|en|D|55|161
1253073379684425736|15954997|Wed Apr 22 21:29:09 +0000 2020|"While we fight the #COVID19 crisis, we should begin thinking about the ultimate crisis of our climate &amp; its most devastating impacts. 

On the 50th Anniversary of #EarthDay, let's commit to having the bold vision of a healthy planet &amp; a healthy economy.
https://t.co/bw5rgy6HCN"|en|D|8|28
1252345990440316929|15954997|Mon Apr 20 21:18:46 +0000 2020|"The U.S. today has effectively given death sentences to hundreds of thousands of non-violent drug offenders trapped in COVID-19 hotspots in our prisons. 

This 4/20, let's commit to staying the course &amp; reforming our harmful cannabis policies.
https://t.co/0dt4E2BSTs"|en|D|20|61
1250564232120111105|15954997|Wed Apr 15 23:18:41 +0000 2020|"Oregonians need ALL of the unemployment insurance they are entitled to and I will keep fighting until they get it!

https://t.co/7ZCPpqQl3h"|en|D|17|59
1250505306230013957|15954997|Wed Apr 15 19:24:32 +0000 2020|"Part of my economic stabilization plan is to give at least $2000 a month to those over age 16. Today, I joined @RoKhanna and @RepTimRyan in introducing the ""Emergency Money for the People Act"" to do just that."|en|D|60|239
1249870415687815168|15954997|Tue Apr 14 01:21:43 +0000 2020|"We need a “time out” on rent, mortgage, and commercial leases. I'm fighting for this and more in the next #COVID19 relief package. 

These are troubling times. We need bold action that will make a difference for the challenges people are facing right now."|en|D|35|172
1249186252156534786|15954997|Sun Apr 12 04:03:05 +0000 2020|"We need USPS. 

We need them to deliver medicine &amp; essential supplies. 

We need them to fortify our democracy with #VoteByMail.

They are on the front lines of this crisis. We can’t allow Trump’s senseless attacks on one of our most vital services to stand. #SaveThePostOffice"|en|D|337|807
