id|user|created_at|text|lang|label|retweet_count|favorite_count
1217887141642018816|210926192|Thu Jan 16 19:11:36 +0000 2020|"As an Appropriator, I worked hard to create a spending bill that strengthens our national security and advances U.S. foreign policy. We cannot continue to allow the Trump Administration to sidestep the Constitution. 
https://t.co/kk6kcdrBQp"|en|D|16|25
1217871312066154496|210926192|Thu Jan 16 18:08:42 +0000 2020|Thank you @TexasWheat and the @wheatworld for presenting me with the 2019 Wheat Advocate Award. I am committed to fighting for wheat growers in my district and across the state of Texas so they can continue to provide our country with this critical food source. https://t.co/ZbqBfjTfEO|en|D|4|4
1217810975493062657|210926192|Thu Jan 16 14:08:57 +0000 2020|Our country’s economy is supported by Texas’ booming oil and gas industry. It is critical that we continue to support an industry that creates jobs, puts us on a path to energy independence, and advances our country’s economy. https://t.co/HJ2JeO085x|en|D|3|18
1217565150460481536|210926192|Wed Jan 15 21:52:07 +0000 2020|College debt should not put someone in financial ruin, especially for hardworking Americans in public service. That’s why I worked hard to secure language in the final spending bill that will help make the loan forgiveness program (TEPSLF) a more fair and reliable process. https://t.co/WS0hKheK6x|en|D|2|9
1217503855862304768|210926192|Wed Jan 15 17:48:34 +0000 2020|Rising living costs and shrinking retirement savings are forcing Americans to work later into their lives than ever before. Today, I am voting for the bipartisan Protecting Older Workers Against Discrimination Act to ensure older workers are protected against age discrimination. https://t.co/eeS3t0Spjn|en|D|2|10
1217128911609520128|210926192|Tue Jan 14 16:58:40 +0000 2020|"We cannot allow the Administration to pull funding from critical military projects that meet our strategic military needs and support the well-being of our military members and their families. 
https://t.co/3Q0UkmdKzx"|en|D|6|15
1216845439057657859|210926192|Mon Jan 13 22:12:15 +0000 2020|Millions of Americans live with a pre-existing condition, including in the Lone Star State. I am committed to fighting for these 11 million Texans and making sure they receive affordable quality health care. #ProtectOurCare https://t.co/xlzOetJ9bg|en|D|1|6
1216787681457377281|210926192|Mon Jan 13 18:22:44 +0000 2020|Responding to the #2020Census is our civic duty. The Census affects funding for our communities and shapes our community’s future. Visit https://t.co/odyyIPIP7S. https://t.co/rNT72woDdH|en|D|7|11
1216123509459603457|210926192|Sat Jan 11 22:23:33 +0000 2020|Congratulations Raine Perez on winning the ‘Next 100’ NFL contest! She is one of 32 youth athletes selected across the nation to take part in a Super Bowl commercial and represent a NFL team at this year’s game. You’ve made Laredo incredibly proud! https://t.co/DQYBv52d9X|en|D|5|10
1216085052943147013|210926192|Sat Jan 11 19:50:45 +0000 2020|Great words from @RosLehtinen. It is critical to remember that we are all Americans and we must work together for our constituents and our country, not just our parties. I am committed to working across the aisle to get work done for the people of TX-28.https://t.co/9O1sugnqCg|en|D|8|14
1215683719052382209|210926192|Fri Jan 10 17:15:59 +0000 2020|Every day millions of Americans are exposed to unsafe levels of PFAS through their drinking water. I voted for the PFAS Action Act to protect Americans from this dangerous chemical and ensure Americans have access to clean and safe water. https://t.co/0zYD4pQvbP|en|D|1|2
1215419186228363270|210926192|Thu Jan 09 23:44:50 +0000 2020|I always enjoy meeting with our law enforcement officers in TX-28, whether it’s deputy sheriffs in Starr County or Border Patrol agents at the U.S.-Mexico border. I want to thank all law enforcement officers for protecting our communities. Happy #NationalLawEnforcementDay! #TBT https://t.co/RF36OzgMEm|en|D|1|21
1215392115531882496|210926192|Thu Jan 09 21:57:15 +0000 2020|As your Congressman, I'm committed to protecting Medicare Advantage for millions of seniors and individuals with disabilities who depend on it, and preserving choice &amp; quality for future beneficiaries. Thank you Coalition for Medicare Choices for presenting me this achievement https://t.co/DAUB0ed2YH|en|D|0|2
1215341852209111040|210926192|Thu Jan 09 18:37:32 +0000 2020|I had the privilege of meeting Manuel Gutierrez, a constituent from Poteet with Neurofibromatosis. Manuel visited my office to discuss the need for research on this genetic disorder. As an Appropriator, I will continue to fund research that will find a cure for diseases like NF. https://t.co/2dGysM1Pwv|en|D|0|2
1215031144040796160|210926192|Wed Jan 08 22:02:53 +0000 2020|America is in a high-stakes battle between China for global leadership in 5G telecommunications. @RepMcCaul and I created legislation to ensure the U.S. sets the standards for the 5G network and remains a world leader in hi-tech research and development. https://t.co/6AJnF3KSKk|en|D|573|627
1214688519131713542|210926192|Tue Jan 07 23:21:25 +0000 2020|Enjoying the snow in D.C. on the first day back in session. I look forward to enjoying the winter weather and working to pass legislation for my constituents! ☕️❄️ https://t.co/DlBrOiLjmz|en|D|1|37
1214581363749330944|210926192|Tue Jan 07 16:15:37 +0000 2020|Watch the Senate Finance Committee discuss the USMCA. I urge my colleagues in the Senate to pass this agreement as soon as possible so our economy can immediately start benefiting from the billions of dollars in new trading opportunities. https://t.co/a1QLqrVelD|en|D|13|26
1214573400670298112|210926192|Tue Jan 07 15:43:59 +0000 2020|The number of physicians per population in RGV is almost half of the physician-per-patient ratio for the U.S. I worked hard to extend the cap-building window so hospitals can hire more doctors in medically underserved areas. Everyone deserves access to quality healthcare. https://t.co/k4u384cYwP|en|D|1|5
1214366814022578177|210926192|Tue Jan 07 02:03:04 +0000 2020|I am very saddened to hear about the tragic loss of my friend and colleague, Councilman Gerald Jimenez. He served his community well and made the City of Floresville a better place. My heart and prayers go out to his wife and family during this time.|en|D|1|12
1214312800408997889|210926192|Mon Jan 06 22:28:27 +0000 2020|Today I held a press conference in San Antonio to discuss legislative wins in the final spending bill that will benefit Joint Base San Antonio. Thank you to Major General (Ret) Juan Ayala for joining me and giving valuable insight into how these funds will help. https://t.co/fnHQXmQVY7|en|D|2|4
1213537713741279234|210926192|Sat Jan 04 19:08:32 +0000 2020|I want to thank the brave men and women in green who risk their lives every day to protect our communities across the United States. I am committed to supporting Border Patrol, our nation’s first line of defense on our southern border. https://t.co/Fc7qXgE1Xg|en|D|1|19
1212392952993107968|210926192|Wed Jan 01 15:19:39 +0000 2020|Wishing every day of the new year to be filled with health, happiness and prosperity for you and your family. Cheers to the New Year! https://t.co/E4UVgiTEgu|en|D|1|9
1211430982722736129|210926192|Sun Dec 29 23:37:08 +0000 2019|I am heartbroken by the news from my colleague @repjohnlewis. I know that he will face this with courage, grace and tenacity, exactly how he has fought for justice and equality in the U.S. My prayers are with him and his family during this time. https://t.co/kP0qtjYrRq|en|D|3|14
1211329971278565383|210926192|Sun Dec 29 16:55:45 +0000 2019|My heart is with the lives we lost in Monsey, NY. I stand with the victims and their families in this time of tragedy. We must come together as a nation and condemn anti-semitism and any forms of hatred in our country.|en|D|1|11
1211325923821264896|210926192|Sun Dec 29 16:39:40 +0000 2019|#OTD: #Texas became the 28th state admitted to the union! Check out @librarycongress Texas #map collection https://t.co/Kqa3HITuRH|en|D|1|1
1210290008390819840|210926192|Thu Dec 26 20:03:18 +0000 2019|From fighting to lower the costs of prescription drugs to helping veterans receive their benefits, my office and I have delivered on our promises. Check out all the incredible things we accomplished this year and stay tuned for 2020! https://t.co/Qn50mSn4Hd|en|D|1|10
1209843925076336641|210926192|Wed Dec 25 14:30:44 +0000 2019|I want to wish you all joy &amp; peace this holiday season. This time of year allows us to reflect on the incredible blessings of family, community &amp; Country. The greatest gift I've received has been the honor of serving as Congressman for the 28th District of Texas. Merry Christmas! https://t.co/8NKndBH2PB|en|D|1|29
1209607249959759872|210926192|Tue Dec 24 22:50:16 +0000 2019|Nothing brings me more joy during the holidays than giving back to those in our community. Thank you Dr. Henry Carranza and L.O.V.E.D. for all you do in our district. https://t.co/7LkWtUZx0w|en|D|3|10
1209126536785338368|210926192|Mon Dec 23 15:00:05 +0000 2019|In the final spending bill, I secured $50 million to support critical infrastructure projects in communities, including the surrounding area of Joint Base San Antonio, that accommodate our country’s military facilities. https://t.co/ZTzREZnWel|en|D|2|4
1208928430789709825|210926192|Mon Dec 23 01:52:53 +0000 2019|To all those celebrating, I’d like to wish you a Happy Hanukkah! https://t.co/LzeWrd1Oy8|en|D|2|4
1208532958925279232|210926192|Sat Dec 21 23:41:25 +0000 2019|I had a great time meeting everyone at Census with Santa earlier today! Did you know that the data collected from the upcoming #Census2020 will be used to determine a community’s federal funding towards daily services and support? https://t.co/do3AmqxelU|en|D|6|14
1207775964148719617|210926192|Thu Dec 19 21:33:23 +0000 2019|Mexico is a critical partner to the United States and is crucial to our own prosperity. They are not only our economic partner, they are our neighbor and friend. I would like to thank Mexico for their dedication to working with us to create the USMCA. https://t.co/Bdq2agrk9G|en|D|31|70
1207775076399157270|210926192|Thu Dec 19 21:29:52 +0000 2019|Over the past year, I have been working to create a bipartisan trade agreement that benefits our workers, businesses, consumers, and the economy as a whole. Today, we have voted and passed the USMCA, a historic victory for my district, for the state of Texas, and for our country. https://t.co/TOEXCWrLpR|en|D|6|15
1207761291391242246|210926192|Thu Dec 19 20:35:05 +0000 2019|In the USMCA, I secured $250 million for the North American Development Bank &amp; $300 million for the Border Water Infrastructure Program to help fund projects for cleaner water, air and land. I am voting for the #USMCA to promote a healthy environment on both sides of the border. https://t.co/GCGczuyj9i|en|D|8|17
1207732679887740928|210926192|Thu Dec 19 18:41:24 +0000 2019|The #USMCA includes meaningful labor standards and protects workers’ rights in all three countries. I am voting for this free and fair trade agreement for America’s working families. https://t.co/IDdIa7Uc74|en|D|2|4
1207699828920205313|210926192|Thu Dec 19 16:30:51 +0000 2019|The #USMCA will help small businesses compete and win on the international stage. Today, I will be voting yes on the USMCA to support small businesses in South Texas and across the nation. https://t.co/R3xwZdtx70|en|D|8|14
1207683065335693314|210926192|Thu Dec 19 15:24:15 +0000 2019|In 2018, importers in Canada and Mexico purchased more than $137 billion of Texas exports, making them by far the state’s two largest trading partners. I am voting for the #USMCA to expand economic growth and opportunities for the great state of Texas. https://t.co/u5QiO3hiAo|en|D|6|3
1207389860782366728|210926192|Wed Dec 18 19:59:09 +0000 2019|"GREAT NEWS: After months of negotiations, we will be voting on the USMCA tomorrow! The #USMCA will set the highest standards for enforcement in any U.S. trade agreement. This includes: 
1. Protecting American jobs
2. Promoting workers’ rights
3. Safeguarding our environment https://t.co/3k6PMAcYyz"|en|D|3|14
1207334574289752064|210926192|Wed Dec 18 16:19:28 +0000 2019|"Today, I have decided to vote for both articles of impeachment. My statement is below. 
https://t.co/5pnRPImRYW"|en|D|23|117
1206709282550558721|210926192|Mon Dec 16 22:54:47 +0000 2019|In the final spending bill, I secured language prohibiting DHS from constructing fencing within cultural &amp; historical landmarks, including the Eli Jackson Cemetery. I am committed to fighting for our community, our land, &amp; our rights from this wasteful, ineffective border wall. https://t.co/lT4Pj4aCiQ|en|D|6|24
1206653760476499968|210926192|Mon Dec 16 19:14:09 +0000 2019|"ICYMI, I secured the signature environmental safeguard in the #USMCA: $250 million for NADB and $300 in EPA Grants to fund cleanups at the border. I remain committed to creating cleaner and healthier communities at the U.S.-Mexico border. 
 https://t.co/9ge3r3ATzR"|en|D|3|16
1205942009258749953|210926192|Sat Dec 14 20:05:54 +0000 2019|Open Enrollment in the Health Insurance Marketplace ends this weekend. It's not too late to get the coverage you need. #GetCovered for 2020 on https://t.co/aGNO4GfTi1 https://t.co/WA2UPP28xK|en|D|1|3
1205595478735364097|210926192|Fri Dec 13 21:08:55 +0000 2019|"This latest attempt to appropriate funds for an ineffective, wasteful border wall is extremely concerning. The Administration’s wall hurts taxpayers, wildlife, the environment, and my community. We need to stop it. 
https://t.co/hdcmMppaDb"|en|D|1|6
1205570598623207429|210926192|Fri Dec 13 19:30:03 +0000 2019|Prescription drug prices are surging. This week, I voted for the Lower Drugs Costs Now Act to fight back! I am committed to helping Americans afford their prescription drugs and get the healthcare they need and deserve. https://t.co/QPcy9WVzPe|en|D|2|4
1205134330693062656|210926192|Thu Dec 12 14:36:29 +0000 2019|"The USMCA is an important step for American workers. This trade agreement includes worker protections, labor fairness, creates jobs in the manufacturing sector, and boosts wages. It is time to pass #USMCA 
https://t.co/FjSKp9uOeW"|en|D|1|11
1204894319968235526|210926192|Wed Dec 11 22:42:46 +0000 2019|I am committed to supporting our military and their families as they defend our great nation. That's why I am voting yes on the #NDAA to give them a 3.1% pay raise, combat sexual assault, and improve the housing system. https://t.co/sqp5tAt9Tu|en|D|2|6
1204892275995742210|210926192|Wed Dec 11 22:34:39 +0000 2019|I voted for the Coastal and Great Lakes Communities Enhancement Act for a cleaner, safer, and more sustainable future for our country.   This bill will help coastal communities plan for and prosper in a resilient future. https://t.co/cGuKl2xnBU|en|D|2|9
1204831277389664259|210926192|Wed Dec 11 18:32:15 +0000 2019|Nearly 58 million people in America have been unable to pay for prescription medicines at least once in the last 12 months. Congress must #LowerDrugCosts by passing H.R. 3! https://t.co/fjr0reokA2|en|D|3|6
1204416065054203906|210926192|Tue Dec 10 15:02:21 +0000 2019|We have a final agreement on the #USMCA, a much-needed update to NAFTA! This trade agreement is projected to raise GDP by nearly $70 billion and create upwards of 200,000 jobs. The USMCA is good for my district, for the state of Texas, and for our country as a whole. https://t.co/gHelQ3zGvw|en|D|41|123
1204158784253419520|210926192|Mon Dec 09 22:00:01 +0000 2019|Congratulations to @laredopalominos for being ranked #1 as the best school in Texas for Registered Nursing (ADN/ASN) Programs 2020. I will continue working to secure resources and funding for nursing programs at our local colleges and universities.  https://t.co/1TALuXVJHD|en|D|4|9
1204098140518920193|210926192|Mon Dec 09 17:59:02 +0000 2019|Stopping the flow of illegal drugs across our border &amp; at ports of entry is critical to addressing the opioid epidemic. I am voting for DHS Opioid Detection Resilience Act to ensure CBP has the necessary equipment to detect synthetic opioids &amp; to improve detection capabilities. https://t.co/ufkJBRpHlR|en|D|2|4
1203743062964527106|210926192|Sun Dec 08 18:28:05 +0000 2019|Thank you @mylaredopd for hosting this great event and for protecting our community. https://t.co/2l0OOeN0ag|en|D|2|5
1203043075095977993|210926192|Fri Dec 06 20:06:35 +0000 2019|The right to vote is the cornerstone of our democracy. That’s why I voted for the Voting Rights Advancement Act, which will restore the promises of the Voting Rights Act of 1965, uphold the integrity of our democracy, and increase transparency in our elections. https://t.co/wlq2KoGP1u|en|D|4|10
1202594085883789313|210926192|Thu Dec 05 14:22:27 +0000 2019|So much is at stake for South Texas in the 2020 Census, from our representation in Congress to the distribution of billions of taxpayer dollars into our communities. We need to make sure everyone is participating &amp; encouraging their family, friends &amp; neighbors to take part too! https://t.co/DV34S0DR4F|en|D|4|11
1202361442550394880|210926192|Wed Dec 04 22:58:01 +0000 2019|Great news! I just voted and helped pass bipartisan legislation to get rid of those pesky robocalls. https://t.co/UJZgAdkYmM|en|D|11|129
1202328851763912710|210926192|Wed Dec 04 20:48:31 +0000 2019|Thanks to the Affordable Care Act, millions of Americans, have gained quality, affordable, and accessible health coverage and care. We must build on this progress and ensure these gains are not reversed. Enroll today at https://t.co/CyeYQNOdGu! #GetCovered #OpenEnrollment https://t.co/xHLDscysGQ|en|D|2|3
1202303356800249862|210926192|Wed Dec 04 19:07:12 +0000 2019|SNAP is a lifeline for millions of Americans, including more than 48,000 households in my district. This new ruling will directly hurt hard working families. We must protect this vital program so millions of Americans can afford a meal. https://t.co/o0fZJpZwsN|en|D|7|16
1202271723317612544|210926192|Wed Dec 04 17:01:30 +0000 2019|Thank you @AmericanBakers for the ABA Bakers’ Dozen Congressional Award. In my district, the baking industry produces over $220 million in economic output yearly &amp; employs 1,525 workers. https://t.co/tx1GpbGuM8|en|D|2|9
1201989232304279554|210926192|Tue Dec 03 22:18:59 +0000 2019|"I am determined to strengthen our existing gun laws following the shooting in Sutherland Springs. Legislation @JohnCornyn &amp; I created after this tragedy strengthens our background check system &amp; keeps firearms out of the hands of dangerous individuals. 
https://t.co/EEjal0kLWE"|en|D|8|35
1201969260584689671|210926192|Tue Dec 03 20:59:37 +0000 2019|Congratulations to Laredo Medical Center CEO Jorge Leal for being recognized with this week’s Hometown Aggie Spotlight. Your effort and contribution to the City of Laredo help provide thousands with outstanding medical attention. https://t.co/YXbfFsAnxM|en|D|4|12
1201945563337560070|210926192|Tue Dec 03 19:25:28 +0000 2019|It was great to meet living legend Bob Schieffer. Bob hosted CBS' Face the Nation for 24 years, interviewed every President since Nixon, and won almost every award in broadcast journalism. His service and leadership in journalism has inspired millions of reporters. https://t.co/LEUjoW9r6T|en|D|2|12
1201630453792415746|210926192|Mon Dec 02 22:33:20 +0000 2019|Check out the interview with @GrayDCnews about the importance of passing USMCA for Texas farmers, manufacturers, workers, and consumers. https://t.co/rvGYDbhAJA|en|D|1|2
1200790748100276224|210926192|Sat Nov 30 14:56:38 +0000 2019|When we pick up a coffee at the café or grab lunch at the local sandwich shop, we are making an impact in our community. I encourage everyone to join me by visiting a small business to holiday shop and supporting the great work these small businesses do for our community. https://t.co/fc8oHk3OqJ|en|D|3|10
1200099543922171904|210926192|Thu Nov 28 17:10:02 +0000 2019|Congratulations to Reagan HS for being the only marching band to represent the entire Lone Star State in the Macy’s Thanksgiving Day parade! Way to make the City of San Antonio proud! https://t.co/YW5rNrIrEA|en|D|3|30
1200071487866253313|210926192|Thu Nov 28 15:18:33 +0000 2019|Each and every Thanksgiving I am, first, thankful for my wife and daughters, and I'm thankful for the privilege of representing you and your family in Congress. I hope you have a great holiday with your family! https://t.co/Yi4YvwVUFn|en|D|2|14
1199848788959125504|210926192|Thu Nov 28 00:33:38 +0000 2019|"It’s official: The PACT Act, bipartisan legislation that makes animal cruelty a federal crime, is now law. As the Co-Chair of the Humane Caucus, I am committed to protecting animals from cruelty and creating a more humane world for man’s best friend.
https://t.co/3jC4XaiPhl"|en|D|6|22
1199423099755749376|210926192|Tue Nov 26 20:22:05 +0000 2019|One of my top priorities is to honor our service men and women who have sacrificed so much to keep our country safe. That's why I am co-sponsoring the National Medal of Honor Monument Act, which will create a national monument for our nation's Medal of Honor recipients in D.C. https://t.co/oodaumN3RH|en|D|2|10
1199332746897825792|210926192|Tue Nov 26 14:23:04 +0000 2019|"As our deficit reaches $1 trillion, it is critical that the House prioritizes fiscal responsibility. That's why my colleagues in @HouseBlueDogs &amp; I wrote a letter that urges Congress to abide by PAYGO, which requires all new priorities be fully paid for.
https://t.co/lrRKj69Ajl"|en|D|1|11
1199037031994802183|210926192|Mon Nov 25 18:48:00 +0000 2019|Everyone deserves to live free from violence. That’s why I am co-sponsoring the International Violence Against Women Act, which will enhance U.S. efforts to eradicate gender-based violence worldwide. https://t.co/MT3fTXmK1h|en|D|3|10
1198621878484656133|210926192|Sun Nov 24 15:18:19 +0000 2019|My family and I had a great time volunteering at the Return of the 100 Acre Woods beautification project at North Central Park in Laredo. Together, we can change our community and our nation. Thank you all for your great work! https://t.co/v557hUsY6g|en|D|3|14
1198011055575883776|210926192|Fri Nov 22 22:51:08 +0000 2019|#FlashBackFriday to the time I was recognized by the Texas Association of School Financial Aid Administrators for my work on authoring the #TexasGrant, a financial aid grant that has helped thousands of students pay for college. https://t.co/AlgviyH5sZ|en|D|2|10
1197994332185407488|210926192|Fri Nov 22 21:44:41 +0000 2019|Today, I announced $2,330,291 for @txamiu's Online Family Nurse Practitioner Program to ensure there are more opportunities for Hispanic students to study medicine and increase the number of nurses in underserved populations in the region. https://t.co/6UO3rRIWja|en|D|1|9
1197278770681581568|210926192|Wed Nov 20 22:21:17 +0000 2019|I voted for a continuing resolution to ensure American families, businesses, &amp; communities have the budget certainty they need at the end of this fiscal year — avoiding a harmful government shutdown &amp; ensuring key health programs don’t expire.|en|D|1|12
1197261741769539589|210926192|Wed Nov 20 21:13:37 +0000 2019|"Yesterday, I met with former Congressman Jack Fields and 
@CEMEX_USA Vice President Joel Galassin @jgalassini to discuss CEMEX's ready-mix concrete plant in my district. I am committed to reducing our carbon footprint by investing in carbon capture technology. https://t.co/9qDLJFAgaU"|en|D|4|11
1197239792561479682|210926192|Wed Nov 20 19:46:24 +0000 2019|Yesterday, my Constituent Service Representative for Bexar County, Kendall Hayes, attended the grand opening of the Mi Familia de Mi Tierra Restaurant in #SanAntonio. She presented the Cortez family with a Congressional Certificate of Recognition for the opening of their business https://t.co/apGcw15gWa|en|D|0|0
1197230647078793216|210926192|Wed Nov 20 19:10:04 +0000 2019|Latinas on average make 54 cents on the dollar compared to white, non-Hispanic men. Latinas deserve to be paid the same as their colleagues. That’s why I co-sponsored the Paycheck Fairness Act, which will work to eliminate the wage gap for Latinas &amp; all women in the U.S. https://t.co/9NLDKFRANY|en|D|11|28
1197184500582768642|210926192|Wed Nov 20 16:06:42 +0000 2019|Last week, my office presented certificates of Congressional Recognition to schools from my district during their National Blue Ribbon School Awards Ceremony in Washington, DC. This national distinction from the Dpt of Ed is an honor not only for the school, but for our district. https://t.co/bbv2868XGb|en|D|0|3
1197172067822641152|210926192|Wed Nov 20 15:17:18 +0000 2019|This weekend, I attended the San Antonio River Authority’s 5th Annual Pecan Jubilee in #Floresville. During the event, I met with members of the community, city officials &amp; the contestants. Congratulations to all the small businesses &amp; individual participants. https://t.co/tRpW6uyFhl|en|D|1|5
1196847901584056322|210926192|Tue Nov 19 17:49:10 +0000 2019|Every person deserves to be treated equally under the Constitution. That’s why I am co-sponsoring a resolution that will help advance the Equal Rights Amendment. It is important that we guarantee equal legal rights for Americans regardless of sex.  #ERANow https://t.co/NBL4VV6jxf|en|D|11|10
