id|user|created_at|text|lang|label|retweet_count|favorite_count
1142083909477437440|1067748650485497862|Fri Jun 21 14:56:37 +0000 2019|"#ThisDayinHistory in 1788, New Hampshire became the ninth and critical state to ratify our Constitution, forming the United States. I am proud to represent a state that has always played a leading role in our history.
https://t.co/zZefjLzY1A"|en|D|2|8
1141820621267058703|1067748650485497862|Thu Jun 20 21:30:24 +0000 2019|I am proud to work with @SenBlumenthal to push for bicameral legislation to improve recruitment &amp; retention of women in the U.S. Coast Guard. It is critical we foster inclusivity so we can continue to attract and retain our nation’s best and brightest.|en|D|1|4
1141772298346749952|1067748650485497862|Thu Jun 20 18:18:23 +0000 2019|"It was an honor to present Sydney with Congress’ highest honor,
the Congressional Gold Medal. Sydney was recognized for her outstanding
contributions to the Boys &amp; Girls Club and her community. Congratulations,
and thank you for all you do! https://t.co/ZUvwhSieBt"|en|D|2|7
1141743082775425025|1067748650485497862|Thu Jun 20 16:22:18 +0000 2019|There are Americans that still risk their lives on a daily basis simply because of who they are or who they love. It is time for the Senate to take action and vote on the #EqualityAct so everyone can live openly and reach their full potential without fear. https://t.co/fIrCWmBcVk|en|D|20|69
1141450117796507649|1067748650485497862|Wed Jun 19 20:58:09 +0000 2019|The House passed 3 amendments I introduced that will allow us to understand impacts of PFAS contamination, support our regional economy, &amp; strengthen our armed forces. I'm proud to continue to serving as an advocate for Granite Staters as we continue the appropriations process.|en|D|2|11
1141405504251600896|1067748650485497862|Wed Jun 19 18:00:53 +0000 2019|"As we continue to celebrate how far the LGBTQ community has come this #Pride, we must also recommit ourselves to the hard work that remains ahead to achieve full equality. You can read more of my thoughts in the Hill 👇
https://t.co/U48FEOlQPl"|en|D|4|22
1141059252993372161|1067748650485497862|Tue Jun 18 19:05:00 +0000 2019|"I am proud to see our bipartisan legislation supporting small businesses and national security is moving to the Senate for a vote. This bill will ensure DHS can continue to provide our men and women in uniform with high-quality American-made goods.
 
https://t.co/hovwYYvPAI"|en|D|2|5
1141026068222140421|1067748650485497862|Tue Jun 18 16:53:08 +0000 2019|"Insurance companies shouldn’t be able to take advantage of families with surprise medical bills in their times of need. I'm thankful for the work of @SenatorHassan as we continue to focus on making healthcare affordable for all Americans.
https://t.co/8X1G5IDNsE"|en|D|6|10
1141014740728254464|1067748650485497862|Tue Jun 18 16:08:07 +0000 2019|Upgrading New Hampshire’s infrastructure is essential to improve safety and grow our state’s economy. I applaud these efforts, and as a member of @TransportDems I will continue to fight for critical investments in our transportation network. https://t.co/gdQzo9Lyb0|en|D|2|10
1140360145286963200|1067748650485497862|Sun Jun 16 20:47:00 +0000 2019|Thank you to the @VAManchester for coming out to the Queen City Pride Parade Festival yesterday and your dedication to serving all of our nation's veterans. #WeServeAllWhoServed https://t.co/txfWsD2v4X|en|D|2|6
1140343256997343232|1067748650485497862|Sun Jun 16 19:39:53 +0000 2019|Wishing a very happy #FathersDay to all the amazing dads out there who encourage and inspire us every day. Thank you for everything you do!|en|D|1|16
1140007753890639872|1067748650485497862|Sat Jun 15 21:26:43 +0000 2019|"Congratulations to all of our 2019 graduates! All the best to you in the years ahead. 🎓🎉
https://t.co/xJQH4yYZhA"|en|D|2|12
1139627149353205762|1067748650485497862|Fri Jun 14 20:14:20 +0000 2019|Today @MayorJoyceCraig and I kicked off Manchester’s Pride celebrations with the raising of the pride flag outside of City Hall. Thanks to everyone who came out! https://t.co/bNvUiKCNgL|en|D|1|36
1139616356771487744|1067748650485497862|Fri Jun 14 19:31:27 +0000 2019|This morning I sat down with @Nhna_nurses and @npa_nh to discuss nursing shortages across our state and the rising cost of prescription drugs. It’s important to hear directly from our providers as we work on solutions for healthcare in Washington. https://t.co/KmNpxRGvej|en|D|1|7
1139602755448922112|1067748650485497862|Fri Jun 14 18:37:24 +0000 2019|Today is #FlagDay, where we commemorate the adoption of our nation’s symbol in 1777. Don’t forget to fly it proudly! https://t.co/PmyEo2djj7|en|D|1|6
1139590062797180939|1067748650485497862|Fri Jun 14 17:46:58 +0000 2019|Happy birthday to the @USArmy , protecting our nation and its freedoms for 244 years. https://t.co/J6b6X3AiZe|en|D|1|8
1139240374285873152|1067748650485497862|Thu Jun 13 18:37:25 +0000 2019|While I was walking to votes late last night, I was proud to see the winning piece from our Congressional Art Competition hung in the halls of our nation’s capital. It’s great to see the creativity of N.H. students on display in the Capitol! https://t.co/c8s9uiQ29E|en|D|2|16
1139193537084436480|1067748650485497862|Thu Jun 13 15:31:19 +0000 2019|Yesterday we mourned the 49 lives lost at #Pulse. Today we #HonorThemWith action by introducing a bill to provide law enforcement with the resources they need to protect LGBTQ Americans. We must ensure everyone can live their truth without fear. #LGBTQEssentialDataAct https://t.co/Wdzb27g421|en|D|5|18
1139184858415149056|1067748650485497862|Thu Jun 13 14:56:49 +0000 2019|I look forward to standing with @mayorjoycecraig tomorrow to raise the Pride flag at Manchester City Hall in recognition of #PrideMonth and all the contributions LGBTQ individuals have made to our great city. https://t.co/gMWfROXsbE|en|D|5|16
1138845254977761282|1067748650485497862|Wed Jun 12 16:27:22 +0000 2019|A budget is a statement of values, and today the House begins debate on a budget that upholds our values by making critical investments in healthcare, education, and workforce training to give all Granite Staters the opportunity to get ahead. #ForThePeople|en|D|0|3
1138842049438998528|1067748650485497862|Wed Jun 12 16:14:37 +0000 2019|Neither party should be able to game the system and skew the intent of the voters. That is why I am proud to support our state’s efforts to create an impartial and transparent redistricting process that gives the power back to the people. https://t.co/EU9y9yU0TG|en|D|25|64
1138825184327217152|1067748650485497862|Wed Jun 12 15:07:36 +0000 2019|3 years ago today, 49 lives were taken from us in a hateful mass shooting at #Pulse nightclub. It is imperative we #HonorTheirLivesWithAction and ensure no more Americans have to endure the horror and heartbreak of such a tragedy. #OrlandoStrong https://t.co/DRYfTaZVwm|en|D|2|12
1138567007463452674|1067748650485497862|Tue Jun 11 22:01:42 +0000 2019|As a nation we will never forget 9/11, and we must never forget the fire fighters and first responders who put their lives on the line when we needed them the most. It is time to permanently reauthorize the Victims Compensation Fund.  #Renew911VCF https://t.co/OPe8WSEZTw|en|D|5|14
1138534478832443393|1067748650485497862|Tue Jun 11 19:52:27 +0000 2019|Our staff holds mobile office hours across the district to meet you in your community. Helping Granite Staters navigate federal agencies and address concerns is our job, so feel free to say hello and let us know how we can help! https://t.co/IC0UQv2lRn|en|D|2|12
1138484933243092994|1067748650485497862|Tue Jun 11 16:35:34 +0000 2019|Today I chaired my second Oversight hearing on @VetAffairsDems which examined the serious challenges in the VA’s police force including a high vacancy rate, poor governance, and lack of consistent standards across the VA. We must make improvements and keep our veterans safe. https://t.co/hJ7O7jPFRk|en|D|4|11
1138171108014903296|1067748650485497862|Mon Jun 10 19:48:33 +0000 2019|Today I met determined advocates, community leaders, &amp; researchers at the 2019 PFAS Conference that are working to raise awareness &amp; address contamination across our country. I'm proud to work alongside them as we push to mitigate the impacts of PFAS &amp; protect public health. https://t.co/AAx6VWtdBF|en|D|0|5
1138153606144618497|1067748650485497862|Mon Jun 10 18:39:00 +0000 2019|Homelessness is a concern that is far too pervasive across New Hampshire. I am humbled to represent constituents like Rita and Raymond Laurion who are helping those who need a hot meal and safe place to rest their head at night. https://t.co/9MCH8pdq18|en|D|3|6
1138118300137906176|1067748650485497862|Mon Jun 10 16:18:42 +0000 2019|In 1963 JFK signed the #EqualPayAct into law to address gender-based wage discrimination. 56 years later we still have work ahead of us to close the gap, which is why I was proud to co-sponsor the Paycheck Fairness Act to hold employers accountable. https://t.co/HEx32xS2k2|en|D|1|12
1138097057917538305|1067748650485497862|Mon Jun 10 14:54:18 +0000 2019|Big Papi has always had the biggest heart on and off the field. We will all be keeping @davidortiz and his family in our thoughts as we wish him a speedy recovery.https://t.co/bAzCLT8lG1|en|D|4|21
1137471608854106113|1067748650485497862|Sat Jun 08 21:28:59 +0000 2019|Educators work tirelessly each day opening doors of opportunity to our students. I was happy to help celebrate them at the New Hampshire’s EDies today. Congratulations to all of the deserving award recipients—we are thankful for all you do to make the world a better place! https://t.co/wWHcvTsEox|en|D|1|11
1137423555778568192|1067748650485497862|Sat Jun 08 18:18:02 +0000 2019|This morning I presented 32 Vietnam veterans with lapel pins as a small token of our appreciation for their service &amp; sacrifice. We are forever indebted to those willing to put everything on the line for our freedoms and security. https://t.co/OBwIrZtowu|en|D|2|8
1137383065494466560|1067748650485497862|Sat Jun 08 15:37:09 +0000 2019|"Stay up to date on our work for the people of New Hampshire by signing up for district updates here! 👇
https://t.co/RGkQYRt3np"|en|D|1|2
1137090136615923712|1067748650485497862|Fri Jun 07 20:13:09 +0000 2019|This morning I spent time attending the Disabled American Veterans New Hampshire State Convention, hearing more about the challenges they face and sharing some of the work we've been doing on the House VA Committee to fight for the resources &amp; care they deserve. https://t.co/nXdfQaYgXz|en|D|3|7
1137011433890287617|1067748650485497862|Fri Jun 07 15:00:25 +0000 2019|On #WearOrange Weekend, I want to salute an inspiring group of young people organizing against gun violence in NH: Exeter Orange mobilized after Parkland to stand up to gun violence &amp; fight for reform in their own community. I look forward to working with them to deliver change. https://t.co/3BGCsaTdnQ|en|D|1|9
1136735212736585736|1067748650485497862|Thu Jun 06 20:42:48 +0000 2019|Yesterday I was presented with an official Navy Seal by Rear Admiral James Loeblein. This has special meaning given the historic presence of the Navy in New Hampshire, and I look forward to proudly displaying this in our office. https://t.co/RqnLayf5pK|en|D|1|4
1136733842277109760|1067748650485497862|Thu Jun 06 20:37:22 +0000 2019|Today I joined @MayorJoyceCraig, @AmericanAir, and @flymanchester leadership to mark the start of two new non-stop flights to Chicago. This is great news for #MHT, NH businesses, &amp; the local economy. We celebrated the occasion with water cannons, cake, &amp; deep dish pizza! https://t.co/TW2X8XH13N|en|D|2|15
1136683154251624449|1067748650485497862|Thu Jun 06 17:15:57 +0000 2019|Last night was my first time getting the chance to enjoy @SenatorShaheen's #ExperienceNewHampshire in D.C. Thanks to Senator Shaheen for showcasing the products and businesses that make our state so special! https://t.co/U5XQO1zOBg|en|D|3|40
1136677858913468417|1067748650485497862|Thu Jun 06 16:54:54 +0000 2019|This is an outstanding tribute to the NH Public Works employees who we have lost on the job. We should always remember the dedicated public servants who put themselves at great risk performing important work for the rest of us. https://t.co/5iewulc8mK|en|D|1|5
1136656405946126336|1067748650485497862|Thu Jun 06 15:29:39 +0000 2019|Yesterday I joined a group of freshman members urging Mitch McConnell to take up #HR1, the #ForThePeople Act. Ending the culture of corruption, getting money out of politics, &amp; making it easier to vote is crucial to making our democracy work for all. https://t.co/uEtD7WeXAw|en|D|6|24
1136646873241010176|1067748650485497862|Thu Jun 06 14:51:47 +0000 2019|Today, on #DDay75thAnniversary, we pay tribute to thousands of heroes who gave their lives on the beaches of Normandy. Let's remember the American and Allied soldiers whose bravery brought about the defeat of fascism and secured freedom and peace. https://t.co/4toZkTfmU7|en|D|2|3
1136365826519568384|1067748650485497862|Wed Jun 05 20:15:00 +0000 2019|This morning I joined End Citizens United &amp; fellow freshmen House members @RepMaxRose, @RepDavids, @RepAndyKimNJ, @RepMalinowski, @RepDeanPhillips, @RepSlotkin, &amp; others to urge Mitch McConnell to take action to pass #HR1, the #ForThePeopleAct &amp; restore faith in our democracy. https://t.co/cQOOfhKe8v|en|D|7|26
1135952465579393027|1067748650485497862|Tue Jun 04 16:52:27 +0000 2019|The actions of Transportation Sec. Chao are deeply concerning--cutting funding for the U.S. maritime industry while promoting family business interests in China. @SecElaineChao must be held accountable. https://t.co/yGfsFwOVRn|en|D|10|24
1135932934085632000|1067748650485497862|Tue Jun 04 15:34:50 +0000 2019|With news that PFAS has found its way into the US food supply, we must take steps to protect the food supply and public health. Americans should not have to live in fear with every meal they have. https://t.co/iwiAJVxgh3|en|D|2|3
1135639913884463104|1067748650485497862|Mon Jun 03 20:10:29 +0000 2019|Happy 200th to the New Hampshire State House! Our citizen-led government has brought ordinary Granite Staters to Concord for centuries to deliberate and govern our state. Best wishes for a week full of bicentennial activities! https://t.co/QZTixuVLaK|en|D|4|8
1135634330032791558|1067748650485497862|Mon Jun 03 19:48:18 +0000 2019|One year ago, President Trump pulled out of the #ParisAccord. This irresponsible act made us the only country in the world to abandon the agreement and global discussions on how to address climate change. We must change course before the withdrawal fully takes effect.|en|D|6|20
1135585414662840326|1067748650485497862|Mon Jun 03 16:33:55 +0000 2019|This is an important piece by @hbarndollar at @seacoastonline. We can’t allow children to be forgotten as families struggle with addiction. We must do better to ensure they are safe, heathy, and supported. https://t.co/xnsXAdCSuQ|en|D|4|7
1135574047381700609|1067748650485497862|Mon Jun 03 15:48:45 +0000 2019|Ten years of love and happiness for thousands of couples. Thanks to all the advocates and allies who ten years ago made New Hampshire one of the first states to pass a marriage equality law. #PrideMonth https://t.co/omWZDCp8a0|en|D|12|62
1134837584549601281|1067748650485497862|Sat Jun 01 15:02:19 +0000 2019|I started my morning by speaking at the start of the Girls on the Run 5K in Portsmouth. It was great to be with nearly 700 girls who have been working hard toward this day. Their energy and determination was infectious. Congratulations to all of today's participants! https://t.co/4a9v58yscw|en|D|0|16
1134823169729159168|1067748650485497862|Sat Jun 01 14:05:02 +0000 2019|Happy #PrideMonth! Throughout June, we'll be celebrating the progress we've made on the path to full equality, honoring the heroes whose shoulders we stand on, and recommitting ourselves to finishing the fight. 🏳️‍🌈 https://t.co/Ftkq9XNI7y|en|D|17|94
1134599347318992903|1067748650485497862|Fri May 31 23:15:38 +0000 2019|I joined @AARPNH, @DartmouthHitch, &amp; medical professionals at the Cashin Center in #MHT to discuss the skyrocketing cost of prescription drugs. I’ll continue to work with colleagues to pass solutions that can lower costs &amp; ensure individuals can access the medications they need. https://t.co/2o6rIhZVt8|en|D|4|5
1134578528249360385|1067748650485497862|Fri May 31 21:52:55 +0000 2019|This afternoon I had the pleasure of doing a ride-along on the COAST bus in Portsmouth. On the way, I spoke with Executive Director Rad Nichols about transit on the Seacoast and funding challenges that could adversely impact this vital service. https://t.co/yfHr4i39IW|en|D|1|5
1134492813058609152|1067748650485497862|Fri May 31 16:12:19 +0000 2019|It was an honor to spend time with our nation's Coast Guard as I toured Station Portsmouth Harbor this AM. While the Admin. has proposed deep cuts to their budget, we must ensure adequate funding to support their work protecting our shores &amp; facilitating maritime transportation. https://t.co/Q6GcV367G2|en|D|1|4
1134491786754310145|1067748650485497862|Fri May 31 16:08:14 +0000 2019|Congrats to @jdistaso, @nancywestnews, @deucecrew, and Dean Shaloup on their lifetime achievement awards from @PressNH! A vibrant free press is essential to a thriving democracy, and they’re a longstanding part of our outstanding NH press corps.|en|D|1|3
1134444450208473088|1067748650485497862|Fri May 31 13:00:08 +0000 2019|Yesterday, at the start of #HousingWeekofAction, I joined the Laconia Housing to talk about the availability affordable workforce housing. This issue touches so many communities across NH &amp; prevents families from finding work in their own communities. We must address this. https://t.co/ohvobtGPsI|en|D|1|4
1134267430807789568|1067748650485497862|Fri May 31 01:16:43 +0000 2019|This evening I was in Meredith to honor our veterans at the longest-running POW/MIA vigil in the United States. I have filed bipartisan legislation—the POW/MIA Flag Act—which would require the flag to be displayed on federal properties in their honor. https://t.co/PtLcyNKVcT|en|D|6|12
1134244810582298624|1067748650485497862|Thu May 30 23:46:50 +0000 2019|This afternoon I spent time with @PhilSpagnuoloNH &amp; staff at New Life Recovery Homes in Laconia, learning more about their efforts to provide recovery supports. I spoke with residents about what they need as we move ahead with a more comprehensive response to the opioid epidemic. https://t.co/7xSjq1PsvF|en|D|3|15
1134183804791328771|1067748650485497862|Thu May 30 19:44:25 +0000 2019|Today I joined veterans, families, &amp; the community to remember our fallen soldiers at the NH Veterans Cemetery in Boscawen. This was a fitting #MemorialDay tribute to our brave soldiers who answered the call and made the ultimate sacrifice for us. https://t.co/wa1ae0UmMu|en|D|2|9
1134101473493692416|1067748650485497862|Thu May 30 14:17:16 +0000 2019|This Admin is using children as pawns in its ongoing efforts to dismantle LGBTQ rights. It’s disgusting &amp; highlights why we need the #EqualityAct. We should make it easier for children to find loving homes, not harder because of discrimination &amp; extremism. https://t.co/5UVABlerjL|en|D|9|18
1134095757747920896|1067748650485497862|Thu May 30 13:54:33 +0000 2019|Thanks to the Islamic Society of NH for welcoming @SenatorHassan, Sen. @LouDallesandro, @MayorJoyceCraig, &amp; me to take part in last night's Iftar as we near the end of #Ramadan. Thank you for the great food, hospitality, and company! https://t.co/EWNDJKlhUO|en|D|2|13
1133769443446841347|1067748650485497862|Wed May 29 16:17:54 +0000 2019|Thanks to everyone who joined us for our Congressional Art Competition Reception yesterday to show off the impressive work of our participants from across the district. Congrats to the winner &amp; finalists who will have their work displayed at the Capitol and in our offices in NH. https://t.co/rpMbMYoypN|en|D|0|9
1133467360013238273|1067748650485497862|Tue May 28 20:17:32 +0000 2019|Go @NHLBruins! An exciting comeback victory last night in the #StanleyCup Final. One step closer to 3 straight Boston championships! https://t.co/z3HmT5ALks|en|D|0|4
1133448246074978306|1067748650485497862|Tue May 28 19:01:34 +0000 2019|Small businesses across the state are the driving force of our economy. I’m glad to see @SBAgov recognize the individuals helping them succeed. https://t.co/s9Nc2H3owT|en|D|0|2
1133444819467014144|1067748650485497862|Tue May 28 18:47:58 +0000 2019|Join us this evening at @3SARTSPACE at 6:30pm in Portsmouth to celebrate the artwork that has been created by students who participated in our Congressional Art Competition. We'll announce the winners and honor their work. https://t.co/QxkQagfirn|en|D|0|2
1133426659208683520|1067748650485497862|Tue May 28 17:35:48 +0000 2019|So many of us have teachers who inspired and opened doors for us. It's important we give them the recognition they deserve for the great work they do, and it’s nice to see Manchester West alum @sethmeyers paying tribute to a great teacher this way. https://t.co/STB3K7tM5c|en|D|9|89
1133413181341282306|1067748650485497862|Tue May 28 16:42:14 +0000 2019|This morning I joined veterans, family members, and state leaders at New Hampshire Veterans Home in Tilton to pay tribute to the fallen. Around #MemorialDay, we must recommit ourselves to building an America worthy of their sacrifice. https://t.co/2B954bdoAi|en|D|5|19
1133110895704514561|1067748650485497862|Mon May 27 20:41:04 +0000 2019|Join us tomorrow at 3S Artspace in Portsmouth at 6:30pm as we celebrate our Congressional Art Competition finalists with an art show to display their work. We will announce the winner and show the community the incredible art that students across the district are creating. https://t.co/ohf2YkL9AD|en|D|2|1
1133110664644444160|1067748650485497862|Mon May 27 20:40:09 +0000 2019|On #MemorialDay we're called to remember the heroes who didn’t return home. For every soldier lost there's a family experiencing unimaginable grief &amp; a nation forever indebted to them. It’s great to see so many fitting tributes across our state, including the Manchester parade. https://t.co/p4ONsQ0w5z|en|D|6|22
1133051871738945537|1067748650485497862|Mon May 27 16:46:31 +0000 2019|This morning I joined veterans and community leaders at the Manchester VA Medical Center to honor our fallen heroes and the veterans we’ve lost to mark this #MemorialDay. Thank you to everyone who came together to honor the memory of so many patriots who served and sacrificed. https://t.co/bxshOeGt3O|en|D|3|17
1132659655442948096|1067748650485497862|Sun May 26 14:48:00 +0000 2019|Join us at 3S Artspace in Portsmouth on Tuesday at 6:30pm as we celebrate the student finalists of our Congressional Art Competition. We will announce the winners and give the community a chance to see the impressive talent that exists across the district. https://t.co/22uhkKNBTY|en|D|3|8
1132014180310106112|1067748650485497862|Fri May 24 20:03:07 +0000 2019|Looking forward to seeing Karen Raynes and Mike Garland's documentary on the USS Squalus, built at Portsmouth Naval Shipyard in 1939. Modern vessel design was impacted by the USS Squalus incident off the Isles of Shoals. https://t.co/O8YEHk7MAs|en|D|1|5
1132007086588596224|1067748650485497862|Fri May 24 19:34:55 +0000 2019|It was a pleasure to join the Portsmouth Propellers Club Lobster Bake at Coast Guard Station Portsmouth Harbor in New Castle this afternoon. The organization does a great job promoting maritime interests and supporting the regional economy. https://t.co/sbzT5OqeuB|en|D|2|7
1131999304443400193|1067748650485497862|Fri May 24 19:04:00 +0000 2019|Recently I caught up with @NHBR to share my thoughts on the progress we've made and the fights we've taken up in my first 100 days as a member of Congress. I look forward to continuing to listen and learn from N.H. and take that feedback to Washington. https://t.co/T68E8X3n52|en|D|1|1
1131968467052191744|1067748650485497862|Fri May 24 17:01:28 +0000 2019|Congratulations to the New Hampshire Scholars Class of 2019. Your hard work and commitment has laid the foundation for your success in college, the military, the workforce, and beyond. Hope you enjoyed the @FisherCats game! https://t.co/eYftMmbExS|en|D|2|7
1131639628585406464|1067748650485497862|Thu May 23 19:14:46 +0000 2019|Hard working Granite Staters should be able to retire with the peace of mind they’ve earned. That's why I was proud to vote for the bipartisan #SECUREAct which will go a long way in addressing our nation’s retirement crisis &amp; helping small business owners save for the future. https://t.co/833XLPMH26|en|D|2|5
1131626118061154304|1067748650485497862|Thu May 23 18:21:05 +0000 2019|Impressed by the work being done at the VA CBOC in Conway. We can’t allow our veterans to feel alone, disconnected, or hopeless. If you are a veteran looking for help or support, don't hesitate to reach out. https://t.co/jXvGbNk30t|en|D|2|4
1131604099139592194|1067748650485497862|Thu May 23 16:53:36 +0000 2019|It's important that Merrimack &amp; surrounding communities are included in this national study. We must do all we can to protect public health and get answers to those exposed to PFAS contamination. https://t.co/e82vk11AXb|en|D|1|3
