id|user|created_at|text|lang|label|retweet_count|favorite_count
1519497073430835200|210926192|Thu Apr 28 02:01:47 +0000 2022|"Today is Yom HaShoah—Holocaust Remembrance Day. Today we remember the 6 million Jews who were murdered in the Holocaust.

We must recommit ourselves to stamping out antisemitism that continues to target Jews in Israel and around the world.

Today we say out loud— Never Again."|en|D|11|16
1517627222634422274|210926192|Fri Apr 22 22:11:40 +0000 2022|"These pictures show the effects of border patrol facilities that are overcrowded and overwhelmed with the sheer number of migrants arriving at our southern border.

Title 42 is critical to ensuring the health and safety of migrants, law enforcement, and border residents. https://t.co/YLQawIA7SH"|en|D|10|21
1514252634563256322|210926192|Wed Apr 13 14:42:16 +0000 2022|"I sent a letter to @GregAbbott_TX urging him to immediately halt the duplicative maintenance inspections at our southern border.

The @TxDPS inspections slow down commercial traffic and affect the supply chain across the US.

We need real border solutions, not unnecessary tactics https://t.co/s58RHPZhwF"|en|D|11|21
1512542041355522048|210926192|Fri Apr 08 21:24:58 +0000 2022|"The new Supreme Court Justice, Judge Ketanji Brown Jackson, will serve our country with dignity. She is the most deserving.

I am excited that children in my district, from San Antonio down to Laredo, will now be able to see themselves in the highest court.

Congratulations! https://t.co/hJV67kThTX"|en|D|11|33
1512157330217086981|210926192|Thu Apr 07 19:56:16 +0000 2022|"Enough is enough. The attack in Tel Aviv today is terrorism- just as were the attacks over the last few weeks.

Israelis should not have to worry about terrorism while enjoying dinner at a restaurant.

We must stamp out anti-semitism and stand with our Israeli friends. 🇮🇱 https://t.co/QFDTV5ZIRa"|en|D|45|232
1511818633462308875|210926192|Wed Apr 06 21:30:25 +0000 2022|Congratulations to Jaime Lizárraga who was appointed to serve as @SECGov Commissioner. Jaime is an a devoted champion of working families and a lifelong public servant.  I am excited for his next step and know he will serve our country well.|en|D|3|2
1511704424548376583|210926192|Wed Apr 06 13:56:35 +0000 2022|.@USCIS needs more funding to continue reducing unnecessary backlogs in immigration benefit applications and refugee processing. Join me &amp; @AppropsDems now as we analyze their 2023 budget request so that the agency can continue its critical work: https://t.co/6TbCXVhprO https://t.co/zSyBXzxWQn|en|D|4|3
1511397760108531717|210926192|Tue Apr 05 17:38:01 +0000 2022|Because of @POTUS’ Executive Order to strengthen the Affordable Care Act and funds from Congress that I supported, nearly 1 million Americans will see lower premiums for their health insurance and thousands of uninsured Americans will gain affordable coverage. #ProtectOurCare https://t.co/OfPZxALFCY|en|D|6|7
1509199019070955524|210926192|Wed Mar 30 16:01:00 +0000 2022|"I stand in solidarity with Israel as the country faces another wave of deadly, antisemitic attacks on innocent civilians.

I condemn these attacks in the strongest terms and pray for the families of those who were lost.

May their memories be a blessing.

#StandWithIsrael https://t.co/FKSpSzTKTz"|en|D|16|70
1509184315980238852|210926192|Wed Mar 30 15:02:34 +0000 2022|"We must support the diabetic community who rely on lifesaving insulin. 

Tomorrow, I will also vote to cap insulin copays at $35/ month.

It’s past time to do the right thing. https://t.co/DumAfIRaZX"|en|D|4|7
1508578513179267078|210926192|Mon Mar 28 22:55:20 +0000 2022|".@POTUS announced a new rule that allows asylum officers at the US-Mexico border to immediately and efficiently adjudicate claims for asylum.

Migrants that are not granted immediate protections will face an immigration judge for further review.

(1/2)"|en|D|4|13
1507464060710920206|210926192|Fri Mar 25 21:06:54 +0000 2022|"March is National Women’s History Month. I joined a bipartisan resolution to honor women’s involvement in history.

This year, the resolution celebrates “Providing Healing, Promoting Hope.” 

To all our mothers, sisters, friends, and colleagues — thank you!"|en|D|1|2
1507082074590695436|210926192|Thu Mar 24 19:49:01 +0000 2022|"The number of Americans filing for unemployment last week fell to 187,000 – the lowest level since September 1969. 

Americans are back at work at a record-setting pace. This Congress, we have added 7.4 million jobs and the unemployment rate has fallen to 3.8 percent. https://t.co/hkYS5zqJvh"|en|D|3|4
1506707747143835663|210926192|Wed Mar 23 19:01:34 +0000 2022|"Saddened to learn of the passing of Madeleine Albright, our first female US Secretary of State.

Albright was a trailblazer, pushing for NATO expansion and steering western foreign policy.

May she Rest In Peace and may her family find comfort during this difficult time https://t.co/QUZfuINrLG"|en|D|0|4
1505704119469813770|210926192|Mon Mar 21 00:33:31 +0000 2022|"I mourn the loss of my friend and colleague, @repdonyoung. 

Rep. Young was the longest serving member of the Republican Party in the House of Reps. He served Alaskan constituents for 49 years.

I pray for his family, his friends, and the Alaskan people. May he Rest In Peace. https://t.co/ikq3qJauIX"|en|D|5|19
1504514834955657222|210926192|Thu Mar 17 17:47:43 +0000 2022|DID YOU KNOW: Last year we saw the greatest single year of job creation in American history: 6.6 million jobs created in the President’s first year – 7.4 million over the course of the Biden Administration – &amp; the fastest economic growth in almost 40 years! https://t.co/cjvIUeFRqV|en|D|5|11
1504215023245266951|210926192|Wed Mar 16 21:56:23 +0000 2022|"I am heartbroken to learn of the passing of 19-year-old Pleasanton resident, Travis Garcia. 

I extend my condolences to his family and the entire @USW_HobbsNM community. May Travis Rest In Peace with his golf teammates — all taken way too soon. 

https://t.co/TPMWIV7NCw"|en|D|6|13
1504153208415199232|210926192|Wed Mar 16 17:50:45 +0000 2022|"Today, the House and Senate had the great honor of attending a Virtual Address to the U.S. Congress delivered by President Volodymyr @ZelenskyyUa of Ukraine.  

We convey our support to the people of Ukraine as they bravely defend democracy. https://t.co/uCoeS5my1v"|en|D|4|8
1504111183812567040|210926192|Wed Mar 16 15:03:45 +0000 2022|Proud to secure funding for mental health services, tuition assistance, and childcare to @CBP. Additionally, the funding allows CBP to hire nearly 800 officers and 725 processing coordinators to ease strain of border agents working to control the influx of migrants at the border. https://t.co/uMXxHMsV4F|en|D|2|4
1503844129381535749|210926192|Tue Mar 15 21:22:35 +0000 2022|"Congrats to my friend, Shalanda Young, on her Senate confirmation to lead the Office of Management and Budget.

I look forward to our continued work bringing federal dollars to south Texas.

@OMBPress https://t.co/7tKWUO2wco"|en|D|2|9
1503785694937989134|210926192|Tue Mar 15 17:30:23 +0000 2022|Today, @POTUS will sign into law the historic funding legislation passed by @HouseDemocrats last week, which will help create jobs and lower costs for families and meet the challenges of our time #ForThePeople. https://t.co/CPbnEVWb2t|en|D|3|6
1502040893842460673|210926192|Thu Mar 10 21:57:10 +0000 2022|"I am a cosponsor of H.R. 1861, the Whole Milk for Healthy Kids Act, which allows the @USDAgov school lunch program to cover flavored whole milk.

Milk is the #1 source of 9 essential nutrients—We must provide children these nutrients so they stay healthy in school and beyond. https://t.co/jXO4b0yDpI"|en|D|1|10
1502009875693461517|210926192|Thu Mar 10 19:53:55 +0000 2022|"In the year since passing the #AmericanRescuePlan to address the economic impact of the COVID-19 pandemic, we’ve created over 7 MILLION jobs and unemployment is down to 3.8% across the United States.

Private sector job growth is strong! https://t.co/SkimgXcrrG"|en|D|7|11
1501759898358530053|210926192|Thu Mar 10 03:20:35 +0000 2022|"I just voted for a brighter tomorrow. Our children in South Texas deserve it.

The government funding package will help working families with the cost of living, create American jobs, and support the vulnerable who work hard. https://t.co/hFYaJ55cId"|en|D|1|7
1501756690810683393|210926192|Thu Mar 10 03:07:51 +0000 2022|"Through government funding legislation that I am voting for this evening, @HouseDemocrats are providing a lifeline to people working hard to support their families. 

I’m so proud of our investments to create an inclusive economy that leaves no Texan behind. https://t.co/B8D3ymw8XK"|en|D|3|6
1501600956085063693|210926192|Wed Mar 09 16:49:00 +0000 2022|"🚨Today is a historic day for South Texas!

The omnibus funding bill will provide critical projects in TX-28 that create jobs, support small businesses, and protect our most vulnerable neighbors.

Proud to be a senior member on this committee- the only Texas Dem! https://t.co/yUhouPKb0c"|en|D|5|11
1501356920287997954|210926192|Wed Mar 09 00:39:18 +0000 2022|"My bill with @RepJohnKatko, the Shadow Wolves Enhancement Act, just passed the House. 

@DHSgov will now be able to increase border personnel and bolster security against illegal activity on federal, privately owned, state and tribal lands.

For more info: https://t.co/GFcePIHfM0"|en|D|1|6
1501245806640308226|210926192|Tue Mar 08 17:17:46 +0000 2022|"I joined a letter to @POTUS calling for an increase in production of domestic energy and applauding the ban on Russian oil.

I support Ukraine against the unprovoked assault by Russia.

Russia is to blame for the war in Ukraine and the rising gas prices at the American pump. https://t.co/A0E3f4AWk3"|en|D|1|11
1499506523600351250|210926192|Thu Mar 03 22:06:29 +0000 2022|"For too long, veterans who have been exposed to toxic burn pits overseas have suffered with little care from the VA. I voted for the PACT Act to get the VA moving on treating these veterans quickly. 

We cannot pinch pennies when it comes to caring for veterans.

#PACTAct https://t.co/jzQYbxFznu"|en|D|6|17
1499391538039644165|210926192|Thu Mar 03 14:29:34 +0000 2022|March is Women's History Month so I want to highlight women in South Texas that have contributed to our community. (1/2) https://t.co/vM7PcDPNmx|en|D|9|27
1498451336823775237|210926192|Tue Mar 01 00:13:33 +0000 2022|"Proud to welcome Dr. Ricardo Cigarroa as my guest for the State of the Union tomorrow. Dr. Cigarroa has been an instrumental part of the fight against COVID in South Texas, conducting  free house calls and interviews.  

Thank you for your leadership and being our hometown hero. https://t.co/gzH1nybQoq"|en|D|3|25
1498379354795134988|210926192|Mon Feb 28 19:27:31 +0000 2022|"The Emmett Till #AntilynchingAct will ensure that the full force of the United States federal government is ALWAYS brought to bear on individuals who commit the monstrous act of lynching.

I'm proud to support this legislation to finally make lynching a federal hate crime. https://t.co/Wb07kjGVEL"|en|D|6|13
1498339108959182848|210926192|Mon Feb 28 16:47:36 +0000 2022|"I send my deepest condolences to @SenFeinstein on the loss of her husband, Dick Blum, who passed away last evening.

May Senator Feinstein, her children, grandchildren, and close friends find comfort in the coming days."|en|D|1|8
1497279162993627137|210926192|Fri Feb 25 18:35:45 +0000 2022|I am proud to support @POTUS pick, Judge Ketanji Brown Jackson, to the Supreme Court. Judge Jackson was raised by two public school teachers. She then worked her way to @Harvard. I appreciate Judge Jackson’s dedication to education and know she will be an excellent justice.|en|D|5|21
1496986080809209858|210926192|Thu Feb 24 23:11:08 +0000 2022|I am committed to helping @cityoflaredo restore the water supply. I have been working directly with @MayorPeteSaenz and @RepRaymondTX to resolve this issue and look forward to meeting next week to discuss all avenues of federal funding.|en|D|2|10
1496605151997706242|210926192|Wed Feb 23 21:57:28 +0000 2022|"I voted for the American Rescue Plan to provide funding for schools as they navigate the COVID-19 pandemic.  In Webb County alone, I helped secure over $1.5 MILLION to help schools bring children safely back to the classroom.

#PublicSchoolProud #PublicSchoolsWeek https://t.co/vvWkiv6uuG"|en|D|4|8
1496232787011149832|210926192|Tue Feb 22 21:17:49 +0000 2022|"My team is helping distribute water to residents.

The Infrastructure Investment and Jobs Act, a bill that I voted for, is bringing crucial investments to communities—like ours—that need improvements to water pipes and systems.

Contact my office if you are in need of assistance. https://t.co/6CC2kyXeot https://t.co/fviVG7MPZ3"|en|D|3|8
1496216653989875719|210926192|Tue Feb 22 20:13:43 +0000 2022|Happy to hear that @MySAWS is willing and ready to help @cityoflaredo restore water to our residents. I have been in communication with @MySAWS CEO, Robert Puente, and thank him for his cooperation. We will not rest until @cityoflaredo has clean drinking water.|en|D|2|4
1495868536736075788|210926192|Mon Feb 21 21:10:25 +0000 2022|"Thank you @POTUS for a year of outstanding leadership and delivering change #ForThePeople! 
 
Happy #PresidentsDay! https://t.co/2psT0jNWY5"|en|D|8|29
1494671171836645378|210926192|Fri Feb 18 13:52:31 +0000 2022|Opportunity Zones allow organizations to invest in economically underserved areas in exchange for tax breaks. This is not just good for business it is good for communities in South Texas. Thank you to Opportunity Zone magazine for naming me a Top 25 Policy Influencer! https://t.co/CZwR967HBT|en|D|3|8
1492322008780050443|210926192|Sat Feb 12 02:17:47 +0000 2022|Congratulations to @txamiualumni Alejandra Avila for being selected for a judicial law clerk post for Justice Sonia Sotomayor! I know you will make Texas proud with your hard work and dedication to the rule of law. Congratulations again! https://t.co/23fdfLSLBG|en|D|2|20
1491889913544982538|210926192|Thu Feb 10 21:40:48 +0000 2022|Building an electric vehicle grid in Texas will create good paying union jobs and decrease our emissions.  I voted for the Bipartisan Infrastructure Law to bring this project to Texas, create jobs, rebuild our economy and improve our lives. https://t.co/gzxLoh04gG|en|D|6|15
1491837791533256709|210926192|Thu Feb 10 18:13:41 +0000 2022|Congratulations to @utrgv Dr. Alexis Racelis on being the ONLY TEXAN appointed to the newly formed @USDAgov Equity Commission!  The Commission will work to make USDA programs more accessible to rural farmers and agricultural workers.  I know Dr. Racelis will make Texas proud! https://t.co/p0Eq3sDrRu|en|D|5|8
1491180640821080066|210926192|Tue Feb 08 22:42:24 +0000 2022|I voted for the Child Tax Credit because it helps lift children out of poverty and keeps more money in the pockets of American families. I will continue working diligently to ensure the Child Tax Credit becomes PERMANENT. https://t.co/GK4qnFcHWI|en|D|5|18
1491179062404218883|210926192|Tue Feb 08 22:36:07 +0000 2022|Congratulations to @UTAustin for being named #1 in @NSF funding! This grant funding helps Longhorns research machine learning, climate change, and more. Texas students are paving the way as our state and country continue to reach new heights. Let's keep climbing and congrats! https://t.co/JrBiTPOvan|en|D|2|7
1491128560253571080|210926192|Tue Feb 08 19:15:27 +0000 2022|"During #SaferInternetDay, we must be clear-eyed about what social media companies are teaching our children.
 
I'm joining @RepSusanWild in calling on @YouTube to remove ""How To Tie a Noose"" videos, which could be the difference between life and death for kids considering suicide https://t.co/CiaM8zpakF"|en|D|5|10
1491084586402869257|210926192|Tue Feb 08 16:20:43 +0000 2022|"Congratulations to Pleasanton High School JROTC Cadet Lieutenant Colonel Simon Karsky for being awarded the Legion of Valor Bronze Cross for outstanding achievement, dependability, and good character. 

https://t.co/kpHkJbrbm6"|en|D|5|7
1489359614302953479|210926192|Thu Feb 03 22:06:17 +0000 2022|Excited to announce nearly $200k for the @utrgv Rural Cooperative Development Grant Program! This program works directly with farmers and ranchers to create jobs and modernize rural areas.  I am committed to funding these rural programs to improve the South Texas economy https://t.co/uPKslnZfhP|en|D|1|6
1489274472263827457|210926192|Thu Feb 03 16:27:58 +0000 2022|"🚨🚨BEXAR COUNTY: Please see below for open warming centers throughout the county. 

If you are in need of assistance, please reach out to my San Antonio office.

Stay safe! https://t.co/YRxPVI9rQi"|en|D|5|6
1488967925537067012|210926192|Wed Feb 02 20:09:51 +0000 2022|"Excited to announce nearly $1.1 MILLION in Rural Development funding for Pleasanton Municipal Airport to build two new hangars!

Thank you @USDA for providing this funding and to the City of Pleasanton for their leadership in bringing federal opportunities to South Texas. https://t.co/vbqdXCCCyB"|en|D|2|3
1488949830756048899|210926192|Wed Feb 02 18:57:57 +0000 2022|"🚨🚨San Antonio: the upcoming winter storm will bring freezing temperatures and ice accumulations to the area. 
 
Click below to get more info and be prepared for potential power outages. If you need assistance, please contact my San Antonio office.

https://t.co/YZbv2xMUYO"|en|D|0|4
1488907904908419072|210926192|Wed Feb 02 16:11:21 +0000 2022|"The LICENSE Act will alleviate stressors on the supply chain and remove regulatory barriers to obtaining commercial driver’s licenses

Thank you @SenMarkKelly @SenLummis @RepLaHood @RepBalderson @RepJoshHarder for your support!

https://t.co/rGjlRSs2W7"|en|D|2|8
1488694450268385286|210926192|Wed Feb 02 02:03:10 +0000 2022|Get well soon, Senator. I wish you a speedy and full recovery. God bless you and your family. https://t.co/lyYLN5r6YB|en|D|1|7
1488583777899225102|210926192|Tue Feb 01 18:43:23 +0000 2022|Congress has worked tirelessly to bring relief to American families, restart our economy, and create high paying jobs.  The U.S. has now recorded the single greatest job growth in American history. Let’s build upon this success and grow an economy that works for everyone. https://t.co/VwkgnnjjoT|en|D|4|9
1488547120068050947|210926192|Tue Feb 01 16:17:43 +0000 2022|"Israel is not an apartheid state. Full stop. 

These inaccuracies incite antisemitic behavior against the Jewish people. Lies that incite violence, but do nothing to help the Palestinian people. 

Let’s work together, not tear each other down.

https://t.co/JWUDdLt7je"|en|D|17|47
1486749634026426379|210926192|Thu Jan 27 17:15:09 +0000 2022|Democrats are creating REAL opportunities for workers to build their own American Dream.  Just last year, we created over 6 MILLION jobs.  I am committed to rebuilding an economy that provides for every American family. https://t.co/V2nY2AcPmY|en|D|3|8
1483574590454575108|210926192|Tue Jan 18 22:58:40 +0000 2022|I have signed a letter urging @HHSGov to ensure that Medicare beneficiaries are able to access at-home COVID-19 testing at no cost. This will grant beneficiaries the option to access at-home tests without a health care professional’s order.|en|D|8|30
1483571024239153155|210926192|Tue Jan 18 22:44:30 +0000 2022|"The men &amp; women of @cbp put their lives on the line everyday to keep us safe. 

That’s why in this years appropriations bill I pushed to include $415 million for pay raises and retirement benefits for CBP’s 64,000 workforce.

I’ll fight to keep this language in the final bill!"|en|D|14|32
1483568095545470978|210926192|Tue Jan 18 22:32:51 +0000 2022|"I look forward to working with @RepDonBacon as the Co-Chairman of the Congressional Caucus for the Advancement of Torah Values. 

We will protect Torah values and freedom of religion, while fighting antisemitism and hatred. 

The inauguration of the caucus https://t.co/HcACGF6DCZ"|en|D|11|27
1483505862287269893|210926192|Tue Jan 18 18:25:34 +0000 2022|"Texas has recovered all jobs lost to the COVID-19 pandemic. Our state is experiencing payroll growth in the retail, warehousing, technology, and transportation industries. 

We now have 28,000 more jobs than in Feb 2020 as we continue to #BuildBackBetter  https://t.co/m7e5E31Rxa"|en|D|7|12
1483470142562525188|210926192|Tue Jan 18 16:03:38 +0000 2022|"Every family in the U.S. is now eligible to receive 4 free at-home COVID-19 tests. 

If you need any assistance finding COVID-19 vaccines or any other resources, please contact my office. 

Please click the link below to order your at-home tests. 

https://t.co/8YcLK8cXoV"|en|D|3|4
1483107204945301506|210926192|Mon Jan 17 16:01:27 +0000 2022|"Today, we pay tribute to #MLK by continuing to fight for social, racial, and economic justice. 

“The arc of the moral universe is long, but it bends towards justice.” 

Thank you to my friend, @RepJeffries, for this message. And thank you Barbara Gervin-Hawkins for hosting us. https://t.co/b7LkalcSxH"|en|D|3|8
1482571535861039104|210926192|Sun Jan 16 04:32:53 +0000 2022|I am relieved to hear that all of the hostages at the synagogue in Colleyville have been released safely.|en|D|5|35
1481994313785561097|210926192|Fri Jan 14 14:19:13 +0000 2022|"The @CDCgov Operation Expanded Testing program provides no cost COVID-19 testing to child care centers, K-12 schools, domestic violence shelters, and other facilities. 

Application instructions can be found here:

https://t.co/PLvukTq0sK"|en|D|3|1
1481319982449451015|210926192|Wed Jan 12 17:39:40 +0000 2022|Over the last year, we added 6.4 million jobs and supported many small businesses. We are now combatting supply chain challenges and rising consumer costs to get goods into your hands more efficiently and cheaply. South Texas—I’m looking out for you. https://t.co/eooURmNYN8|en|D|3|8
1480999475288100866|210926192|Tue Jan 11 20:26:05 +0000 2022|"FEMA is currently accepting applications to the Staffing for Adequate Fire and Emergency Response Grants (SAFER) program. 🔥 🚑 

The grant provides funding to fire departments and volunteer firefighter organizations. The deadline is February 4, 2022.

https://t.co/Gyb5TKmFRK"|en|D|2|0
1480681698337734663|210926192|Mon Jan 10 23:23:21 +0000 2022|Throughout his time in Congress, @RepPerlmutter has served as a loyal friend and colleague. I wish him and his family all the best in this next chapter. https://t.co/B8zKyKUHhX|en|D|1|3
1480642116439134221|210926192|Mon Jan 10 20:46:04 +0000 2022|"I helped secure $7.8 million in relief funds for independent venues, promoters, and festivals in TX-28. I will continue to support small businesses in their recovery from the pandemic and the battle against Omicron.

#saveourstages @nivassoc https://t.co/o5M1BfMhd6"|en|D|2|9
1480569731228839940|210926192|Mon Jan 10 15:58:26 +0000 2022|"The @cityoflaredo, in collaboration with Vara Health, is now offering additional COVID-19 testing at the Laredo Public Library.

With the spread of Omicron, we must do our part to keep the community safe.

If you have been exposed to COVID-19, please get a test and stay home."|en|D|3|3
1480297333153751043|210926192|Sun Jan 09 21:56:01 +0000 2022|"Happy National Law Enforcement Day! I am so grateful for your service to protecting our communities. Today, and everyday, we salute you and thank you. 🇺🇸

@LaredoPolice @SATXPolice @MissionPD @CapitolPolice @CBP @webb_county https://t.co/PLdnsEjCF5"|en|D|4|13
1479599143240753153|210926192|Fri Jan 07 23:41:40 +0000 2022|Israel’s commitment to research in the life sciences sector has been fundamental to global health—through vaccine development, supply chain management and economic cooperation…I look forward to my continued work and commitment to solutions with @_USIEducation https://t.co/4Kwp3Ha9nu|en|D|3|8
1479089978013585409|210926192|Thu Jan 06 13:58:25 +0000 2022|One year ago today, violent insurrectionists stormed the nation’s Capitol building to try and stop the election certification of @POTUS. I was in my office with my staff that day. For hours, we watched as these rioters caused mass destruction to this sacred building. https://t.co/Iu3BnXUOnt|en|D|3|8
1478870150204084228|210926192|Wed Jan 05 23:24:54 +0000 2022|Liquid natural gas is critical to reducing America’s dependence on foreign states. That is why I have continued to support American energy producers. We must promote energy independence and job growth here in the United States. https://t.co/alvAnax9wT|en|D|5|13
1478449407284682755|210926192|Tue Jan 04 19:33:01 +0000 2022|".@RepBobbyRush spent his career championing civil rights. He is a hero to his Chicago constituents and minorities across the country. We are all indebted to his service to our country.

Thank you, my friend, for your time. I wish you all the best on this next chapter."|en|D|2|6
1477301982289440771|210926192|Sat Jan 01 15:33:34 +0000 2022|#HappyNewYear and welcome to 2022! Here’s to this being a year of growth and happiness for communities across our country. https://t.co/b4TcwtHHTX|en|D|2|9
1476584666987696133|210926192|Thu Dec 30 16:03:12 +0000 2021|"Dear TX-28,

I want to show you some of the incredible achievements that we accomplished this past year. We have so much more to do — but with your help, I know we can achieve anything we set our minds on. Thank you!

https://t.co/ClVqTBtKhy

Merry Christmas and Happy New Year! https://t.co/6yXk88uYk8"|en|D|3|9
1476311895208566791|210926192|Wed Dec 29 21:59:19 +0000 2021|"On December 29, 1845, Texas became the 28th state admitted to the Union. The Lone Star State, the state we all love, was born. 

Happy Birthday Texas! https://t.co/7y9l8TYsuu"|en|D|2|46
