id|user|created_at|text|lang|label|retweet_count|favorite_count
1242896673845776384|776664410|Wed Mar 25 19:30:33 +0000 2020|I join with my colleague Ted Lieu. This provision needs to go. https://t.co/GXwu4xKG2s|en|D|2|10
1242895857692954626|776664410|Wed Mar 25 19:27:19 +0000 2020|Coming up: I’m hosting a telephone town hall at 5:40 p.m. with health care and small business experts to take your… https://t.co/C09eLMITSX|en|D|1|2
1242811704792231937|776664410|Wed Mar 25 13:52:55 +0000 2020|Attention small business owners: Many of you have called my office asking how to get the disaster loans we've funde… https://t.co/rKJFmkqsaa|en|D|3|5
1242592163961192448|776664410|Tue Mar 24 23:20:32 +0000 2020|Cleaning &amp; janitorial staff everywhere are working tirelessly to keep our grocery stores and hospitals clean during… https://t.co/ueJ8SPmtVU|en|D|4|27
1242566725335474185|776664410|Tue Mar 24 21:39:27 +0000 2020|Many local governments were strapped for cash even before the #COVID19 outbreak. Our latest proposal would boost Co… https://t.co/BnjZtjWHql|en|D|3|6
1242553686116765697|776664410|Tue Mar 24 20:47:38 +0000 2020|Encouraged to see @USTradeRep is taking steps to import more protective medical equipment after my colleagues and I… https://t.co/m71fBw2nvU|en|D|2|3
1242541032249704460|776664410|Tue Mar 24 19:57:22 +0000 2020|I’m hosting a live town hall with health &amp; small business experts from our area to take questions about #COVID19 in… https://t.co/d7uzU1BNCy|en|D|4|3
1242480772713512960|776664410|Tue Mar 24 15:57:55 +0000 2020|"Monroe County is now under a ""Stay At Home"" order.

Whether you're in a county under this order or not, staying in… https://t.co/e2KrlOpxMV"|en|D|2|3
1242211349834403841|776664410|Mon Mar 23 22:07:19 +0000 2020|On Wednesday, 3/25, I’m hosting a live telephone town hall with health care and small business experts to take your… https://t.co/setJGs4whI|en|D|2|3
1242170744903290883|776664410|Mon Mar 23 19:25:58 +0000 2020|Yesterday, we saw the first confirmed #COVID19 case in the @USFederalPrison system. They showed symptoms 3 days aft… https://t.co/MDBPTK5LQ9|en|D|2|3
1242149298739044352|776664410|Mon Mar 23 18:00:45 +0000 2020|10 years ago today, the #ACA became law. In that time it's protected people with pre-existing conditions, covered m… https://t.co/i5bQOFmF4h|en|D|1|4
1242103430434480130|776664410|Mon Mar 23 14:58:29 +0000 2020|THREAD: My dedicated staff are working remotely so Northeastern Pennsylvanians can continue to come to us for help… https://t.co/bF7y2sPWxw|en|D|1|16
1241061946159325185|776664410|Fri Mar 20 18:00:00 +0000 2020|IMPORTANT: Both the tax filing AND payment deadlines are now July 15, 2020 – Americans will have an extra three mon… https://t.co/pN3cQkbHzU|en|D|2|5
1241038628442312706|776664410|Fri Mar 20 16:27:21 +0000 2020|I find it appalling that coal companies are attempting to kneecap critical programs that help former coal regions a… https://t.co/BlMhsNRFGi|en|D|13|34
1241031746621034498|776664410|Fri Mar 20 16:00:00 +0000 2020|Both individuals &amp; businesses taking part in mitigation efforts is essential to slowing the spread of #COVID19. The… https://t.co/KljItgmPqc|en|D|1|3
1241022584273108993|776664410|Fri Mar 20 15:23:35 +0000 2020|Small businesses across PA impacted by #COVID19 are now eligible for economic injury disaster loans to help cover c… https://t.co/aJ6QUc5x8R|en|D|1|3
1240986453070319617|776664410|Fri Mar 20 13:00:01 +0000 2020|I want all northeastern Pennsylvanians to know that I’m looking out for you as we fight #COVID19. My office is now… https://t.co/QtXP2d4pMj|en|D|35|77
1240748630983823361|776664410|Thu Mar 19 21:15:00 +0000 2020|This is a challenging time for our nation’s health care workers. Let’s take a moment today to thank our doctors, fi… https://t.co/nACkNi2SXQ|en|D|10|22
1240732143204085765|776664410|Thu Mar 19 20:09:29 +0000 2020|We have U.S. servicemembers stationed around the world, including tens of thousands in countries hit hard by… https://t.co/FrnpjJNylq|en|D|3|11
1240327021970051074|776664410|Wed Mar 18 17:19:40 +0000 2020|This morning, I received confirmation that someone I interacted with over the weekend has tested positive for… https://t.co/YkCr9os1YX|en|D|14|37
1239993656280403969|776664410|Tue Mar 17 19:15:00 +0000 2020|This is a difficult time for our nation &amp; world as we fight #COVID19, but on this #StPatricksDay, let’s take some t… https://t.co/vFt4uDtP1X|en|D|2|9
1239966173556387841|776664410|Tue Mar 17 17:25:47 +0000 2020|Northeastern Pennsylvania veterans: here’s some information from the VA about how they are working to protect and c… https://t.co/V4hlJ1y7zf|en|D|1|4
1239619944716718081|776664410|Mon Mar 16 18:30:00 +0000 2020|Have #COVID19 questions? I’m keeping my website up to date with the latest on the outbreak in NEPA, what we’re doin… https://t.co/wYfIX2kT0J|en|D|4|9
1239582196932808705|776664410|Mon Mar 16 16:00:00 +0000 2020|The #FamiliesFirst #Coronavirus Response Act helps ensure food security for vulnerable seniors during this #COVID19… https://t.co/V3CceeE7c6|en|D|8|14
1239564731545006080|776664410|Mon Mar 16 14:50:36 +0000 2020|The scale of the #COVID19 pandemic demands a strong health care AND economic response. The #FamiliesFirst… https://t.co/SoBbCjzD7S|en|D|19|59
1239255184519421952|776664410|Sun Mar 15 18:20:34 +0000 2020|I’m continuing to monitor the #COVIDー19 outbreak in northeastern Pennsylvania. The latest info on the number of cas… https://t.co/qVfDdZe7ld|en|D|4|4
1238834770790027267|776664410|Sat Mar 14 14:30:00 +0000 2020|I’m proud to have a 100% rating from Defenders of Wildlife for the 7th year running! The public lands in northeaste… https://t.co/wsCg2Fv19j|en|D|2|6
1238818822313959424|776664410|Sat Mar 14 13:26:38 +0000 2020|"Early this morning, the House passed the #FamiliesFirst #Coronavirus Response Act to:

✔️provide paid sick leave
✔️… https://t.co/aCLz6gWA7i"|en|D|9|20
1238585729036496902|776664410|Fri Mar 13 22:00:24 +0000 2020|The #COVID19 response package enacted last week authorized up to $7 billion for low-interest disaster loans for sma… https://t.co/Kt12JTq4xO|en|D|2|5
1238556430862626817|776664410|Fri Mar 13 20:03:59 +0000 2020|Attention Firefighters: the Assistance to Firefighters Grant application period has been extended to March 20, 2020… https://t.co/cbWwL2P4Vn|en|D|1|1
1238534948157632512|776664410|Fri Mar 13 18:38:37 +0000 2020|The #Covid_19 outbreak may be stressful for both adults and children. @CDCgov has helpful information on ways to ma… https://t.co/AM1boCS9XE|en|D|1|9
1238167968112091137|776664410|Thu Mar 12 18:20:22 +0000 2020|Public workers deserve to be able to stand together &amp; fight for fair pay and better workplace protections. I’m prou… https://t.co/bIAtAEaaEK|en|D|4|8
1238141806799355904|776664410|Thu Mar 12 16:36:24 +0000 2020|Pleased to announce that the Scranton Primary Health Care Center was awarded a $1.2M grant to help them continue pr… https://t.co/oJU31rrCbs|en|D|2|10
1237816754186981376|776664410|Wed Mar 11 19:04:46 +0000 2020|PFAS contamination at military bases around the globe has put countless lives at risk. Right now, I’m examining the… https://t.co/ra1BHucT7X|en|D|2|3
1237790314666082311|776664410|Wed Mar 11 17:19:42 +0000 2020|#Census2020 Day is coming up, and households will soon receive info about how to participate. But be on the lookout… https://t.co/yqPSwsZhb7|en|D|6|10
1237737974898491393|776664410|Wed Mar 11 13:51:43 +0000 2020|Great meeting with my friends from @DelRivCoalition @PennFuture @DucksUnlimited &amp; @TroutUnlimited. I’m strongly com… https://t.co/ZcCXPPeDOd|en|D|6|17
1237500285205045249|776664410|Tue Mar 10 22:07:14 +0000 2020|An accurate #Census2020 makes sure we get the federal resources we need in NEPA. Visit my website to learn more abo… https://t.co/UFYTsqmJIr|en|D|2|5
1237111712085684224|776664410|Mon Mar 09 20:23:11 +0000 2020|Proud to be leading bills with support from both political parties to revitalize our mine-scarred lands and take ca… https://t.co/MScaQwY8jY|en|D|4|8
1237019998205423617|776664410|Mon Mar 09 14:18:44 +0000 2020|Millions of seniors experience some form of hearing loss, but resources like hearing aids can be outrageously expen… https://t.co/5U2m76NlPQ|en|D|3|7
1236776960472371201|776664410|Sun Mar 08 22:13:00 +0000 2020|House Democrats have been working to lower drug prices, protect our clean water &amp; air, and end gun violence. We pas… https://t.co/K7GVctt8K4|en|D|2|15
1236728390582800385|776664410|Sun Mar 08 19:00:00 +0000 2020|1 year ago today, the House passed #HR1, the #ForThePeople Act, a major corruption reform bill to end outsize corpo… https://t.co/g8lv4wsll7|en|D|13|18
1236710354765451265|776664410|Sun Mar 08 17:48:20 +0000 2020|This year’s #InternationalWomensDay theme is #EachforEqual. As we celebrate the accomplishments of trailblazing wom… https://t.co/RR9vwl6Jcu|en|D|1|4
1236385494503763969|776664410|Sat Mar 07 20:17:27 +0000 2020|Participating in #Census2020 is a great way to make your voice heard. It's non-partisan, it's safe, it's confidenti… https://t.co/5jwC6dwgjU|en|D|2|3
1236000226357452800|776664410|Fri Mar 06 18:46:32 +0000 2020|One of these confirmed #COVID19 cases is in northeastern Pennsylvania. I have been in contact with the… https://t.co/d3IUxNc5em|en|D|3|7
1235939633177022464|776664410|Fri Mar 06 14:45:45 +0000 2020|Proud to keep leading the charge of Democrats and Republicans fighting the scourge of child porn. Here with… https://t.co/dwgiLakjNY|en|D|1|4
1235626128540385280|776664410|Thu Mar 05 18:00:00 +0000 2020|ICYMI: With @IRSnews restarting use of private debt collection companies to collect past due tax payments, I asked… https://t.co/41Lymf2fSw|en|D|2|9
1235603479005204480|776664410|Thu Mar 05 16:30:00 +0000 2020|🚨🚨What you REALLY need to know if DC Republicans win their lawsuit against the #ACA: “Everything would go: protecti… https://t.co/H7zJAPNVcT|en|D|7|15
1235305263336427521|776664410|Wed Mar 04 20:45:00 +0000 2020|Today, the House will consider a strong, comprehensive $8.3 billion #COVID19 response package to accelerate vaccine… https://t.co/PvhgLQIjXb|en|D|0|3
1235295429060972546|776664410|Wed Mar 04 20:05:55 +0000 2020|I’ve been working to bring back money for stormwater projects &amp; to protect our clean water, but the WH budget propo… https://t.co/ThgG6Jm682|en|D|6|11
1235210892205154304|776664410|Wed Mar 04 14:30:00 +0000 2020|This morning, @AppropsDems &amp; I will examine the FY21 budget request for @USTreasury. I'm planning to ask… https://t.co/lKNtFDB2cF|en|D|1|5
1234966757040906243|776664410|Tue Mar 03 22:19:54 +0000 2020|"I’m encouraged to see that our area hospitals are taking proactive steps to expand #COVID19 testing. 
https://t.co/g8B5PzBtZ4 1/3"|en|D|0|3
1234942122035482625|776664410|Tue Mar 03 20:42:00 +0000 2020|Following reports last year of unsafe conditions our servicemembers &amp; their families were facing in privatized hous… https://t.co/aQLxfrYO60|en|D|3|5
1234856056162906112|776664410|Tue Mar 03 15:00:00 +0000 2020|Service members &amp; their families deserve safe, high-quality housing and to have their housing concerns quickly addr… https://t.co/Cvxt50Jsjg|en|D|1|2
1234514564143894531|776664410|Mon Mar 02 16:23:02 +0000 2020|America’s seniors deserve affordable health care, financial security and the ability to live independently &amp; contri… https://t.co/UPJF4QlX92|en|D|7|17
1233473141797769216|776664410|Fri Feb 28 19:24:48 +0000 2020|Millions of people visit the Delaware Water Gap Nat'l Recreation Area each year to take in its natural beauty. I've… https://t.co/oyy6jT2ISF|en|D|0|2
1233466903168999425|776664410|Fri Feb 28 19:00:01 +0000 2020|Coal companies often use deceptive practices to prevent miners and their families from receiving the benefits they… https://t.co/Fo2TYOlC1R|en|D|4|10
1233174976003526657|776664410|Thu Feb 27 23:40:00 +0000 2020|Insulin prices are so out of hand that patients are turning to Craigslist. It’s unacceptable that people have to go… https://t.co/oI3y4s65kG|en|D|4|14
1233153585220923392|776664410|Thu Feb 27 22:15:00 +0000 2020|One year ago today, the House took an important step to address the gun violence crisis in this country by passing… https://t.co/OZEHd0rhno|en|D|3|7
1233142260398796819|776664410|Thu Feb 27 21:30:00 +0000 2020|As extreme weather events grow ever more intense, we have to ensure our homes, businesses and infrastructure are bu… https://t.co/svNjDZeNuU|en|D|1|2
1233127970967105547|776664410|Thu Feb 27 20:33:13 +0000 2020|Today I had a visit from my friend Micaela of Plymouth, PA – she was recently promoted to Cadet Captain in the Civi… https://t.co/GxGNFvGHwB|en|D|1|6
1233081862886744065|776664410|Thu Feb 27 17:30:00 +0000 2020|Modernizing @DeptVetAffairs electronic health records is key to improving health care for veterans &amp; their families… https://t.co/RKmp2EbNGG|en|D|3|2
1232777087188119556|776664410|Wed Feb 26 21:18:56 +0000 2020|By now, it’s clear that the Coronavirus poses a threat to our health, safety &amp; economy here in the U.S. On… https://t.co/SFGdcFmagc|en|D|10|14
1232745899056648192|776664410|Wed Feb 26 19:15:00 +0000 2020|Completing your #Census2020 is so important for our northeastern Pennsylvania community because it helps determine:… https://t.co/WAHIlkhv87|en|D|2|3
1232716958266687493|776664410|Wed Feb 26 17:20:00 +0000 2020|After over a century of failed attempts, Congress is finally poised to outlaw lynching. Today, we bring justice to… https://t.co/sG8M0vvQ7j|en|D|2|11
1232326637787766784|776664410|Tue Feb 25 15:29:00 +0000 2020|Public schools are the foundation of success for young people across this country. That’s why I support the Rebuild… https://t.co/jdNOQNGx3R|en|D|2|4
1232064587995979776|776664410|Mon Feb 24 22:07:43 +0000 2020|I heard from so many constituents today about how they rely on Medicare to get the medication they need – whether i… https://t.co/5WR6ATNUoS|en|D|4|17
1231991887411712001|776664410|Mon Feb 24 17:18:49 +0000 2020|Proud to join my colleagues in this push for #ERAnow. Women's equality is not a partisan issue, it's a human issue,… https://t.co/Vn2FX2bVbp|en|D|7|13
1230877516400877570|776664410|Fri Feb 21 15:30:43 +0000 2020|Proud to announce that NEPA will receive $23 million+ for affordable housing support this year. These funds will ke… https://t.co/6ls0kUNrOk|en|D|10|18
1230602587898077191|776664410|Thu Feb 20 21:18:15 +0000 2020|Pre-existing conditions protections are at risk, and Rx prices are spiraling out of control. The House has passed b… https://t.co/BEYn91CMJ2|en|D|10|17
1230275872944316416|776664410|Wed Feb 19 23:40:00 +0000 2020|Did you know that @USCensusBureau is still hiring in our area for #Census2020? It’s a great opportunity for a good-… https://t.co/SOVSOba2s1|en|D|3|7
1230250222061850624|776664410|Wed Feb 19 21:58:04 +0000 2020|The Medicaid expansion has been a lifeline for rural hospitals in northeastern Pennsylvania. Cutting $900 billion f… https://t.co/Je0yHyAeFg|en|D|17|26
1229895870101041153|776664410|Tue Feb 18 22:30:00 +0000 2020|Leader McConnell is still sitting on 275+ BIPARTISAN-passed bills that help working Americans – bills to strengthen… https://t.co/VQWwvD2fTv|en|D|16|26
1229858346523594753|776664410|Tue Feb 18 20:00:54 +0000 2020|Big drug companies have hiked the prices of 500+ drugs already this year. They are robbing Americans at the pharmac… https://t.co/nqKKwxFj0Z|en|D|9|18
1228383455731470336|776664410|Fri Feb 14 18:20:12 +0000 2020|Check out my latest e-newsletter to find out how I’m fighting to protect health care for our most vulnerable, plus… https://t.co/1ATHghH34z|en|D|1|4
1228052799289778178|776664410|Thu Feb 13 20:26:18 +0000 2020|The #ChesapeakeBay Program provides critical funding for stormwater system improvements in our area and helps reduc… https://t.co/YJInId4vHq|en|D|7|8
1228012975312777218|776664410|Thu Feb 13 17:48:03 +0000 2020|A great example of the Abandoned Mine Land Trust Fund at work in NEPA! I’m leading the charge to ensure this progra… https://t.co/UeBnq2HG0X|en|D|2|2
1227991815615385601|776664410|Thu Feb 13 16:23:58 +0000 2020|Women’s equality is not a partisan issue, it’s a human issue, and the Constitution should reflect that. That's why… https://t.co/6bbbp6bCWS|en|D|19|61
1227739158044504064|776664410|Wed Feb 12 23:40:00 +0000 2020|Our @NRDems #KeepItWild bill has passed the House! This bill protects 1.3 million acres of wilderness and 1,000 riv… https://t.co/5WYCmG3vO8|en|D|7|17
1227729450021814272|776664410|Wed Feb 12 23:01:25 +0000 2020|Turning Medicaid into a block grant program would put health care for nearly 3,000,000 Pennsylvanians at risk &amp; jeo… https://t.co/1ekIrzRdrD|en|D|9|18
1227367962627235840|776664410|Tue Feb 11 23:05:00 +0000 2020|A new @PennEnvironment report shows a concerning trend about the air quality in NEPA. Clean air is one of our most… https://t.co/8X5ACuaBrE|en|D|11|28
1227345024914001920|776664410|Tue Feb 11 21:33:51 +0000 2020|I agree that our infrastructure desperately needs federal investment. In the House, we’ve outlined a comprehensive… https://t.co/wuV2B96jsd|en|D|8|12
1227029481883389953|776664410|Tue Feb 11 00:40:00 +0000 2020|Cutting $500,000,000,000 from Medicare &amp; $900,000,000,000 from Medicaid as the White House budget requests would be… https://t.co/NzTOq10mfI|en|D|33|66
1227014544335286274|776664410|Mon Feb 10 23:40:38 +0000 2020|Always great to see AFGE Local 1647 in DC! I'm proud to continue the fight for stronger organizing rights and a lon… https://t.co/KNLWVEvkAI|en|D|1|8
1225919125488308229|776664410|Fri Feb 07 23:07:50 +0000 2020|I’m working with my colleagues from Pennsylvania to prevent cuts to Medicaid and ensure children, seniors and indiv… https://t.co/V1WpEF5bQI|en|D|10|30
1225868902988730368|776664410|Fri Feb 07 19:48:16 +0000 2020|Yesterday, my @SEEC colleagues and I met with @AlGore to discuss how we can take #ClimateActionNow. It shouldn’t be… https://t.co/WztYfAJRuq|en|D|6|17
1225603927590215680|776664410|Fri Feb 07 02:15:21 +0000 2020|"The House has just passed the #PROAct – bold labor reform legislation that:

✔️Strengthens workers' power to negoti… https://t.co/e4u4saAkrS"|en|D|7|28
1225561816266428417|776664410|Thu Feb 06 23:28:01 +0000 2020|This week, the House passed a bill I proudly co-sponsored to provide $455 million over the next 5 years to address… https://t.co/ND7NNUsVHN|en|D|1|19
1225539310335791107|776664410|Thu Feb 06 21:58:35 +0000 2020|The right to collectively bargain is a time-honored tradition in NEPA, and a core pillar of a strong American middl… https://t.co/Zo8WzgNRYB|en|D|5|21
1225503417629597696|776664410|Thu Feb 06 19:35:58 +0000 2020|THIS JUST IN: Pennsylvania will receive over $32 million for abandoned mine reclamation this year! https://t.co/R02PJwkWDR|en|D|0|16
1225495625309081600|776664410|Thu Feb 06 19:05:00 +0000 2020|Medicaid block grants put health care for children, seniors and individuals with disabilities at risk. I am committ… https://t.co/8ymKfbW5HT|en|D|219|628
1225481283880542208|776664410|Thu Feb 06 18:08:01 +0000 2020|This is an all-too-common story in the US. The soaring cost of prescription drugs is sending Americans into debt or… https://t.co/ZrewkvfiAv|en|D|2|9
1225165952855281665|776664410|Wed Feb 05 21:15:00 +0000 2020|Our economy might be good for those at the top, but working people are still struggling to get ahead. This week, th… https://t.co/dWKh2ImLaP|en|D|5|11
1225146141282652161|776664410|Wed Feb 05 19:56:16 +0000 2020|At a time when urban issues get plenty of attention, it's our responsibility to make sure small towns don't get lef… https://t.co/HUUMEHr2xf|en|D|0|1
1224919919688548352|776664410|Wed Feb 05 04:57:21 +0000 2020|After tonight, this fact still remains: Democrats have been working to expand access to health care, while national… https://t.co/thPDzyevGG|en|D|25|52
1224914323648196609|776664410|Wed Feb 05 04:35:07 +0000 2020|It is absolutely true that our nation's infrastructure needs to be rebuilt. @HouseDemocrats' #MovingForward plan ma… https://t.co/HW5L749eGU|en|D|4|16
1224909898934292480|776664410|Wed Feb 05 04:17:32 +0000 2020|The president called for a bill to address the skyrocketing cost of prescription drugs. We’ve already sent one to t… https://t.co/O3SBqT6gRw|en|D|20|62
1224862679485046784|776664410|Wed Feb 05 01:09:54 +0000 2020|Democrats are passing bills #ForThePeople to negotiate lower prescription drug costs and protect people with pre-ex… https://t.co/IgoatXkGGl|en|D|2|8
1224814061818404864|776664410|Tue Feb 04 21:56:42 +0000 2020|I’m proud to welcome Ben Tielle from Pittston to join me at the State of the Union tonight and shine a light on our… https://t.co/Xg25PHzrTx|en|D|0|11
1224771951119544320|776664410|Tue Feb 04 19:09:22 +0000 2020|Ben’s story is a stark reminder what’s at stake for people with pre-existing conditions if the courts overturn the… https://t.co/95dnGg8OC7|en|D|4|8
1224372865836945408|776664410|Mon Feb 03 16:43:33 +0000 2020|This year's Assistance to Firefighters Grants application period is now open! These funds can help our local fire c… https://t.co/fAKDAreUtL|en|D|2|10
1223968799893999617|776664410|Sun Feb 02 13:57:56 +0000 2020|This month, let’s take time to celebrate the contributions that Black Americans have made to our nation, remember t… https://t.co/qlKjgy1HtQ|en|D|4|8
1223264073741152256|776664410|Fri Jan 31 15:17:36 +0000 2020|It’s very troubling to see that schools in Scranton are still contaminated with lead &amp; asbestos. I'm monitoring thi… https://t.co/VHrJroXu6W|en|D|8|15
1223066315876904961|776664410|Fri Jan 31 02:11:47 +0000 2020|Let's be clear about what Washington Republicans' Medicaid proposal would do: it would put health care for the most… https://t.co/KzzgGVgLoN|en|D|15|21
1223006686845325322|776664410|Thu Jan 30 22:14:51 +0000 2020|The Lackawanna is Pennsylvania's 2020 River of the Year! Better yet, the Lackawanna River Conservation Association… https://t.co/urLcaB5fgp|en|D|4|14
1222995916078157824|776664410|Thu Jan 30 21:32:03 +0000 2020|The #USMCA is now law! I’m proud of the work my Democratic colleagues did to make it a better deal. The improved US… https://t.co/KcwaFhjU7Z|en|D|2|6
1222912239629492224|776664410|Thu Jan 30 15:59:33 +0000 2020|No child should ever feel afraid in their classroom. That's why I've introduced legislation today to to improve awa… https://t.co/zqOCqb7uXx|en|D|3|5
1222610673261252608|776664410|Wed Jan 29 20:01:14 +0000 2020|#HouseDemocrats are making good on our promises to bring down the cost of health care, raise wages, get big money o… https://t.co/fVZWS8qTBM|en|D|2|7
1222592896295219203|776664410|Wed Jan 29 18:50:35 +0000 2020|Creating good-paying jobs &amp; investing in our infrastructure honors our commitment to work #ForThePeople.… https://t.co/OS6tzhTtYZ|en|D|3|6
1222580370341801995|776664410|Wed Jan 29 18:00:49 +0000 2020|Thanks to my colleagues on @NRDems for approving my bill, the SAFE Act, today. As the effects of extreme weather be… https://t.co/dRwuiAMVW4|en|D|4|17
1222561089982025729|776664410|Wed Jan 29 16:44:12 +0000 2020|Thanks to @WhiteCoatWaste for presenting me with the “Waste Warrior” award for my efforts to put an end to inhumane… https://t.co/v8DgZ7yqcH|en|D|10|21
1222545989346742273|776664410|Wed Jan 29 15:44:12 +0000 2020|LIVE NOW: the House Natural Resources Committee is considering the SAFE Act, my bill to protect our natural resourc… https://t.co/dNIo6M8Zcp|en|D|4|8
1222543425813340162|776664410|Wed Jan 29 15:34:01 +0000 2020|I’m proud to announce that Ben Tielle of Pittston will join me next week at the State of the Union. Ben’s story rem… https://t.co/7htSuW2Efx|en|D|2|7
1221884486549409794|776664410|Mon Jan 27 19:55:37 +0000 2020|75 years after the liberation of the Nazis’ largest death camp, #WeRemember the millions of victims and survivors o… https://t.co/2Yy91rbc2j|en|D|1|13
1220828625521393664|776664410|Fri Jan 24 22:00:00 +0000 2020|I had the honor of nominating Gavin Brazanskas of Shohola to be considered to attend the U.S. Naval Academy, and he… https://t.co/hxbYaoD436|en|D|3|12
1220812877780725761|776664410|Fri Jan 24 20:57:26 +0000 2020|It’s my honor to lead the charge of Democrats &amp; Republicans working together to fund abandoned mine land  reclamati… https://t.co/vTh256sk00|en|D|1|6
1220774963403161602|776664410|Fri Jan 24 18:26:46 +0000 2020|Thanks to everyone who joined me for “Coffee with Your Congressman” in Hazleton this week! We had thoughtful conver… https://t.co/steo1LweGa|en|D|1|8
1220443169776717831|776664410|Thu Jan 23 20:28:21 +0000 2020|Strong showing of support across party lines today for cleaning up environmental and safety hazards posed by abando… https://t.co/9NTejD5rRA|en|D|0|12
1220054296890310656|776664410|Wed Jan 22 18:43:06 +0000 2020|It was great to see so many constituents, students, and Boy Scouts come out to our coffee event last night in Bushk… https://t.co/9McqdHicvJ|en|D|2|16
1219741460326645760|776664410|Tue Jan 21 22:00:00 +0000 2020|I’m proud of my record of fighting big money special interests in Washington. It’s a critical step to making progre… https://t.co/KuuAgh31az|en|D|2|17
1219698283179839488|776664410|Tue Jan 21 19:08:26 +0000 2020|High drug costs burden millions of Americans, but the Supreme Court #CitizensUnited ruling has allowed big drug com… https://t.co/7emYldcc2F|en|D|10|23
1219299327216095232|776664410|Mon Jan 20 16:43:07 +0000 2020|Martin Luther King Jr. stood up against racial injustice in a way that was peaceful, even when those who opposed hi… https://t.co/vIS9xnX6Vo|en|D|2|11
