id|user|created_at|text|lang|label|retweet_count|favorite_count
1520548400248373248|1067748650485497862|Sat Apr 30 23:39:23 +0000 2022|"Thank you to all who organized #DrugTakeBackDay events across New Hampshire today. 

Still need to safely dispose of old or unused prescription drugs? You can find a secure drop-off location any day of the year here ➡️ https://t.co/9Q0lKUGfRs https://t.co/VVxecKmnvm"|en|D|1|4
1520456279629733888|1067748650485497862|Sat Apr 30 17:33:20 +0000 2022|"There’s no better way to celebrate #IndieBookstoreDay than with a stop to one of New Hampshire’s many local bookstores. 

Great to stop in and get some new recommendations! https://t.co/fWhqqDm8f2"|en|D|7|12
1520416628370034688|1067748650485497862|Sat Apr 30 14:55:46 +0000 2022|"Honored to help kick-off the New England School Nurses Conference in Portsmouth this morning. 

Thank you again for the work you do to keep our students safe and healthy! Our schools would not be the same without you. https://t.co/0k3st3Uc7t"|en|D|3|6
1520145901414756354|1067748650485497862|Fri Apr 29 21:00:00 +0000 2022|"Tomorrow is #DrugTakeBackDay, an opportunity to clean out your medicine cabinet, safely dispose of unused or expired medications, and prevent the potential abuse of these medications. 

Learn more⤵️
https://t.co/2i8ZiOWV77"|en|D|2|2
1520123251929845761|1067748650485497862|Fri Apr 29 19:30:00 +0000 2022|"Granite Stater James Foley lost his life as a journalist in pursuit of truth. My thoughts are with his family and loved ones, and I hope today’s news will bring a sense of justice as those responsible for his death are finally held accountable. 

https://t.co/H4V7aKtyOb"|en|D|1|4
1520096235197276160|1067748650485497862|Fri Apr 29 17:42:39 +0000 2022|"Natural disasters are costing our state more each year, and rural communities are especially vulnerable.

This bipartisan bill will cut through red tape to make it easier for New Hampshire to access FEMA aid. 

https://t.co/UEhvpJ7sbX"|en|D|3|4
1520032655827472386|1067748650485497862|Fri Apr 29 13:30:00 +0000 2022|"Too many of our veterans who suffer traumatic brain injuries while serving in uniform face barriers to care when they return.

That’s why I’m calling on @DeptVetAffairs to make important changes so our heroes can access the quality care they need.

https://t.co/XSbROcHvE1"|en|D|3|5
1519806161549242368|1067748650485497862|Thu Apr 28 22:30:00 +0000 2022|"Congrats, Sara, for being named New Hampshire’s Teacher of the Year! Teachers shape the future of our community, state, and country, and we’re grateful for your dedication to our students.

Thanks for stopping by my office today while you're in DC! https://t.co/Qobh2dsxb6"|en|D|2|15
1519782932243566592|1067748650485497862|Thu Apr 28 20:57:41 +0000 2022|"This bill will deliver critical support to Ukraine. I urge the President to sign it into law swiftly.

https://t.co/6aMvKkMXUu"|en|D|2|7
1519745482305720322|1067748650485497862|Thu Apr 28 18:28:53 +0000 2022|"New Hampshire has always been proud of our history and our natural environment, and today, we got to bring a piece of home here by planting a tree dedicated to the people of New Hampshire on the Capitol grounds.

Great to plant and dedicate this tree ahead of Arbor Day tomorrow! https://t.co/BnPgu9Jr2x"|en|D|2|13
1519425732241510400|1067748650485497862|Wed Apr 27 21:18:18 +0000 2022|This evening at sundown #YomHashoa begins, a time to honor the lives of the six million Jews who were murdered in the Holocaust and recommit to ending hatred and anti-Semitism in all its forms. #NeverAgain|en|D|6|17
1519371646796189696|1067748650485497862|Wed Apr 27 17:43:23 +0000 2022|Starting soon ⬇️ https://t.co/LC1SLae3H6|en|D|1|1
1519307881543127040|1067748650485497862|Wed Apr 27 13:30:00 +0000 2022|"As we grapple with the effects of the pandemic, we must address the ongoing mental health crisis. Recently I secured funding for ACERT, a local effort to help kids overcome trauma, and I’m committed to bringing additional mental health resources to NH.

https://t.co/SLwAcLBA2P"|en|D|2|1
1519057139402264582|1067748650485497862|Tue Apr 26 20:53:39 +0000 2022|"Today, I helped pass five overwhelmingly bipartisan bills to help our Main Street businesses thrive.

I'll keep working to make sure they have the support and resources they need. https://t.co/9jZ4gHlMiT"|en|D|7|15
1518989973139165185|1067748650485497862|Tue Apr 26 16:26:45 +0000 2022|"Restaurant week returns to Portsmouth for the first time since 2019!

Be sure to stop by your favorite place or try a new spot before the week is out, and help celebrate the resiliency of our local restaurants. 

https://t.co/KR0t4TEzvJ"|en|D|1|1
1518945491316363265|1067748650485497862|Tue Apr 26 13:30:00 +0000 2022|"Congratulations, Jennifer, for being named one of the Top Ten Public Works Leaders of the Year by the American Public Works Association. Your service to Exeter has had an invaluable impact. 

Thank you for your dedication to NH!

https://t.co/g2sM1XviQy"|en|D|2|3
1518701263348711425|1067748650485497862|Mon Apr 25 21:19:31 +0000 2022|"Glad that @DeptVetAffairs has taken this step to make it easier for veterans who were exposed to burn pits and other toxins while in uniform to receive vital care. We must ensure all veterans who have been affected are able to access the care they need.
https://t.co/065DMX8qXt"|en|D|5|7
1518670190887817216|1067748650485497862|Mon Apr 25 19:16:03 +0000 2022|"No one should have to choose between paying their heating and cooling bills or putting food on the table. 

I’m pleased to see additional funding being delivered to New Hampshire which will continue to lower energy costs for families.

https://t.co/U9pMfw8ll3"|en|D|1|1
1518636267797463042|1067748650485497862|Mon Apr 25 17:01:15 +0000 2022|"Honored to have been among the first to sign the NH Card for Ukraine before it traveled across the state, accepting signatures from Granite Staters in support of the Ukrainian people. 

The card will be on exhibit at the NH State House until May 6th ⬇️

https://t.co/ajrkJ4cQ73"|en|D|1|2
1518618052912365569|1067748650485497862|Mon Apr 25 15:48:53 +0000 2022|"Glad to have the opportunity last week to discuss ways we can strengthen care for our veterans. I’ll continue working to ensure our veterans can access the benefits and care they have earned. 

https://t.co/6lkKTbDIrJ"|en|D|2|1
1517959996990009344|1067748650485497862|Sat Apr 23 20:14:00 +0000 2022|"This contract reaffirms the vital role Granite State companies play in our national security and defense. 
 
I'll continue to support investing in domestic manufacturing right here in New Hampshire to create jobs and bolster our security.
https://t.co/nqp4YYyKzF"|en|D|1|1
1517891797376241665|1067748650485497862|Sat Apr 23 15:43:00 +0000 2022|Happy birthday, @USArmyReserve! Thank you for 114 years of service to our country. https://t.co/qZBrO31Uam|en|D|2|2
1517520601543417857|1067748650485497862|Fri Apr 22 15:08:00 +0000 2022|"New Hampshire’s way of life and economy are rooted in our environment.

In honor of #EarthDay, we must recommit to doing all we can to fight climate change and protect our natural surroundings. https://t.co/vsVSMjpvRB"|en|D|3|10
1517248044022083585|1067748650485497862|Thu Apr 21 21:04:57 +0000 2022|"Visited the solar array in Manchester today with @LCVoters NH for the first time since last year and saw what a difference a few months can make!
 
This landfill is now generating green, renewable energy thanks to leadership by @MayorJoyceCraig and partners at @manchester_nh. https://t.co/nVnqrOUekV"|en|D|4|8
1517225408634277890|1067748650485497862|Thu Apr 21 19:35:00 +0000 2022|Thank you @SenatorHassan for hosting this field hearing to discuss the critical issues facing our veterans. It's vital that we keep working together to strengthen care for those who have served, and I’m committed to ensuring our veterans can receive the support they have earned. https://t.co/wFNY6zK6Jx|en|D|6|25
1516890753095675904|1067748650485497862|Wed Apr 20 21:25:12 +0000 2022|"The new Oyster River Middle School is paving the way for a green, sustainable future. It was a pleasure to join the ribbon-cutting ceremony with local leaders and private partners and get a tour led by expert tour guides - Oyster River 5th graders! 

Thanks for the warm welcome! https://t.co/WIk2mNm8Ty"|en|D|3|5
1516843279052124161|1067748650485497862|Wed Apr 20 18:16:33 +0000 2022|"Thanks to funding from the bipartisan infrastructure law I fought to pass, work on the Route 3A/Hackett Hill project in Hooksett has been accelerated. 

Glad to meet with local and state leaders today to get an update on the progress. l'll continue to support these investments. https://t.co/V6EosZzGtD"|en|D|2|5
1516408779398656003|1067748650485497862|Tue Apr 19 13:30:01 +0000 2022|"April is #FairHousingMonth, which commemorates the anniversary of the Fair Housing Act. We know that more work is needed to ensure New Hampshire families can access safe, affordable housing. 

That's why I’ll keep fighting to invest in affordable housing for all Granite Staters."|en|D|3|4
1516171796843798529|1067748650485497862|Mon Apr 18 21:48:20 +0000 2022|Joined @NASA Administrator @SenBillNelson and @astro_ricky in Merrimack to see the work being done by Nanocomp Technologies. Investing in our space program is investing in New Hampshire's workforce and economy, and I'm committed to supporting U.S. innovation and manufacturing. https://t.co/Jxy1Kc6oew|en|D|6|22
1516116584833732611|1067748650485497862|Mon Apr 18 18:08:56 +0000 2022|"No New Hampshire family has been left untouched by the opioid crisis. And deaths are rising. We must do all we can, including passing legislation I introduced to get dangerous drugs like fentanyl out of our communities and hold traffickers accountable. 

https://t.co/2VXFFYpfqt"|en|D|3|4
1516098328194338821|1067748650485497862|Mon Apr 18 16:56:23 +0000 2022|"These federal funds will help fill critical gaps in providers' budgets caused by lost revenue and increased costs associated with the pandemic. I’ll keep fighting so that New Hampshire providers have the resources needed to keep our communities safe. 
 
https://t.co/WLhJ8Y2iAg"|en|D|3|3
1515691549312667654|1067748650485497862|Sun Apr 17 14:00:00 +0000 2022|Wishing all Granite Staters who celebrate a happy Easter! I hope today brings the opportunity to spend time with friends, family, and loved ones.|en|D|2|7
1515404662110887937|1067748650485497862|Sat Apr 16 19:00:00 +0000 2022|"Investing in clean energy is vital to support the Granite State economy, environment, and way of life. Thanks to the infrastructure law I fought to pass, NH will receive critical funds to strengthen our clean infrastructure and increase jobs.
 
https://t.co/pthF9Go3n4"|en|D|5|6
1515344263063777287|1067748650485497862|Sat Apr 16 15:00:00 +0000 2022|The children of service members serve and sacrifice alongside their parents in their own way. April is the Month of the Military Child when we honor the 2 million military children whose parents serve in uniform. We're thankful for the important role they play in our community.|en|D|5|7
1515095119363514376|1067748650485497862|Fri Apr 15 22:30:00 +0000 2022|To all those beginning the celebration of Passover tonight, may you have a healthy and safe holiday surrounded by friends and family. Chag Sameach and happy #Passover to those who are celebrating all over the world!|en|D|3|9
1515076106348548098|1067748650485497862|Fri Apr 15 21:14:27 +0000 2022|"I’m proud to stand with the people of Ukraine against Vladimir Putin. We cannot allow the atrocities committed by Russia to go unanswered. 

If supporting Ukraine means I get sanctioned by Russia, then I wear that as a badge of honor.

https://t.co/LefTQB8Ix1"|en|D|12|31
1515031287861587970|1067748650485497862|Fri Apr 15 18:16:21 +0000 2022|"New Hampshire is leading innovative ways to address mental health crises in our community. ACERT connects law enforcement and community groups to children impacted by trauma. Proud to secure funds to help this program grow.

https://t.co/lJ0sHRNVzh"|en|D|4|4
1515003558059462668|1067748650485497862|Fri Apr 15 16:26:10 +0000 2022|"🚨REMINDER: The deadline to submit a project for the 2022 Congressional Art Competition is April 22 at 5:00 pm.
 
Read more info about eligibility and submission instructions here⬇️
https://t.co/zq4MvSBs6j"|en|D|3|3
1514711429143793672|1067748650485497862|Thu Apr 14 21:05:21 +0000 2022|"Yesterday, I joined @MayorJoyceCraig to tour a new @FITNH affordable housing project funded by HOME grants. This funding comes at a critical time as our communities recover from the pandemic.
 
I’ll continue to fight to ensure all Granite Staters have access to quality housing. https://t.co/kdDwNxm2Q3"|en|D|6|10
1514668702242947072|1067748650485497862|Thu Apr 14 18:15:34 +0000 2022|".@ConservationFnd &amp; @nhdfl just completed a conservation project of 6395 acres in the Beebe River watershed.
 
NH’s way of life and economy are rooted in our natural surroundings, and I’m excited to see projects like this one protecting our environment.

https://t.co/o2ySBQ3jpn"|en|D|2|2
1514650830301020168|1067748650485497862|Thu Apr 14 17:04:33 +0000 2022|"We know that no one action can sufficiently lower our energy costs. But there are steps we can and must take to provide relief. 

That's why I’ve joined my colleagues in pushing House leadership to consider additional action to lower energy prices and help Granite Staters. https://t.co/6RJTJ8k64B"|en|D|3|5
1514593061556219909|1067748650485497862|Thu Apr 14 13:15:00 +0000 2022|"The STOCK Act passed 10 years ago, but we must do more to #BanCongressionalStockTrading. I’ve called on leadership to make much-needed reforms and bring bills to the floor and call a vote to do just that.

No one should profit from public service."|en|D|2|5
1514339487807115272|1067748650485497862|Wed Apr 13 20:27:23 +0000 2022|Developed here in NH, ACERT is a community effort between law enforcement and service providers to protect and help our kids. Federal funds I secured will help expand ACERT, and today we came together with @mht_nh_police, @YWCANH, and other partners to look to the future. https://t.co/DJ5e3iGpTm|en|D|3|5
1514316497044353033|1067748650485497862|Wed Apr 13 18:56:02 +0000 2022|"Yesterday, I visited Exeter Hospital and spoke with health care workers who have been on the frontlines throughout the pandemic. We are incredibly grateful for their service.
 
I’ll continue to fight to make sure they have the resources they need to protect our communities. https://t.co/pJ5qkbtbpe"|en|D|5|8
1514298214593306631|1067748650485497862|Wed Apr 13 17:43:23 +0000 2022|"This week I got to see the advanced manufacturing being done at Albany Engineering Composites and joined an employee town hall. 
 
I worked to secure funding to help them continue to innovate, and I’m committed to ensuring we make more of our goods right here in New Hampshire https://t.co/IaM2hiuhC7"|en|D|3|5
1514230633299591179|1067748650485497862|Wed Apr 13 13:14:50 +0000 2022|.@Cobham_AES is leading advanced manufacturing of technology that supports our national defense and security. I was happy to be at the grand opening of their new location in Exeter and remain committed to supporting innovation and manufacturing right here in New Hampshire. https://t.co/Pe7isb3Sg1|en|D|2|1
1513981889509531649|1067748650485497862|Tue Apr 12 20:46:25 +0000 2022|"When it’s #CraftBeerWeek, you find a brewery. And luckily in New Hampshire, we have some of the best. 
 
This afternoon I dropped by Czar Brewery in Exeter, which has won awards for its craft beers made from local ingredients. Thanks for the tour and for the beers! https://t.co/kQ1mSfustc"|en|D|4|8
1513934950566969359|1067748650485497862|Tue Apr 12 17:39:54 +0000 2022|"Access to high-speed internet is vital to compete in the 21st century. I was proud to secure funds to expand broadband in Sandwich, which will help connect Granite Staters &amp; businesses across the town.

https://t.co/8jsbpDZxuu"|en|D|3|8
1513596494577815560|1067748650485497862|Mon Apr 11 19:15:00 +0000 2022|"#ICYMI: Last week I helped pass legislation to replenish assistance available to small restaurants, which have faced innumerable challenges these last two years. We must ensure all our small businesses can keep their doors open.
 
https://t.co/O2dBcpv1Nw"|en|D|4|6
1513570510130528266|1067748650485497862|Mon Apr 11 17:31:45 +0000 2022|"Honored to join five members of the NH National Guard who were awarded the Purple Heart over the weekend.
 
This solemn distinction recognizes the sacrifices these men and women made while in uniform. Thank you for your service. https://t.co/wmAiJ6VtCU"|en|D|5|16
1512867947684896768|1067748650485497862|Sat Apr 09 19:00:01 +0000 2022|"Congratulations to Alison Memoli from John H. Fuller Elementary School for being named New Hampshire School Counselor of the Year. 

Your impact on the students in Conway has been invaluable, and we thank you for all that you do. 

https://t.co/aVIPDmjTe9"|en|D|4|6
1512807796538028032|1067748650485497862|Sat Apr 09 15:00:59 +0000 2022|"Preston Sharp started his own organization to deliver red carnations to veterans cemeteries. 
 
Thank you, Preston, for your work and commitment to ensuring the lives of all veterans in our state are honored.

https://t.co/sY9x54cDh2"|en|D|5|10
1512530013593165829|1067748650485497862|Fri Apr 08 20:37:11 +0000 2022|It’s great to see our community standing with Ukraine. Thank you to Andrey and everyone across New Hampshire for their continued support for the Ukrainian people. https://t.co/BMj2yKoqRP|en|D|3|7
1512513623587004420|1067748650485497862|Fri Apr 08 19:32:03 +0000 2022|".@POTUS should not revoke Title 42 without a plan to protect the health and safety of the American people. I've helped introduce a bipartisan bill to ensure the Administration presents a plan to Congress that addresses all possible impacts of this change. 
https://t.co/6m7pyT9OZN"|en|D|2|3
1512467881065332743|1067748650485497862|Fri Apr 08 16:30:17 +0000 2022|"Every freedom loving nation should take every step possible to support Ukraine and punish Putin for his murderous invasion.
 
Yesterday, I voted to revoke free trade privileges from Russia to continue to hold Putin accountable and further isolate Russia.
 
https://t.co/o64zeUSGrI"|en|D|2|4
1512205104455340042|1067748650485497862|Thu Apr 07 23:06:06 +0000 2022|"Proud to have a seat at the negotiating table as we finalize legislation to make more goods at home, lower costs, and ensure American competitiveness. I look forward to working across the aisle to seize this opportunity and deliver for New Hampshire.

https://t.co/mx1ZMa148K"|en|D|5|7
1512187285009276933|1067748650485497862|Thu Apr 07 21:55:18 +0000 2022|"Today was the last day for our @VictoryInst intern, Angel. We’re so grateful for her service to the Granite State. Thank you, Angel, for all your hard work these last few months!

Interested in working on behalf of #NH01? Apply by April 13th:
https://t.co/id4W6KHrF5 https://t.co/I8VRDGodGm"|en|D|3|8
1512155167650725893|1067748650485497862|Thu Apr 07 19:47:41 +0000 2022|"Judge Ketanji Brown Jackson has made history as the first Black woman confirmed to serve on the Supreme Court. She’s eminently qualified and has had a long and impressive legal career.
 
I congratulate her and am confident that she will uphold the Constitution. https://t.co/Hc2GCKLwQS"|en|D|4|13
1512119960495173637|1067748650485497862|Thu Apr 07 17:27:47 +0000 2022|"Small businesses are the backbone of our economy - and our restaurant, hospitality, and entertainment industries have been hit hardest these last two years.
 
That’s why I voted to provide more relief and urge the Senate to act swiftly to deliver funds to these businesses ASAP. https://t.co/cED9oXZRsJ"|en|D|9|14
1512086995580846084|1067748650485497862|Thu Apr 07 15:16:47 +0000 2022|"NEWS: The House passed bipartisan legislation requiring @potus to report evidence of war crimes and other atrocities committed by Russia in Ukraine. 

The world has been shocked by what we’ve witnessed in Ukraine, and Putin must be held accountable.

https://t.co/fK7oqNWo9l"|en|D|4|6
1512062102944452623|1067748650485497862|Thu Apr 07 13:37:52 +0000 2022|"Tax season is in full swing with this year's filing deadline just 11 days away. Unfortunately, we always see an uptick in cyber scams during this time of the year.
 
Learn more about how to spot potential threats and how to report them:
 
https://t.co/zpr4JP2hY1"|en|D|2|1
1511831916357599242|1067748650485497862|Wed Apr 06 22:23:11 +0000 2022|".@USPS is a bedrock institution that delivers for all Granite Staters. I supported this bill in the House and fought to pass these bipartisan, commonsense reforms that will preserve and strengthen this American institution. 

Pleased to see @potus signed it into law today. https://t.co/dFXNp2f1Rg"|en|D|4|7
1511816512235048970|1067748650485497862|Wed Apr 06 21:21:59 +0000 2022|"A bill I introduced with @RepMann to strengthen oversight of VA’s Community Care Network just passed out of committee. 
 
Veterans should never receive care from unqualified providers, and we're now a step closer to ensuring better care for all veterans. 
https://t.co/0AjbzKz4Hj"|en|D|4|5
1511777435230089216|1067748650485497862|Wed Apr 06 18:46:42 +0000 2022|"This week is #NPHW! Our public health professionals do critical work to support the health of our communities, especially during the past two years.
 
Thank you to all our public health officials  for their contributions to our community, state, and country. https://t.co/2ddnnT5SAJ"|en|D|1|2
1511747409239584781|1067748650485497862|Wed Apr 06 16:47:23 +0000 2022|"Today, @POTUS  announced another round of sanctions against Putin, designed to further cripple his regime. The atrocities Russia has committed in Bucha, Mariupol, and across Ukraine cannot go unanswered, and we must continue to hold Putin accountable.

https://t.co/hHLyATAaOE"|en|D|3|8
1511690191450345472|1067748650485497862|Wed Apr 06 13:00:02 +0000 2022|"It was great to visit @CranmoreMtn and see their expanding facilities! I appreciated seeing first-hand the development going on in our district that will spur economic growth and support our community.
 
 Even got in a final few runs of the season ⛷
 https://t.co/7yBQpVklnl"|en|D|2|3
1511471402674704388|1067748650485497862|Tue Apr 05 22:30:38 +0000 2022|"It was an honor to join @SenatorShaheen, @SenatorHassan, &amp; @RepAnnieKuster to meet with the NH National Guard here in Washington. 

Thank you for all you do. https://t.co/1libRYCH2S"|en|D|3|11
1511458172820758531|1067748650485497862|Tue Apr 05 21:38:04 +0000 2022|"Our service members aren’t the only ones who sacrifice for our nation, their families do too. Today, on #GoldStarSpousesDay, we recognize the bravery and sacrifices made by our Gold Star Spouses.

Thank you for your service to our country, it will not be forgotten."|en|D|2|4
1511436150631710723|1067748650485497862|Tue Apr 05 20:10:34 +0000 2022|"I'm joining a bipartisan call for Congress to work across the aisle and deliver legislation that bolsters U.S. competitiveness and strengthens manufacturing. 

This is vital for our economic and national security interests and needs bipartisan support. 

https://t.co/9dCeckEwJK"|en|D|2|4
1511420322469355524|1067748650485497862|Tue Apr 05 19:07:40 +0000 2022|"I recently had the chance to sit down with the Conway Police Department to hear from them and to better understand how we can address the needs of local law enforcement.
 
I'll continue to advocate for the resources needed to keep our communities safe. 
 
https://t.co/LLStObdW9h"|en|D|3|5
1511073477079539715|1067748650485497862|Mon Apr 04 20:09:25 +0000 2022|"April marks the beginning of Sexual Assault Awareness Month. We must stand with survivors and work together to strengthen our prevention and support programs moving forward. 
 
Those impacted by sexual violence can call 1-866-644-3574 for resources and help. https://t.co/onh9Rshl3b"|en|D|9|12
1511022540185079811|1067748650485497862|Mon Apr 04 16:47:01 +0000 2022|"Happy #NationalLibraryWeek ! Beyond books, our libraries offer invaluable resources for our entire community.
 
Thank you to our librarians and library staff for your work and contribution to our community. I remain committed to supporting our libraries this week and every week. https://t.co/5nnAYvIbDO"|en|D|7|25
1510982506060914694|1067748650485497862|Mon Apr 04 14:07:56 +0000 2022|"Last week I got to meet our 2021 Congressional Art Competition winner, Annie ! It’s always great to see the creativity and talent of our Granite State students.
 
🎨Submit your work for this year's competition by April 22nd: https://t.co/zmJbm1cMBF"|en|D|1|2
1510693616737402880|1067748650485497862|Sun Apr 03 19:00:00 +0000 2022|"Interested in working on behalf of #NH01? We’re now accepting summer internship applications for all three of my offices in Dover, Manchester, and Washington, DC.

Learn more here and submit an application by April 13th: https://t.co/id4W6KZ2wD"|en|D|7|11
1510633228389990400|1067748650485497862|Sun Apr 03 15:00:02 +0000 2022|"As public health guidelines continue to evolve, https://t.co/YeKc1OQbVx was launched to be a “one-stop shop” for all COVID resources, like masks, vaccines, tests, and more. 

Get the information you need ⬇️ https://t.co/Sijajn7osf"|en|D|2|1
1510349717665890317|1067748650485497862|Sat Apr 02 20:13:28 +0000 2022|"There was a birthday party at the American Legion in Dover today that I just couldn't miss. Paul Thiem, a WWII Army Air Corps veteran, is 104 years young!

Happy birthday, Mr. Thiem. Thank you for your service to your country and your community. https://t.co/TeKHwWjuqd"|en|D|7|36
