id|user|created_at|text|lang|label|retweet_count|favorite_count
1334518078978322434|210926192|Thu Dec 03 15:21:18 +0000 2020|"It’s an honor to continue serving as Chief Deputy Whip as well as a senior member of the Steering and Policy Committee in the 117th Congress. Thank you James E. Clyburn for entrusting me with this leadership opportunity. 

https://t.co/6yIqGRUqju"|en|D|1|9
1333887656766431233|210926192|Tue Dec 01 21:36:14 +0000 2020|On World AIDS Day, we recognize our achievements in HIV prevention, renew our commitment to stopping new HIV infections, support those affected by HIV, and remember those who have lost their lives to HIV-related diseases. https://t.co/JLQ2j7Sh12|en|D|2|1
1333843591043670023|210926192|Tue Dec 01 18:41:08 +0000 2020|"Having reliable, affordable health insurance is more important than ever during the #COVID19 pandemic.
Last year, 2 in 3 shoppers could find a plan for $10/month or less after tax credits.  See what you may qualify for at https://t.co/JnUX9IqjTH. #GetCovered https://t.co/Zz7zEPmiGC"|en|D|1|3
1333494787622785027|210926192|Mon Nov 30 19:35:07 +0000 2020|REMINDER: Medicare Open Enrollment ends on Dec. 7. Make sure to visit https://t.co/4rg0FWDCLf to compare coverage options and sign up for a plan that is the best fit for you. https://t.co/Bdd9K7fW4m|en|D|3|0
1333469569869115397|210926192|Mon Nov 30 17:54:54 +0000 2020|"The Constitution is clear: every person living in the U.S. has the right to be counted, regardless of their immigration status. 

We must ensure that power is distributed equally in our country and everyone has the representation they deserve
https://t.co/hFGz5XrCxW"|en|D|2|0
1332779550170882048|210926192|Sat Nov 28 20:13:01 +0000 2020|"Small businesses are the backbone of our country’s economy. Now, more than ever, they need our help.
Let’s all do our part and #ShopSmall on #SmallBusinessSaturday!
 
I won’t stop fighting in Congress to give small businesses the relief they deserve."|en|D|3|4
1332399355177918468|210926192|Fri Nov 27 19:02:15 +0000 2020|"Tomorrow is Small Business Saturday! This year, they need our support more than ever. When you #ShopSmall, you are helping: 
🛍 Local businesses
👨‍👩‍👧‍👦 Employees and their families 
🏙 Our community"|en|D|1|2
1332012257472077824|210926192|Thu Nov 26 17:24:04 +0000 2020|Wishing you and your family a safe and Happy Thanksgiving! On this day, we come together to give thanks. This year I am grateful for our doctors, nurses and all other frontline workers who have cared for us during this pandemic. https://t.co/okvdXYeD6n|en|D|3|11
1331762977717018625|210926192|Thu Nov 26 00:53:31 +0000 2020|"Since the outbreak of COVID-19, violence against women, particularly domestic violence, has intensified. 
On the International Day for the Elimination of Violence against Women, we must shine a light on this epidemic &amp; recommit ourselves to eliminating it.
https://t.co/21JmMsyeTn"|en|D|2|1
1331698488053215238|210926192|Wed Nov 25 20:37:15 +0000 2020|"Last week, I was back in D.C., passing legislation for the American people. Throughout the district, our communities were hosting Thanksgiving food drives &amp; more. Check out my newsletter to see the work my offices &amp; I are doing to better serve you. ⬇️
https://t.co/Ok6LaTj9eV"|en|D|1|0
1331671196757340161|210926192|Wed Nov 25 18:48:49 +0000 2020|"One of the soccer's most gifted players has passed away.
Diego Maradona’s passion and incredible skill inspired a new generation of players, bringing the game to new heights. May he Rest In Peace.
 
https://t.co/iciz6AwA3M"|en|D|1|0
1331613877042294784|210926192|Wed Nov 25 15:01:03 +0000 2020|"Traveling for the holidays?
 
✅ Wear a mask
✅ Wash your hands
✅ Stay at least 6 ft apart from others
 
Remember, the best way to avoid getting or spreading COVID-19 is by staying home. However, if you do travel, do so safely. https://t.co/LXenWMuc67"|en|D|1|1
1331306682497036290|210926192|Tue Nov 24 18:40:22 +0000 2020|"As COVID-19 cases increase across the country, it’s important to make sure you have access to affordable health care coverage for the new year.

The Affordable Care Act’s Open Enrollment is going on right now! #GetCovered before Dec. 15 at https://t.co/CyeYQNOdGu. https://t.co/c1iHVqkSk3"|en|D|1|1
1330937123478904838|210926192|Mon Nov 23 18:11:52 +0000 2020|Congratulations to @AliMayorkas for being the first Latino and immigrant nominated to serve as Secretary of Homeland Security. https://t.co/kFNuFNxGKO|en|D|4|9
1330569297584922628|210926192|Sun Nov 22 17:50:15 +0000 2020|"“If we are strong, our strength will speak for itself. If we are weak, words will be of no help.”

#OTD in 1963 John F. Kennedy was scheduled to give these remarks in Dallas. He was assassinated before he reached the destination.
https://t.co/sDWrs76kE2"|en|D|1|2
1329808765370191873|210926192|Fri Nov 20 15:28:10 +0000 2020|"🚨REMINDER🚨Anyone who doesn’t normally file a tax return can still be eligible to receive the $1200 Economic Impact Payment.
 
The deadline to register is TOMORROW, Nov. 21, at 3 p.m. EST.
Visit https://t.co/BynsC0Ci56 for more information."|en|D|2|0
1329490766922731521|210926192|Thu Nov 19 18:24:34 +0000 2020|"Millions of Americans are impacted by diabetes every year, and yet, many struggle to afford their insulin on a daily basis. 

That is why November is dedicated to raising awareness about diabetes. #DiabetesAwarenessMonth
Learn more at @CDCDiabetes https://t.co/7HHiHmUYqV"|en|D|3|4
1329193757108039686|210926192|Wed Nov 18 22:44:21 +0000 2020|👋 Wait! Before you keep scrolling…check out my Congressional Report! Learn more about the work my office and I are doing in the district and D.C. as well as important deadlines for federal resources. https://t.co/qMr1YhPDqM|en|D|2|4
1329091350843727879|210926192|Wed Nov 18 15:57:26 +0000 2020|In South Texas, ranching is a way of life. However, cattle fever ticks are a growing concern for these ranchers. Did you know these ticks will attach themselves to cattle, resulting in the destruction of the red blood cells? https://t.co/TzHcVbuahy|en|D|2|9
1328787916534009857|210926192|Tue Nov 17 19:51:41 +0000 2020|"As we approach the holiday season, we need to make sure we protect ourselves &amp; our loved ones.

• Wash your hands for at least 20 seconds
• Clean &amp; then disinfect frequently used surfaces
• Stay home if you’re sick
• Avoid touching your face

Together, we can slow the spread. https://t.co/8DDFwyayXC"|en|D|1|4
1328468186841427969|210926192|Mon Nov 16 22:41:12 +0000 2020|"Latino stories aren’t always included in our American story. Now, more than ever, it’s time to change that. We need a @LatinoMuseum in Washington D.C. 

Read more from @RosLehtinen and @KenSalazar ⬇ 
https://t.co/1kC4mvrJbL"|en|D|6|10
1328356105555243008|210926192|Mon Nov 16 15:15:49 +0000 2020|"Military families across the country and the globe make hard sacrifices. Throughout the pandemic, these sacrifices have been harder. 
  
But know this: these sacrifices have not gone – nor will they not go – unnoticed. To them, we say thank you. 
#MilitaryFamilyMonth https://t.co/Zb5p0H1qZI"|en|D|1|7
1328033046570864640|210926192|Sun Nov 15 17:52:06 +0000 2020|"Open enrollment for health insurance under the Affordable Care Act is available until Dec. 15. During this #COVID19 crisis, get covered today.

Check out https://t.co/aGNO4GfTi1 for more information. https://t.co/dxa2Vkadkv"|en|D|3|5
1327254751646453760|210926192|Fri Nov 13 14:19:26 +0000 2020|"Let’s get this straight: We had a free, fair and secure election.

The attacks against our election jeopardize our democracy. We cannot let this continue. https://t.co/P5Ow6BM5ii"|en|D|8|41
1326999117080432655|210926192|Thu Nov 12 21:23:38 +0000 2020|"Wearing a mask helps prevent your respiratory droplets from traveling to other people AND it protects you against respiratory droplets from others. 

The science is clear -- #WearAMask. Save lives. 
https://t.co/azV3lD5mPF"|en|D|9|31
1326702971854479361|210926192|Thu Nov 12 01:46:52 +0000 2020|Our nation’s veterans are some of our greatest heroes. This morning, it was an honor to celebrate the brave men &amp; women who have served our country. Thank you to the Laredo and Zapata communities for putting together two beautiful, safe events for local veterans &amp; their families. https://t.co/Naur3bkgTo|en|D|3|17
1326540792425406464|210926192|Wed Nov 11 15:02:25 +0000 2020|"Happy #VeteransDay to all who served. 
  
Thank you to every servicemember who has sworn to defend our country and the values it stands for. https://t.co/wCt98KX21h"|en|D|4|22
1326221381290299392|210926192|Tue Nov 10 17:53:11 +0000 2020|Happy birthday, @USMC! For 245 years, the Marines have answered our nation’s call of duty with honor, courage, and valor. Thank you for keeping us safe at home and abroad. https://t.co/V35FrO9Q5V|en|D|2|14
1326179166543372291|210926192|Tue Nov 10 15:05:27 +0000 2020|The Supreme Court is hearing arguments against the Affordable Care Act, and if they repeal it, millions of Americans will lose pre-existing condition protections. We can’t let it happen. #SaveTheACA https://t.co/5edti7ZMeB|en|D|19|33
1325874944497119233|210926192|Mon Nov 09 18:56:34 +0000 2020|Open Enrollment is here! If you need health coverage or want to renew, check out https://t.co/aGNO4GfTi1 and select a plan that works best for you. Get covered by the December 15 deadline. https://t.co/4C9wMOZMes|en|D|1|2
1325507424103632898|210926192|Sun Nov 08 18:36:11 +0000 2020|I am saddened to hear of the passing of Alex Trebek, the beloved longtime Jeopardy! host. He was a teacher and a friend for millions of Americans. His impact on our culture is immeasurable. https://t.co/HU44NgPRLX|en|D|2|18
1325115454738804736|210926192|Sat Nov 07 16:38:38 +0000 2020|"Congratulations to @JoeBiden and @KamalaHarris on winning this hard-fought race!

The Biden administration will restore civility, decency, and compassion into the office."|en|D|14|111
1324465955557281792|210926192|Thu Nov 05 21:37:45 +0000 2020|REMINDER: My office is still accepting Military Service Academy Nominations until Friday Nov. 6. If you are a student in #TX28 and interested in applying, please visit https://t.co/7dDuBkIMme for more information. https://t.co/91OXJRzzDU|en|D|2|4
1324426456869543938|210926192|Thu Nov 05 19:00:48 +0000 2020|"This #VeteransSmallBusinessWeek I want to recognize those that serve our country in the military then continue to contribute by starting a #VetBiz.  
 
I’m committed to supporting our veterans by working to ensure they have the resources they need to grow. https://t.co/6aoKA17ODv"|en|D|1|3
1324168296921518081|210926192|Thu Nov 05 01:54:58 +0000 2020|"We must stay vigilant. Continue practicing health guidelines:
😷Wear a face covering
↔️Physical distance 6 feet apart
🧼Wash hands often
🌡Stay home when ill https://t.co/M8BQNmDYDT"|en|D|2|2
1323721061935026176|210926192|Tue Nov 03 20:17:49 +0000 2020|"Thank you to all of our poll workers and @USPS employees for making sure every American can make their voice heard this #ElectionDay 

I am grateful for their hard work &amp; the important role they play in our democracy."|en|D|2|8
1323664064107716608|210926192|Tue Nov 03 16:31:20 +0000 2020|"Attention South Texans: Election Day is today! 

Polling places across Texas will be open until 7 PM on Tuesday, Nov. 3. As long as you are in line by 7 PM, you will be allowed to vote. 

When voting in person, make sure to bring a valid ID and follow health guidelines. https://t.co/o0UIELTEpO"|en|D|2|2
1323380369463398404|210926192|Mon Nov 02 21:44:01 +0000 2020|"Our nation’s farmers &amp; ranchers are resilient. However, they are still facing many challenges due to the pandemic. 

The @usdafsa has implemented an additional Coronavirus Food Assistance Program for agricultural producers who face market disruptions because of COVID-19. https://t.co/4w55jxC72X"|en|D|0|2
1323007624590303235|210926192|Sun Nov 01 21:02:52 +0000 2020|"Open enrollment for 2021 begins today! Visit https://t.co/aGNO4GfTi1 to research plans &amp; find one that works best for you.

I will continue to fight for every American to ensure they receive the critical medical care that they &amp; their families need to stay healthy &amp; safe. https://t.co/5RWVl3V49e"|en|D|1|1
1322558857625915394|210926192|Sat Oct 31 15:19:38 +0000 2020|"“The name is bond, James bond.” 
Sir Sean Connery was a legend on screen, giving life to the character of James Bond. The world will miss him, but his iconic work will live on. https://t.co/YdC4XsQUI5"|en|D|2|7
1322266649869897730|210926192|Fri Oct 30 19:58:30 +0000 2020|"🚨Attention Texas🚨

TODAY is the last day to #VoteEarly! 

Make a plan to ensure your voice is heard:
https://t.co/91RM6jOp4V"|en|D|2|2
1322192821193969666|210926192|Fri Oct 30 15:05:08 +0000 2020|I couldn’t leave the Rio Grande Valley yesterday without visiting the City of La Joya’s pumpkin patch, located outside city hall. The weather was way too nice to pass up on an opportunity to get into the fall spirit! https://t.co/NNqwUUA5IF|en|D|5|16
1322170304475635713|210926192|Fri Oct 30 13:35:39 +0000 2020|"Voting, like everything else this year, looks different, thanks to the coronavirus pandemic. Learn how to protect yourself while early voting or on November 3rd. 
https://t.co/I80Wu76wDw"|en|D|1|2
1321958109682765824|210926192|Thu Oct 29 23:32:28 +0000 2020|"On #NationalInternetDay, we celebrate the invention that connects us to people across the country. 

However, 20 million Americans don’t have access, leaving them unable to use online student or health services. 

Today, we must recommit ourselves to closing the digital divide."|en|D|1|5
1321927013771452416|210926192|Thu Oct 29 21:28:54 +0000 2020|Earlier, I joined @CBP, Superintendent of Bridges Juan Olaguibel, Senator Cornyn’s office, Senator “Chuy” Hinojosa, State Rep. Sergio Muñoz Jr., and mayors from surrounding cities to celebrate the northbound lane expansion at the Anzalduas International Bridge. https://t.co/Ez2xrJbIb6|en|D|0|6
1321876599340486656|210926192|Thu Oct 29 18:08:35 +0000 2020|Latinas still endure one of the widest pay gaps of any group. @HouseDemocrats already passed legislation to address this issue – the Senate must do its part to pass the #PaycheckFairnessAct! #LatinasAreEssential https://t.co/4M4Wny5UtT|en|D|1|3
1321584947774279680|210926192|Wed Oct 28 22:49:40 +0000 2020|On #NationalFirstRespondersDay, I want to recognize the heroic men and women who put their lives on the line every day to protect our community during this pandemic. Thank you to all of our first responders! https://t.co/J2xvWkijHv|en|D|0|6
1321493990416486401|210926192|Wed Oct 28 16:48:14 +0000 2020|Early voting in Texas is still underway! Make sure your voice is heard. Visit https://t.co/91RM6jOp4V to learn more about voting in Texas and make your plan to vote. https://t.co/TEtcszTQtG|en|D|2|4
1321211198663237639|210926192|Tue Oct 27 22:04:31 +0000 2020|"Hard-working families have been waiting for food assistance, small business aid, &amp; a second stimulus check.  
 
The House passed the #Heroes Act in May to crush this virus &amp; provide needed relief. 
 
Why are President Trump &amp; the Senate turning their backs on the American people?"|en|D|1|7
1320886368873177088|210926192|Tue Oct 27 00:33:45 +0000 2020|"Open enrollment for #Medicare has begun!

You will have until Dec. 7 to decide whether you need to make any changes in your coverage.
Learn more with the Medicare Plan Finder tool, which will help you find a plan that works best for you:
https://t.co/ae6jsKzRoY https://t.co/tgtXoRFyAj"|en|D|0|0
1320069229329174528|210926192|Sat Oct 24 18:26:44 +0000 2020|Congrats on the successful opening of IDEA Converse! I look forward to seeing our students learn and our community grow. https://t.co/iJHei4wZos|en|D|2|5
1319748573811085312|210926192|Fri Oct 23 21:12:34 +0000 2020|"The deadline to submit your application for a service academy nomination is just around the corner! 

For more info on how to apply, visit: https://t.co/CfLmVNPjws https://t.co/9EKD8GBl6D"|en|D|1|2
1319389825133383680|210926192|Thu Oct 22 21:27:02 +0000 2020|"In this week's newsletter, I talk about Acting DHS Secretary Wolf's announcement about extending 'non-essential' travel restrictions on the U.S.-Mexico border to Nov 21. Check it out ⬇️
 https://t.co/0qigtz1fdc"|en|D|3|2
1319002013343059971|210926192|Wed Oct 21 19:46:00 +0000 2020|"545 children. That’s 545 too many.
 
We must do everything in our power to reunite these kids with their families and ensure this does not happen again. 
https://t.co/04NmxiDtV6"|en|D|4|13
1318568461002473479|210926192|Tue Oct 20 15:03:13 +0000 2020|“Pain. Passion. Purpose.” We miss you, Mr. Chairman. https://t.co/Kcj2WhSjov|en|D|1|3
1318181205251063809|210926192|Mon Oct 19 13:24:24 +0000 2020|"As our nations grapples with the pandemic, Head Start programs throughout the country continue to support and teach our children. 

The future success of the United States is at risk if we fail to support Head Start in the next COVID-19 relief package.
https://t.co/QiNIIme55a"|en|D|3|1
1317563598781243392|210926192|Sat Oct 17 20:30:15 +0000 2020|"This past week, I visited Mexico City with the @cityoflaredo and hosted a virtual event geared towards students interested in military academies. To read more about what my office and I are doing for South Texans, read my latest newsletter!
https://t.co/DS8LViVFWQ"|en|D|2|5
1317214092189458432|210926192|Fri Oct 16 21:21:26 +0000 2020|On this #WorldFoodDay let’s thank our #FoodHeroes, including our farmers, food transporters, grocery workers and cooks, for their work in growing, nourishing and sustaining our communities during this pandemic. https://t.co/w5fluy3n8E|en|D|0|1
1317137527619411968|210926192|Fri Oct 16 16:17:12 +0000 2020|"I voted for the #CARESAct, which kept 18 million people from slipping into poverty. The aid from this package is now spent &amp; 8 million people have fallen into poverty.

The House passed the Heroes Act to provide more relief &amp; to stimulate the economy. The Senate needs to act. https://t.co/JFpNsDpPCX"|en|D|3|4
1316818314899980289|210926192|Thu Oct 15 19:08:46 +0000 2020|"On the last day of Hispanic Heritage Month, we look back on our history of resilience. 

We look around, seeing that we are more essential than ever. And we look forward, knowing there are better days for Latinos in America coming, if we are willing to fight for them. #HHM https://t.co/iswHjZduQn"|en|D|4|6
1316789071608508417|210926192|Thu Oct 15 17:12:34 +0000 2020|"Complete your Census TODAY at https://t.co/H6eE3Nar0I  

Census data is critical to helping our communities thrive. It helps us obtain the healthcare, transportation, schools, affordable housing, &amp; higher education that our families need to get a good start &amp; succeed.
#BeCounted https://t.co/BOz67ITQtD"|en|D|0|0
1316753321470894080|210926192|Thu Oct 15 14:50:30 +0000 2020|"These major changes to USPS caused problems for rural Americans, including delays in delivery of medical prescriptions, payments, &amp; job applications, &amp; impeding many to vote by mail.

We won’t allow politics to get in the way of providing a public service to the American people. https://t.co/0KtrGWMIwu"|en|D|2|1
1316478682765111297|210926192|Wed Oct 14 20:39:11 +0000 2020|"You, your family, your neighbors, and your friends have less than 48 hours to be counted in the #2020Census before the Administration shuts it down after 11:59 p.m. Hawaii time on Oct. 15.

Shape your future. Go to https://t.co/H6eE3Nar0I https://t.co/DrxyQuU7Yw"|en|D|9|7
1316454587998638080|210926192|Wed Oct 14 19:03:26 +0000 2020|"REMINDER: People who don’t normally file a tax return now have more time to sign up &amp; receive their Economic Impact Payment. Use the #IRS Non-Filers’ tool by Nov. 21: https://t.co/Irx6ZDzMfb 

Share this with your family &amp; friends so they can get the relief they need too."|en|D|1|0
1316150997178355712|210926192|Tue Oct 13 22:57:05 +0000 2020|"This a major loss for our democracy. Cutting the Census early will harm vulnerable communities across the United States by denying them federal funding and the political representation they deserve.  
 
Fill out the Census now. Before it’s too late. https://t.co/ZuhZpzonux"|en|D|4|7
1316024944803766273|210926192|Tue Oct 13 14:36:12 +0000 2020|Happy 245th birthday to the @USNavy! Thank you to all the men and women who protect our nation every day with honor and bravery. https://t.co/oWw6w75PNe|en|D|2|5
1315733885960028161|210926192|Mon Oct 12 19:19:38 +0000 2020|Happy #NationalFarmersDay! Today, I want to celebrate all the hardworking farmers and ranchers in Texas who dedicate their lives to feeding &amp; fueling our country. https://t.co/v3Mvdgkllz|en|D|1|5
1315418103417843713|210926192|Sun Oct 11 22:24:49 +0000 2020|"This issue isn’t new. Last year, I worked with the City of Laredo to propose an alternative to erecting a tent for immigration hearings. However, @DHSgov didn’t listen &amp; decided to proceed with the contract to construct the soft-sided tent facility...(1/2)
https://t.co/yxtUhg6NqO"|en|D|4|3
1315297685705043968|210926192|Sun Oct 11 14:26:19 +0000 2020|"Restrictions on nonessential travel at LPOEs along the US-MX border have hurt border communities. My proposal balances the health of the individual &amp; the health of the economy. We can work with @DHSgov &amp; local officials to safely re-open our borders.
https://t.co/zwplbHhXQr"|en|D|11|46
1315048966535483392|210926192|Sat Oct 10 21:58:00 +0000 2020|Earlier this week, I had the honor of receiving the 2020 ALFA Outstanding Commitment Award. Thank you for this recognition and I will continue to work hard in finding ways to develop and advance international trade within our communities. https://t.co/WaZb5nFQrG|en|D|3|8
1315015217479376896|210926192|Sat Oct 10 19:43:54 +0000 2020|"Did you know that, according to @MentalHealthAm, 1 in 5 US adults experience mental health issues each year?
 
It’s time to #EndTheStigma and speak up for affordable mental health care and treatment.
 
#WorldMentalHealthDay https://t.co/inQJJF6s9D"|en|D|4|2
1314991862407626753|210926192|Sat Oct 10 18:11:06 +0000 2020|"This is a major victory for border communities, the environment and wildlife, and private property rights. 
The Constitution is on our side: the Administration cannot sidestep Congress and divert funding from our military and their families to fulfill his empty campaign promise. https://t.co/gRWtIZvaZu"|en|D|13|15
1314664544837480449|210926192|Fri Oct 09 20:30:27 +0000 2020|REMINDER: If you would like to be nominated to one of our nation’s service academies, join us in 30 minutes for Military Service Academy Day! Register by contacting one of the offices in #TX28 https://t.co/EBFEbvkSxW|en|D|1|0
1314625164362031105|210926192|Fri Oct 09 17:53:58 +0000 2020|We must come together to create a plan to reopen the border to 'non-essential' travel. I look forward to working with @DHSgov, border city officials &amp; businesses in developing a strategy that focuses on our shared interest of protecting the lives &amp; livelihoods of our communities. https://t.co/7A1PMGbgkO|en|D|3|7
1314591787504336896|210926192|Fri Oct 09 15:41:20 +0000 2020|"Our USPS &amp; the Universal Postal Union make it possible to write letters to anyone in the world ✍️
 
This would not be possible without our postal workers’ hard work and dedication. 

Today we celebrate #WorldPostDay 🎉 https://t.co/CLJbJKRJfo"|en|D|5|11
1314561086830579712|210926192|Fri Oct 09 13:39:21 +0000 2020|"The pandemic has exacerbated health care challenges that plague rural communities in the United States. We must work to protect and build on the Affordable Care Act to improve access to quality care in rural areas. 
https://t.co/pgkgxCa8YV"|en|D|2|3
1314250094900895746|210926192|Thu Oct 08 17:03:34 +0000 2020|"ICYMI📬￼- Read my latest newsletter about my legislative work in Washington DC, events in Texas, and updates to the Census.
https://t.co/LJHhVR3PIq"|en|D|1|0
1313910280280309765|210926192|Wed Oct 07 18:33:16 +0000 2020|The CARES Act—which included one-time cash payments of $1,200—bolstered incomes &amp; spurred spending. W/ the updated #HeroesAct, @HouseDemocrats are continuing to put money directly into families’ pockets through additional direct payments to cushion the economic blow of COVID-19. https://t.co/wmIrvhJQT9|en|D|3|2
1313853640910745601|210926192|Wed Oct 07 14:48:12 +0000 2020|Thank you for this kind recognition from Pepe Carmona on behalf of @NarroJose. I am committed to strengthening our economic relationship with Mexico. https://t.co/ROlYskfwn3|en|D|1|5
1313612269775880194|210926192|Tue Oct 06 22:49:05 +0000 2020|This afternoon, @MayorPeteSaenz, Dr. Marte Martinez &amp; I met with @m_ebrard to discuss the USMCA, border crossings, labor issues, compliance with the 1944 Water Treaty &amp; smuggling of firearms into Mexico. We must work together on these issues for the success of our two countries. https://t.co/y05qXTsDua|en|D|3|12
1313582552050028544|210926192|Tue Oct 06 20:51:00 +0000 2020|"More than 210,000 Americans have died, over 7.5 million have been infected, and about 30 million are out of work.

We must put politics aside and come back to the negotiating table. 

The American people cannot wait much longer.
https://t.co/6pGybVy51d"|en|D|2|7
1313569283436408833|210926192|Tue Oct 06 19:58:16 +0000 2020|Thank you @JesusSeade for meeting with me, @MayorPeteSaenz, City Manager Robert Eads and Dr. Marte Martinez to discuss how we can strengthen our partnership and economic cooperation. I look forward to having you visit Washington DC soon. https://t.co/yNuCYCex7B|en|D|1|5
