id|user|created_at|text|lang|label|retweet_count|favorite_count
1406284843797860356|1067748650485497862|Sat Jun 19 16:16:48 +0000 2021|This morning I visited the Exeter Arts and Music Fest in Swasey Parkway and was honored to take part in the #Juneteenth celebration. A beautiful day for community, reflection, and action. https://t.co/3HzUxMJBAX|en|D|4|15
1405997169728004110|1067748650485497862|Fri Jun 18 21:13:42 +0000 2021|Happy 53rd birthday to @CJBUSLINES. Thanks for over half a century of service in New Hampshire's Seacoast. https://t.co/3H73uBFWjC|en|D|1|3
1405971500428107780|1067748650485497862|Fri Jun 18 19:31:42 +0000 2021|"Happy #Pride, Queen City!

Today we raised the Pride Flag at @Manchester_NH City Hall. Thank you to everyone who joined us to show their support and demonstrate that Manchester remains a truly welcoming and inclusive place. #MHTpride https://t.co/BBXLaUdDLE"|en|D|8|33
1405658034232254469|1067748650485497862|Thu Jun 17 22:46:05 +0000 2021|"Thank you to everyone who showed up tonight to prove Derry is an inclusive community where we respect our differences and everyone is welcome.

Happy #Pride! https://t.co/7bShHmFQBX"|en|D|11|55
1405596053232095237|1067748650485497862|Thu Jun 17 18:39:48 +0000 2021|"A key program to help shuttered entertainment venues has been plagued by technical challenges and delays. That's why I joined more than 200 members of Congress in a bipartisan effort calling for answers and for funds to be released. 

#SaveOurStages

https://t.co/C362FxK3MO"|en|D|1|2
1405568273467465732|1067748650485497862|Thu Jun 17 16:49:25 +0000 2021|"It is long past time to repeal the 20-year-old Authorization for the Use of Military Force in Iraq, which passed when I was a student in college and was used in a way that far exceeded the original intent of the legislation.

Read my full statement: https://t.co/vaYUw25r9T https://t.co/qd21yGnswv"|en|D|3|5
1405529290477690896|1067748650485497862|Thu Jun 17 14:14:30 +0000 2021|The National Guard and Reserve play a vital role in our communities and national defense, and this legislation will honor their service and contributions. The privilege of being laid to rest in a state veterans cemetery is one that Reservists and members of the Guard deserve. https://t.co/KkOjsJljFT|en|D|1|6
1405307995672780800|1067748650485497862|Wed Jun 16 23:35:10 +0000 2021|"I was proud to cast my vote to establish #Juneteenth as a federal holiday to recognize and commemorate the end of slavery in the United States. 

I urge all Americans to use this day to reflect on the role we can all play in creating a more perfect union for all of our people. https://t.co/UKqwvbp7vw"|en|D|5|22
1405245754755760131|1067748650485497862|Wed Jun 16 19:27:50 +0000 2021|".@TheJusticeDept announced funding to help police departments strengthen community-oriented policing, improve training, raise standards, and implement best practices.

I introduced legislation to do just that and am glad DOJ heeded my call for action. 1/2

https://t.co/Wc0UiL1cD1"|en|D|4|2
1404532658554773504|1067748650485497862|Mon Jun 14 20:14:15 +0000 2021|"Today in New Hampshire and throughout the country, we commemorate the 244th anniversary of the adoption of the Stars and Stripes. 

Happy #FlagDay! https://t.co/aUCOGejqX7"|en|D|1|7
1403877909136293888|1067748650485497862|Sun Jun 13 00:52:30 +0000 2021|"Five years ago today, 49 people were killed at #PulseNightClub. To honor their memory, Pulse will soon become a national memorial. In addition to celebrating their lives, we must also take action to enact additional protections for LGBTQ Americans.

https://t.co/GqDMJQgrwg"|en|D|4|10
1403467118537019402|1067748650485497862|Fri Jun 11 21:40:10 +0000 2021|"The Sawyer River Bridge in Hart's Location provides access to 6,500 acres of timber management land and hiking trails.

It's finally undergoing needed repairs and renovations with funds from the Great American Outdoors Act, which I was proud to co-sponsor. https://t.co/adCfyXntqi"|en|D|4|15
1403420517374173184|1067748650485497862|Fri Jun 11 18:35:00 +0000 2021|"Happy to be back with the Mt. Washington Valley Economic Council for a conversation with local small business leaders. 

I appreciated hearing directly from Valley businesses about what we can do in Washington and New Hampshire to continue to help Main Street succeed. https://t.co/ABRD51whko"|en|D|2|1
1403382586358091780|1067748650485497862|Fri Jun 11 16:04:16 +0000 2021|"Wrapping up a busy week with a trip to the Mount Washington Valley!

Started off at @StoryLandNH to tour the newly reopened @LivingShoresNH. We talked about their experiences during the pandemic, workforce needs, and what additional support NH small businesses need to thrive. https://t.co/BKe2x0fYUq"|en|D|3|8
1403053832255455238|1067748650485497862|Thu Jun 10 18:17:55 +0000 2021|"With the future of Roe in doubt and states passing restrictive abortion laws, it’s crucial that Congress acts to protect the right to choose. 

That’s why I’m co-sponsoring the Women’s Health Protection Act to safeguard access to reproductive care.

https://t.co/IGkhMtqEqV"|en|D|9|18
1403026321169600512|1067748650485497862|Thu Jun 10 16:28:36 +0000 2021|"Good luck, Addy! We're all rooting for you. #SpellingBee 

https://t.co/8phjRoJM7r"|en|D|5|12
1403012552691531780|1067748650485497862|Thu Jun 10 15:33:53 +0000 2021|"NEWS: Two bipartisan infrastructure packages have cleared the @TransportDems Committee with several critical priorities that I fought to include. 1/5

Read more⬇️and➡️https://t.co/7tSYbuiCpO https://t.co/uAPX5N4eGy"|en|D|4|6
1402633910354333713|1067748650485497862|Wed Jun 09 14:29:18 +0000 2021|"Lack of transportation should not stop rural vets from accessing VA care. That's why I joined @repdonyoung and @RepStefanik to introduce legislation to permanently authorize a vital program that provides veterans with no-cost rides.

Learn more ➡️ https://t.co/YqFVYVIYVe https://t.co/oWUvDbeANf"|en|D|4|4
1402298206520741890|1067748650485497862|Tue Jun 08 16:15:20 +0000 2021|"PFAS is one of our most pressing environmental and public health issues.

That's why I reintroduced the Clean Water Standards for PFAS Act to establish national drinking water standards for PFAS, hold polluters accountable, and help communities pay for water upgrades. 1/2 https://t.co/WfrLTJneSq"|en|D|3|14
1400558176186023942|1067748650485497862|Thu Jun 03 21:01:04 +0000 2021|"Thanks to Dave Guttadaro, owner of Tumbledown Farms and Farm to Fork, for the grand tour and sharing your experiences as a small business owner.

Dave used the Paycheck Protection Program, EIDL, and Restaurant Revitalization Fund to help support his business during the pandemic. https://t.co/rn85uZ7xbj"|en|D|2|8
1400502273030164488|1067748650485497862|Thu Jun 03 17:18:56 +0000 2021|"Thanks for the warm welcome, @makersmillnh!

I had a great tour of the future site of Carroll County's first dedicated Community Makerspace &amp; Vocation Hub. Looking forward to seeing this space serve as a hub for innovation, creativity, and creation. https://t.co/PQ6G7jSXNQ"|en|D|3|14
1400476966764138499|1067748650485497862|Thu Jun 03 15:38:23 +0000 2021|"Kicking off #603Day in Carroll County! 

First stop: New Hampshire Electric Co-op in Moultonborough. I'm touring their solar farm and new energy storage project and discussing ongoing efforts to expand broadband service in the region. https://t.co/9m6O0svbna"|en|D|3|15
1400216523634098177|1067748650485497862|Wed Jun 02 22:23:28 +0000 2021|"After over a year of isolation, social distancing, pain, and loss, #Pride Month could not have arrived at a better time to let us celebrate the importance of being together and being ourselves.

I'm proud to be serving in Congress to fight for equality for all LGBTQ+ individuals. https://t.co/T0Y82dfkjr"|en|D|17|80
1400180739774242821|1067748650485497862|Wed Jun 02 20:01:17 +0000 2021|"The #AmericanRescuePlan is helping our schools re-open safely so NH students can get back in the classroom. 

Today I visited Merrimack High School to talk about the support that is coming to New Hampshire and how we can make smart infrastructure investments in our schools. https://t.co/lSQ6R8cg9H"|en|D|2|8
1400122682423840771|1067748650485497862|Wed Jun 02 16:10:35 +0000 2021|Proud to join with Senator Shaheen to introduce this legislation. I remain committed to working to build bipartisan support for this bill so we can take what has been developed right here in New Hampshire and share it at the national level. https://t.co/mKwzPdqxv6|en|D|1|12
1399841179194302471|1067748650485497862|Tue Jun 01 21:31:59 +0000 2021|"As New Hampshire’s original craft brewery, it’s safe to say that Peter and the team at Portsmouth Brewery were ahead of the curve. 

I couldn’t pass up an opportunity to join their 30th anniversary celebration today and wish them another 30+ years of success. Cheers 🍻! https://t.co/p8y4U7b2rl"|en|D|3|18
1399502324175970304|1067748650485497862|Mon May 31 23:05:30 +0000 2021|"Finished the day at the Sweeney Post in Manchester after the #MemorialDay parade. 

As President Kennedy said of the debt we owe to those who have served: “As we express our gratitude, we must never forget that the highest appreciation is not to utter words but to live by them.” https://t.co/WzNcCp41V0"|en|D|4|15
1399472642730741761|1067748650485497862|Mon May 31 21:07:33 +0000 2021|"Honored to join the #MemorialDay ceremony at Veteran's Memorial Park in Manchester this afternoon and help dedicate a new monument to veterans of the Vietnam War.

Thank you to the organizers and community members who joined us to commemorate our fallen heroes. https://t.co/XiVUPkZw8o"|en|D|4|15
1399438630830198789|1067748650485497862|Mon May 31 18:52:24 +0000 2021|I began #MemorialDay in Rochester today to visit the Field of Honor and thank veterans and their families in attendance for their service and sacrifice. https://t.co/EOHnEfN576|en|D|5|19
1399363238610059269|1067748650485497862|Mon May 31 13:52:49 +0000 2021|"Today we honor the lives and memories of all those who gave, what Lincoln called, ""the last full measure of devotion"" for our country. On this #MemorialDay, let us reflect on the true cost of our freedom and way of life and recommit ourselves to never forget the sacrifices made. https://t.co/SuXMv9E47z"|en|D|4|8
1399136159486431235|1067748650485497862|Sun May 30 22:50:29 +0000 2021|"A little rain won’t stop us from commemorating #MemorialDay here in New Hampshire. 

I was honored to be part of the NH State Veterans Cemetery ceremony today to pay tribute to those service members who gave their lives to protect and defend our country. https://t.co/f6hPAOlVPT"|en|D|6|24
1398344685064654848|1067748650485497862|Fri May 28 18:25:27 +0000 2021|"I’m outraged by today’s vote in the U.S. Senate to block the bipartisan commission to investigate the events of January 6. (1/4)⬇️

https://t.co/DMucanoI08"|en|D|9|28
1398340951555387393|1067748650485497862|Fri May 28 18:10:37 +0000 2021|"For years the @NHFB  has done incredible work feeding Granite Staters, but they truly stepped up to meet the needs of our state during the COVID-19 pandemic.

I was glad to pitch in at their mobile food pantry in Manchester this morning and thank volunteers and staff. https://t.co/uZmT7sCbV7"|en|D|3|6
1398013209949442058|1067748650485497862|Thu May 27 20:28:17 +0000 2021|"PFAS is one of the most pressing environmental and public health issues facing our nation - impacting millions.

That's why I'm joining @RepMeijer in leading a bipartisan push to ensure funding to address PFAS is included in a final infrastructure bill.

https://t.co/tAtzw81dWh"|en|D|4|27
1397975388500942858|1067748650485497862|Thu May 27 17:58:00 +0000 2021|"Got a close-up look at this I-93 bridge rehab project with the team from R.S. Audley and @NewHampshireDOT this morning. 

As we move an infrastructure bill through Congress, this is an example of the type of project we're looking to fund to improve safety and quality of life. https://t.co/AN2vPOTHeQ"|en|D|8|21
1397650166648279041|1067748650485497862|Wed May 26 20:25:41 +0000 2021|"This is deeply disappointing news for hard working Granite Staters who have followed the rules and did what was right by working from home to keep their friends, families, and communities safe during the pandemic. 1/3

https://t.co/E6k2bChIXa"|en|D|2|4
1397292218466045953|1067748650485497862|Tue May 25 20:43:19 +0000 2021|"Today I led a briefing with the House Small Business Caucus to discuss the support available for restaurants. We must provide additional resources to our small businesses and strengthen existing programs so they meet the needs of Main Street.

Learn more➡️https://t.co/vnGA04PN0U https://t.co/AH3RaimkdT"|en|D|3|14
1397268023426310149|1067748650485497862|Tue May 25 19:07:11 +0000 2021|I appreciate the Administration’s decision to make available an additional 22,000 H-2B visas. But this step is inadequate by itself and fails to meet the needs of seasonal small businesses who cannot gear up for the summer without more visas and improvements to the program. 1/4|en|D|1|8
1397250656759582721|1067748650485497862|Tue May 25 17:58:10 +0000 2021|"It's a beautiful day to be on the WOW Rail Trail in Laconia! 

As we work to move a comprehensive infrastructure bill through Congress, I’m committed to making sure we can dedicate federal resources to expanding the network of paths and rail trails that connect our communities. https://t.co/I9zBm7Kb7c"|en|D|6|15
1397207270476423177|1067748650485497862|Tue May 25 15:05:46 +0000 2021|The rise of anti-Semitic violence and rhetoric that we've seen throughout the country is despicable and antithetical to our values. Hatred like this has no place here. It must be condemned and stopped.|en|D|5|28
1396854299548962819|1067748650485497862|Mon May 24 15:43:11 +0000 2021|"Coastal communities are dealing directly with the impacts of rising sea levels &amp; changing weather patterns. 

That's why @RepWebster and I introduced a bill creating a central hub for communities to identify and apply for resiliency and mitigation grants.

https://t.co/uNElELNKYJ"|en|D|3|12
1395854412682248192|1067748650485497862|Fri May 21 21:30:00 +0000 2021|"We had a busy week in New Hampshire and Washington. Take a look back at some of the highlights in our #TeamPappas week-in-review! 

⬇️ #NH01 https://t.co/EmDytVXHgs"|en|D|4|15
1395833059405180928|1067748650485497862|Fri May 21 20:05:09 +0000 2021|"At IUPAT District 35’s training facility in Brentwood, painters and allied trade workers are getting trained right here in New Hampshire.  

Investments in infrastructure and job training are critical to rebuilding our country, and they’re ready to get the job done. https://t.co/E45lwkEEC0"|en|D|5|21
1395766937028866056|1067748650485497862|Fri May 21 15:42:24 +0000 2021|"Stopped by @SassyBiscuitCo in Dover this morning!

They opened in the middle of the pandemic last year. Because of the American Rescue Plan, they're receiving critical assistance though the @SBAgov Restaurant Revitalization Fund. https://t.co/JWXDGWE43E"|en|D|6|24
1395535173421252611|1067748650485497862|Fri May 21 00:21:27 +0000 2021|"This ceasefire is welcome news. I urge the continuation of measured, thoughtful diplomacy to prevent any further loss of life and move towards peace and stability.
 
https://t.co/AIPcglmlND"|en|D|4|14
1395155142060646403|1067748650485497862|Wed May 19 23:11:21 +0000 2021|"JUST NOW: I joined with Republicans and Democrats in a bipartisan vote to establish a national commission to investigate the January 6 attack on the United States Capitol.

1/5 https://t.co/KuZxzf3c8o"|en|D|9|68
1395084393077780486|1067748650485497862|Wed May 19 18:30:13 +0000 2021|"The losses suffered by the residents of the State Veterans Home and their families over the last year have been tragic.

On @VetAffairsDems I worked to secure the #AmericanRescuePlan funding announced today to keep patients, families, and staff safe.

➡️  https://t.co/5A8NoxsXSW https://t.co/xzSc8fmvDT"|en|D|2|6
1394690721916104705|1067748650485497862|Tue May 18 16:25:54 +0000 2021|"🚨 NEWS ⬇️

New Hampshire is receiving $10.7 million in #AmericanRescuePlan funds to support efforts to combat the substance use disorder epidemic and increase access to mental health services.

Learn more: https://t.co/Qtu4zFMubx https://t.co/ShzMFwC8hG"|en|D|6|22
1394448006263582721|1067748650485497862|Tue May 18 00:21:26 +0000 2021|The American Rescue Plan provided much needed investment in the VA, but we must work together to ensure this funding is used to address long standing issues that have been exacerbated by this pandemic. https://t.co/cQL3BOlRNQ|en|D|8|24
1393592337603891204|1067748650485497862|Sat May 15 15:41:19 +0000 2021|"On #ArmedForcesDay we honor the members of the U.S. military and recognize their service and sacrifice. 

Thank you for all you do to keep our country safe. https://t.co/rxpmhFAJzn"|en|D|4|19
1392561289138933762|1067748650485497862|Wed May 12 19:24:18 +0000 2021|"Smart infrastructure connects Americans with the people and places most important to them. 

Legislation I introduced would transform America's bike and pedestrian paths to support recreation, safeguard our environment, and strengthen local economies.

➡️  https://t.co/aEYCkeg2f1 https://t.co/QWyDr3fMmC"|en|D|5|25
1392532318481522695|1067748650485497862|Wed May 12 17:29:11 +0000 2021|"🚨 The @FCC's new Emergency Broadband Benefit begins today.

This program will help eligible Granite Staters get connected to jobs, healthcare services, education, and more. 

Start here ⬇️

https://t.co/Yl1KZ99sIO"|en|D|3|1
1392241993644978176|1067748650485497862|Tue May 11 22:15:32 +0000 2021|"Internet access is critical for small businesses to compete, for students to thrive, and for people to stay connected.

This morning I joined Acting @FCC Chairwoman @JRosenworcelFCC and @RepAnnieKuster to highlight the new Emergency Broadband Benefit launching tomorrow. https://t.co/zuqk54zU2Z"|en|D|10|19
1392127435349581829|1067748650485497862|Tue May 11 14:40:19 +0000 2021|"Today at 11:00 AM I'm joining @RepAnnieKuster and Acting @FCC Chairwoman @JRosenworcelFCC for a free broadband assistance webinar.

Learn about @FCC's program to help families and households struggling to afford internet service during COVID-19.

RSVP➡️https://t.co/muwSLZtTj0 https://t.co/la23QzmGC6"|en|D|3|3
1391844679163994114|1067748650485497862|Mon May 10 19:56:45 +0000 2021|"Today I joined @DEANewEngland,
 @AMRManchesterNH, @ManchesterFD, and @MakinitHappenGM to discuss legislation I introduced - that was just signed into law - to keep communities safe from fentanyl analogues and hold international traffickers accountable.

➡️ https://t.co/v5WWtLpxXU https://t.co/4dCoSs4Afo"|en|D|7|16
1391423329710575616|1067748650485497862|Sun May 09 16:02:27 +0000 2021|"Wishing a happy #MothersDay to all of the mothers and mother figures throughout New Hampshire today. 

Thank you for all you do. https://t.co/qu18F1z2u5"|en|D|3|13
1391074286484566023|1067748650485497862|Sat May 08 16:55:29 +0000 2021|"Another busy week is in the books here in #NH01. 

Take a look back at some of the highlights in our #TeamPappas Week-in-Review ⬇️ https://t.co/2pB6LeAwzK"|en|D|6|13
1390722256914030595|1067748650485497862|Fri May 07 17:36:39 +0000 2021|"New Hampshire will be receiving $1 million from the #AmericanRescuePlan to support COVID-19 vaccine education and outreach efforts.

This will help increase vaccine confidence and address barriers to vaccination in underserved and vulnerable communities.

https://t.co/xQatxEx5bW"|en|D|10|16
1390386394447634434|1067748650485497862|Thu May 06 19:22:03 +0000 2021|"PPP is out of money well ahead of the deadline and has closed applications to most borrowers. 

It should not have gotten to this point, and that’s why I called for action on this two weeks ago to ensure everyone who is eligible can get a loan. 

1/3

https://t.co/8ySdtZpEUs"|en|D|3|1
1390055380651282434|1067748650485497862|Wed May 05 21:26:43 +0000 2021|Increasing our clean energy is essential in supporting our region’s economy, environment, and way of life. That is why I was so glad to join @SunriseLabsInc in celebrating their new solar system and their continued efforts to make our communities a better place to work and live. https://t.co/NDfwjyQoCV|en|D|4|20
1389695110024073217|1067748650485497862|Tue May 04 21:35:08 +0000 2021|On today’s #TeacherAppreciationDay I wanted to take a moment to thank the incredible educators across New Hampshire who have gone above and beyond to support and educate our children throughout this pandemic. I hope you will all join me by thanking a special teacher in your life. https://t.co/u2eITVTdHq|en|D|7|27
1389670832461516804|1067748650485497862|Tue May 04 19:58:39 +0000 2021|"BREAKING: President Biden just signed legislation I introduced into law that will extend the emergency scheduling of fentanyl analogues as Schedule 1. 

This will help bring international traffickers to justice and ensure that these deadly substances stay out of our communities. https://t.co/cQDuyTl61n"|en|D|20|43
1389281180982382595|1067748650485497862|Mon May 03 18:10:19 +0000 2021|"✂️  This morning I got to help cut the ribbon on the new @BGCofManchester clubhouse annex. 

Our community is stronger and our kids and families are better off because of the Boys and Girls Club. This expansion will allow more great futures to start here in Manchester. https://t.co/tbNbXZAF76"|en|D|2|15
1387841470024065031|1067748650485497862|Thu Apr 29 18:49:25 +0000 2021|"BREAKING: The Senate just passed my legislation extending the scheduling of all fentanyl analogues as Schedule 1. 

This will prevent more of these deadly drugs from flooding our communities and will help bring traffickers to justice.

https://t.co/EVqpVcZHFd"|en|D|8|15
1387783227226611712|1067748650485497862|Thu Apr 29 14:57:59 +0000 2021|"Yesterday I joined @SenatorShaheen, @SenatorHassan, and @RepAnnieKuster to announce a federal grant to help protect the Merrimack River watershed, revitalize habitats for vulnerable fish and wildlife species, and boost climate resilience. 

Read more ⬇️

https://t.co/3dRb3bi1re"|en|D|5|14
1387564395245486081|1067748650485497862|Thu Apr 29 00:28:26 +0000 2021|"If you've received the vaccine, called Employment Security, or visited a mobile food pantry, the @NHNationalGuard has been there to help.

I was honored to be joined by New Hampshire National Guard members as virtual guests at @POTUS's  address to Congress tonight. https://t.co/BXW2wtT9xL"|en|D|4|22
1387473321193771009|1067748650485497862|Wed Apr 28 18:26:32 +0000 2021|"It's an honor to welcome members of the @NHNationalGuard as my virtual guests to President Biden's address to Congress tonight. 

We're all indebted to the members of our National Guard who have gone above and beyond on the front lines of COVID-19 keeping our communities safe. https://t.co/2sgNRrx5tH"|en|D|2|8
1386728271837028362|1067748650485497862|Mon Apr 26 17:05:58 +0000 2021|"This weekend I participated in National Prescription Drug #TakeBackDay with @DEANEWENGLAND, @MakinitHappenGM, @mht_nh_police, and other community partners.

If you missed the event, you can find locations to drop off unused prescription drugs here: https://t.co/REwjuzxySO https://t.co/N8tDVW4JmL"|en|D|4|9
1385977369975042048|1067748650485497862|Sat Apr 24 15:22:09 +0000 2021|"It's a beautiful day to #CelebrateTrails! 

At Stark Park in Manchester this morning to help cut the ribbon on some new and refurbished community trails. https://t.co/qpGqKZGUnP"|en|D|2|15
1385704544412258308|1067748650485497862|Fri Apr 23 21:18:03 +0000 2021|"Honored to welcome @VP Kamala Harris back to the Granite State!

It's time we invest in American infrastructure and the American people. I was proud to be at IBEW 490 today to talk about the #AmericanJobsPlan and getting our workers the training they need to rebuild this country. https://t.co/RRzQidnfF4"|en|D|11|45
1385342459308351488|1067748650485497862|Thu Apr 22 21:19:15 +0000 2021|It is our collective responsibility to support our veterans, especially those who may be struggling with depression or PTSD from their time in service. https://t.co/T0ToMfBZTe|en|D|1|3
1385276580084264961|1067748650485497862|Thu Apr 22 16:57:28 +0000 2021|"We're a few minutes away from starting our information session about FEMA's new COVID-19 funeral assistance program. 

It starts at 1:00 PM and you can still sign up here: https://t.co/AqdUkuDdt8 https://t.co/hTK8H2aGBZ"|en|D|1|2
1385231930707398665|1067748650485497862|Thu Apr 22 14:00:03 +0000 2021|"From our Seacoast to the White Mountains and everywhere in between, New Hampshire's way of life is rooted in our natural environment.  

On #EarthDay we must recommit to protecting the only home we have and ensure that these natural treasures are enjoyed by generations to come. https://t.co/RFclvtCv8X"|en|D|8|22
1384995747607846915|1067748650485497862|Wed Apr 21 22:21:32 +0000 2021|"We're live! @RepAnnieKuster and I are hosting a telephone town hall with state and federal officials to discuss the response to COVID-19 and answer your questions.

You can join by phone at 866-478-3366 or online at https://t.co/xz29ujMerm. https://t.co/IedfBksbEL"|en|D|1|1
1384967851619008512|1067748650485497862|Wed Apr 21 20:30:41 +0000 2021|"The House just unanimously passed my bipartisan legislation extending the scheduling of all fentanyl analogues as Schedule 1. 

This will prevent our communities from being flooded with synthetic opioids and ensures international traffickers are held accountable without delay. https://t.co/Lt3RACjXqn"|en|D|6|7
