id|user|created_at|text|lang|label|retweet_count|favorite_count
988453649365045250|210926192|Mon Apr 23 16:24:49 +0000 2018|Today, I joined @DHSgov @ICEgov @LaredoChamber and local business owners to learn about the IMAGE program, Employment Eligibility forms and procedures, how to properly file I-9 forms and how to conduct a self-audit.|en|D|1|0
988233557817593861|210926192|Mon Apr 23 01:50:15 +0000 2018|REMINDER: CALLING ON ALL BUSINESS AND RESTAURANT OWNERS IN LAREDO! Join us for DHS IMAGE and I-9 Workshops April 23-25. Register here: https://t.co/mjXjU0esuG|en|D|1|2
987477142287077376|210926192|Fri Apr 20 23:44:31 +0000 2018|Today, I spoke at the @lccpalominos Cybersecurity Conference about implementing effective cyber defense practices throughout the community and the creation of the first-of-its-kind Cybersecurity Institute. https://t.co/LjnexJwE1d|en|D|1|7
987367008911142912|210926192|Fri Apr 20 16:26:53 +0000 2018|CALLING ON ALL BUSINESS AND RESTAURANT OWNERS IN LAREDO! Join us for DHS IMAGE and I-9 Workshops next week April 23-25. Register here: https://t.co/TEfR6nbOwu|en|D|0|2
987032928407441408|210926192|Thu Apr 19 18:19:22 +0000 2018|Yesterday, I met with @LatAmGoesGlobal High-Level Working Group on Inter-American Relations and Bipartisanship to discuss a broad set of recommendations with their working group of former policymakers, academics, and business leaders regarding inter-American relations. https://t.co/xIL9UCUIM8|en|D|2|5
987005352460898304|210926192|Thu Apr 19 16:29:48 +0000 2018|Yesterday, I had a great discussion with @gregfenves, President of @UTAustin, and Ellyn Perrone, Senior Associate Vice President for Research &amp; Federal Relations. We discussed appropriations, including funding for research and student financial aid. https://t.co/CQaHeTfQRw|en|D|2|8
986968820484132865|210926192|Thu Apr 19 14:04:38 +0000 2018|Yesterday, I met with @GDMS Chairman &amp; CEO Phebe Novakovic and held a productive discussion regarding border technology and combat vehicles. https://t.co/lSR09mvqgy|en|D|1|3
986944746781278208|210926192|Thu Apr 19 12:28:58 +0000 2018|Yesterday I met with a group from @ToyotaTexas from San Antonio, Texas. We discussed NAFTA, steel and aluminum tariffs, and recent activities at our San Antonio plant. https://t.co/XuWwdpjbD9|en|D|1|6
986730415816937472|210926192|Wed Apr 18 22:17:18 +0000 2018|Today, I met with the President of the National Association of Immigration Judges (NAIJ), Judge A. Ashley Tabaddor and Executive Vice President, Judge Amiena Khan, to discuss the NAIJ's budget and hiring processes. https://t.co/VShTVX3pkl|en|D|1|4
986726139602391046|210926192|Wed Apr 18 22:00:18 +0000 2018|Today, I attended a breakfast that was held in honor of the Republic of Azerbaijan with Rabbi Marc Schneier, Pastor Bob Roberts, Jr., and Bishop Robert Stearns, and other members of Congress. https://t.co/r7SFBIwqTk|en|D|8|21
986696433960185857|210926192|Wed Apr 18 20:02:16 +0000 2018|It was an honor meeting w/ the Pres. of the Congress of Guatemala, @AlvaroArzuE, Interior Minister Enrique Antonio Degenhart Asturias, Ambassador of Guatemala @MemeEspina and Minister Counselor, Jose Lambour to discuss strengthening the partnership b/w the U.S. and Guatemala. https://t.co/aHT3v80ZUy|en|D|0|2
986591978753323008|210926192|Wed Apr 18 13:07:12 +0000 2018|Yesterday I sat down with @JoaquinCastrotx, San Antonio Mayor, @Ron_Nirenberg, SAWS CEO Robert Puente, Deputy Assistant Secretary Mark Correll and @district10perry to help facilitate a solution to the wastewater replacement project on Lackland Airforce Base. https://t.co/zOOWO8DUnu|en|D|8|16
986585181774602240|210926192|Wed Apr 18 12:40:11 +0000 2018|Yesterday I held a productive meeting with representatives from @CocaColaSWB to discuss important issues related to the beverage industry as well as legislative priorities for the upcoming year. https://t.co/RvtvbOM7LS|en|D|1|3
986405191980322818|210926192|Wed Apr 18 00:44:58 +0000 2018|Barbara Bush was a shining example of the tremendous good former First Ladies can accomplish. Her commitment to our country will continue to impact the lives of many through her legacy. My deepest condolences to the entire Bush family. I’ll continue to keep you in my prayers.|en|D|3|29
986372753019342848|210926192|Tue Apr 17 22:36:04 +0000 2018|Today, I met with representatives of @SisterCitiesInt to discuss the many benefits of foreign operations initiatives, diplomatic and government activities in and around @FWSCI, and international relationships worldwide. https://t.co/QNRAiR7UtL|en|D|4|3
986367737248321536|210926192|Tue Apr 17 22:16:09 +0000 2018|Today, I discussed water issues in Texas with the Mayor of San Antonio, @Ron_Nirenberg. https://t.co/84wzFQtFCW|en|D|3|39
986359464554041344|210926192|Tue Apr 17 21:43:16 +0000 2018|Today, I spoke with @ADMZukunft of the @USCG during a House Appropriations Subcommittee on Homeland Security hearing about ways that the Coast Guard can better protect our community from drugs and the current opioid epidemic. https://t.co/e3vyjpIuRy|en|D|0|4
985862685827960832|210926192|Mon Apr 16 12:49:15 +0000 2018|ENROLL NOW! I encourage military spouses and children to enroll in ThanksUSA’s Scholarship Program, that will help provide families with educational and economic benefits that reflect the gratitude of all Americans. READ MORE HERE: https://t.co/MDt7zd5c7t|en|D|3|2
985246545401573376|210926192|Sat Apr 14 20:00:56 +0000 2018|Today, I released the following statement regarding the U.S. airstrikes in Syria https://t.co/qWUipgQRpV|en|D|3|3
984882784744374273|210926192|Fri Apr 13 19:55:28 +0000 2018|I’m sadden to hear of the passing of Atascosa County Commissioner Freddie Ogden. Freddie was an outstanding man who dedicated his life to his family and his community. My thoughts and prayers go out to his family and the entire community during this difficult time.|en|D|2|0
984879520225341442|210926192|Fri Apr 13 19:42:30 +0000 2018|Yesterday, I spoke with @CBP_McAleenan, ERO EAD Matthew Albence, and HSI EAD Derek Benner during a @HouseAppropsGOP subcommittee hearing on the department’s budget request for FY19. https://t.co/zUA3nQoPjP|en|D|1|2
984770067337498627|210926192|Fri Apr 13 12:27:34 +0000 2018|Wishing a warm welcome to Congressman Lamb of Pennsylvania @ConorLambPA. Congratulations and I look forward to serving alongside you in the House of Representatives.|en|D|1|6
984546730560622593|210926192|Thu Apr 12 21:40:07 +0000 2018|It was a pleasure attending the #2018CHLIGala last night. Congratulations to @TheCHLI Int’l Leadership Award recipient @RosLehtinen. We’ll continue promoting Latino leadership &amp; empowering oppressed communities in our nation. https://t.co/3bFgXFTyZD|en|D|8|7
984520596901040134|210926192|Thu Apr 12 19:56:16 +0000 2018|Yesterday I met with @UHouston Leland Fellows to discuss important issues to Texas as well as their experiences as interns in congressional offices. https://t.co/suFGuKsYL3|en|D|1|2
984514675462287361|210926192|Thu Apr 12 19:32:44 +0000 2018|I held a productive meeting yesterday with the new BP Gulf of Mexico President, Starlee Sykes, to discuss the importance of responsible oil and gas development. L/R: Henry Cuellar, Starless Sykes, Suzanne Swink, Jack Gerard, Darrell Pope. https://t.co/mKLHkQ7zr3|en|D|4|4
984510599831937024|210926192|Thu Apr 12 19:16:32 +0000 2018|I had the honor of meeting with Lieutenant General Charles D. Luckey with the National Guard Reserve yesterday to discuss issues pertaining to border security. https://t.co/T00ANnNkoI|en|D|0|0
984506391749582848|210926192|Thu Apr 12 18:59:49 +0000 2018|Yesterday I had the honor of meeting with the German Ambassador to the U.S. @AmbWittig to discuss transatlantic relations and trade between Germany and the US. #trade https://t.co/ELHZowMsXf|en|D|5|10
984503581138083840|210926192|Thu Apr 12 18:48:39 +0000 2018|Yesterday I met with the President of National Tank Carriers to discuss streamlining regulations for the trucking industry. L/R: Rep. Cuellar, Pres. of Mullen Consulting, LLC Jim Mullen; BC Consulting, LLC Founder Britton Clarke; and Pres. of National Tank Carriers Daniel Furth. https://t.co/t3O0W46xV3|en|D|1|3
984461521345540099|210926192|Thu Apr 12 16:01:31 +0000 2018|Yesterday, I had the opportunity to question @DHSgov Secretary K. Nielsen @SecNielsen regarding Homeland Security operations, national security priorities, and the department’s FY19 Budget. https://t.co/ZScdrtCZtG|en|D|1|5
984454669396267008|210926192|Thu Apr 12 15:34:18 +0000 2018|Yesterday morning, I welcomed a group of students and teachers from United Day School in Laredo on their annual visit to the U.S. Capital to learn about Congress. https://t.co/LEtyHoljoE|en|D|0|5
984437682943266816|210926192|Thu Apr 12 14:26:48 +0000 2018|Yesterday, I addressed the National Shooting Sports Foundation @NSSF at their annual Congressional Fly-In Breakfast to discuss issues affecting the industry, including #FixNICS Act, a bipartisan piece of legislation I introduced in Congress. https://t.co/dd1JJItGKc|en|D|2|6
984431933458350081|210926192|Thu Apr 12 14:03:57 +0000 2018|Thank you @EmilyBaucum from @News4SA &amp; @KABBFox29 for shadowing me today for FOX New’s “Day in the life of a Member of Congress,” to show the American people a clearer concept of how my daily constituent meetings in DC impact my district.  #TX28 https://t.co/5ahx5mv9Zd|en|D|1|6
983797269718806528|210926192|Tue Apr 10 20:02:01 +0000 2018|Right now, you can still apply to renew your DACA. If you meet the requirements to apply for DACA renewal, you should apply → https://t.co/QWu1RA2DGa https://t.co/qikf7uV12x|en|D|1|0
983489674306924544|210926192|Mon Apr 09 23:39:45 +0000 2018|The non-partisan @USCBO just said the US deficit will increase during the next couple of yrs due to tax cuts Repubs approved in Dec. This is not the time to be receiving this type of news. Instead of increasing our deficit, Repubs should find a way to work with us and reduce it.|en|D|3|11
981903107809570816|210926192|Thu Apr 05 14:35:18 +0000 2018|Today, I released the following statement regarding the passing of Judge Marcel C. Notzon. https://t.co/A3Wbi1eNjE|en|D|2|1
981523985581133824|210926192|Wed Apr 04 13:28:48 +0000 2018|Today, my office will host an informative video conference from Washington D.C. regarding the Omnibus Appropriations Act of 2018. Please join us at one of the locations listed below! https://t.co/0ets3a5Q2K|en|D|2|3
981291982101340160|210926192|Tue Apr 03 22:06:54 +0000 2018|JOIN US! On Wednesday, April 4th, I invite you to join a video conference about the Omnibus Approps Act of 2018 to discuss essential funding for transportation, infrastructure, health care, law enforcement, and education which will greatly benefit TX28. https://t.co/KJD4ysItTH|en|D|1|1
980488241081147393|210926192|Sun Apr 01 16:53:07 +0000 2018|Wishing everyone a Happy Easter! https://t.co/oabb8LHhQj|en|D|1|12
978715897144791040|210926192|Tue Mar 27 19:30:28 +0000 2018|REMINDER: JOIN US! TODAY my office will be hosting a military service academy informational session in Laredo for high school students who are interested in applying to one of our nation's five prestigious service academies https://t.co/eFn4UQEdWw|en|D|4|3
978392607872180224|210926192|Mon Mar 26 22:05:50 +0000 2018|REMINDER: JOIN US! TODAY my office will be hosting a Military Service Academy informational session in Mission for high school students who are interested in applying to one of our nation's five prestigious service academies. https://t.co/w8I2FHSx6Q|en|D|0|0
978275374940422144|210926192|Mon Mar 26 14:19:59 +0000 2018|REMINDER: JOIN US! This week my office will be hosting military service academy informational sessions in Mission and Laredo for high school students who are interested in applying to one of our nation's five prestigious service academies https://t.co/YvDxIZaWwb|en|D|2|3
976950962781908992|210926192|Thu Mar 22 22:37:15 +0000 2018|Yesterday I discussed the ongoing farm bill negotiations with members of the Southwest Council of Agribusiness in Washington. https://t.co/1LXVx1wknh|en|D|1|5
976912602923225088|210926192|Thu Mar 22 20:04:49 +0000 2018|Yesterday, I met with @TXAgLandTrust CEO Blair Fitzsimmons and COO James Oliver to discuss agricultural land easement legislation in the farm bill. https://t.co/LN7MITtyDI|en|D|1|5
976857405081489410|210926192|Thu Mar 22 16:25:29 +0000 2018|Today, I had the pleasure of speaking to members on the @TexasFarmBureau during their annual delegation about trade, regulatory reform, immigration reform, cattle fever tick, and more. https://t.co/knnfBIMVWu|en|D|3|1
976583002837876736|210926192|Wed Mar 21 22:15:06 +0000 2018|Sat down with @USACEHQ of the Fort Worth District, COL Calvin C. Hudson II, Elston Eckhardt, Eric Verwers, and Danielle Schroeder to get an update on current priorities in the Fort Worth District. https://t.co/TdfiHqenmN|en|D|0|2
976580767315845120|210926192|Wed Mar 21 22:06:13 +0000 2018|In Washington today, I had a productive conversation with the @TAHCH regarding current issues with home care and hospice providers in Texas. https://t.co/PMItJImvXH|en|D|1|3
976565547734327296|210926192|Wed Mar 21 21:05:44 +0000 2018|Yesterday, I met with Jon Gary Herrera and Leroy Alloway of VIA Metropolitan Transit @VIA_Transit. We discussed funding transit programs for the FY18 Omnibus Appropriations Bill. https://t.co/VfxrYZ3wVl|en|D|2|7
976561337450074112|210926192|Wed Mar 21 20:49:01 +0000 2018|Yesterday I met with @TexasFarmBureau (TFB) members to discuss pressing agricultural issues. https://t.co/KWBhwewwbQ|en|D|1|5
976533175131308033|210926192|Wed Mar 21 18:57:06 +0000 2018|Yesterday I had a productive meeting with members of the I-69 delegation and Texas Transportation Commissioner, Jeff Austin III, to discuss major infrastructure initiatives in Texas. https://t.co/3Fs8n7D9AL|en|D|0|5
976512937304231936|210926192|Wed Mar 21 17:36:41 +0000 2018|Yesterday I met with Ivan Zapien and Kyle Simpson of Hogan Lovells Law Firm to discuss energy issues. From left to right: Congressman Henry Cuellar, Kyle Simpson. And Ivan Zapien. https://t.co/7SikIpqXc0|en|D|3|1
976494937205346304|210926192|Wed Mar 21 16:25:10 +0000 2018|Yesterday I hosted a meeting of @TexasTech officials and colleagues of mine from the Texas Delegation to discuss the university’s systems and various programs. https://t.co/7ehA4PS02q|en|D|1|6
976490851911188480|210926192|Wed Mar 21 16:08:56 +0000 2018|According to data compiled by @BGOV, U.S. weekly crude imports fall 6.7% to 7.08M b/d: EIA. See attached image for more details. https://t.co/MJcPYRKXgf|en|D|1|2
976475693654700033|210926192|Wed Mar 21 15:08:42 +0000 2018|Calling on all veterans to take advantage of the Veteran Affairs’ Mobile Medical Unit to be in Roma, TX today Wednesday, March 21 at the Veterans of Foreign War (VFW) parking lot, Post 9175, located at 1708 N Flores St in Roma, from 9 a.m. to 4:30 p.m. https://t.co/t34PlMFd3R|en|D|4|4
976459219355488256|210926192|Wed Mar 21 14:03:14 +0000 2018|Encouraged to see that the Administration has dropped a demand that all vehicles made in Canada and Mexico for export to the U.S. contain at least 50% U.S. content. This is a step in the right direction. #NAFTA #trade Read more here: https://t.co/l0rWJsHa22|en|D|2|3
976186342903373824|210926192|Tue Mar 20 19:58:55 +0000 2018|Save Local Business Act should be in the 2018 omni to provide clarity to small businesses on #jointemployer. #smallbiz should know the rules!|en|D|11|16
976175375914033152|210926192|Tue Mar 20 19:15:20 +0000 2018|Thank you @USChamber for awarding me with the 2017 Spirit of Enterprise Award. I will continue to support pro-job, pro-growth policies at the federal level because I know that support for business means greater economic prosperity for our country. #probiz #smallbiz https://t.co/fExSeMAzVZ|en|D|3|11
976109365244694528|210926192|Tue Mar 20 14:53:02 +0000 2018|The bombings in Austin and the San Antonio area have been nothing short of shocking and unsettling. Praying for the families and community members who have been affected by these terrible attacks. These tragedies must be stopped. #AustinBombings|en|D|6|11
976101218346065921|210926192|Tue Mar 20 14:20:40 +0000 2018|Congratulations to Kevin McAleenan on his confirmation as Commissioner of Customs and Border Patrol @CBP. I look forward to working with you to continue securing our borders, increasing trade, and facilitating economic growth.|en|D|1|4
975862035446673413|210926192|Mon Mar 19 22:30:14 +0000 2018|"The federal debt has hit $21 trillion under the Trump administration.
When our country is in this precarious state, eliminating the deficit and reducing the debt should be a national priority achieved in a bipartisan manner
U.S. Treasury Dept data: https://t.co/1YhNlDOJQG"|en|D|4|8
975787888343441409|210926192|Mon Mar 19 17:35:36 +0000 2018|William “Billy” Leo, former Mayor of La Joya, was a great Texan who leaves behind a legacy of tireless labor in his efforts to make our state a better place. He will be missed, but his influence will endure. My thoughts and prayers go out to his family and the entire community.|en|D|3|3
974664269672407040|210926192|Fri Mar 16 15:10:44 +0000 2018|Saddened to hear of the passing of Congresswoman Louise Slaughter @louiseslaughter. Her work in Congress will not be forgotten, and I thank her for her years of service. My thoughts and prayers go out to her family and friends during this difficult time.|en|D|4|13
974378384129183746|210926192|Thu Mar 15 20:14:44 +0000 2018|Today I met with @TexasDSHS Commissioner, John Hellerstedt, to discuss opioids prevention funding at CDC, preparedness funding, and general support for CDC and Texas state health departments. https://t.co/11HsEz0tfk|en|D|2|6
974352985131233281|210926192|Thu Mar 15 18:33:48 +0000 2018|CHCs are an integral part of providing essential healthcare to families in my district. Today, I spoke with @GCHCTexas CEO Elmo Lopez and Board Member Juan Sanchez to discuss the Community Health Center and Primary Care Workforce Expansion Act of 2017. https://t.co/vWDwcjMb5f|en|D|1|1
974044203025084416|210926192|Wed Mar 14 22:06:49 +0000 2018|Today I had the pleasure of meeting with the Ambassador of Guatemala, @MemeEspina, to discuss US aid and other priorities for the country of Guatemala. https://t.co/OHTAe8CWCL|en|D|1|4
974040649388429312|210926192|Wed Mar 14 21:52:42 +0000 2018|Today I met with the @NAAhq to discuss infrastructure, cyber security, and reauthorizing the National Flood Insurance Program. https://t.co/Yq6N91SuPK|en|D|5|12
974028295028297728|210926192|Wed Mar 14 21:03:36 +0000 2018|Today, I had a productive meeting with @TXStateUnivSyst Chancellor and Presidents to discuss exciting work being done at TSUS Institutions and key priorities for 2018. https://t.co/pLEQKbxn8s|en|D|1|6
973642402312474624|210926192|Tue Mar 13 19:30:12 +0000 2018|Striking words from President Reagan: “Rather than talking about putting up a fence, why don’t we work out some recognition of our mutual problems?” #WallsDontWork|en|D|7|17
973639738690240514|210926192|Tue Mar 13 19:19:37 +0000 2018|"Key points about Trump’s wall?
-It’s ineffective
-It’s a waste of money
#WallsDontWork"|en|D|6|7
973636201512079360|210926192|Tue Mar 13 19:05:34 +0000 2018|60% of Americans oppose making President Trump’s misguided dream of a border wall a reality. Congress must stand strong. #WallsDontWork https://t.co/Mq48ANGO69|en|D|1|5
973634848119279622|210926192|Tue Mar 13 19:00:11 +0000 2018|As @realDonaldTrump tours his wall prototypes today, it’s important to remember that #WallsDontWork.|en|D|2|10
972226941788049410|210926192|Fri Mar 09 21:45:40 +0000 2018|Today, @RepFilemonVela, @RepNewhouse, @RepGonzalez, @RepEBJ, @RepKevinCramer, @RepTerriSewell and I sent a bipartisan letter to President Trump urging that he work to update and modernize – not withdraw the U.S. from - #NAFTA. Read more here: https://t.co/PKqF6XzinA|en|D|3|6
971867921126514694|210926192|Thu Mar 08 21:59:03 +0000 2018|TY to all the Members that came out in a bipartisan celebration of Laredo week! It was a perfect way to end a week full of productive meetings with the @CityofLaredoTX. L/R (Left):@MayorPeteSaenz, @NancyPelosi, @RepCuellar L/R (Right):@MayorPeteSaenz, @SteveScalise, @RepCuellar https://t.co/IoleEPxqjt|en|D|1|3
971846503047278592|210926192|Thu Mar 08 20:33:57 +0000 2018|Thank you to everyone who celebrated Laredo Day in Washington! It was a pleasure joining the @CityofLaredoTX, Members of Congress, and community members, marking the conclusion of a week of productive meetings relating to Laredo. Hope to see you all again next year! https://t.co/chjdk28DW8|en|D|3|12
971832483355529218|210926192|Thu Mar 08 19:38:14 +0000 2018|Yesterday, I met with the U.S. Army Corps of Engineers @USACEHQ and representatives from the Laredo Delegation to discuss updates on the Chacon Creek project on the Rio Grande Basin https://t.co/NNEosvkyRI|en|D|1|0
971811331006492672|210926192|Thu Mar 08 18:14:11 +0000 2018|It was a pleasure meeting with 1982 Heisman Trophy winner, @HerschelWalker, during National Health Through Fitness Day to discuss pro-health initiatives! https://t.co/Prhw5FihqS|en|D|1|7
971787930875383809|210926192|Thu Mar 08 16:41:12 +0000 2018|Yesterday, I met with the #IBWC, the @NADB_BDAN, and representatives from the @CityOfLaredoTX to discuss the proposed convention center on the Rio Grande, the Laredo Low Water Weir project, and ongoing efforts to address wastewater discharge into the Rio Grande https://t.co/PjXnSnKrCI|en|D|4|6
971779038204301314|210926192|Thu Mar 08 16:05:52 +0000 2018|This week I met with the Haynes and Villegas family of Laredo, TX. My office was able to obtain a WH tour for them as well. L/R: Erika Haynes, Chris M. Haynes, Congressman Henry Cuellar, Nicole Villegas, and Ramon Villegas. https://t.co/VlsO6bXVeM|en|D|1|1
971768991873200133|210926192|Thu Mar 08 15:25:56 +0000 2018|Yesterday, I met with representatives from the @USDOT and the @CityOfLaredoTX to discuss the City’s INFRA Grant application for the Laredo I-35 &amp; I-69W expansion projects https://t.co/SwfOumfS7y|en|D|1|0
971753692893466624|210926192|Thu Mar 08 14:25:09 +0000 2018|Yesterday, I held a Media Availability for Laredo Media Partners with the @CityOfLaredoTX Mayor Pete Saenz and Nuevo Laredo Binational Affairs Director Edgar Parra from Washington. L/R: Edgar Parra, Congressman Henry Cuellar, Mayor Pete Saenz https://t.co/QXLXF4N6yY|en|D|1|0
971750756939419649|210926192|Thu Mar 08 14:13:29 +0000 2018|The @CityofLaredoTX and I met with the @USDOTFRA to discuss improving railways in the district https://t.co/dopFJ1L1J2|en|D|1|1
971530630671499264|210926192|Wed Mar 07 23:38:47 +0000 2018|Yesterday I met with Acting Chief Patrol Agent Jason D. Owens, from the Laredo Sector Border Patrol https://t.co/BBfFekTGy5|en|D|2|5
971513989648838656|210926192|Wed Mar 07 22:32:39 +0000 2018|Yesterday, I attended an event at the LOC where I engaged with various discussions with Members of Congress. L/R: Rep. Henry Cuellar, Acting Chief Patrol Agent Jason Owens, Senator Rand Paul, Rep. Thomas Massie, and Elroy Sailor. https://t.co/8dKdF4WYS7|en|D|1|6
971475893288914944|210926192|Wed Mar 07 20:01:16 +0000 2018|Today I held an Annual Legislative Update to discuss ways to help generate the economy including increasing trade and improving infrastructure, for @cityoflaredotx @MayorPeteSaenz @txamiu during their annual legislative visit to Washington, D.C. https://t.co/cNLth5SIRD|en|D|1|4
971470579374215168|210926192|Wed Mar 07 19:40:09 +0000 2018|Yesterday, my staff and members of the Laredo Delegation met with staff from the Office of @collinpeterson (MN-07) to discuss agriculture and trade. https://t.co/DRmLSAqKLM|en|D|1|3
971152613583609857|210926192|Tue Mar 06 22:36:40 +0000 2018|It was a pleasure meeting with the Assistant Sec. for Border, Immigration and Trade Policy at @DHSgov, Michael Dougherty, to discuss border security, #NAFTA, and #DACA. L/R: @RepCuellar, @RepFilemonVela, Sec. Dougherty, @CityofLaredoTX Mayor Saenz, and Council Member Vielma. https://t.co/RqEZHM2aOA|en|D|0|8
971147541743128577|210926192|Tue Mar 06 22:16:31 +0000 2018|Today, my staff met with @davereichert and officials from @CityOfLaredoTX to discuss the importance of trade and ways to secure funding for improving trade infrastructure at the Port of Laredo. https://t.co/TflTr8TUS0|en|D|1|3
971116741421125633|210926192|Tue Mar 06 20:14:08 +0000 2018|We had a productive meeting today with @RepKevinBrady, Chair of the House Ways and Means Committee and officials from the @CityofLaredoTX to discuss trade agreements and #NAFTA. https://t.co/VpDU73URnf|en|D|0|4
971102735885066240|210926192|Tue Mar 06 19:18:29 +0000 2018|Today, His Excellency @Geronimo_GF hosted breakfast for our Laredo delegation in their annual legislative visit to Washington D.C. Pictured L/R: @MayorPeteSaenz, @GERONIMO__GF, @RepCuellar, @cityoflaredotx City Manager Horacio de Leon. https://t.co/HtQvEC13bg|en|D|3|8
971086645670895617|210926192|Tue Mar 06 18:14:32 +0000 2018|My staffer Patrick O’Connor met with the @cityoflaredoTX Convention and Visitor’s Bureau Director Ramos, Dist. 5 Council Member Vielma, Deputy City Manager Collazo, and Ms. Brearcliffe, Electronic Resources Coordinator at the @librarycongress to discuss digital library services. https://t.co/ZR0FzCZUIu|en|D|1|0
971072703573655552|210926192|Tue Mar 06 17:19:08 +0000 2018|Yesterday my staffer, Patrick O'Connor, and officials from the @CityofLaredoTX met with staffers from the @NEAarts and the @NEHgov to discuss grant opportunities. https://t.co/vSCcLeIo8w|en|D|3|7
