id|user|created_at|text|lang|label|retweet_count|favorite_count
1507062269519310851|240393970|Thu Mar 24 18:30:19 +0000 2022|I was honored to meet with Laurens County First Responders and Law Enforcement today as part of my annual First Res… https://t.co/gFBDEgjzUg|en|R|3|13
1506690787035262987|240393970|Wed Mar 23 17:54:11 +0000 2022|"No, @POTUS. Your economic strategy has failed — and it’s hurting Americans. 

-National gas price average of $4.24… https://t.co/pOPk84QtP6"|en|R|7|22
1506339829486923785|240393970|Tue Mar 22 18:39:36 +0000 2022|These scandals go much further than Hunter Biden — this is about the sitting President of the United States and our… https://t.co/ErQ06ahZzU|en|R|24|50
1506330841911336968|240393970|Tue Mar 22 18:03:53 +0000 2022|The Taliban and the Kremlin can tweet freely, but @Twitter locks @TheBabylonBee out for calling a biological male b… https://t.co/FdSjXJYNuW|en|R|7|20
1506266221603393538|240393970|Tue Mar 22 13:47:06 +0000 2022|Biden's border crisis is only worsening w/ over 2 mil. illegal border crossings since he took office. Border offici… https://t.co/6EIPMheb2M|en|R|9|11
1506257066335387650|240393970|Tue Mar 22 13:10:44 +0000 2022|"""If you ate today, thank a farmer."" Happy National Agriculture Day to all the farmers &amp; those in agriculture who pl… https://t.co/f5yNWkW7pT"|en|R|21|81
1506004280402227204|240393970|Mon Mar 21 20:26:15 +0000 2022|"No, inflation is not ""transitory"" or a ""high-class problem"" or the ""Putin price hike."" Inflation is the result of t… https://t.co/r3vVbSTDma"|en|R|12|38
1505181777379442690|240393970|Sat Mar 19 13:57:55 +0000 2022|Our thoughts and prayers are with the family of @repdonyoung who represented Alaska for nearly half a century in Co… https://t.co/JMSfuANAQf|en|R|6|38
1504821670917332994|240393970|Fri Mar 18 14:06:59 +0000 2022|The last time this happened, China decided it was a good time to export the virus to the rest of the world. https://t.co/pN6Zolr5GL|en|R|5|15
1504810515683581952|240393970|Fri Mar 18 13:22:39 +0000 2022|*his victory. Why are we celebrating the fact that a biological MALE took first place from a woman in a  women's sw… https://t.co/iN7TsG7YU5|en|R|13|64
1504638808352075798|240393970|Fri Mar 18 02:00:21 +0000 2022|We need a special counsel appointed immediately to ensure that @JoeBiden and his Administration do not interfere wi… https://t.co/omf0Nru2Ak|en|R|10|40
1504517160126844930|240393970|Thu Mar 17 17:56:58 +0000 2022|Biden essentially declared war on American energy in 2020. Playing politics with a rush-to-green agenda leads to en… https://t.co/rCmvY9DfQJ|en|R|6|21
1504215169047711753|240393970|Wed Mar 16 21:56:57 +0000 2022|Here’s part of my conversation w/ Charlie James on 106.3 WORD on the importance of our energy independence &amp; why Pu… https://t.co/zOijvDBSCR|en|R|3|10
1503762233741959172|240393970|Tue Mar 15 15:57:09 +0000 2022|"The Democrats' ""just buy an EV"" talking point is the new ""let them eat cake!"" https://t.co/DlTbyk9KV1"|en|R|3|20
1503745571554828290|240393970|Tue Mar 15 14:50:57 +0000 2022|An open border is a threat to our national security and a gateway for terrorism. @POTUS and Border Czar @VP, it is… https://t.co/0DQuhNLjIA|en|R|25|87
1503402629409521671|240393970|Mon Mar 14 16:08:13 +0000 2022|These are Biden's gas prices, not Putin's. Biden began his attack on American energy, making gas prices skyrocket,… https://t.co/TFkEH4bGfZ|en|R|12|37
1503396724706058256|240393970|Mon Mar 14 15:44:45 +0000 2022|Very important message. https://t.co/5pFwT3jnbc|en|R|10|48
1503362586636603396|240393970|Mon Mar 14 13:29:06 +0000 2022|Putin wants America to be energy dependent. Biden is helping him achieve this goal and Vladimir Putin is laughing.… https://t.co/q1zwmBjfao|en|R|6|43
1502660691605528585|240393970|Sat Mar 12 15:00:01 +0000 2022|The CCP continues to gain ground in the nuclear energy sector while the United States cedes leverage in the energy… https://t.co/Zfu48CUCSn|en|R|5|12
1502286537735786499|240393970|Fri Mar 11 14:13:16 +0000 2022|Congratulations to Lander University for its 150th Anniversary! Lander celebrates record growth, with more students… https://t.co/3UvuWaIdci|en|R|4|11
1501958653552861188|240393970|Thu Mar 10 16:30:22 +0000 2022|The United States is blessed with abundant natural resources but cursed with liberal politicians who refuse to allo… https://t.co/15KQyv1JGZ|en|R|27|112
1501914825668112389|240393970|Thu Mar 10 13:36:13 +0000 2022|.@SCFarmBureau visited to discuss challenges regarding high production costs, energy prices, supply chain issues, a… https://t.co/5sGctOSECW|en|R|4|14
1501585985242636293|240393970|Wed Mar 09 15:49:31 +0000 2022|Great to meet with the SC Bankers Association to hear from bankers across SC. As a former community banker, I know… https://t.co/Q9ze2mD12O|en|R|4|9
1501305008335118337|240393970|Tue Mar 08 21:13:01 +0000 2022|Hearing talk around town that Dems are including the ban on Russian gas in their massive omnibus bill. If true, thi… https://t.co/BCxlEFJb03|en|R|5|21
1501304140340908032|240393970|Tue Mar 08 21:09:34 +0000 2022|Gas prices were already soaring nationwide because of Biden's America-last energy policy. Russia's invasion of Ukra… https://t.co/VF9btNaJmD|en|R|19|84
1501268424286081027|240393970|Tue Mar 08 18:47:39 +0000 2022|Why is Biden more willing to get oil from Iran and Venezuela, than he is from the United States and Canada?|en|R|93|366
1501213228856188934|240393970|Tue Mar 08 15:08:19 +0000 2022|The national average for gas is at an all-time high, costing Americans $4.17/gallon (AAA), compared to a $2.77 nati… https://t.co/HxSMTRhr23|en|R|78|178
1501204049940594690|240393970|Tue Mar 08 14:31:51 +0000 2022|We need a wartime response from Joe Biden in support of American energy production. Every Biden-era energy regulati… https://t.co/MzQoJiTeCq|en|R|10|57
1500942157489836032|240393970|Mon Mar 07 21:11:11 +0000 2022|Joe Biden appeals to Saudi Arabia for oil while forcing Americans out of energy jobs here. The U.S. is blessed with… https://t.co/NXTz5RMn36|en|R|23|111
1500880533907288074|240393970|Mon Mar 07 17:06:18 +0000 2022|The Russian people should know Putin is one of the richest men in the world and is sending their sons to war in Ukr… https://t.co/ZmiofWtsMe|en|R|2|18
1499541077484781570|240393970|Fri Mar 04 00:23:47 +0000 2022|I'm thankful there's bipartisan support in Congress against Russia's invasion of Ukraine. But why isn't there bipar… https://t.co/WIyNKs5dpD|en|R|27|152
1499477246117126148|240393970|Thu Mar 03 20:10:09 +0000 2022|If we don't lead the way in energy production, our enemies will, and are watching this play out in real time in Rus… https://t.co/9HTfLE24BN|en|R|33|51
1499421761045213185|240393970|Thu Mar 03 16:29:40 +0000 2022|Energy security is national security. American energy independence (&amp; cutting off Russian energy) is more important… https://t.co/rbb3TQzCEB|en|R|3|22
1499419533865533448|240393970|Thu Mar 03 16:20:49 +0000 2022|Happy #NationalAnthemDay, the day our National Anthem was adopted in 1931. May we never lose sight of these lyrics.… https://t.co/G1hppebzJZ|en|R|8|20
1499391961777807360|240393970|Thu Mar 03 14:31:15 +0000 2022|"Translation: ""We know that the Biden Administration's policies are causing gas prices to spike. This is intentional… https://t.co/xqafHdX4Tm"|en|R|10|24
1499372024296263682|240393970|Thu Mar 03 13:12:02 +0000 2022|The question every American needs to ask: Why does Joe Biden refuse to implement an energy policy that simultaneous… https://t.co/JVQKt18370|en|R|130|410
1499133243974692868|240393970|Wed Mar 02 21:23:12 +0000 2022|Thank you for your hard work on this issue @RogerMarshallMD. I have filed the discharge petition in the House, and… https://t.co/swdxNhLAU0|en|R|10|41
1499129212682350594|240393970|Wed Mar 02 21:07:11 +0000 2022|It was great speaking with members of the Carolinas Credit Union League in the Capitol today and listening to their… https://t.co/HYyJt8xiVF|en|R|1|12
1499101944857645060|240393970|Wed Mar 02 19:18:50 +0000 2022|THANK YOU! https://t.co/BCaZbd0A0H https://t.co/MRQzpu285g|en|R|1|20
1499068104906878976|240393970|Wed Mar 02 17:04:22 +0000 2022|"Without South Carolina, there would be no Texas.

Happy Texas Independence Day from the Third District of South Car… https://t.co/QICdgwB1Uy"|en|R|2|16
1499011323853746177|240393970|Wed Mar 02 13:18:44 +0000 2022|"A few thoughts on President Biden's State of the Union Address last night:

He said he wants to secure the border,… https://t.co/ANLcg0qc1c"|en|R|11|47
1498856457764233225|240393970|Wed Mar 02 03:03:21 +0000 2022|"""Putin may surround Kyiv with tanks, but he will never win the hearts and mind of the Iranian people"" -President Joe Biden"|en|R|20|76
1498855338107457544|240393970|Wed Mar 02 02:58:54 +0000 2022|Secure the border?!?! Gimme a break!|en|R|32|225
1498854619228823567|240393970|Wed Mar 02 02:56:03 +0000 2022|When Trump talked about building and buying American, he was called a fascist/nationalist.|en|R|6|37
1498818168176979968|240393970|Wed Mar 02 00:31:12 +0000 2022|"Vicky's right. Women's sports are for women, not men pretending to be women. Twitter, if you're going to ""cancel"" V… https://t.co/WZBpeAZdYS"|en|R|8|30
1498765838110924803|240393970|Tue Mar 01 21:03:16 +0000 2022|I asked my constituents what they were hoping to hear President Biden say during his State of the Union address thi… https://t.co/jTObYYSR57|en|R|8|56
1498718999131176971|240393970|Tue Mar 01 17:57:08 +0000 2022|This is not a sustainable policy. Tapping into reserves provides only temporary relief, and limits our ability to r… https://t.co/8xbGdW6Pc6|en|R|8|43
1498458741208985621|240393970|Tue Mar 01 00:42:58 +0000 2022|Exactly. Russia's a tiny market compared to China. The Ukraine situation gives @Disney an opportunity to act and bu… https://t.co/5fhP3MQBCd|en|R|48|126
1498394650356461575|240393970|Mon Feb 28 20:28:18 +0000 2022|Fact https://t.co/kRcHYKF95T|en|R|19|72
1497591098180517891|240393970|Sat Feb 26 15:15:16 +0000 2022|Why is the Ukrainian government currently mass distributing firearms to the general population? Because the right a… https://t.co/vcN3yguuXg|en|R|33|170
1497588524572360704|240393970|Sat Feb 26 15:05:02 +0000 2022|Awesome! Now do this for Hong Kong. https://t.co/WWh3xKYJTA|en|R|10|33
1497330808557912074|240393970|Fri Feb 25 22:00:58 +0000 2022|"Stopped by to visit Big Smiles Peaches in Edgefield County, located in an area known as ""The Ridge,"" the heart of S… https://t.co/4DZr9uSt0i"|en|R|2|19
1497221361390993460|240393970|Fri Feb 25 14:46:04 +0000 2022|This week, I met with Williamston Mayor Rockey Burgess and Councilmembers Tabatha Austin and Chris Alexander. We en… https://t.co/xrjsocv2wz|en|R|2|6
1497050494170247168|240393970|Fri Feb 25 03:27:06 +0000 2022|Germany objects to including Swift in the sanctions package against Russia. This is after their generous offer to d… https://t.co/3LstZppVSn|en|R|41|137
1496961351994028039|240393970|Thu Feb 24 21:32:53 +0000 2022|I visited the @ACTC_org yesterday and was encouraged by the instruction and skills these students are gaining to pr… https://t.co/EyJXjxpPsB|en|R|1|6
1496920212536541184|240393970|Thu Feb 24 18:49:24 +0000 2022|"We once had ""peace through strength,"" but now it's ""war through weakness."" Putin’s actions are reprehensible, a com… https://t.co/QeiRiHzSFJ"|en|R|19|82
1496918262315159552|240393970|Thu Feb 24 18:41:39 +0000 2022|Russia is a gas station masquerading as a country. If you want to hurt Putin, you go after energy. https://t.co/VzoLhHsRcU|en|R|3|21
1496905561895575556|240393970|Thu Feb 24 17:51:11 +0000 2022|I can't emphasize this enough. Increasing our natural gas exports is one of the best ways we can combat Russian agg… https://t.co/m7bZJFTdcR|en|R|2|14
1496620317799821314|240393970|Wed Feb 23 22:57:44 +0000 2022|Great to see thriving industries in the Third District like Ascend Performance Materials, a provider of high-qualit… https://t.co/P1y2gUssba|en|R|0|18
1496530362687795203|240393970|Wed Feb 23 17:00:17 +0000 2022|Congrats on 50 years of #MakingLifeEasier! https://t.co/j2BMdjGsMq|en|R|3|6
1496527086521049095|240393970|Wed Feb 23 16:47:16 +0000 2022|"We have. Here are three, and I'm signed on to all of them.
-https://t.co/UiXlTx8R08
-https://t.co/hT1uih3NPn
-… https://t.co/Cnd8tuxSxf"|en|R|5|15
1496200741865897984|240393970|Tue Feb 22 19:10:29 +0000 2022|President Trump was 100% right on this. https://t.co/NwMcRswY1N|en|R|8|60
1495975018626441217|240393970|Tue Feb 22 04:13:32 +0000 2022|Joe Biden is channeling his inner Chamberlain at a time when the world needs a Churchill. https://t.co/WjhkBn9NSM|en|R|9|35
1494859061707292674|240393970|Sat Feb 19 02:19:08 +0000 2022|Castro would be proud https://t.co/hgJKURrTQQ|en|R|31|122
1494684629189677058|240393970|Fri Feb 18 14:46:00 +0000 2022|Heartbroken to hear of @RepHagedorn's passing this morning at the age of 59. He was a true American who loved this… https://t.co/6Z21IeSYgU|en|R|5|22
1494679364465831938|240393970|Fri Feb 18 14:25:04 +0000 2022|"""With all eyes on China for the Olympics, do not overlook what the (CCP) would rather keep in the shadows: the geno… https://t.co/UcjDRANeRQ"|en|R|40|56
1494358238267117569|240393970|Thu Feb 17 17:09:02 +0000 2022|"""There is no doubting the geopolitical importance of America’s new oil-and-gas position.” Check out this op-ed on w… https://t.co/n43qaxZPYI"|en|R|6|8
1494115497658523653|240393970|Thu Feb 17 01:04:28 +0000 2022|"“All tyrannies rule through fraud and force, but once the fraud is exposed they must rely exclusively on force.”
-G… https://t.co/I7nXvF9EsQ"|en|R|5|55
1494069044596682763|240393970|Wed Feb 16 21:59:53 +0000 2022|"""Masks for thee, not for me..."" Teachers unions and Washington bureaucrats don't care about your kids. This is not… https://t.co/eOFE5nABBe"|en|R|3|14
1494026463041015813|240393970|Wed Feb 16 19:10:41 +0000 2022|Congratulations to @EnesFreedom for receiving a Nobel Peace Prize nomination. Thank you for standing for human righ… https://t.co/gflJsDY31m|en|R|634|1411
1493616408114221060|240393970|Tue Feb 15 16:01:16 +0000 2022|Hillary Clinton's #Spygate must receive the full investigation it deserves, but Democrats (and the media) either ig… https://t.co/r2ESVJZnNc|en|R|22|86
1493419807189909504|240393970|Tue Feb 15 03:00:03 +0000 2022|Still waiting... https://t.co/kvHiFTlY6g|en|R|22|66
1493235830109913092|240393970|Mon Feb 14 14:48:59 +0000 2022|It's long overdue for Biden to lift pandemic-related emergency powers &amp; get America back to normal. The government'… https://t.co/f0f8aXN0To|en|R|4|18
1492695074693599233|240393970|Sun Feb 13 03:00:13 +0000 2022|"The Clinton campaign paid to ""infiltrate"" the White House and Trump Tower in an attempt to fabricate a connection b… https://t.co/COHIwOJa0t"|en|R|29|71
1492678412577742855|240393970|Sun Feb 13 01:54:00 +0000 2022|Where's your John Durham story? @CNNPolitics @CBSPolitics @NBCNews @politico @nprpolitics|en|R|246|544
1492242041383751683|240393970|Fri Feb 11 21:00:01 +0000 2022|Inflation is at a 40-year high and will cost most American households an extra $3,500 in expenses this year (Penn W… https://t.co/nmivXtuGfI|en|R|8|27
1492158660335878148|240393970|Fri Feb 11 15:28:42 +0000 2022|Biden's energy policy emboldens our adversaries &amp; puts America last. Why is Biden sending even more money to Putin… https://t.co/yiuKYNPtZB|en|R|8|18
1492150967676149765|240393970|Fri Feb 11 14:58:08 +0000 2022|From Afghanistan and the southern border crisis to skyrocketing inflation and draconian mandates, it is no surprise… https://t.co/jrxzjy995A|en|R|7|21
1491841518914748421|240393970|Thu Feb 10 18:28:29 +0000 2022|The last time inflation was this high in 1982, I was in high school. #Bidenflation is a tax on all Americans, has i… https://t.co/HbfH7QSTTq|en|R|10|73
1491529585422475267|240393970|Wed Feb 09 21:48:59 +0000 2022|And don't forget handing out crack pipes! https://t.co/qAYq6eWbFw|en|R|5|69
1491519041386733583|240393970|Wed Feb 09 21:07:05 +0000 2022|Excited to see Pauline represent Clemson and the state of South Carolina well during the… https://t.co/WivRQMrTM7|en|R|1|10
1491427310515326977|240393970|Wed Feb 09 15:02:34 +0000 2022|"Biden Admin uses taxpayer $ for CRACK PIPES for drug addicts to smoke illicit substances in the name of ""racial equ… https://t.co/H86PIlKeDy"|en|R|12|41
1491160472175128576|240393970|Tue Feb 08 21:22:15 +0000 2022|Unfortunately, due to votes in the House, tonight's Telephone Town Hall had to be postponed. Stay tuned for a resch… https://t.co/Iz8V3Q6SD7|en|R|1|6
1491127888187621376|240393970|Tue Feb 08 19:12:47 +0000 2022|Allowing non-citizens to vote in our elections suppresses the voice of citizens, undermines the rights of Americans… https://t.co/L8QSfYNAZq|en|R|8|26
1491118655228485632|240393970|Tue Feb 08 18:36:05 +0000 2022|Weeks ago, Nancy Pelosi was handing out N95 masks made in China. This week, the Biden Administration is using your… https://t.co/uejsKO3vcM|en|R|23|60
1491114732375343104|240393970|Tue Feb 08 18:20:30 +0000 2022|The time to continue Trump's sanctions on the Nord Stream II pipeline was Biden's first day in office.|en|R|3|29
1491064160070750209|240393970|Tue Feb 08 14:59:33 +0000 2022|Enough fentanyl was seized by CBP last year to kill every American nearly 7 times &amp; and was the leading cause of de… https://t.co/VxJxxkhHqU|en|R|61|103
1490777638771867653|240393970|Mon Feb 07 20:01:01 +0000 2022|SC Farm Bureau President Harry Ott said, “The well-being of our livestock is top priority for cattle farmers and th… https://t.co/JgGDOvKgtQ|en|R|4|4
1490720251205537795|240393970|Mon Feb 07 16:12:58 +0000 2022|Tune in to my Telephone Town Hall tomorrow at 5:30 p.m. EST for a Washington Update and a chance to ask me question… https://t.co/QbDslMcAkc|en|R|4|1
1489639009844404228|240393970|Fri Feb 04 16:36:30 +0000 2022|Glad @CNNPolitics is starting to say publicly what they were previously all thinking privately. https://t.co/OI1XLzd6YZ|en|R|2|10
1489422802910334977|240393970|Fri Feb 04 02:17:23 +0000 2022|I'll be on Christian Worldview with Tony and Austin tomorrow at 8 a.m. If you're local, be sure to tune in to His R… https://t.co/f7SEs8Xh54|en|R|2|13
1489315851153063945|240393970|Thu Feb 03 19:12:23 +0000 2022|The Democrats' 2,900+ page America Concedes Act is not just weak on China, but it actively harms America while help… https://t.co/BYzokPtPcS|en|R|36|45
1488993383641198600|240393970|Wed Feb 02 21:51:01 +0000 2022|I stand with the truckers and tow truck companies because I stand for #MedicalFreedom (for Americans and Canadians,… https://t.co/16mv3NqTwo|en|R|8|40
1488983445590134787|240393970|Wed Feb 02 21:11:32 +0000 2022|In Washington, it's Groundhog Day (again) and the Democrats are still pushing their socialist agendas, overlooking… https://t.co/EMPzBYeQS3|en|R|3|19
1488906407839776769|240393970|Wed Feb 02 16:05:24 +0000 2022|.@MUSChealth's decision to remove folks from organ transplant lists for not having the COVID shot is blatant medica… https://t.co/Ndqm2l81e9|en|R|33|60
1488608229261287430|240393970|Tue Feb 01 20:20:33 +0000 2022|MUSC's decision to remove someone from a transplant list because he chose not to receive the COVID shot is inhumane… https://t.co/PW0Vb8BVgH|en|R|18|57
1488543974914732038|240393970|Tue Feb 01 16:05:14 +0000 2022|The Democrats' America Concedes Act is nothing more than Build Back Better 3.0 &amp; a reckless spending spree that sur… https://t.co/Exwjfg50ml|en|R|64|112
1488264748089155585|240393970|Mon Jan 31 21:35:41 +0000 2022|Canadian truckers are demanding freedom from tyranny, and I stand with them! #FreedomConvoy2022 https://t.co/bdc2tv35l6|en|R|5|28
1488196584013766662|240393970|Mon Jan 31 17:04:49 +0000 2022|Biden has created an energy crisis by canceling American energy independence and putting America last. Gas prices a… https://t.co/hVXKOCy3KA|en|R|10|26
1487121033190645766|240393970|Fri Jan 28 17:50:58 +0000 2022|States changing election laws in violation of their own state constitutions.  https://t.co/2GiZwHHadW|en|R|8|33
1486816749009965062|240393970|Thu Jan 27 21:41:51 +0000 2022|She's been called the C-word by Obama's Deputy Chief of Staff, threatened with physical violence by a Clinton Cabin… https://t.co/EBF1LCa95c|en|R|10|28
1486720737285066756|240393970|Thu Jan 27 15:20:20 +0000 2022|We remember the liberation of Auschwitz in 1945 and the lives of more than six million Jews murdered by the Nazis.… https://t.co/fkggmFr7m9|en|R|21|82
1486366443260325890|240393970|Wed Jan 26 15:52:30 +0000 2022|President Biden is a record-setting president—in all the wrong ways. From record-high illegal border crossings to r… https://t.co/lLDgAywYph|en|R|35|76
1486056275171581960|240393970|Tue Jan 25 19:20:00 +0000 2022|Illegal border crossings are rising at a faster rate than any other time in recent history. Because of the Democrat… https://t.co/zeqvPVNBKE|en|R|15|37
1485734159578394624|240393970|Mon Jan 24 22:00:01 +0000 2022|This #SchoolChoiceWeek, we are fighting to take education out of the hands of “woke” school boards, government bure… https://t.co/HwoZQKkqQG|en|R|3|14
1485722346598146048|240393970|Mon Jan 24 21:13:05 +0000 2022|Are you better off now than when gas was $2 a gallon, inflation wasn’t a concern, and store shelves weren’t bare? https://t.co/YgAc1z1Dzv|en|R|74|543
1485627795602644994|240393970|Mon Jan 24 14:57:22 +0000 2022|Washington is too big and intrusive and it's time to get government out of the way as our Founding Fathers intended… https://t.co/X4Y2hFy0fu|en|R|5|10
1484575266387095557|240393970|Fri Jan 21 17:15:00 +0000 2022|The #RighttoLife is the foundation every other right is built upon and must be protected. As a father of three, thi… https://t.co/bIO52tPxEC|en|R|8|25
1484225146500042761|240393970|Thu Jan 20 18:03:45 +0000 2022|"From 1/20/2021 ➡️ 1/20/2022: A year of unprecedented crises.

❌Southern Border Crisis
❌Energy Crisis
❌Economic Cris… https://t.co/ZEATiPkGIX"|en|R|5|16
1484224297552039944|240393970|Thu Jan 20 18:00:22 +0000 2022|One year ago today, Biden was inaugurated and began a year of unprecedented crises under one-party rule. Here’s a g… https://t.co/NvrwSZkhrB|en|R|9|25
1483951653560758278|240393970|Wed Jan 19 23:56:59 +0000 2022|A few thoughts on the #bidenpressconference. 1) I hope the media acknowledges how inaccessible Biden has been compa… https://t.co/1b2oUkreRe|en|R|8|37
1483922016180875264|240393970|Wed Jan 19 21:59:13 +0000 2022|I'm proud to have earned an A+ on @SBAList's pro-life Scorecard. I will always vote to protect the rights of the un… https://t.co/Jjt0DMi0mY|en|R|6|43
1483827947559698440|240393970|Wed Jan 19 15:45:25 +0000 2022|The Abortion Pill Reversal program saved Oliver’s life in the womb by reversing the abortion pill process. Watch th… https://t.co/0h5LKXKxtj|en|R|7|21
1483565095879905288|240393970|Tue Jan 18 22:20:56 +0000 2022|Democrats rammed through $120 billion in the American Rescue Plan for “re-opening schools” last year. However, only… https://t.co/3jQvhwbSUw|en|R|8|22
1483556845193240579|240393970|Tue Jan 18 21:48:09 +0000 2022|AKA not solving the border crisis. https://t.co/n7Kjyc29tA|en|R|6|18
1483491146747760647|240393970|Tue Jan 18 17:27:05 +0000 2022|2021 was the worst year for the economy in four decades. Prices are up across the board while labor force participa… https://t.co/gKPc1Lza66|en|R|26|60
1483485028147412994|240393970|Tue Jan 18 17:02:47 +0000 2022|"Pretty overwhelming response, people want fewer campaign ads. However, since Dem's ""voting rights"" legislation woul… https://t.co/7GS40oSbSM"|en|R|3|8
1483442951661498372|240393970|Tue Jan 18 14:15:35 +0000 2022|Stop https://t.co/Myp5HveI32|en|R|4|26
1483119225942290436|240393970|Mon Jan 17 16:49:13 +0000 2022|Would you like to see more or less campaign ads come election season?|en|R|4|8
1483091746963791873|240393970|Mon Jan 17 15:00:01 +0000 2022|The Hyde Amendment has saved at least 2.4 million babies since 1976, but Democrats want to remove this lifesaving p… https://t.co/oYfGUFNbqU|en|R|3|13
1483062851325636612|240393970|Mon Jan 17 13:05:12 +0000 2022|"Remembering the life and legacy of Martin Luther King Jr. today. 

“The ultimate measure of a man is not where he s… https://t.co/kccgxYHRUx"|en|R|10|42
1482167648054128640|240393970|Sat Jan 15 01:47:59 +0000 2022|Congratulations Joe, you've kept your campaign promise of uniting the country by turning Republicans, Democrats, an… https://t.co/u4HF20xQF5|en|R|35|210
1482134255018950662|240393970|Fri Jan 14 23:35:17 +0000 2022|General Electric, one of America’s largest employers, canceled its mandate after yesterday’s Supreme Court ruling a… https://t.co/SWmlWv3jlx|en|R|18|72
1482087625418809359|240393970|Fri Jan 14 20:30:00 +0000 2022|"This is not a ""voting rights bill"" as Democrats claim — instead, it's a federal takeover of elections in a desperat… https://t.co/hHo3uT4JbY"|en|R|9|72
1482074294058303491|240393970|Fri Jan 14 19:37:01 +0000 2022|Honored to receive the Friend of the Family Award this week from the Faith and Freedom Coalition for my conservativ… https://t.co/ozpazQU5UO|en|R|7|32
1482051243665248261|240393970|Fri Jan 14 18:05:26 +0000 2022|The Nord Stream 2 pipeline sanctions bill failed to pass the Senate. Allowing the completion of this pipeline under… https://t.co/iAPBsHcJ0f|en|R|4|15
1482039415493074949|240393970|Fri Jan 14 17:18:26 +0000 2022|My office has received multiple constituent cases from healthcare workers whose personal doctors urged medical exem… https://t.co/coSpdcdLxD|en|R|2|13
