id|user|created_at|text|lang|label|retweet_count|favorite_count
1387026072236183555|240393970|Tue Apr 27 12:49:19 +0000 2021|Has anyone in the media ever heard of this happening before?!? @Gannett would love more clarity on why you're allow… https://t.co/AKSUudSc8P|en|R|11|33
1387008121806237697|240393970|Tue Apr 27 11:38:00 +0000 2021|.@DSladeNews good article sharing some of what I'm hearing from constituents. Also hope you saw this second tweet a… https://t.co/nkJloMtyN4|en|R|2|3
1386795575694200834|240393970|Mon Apr 26 21:33:25 +0000 2021|Agreed https://t.co/WB9aBenNJ9|en|R|10|42
1386792857063903232|240393970|Mon Apr 26 21:22:37 +0000 2021|By giving California more representatives in Congress than they deserve, South Carolinians along with residents in… https://t.co/VfZXjtAjm9|en|R|3|32
1386784246212214787|240393970|Mon Apr 26 20:48:24 +0000 2021|California should have and would have lost more seats had illegal immigrants been excluded from Congressional appor… https://t.co/ixr3xPTHwW|en|R|13|47
1386772600420974607|240393970|Mon Apr 26 20:02:07 +0000 2021|I saw this coming, which is why I authored HR 85, the Old Glory Only Act. No flag (Pride, BLM, or Gadsden) should f… https://t.co/RZMfmQsknU|en|R|14|60
1386747348383113217|240393970|Mon Apr 26 18:21:47 +0000 2021|"Be sure to ""circle back"" with Members of Congress on this as well @PressSec, because we certainly want to know if t… https://t.co/wt4g2vHQBt"|en|R|12|53
1385738104200433667|240393970|Fri Apr 23 23:31:24 +0000 2021|Friday night news dump. Biden Admin eliminating penalties for noncompliance with deportation orders...in the middle… https://t.co/1SHMaX562x|en|R|33|66
1385700002866028552|240393970|Fri Apr 23 21:00:00 +0000 2021|I joined @MyTimVanHorn yesterday on the @toddstarnes Show to discuss the Democrats' unconstitutional attempt to mak… https://t.co/yYXlMgO45k|en|R|2|15
1385633383393472519|240393970|Fri Apr 23 16:35:17 +0000 2021|Woah woah woah, this is so false that I have to respond. It was the SC Democrat Party that filed the lawsuit challe… https://t.co/15QfiqKx3i|en|R|9|32
1385631627645227008|240393970|Fri Apr 23 16:28:18 +0000 2021|I must have touched a nerve with that spend $120 million/lose by 10+ point remark. Anyway, thank you for your help… https://t.co/mR2pNziqNJ|en|R|3|30
1385625594264793091|240393970|Fri Apr 23 16:04:20 +0000 2021|I'd say you should resign, but I'm actually VERY thankful you're the head of the DNC. Spend $120 million on a Senat… https://t.co/ueI3sCKGPe|en|R|24|119
1385619237084049417|240393970|Fri Apr 23 15:39:04 +0000 2021|Admitting a new state into the union is absolutely SC's business @KarlyShorter. This particular issue also runs afo… https://t.co/fZMMiFquPv|en|R|4|21
1385618464933617667|240393970|Fri Apr 23 15:36:00 +0000 2021|Respectfully, I think you need to speak to more employers to get a better handle of what's happening @DSladeNews. M… https://t.co/aG1xssJs5U|en|R|6|17
1385567456689803264|240393970|Fri Apr 23 12:13:18 +0000 2021|"National Volunteer Week is April 18-24 &amp; organizations across the country are celebrating.

Thank you to the more t… https://t.co/KTmB8G7J4c"|en|R|1|4
1385552646401142784|240393970|Fri Apr 23 11:14:27 +0000 2021|I sincerely hope @WhipClyburn &amp; every other Member who has been fined wins their appeal, either internally or in co… https://t.co/LYsGJPsePT|en|R|4|16
1385266663420014594|240393970|Thu Apr 22 16:18:04 +0000 2021|The United States Constitution. https://t.co/tIQs8os1NT|en|R|7|71
1385266154218872844|240393970|Thu Apr 22 16:16:02 +0000 2021|If Democrats really gave a damn about voting rights in DC instead of stacking the Senate, they'd support giving DC… https://t.co/y3JjzeiGWa|en|R|31|142
1384963434387808259|240393970|Wed Apr 21 20:13:08 +0000 2021|"Today I asked questions at the Subcommittee on Communications &amp; Technology entitled ""Securing American Network Tech… https://t.co/hs5kVNyLNt"|en|R|198|172
1384906043025760262|240393970|Wed Apr 21 16:25:05 +0000 2021|Going to comment on this, Mr. President? @JoeBiden @POTUS https://t.co/2J2z6aKnFO|en|R|14|47
1384864194214998020|240393970|Wed Apr 21 13:38:48 +0000 2021|ICYMI, I was on Washington Watch with @tperkins. We discussed my bill to remove the longstanding antitrust exemptio… https://t.co/ymc3EQUkuz|en|R|2|15
1384845778418651137|240393970|Wed Apr 21 12:25:37 +0000 2021|Agree 100% with @mtgreenee. There should be bipartisan outrage on this. While most suspension votes are non-controv… https://t.co/oDio8CXKwn|en|R|342|1060
1384639991037546509|240393970|Tue Apr 20 22:47:53 +0000 2021|I am hopeful that this court decision will bring about an opportunity for healing, new beginnings, fresh perspectiv… https://t.co/3FQ2Pn5kcj|en|R|2|16
1384630971027402758|240393970|Tue Apr 20 22:12:03 +0000 2021|Who with the mask police is going to be the first to call out Al Sharpton and his press conference? Or is this like… https://t.co/jMN4eTK5vx|en|R|8|60
1384550554710462465|240393970|Tue Apr 20 16:52:30 +0000 2021|.@RepMaxineWaters traveled across state lines to tell rioters, who previously damaged over 1,300 properties and cau… https://t.co/iua8x3l5OO|en|R|19|65
1384521642278334465|240393970|Tue Apr 20 14:57:37 +0000 2021|These extreme energy policies championed by Democrats have real world negative consequences for small businesses ac… https://t.co/sgFNq9sjzE|en|R|6|16
1384485560887173120|240393970|Tue Apr 20 12:34:14 +0000 2021|The Judge presiding over the George Floyd case admonished Maxine Waters for inciting violence, yet Nancy Pelosi say… https://t.co/3dwsZYHsRw|en|R|31|162
1384119173563834368|240393970|Mon Apr 19 12:18:21 +0000 2021|"Is @KamalaHarris the worst gov't ""czar"" ever? She's in charge of the border crisis but hasn't visited, hasn't spoke… https://t.co/PoeICH3pgC"|en|R|9|64
1384117558232551424|240393970|Mon Apr 19 12:11:56 +0000 2021|"1) Travels across state lines to incite a riot
2) Appears to be attempting to interfere with a criminal proceeding… https://t.co/zJSm3wVwHW"|en|R|19|49
1384115036776386561|240393970|Mon Apr 19 12:01:55 +0000 2021|Under @SpeakerPelosi's standard, @RepMaxineWaters should be stripped of her committee assignments. That won't happe… https://t.co/K9kE1pa773|en|R|15|74
1383097648043991040|240393970|Fri Apr 16 16:39:10 +0000 2021|Great job @SteveScalise! Americans are tired of the double standards. https://t.co/tH7h4UIMRS|en|R|439|1039
1382778030721011720|240393970|Thu Apr 15 19:29:07 +0000 2021|You're 100% right @Jim_Jordan. Court packing is judicial tyranny. If Dems succeed in adopting this proposal, they w… https://t.co/LIw4jlH5aO|en|R|187|1069
1382773699233906690|240393970|Thu Apr 15 19:11:55 +0000 2021|Court packing = judicial tyranny|en|R|44|193
1382771253841440772|240393970|Thu Apr 15 19:02:12 +0000 2021|HUGE thank you to @RepAndyHarrisMD, @WarrenDavidson, and @RepRutherfordFL for signing on to this effort!  https://t.co/WG82PJm2Ig|en|R|3|7
1382483878967971842|240393970|Thu Apr 15 00:00:16 +0000 2021|Play ball! https://t.co/W4chpwnzEU|en|R|22|164
1382418381568106498|240393970|Wed Apr 14 19:40:00 +0000 2021|I try to give credit where credit is due, and in that spirit, if @JoeBiden follows through on his commitment to wit… https://t.co/zRlU0t38wV|en|R|21|61
1382394674653106177|240393970|Wed Apr 14 18:05:48 +0000 2021|Thank you to the patriots who joined me and @SenMikeLee in filing legislation eliminating @MLB's anti-trust exempti… https://t.co/JSfwSQRRQs|en|R|149|1069
1382390131869544461|240393970|Wed Apr 14 17:47:45 +0000 2021|"(4) Today, I filed legislation with 
@SenMikeLee
 to eliminate MLB Antitrust exemption.  

https://t.co/WG82PJm2Ig… https://t.co/dCNqeC3U4g"|en|R|8|43
1382389723348488192|240393970|Wed Apr 14 17:46:08 +0000 2021|"(3) Today, I filed legislation with 
@SenMikeLee
 to eliminate MLB Antitrust exemption.  

https://t.co/WG82PJm2Ig… https://t.co/y5QsPVFstT"|en|R|6|15
1382388888874979328|240393970|Wed Apr 14 17:42:49 +0000 2021|"(2) Today, I filed legislation with 
@SenMikeLee
 to eliminate MLB Antitrust exemption.  

https://t.co/WG82PJm2Ig… https://t.co/CjgtjlYxLM"|en|R|1|5
1382384678603214850|240393970|Wed Apr 14 17:26:05 +0000 2021|"Today, I filed legislation with @SenMikeLee to eliminate MLB Antitrust exemption.  

https://t.co/WG82PJm2Ig… https://t.co/Lf6P0uNAbO"|en|R|192|948
1382342369891221504|240393970|Wed Apr 14 14:37:58 +0000 2021|.@MLB has seen a 47% drop in support from GOP voters over the past few weeks. Why? Because MLB has revealed they're… https://t.co/jznFe5RC8M|en|R|20|69
1382130505139814402|240393970|Wed Apr 14 00:36:05 +0000 2021|Hearing from some of my GOP colleagues that individual @MLB owners are lobbying them to stay off this bill. I'm gla… https://t.co/Uc7jxNX7ru|en|R|653|2972
1379797866059808770|240393970|Wed Apr 07 14:07:01 +0000 2021|Thank you @henrymcmaster for standing strong against the so called “vaccine passports” being implemented in South C… https://t.co/cyZQ7JdvqG|en|R|10|59
1379479902769061890|240393970|Tue Apr 06 17:03:32 +0000 2021|President Biden and VP Harris have been working overtime to dodge accountability for the worsening southern border… https://t.co/bFr5x5w0X9|en|R|62|178
1379091639759728643|240393970|Mon Apr 05 15:20:43 +0000 2021|"At what point will the President admit this is an all-out crisis?! We need to secure the border NOW! 

https://t.co/tbE1sYQQd3"|en|R|21|49
1378706923101491200|240393970|Sun Apr 04 13:52:00 +0000 2021|He is Risen!|en|R|15|177
1378330409155633156|240393970|Sat Apr 03 12:55:52 +0000 2021|When will progressives begin the call for corporate America to leave NY over election laws on the books in THAT sta… https://t.co/QKQMXHsnFQ|en|R|32|168
1378329429332611074|240393970|Sat Apr 03 12:51:58 +0000 2021|You're 100% correct @DanCrenshawTX. I've been warning businesses about this for over a year now. Guess it will take… https://t.co/5VrSxhcBpF|en|R|10|106
1378184164638404609|240393970|Sat Apr 03 03:14:44 +0000 2021|GOP lawmaker to offer bill revoking MLB's antitrust exception https://t.co/fTji12mEjb|en|R|57|313
1378166719961792513|240393970|Sat Apr 03 02:05:25 +0000 2021|.@tedcruz, @SenMikeLee, @marcorubio @WarrenDavidson, @chiproytx and more all engaged on this issue in a matter of h… https://t.co/WsMp2oCRCw|en|R|429|1775
1378137307778277378|240393970|Sat Apr 03 00:08:33 +0000 2021|.@JustinBamberg as a lawyer, I would think you would be more familiar with anti-trust issues. The current antitrust… https://t.co/ai89vRItvY|en|R|8|51
1378112360704045056|240393970|Fri Apr 02 22:29:25 +0000 2021|CC @JackPosobiec https://t.co/bf48wwXzBv|und|R|13|68
1378076742636736512|240393970|Fri Apr 02 20:07:53 +0000 2021|CC @DonaldJTrumpJr https://t.co/bf48wwXzBv|und|R|541|2372
1378075721587904512|240393970|Fri Apr 02 20:03:50 +0000 2021|I strongly agree,@marcorubio I've begun the process of drafting legislation to remove @MLB's antitrust exception. I… https://t.co/MOzJMYqfjh|en|R|35|108
1378074529076015106|240393970|Fri Apr 02 19:59:05 +0000 2021|In light of @MLB's stance to undermine election integrity laws, I have instructed my staff to begin drafting legisl… https://t.co/szPPdZmRLA|en|R|5170|23748
1378006404166991875|240393970|Fri Apr 02 15:28:23 +0000 2021|Proud to lead this letter with @RepTimmons @RepNancyMace @RepRalphNorman &amp; @RepJoeWilson to Gov. @henrymcmaster sup… https://t.co/NpLIxMUvAN|en|R|32|123
1377700815134199816|240393970|Thu Apr 01 19:14:05 +0000 2021|Reminder: @Delta was one of the companies that lobbied for the Equality Act, a bill that could force doctors (even… https://t.co/I3nnjnW86m|en|R|43|95
1377647243231121411|240393970|Thu Apr 01 15:41:12 +0000 2021|Great find @TomCottonAR! @Delta should make decisions on facts, not a perceived sense of wokeness. https://t.co/cRNaRgYrIW|en|R|16|49
1377633622644174851|240393970|Thu Apr 01 14:47:05 +0000 2021|I'm sending an open invitation to any Congressional Democrats to come to SC and learn more about guns. We can visit… https://t.co/a46vj51Ke3|en|R|13|63
1377613276570382337|240393970|Thu Apr 01 13:26:14 +0000 2021|This is what fascism looks like. https://t.co/75AuJbe4n2|en|R|28|70
1377313349982097419|240393970|Wed Mar 31 17:34:26 +0000 2021|This!!!! @RepJimBanks spot on per usual! https://t.co/Yil4mWnbkq|en|R|19|81
1377306482769805312|240393970|Wed Mar 31 17:07:09 +0000 2021|If Delta doesn't support election integrity, then Republicans shouldn't support Delta. The era of companies taking… https://t.co/woHn8ldenq|en|R|49|151
1377299989966286856|240393970|Wed Mar 31 16:41:21 +0000 2021|.@EricTrump I posted the full interview on my FB page, and we'll see what Facebook decides to do with it. Every Ame… https://t.co/IYX66DypEV|en|R|548|2766
1377243991213801473|240393970|Wed Mar 31 12:58:50 +0000 2021|"Here's my ""vaccine passport"" https://t.co/W7jQetW719"|en|R|3110|14344
1376962520909541402|240393970|Tue Mar 30 18:20:22 +0000 2021|John Adams would be appalled https://t.co/LgQ0hyQmLh|en|R|6|34
1376936184480460809|240393970|Tue Mar 30 16:35:43 +0000 2021|.@KamalaHarris what parents have had to go through this past year with school closures isn't a laughing matter. Wat… https://t.co/vFuAi8lvJq|en|R|16|53
1376876561182392321|240393970|Tue Mar 30 12:38:47 +0000 2021|A few months ago, I tweeted that I opposed making COVID vaccines mandatory. I said that everyone had the right to g… https://t.co/q2G76nRdM4|en|R|3|40
1376693612470267905|240393970|Tue Mar 30 00:31:49 +0000 2021|At what point does the Biden border crisis constitute an invasion under Article IV Section 4 of the United States Constitution?|en|R|128|364
1376562686184554507|240393970|Mon Mar 29 15:51:34 +0000 2021|.@JackPosobiec this story never got the level of attention that it deserved. Imagine what the media would do if a R… https://t.co/i2KSCzLP3a|en|R|325|1036
1375594956983795715|240393970|Fri Mar 26 23:46:09 +0000 2021|"Woke Logic

2020, Trump is President: The filibuster is needed to protect democracy!

2021, Biden is President: The filibuster is racist!"|en|R|201|518
1375171001563156488|240393970|Thu Mar 25 19:41:30 +0000 2021|.@RealCandaceO I mentioned your situation to Twitter's CEO directly during today's hearing. I'm so sorry they would… https://t.co/pFvchzpl0t|en|R|520|7496
1375091559075569670|240393970|Thu Mar 25 14:25:50 +0000 2021|"Only in Bizarro World would it acceptable to tax hard working Americans (or borrow trillions from them) to give ""fr… https://t.co/nGcXXDTeoi"|en|R|24|92
1374804253617819648|240393970|Wed Mar 24 19:24:11 +0000 2021|Oh our VP that just yesterday laughed when asked about going to visit the border? Interesting.… https://t.co/JNgqySpulN|en|R|9|31
1374698951199358980|240393970|Wed Mar 24 12:25:45 +0000 2021|A firearm is a tool that can be used for good or for evil, just like any device made by man. If you want to talk ab… https://t.co/2F2TlWd73w|en|R|17|62
1374697046809178113|240393970|Wed Mar 24 12:18:11 +0000 2021|You are out to take our guns. You're trying to ban the purchase of the most popular guns in America &amp; set up a regi… https://t.co/s2ISuzG7q4|en|R|15|52
1374455906046406672|240393970|Tue Mar 23 20:19:58 +0000 2021|For the folks asking what Republicans in Congress are doing to help solve the Biden Border Crisis ⬇️… https://t.co/Rtlz1V7j47|en|R|7|14
1374411933315571737|240393970|Tue Mar 23 17:25:14 +0000 2021|This is a good reminder that not only did @JoeBiden eliminate Donald Trump's programs to keep our southern border s… https://t.co/YVZLm14EBq|en|R|23|40
1374395326514098180|240393970|Tue Mar 23 16:19:15 +0000 2021|Pelosi flew in a COVID positive Member of Congress to vote for her for Speaker. Don't blame this on the Sergeant at… https://t.co/QlnkQDL7Db|en|R|7|20
1374393244239294470|240393970|Tue Mar 23 16:10:59 +0000 2021|Petty describes Nancy Pelosi perfectly. https://t.co/QhP4vdDisu|en|R|4|29
1374336621244514315|240393970|Tue Mar 23 12:25:59 +0000 2021|.@JoeBiden, I know you have no interest in going to the border to see the crisis you created. But perhaps someone o… https://t.co/Gb4uPZKp6d|en|R|65|176
1374152436676460545|240393970|Tue Mar 23 00:14:06 +0000 2021|Republicans are going to investigate the hell out of the Biden Administration when we take back the House next year… https://t.co/tP0HAELmm1|en|R|129|641
1374146739100344327|240393970|Mon Mar 22 23:51:27 +0000 2021|"Between Jan '19-Jan '21 there were 71,036 asylum cases filed from Mexico, through Trump's ""remain in Mexico policy.… https://t.co/oSEnXj07Tz"|en|R|15|32
1374060605389295619|240393970|Mon Mar 22 18:09:11 +0000 2021|If only there was some kind of agreement with Mexico, where people requesting asylum in the United States could wai… https://t.co/n8Aiz6BRyb|en|R|12|44
1374018809154129922|240393970|Mon Mar 22 15:23:06 +0000 2021|"Where's ""the Squad?!?!"" Apparently their feigned outrage over ""kids in cages"" stemmed more from their hatred of Don… https://t.co/5yMYEnPYs6"|en|R|8|21
1374017428263477254|240393970|Mon Mar 22 15:17:37 +0000 2021|For those of you who missed the @MichelleObama reference. https://t.co/vX2XaNcbYD https://t.co/OxCsyIJa8r|en|R|14|12
1373980419876663300|240393970|Mon Mar 22 12:50:34 +0000 2021|"""Kids in cages."" I wonder if @MichelleObama will be making a public address like she did at the DNC to condemn the… https://t.co/U5Va3r3qUC"|en|R|16|42
1373636232912191489|240393970|Sun Mar 21 14:02:53 +0000 2021|"Thank you for raising this point @newtgingrich. I offered an amendment to the $1.9 trillion ""COVID relief"" bill tha… https://t.co/5GpJhRKEAZ"|en|R|8|27
1372960613723426824|240393970|Fri Mar 19 17:18:13 +0000 2021|.@RandPaul is a doctor. So is Fauci. If this exchange was taking place anywhere other than a Senate hearing, I'm no… https://t.co/gXIoA7hzSt|en|R|15|33
1372956330366017536|240393970|Fri Mar 19 17:01:12 +0000 2021|We need an adult in the room like @mikepompeo. https://t.co/AryEXCbtqN|en|R|8|15
1372947677021868032|240393970|Fri Mar 19 16:26:48 +0000 2021|Budget Chairman John Yarmuth arguing on the House floor that debt has no meaning. How the heck does someone like th… https://t.co/map8MUYv5O|en|R|49|85
1372673953978855425|240393970|Thu Mar 18 22:19:08 +0000 2021|There's a crisis on our southern border. Where is our President?|en|R|81|430
1372610471891763206|240393970|Thu Mar 18 18:06:53 +0000 2021|Despite the worsening #BidenBorderCrisis, House Dems are bringing two amnesty bills to the floor today. President B… https://t.co/MbD6fxG78B|en|R|11|46
1372516683219406850|240393970|Thu Mar 18 11:54:12 +0000 2021|I fully recognize that Russia attempted to interfere with our elections. It's a debunked conspiracy theory that the… https://t.co/VXKKDnLruI|en|R|21|101
1372515590502498307|240393970|Thu Mar 18 11:49:51 +0000 2021|Be on the lookout for severe weather today! https://t.co/IRxH5dwKDX|en|R|1|4
1372362576710017032|240393970|Thu Mar 18 01:41:50 +0000 2021|It's called placing a check on power, and ensuring that government is accountable to the people. It was a top conce… https://t.co/BU2yMfFoKo|en|R|1|10
1372361681444204544|240393970|Thu Mar 18 01:38:16 +0000 2021|What do they have to hide? https://t.co/wjmfaedrmp|en|R|6|32
1372358390073163780|240393970|Thu Mar 18 01:25:12 +0000 2021|Another blue check pushing out debunked conspiracy theories. @Jack allows this &amp; worse, yet kicks Trump off of the… https://t.co/aGZRYpDPMw|en|R|11|47
1372306210591027201|240393970|Wed Mar 17 21:57:51 +0000 2021|"Just wondering when Democrats will go to the border to see the ""kids in cages""..."|en|R|94|333
1372291783493877761|240393970|Wed Mar 17 21:00:31 +0000 2021|Filed an amendment to H.R. 1868 that would remove $494 billion in funding unrelated to COVID-19 that was included i… https://t.co/dPwvwklbUd|en|R|4|15
1372181162010013704|240393970|Wed Mar 17 13:40:57 +0000 2021|Proud to reintroduce the Modernize Nuclear Reactor Environmental Reviews Act this Congress! My bill would streamlin… https://t.co/kGqOP5OOSL|en|R|4|13
1371914047671648257|240393970|Tue Mar 16 19:59:32 +0000 2021|What's factually inaccurate about this? Pres Trump spent 4 years establishing policies to better secure the border.… https://t.co/wwy8WrUxq0|en|R|9|18
1371556049480728582|240393970|Mon Mar 15 20:16:59 +0000 2021|President Biden’s weak immigration policies created the current crisis at our southern border. Remember, within wee… https://t.co/7vR1O7sttM|en|R|26|70
1370475356470272012|240393970|Fri Mar 12 20:42:41 +0000 2021|.@TheJusticeDept @FBI Where are the arrests for this? And I'm assuming these people will also be held without bail,… https://t.co/iL4gGgkDri|en|R|46|90
1370407916310818817|240393970|Fri Mar 12 16:14:42 +0000 2021|As an avid sportsman and gun owner, I experience hearing loss due to a lifetime of firearm noise just from doing wh… https://t.co/buDlrKS7vF|en|R|7|22
1370114971607166987|240393970|Thu Mar 11 20:50:39 +0000 2021|Led a letter to CBP &amp; ICE requesting answers to the many troubling reports on illegal immigrants infected with COVI… https://t.co/enaiEUz8XF|en|R|16|40
1370101094450409475|240393970|Thu Mar 11 19:55:30 +0000 2021|"Why should we trust a government that fences itself in for ""protection,"" while in the same breath says fences don't… https://t.co/d5fDxkgfvT"|en|R|33|138
1370054933979004930|240393970|Thu Mar 11 16:52:05 +0000 2021|HR 8 &amp; HR 1446 are an assault on our 2nd Amendment liberties. These bills would not improve background checks &amp; wou… https://t.co/CzWL9BgfeX|en|R|11|41
1369996947793313793|240393970|Thu Mar 11 13:01:40 +0000 2021|One of the negative consequences of the $1.9 trillion Pelosi pay off bill that was not talked about enough is infla… https://t.co/2dy1guaoVh|en|R|42|94
1369766289649074180|240393970|Wed Mar 10 21:45:07 +0000 2021|H.R. 1319 is not a rescue plan in any way shape or form. This bill is a wish list of progressive priorities that ar… https://t.co/fk8thqe5T1|en|R|7|22
1369632290507218945|240393970|Wed Mar 10 12:52:39 +0000 2021|Since Joe Biden took office, avg gas prices have risen by 24% or $0.54 a gallon. The avg price per gallon is expect… https://t.co/z9juFS5e59|en|R|45|99
1369622860101206024|240393970|Wed Mar 10 12:15:10 +0000 2021|As a company, @Disney has been complicit with human rights abuses and modern day slavery. They don't have the moral… https://t.co/Tp7B1iJVhV|en|R|7|19
1369620181656481798|240393970|Wed Mar 10 12:04:32 +0000 2021|Despite @Disney's public claims, they are in fact a very liberal company that has consistently held those with cons… https://t.co/Ghsu1eRG2H|en|R|3|24
1369474546634461185|240393970|Wed Mar 10 02:25:50 +0000 2021|So sad to learn of Sally's passing. When I was first elected to Congress, she was one of the volunteers who helped… https://t.co/V44DkHch1n|en|R|4|19
1369309334258204684|240393970|Tue Mar 09 15:29:20 +0000 2021|Proud to join @michaelcburgess on this effort. The American people deserve answers on why President Biden continues… https://t.co/q1bN4aW2WO|en|R|4|15
1369301951444312071|240393970|Tue Mar 09 15:00:00 +0000 2021|"Reminder, I filed an amendment to the ""covid relief"" bill with the rules committee that would have required all ill… https://t.co/ryWntLShQB"|en|R|7|19
1367992611047346178|240393970|Sat Mar 06 00:17:09 +0000 2021|"Morning Consult did NOT mention...

-The Pelosi Tunnel &amp; Schumer Bridge
-School funding not tied to reopening
-spec… https://t.co/8iBpzN6PsW"|en|R|9|23
1367986423954079755|240393970|Fri Mar 05 23:52:34 +0000 2021|Joe Biden created this crisis. He created this with his policies and his rhetoric. https://t.co/zZduSYMvHe|en|R|16|54
1367940230750343168|240393970|Fri Mar 05 20:49:00 +0000 2021|"Has Jen Psaki and the WH ever actually ""circled back"" on anything?"|en|R|6|109
1367205137652006919|240393970|Wed Mar 03 20:08:00 +0000 2021|I'm not worried about prison breaks, @SMKleinman. I'm worried about making our communities targets for terrorist at… https://t.co/idAmFxrBlo|en|R|2|2
1367185048110260224|240393970|Wed Mar 03 18:48:11 +0000 2021|The idea of releasing illegal immigrants who have tested positive for COVID-19 into our country while making Americ… https://t.co/6PURCsudOh|en|R|15|31
1366775533841903617|240393970|Tue Mar 02 15:40:55 +0000 2021|"H.R. 1 would NOT restore public confidence in our elections. It would simply put the 2020 election on repeat. 

https://t.co/Hfsu6I7vPr"|en|R|6|20
1366377708767346690|240393970|Mon Mar 01 13:20:06 +0000 2021|"House Dems voted for:

 - $1,400/week, for 15 weeks to fed employees with children remote learning, but $0 for all… https://t.co/0FLwDuNIsU"|en|R|63|81
1365673069524697091|240393970|Sat Feb 27 14:40:07 +0000 2021|"House Democrats passed their $1.9T ""COVID relief"" bill without any Republican support. Let’s be clear- this is not… https://t.co/rNynGpNmxj"|en|R|46|64
1365494302256865281|240393970|Sat Feb 27 02:49:45 +0000 2021|The largest spending bill in US history is going to be voted on in the dark of night. How is that for transparency?|en|R|887|2006
1365450855567228932|240393970|Fri Feb 26 23:57:07 +0000 2021|The Dems won’t commit to ensuring the education funding in their “COVID relief” bill is tied to reopening schools a… https://t.co/uEtle11LuM|en|R|11|39
1365409585079681030|240393970|Fri Feb 26 21:13:07 +0000 2021|Another reason to oppose the “COVID-19 relief” bill – It could cause $36 billion in cuts to the Medicare Program to… https://t.co/ngcwumk98E|en|R|12|18
1365390029913264131|240393970|Fri Feb 26 19:55:25 +0000 2021|The Democrats $1.9 trillion bill is not a “COVID-19 relief and rescue” plan, it’s a payoff for progressives. Period… https://t.co/eENCHLXMXC|en|R|142|311
1365378783520448512|240393970|Fri Feb 26 19:10:44 +0000 2021|Thank you @RepDLesko for being a champion for the people! https://t.co/KPFKU5gdS1|en|R|8|9
