id|user|created_at|text|lang|label|retweet_count|favorite_count
1290277676310122496|240393970|Mon Aug 03 13:25:44 +0000 2020|Agree/disagree: If your home or business is threatened &amp; the police say they're unavailable (stand down orders/defu… https://t.co/W2e4OK0pTK|en|R|7|11
1289909309908738050|240393970|Sun Aug 02 13:01:59 +0000 2020|Someone give this grandma a medal! https://t.co/RW2poAP7eX|en|R|5|17
1288516924268253189|240393970|Wed Jul 29 16:49:08 +0000 2020|common sense https://t.co/IpELziHFiM|fr|R|3|8
1287773379299364864|240393970|Mon Jul 27 15:34:33 +0000 2020|"Has anyone asked @RepJerryNadler if the Seattle violence is a ""myth"" as well? 🤔 https://t.co/ePteiX7MeS"|en|R|27|61
1286718263666384897|240393970|Fri Jul 24 17:41:54 +0000 2020|Rant over. Fix it @LeaderHoyer @SpeakerPelosi. https://t.co/HrvBRiC10R https://t.co/xceQl8Su8H|en|R|4|5
1286717172157489156|240393970|Fri Jul 24 17:37:34 +0000 2020|The greatest country in the history of the world should have a better process for conducting legislative work than… https://t.co/OFtmUdQ2Zz|en|R|32|49
1286715779078148099|240393970|Fri Jul 24 17:32:02 +0000 2020|A Member of Congress isn't more important than a police officer, a farmer, a trucker, or a grocery store clerk. If… https://t.co/29LQhFCtfn|en|R|22|50
1286715264386596865|240393970|Fri Jul 24 17:29:59 +0000 2020|Furthermore, there have been multiple times this week where votes have been held open for long amounts of times, so… https://t.co/dIc4NoFSjU|en|R|4|11
1286714970152067077|240393970|Fri Jul 24 17:28:49 +0000 2020|The House has been in session for 5 days, and we only managed to complete (at most) a day and a half of work. This… https://t.co/GqqjcVwzF7|en|R|3|10
1286714543717208065|240393970|Fri Jul 24 17:27:07 +0000 2020|This week the House conducted a series of votes that under normal rules would have took just 27 minutes to complete… https://t.co/1M5yiY2XnN|en|R|2|9
1286714178603032576|240393970|Fri Jul 24 17:25:40 +0000 2020|It may not be festivus, but it's time to air some grievances|en|R|2|19
1286353084516569088|240393970|Thu Jul 23 17:30:49 +0000 2020|Are you a small business owner? Does your business need relief from COVID-19? There is still money available in the… https://t.co/qVRlu69ouX|en|R|10|21
1286058740060434432|240393970|Wed Jul 22 22:01:12 +0000 2020|Delaying support and flexibility to South Carolina's most vulnerable students during a pandemic is a low blow. The… https://t.co/W0eHoBCdiz|en|R|2|26
1285573131646705672|240393970|Tue Jul 21 13:51:34 +0000 2020|There's this strange notion that I should be grateful that folks are choosing to kneel during the anthem instead of… https://t.co/3HHEQjnVmg|en|R|36|131
1285243711610400769|240393970|Mon Jul 20 16:02:34 +0000 2020|.@LeaderHoyer so let me get this straight. First your party wants to take away our guns and our right to defend our… https://t.co/eZKEo7nsPA|en|R|93|221
1285242474768797696|240393970|Mon Jul 20 15:57:39 +0000 2020|And what about the congressional response to local government inaction in Portland??? @LeaderHoyer are you content… https://t.co/dMV1C6pk84|en|R|3|6
1285240143713099776|240393970|Mon Jul 20 15:48:23 +0000 2020|Truth https://t.co/TzmNUQqfTQ|en|R|3|11
1284501555161583619|240393970|Sat Jul 18 14:53:30 +0000 2020|Very sad to learn of the passing of my colleague John Lewis. Congressman Lewis fought every day to make our country… https://t.co/aRTL5ssGh8|en|R|2|25
1284225779149213704|240393970|Fri Jul 17 20:37:40 +0000 2020|Encouraging news for SC! The number of South Carolinians working increased by 105,000 last month and our unemployme… https://t.co/NNyX549d5d|en|R|4|8
1283872718220341250|240393970|Thu Jul 16 21:14:43 +0000 2020|NEPA modernization will mitigate legal uncertainty surrounding infrastructure projects, expedite project permitting… https://t.co/cy6uvb4AT8|en|R|2|3
1282706797518782465|240393970|Mon Jul 13 16:01:46 +0000 2020|Democrats are clearly at the mercy of the mobs because they’re too scared to speak out against them! Thankfully we… https://t.co/AZWaLBedu9|en|R|9|17
1281961297547010048|240393970|Sat Jul 11 14:39:25 +0000 2020|"""An appeaser is one who feeds a crocodile — hoping it will eat him last."" We can't give in to these Marxist demands… https://t.co/ANumw4DR9W"|en|R|86|219
1281922647207665664|240393970|Sat Jul 11 12:05:50 +0000 2020|Great news! @realDonaldTrump has DENIED Minnesota's disaster request to repair half a billion dollars in damage fro… https://t.co/47qqdeIhy9|en|R|16843|57072
1281766068311252997|240393970|Sat Jul 11 01:43:39 +0000 2020|Before the Marxists were calling to defund the police, they wanted to defund ICE. https://t.co/6gDpOnKKxr|en|R|80|168
1281645815300145152|240393970|Fri Jul 10 17:45:48 +0000 2020|Cancel culture at its worst. We can't even talk to each other anymore? https://t.co/o54DJfpik8|en|R|27|95
1280858399241129984|240393970|Wed Jul 08 13:36:54 +0000 2020|The Paycheck Protection Program (PPP) has been extended! The Small Business Administration is now accepting new app… https://t.co/U2aoRL4Lig|en|R|24|67
1280248237983662080|240393970|Mon Jul 06 21:12:20 +0000 2020|"https://t.co/dbKWodupY8

Glad to see the ban on robocalls to cell phones was upheld! Justice Kavanaugh noted “Ameri… https://t.co/di7KGIQ1lb"|en|R|6|31
1280221519642349572|240393970|Mon Jul 06 19:26:10 +0000 2020|Strongly support this effort. No one wants to see litter detract from the beauty of our state. Be responsible!… https://t.co/GuRQKCNrXe|en|R|1|7
1279481515466989571|240393970|Sat Jul 04 18:25:39 +0000 2020|https://t.co/h7rqnPOIOH https://t.co/74SBGsQyOb|und|R|1|14
1279400910200979456|240393970|Sat Jul 04 13:05:21 +0000 2020|"""We hold these truths to be self-evident, that all men are created equal, that they are endowed by their Creator wi… https://t.co/EaWhX9k6bx"|en|R|19|94
1279153992292020224|240393970|Fri Jul 03 20:44:11 +0000 2020|Another GREAT jobs report – the economy added 4.8 million jobs in June. The great American comeback is underway fol… https://t.co/C3NpiEmCl7|en|R|3|19
1278820086053298178|240393970|Thu Jul 02 22:37:22 +0000 2020|Fantastic news. Can't wait for more of these folks to rot in prison. https://t.co/tqyLJKw6xi|en|R|29|129
1278498373058863108|240393970|Thu Jul 02 01:19:00 +0000 2020|The Marxists are coming... https://t.co/Q44rZ4R4Xt|en|R|5|26
1278486555896745990|240393970|Thu Jul 02 00:32:02 +0000 2020|The SC delegation is working together in unison to offer solutions to expand broadband access for all South Carolin… https://t.co/uR6Z8XESgi|en|R|3|12
1278427442189930501|240393970|Wed Jul 01 20:37:08 +0000 2020|USMCA goes into effect today. This is a huge win for the US. The deal will create over 170,000 new American jobs, e… https://t.co/v6y09VySt4|en|R|5|20
1278378678968365057|240393970|Wed Jul 01 17:23:22 +0000 2020|I’ve long supported the deployment of new broadband infrastructure projects, especially in rural areas. My bill, H.… https://t.co/qhJQ0HRU0P|en|R|3|8
1278293521968046080|240393970|Wed Jul 01 11:44:59 +0000 2020|Any city or state that defunds the police ought to immediately allow concealed carry reciprocity. If the government… https://t.co/PdMPtF71lP|en|R|292|937
1277658896501559297|240393970|Mon Jun 29 17:43:13 +0000 2020|Today SCOTUS overturned Louisiana’s pro-life law requiring abortion clinic doctors to have admitting privileges at… https://t.co/sQj45ZEt5x|en|R|5|11
1276293351642411009|240393970|Thu Jun 25 23:17:02 +0000 2020|Strong show of force from @realDonaldTrump outside the Lincoln emancipation statue being targeted by the rioters. P… https://t.co/RuWD6wDmUn|en|R|43|162
1275849178401460226|240393970|Wed Jun 24 17:52:02 +0000 2020|Justice has been served! Now we must hold the Washington bureaucrats who weaponized their positions of power and un… https://t.co/JYt3Gf2zeh|en|R|6|25
1275777891331125254|240393970|Wed Jun 24 13:08:46 +0000 2020|Thank you for announcing your desire to commit a federal crime and replying directly to the US Attorney's Office. https://t.co/g9XWeaXKI0|en|R|5|21
1275776212951064576|240393970|Wed Jun 24 13:02:06 +0000 2020|.@realDonaldTrump says the Federal Government will enforce the Veterans’ Memorial Preservation &amp; Recognition Act of… https://t.co/dmOKEi6Hn4|en|R|19|37
1275548344241344520|240393970|Tue Jun 23 21:56:38 +0000 2020|(1/3) We are no longer dealing with legal peaceful protests, folks. This is organized, criminal activity that’s tak… https://t.co/vPScb7tIgN|en|R|1|21
1275444108245401603|240393970|Tue Jun 23 15:02:26 +0000 2020|Today @HouseCommerce is having a full committee hearing on “Oversight of the Trump Administration’s Response to the… https://t.co/YuuIHq3wsE|en|R|1|0
1275075194432831490|240393970|Mon Jun 22 14:36:30 +0000 2020|We don’t hear enough stories like this. Our officers in blue put their lives on the line every day to keep us safe.… https://t.co/cK0fwuL39b|en|R|3|10
1274818698214334464|240393970|Sun Jun 21 21:37:17 +0000 2020|Happy Father’s Day to all the Fathers out there! Thinking of my Dad today. Being a Dad to my three boys is one of m… https://t.co/2DINHyn0VX|en|R|1|20
1274326451203047424|240393970|Sat Jun 20 13:01:16 +0000 2020|The Communist Cultural Revolution V.2 https://t.co/1UqpPNHJcE|en|R|5|14
1274321104690126848|240393970|Sat Jun 20 12:40:01 +0000 2020|"Lenin is responsible for around 100,000 deaths. But he's a leftist icon! I wouldn't be surprised if the CHAZ ""commu… https://t.co/ZIVbE0s6qE"|en|R|15|38
1274316444960993280|240393970|Sat Jun 20 12:21:30 +0000 2020|This is what I'm talking about! These Marxist inspired movements of rioting and destruction are dangerous! Is this… https://t.co/BWYNRViTxl|en|R|6|20
1274180104319631360|240393970|Sat Jun 20 03:19:44 +0000 2020|Screenshot of the now deleted tweet from a DNC delegate publicly calling for the theft and destruction of governmen… https://t.co/xbbRUItTdG|en|R|25|27
1274175774703210496|240393970|Sat Jun 20 03:02:32 +0000 2020|A DNC delegate publicly calling for the theft and illegal destruction of government property. @DailyCaller @OANN… https://t.co/XxUWOV3kYJ|en|R|4|10
1274077844856016897|240393970|Fri Jun 19 20:33:24 +0000 2020|.@SpeakerPelosi every leader in history, including ourselves, has flaws and imperfections. Every single portrait or… https://t.co/1lcYsfIdnW|en|R|5|8
1274076350865985536|240393970|Fri Jun 19 20:27:27 +0000 2020|.@SpeakerPelosi if policing controversial comments is important to you, then why refuse to discipline current Membe… https://t.co/VAAlnPuJ6r|en|R|9|16
1274075088225210373|240393970|Fri Jun 19 20:22:26 +0000 2020|.@SpeakerPelosi should the Baltimore memorial of your father Thomas D'Alesandro Jr. be removed for his comments con… https://t.co/tV1tE4vyKr|en|R|6|14
1274069564331102208|240393970|Fri Jun 19 20:00:29 +0000 2020|In response to Speaker Pelosi’s actions to remove portraits of certain former Speakers from the Capitol, I'm writin… https://t.co/bCuDONouLs|en|R|9|30
1274059144488681472|240393970|Fri Jun 19 19:19:05 +0000 2020|My friend and colleague @RepRalphNorman fought tirelessly for this project. The 5th District has great leadership i… https://t.co/QfC9hDGOxC|en|R|5|22
1274054832375107590|240393970|Fri Jun 19 19:01:57 +0000 2020|Americans are proud that this Administration fights back against false narratives like this one. This entire exchan… https://t.co/F9nimvRcez|en|R|11|23
1273970870067826689|240393970|Fri Jun 19 13:28:19 +0000 2020|Example #2. Threatening to shutdown the account of a United States Senator because he's saying something that your… https://t.co/BOKShg5oQ6|en|R|2|6
1273969539991158785|240393970|Fri Jun 19 13:23:02 +0000 2020|I'm starting to think that @twitter is purposefully acting in such a way as to force Congress to reexamine Section… https://t.co/wfQ2xJkK0R|en|R|6|34
1273308437204611072|240393970|Wed Jun 17 17:36:03 +0000 2020|Today marks the 5th anniversary of the shooting at Mother Emanuel AME Church in Charleston. It is with heavy hearts… https://t.co/D9IqZQXJtB|en|R|0|7
1273244702486269953|240393970|Wed Jun 17 13:22:47 +0000 2020|Heartbroken to hear of the passing of Congressman Andy Barr’s wife, Carol. Please join me in praying for Andy, his… https://t.co/x7tZfshAm4|en|R|4|23
1273033040692985856|240393970|Tue Jun 16 23:21:43 +0000 2020|“Retail sales shattered already-lofty expectations for May as consumers freed from the coronavirus-induced lockdown… https://t.co/aLbXpOklly|en|R|2|14
1272634314153476106|240393970|Mon Jun 15 20:57:19 +0000 2020|"https://t.co/cUlSukmhNy
Pleased to hear SCOTUS reversed the 4th Circuit's ruling to vacate the Forest Service's Atl… https://t.co/Aa8sqTPg4A"|en|R|4|8
1272618331225325568|240393970|Mon Jun 15 19:53:48 +0000 2020|Thinking of @RepTomRice &amp; his family and praying they recover from COVID-19 as soon as possible. Glad to hear you’r… https://t.co/QcRhahyUJ7|en|R|3|23
1272591115208753153|240393970|Mon Jun 15 18:05:40 +0000 2020|I wish I could say I was surprised. https://t.co/jxi0L5FvGa|en|R|8|47
1271778844572254209|240393970|Sat Jun 13 12:17:59 +0000 2020|America needs football! And college sports aren't just important for morale in America, they're important for the e… https://t.co/LvduzIWDmt|en|R|8|34
1271511829370593283|240393970|Fri Jun 12 18:36:58 +0000 2020|Many of the liberal, Democrat-controlled cities where the rioting took place chose to fiddle while their cities bur… https://t.co/wAGF3BCoUK|en|R|9|26
1271511011753963522|240393970|Fri Jun 12 18:33:43 +0000 2020|Today I sent a letter to Speaker Pelosi saying that no tax dollars should go to any town or city to repair damage f… https://t.co/Xs9wsJhApK|en|R|10|44
1270344691305897985|240393970|Tue Jun 09 13:19:10 +0000 2020|And that ladies and gentlemen, is some high quality Washington BS https://t.co/hXom3bSJHj|en|R|10|54
1270106205889929221|240393970|Mon Jun 08 21:31:31 +0000 2020|FYI South Carolinians voting in the primary tomorrow – the State is facing a shortage of poll workers due to COVID-… https://t.co/dfvmjyqtQU|en|R|6|8
1270048926318682113|240393970|Mon Jun 08 17:43:55 +0000 2020|It’s a sad and scary day in America when we have citizens calling to defund and dismantle the police. This dangerou… https://t.co/hHz7jr0sWr|en|R|7|43
1269390368493178886|240393970|Sat Jun 06 22:07:02 +0000 2020|On June 6, 1944 thousands of Allied troops stormed the beaches of Normandy to liberate Europe &amp; fight for the freed… https://t.co/9WcKPTk8d0|en|R|6|29
1269084178911559687|240393970|Sat Jun 06 01:50:21 +0000 2020|Very legitimate concern https://t.co/okN5HuiVDi|en|R|4|12
1269011985129226241|240393970|Fri Jun 05 21:03:29 +0000 2020|Been notified by the SC National Guard that they were also displaced by the Mayor of DC. If the city of Washington… https://t.co/pC77inNHYh|en|R|39|144
1268890347779825664|240393970|Fri Jun 05 13:00:08 +0000 2020|GREAT NEWS!! The U.S. unemployment rate DROPPED in May. The Labor Department reported this morning that employers A… https://t.co/JSEsgAGxFL|en|R|21|93
1268640481925312512|240393970|Thu Jun 04 20:27:15 +0000 2020|Wow! https://t.co/xAAo6bVqH4|und|R|12|22
1268528706181574657|240393970|Thu Jun 04 13:03:06 +0000 2020|I'm pleased to report that after checking in with the Guard this morning, that none of the 445 SCNG personnel curre… https://t.co/NALrQBE83v|en|R|4|24
1268528379147554816|240393970|Thu Jun 04 13:01:48 +0000 2020|Some good news to report this morning. Yesterday, members of the SC National Guard were called to DC to perform civ… https://t.co/tE3B3fPPTY|en|R|6|29
1268245534864814080|240393970|Wed Jun 03 18:17:53 +0000 2020|My SC colleagues &amp; I sent a bipartisan letter to House &amp; Senate leadership urging them to expand broadband access i… https://t.co/yg09aE2F6C|en|R|4|8
1268159066368430080|240393970|Wed Jun 03 12:34:17 +0000 2020|Stop. The. Violence. https://t.co/zyR3kZ38hT|en|R|10|20
1267799115339051013|240393970|Tue Jun 02 12:43:58 +0000 2020|I would encourage any business who is considering making charitable donations in response to the George Floyd prote… https://t.co/z9J5RUWR0z|en|R|20|61
1266360281707446272|240393970|Fri May 29 13:26:33 +0000 2020|453,560 COVID-19 tests were conducted in the United States yesterday, a new single-day high for testing!|en|R|3|7
1266131909043683330|240393970|Thu May 28 22:19:05 +0000 2020|The House passed the Paycheck Protection Program Flexibility Act today! I proudly supported this legislation &amp; am c… https://t.co/c1ijOeqaNN|en|R|2|9
1266028784160997379|240393970|Thu May 28 15:29:18 +0000 2020|Pandemic Emergency Unemployment Compensation (PEUC) is live for South Carolinians! If you’ve exhausted your regular… https://t.co/irUyojyk8o|en|R|3|2
1265729775227764736|240393970|Wed May 27 19:41:09 +0000 2020|Historic day for the country! #SpaceXDragon https://t.co/ITpzqfnRm7|en|R|5|18
1265671963579756544|240393970|Wed May 27 15:51:25 +0000 2020|This day will go down in history – the first time the House of Representatives has ever had the option to vote by p… https://t.co/5DAdT971p8|en|R|8|35
1265618814173134855|240393970|Wed May 27 12:20:14 +0000 2020|Been keeping this page on my website constantly updated with important COVID19 information. I hope you'll find it u… https://t.co/noUOqUP6fr|en|R|1|3
1265398870802079744|240393970|Tue May 26 21:46:15 +0000 2020|Attn: Farmers &amp; Ranchers – @USDA launched the application for the Coronavirus Food Assistance Program (CFAP) today.… https://t.co/nS43HOoVva|en|R|1|1
1265334018654064644|240393970|Tue May 26 17:28:33 +0000 2020|Introduced new legislation! H.R. 6969, the “TELL” Act – this bill would prevent China and their state-owned entitie… https://t.co/sesf4ZgfWJ|en|R|5|6
1264928486118096896|240393970|Mon May 25 14:37:06 +0000 2020|May we always honor and remember the brave men and women who made the ultimate sacrifice defending our freedoms. We… https://t.co/u6kEbYHWAo|en|R|8|56
1264325207642329091|240393970|Sat May 23 22:39:54 +0000 2020|Happy Birthday South Carolina! It’s an honor to serve the Third District of South Carolina in Congress. #SCPride… https://t.co/9X2dIyS5OD|en|R|3|49
1263902925115531265|240393970|Fri May 22 18:41:54 +0000 2020|Our First Amendment rights don't disappear because of a virus! Every church, synagogue, and House of Worship has th… https://t.co/Dq6OyREXdu|en|R|12|65
1263896214300438529|240393970|Fri May 22 18:15:14 +0000 2020|Our First Amendment rights don't disappear during a pandemic. I'm proud that South Carolina was one of the states t… https://t.co/BPO3L8ZWIS|en|R|6|23
1263597717835509760|240393970|Thu May 21 22:29:07 +0000 2020|It’s #NationalEMSWeek! Thank you to all our #EMS providers for going beyond the call of service, especially during… https://t.co/Uqi2cjZ9ph|en|R|2|6
1263442251633565700|240393970|Thu May 21 12:11:21 +0000 2020|Keep your eyes on the Venezuela/Iran situation. US Sanctions have to mean something. Seems Iran is pushing here in our own neighborhood.|en|R|8|19
1263196087491481605|240393970|Wed May 20 19:53:10 +0000 2020|Not only should they be forced to return the $80 million, but all 37 affiliates should be prosecuted for submitting… https://t.co/aUhPiVxttA|en|R|8|25
1263134060035158018|240393970|Wed May 20 15:46:42 +0000 2020|Appreciate @EPAAWheeler's hard work on this! The proposed rule will provide greater transparency in regulatory guid… https://t.co/fjxyXgqwuL|en|R|1|1
1262853674965098497|240393970|Tue May 19 21:12:33 +0000 2020|Great news from the @StateDept. This is a prime example of how American energy dominance can help other countries b… https://t.co/p22uF1CUSE|en|R|6|10
1262527897098747907|240393970|Mon May 18 23:38:01 +0000 2020|Proud to support this effort. We must do everything in our power to ensure the integrity of our congressional commi… https://t.co/BkVY4psQ4z|en|R|6|18
1261084396439961601|240393970|Fri May 15 00:02:04 +0000 2020|And what's worse, is when that American's private phone conversation, which again was collected by the government w… https://t.co/lvt7MAORzD|en|R|7|18
1261083801880530945|240393970|Thu May 14 23:59:42 +0000 2020|"So the government listens in on an Americans private phone conversation. Their identity is ""masked""/protected becau… https://t.co/TmQADEtIOD"|en|R|5|18
1261047476561248263|240393970|Thu May 14 21:35:22 +0000 2020|Unmasking = spying on American citizens without a warrant, which is a violation of the 4th Amendment. The Obama Adm… https://t.co/LDA8QrK5Yy|en|R|25|98
1260934951500800000|240393970|Thu May 14 14:08:14 +0000 2020|The unmasking &amp; warrantless searches of Trump campaign officials by VP Biden &amp; Obama Admin officials is one of the… https://t.co/wRDFvuV75A|en|R|12|31
1260931533176631299|240393970|Thu May 14 13:54:39 +0000 2020|Our Founding Fathers feared warrantless searches. We now know that VP Biden, Susan Rice, &amp; President Obama's Chief… https://t.co/fyjlvwbcgS|en|R|14|22
1260928763526811648|240393970|Thu May 14 13:43:38 +0000 2020|"This ""proxy voting"" scheme is a threat to the foundation of our Republic! Under this upcoming House rule change, 22… https://t.co/aPBX95BL29"|en|R|5|11
1260591055344480264|240393970|Wed May 13 15:21:42 +0000 2020|Adam Schiff never had any evidence, yet he perpetuated the hoax anyways. It was all a coup attempt to take down… https://t.co/Gb111OOwSX|en|R|12|35
1260582775658332167|240393970|Wed May 13 14:48:48 +0000 2020|Why didn’t Mueller uncover these documents? With how many lawyers on his team? Over a dozen. How many subpoenas iss… https://t.co/tnu08Oo7sf|en|R|15|19
1260582107698601985|240393970|Wed May 13 14:46:09 +0000 2020|#CountMeIn for the 2020 Census! Thank you Lt. Governor @PamelaEvette for putting together this project to support S… https://t.co/rKf1ngYpJs|en|R|1|2
1260564545048850438|240393970|Wed May 13 13:36:22 +0000 2020|Congress shouldn’t redistribute money from hardworking taxpayers around the nation to bailout blue states’ longtime… https://t.co/8tlYMLwKia|en|R|8|18
1260299617671020545|240393970|Tue May 12 20:03:38 +0000 2020|Democrats released their partisan “Phase 4” response bill after negotiations with… oh wait… absolutely no one. The… https://t.co/0OBteLSvWp|en|R|31|43
1260288076296880129|240393970|Tue May 12 19:17:47 +0000 2020|Like the saying goes… “never let a good crisis go to waste.” That’s been Nancy Pelosi’s disgraceful theme during th… https://t.co/vvfvzmTEs9|en|R|93|302
1260262791606304771|240393970|Tue May 12 17:37:18 +0000 2020|“Our Founding Fathers never intended for the federal government to be the behemoth it has become. They didn’t inten… https://t.co/vcvgcGrtSZ|en|R|16|32
1260255342895792135|240393970|Tue May 12 17:07:42 +0000 2020|Proud to cosponsor this legislation. In times of crisis, we can’t take our eye off the ball – we must continue bein… https://t.co/7Rq1DZ76Ej|en|R|5|11
1260247300078809088|240393970|Tue May 12 16:35:45 +0000 2020|.@RichardGrenell &amp; AG Barr have done more to get the truth out than the Mueller investigation ever did! And what di… https://t.co/fZnwlElnqo|en|R|16|39
1260196056886886400|240393970|Tue May 12 13:12:07 +0000 2020|Another critical move to #ReopenAmerica and get our state and nation working once again! Let’s keep it up so we can… https://t.co/K50BHNoPWn|en|R|6|12
1259922242378633218|240393970|Mon May 11 19:04:05 +0000 2020|"In the words of my friend @Jim_Jordan...""We were right about everything."" 

People have to be prosecuted over this!… https://t.co/mivCdwy8R9"|en|R|4|11
1259839263094517764|240393970|Mon May 11 13:34:21 +0000 2020|Proud to receive the Award for Conservative Excellence from @ACUConservative by fighting for conservative values in… https://t.co/QZf4oOfHmc|en|R|1|9
1259833898843938816|240393970|Mon May 11 13:13:02 +0000 2020|Important move by @realDonaldTrump to protect our nation by securing critical electrical infrastructure. Grid secur… https://t.co/krgeO5aIMB|en|R|70|115
1258870087429361680|240393970|Fri May 08 21:23:12 +0000 2020|This is a great start! We need to keep opening up and getting folks back to work! Let's support these businesses an… https://t.co/RrTIeZSnf7|en|R|2|11
1258736478512910336|240393970|Fri May 08 12:32:17 +0000 2020|If the people over at the FBI &amp; DOJ involved in this hit job against President Trump don't go to jail over this, th… https://t.co/UyJClcj93d|en|R|32|96
1258736192968970241|240393970|Fri May 08 12:31:09 +0000 2020|I'm convinced that these nefarious actors decided that that even if they were unsuccessful in fabricating evidence… https://t.co/HvmxqYS6KP|en|R|3|11
1258735856967471105|240393970|Fri May 08 12:29:49 +0000 2020|The extreme Never Trumpism within parts of our government could be the biggest threat to the rule of law &amp; our cons… https://t.co/ySjyu0qsB6|en|R|71|237
1258735726457507840|240393970|Fri May 08 12:29:18 +0000 2020|The more we learn about the conduct of partisan, deep state actors over at the FBI &amp; DOJ, the more it's clear that… https://t.co/puDqq08o7e|en|R|10|16
1258493947397263361|240393970|Thu May 07 20:28:33 +0000 2020|We’ve got to get back on track and get our economy humming once again. @realDonaldTrump is right – it’s time to re-… https://t.co/7ysD0COP8I|en|R|3|7
1258492760736366593|240393970|Thu May 07 20:23:50 +0000 2020|Found the @NRFnews resources on “Operation Open Doors” to be great information for retailers as we urgently begin t… https://t.co/fgKNchjAKs|en|R|1|2
1258451908219543557|240393970|Thu May 07 17:41:30 +0000 2020|This is an important project that will be awesome for the Historic Newry Mill district! Can’t wait to see the progr… https://t.co/yws1J2pjxF|en|R|1|1
1258445863824826372|240393970|Thu May 07 17:17:29 +0000 2020|"I wrote the AG with concern over media reports of DOJ ""suspending"" a variety of constitutional protections. Not onl… https://t.co/ixPDDU96xX"|en|R|3|6
