id|user|created_at|text|lang|label|retweet_count|favorite_count
1520133616222838785|1080574793630527505|Fri Apr 29 20:11:11 +0000 2022|See below for my statement following the Biden administration’s creation of a “Disinformation Governance Board” within the Department of Homeland Security. https://t.co/4SOAX2bAOh|en|R|8|13
1519689528541339648|1080574793630527505|Thu Apr 28 14:46:32 +0000 2022|"While small businesses battle soaring inflation, rising energy costs, and labor shortages the Biden admin's SBA is discussing becoming a ""voter agency"" and dedicating millions of dollars to climate change.

The SBA must refocus on its mission to advocate for our small businesses. https://t.co/A1jkuEkBLP"|en|R|7|10
1519435140635807744|1080574793630527505|Wed Apr 27 21:55:41 +0000 2022|"The Biden admin’s complete disregard for their obligation to secure our border is having harmful impacts on Pennsylvanians and all Americans.

Title 42 must remain in place, and this administration owes the American people a real plan to secure our border. https://t.co/RhN7N8CEmo"|en|R|7|23
1518632172999135232|1080574793630527505|Mon Apr 25 16:44:59 +0000 2022|"The Biden Administration has shown a complete disregard for its obligation to secure our border.

Today I joined my @HouseGOP colleagues in calling on @SecMayorkas to reverse the Biden Admin's disastrous immigration policies and secure our southern border.
https://t.co/3t5dIUGTbE"|en|R|36|113
1517600249866563589|1080574793630527505|Fri Apr 22 20:24:29 +0000 2022|"Yesterday I visited small businesses in Lebanon City with Sen. Chris Gebhard, Commissioner Michael Kuhn, Commissioner Bob Phillips, and Mayor Sherry Capello. 

Small businesses contribute tremendously to our communities and I always value the opportunity to visit with them. https://t.co/vMqCprJ5k3"|en|R|3|12
1517174226326892546|1080574793630527505|Thu Apr 21 16:11:37 +0000 2022|I joined @MorningsMaria this morning to discuss the Russian invasion of Ukraine and the Biden administration's efforts to lift Title 42, which will only worsen their southern border crisis. Check out my full interview: https://t.co/wT4KmFYyPO|en|R|2|3
1517084672991404032|1080574793630527505|Thu Apr 21 10:15:46 +0000 2022|TUNE IN: I’ll be joining @MorningsMaria at 6:20AM!|en|R|2|10
1516513199658606592|1080574793630527505|Tue Apr 19 20:24:56 +0000 2022|🚨Calling all PA-09 high school students: The 2022 Congressional Art Competition is now open for submissions! I encourage all high school students who enjoy art to submit a piece of artwork. https://t.co/Cl5ZrRQIoW|en|R|4|4
1515041762611449859|1080574793630527505|Fri Apr 15 18:57:58 +0000 2022|Shelley and I, and our entire congressional team, wish everyone a  reflective Passover and Good Friday. May God Bless your families and the United States of America 🇺🇸 🙏 https://t.co/GRYJ7ppcmB|en|R|1|9
1514998773348503556|1080574793630527505|Fri Apr 15 16:07:09 +0000 2022|I was informed that Vladimir Putin banned me for life from Russia. My initial response is that it should be rephrased. I’m banned for Putin’s life because the day will come when Russia will be free of Putin and he will go down in history in the category of Stalin and Hitler.|en|R|12|56
1514254069287772174|1080574793630527505|Wed Apr 13 14:47:58 +0000 2022|"After months of government-mandated lockdowns, studies have shown states that instituted prolonged lockdowns crippled their economies and education systems with little to no health benefits.

Now, Americans are voting with their feet and leaving Democrat-run cities and states. https://t.co/IjgQdp0S1M"|en|R|4|8
1513879358162845700|1080574793630527505|Tue Apr 12 13:59:00 +0000 2022|"Inflation rose at 8.6% last month and is estimated to cost the average American family an additional $5,000 this year.

Inflation is a tax on every American. Our families and small businesses can no longer afford Democrats' reckless government spending.
https://t.co/ii9ly6TSrz"|en|R|2|6
1512501561913663488|1080574793630527505|Fri Apr 08 18:44:07 +0000 2022|The Biden administration has crippled America's domestic energy production and is seeking to replace it with energy from adversaries such as Venezuela and Iran. They are choosing Venezuela over Pennsylvania, Tehran over Texas, and Moscow over Midland.|en|R|2|16
1512081748577857542|1080574793630527505|Thu Apr 07 14:55:56 +0000 2022|"I joined my @HouseForeignGOP colleagues to urge the Biden Administration not to rush to a new Iran nuclear deal offering concessions that will enrich our adversaries, endanger our allies &amp; cost America dearly.

This deal was misguided 7 years ago. It’s downright dangerous today. https://t.co/hwCoGrblF1"|en|R|14|27
1511804445952196624|1080574793630527505|Wed Apr 06 20:34:02 +0000 2022|Today, House Democrats denied my request to consider the PAUSE Act which would prevent the Biden administration from ending Title 42. Rather than secure our border, Democrats are ending the last remaining policy to deter illegal immigration. https://t.co/Xx53irmsrC|en|R|60|111
1511471202560356357|1080574793630527505|Tue Apr 05 22:29:51 +0000 2022|"I joined 51 of my GOP colleagues in calling on the Biden admin to reverse their disastrous decision to rescind Title 42.

We already have an unprecedented surge of illegal immigration &amp; drugs at our border. Ending Title 42 will only exacerbate this crisis. https://t.co/lJgrcObeZp"|en|R|2|10
1511371593817206793|1080574793630527505|Tue Apr 05 15:54:02 +0000 2022|Last night, I spoke on the House floor honoring Lt. William Lebo, a 40 year veteran of the Lebanon City Police Department, who was killed in the line of duty last week. Lt. Lebo was a calm, kind &amp; ethical police officer who was deeply devoted to protecting the Lebanon community. https://t.co/VPpHu9PCwU|en|R|1|3
1511086657633722369|1080574793630527505|Mon Apr 04 21:01:48 +0000 2022|"I joined Speaker @newtgingrich's podcast to discuss my bill that would bring transparency to the immigration crisis the Biden admin has created &amp; the practice of flying thousands of immigrants around the country without notice to state &amp; local officials.
https://t.co/IYbZfRbKoN"|en|R|1|0
1510002961967198212|1080574793630527505|Fri Apr 01 21:15:35 +0000 2022|Happy to join my Small Business Committee colleague @RepDavids for a friendly wager on tomorrow's Final Four game as the Villanova Wildcats take on the KU Jayhawks! #GoNova https://t.co/G8qKOBYJDF|en|R|1|7
1510001539624189952|1080574793630527505|Fri Apr 01 21:09:56 +0000 2022|"Despite illegal border crossings reaching records highs, the Biden admin has announced they will end the effective Title 42 policy.

This decision sends a further message that America's borders are wide open and will only entice more illegal immigration.
https://t.co/yOlAepyEoN"|en|R|4|1
1509953319866929156|1080574793630527505|Fri Apr 01 17:58:19 +0000 2022|"The Biden Administration continues to choose Venezuela over Pennsylvania, Tehran over Texas, and OPEC over Oklahoma in an attempt to solve their self-inflicted energy crisis. 

They continue to ignore the most obvious solution; unleashing America's domestic energy production. https://t.co/EhEBwtw535"|en|R|4|7
1509892853383712773|1080574793630527505|Fri Apr 01 13:58:03 +0000 2022|TUNE IN: I’ll be joining @Varneyco on @FoxBusiness at 10:15am!|en|R|1|0
1509701913931038722|1080574793630527505|Fri Apr 01 01:19:19 +0000 2022|I received the awful news tonight that two police officers were shot and one was tragically killed responding to a domestic disturbance in Lebanon County. May god bless these officers and their families.|en|R|3|16
1509666863726448652|1080574793630527505|Thu Mar 31 23:00:03 +0000 2022|"The Biden administration is rushing to cut another nuclear deal with Iran, offering concessions that will enrich our adversaries, endanger our allies, and cost America dearly.

A nuclear deal with Iran was misguided 7 years ago, it is downright dangerous today. https://t.co/Etz89h4drR"|en|R|7|17
1509653883471151104|1080574793630527505|Thu Mar 31 22:08:28 +0000 2022|Happy to work with @RepBethVanDuyne to reduce the regulatory burden on small businesses by cosponsoring her Small Business Regulatory Reduction Act. https://t.co/7rbl4s6P9J|en|R|2|6
1509199372709470212|1080574793630527505|Wed Mar 30 16:02:24 +0000 2022|"Record levels of inflation will cost the average American family an extra $5,200 this year.

Americans can't afford the Biden administration's reckless spending policies.
https://t.co/MjVkiNJtvp"|en|R|4|14
1508808153168764929|1080574793630527505|Tue Mar 29 14:07:50 +0000 2022|"Tune in now to my @HSBCgop hearing where we will discuss the importance of community lending and the 504 Loan Program, a successful public private partnership that drives economic development in our communities. 
https://t.co/PFMM1VCBIG"|en|R|2|2
1508231433063739394|1080574793630527505|Sun Mar 27 23:56:09 +0000 2022|TUNE IN: I will be joining @RJHarrisWHP580 live at 7:35am tomorrow morning!|en|R|2|3
1508087987661381633|1080574793630527505|Sun Mar 27 14:26:09 +0000 2022|TUNE IN: I'll be joining Volpe Report this morning at 10:30am on Fox 56.|en|R|1|2
1506668373131907072|1080574793630527505|Wed Mar 23 16:25:07 +0000 2022|Yesterday I joined with community stakeholders to celebrate $2 million in Community Project Funds secured for @AlverniaU's new Pottsville College Towne project. This funding will be used to advance Alvernia's satellite campus relocation and expansion into Pottsville. https://t.co/KOceaBxqGX|en|R|4|9
1506361270227939334|1080574793630527505|Tue Mar 22 20:04:48 +0000 2022|"Happy #NationalAgricultureDay to all of the hardworking farmers across the Commonwealth and the nation.

Pennsylvania has a strong agricultural heritage and PA farmers continue to supply the nation and the world with high-quality agricultural products every day. #ThankAFarmer https://t.co/beinJPMsbM"|en|R|0|11
1506321904168222727|1080574793630527505|Tue Mar 22 17:28:22 +0000 2022|"The rise in energy costs is due to the Biden administration's continued assault on our domestic energy production.

They're literally choosing Venezuela over Pennsylvania. They're choosing Tehran over Texas. We must choose American energy independence.
https://t.co/B7QZb2jemm"|en|R|20|43
1506202628988063744|1080574793630527505|Tue Mar 22 09:34:25 +0000 2022|TUNE IN: I’ll be joining Mornings with Maria on @FoxBusiness at 6:15AM! @MorningsMaria|en|R|6|16
1505955826560815112|1080574793630527505|Mon Mar 21 17:13:43 +0000 2022|"This morning, PA State Troopers, Martin Mack III and Branden Sisca, were tragically killed in the line of duty. Thousands of police officers wake up every day and make sacrifices to protect and serve their communities. 

https://t.co/Us8WDTIQfb"|en|R|3|12
1505238648589070339|1080574793630527505|Sat Mar 19 17:43:54 +0000 2022|It was with profound sadness I learned of the passing of the great Don Young. The Dean of the House served Alaska with passion for 49 years. He was a friend &amp; wise mentor. His call for order &amp; expedition on the House floor was legendary and will be imitated but never duplicated. https://t.co/nuZkYzHoT5|en|R|5|11
1504827401859182597|1080574793630527505|Fri Mar 18 14:29:45 +0000 2022|"The White House should be using TikTok to inform the Russian people of the truth rather than misinform the American people with their spin. 

https://t.co/koRgMLJoCN"|en|R|4|8
1504596077172957194|1080574793630527505|Thu Mar 17 23:10:33 +0000 2022|I joined Evening Edit on @FoxBusiness to discuss the sanctions crumbling Russia's economy and House Democrats' efforts to block Republican efforts to unleash American energy independence and lower gas prices. https://t.co/g1QNsXV9yv|en|R|1|2
1504589456967450633|1080574793630527505|Thu Mar 17 22:44:15 +0000 2022|"The @WhiteHouse is using TikTok stars to mislead the American people about the cause of rising gas prices.

The Biden Administration should try using social media to share Russian atrocities with the world, not spread lies to Americans.
https://t.co/wIey9LHn1W"|en|R|3|8
1504527788971372546|1080574793630527505|Thu Mar 17 18:39:12 +0000 2022|TUNE IN: I'll be joining @FoxBusiness's @EveningEdit tonight at 6pm!|en|R|1|1
1504524772172042240|1080574793630527505|Thu Mar 17 18:27:13 +0000 2022|"For the third time, Democrats in Congress have voted to block a bill that would support American energy independence.

This bill would repeal the Biden admin's anti-energy policies &amp; increase disposable income of Americans by reducing soaring energy costs.
https://t.co/fNKhiAuDNd"|en|R|1|5
1504236016516927488|1080574793630527505|Wed Mar 16 23:19:48 +0000 2022|Tune in to @wbrewyou tonight to hear me discuss @ZelenskyyUa's address to Congress this morning and the ongoing Russian invasion of Ukraine. https://t.co/C52sQpd69W|en|R|1|3
1504231407211663369|1080574793630527505|Wed Mar 16 23:01:29 +0000 2022|"As fuel prices continue to rise, the Biden Administration continues to blame anybody but themselves for this self-inflicted crisis. 

While the President will tell you it’s “corporate greed” one week, and “Putin’s fault” the next, the numbers tell a different story. Watch more📽️ https://t.co/8nEbrqdgrL"|en|R|18|47
1504155841171275778|1080574793630527505|Wed Mar 16 18:01:13 +0000 2022|President @ZelenskyyUa delivered a powerful message to Congress this morning and again asked for MiG jets to defend Ukraine's skies. The U.S. can and must facilitate the delivery of these planes ASAP.|en|R|3|5
1504113632183033861|1080574793630527505|Wed Mar 16 15:13:29 +0000 2022|"Today we celebrate National #SBDCDay!🎉

PASBDCs are an exceptional public-private partnership between the SBA, PADCED, and 16 PA colleges &amp; universities that provide entrepreneurs and small business owners consulting, training, &amp; resources to help them thrive. @PASmallBusiness https://t.co/c0YK3xUk0b"|en|R|2|2
1504098359702966278|1080574793630527505|Wed Mar 16 14:12:48 +0000 2022|Congress heard a powerful message from President @ZelenskyyUa this morning. His words and the images he presented demonstrate Ukraine’s resilience in the face of a devastating war against innocent people. We must provide every tool we can to help Ukraine defeat Putin’s invasion.|en|R|2|7
1503764529393676292|1080574793630527505|Tue Mar 15 16:06:17 +0000 2022|"I stand with my @ProbSolveCaucus colleagues in urging the Biden Administration to facilitate the transfer of MiG-29 jets to the Ukrainian Air Force amid the ongoing Russian invasion of Ukraine.

We must continue to stand with our ally Ukraine amid this unjust invasion. https://t.co/yqKKt8RPpi"|en|R|4|8
1502343494496665620|1080574793630527505|Fri Mar 11 17:59:35 +0000 2022|"The United States must continue to support Ukraine in every possible way.

For more of my thoughts, see my discussion on @FoxBusiness’s @Varneyco from this morning.

https://t.co/HJZrSYnwNf"|en|R|4|2
1502298304222273537|1080574793630527505|Fri Mar 11 15:00:01 +0000 2022|TUNE IN: I'll be on @FoxBusiness's @Varneyco at 11am EST.|en|R|2|2
1502290199858106378|1080574793630527505|Fri Mar 11 14:27:49 +0000 2022|"The Biden Administration must provide Ukraine with the highest level of weapons and sanctions with the sole goal of a Ukrainian victory.

For more, see my interview on @newsmax’s National Report. https://t.co/B9Soq7R4hD"|en|R|4|6
1502273276621598724|1080574793630527505|Fri Mar 11 13:20:34 +0000 2022|"This morning I joined @ChrisStigall to discuss Biden’s trip to Philadelphia to speak to House Democrats as well foreign policy, domestic energy, and other critical issues America's facing. See the whole interview below.
https://t.co/BLk9mw15Sp"|en|R|1|4
1502268100887994369|1080574793630527505|Fri Mar 11 13:00:00 +0000 2022|TUNE IN: I'll be on @newsmax's National Report at 9am EST.|en|R|1|3
1502245451692531712|1080574793630527505|Fri Mar 11 11:30:00 +0000 2022|TUNE IN: I'll be on the @ChrisStigall Show at 7:30am EST.|en|R|1|2
1502086907194396681|1080574793630527505|Fri Mar 11 01:00:00 +0000 2022|TUNE IN: I'll be on @FoxBusiness's @Varneyco tomorrow at 11am EST.|en|R|1|4
1502079356742426626|1080574793630527505|Fri Mar 11 00:30:00 +0000 2022|TUNE IN: I'll be on the @ChrisStigall Show tomorrow at 7:30am EST.|en|R|2|1
1502056710038458372|1080574793630527505|Thu Mar 10 23:00:01 +0000 2022|TUNE IN: I'll be on @newsmax's National Report tomorrow at 9am EST.|en|R|1|0
1502014894371131397|1080574793630527505|Thu Mar 10 20:13:51 +0000 2022|Thank you to my friend Bill Leandri, one of the men of faith in the Back Mountain Ecumenical Group, for inviting me to speak at their breakfast this morning. We discussed the Russian invasion of Ukraine, American energy, the atmosphere in D.C., and answered members questions. https://t.co/uhsaGqVJgM|en|R|2|5
1501929149786734597|1080574793630527505|Thu Mar 10 14:33:08 +0000 2022|"🚨Inflation rose 7.9% in February, the rate highest since 1982.

Despite their excuses, the Biden admin’s policies have brought on this inflation crisis and as a result Americans are paying much more for everyday goods.

https://t.co/xGNyKsCeSN"|en|R|6|17
1501608133713707008|1080574793630527505|Wed Mar 09 17:17:32 +0000 2022|"It's hard to believe and incredibly irresponsible that Treasury @SecYellen continually refuses to comply with federal law that requires her to testify before @HSBCgop. 

It's simple: Do your job. Follow the law. Show up. https://t.co/FfInJk26cl"|en|R|4|12
1501547081596649475|1080574793630527505|Wed Mar 09 13:14:56 +0000 2022|"“I don’t think we should be worried about being fearful of Putin, I think Putin should be fearful of NATO and the United States.”

For more from my interview on @FoxBusiness Tonight  watch below.

https://t.co/owu9GxeRr5"|en|R|1|3
1501370935252770817|1080574793630527505|Wed Mar 09 01:34:59 +0000 2022|"""Producing oil and gas here at home doesn’t just keep prices low but serves as a strategic global advantage.""

Tonight I spoke on the House floor about the importance of energy American energy independence for our national security. Watch my speech below for more. https://t.co/aJNsWbulBM"|en|R|3|14
1501349700087263232|1080574793630527505|Wed Mar 09 00:10:36 +0000 2022|"During today's @HSBCgop hearing we discussed the Small Business Innovation &amp; Research Program.

This important public-private partnership empowers small business innovation for the benefit of the American people. You can listen to my questioning here: https://t.co/uneeIYuvjR"|en|R|3|2
1501279083262406656|1080574793630527505|Tue Mar 08 19:30:00 +0000 2022|Last week House Democrats unanimously voted against the American Energy Independence from Russia Act, voting to keep America reliant on foreign nations, friend &amp; foe alike, rather than harness our natural resources to become the dominant global producer &amp; exporter of oil &amp; gas.|en|R|0|3
1501271541224337408|1080574793630527505|Tue Mar 08 19:00:02 +0000 2022|"The @EIAgov estimates the US will continue to import more crude oil than we export in 2022.

With a Russian embargo in place we must lower gas prices by increasing domestic production of the cleanest gas any nation has to offer, and revive the Keystone XL Pipeline."|en|R|1|6
1501248037594746886|1080574793630527505|Tue Mar 08 17:26:38 +0000 2022|"The US was a net exporter of oil in 2020, but under Biden we became a net importer in 2021, and remains so today. 

With the Keystone XL Pipeline we would have imported over 100k gallons from Canada, rather than the 70k from Russia we currently import."|en|R|5|14
1501217005948616715|1080574793630527505|Tue Mar 08 15:23:20 +0000 2022|"Today I joined @cspanwj live to discuss the Russian invasion of Ukraine, energy independence, the economy, and more. Watch the full interview below.
https://t.co/AS56AoZ9Dq"|en|R|1|2
1501158286246039556|1080574793630527505|Tue Mar 08 11:30:00 +0000 2022|TUNE IN: I'll be live on @cspan's Washington Journal at 7:30am EST.|en|R|1|5
1500943814269313025|1080574793630527505|Mon Mar 07 21:17:46 +0000 2022|TUNE IN: Tomorrow morning I'll be live on @cspan's Washington Journal at 7:30am EST.|en|R|1|2
1500154855217840130|1080574793630527505|Sat Mar 05 17:02:43 +0000 2022|This morning I joined a bipartisan Congressional briefing with President Zelensky of Ukraine. It’s clear there is bipartisan consensus in the House and Senate to support Ukraine with weapons and impose even tougher sanctions on Putin. Read my full statement below. https://t.co/4i7vUl2JU2|en|R|2|10
1499864410717925379|1080574793630527505|Fri Mar 04 21:48:36 +0000 2022|Meuser Responds To Biden’s Proposed ‘Waters of the United States’ Rule Change https://t.co/bJriBA89sS|en|R|10|11
1499453960494759940|1080574793630527505|Thu Mar 03 18:37:37 +0000 2022|"Today we celebrate our national anthem, which Americans have sung with patriotic fervor since 1814.

I am proud to be an American, and I will always stand and sing to America and Old Glory. https://t.co/BpEbRW0r44"|en|R|3|8
1499134408812548097|1080574793630527505|Wed Mar 02 21:27:50 +0000 2022|"""The American people had hopes that the President would reverse course on his failed far-left agenda. Instead, we heard a speech completely devoid of reality that touted fabricated victories.""

See my full statement on Biden's #SOTU address here. https://t.co/sxamnRDvPJ"|en|R|5|10
1499097066253033481|1080574793630527505|Wed Mar 02 18:59:27 +0000 2022|"Today I questioned the Biden administration on the continued Russian invasion of Ukraine during the @HouseForeignGOP hearing. To hear my remarks visit the link below.

https://t.co/tqJJUhYvjY"|en|R|3|10
1499059942300524544|1080574793630527505|Wed Mar 02 16:31:56 +0000 2022|#SOTU was a State of Denial. In the last 14 months our public safety is at risk, the economy is fractured, we're dependent on foreign energy, small businesses are struggling, and our national security is threatened. POTUS refused to offer viable solutions to address these issues.|en|R|3|9
1499054161660362760|1080574793630527505|Wed Mar 02 16:08:57 +0000 2022|"This is what the Ukrainians in Kyiv are asking for. This is what we must get them today.

I'm questioning Biden's State Department on this in the @HouseForeignGOP hearing today. https://t.co/6xSPhHtYZC"|en|R|7|11
1498757468276596741|1080574793630527505|Tue Mar 01 20:30:00 +0000 2022|I had the opportunity to speak on the Russian invasion of Ukraine on @newsmax’s John Bachman Now today live from Washington ahead of the State of the Union. The Administration and our allies must continue to implement severe sanctions on Russia and support the people of Ukraine. https://t.co/Fss4GuA6vh|en|R|1|4
1498746755726336000|1080574793630527505|Tue Mar 01 19:47:26 +0000 2022|Thank you @HouseGOP for hosting a Media Row in the Capitol today ahead of the State of the Union, where I was able to speak with a variety of reporters during the event about Russia's invasion of Ukraine, the economy, and what to expect from Biden tonight. #SOTUinCrisis https://t.co/JfJndKquUk|en|R|3|4
1498743185690042370|1080574793630527505|Tue Mar 01 19:33:15 +0000 2022|"Big business is not the problem for small business, big government is. The most important role gov't can play is as a catalyst to competition &amp; success among all business.

Today I joined my @HSBCgop colleagues to discuss promoting healthy competition in the American economy. https://t.co/FzdxrRzQet"|en|R|4|3
1498736075812093954|1080574793630527505|Tue Mar 01 19:05:00 +0000 2022|"President Biden needs to restart the Keystone Pipeline project.

American energy independence is national security."|en|R|20|93
1498723493038501892|1080574793630527505|Tue Mar 01 18:15:00 +0000 2022|Under Biden inflation is the worst it’s been since 1982 and is costing the average American over $250 a month. #BidenByTheNumbers https://t.co/jzwaeBORNO|en|R|3|10
1498712169302659078|1080574793630527505|Tue Mar 01 17:30:00 +0000 2022|"Biden is drowning America in energy costs.

Gas prices are at a 7 year high, over $1/gallon compared to last year.

American households are paying $1,000 more on energy than last year.

Meanwhile BBB grants $555b for “environmental justice” with no focus on domestic energy."|en|R|4|13
1498665611748069392|1080574793630527505|Tue Mar 01 14:25:00 +0000 2022|"President Biden’s Build Back Better agenda has done the opposite of what its name suggests. 

Instead of rebuilding the American economy, critical industries like farming are having a significantly more difficult time delivering goods and entering the marketplace."|en|R|2|9
1498658978011795457|1080574793630527505|Tue Mar 01 13:58:38 +0000 2022|"This has become Putin’s war, not Russia’s war. Check out my interview from @VarneyCO yesterday for more of my thoughts on the ongoing Russian invasion of Ukraine.

https://t.co/S9U5Sv3Rgp"|en|R|6|19
1498388787751120901|1080574793630527505|Mon Feb 28 20:05:00 +0000 2022|"Ukraine is putting up an incredible fight against Russia, and we need to support them.

In conjunction with our allies, the USA must continue imposing harsh sanctions on Russia &amp; providing critical security assistance to the Ukrainian people defending their country against Putin."|en|R|1|7
1498349782355619847|1080574793630527505|Mon Feb 28 17:30:00 +0000 2022|Biden promised to solve the supply chain crisis and remove bottlenecks. Instead of delivering on his promise, the supply chain has only gotten worse and cargo ships are stalled waiting further out at sea.|en|R|5|8
1498323356432703492|1080574793630527505|Mon Feb 28 15:45:00 +0000 2022|TUNE IN: I will be live on @Varneyco at 11:15am to discuss the ongoing Russian invasion of Ukraine.|en|R|1|3
1498317001730797568|1080574793630527505|Mon Feb 28 15:19:45 +0000 2022|"Only 37% of Americans support Biden’s presidency moving into the State of the Union.

58% of Americans say our union is worse off than it was one year ago, clearly indicating a majority of Americans see Biden’s presidency as a failure."|en|R|3|19
