id|user|created_at|text|lang|label|retweet_count|favorite_count
1215298540269985798|1080574793630527505|Thu Jan 09 15:45:25 +0000 2020|"The men and women who serve in law enforcement are always on call when we need them most. As the son of a police officer, I greatly appreciate all who protect and serve our communities.

#LawEnforcementAppreciationDay https://t.co/Lx7zj9w8PA"|en|R|1|10
1215041079176781824|1080574793630527505|Wed Jan 08 22:42:22 +0000 2020|"I just kicked off my telephone town hall to discuss key priorities affecting #PA09.

If you’d like to join, please dial-in now using the call-in information below:

Participant: 877-229-8493
PIN: 118349"|en|R|4|3
1214970058109313031|1080574793630527505|Wed Jan 08 18:00:09 +0000 2020|(1/5) The President just addressed the nation and delivered a firm, direct, and reassuring message of peace through strength. @realDonaldTrump thanked our troops and praised their efforts to completely foil Iran’s attempted attack last night.|en|R|15|64
1214956867258073088|1080574793630527505|Wed Jan 08 17:07:44 +0000 2020|Energy independence means national security. Because of @RealDonaldTrump's pro-domestic energy policies, Iran has lost its leverage over the United States. 4-5 years ago, Middle East turmoil would have spiked gas prices for American families. https://t.co/1OLcqTe5Sp|en|R|3|3
1214954923906887681|1080574793630527505|Wed Jan 08 17:00:01 +0000 2020|"Friendly reminder I will be hosting a telephone town hall today at 5:30 p.m. ET to discuss key issues affecting #PA09. I will be taking questions &amp; listening to comments from all counties in the district. 

If you’d like to join, dial: 

Participant: 877-229-8493
PIN: 118349"|en|R|2|3
1214698228353912833|1080574793630527505|Wed Jan 08 00:00:00 +0000 2020|"I will be hosting a telephone town hall tomorrow, Wednesday, Jan. 8 at 5:30 p.m. to discuss key issues affecting #PA09. I will be taking questions &amp; listening to comments from all counties in the district. 

If you’d like to join, dial: 

Participant: 877-229-8493
PIN: 118349 https://t.co/X4EbEYLo74"|en|R|2|4
1214280769851527169|1080574793630527505|Mon Jan 06 20:21:10 +0000 2020|"I am pleased to announce that Tom Gerhard will join our office today as Director of Community Development and Deputy District Director.

Full press release is below:

https://t.co/KtH7EUm8xt"|en|R|2|6
1213880624127320064|1080574793630527505|Sun Jan 05 17:51:08 +0000 2020|Thanks for hosting me! https://t.co/Qu5G0MNK1o|en|R|5|10
1213596540947832832|1080574793630527505|Sat Jan 04 23:02:17 +0000 2020|"Enjoyed attending the 104th Pennsylvania Farm Show today. 

The agricultural industry employs nearly half a million people in PA and contributes $185B to the state’s economy. https://t.co/PVgr0QsxTU"|en|R|3|11
1213482719235035136|1080574793630527505|Sat Jan 04 15:30:00 +0000 2020|"ICYMI: the @CitizensVoice featured my op-ed regarding Democrat leadership betraying the nation’s trust.
Since they don’t trust the American voter to decide who our president should be, the American voter is justified in not trusting Nancy Pelosi’s House.
https://t.co/7oPIdANkde"|en|R|12|21
1213176732829847553|1080574793630527505|Fri Jan 03 19:14:07 +0000 2020|My full statement on the elimination of top Iranian General and terrorist Qasem Soleimani: https://t.co/848QAZjZtQ|en|R|4|1
1213127269272760320|1080574793630527505|Fri Jan 03 15:57:34 +0000 2020|(1/3) The killing of Americans will never go unpunished, and aggression from Iran will no longer go unchecked. If Iran laid down its weapons and wanted peace, conflicts would end.|en|R|8|30
1213105395335598080|1080574793630527505|Fri Jan 03 14:30:39 +0000 2020|WATCH: I spoke with @WBREwyou regarding the partisan impeachment process, lowering prescription drug costs, and @realDonaldTrump’s swift action against the Iranian-backed forces in Iraq. https://t.co/XT1g1FgrjK|en|R|2|1
1212942456465039360|1080574793630527505|Fri Jan 03 03:43:11 +0000 2020|(1/3) Tonight, under orders from @RealDonaldTrump, the United States military carried out a strike that eliminated Qasem Soleimani, the commander of the Iranian Quds Force, a U.S.-designated terrorist organization.|en|R|12|55
1212845715136942080|1080574793630527505|Thu Jan 02 21:18:46 +0000 2020|I spoke with @WBREwyou today regarding key issues affecting #PA09. Please tune in tonight in the 5 p.m. hour to learn more.|en|R|2|1
1212395555579744256|1080574793630527505|Wed Jan 01 15:30:00 +0000 2020|"As we close out the year and decade and enter into our own “Roaring Twenties,” I look forward to working together to keep the American Dream alive and well for all. 

Happy #NewYear! https://t.co/zMzH7KigZJ"|en|R|2|17
1211750353714237447|1080574793630527505|Mon Dec 30 20:46:12 +0000 2019|"Thanks to @RealDonaldTrump’s #TaxCutsAndJobsAct, America’s workers are seeing tangible increases in their paychecks. 

Low-wage workers enjoyed a 4.5% income boost, outpacing the 2.9% growth their high-wage counterparts saw in November! https://t.co/a597oOkhP0"|en|R|55|227
1211656502500573184|1080574793630527505|Mon Dec 30 14:33:16 +0000 2019|WATCH: I joined @MorningsMaria on @FoxBusiness to discuss the U.S. airstrikes against Iranian-backed targets in Iraq and Syria, domestic terrorism, and the American voter being justified in not trusting Nancy Pelosi’s House. https://t.co/vmSCCgkgye|en|R|6|16
1211417086767091713|1080574793630527505|Sun Dec 29 22:41:55 +0000 2019|"I will join @MorningsMaria tomorrow in the 7 a.m. ET hour to discuss key priorities.

Please tune in!"|en|R|4|11
1209858840147066880|1080574793630527505|Wed Dec 25 15:30:00 +0000 2019|"Merry #Christmas to all!

I hope that everyone has safe travels and enjoys time with family and friends. https://t.co/1Kka6YpAc6"|en|R|4|19
1209178305204772864|1080574793630527505|Mon Dec 23 18:25:48 +0000 2019|"Read my op-ed in the @DailyItem regarding the partisan impeachment process.

Since Democrat leadership doesn’t trust the American voter to decide who our president should be, the American voter is justified in not trusting Nancy Pelosi’s House.

https://t.co/BpGKDEo7tw"|en|R|32|126
1208881733694869504|1080574793630527505|Sun Dec 22 22:47:19 +0000 2019|Happy first night of #Hanukkah to everyone celebrating the Festival of Lights. https://t.co/XA1RPpHz1D|en|R|2|10
1208771677879967745|1080574793630527505|Sun Dec 22 15:30:00 +0000 2019|"Today marks the two-year anniversary of the Tax Cuts and Jobs Act. 

Thanks to the TCJA, @realDonaldTrump, and Congressional Republicans, the economy has added nearly 7M jobs! #TCJA2Years https://t.co/DtFm10v4ad"|en|R|8|27
1208409290320621568|1080574793630527505|Sat Dec 21 15:30:00 +0000 2019|"ICYMI: I took part in a ceremony to honor U.S. Army veteran Sergeant Francis O’Donnell, and to reissue medals earned during the Korean War.

Full video from @WNEP below:

https://t.co/2XsKK17f91"|en|R|3|2
1208123512361308161|1080574793630527505|Fri Dec 20 20:34:25 +0000 2019|"ICYMI: I spoke with @CBS21News regarding the partisan impeachment vote. 

The people should decide who will be President, not Speaker Pelosi: https://t.co/2381wPvMW1"|en|R|3|5
1207774269280849924|1080574793630527505|Thu Dec 19 21:26:39 +0000 2019|"My statement on House passage of the #USMCA:

https://t.co/ZPH9ZwLRdR"|en|R|9|55
1207480173827907584|1080574793630527505|Thu Dec 19 01:58:01 +0000 2019|"My statement on tonight’s impeachment vote:

https://t.co/Vypgp2PQvt"|en|R|5|6
1207377512495484930|1080574793630527505|Wed Dec 18 19:10:05 +0000 2019|"Tonight, Democrat leadership brings their impeachment charade to the House floor for a vote.

Watch my speech below to hear why I’ll be voting in strong opposition to both articles of impeachment. https://t.co/tHhPkqGbzw"|en|R|181|761
1207062478926024706|1080574793630527505|Tue Dec 17 22:18:15 +0000 2019|(1/3) Below is a very important letter for all Pennsylvanians and Americans to read from @realDonaldTrump to Speaker Pelosi regarding the baseless and partisan impeachment process. https://t.co/ntP9ctHeL2|en|R|151|381
1206982162022617089|1080574793630527505|Tue Dec 17 16:59:06 +0000 2019|"I will appear on @FoxBusiness Network’s “Making Money with Charles Payne” at 2:35 p.m. ET to discuss the government funding bill and impeachment.

Please tune in!"|en|R|4|4
1206924234498416642|1080574793630527505|Tue Dec 17 13:08:55 +0000 2019|"Due to inclement weather, my Pottsville and Bloomsburg offices will open at 11 am. 

If you are in need of immediate assistance, please call my DC office at (202) 225-6511."|en|R|4|4
1206686276688236548|1080574793630527505|Mon Dec 16 21:23:22 +0000 2019|"I will join Frank Andrews on @WILKNewsradio at 4:30 p.m. to discuss impeachment.

Hope you can tune in!"|en|R|2|2
1206670338878312450|1080574793630527505|Mon Dec 16 20:20:02 +0000 2019|"I will appear on @WBREwyou (Eyewitness News) tonight in the 5 p.m. hour to discuss the baseless and partisan impeachment process against @realDonaldTrump.

Please tune in!"|en|R|4|30
1206578079361097729|1080574793630527505|Mon Dec 16 14:13:25 +0000 2019|Since @realDonaldTrump has clearly not committed any high crimes or misdemeanors, I’ll vote ‘hell no’ on impeachment. https://t.co/Vq54nREm7Q|en|R|20|75
1206320672928079872|1080574793630527505|Sun Dec 15 21:10:35 +0000 2019|"ICYMI: enjoyed speaking with @RJHarrisWHP580 to discuss the baseless and partisan impeachment process against @realDonaldTrump, which has been flawed from the start.

https://t.co/eBBLt6alJ5"|en|R|5|20
1205891471477559296|1080574793630527505|Sat Dec 14 16:45:05 +0000 2019|Learn how to apply for funding under @fema’s Assistance to Firefighter Grants (AFG) program, Fire Prevention and Safety (FP&amp;S) grant program, &amp; Staffing for Adequate Fire and Emergency Response (SAFER) grants, by clicking the link below: https://t.co/4zBGsPysIy|en|R|2|5
1205588578039947264|1080574793630527505|Fri Dec 13 20:41:30 +0000 2019|"Today I took part in a ceremony to honor and thank U.S. Army veteran Sergeant Francis O’Donnell, and to reissue medals earned during the Korean War.

Tune in to @WNEP at 6 p.m. and @brcnews13 at 5:30 or 6:30 p.m. for stories on today’s ceremony! https://t.co/CNysLBEs14"|en|R|7|12
1205237845268541458|1080574793630527505|Thu Dec 12 21:27:49 +0000 2019|"Happy birthday, #Pennsylvania! On December 12, 1787, Pennsylvania became the second state to ratify the Constitution.

Check out the map of Pennsylvania below, courtesy of the @LibraryCongress. https://t.co/HFFNuVKYXW"|en|R|3|8
1205134684319076352|1080574793630527505|Thu Dec 12 14:37:53 +0000 2019|(1/2) It is important for everyone to see Attorney General William Barr’s straightforward description of the recent inspector general’s report and the forthcoming Durham report.|en|R|4|12
1204905579933831171|1080574793630527505|Wed Dec 11 23:27:30 +0000 2019|The passage of this historic #NDAA is a big win for America. Under @realDonaldTrump’s leadership, the agreement provides the biggest pay raise in a decade for our troops, strengthens our military, &amp; establishes a Space Force to better defend against 21st century threats.|en|R|10|39
1204849069497180160|1080574793630527505|Wed Dec 11 19:42:57 +0000 2019|"Tomorrow, our hours in State Representative Heffley’s office will be in his Albrightsville location (2681 State Route 903, Unit 3, Albrightsville, PA) from 9 a.m.-3 p.m. 

Next Thursday (Dec. 19), our hours will be from 9 a.m.-3 p.m. in Weissport. https://t.co/XvM2uRHrCk"|en|R|1|3
1204822472715046913|1080574793630527505|Wed Dec 11 17:57:16 +0000 2019|"I spoke on the House floor in support of H.R. 19, the Lower Costs, More Cures Act. 

This important legislation would lower out-of-pocket spending, spur competition &amp; innovation, &amp; empower patients to make well-informed decisions about their medications. 

https://t.co/mYRJBz3S7v"|en|R|12|59
1204443741836193793|1080574793630527505|Tue Dec 10 16:52:20 +0000 2019|(1/3) Finally, Democrat leadership has come up with the terms they find most effective for their impeachment sham. They’ve tried Russian corruption, bribery, quid pro quo, and obstruction of justice, and have now finally arrived at “abuse of power” and “obstruction of Congress.”|en|R|8|20
1204435646733078529|1080574793630527505|Tue Dec 10 16:20:10 +0000 2019|(1/2) The #USMCA now looks like it will finally come to the House floor for a vote next week. This agreement, as negotiated by @realDonaldTrump, is a huge win for America &amp; #PA09. Democrat leadership has wasted months on their impeachment sham instead of this critical trade deal.|en|R|2021|9486
1204060925642317824|1080574793630527505|Mon Dec 09 15:31:09 +0000 2019|(1/4) I agree with @GOPLeader - “Democrats have claimed they are hesitant or remorseful about impeachment, but their timeline shows they have been plotting to take down President Trump all along.” https://t.co/bM1Bww34D6|en|R|197|606
1202961356489658369|1080574793630527505|Fri Dec 06 14:41:51 +0000 2019|"Another booming jobs report under @realDonaldTrump’s leadership.

The U.S. added 266K new jobs in November, unemployment is at 3.5%, and wages are up 3.1% compared to a year earlier. https://t.co/Fe44RGryJH"|en|R|63|257
1202943273100283910|1080574793630527505|Fri Dec 06 13:30:00 +0000 2019|"Great to catch up with @VP Mike Pence, one of the best VP’s in the history of our nation, at this week’s @HouseGOP meeting. 

Thank you for continuing to fight for the American people. https://t.co/3475apNdYy"|en|R|5|20
1202661442568232960|1080574793630527505|Thu Dec 05 18:50:06 +0000 2019|"Today, I honored Mahantongo Valley Farms owners Larry and Joanna Snyder, who are from #PA09. 

One of their beautiful Christmas trees was selected by @realDonaldTrump and @FLOTUS to adorn the Blue Room in the @WhiteHouse during this holiday season. https://t.co/OtvC9oCt3o"|en|R|7|13
1202643149530775553|1080574793630527505|Thu Dec 05 17:37:25 +0000 2019|The people should decide who our next president is, not Nancy Pelosi.|en|R|14|65
1202621136372191237|1080574793630527505|Thu Dec 05 16:09:57 +0000 2019|(1/2) This is the most partisan impeachment process in the history of America. The process is not based on wrongdoing, but purely on political positioning. It's one thing to act politically on a campaign, but for Nancy Pelosi to act in such a partisan way in Congress is absurd.|en|R|173|653
1202586252857499651|1080574793630527505|Thu Dec 05 13:51:20 +0000 2019|WATCH: spoke with @cspanwj to discuss why I stand with @realDonaldTrump and against the partisan impeachment process. https://t.co/eEcfbw9Xvc|en|R|80|282
1202369491092377600|1080574793630527505|Wed Dec 04 23:30:00 +0000 2019|WATCH: enjoyed speaking with @WarRoom2020 to discuss the sham impeachment process and opportunity cost for our country. It’s past time for Speaker Pelosi to bring the #USMCA to the floor for a vote. https://t.co/Zm7UO9qmKB|en|R|7|19
1202339922725748736|1080574793630527505|Wed Dec 04 21:32:30 +0000 2019|Enjoyed hosting a telephone town hall. It was a pleasure to answer questions from the great people of #PA09. It’s an honor to serve you!|en|R|3|5
1202021640529469440|1080574793630527505|Wed Dec 04 00:27:46 +0000 2019|"I will join @cspanwj at 7:40 a.m. tomorrow (Wednesday, Dec. 4) to discuss the partisan impeachment process. 

Please tune in!"|en|R|1|1
1201993096608800768|1080574793630527505|Tue Dec 03 22:34:20 +0000 2019|"I just kicked off my telephone town hall to discuss key priorities affecting #PA09.

If you’d like to join, please dial-in now using the call-in information below:

Participant: 877-229-8493
PIN: 118349"|en|R|2|9
1201968047633915905|1080574793630527505|Tue Dec 03 20:54:48 +0000 2019|"Friendly reminder I will be hosting a telephone town hall today at 5:25 p.m. ET to discuss key issues affecting #PA09. I will be taking questions &amp; listening to comments from all counties in the district. 

If you’d like to join, dial: 

Participant: 877-229-8493
PIN: 118349"|en|R|1|2
1201686933920976896|1080574793630527505|Tue Dec 03 02:17:45 +0000 2019|"I will be joining @WarRoom2020 tomorrow at 9 a.m. ET to discuss the baseless and partisan impeachment process. 

You can listen live here: https://t.co/7bNRW9NsWi"|en|R|3|3
1201629291752099840|1080574793630527505|Mon Dec 02 22:28:43 +0000 2019|"I will be hosting a telephone town hall tomorrow, Tuesday, Dec. 3 at 5:25 p.m. ET to discuss key issues affecting #PA09. I will be taking questions &amp; listening to comments from all counties in the district. 

If you’d like to join, dial: 

Participant: 877-229-8493
PIN: 118349"|en|R|1|1
1201311658091667457|1080574793630527505|Mon Dec 02 01:26:33 +0000 2019|"More continued attempts by Democrat leadership to bully this process.

Please see the letter (link below) from the White House outlining their appropriate response to these abusive tactics.

https://t.co/x5UC7PFBEN"|en|R|6|19
1200854760955564032|1080574793630527505|Sat Nov 30 19:11:00 +0000 2019|"Today is the first day of Buck rifle hunting season in Pennsylvania. I’m pictured here with my son during archery season. 

Hoping the next picture will be with an 8+ point Buck! https://t.co/HQqOlTdQ1g"|en|R|4|26
1200827392337559555|1080574793630527505|Sat Nov 30 17:22:15 +0000 2019|Congratulations to the Dallas Mountaineers, beating Jersey Shore in a tough matchup, 56-28, earning their spot competing for the 4A State title in Hershey on Thursday, Dec. 5 at 7 p.m. Pictured is my son Danny (#4) &amp; his teammates, chomping at the bit/chocolate to get to Hershey! https://t.co/xVAqnup5NV|en|R|1|12
1200799144186503169|1080574793630527505|Sat Nov 30 15:30:00 +0000 2019|Congrats to Mahantongo Valley Farms owner Larry Snyder of Northumberland County for winning the 2019 National Christmas Tree Contest and delivering his tree to the @WhiteHouse. https://t.co/B19tQTSAwH|en|R|4|13
1200414110661402624|1080574793630527505|Fri Nov 29 14:00:01 +0000 2019|"ICYMI: our country’s economy continues to boom under @realDonaldTrump’s pro-growth policies. 

The U.S. economy added 128K jobs in October, far surpassing expectations. https://t.co/dXzcNuWjKL"|en|R|29|128
1200066824278347776|1080574793630527505|Thu Nov 28 15:00:01 +0000 2019|Happy #Thanksgiving to all! I am thankful to serve the wonderful people of #PA09. https://t.co/ZfsIR37q9C|en|R|2|10
1199854044820451328|1080574793630527505|Thu Nov 28 00:54:31 +0000 2019|A special thanks to Rob Kemp and Ed Lynch for the opportunity to speak at the Lebanon County Services Club Annual Luncheon today. https://t.co/4LO9TEmVQQ|en|R|1|4
1199817676622684162|1080574793630527505|Wed Nov 27 22:30:00 +0000 2019|"Hope everyone has safe travels and enjoys time with friends and family over #Thanksgiving.

I am thankful to serve the great people of #PA09."|en|R|5|30
1199728192971530245|1080574793630527505|Wed Nov 27 16:34:25 +0000 2019|"Have you had time to check out our #OpportunityZones resources page? 

#PA09 contains 10 Opportunity Zones, including areas in Columbia, Lebanon, Luzerne, Montour, Northumberland, and Schuylkill counties. 

Learn more here: https://t.co/Em5UtNwiMM"|en|R|1|0
1199448048100945920|1080574793630527505|Tue Nov 26 22:01:13 +0000 2019|"It’s past time for Speaker Pelosi to bring the USMCA to the floor for a vote, which will spur $68B in new economic growth nationwide. 

More than 42K jobs in Pennsylvania depend on manufacturing exports to North America. 

We must pass the #USMCAnow. https://t.co/Swcds8gr98"|en|R|72|202
1198660174518591493|1080574793630527505|Sun Nov 24 17:50:30 +0000 2019|Enjoyed speaking at State Representative Kurt Masser’s Farmer Breakfast to discuss agriculture, farming, and rural broadband initiatives in #PA09. https://t.co/Ne20v90LsC|en|R|2|4
1198254690783367170|1080574793630527505|Sat Nov 23 14:59:15 +0000 2019|"Reminder: I will join @BreitbartNews on @SiriusXMPatriot to discuss impeachment with @mboyle1 at 11 a.m. ET.

Please tune in!"|en|R|8|61
1198008704454610949|1080574793630527505|Fri Nov 22 22:41:47 +0000 2019|"I will join @BreitbartNews on @SiriusXMPatriot to discuss impeachment with @mboyle1 tomorrow at 11 a.m. ET.

Please tune in!"|en|R|1|6
1197282387119489026|1080574793630527505|Wed Nov 20 22:35:40 +0000 2019|I will join WHLM Radio (1280 AM) tomorrow morning at 8:15 a.m. to discuss key priorities. Please tune in!|en|R|0|3
1197243148981997569|1080574793630527505|Wed Nov 20 19:59:45 +0000 2019|"CNN headline: ""Witness Implicates Trump"" 

Watch the video below to see why CNN is #FakeNews https://t.co/YXI3KBQ4ew https://t.co/FZafwp4ktG"|en|R|21|47
1197210918498816000|1080574793630527505|Wed Nov 20 17:51:40 +0000 2019|"Watch my floor speech below regarding facts upheld by yesterday's public impeachment hearings.

These facts, which indeed clear @realDonaldTrump, do not change. https://t.co/RVLbiRlXk4"|en|R|158|475
1197145067393294337|1080574793630527505|Wed Nov 20 13:30:00 +0000 2019|"There’s a lot happening in Washington and I want to keep you informed. 

Please sign-up for my e-mail updates below to receive important news. https://t.co/hji5Gq6wjK"|en|R|2|1
1196933673226035205|1080574793630527505|Tue Nov 19 23:30:00 +0000 2019|"Congrats to Ferrero USA on opening their new distribution center in #PA09! 

I enjoyed speaking at their ribbon cutting ceremony to discuss how their new location will produce 225 well-paying jobs and bring an improved economy and quality of life to Pennsylvania’s Ninth District. https://t.co/Dl6qMujsjI"|en|R|0|4
1196858253088559105|1080574793630527505|Tue Nov 19 18:30:18 +0000 2019|"Social media trolls have abandoned even the most basic level of courtesy in attacking @RepStefanik. No willingness to tolerate, understand, or be civil. Like bullies on a playground, they resort to juvenile and cowardly antics.

Go #TeamElise!"|en|R|66|273
1196849819429560322|1080574793630527505|Tue Nov 19 17:56:48 +0000 2019|November marks National Adoption Month, where we celebrate the loving families who provide homes for babies and children in need of a loving family. God bless those who offer hope, love, and stability to children in need. https://t.co/a1Eni0Upgx|en|R|2|8
1196088101459902471|1080574793630527505|Sun Nov 17 15:30:00 +0000 2019|"In Pennsylvania, more than 42K jobs depend on manufacturing exports to North America. 

It’s past time for Speaker Pelosi to finally listen to the American people and bring the USMCA to the floor for a vote. #USMCAnow https://t.co/Sx1nLW8HSH"|en|R|7|28
1195725714676494336|1080574793630527505|Sat Nov 16 15:30:00 +0000 2019|ICYMI: I spoke with @EdwardLawrence on @FoxBusiness to discuss the continued lack of due process surrounding the impeachment inquiry…Republicans have even been denied the right to call witnesses. https://t.co/52nzRmJped|en|R|43|144
1195424843237335042|1080574793630527505|Fri Nov 15 19:34:27 +0000 2019|"Congratulations to Schuylkill County! 

Tamaqua High School secured a district championship in football and Penn State Schuylkill is a three-peat dynasty in women’s cross country. https://t.co/k5ssHtyNaX"|en|R|8|21
1195342988978855941|1080574793630527505|Fri Nov 15 14:09:11 +0000 2019|"Watch my floor speech below on why this impeachment inquiry is a sham. 

Democrat leadership has prioritized politics over the people, instead of bringing the USMCA to the floor, lowering prescription drug costs, and passing an infrastructure bill. https://t.co/g3HdHgeS5g"|en|R|366|1099
1195079093731176456|1080574793630527505|Thu Nov 14 20:40:34 +0000 2019|I joined @EdwardLawrence to discuss today’s hearing with Federal Reserve Chairman Powell and the ongoing topic of impeachment. Tune in at 4 p.m. and 6 p.m. on @FoxBusiness to watch!|en|R|2|9
1195069550913630208|1080574793630527505|Thu Nov 14 20:02:38 +0000 2019|"The Fed Chairman sees clear skies ahead for the U.S. economy. Powell says he doesn’t see “a day of reckoning"" coming anytime soon.

Watch my segment from the @housebudgetGOP hearing with Chairman Powell below. https://t.co/O3aVM2rrjL"|en|R|6|13
1194754495806398464|1080574793630527505|Wed Nov 13 23:10:43 +0000 2019|(1/2) The impeachment hearings are continuing despite the following: this is a highly biased process, the leading Democrat players have predetermined presumptions of guilt &amp; have been untruthful about contact with the whistleblower, &amp; there has been no evidence of quid pro quo.|en|R|61|173
1194749813549674497|1080574793630527505|Wed Nov 13 22:52:07 +0000 2019|I will join @WKOK1070’s “On the Mark” tomorrow morning in the 9 a.m. hour to discuss key priorities. Please tune in!|en|R|1|3
1194636719150288901|1080574793630527505|Wed Nov 13 15:22:43 +0000 2019|Enjoyed speaking at the Association of Independent Mortgage Experts (@AIMEnational) lunch to discuss home loans &amp; financial services issues affecting the people of #PA09. https://t.co/8Ojb1zESCa|en|R|1|2
1194396958330253313|1080574793630527505|Tue Nov 12 23:30:00 +0000 2019|I spoke at the Berwick Elks Veterans Day dinner last evening to honor veterans in Berwick, PA and meet members of the #PA09 community. Thank you for your service! https://t.co/JAHN2TEc7r|en|R|2|3
1194373696019947521|1080574793630527505|Tue Nov 12 21:57:34 +0000 2019|WATCH: I joined @CBS21News’ “Face the State” to discuss the partisan and baseless impeachment proceedings being carried out by Democrat leadership. https://t.co/Utae9r6Oiv|en|R|12|58
1194332029648687105|1080574793630527505|Tue Nov 12 19:12:00 +0000 2019|I recently visited the Lebanon Veterans Affairs Medical Center (@VALebanon) to thank veterans for their service to our country. Let us never forget the sacrifice they and their families made to safeguard our freedom. https://t.co/WUrakJBrPs|en|R|5|9
