id|user|created_at|text|lang|label|retweet_count|favorite_count
1453383487260696581|1080574793630527505|Wed Oct 27 15:30:00 +0000 2021|"We have a crisis at our southern border with a record number of illegal border crossings. 

I cosponsored the BE GONE Act to protect our communities &amp; ensure sex criminals &amp; predators are identified &amp; stopped immediately.

Learn more here: https://t.co/NxjLotgESE"|en|R|3|5
1453372578052071431|1080574793630527505|Wed Oct 27 14:46:39 +0000 2021|"The Democrats IRS Bank Surveillance Scheme is lunacy.

It is threatening the privacy of all Americans and will raise costs on our smaller financial institutions. https://t.co/sBLHuu6k1K"|en|R|64|125
1453357061702488069|1080574793630527505|Wed Oct 27 13:45:00 +0000 2021|"TODAY @ 10:00 AM: The @HSBCgop will be discussing the challenges facing small businesses in America, and how we can encourage more investing in rural communities. 

WATCH https://t.co/ymD5PoLprL"|en|R|2|0
1453087982525759501|1080574793630527505|Tue Oct 26 19:55:46 +0000 2021|President Biden’s policies disincentive people to go to work and have exacerbated the supply chain crisis. https://t.co/0xEcUSmCMt|en|R|8|8
1453057400878026755|1080574793630527505|Tue Oct 26 17:54:15 +0000 2021|The Biden White House should do the exact opposite of everything they are doing. @MorningsMaria https://t.co/bZmOrgZysA|en|R|5|5
1453043749760618497|1080574793630527505|Tue Oct 26 17:00:00 +0000 2021|"The holidays are around the corner and demand will increase as it does every holiday season. 

The Biden Administration’s failure to address the inflation and supply chain crises will make this Christmas the most expensive Christmas anyone can remember. https://t.co/XA1VhG20Hf"|en|R|13|19
1453039972710330377|1080574793630527505|Tue Oct 26 16:45:00 +0000 2021|"Thanks to President Biden, gas prices in Pennsylvania have risen almost 8 cents in the past week. My constituents are paying $3.56/gallon.

We need to bring oil production back to the United States. 
https://t.co/E5aS7az58d"|en|R|4|13
1453029775027679245|1080574793630527505|Tue Oct 26 16:04:29 +0000 2021|"TUNE IN: I will be live on @newsmax at 12:45 PM to discuss how the supply chain crisis is hurting small businesses. 

WATCH
https://t.co/aKnUt4DkaL"|en|R|2|2
1453013560699858950|1080574793630527505|Tue Oct 26 15:00:03 +0000 2021|"Unfortunately, Americans are facing  a long, cold, and expensive winter due to the Democrat’s disastrous energy policies. 

Biden’s attack on domestic energy production will have your heating bill skyrocket, and the proposed tax will drive up costs even more. https://t.co/CWAFrrz7Sh"|en|R|76|155
1453003798675394579|1080574793630527505|Tue Oct 26 14:21:15 +0000 2021|"Biden’s disastrous polices have created multiples crises from the border to inflation and the supply chain issues.  

He has NO plan to fix these crises he created, but Republicans do. https://t.co/QkIEeLJ3MM"|en|R|2|7
1452929971261956104|1080574793630527505|Tue Oct 26 09:27:53 +0000 2021|TUNE IN: I will be on @MorningsMaria at 6:20 AM to discuss the supply chain crisis.|en|R|13|29
1452770088805937157|1080574793630527505|Mon Oct 25 22:52:34 +0000 2021|"The sacrifices of our brave men and women in Afghanistan will never be forgotten. 

Honored to have cosponsored H.R. 5142 that just passed the House that would award the Congressional Gold Medal to the 13 servicemembers who were killed in Afghanistan on August 26, 2021."|en|R|1|14
1452734209173430273|1080574793630527505|Mon Oct 25 20:30:00 +0000 2021|Hardworking Americans across the country are struggling under President Biden and the Democrat leadership’s excessive tax and spend agenda that is causing record inflation, lower wages, supply-chain issues, and skyrocketing gas prices.|en|R|7|14
1452726658839072778|1080574793630527505|Mon Oct 25 20:00:00 +0000 2021|"This administration has lost complete control of the supply chain crisis. 

Prices are up for just about everything, and President Biden continues to push the most reckless tax and spend agenda this nation has ever seen. 
https://t.co/hHT8B63UWx"|en|R|4|3
1452722240781434884|1080574793630527505|Mon Oct 25 19:42:27 +0000 2021|This is not true. https://t.co/geJbbpTRCU|en|R|4|16
1452718288363003923|1080574793630527505|Mon Oct 25 19:26:44 +0000 2021|"Biden and the Democrats’ solution to the nation’s problems is more government. 
https://t.co/Ly2Vz9M9W8"|en|R|3|6
1451567772685713410|1080574793630527505|Fri Oct 22 15:15:00 +0000 2021|"Manufacturers across the country are impacted from our current semiconductor shortages, and our economy depends on having a resilient supply.

I led the @probSolveCaucus in calling to increase our production. We must pass the CHIPS Act.
https://t.co/C1i9mKI22i"|en|R|3|5
1451563997673754625|1080574793630527505|Fri Oct 22 15:00:00 +0000 2021|"We went from energy independent to energy dependent. 

Biden can fix this issue TOMORROW if we unleashed American energy production.  
https://t.co/LyN6i4gjvO"|en|R|3|7
1451562267561050133|1080574793630527505|Fri Oct 22 14:53:07 +0000 2021|"This is unacceptable! POTUS must stop letting people into the US illegally &amp; every refugee must be fully vetted. 

I introduced a Resolution calling on Biden to secure the US by denying entry to certain individuals due to a heightened terror threat from an unstable Afghanistan. https://t.co/ELpOmKYNsk"|en|R|3|4
1451557153584582658|1080574793630527505|Fri Oct 22 14:32:48 +0000 2021|"The President claims he hasn’t had time to go to the border, but he certainly finds time to go home to Delaware.  

Why is the humanitarian crisis at our border not important to President Biden? 
https://t.co/MQi75ozM8W"|en|R|4|6
1451329954390716423|1080574793630527505|Thu Oct 21 23:30:00 +0000 2021|"Tonight during his CNN town hall, President Biden will try to sell Americans on his massive tax and spending bill which would be the largest expansion of government in history.

Watch below as I lay out what is really in this bill: https://t.co/PhKFRY9UQY"|en|R|183|484
1451305950644670472|1080574793630527505|Thu Oct 21 21:54:37 +0000 2021|America is facing a historic supply chain crisis. Instead of addressing this crisis President Biden and Democrats in Congress are working hard to pass their Build Back Broke Agenda which would only further exacerbate the crisis. https://t.co/hDm0ipkFzc|en|R|29|41
1451253086878683150|1080574793630527505|Thu Oct 21 18:24:33 +0000 2021|"The Democrats rejected the Republicans legislation that would prevent the Biden Admin to require banks to turn over Americans’ bank account transactions.  

Biden’s IRS plan is a gross expansion of government that violates the privacy of every American and small business."|en|R|4|8
1450959873567510528|1080574793630527505|Wed Oct 20 22:59:26 +0000 2021|"I joined my colleagues to urge Biden to stop pushing a socialist-big government agenda and address the immediate challenges that are facing our country. The supply chain crisis is devastating small businesses and increasing prices on American consumers. 

Read our full letter: https://t.co/gSgaWTizrx"|en|R|7|11
1450937369704558592|1080574793630527505|Wed Oct 20 21:30:00 +0000 2021|"Americans are paying more for just about everything under President Biden’s Build Back Broke agenda. 

We need more free market capitalism and less big government socialism. https://t.co/jKbrfYW1p9"|en|R|3|5
1450931076554235918|1080574793630527505|Wed Oct 20 21:05:00 +0000 2021|Small businesses in Pennsylvania and across the country are currently combatting crippling inflation, supply chain issues, and workforce shortages. Today at the @HouseSmallBiz hearing, I spoke to small business owners about how we can address this crisis. https://t.co/rBWQyJf2Tk|en|R|3|7
1450928777865859081|1080574793630527505|Wed Oct 20 20:55:52 +0000 2021|"Just spoke to Frank Andrews on WILK about Biden's Build Back Broke agenda. 

While Biden is in Scranton, I'm headed to the House Floor trying to appeal to the Democrat Caucus to not vote with the progressives and vote for free market capitalism not big government socialism."|en|R|2|4
1450854555210719234|1080574793630527505|Wed Oct 20 16:00:56 +0000 2021|"We are seeing a supply chain crisis because we have a serious workforce shortage, hyperinflation – high demand and low supply – strong consumer purchasing but no “Made in the USA” goods to fulfill that demand. 

It is time for the Biden Admin to fix this crisis. https://t.co/GiuxYBhjoW"|en|R|8|31
1450843702545592320|1080574793630527505|Wed Oct 20 15:17:48 +0000 2021|"As the former Secretary of Revenue for PA, I know that the Biden Administration’s IRS proposal is lunacy. 

I cosponsored the Prohibiting IRS Surveillance Act to protect the American taxpayer and small businesses from this invasive and costly policy. 
https://t.co/jBsPgZ7Fds"|en|R|3|7
1450571878892982278|1080574793630527505|Tue Oct 19 21:17:40 +0000 2021|"Raising the threshold is not good enough. 

An overwhelming majority of Americans and small businesses will still be subjected to this intrusive plan.
https://t.co/xVizwH6wlK"|en|R|3|5
1450552330483421184|1080574793630527505|Tue Oct 19 20:00:00 +0000 2021|"With the holiday season right around the corner, Main Street USA is begging for support from every American. 

How can you help?
➡️Buy local 
➡️Recommend them to friends/family
➡️Promote a Small Business every chance you get"|en|R|1|5
1450541006408011781|1080574793630527505|Tue Oct 19 19:15:00 +0000 2021|"Small businesses are the backbone of local communities.

We cannot crush Main Street with the Democrats’ $5T spending package that institutes a 39.6% income tax rate and a 25% rate on capital gains."|en|R|6|22
1450532613647740935|1080574793630527505|Tue Oct 19 18:41:39 +0000 2021|"The problem is the Biden Administration's disastrous policies, not the high expectations from the American people. 
https://t.co/MsJDzTQ50b"|en|R|5|11
1450451948575068164|1080574793630527505|Tue Oct 19 13:21:07 +0000 2021|"It's time to solve the latest of ""Biden Blunders""- Supply Chain. 

Get off the backs of local small businesses and allow Main Street to be the most competitive place to purchase goods. No threat of tax increases, mandates or regulation and open up America's workforce."|en|R|6|18
1450154632047648776|1080574793630527505|Mon Oct 18 17:39:41 +0000 2021|"Under Pres. Trump, defense spending was strategically increased. There have been no increases under Pres. Biden. 

It's highly improbable that such an action such as firing a supersonic missile by the PRC would have occurred under a Trump Administration.
https://t.co/1OkKKNnfAg"|en|R|4|6
1450130309501095941|1080574793630527505|Mon Oct 18 16:03:02 +0000 2021|TUNE IN: I will be live with @TeamCavuto on @FoxBusiness at 12:30 PM to discuss U.S.-China tensions.|en|R|1|4
1450111423523270659|1080574793630527505|Mon Oct 18 14:47:59 +0000 2021|"Had a wonderful time this weekend at the Cigar Fest in Hamburg seeing many small businesses from our community. 

Our economy thrives when Main Street is doing well. I encourage everyone to go out and shop your local businesses! https://t.co/S5c4C6Fl4R"|en|R|2|9
1450096973932077058|1080574793630527505|Mon Oct 18 13:50:34 +0000 2021|With the passing of General Colin Powell, we remember and thank him for his service to our country including; National Security Advisor under President Reagan, Joint Chiefs of Staff under Presidents' Bush and Clinton, and Secretary of State under President George W. Bush.|en|R|1|8
1450087817988775937|1080574793630527505|Mon Oct 18 13:14:11 +0000 2021|"ICYMI: I joined Larry Kudlow to discuss the supply chain crisis we are facing. 

LISTEN
https://t.co/I7kSvVyuA6"|en|R|2|4
1449374411484766211|1080574793630527505|Sat Oct 16 13:59:22 +0000 2021|"TUNE IN: I will be live on @77WABCradio at 11:15 AM with Larry Kudlow to discuss the supply chain issues our country is facing. 

LISTEN https://t.co/kdW0YHOtaC"|en|R|1|0
1448683737907187732|1080574793630527505|Thu Oct 14 16:14:53 +0000 2021|"Two years ago the U.S. was energy independent, and now we are relying on our adversaries for energy instead of getting it from home. 

Americans are now forced to pay 42 % more for gasoline because of Biden’s anti-American energy policies. 

Read our letter to Biden below⬇️ https://t.co/NY4WBz06c3"|en|R|86|219
1448387882281013248|1080574793630527505|Wed Oct 13 20:39:15 +0000 2021|My father was a police officer, and I saw firsthand the sacrifice the men and women in uniform make to keep our communities safe. This #NationalPoliceWeek, and every week, we are forever grateful for those who protect and serve in Pennsylvania and across the country. https://t.co/ZqJuVcDhKB|en|R|1|13
1448371229690376201|1080574793630527505|Wed Oct 13 19:33:05 +0000 2021|We have a persistent workforce shortage, high inflation, and serious supply chain bottlenecks due to President Biden’s failed policies. https://t.co/XX5qAlSZjP|en|R|7|12
1448350461636055043|1080574793630527505|Wed Oct 13 18:10:33 +0000 2021|TUNE IN: I’ll be live on @FoxBusiness at 2:15 PM to discuss the supply chain crisis we are facing in the country. https://t.co/eVA2cfGmoj|en|R|1|4
1448330769542356993|1080574793630527505|Wed Oct 13 16:52:18 +0000 2021|"In the few short months of Biden’s presidency we have a: 

-Border Crisis
-Supply Chain Crisis 
-Labor Shortage Crisis
-Energy Crisis 
-Economic Crisis
-Crime Crisis 
-COVID Crisis 

No wonder his approval rating is tanking. 
https://t.co/idsIgMzsPz"|en|R|6|6
1448313830803599360|1080574793630527505|Wed Oct 13 15:45:00 +0000 2021|"Democrats are engaged in a spending of over $5 trillion in taxpayers’ money and asking Republicans to increase the credit card limit with no say in how it is going to be spent. 

This is ridiculous and the American public isn’t buying it. 
https://t.co/dNnVfGZt6u"|en|R|2|7
1448305294543663104|1080574793630527505|Wed Oct 13 15:11:05 +0000 2021|"The world is taking advantage of Joe Biden’s failed policies. We need to secure the border NOW! 
https://t.co/fMI3rWaz3y"|en|R|3|8
1448242115620790276|1080574793630527505|Wed Oct 13 11:00:02 +0000 2021|"TUNE IN: I will be live on @newsmax at 8:00 AM with @FinnertyUSA to discuss the Democrats' out of control spending. 

WATCH: https://t.co/aKnUt4DkaL"|en|R|1|1
1448043064384184329|1080574793630527505|Tue Oct 12 21:49:04 +0000 2021|Agriculture is one of the leading industries in PA, providing thousands of family-sustaining jobs. In Congress, I will continue to work for our farmers, ensuring a future filled with increased opportunity and prosperity for those who help feed America. #NationalFarmersDay https://t.co/gRG5Em89F0|en|R|3|7
1448038711384489989|1080574793630527505|Tue Oct 12 21:31:46 +0000 2021|Republicans’ position has remained unchanged for months: if Democrats can advance a reckless spending agenda without Republican support, they must raise the debt limit without our support as well. https://t.co/qkJIMYDSWW|en|R|30|107
1448015617043349510|1080574793630527505|Tue Oct 12 20:00:00 +0000 2021|"Our government has a spending problem and it is costing the taxpayers’ an extra $175 a month. 

Inflation is tax on every American. 

The last thing we need is a reconciliation bill that will make 80% of Americans poorer. 
https://t.co/uAyE8reE6c"|en|R|3|9
1448008065798705155|1080574793630527505|Tue Oct 12 19:30:00 +0000 2021|"Biden needs to stop incentivizing people to not work.  
https://t.co/RyXFkByiIl"|en|R|7|10
1447996741635117056|1080574793630527505|Tue Oct 12 18:45:00 +0000 2021|"This should be concerning to every American. 

Big government at its finest. https://t.co/gTqY2REvOZ"|en|R|35|64
1447989325807898625|1080574793630527505|Tue Oct 12 18:15:32 +0000 2021|It is hard to sell a disastrous tax and spend package to the American people no matter how hard you try. https://t.co/Qc9ObYB5bT|en|R|111|485
1447984505810259971|1080574793630527505|Tue Oct 12 17:56:23 +0000 2021|"We have 7.7 million unemployed Americans, yet 51 % of small businesses reported they could not fill job openings in September. 

The Democrats agenda of higher taxes, more regulations, and incentivizing people to stay home is stifling the growth of Main Street."|en|R|4|17
1446566065832484871|1080574793630527505|Fri Oct 08 20:00:00 +0000 2021|"The Biden Administration refuses to take blame for their bad policies. 

Instead of addressing the problem, their solution is to spend trillions of more dollars at the taxpayers expense."|en|R|8|10
1446560841768308749|1080574793630527505|Fri Oct 08 19:39:15 +0000 2021|Enjoyed sitting down with the Columbia County Farm Bureau at the Morris Family restaurant in Bloomsburg to discuss their priorities and what’s important to them this morning. https://t.co/uwLrZlCBzd|en|R|1|5
1446520527502417929|1080574793630527505|Fri Oct 08 16:59:03 +0000 2021|The rest of the world has been getting competitive for the last 25 years and the U.S. needs to keep our edge. Biden’s tax plan crushes our competitive advantage, sending companies and opportunity back overseas. https://t.co/rwZElk5HIo|en|R|4|8
1446511195230515202|1080574793630527505|Fri Oct 08 16:21:58 +0000 2021|This week I spoke to General McMaster and Ambassador Crocker about the importance of transparency and accountability following our disastrous withdrawal from Afghanistan. https://t.co/oY9yAvKfmO|en|R|2|4
1446500292481142784|1080574793630527505|Fri Oct 08 15:38:39 +0000 2021|"Another self-inflicted crisis from the Biden Administration. 

Business owners are holding “HELP WANTED” signs while 7.7 million Americans are unemployed. 
https://t.co/uX3NphS62e"|en|R|3|10
1446225876836884483|1080574793630527505|Thu Oct 07 21:28:13 +0000 2021|"Producing American energy not only creates jobs and reduces energy prices for Americans, it keeps our allies from buying energy from adversaries.  

Biden’s policies are driving up prices, killing jobs, and empowering Russia &amp; OPEC. 
https://t.co/cpAZzW60Du"|en|R|2|7
1446211390428037121|1080574793630527505|Thu Oct 07 20:30:39 +0000 2021|Last night I joined the Schuylkill County Farm Bureau and State Rep. Joe Kerwin for dinner at Leibys to give a legislative update from Capitol Hill. I will continue to bring the needs of Pennsylvanians’ to Washington and advocate for what is best for the Commonwealth. https://t.co/jWzLMnnkg2|en|R|1|3
1446197321734279172|1080574793630527505|Thu Oct 07 19:34:45 +0000 2021|"You can expect to pay up to 20% more on holiday gifts this year due to inflation. 

Americans simply cannot afford Joe Biden’s agenda. 
https://t.co/vAEq0hvAPw"|en|R|5|6
1446150831804276738|1080574793630527505|Thu Oct 07 16:30:01 +0000 2021|"Owning a vehicle has become a burden in Joe Biden’s America. 

The national average for the price of gas has reached $3.22, the highest since 2014."|en|R|1|10
1446140834232115207|1080574793630527505|Thu Oct 07 15:50:17 +0000 2021|"In Joe Biden’s economy, even the dollar store is suffering from inflation. 
https://t.co/i90cCewv3E"|en|R|100|270
1445823116576313348|1080574793630527505|Wed Oct 06 18:47:47 +0000 2021|I will continue to advocate for small businesses in Pennsylvania and across the country. https://t.co/kGsBhGbO5N|en|R|6|13
1445499855560863747|1080574793630527505|Tue Oct 05 21:23:16 +0000 2021|"Joe Biden is looking to surrender our economy to the far left. 

We cannot afford the Democrats’ out of control spending agenda. @newsmax https://t.co/7vJQEXbzkv"|en|R|3|7
1445477769148698631|1080574793630527505|Tue Oct 05 19:55:30 +0000 2021|Spent this morning at the Pocono Prayer Breakfast discussing the importance of religious freedom. While in Congress, I will continue to support legislation that protects those freedoms. https://t.co/Nkov4Va6Dn|en|R|3|19
1445433612082589697|1080574793630527505|Tue Oct 05 17:00:02 +0000 2021|Joe Biden has surrendered to the far left.|en|R|2|15
1445418503125696516|1080574793630527505|Tue Oct 05 16:00:00 +0000 2021|Biden’s spending plan is big government socialism against free market capitalism.|en|R|4|8
1445413069748899844|1080574793630527505|Tue Oct 05 15:38:24 +0000 2021|"The Biden Administration’s words and policies have created incentives for many people from around the world to make the perilous journey to our border. This administration is directly to blame for the humanitarian crisis we are witnessing. 
https://t.co/BcxFxBqZnB"|en|R|2|2
1445403410212134912|1080574793630527505|Tue Oct 05 15:00:01 +0000 2021|We must demand accountability and transparency from Big Tech, especially when it comes to the safety and wellbeing of our children. https://t.co/T4QVvj346A|en|R|1|2
1445399613712777216|1080574793630527505|Tue Oct 05 14:44:56 +0000 2021|TUNE IN: I will be on @newsmax at 11:00 AM to discuss Biden and Democrats trying to sell their spending plan to the American people.|en|R|1|3
1445392938821984258|1080574793630527505|Tue Oct 05 14:18:25 +0000 2021|"Another lie from the Biden Administration. 

His agenda will raise taxes and the costs of goods and services will skyrocket. https://t.co/k8dPIWaUEa"|en|R|4|17
1445124063219765248|1080574793630527505|Mon Oct 04 20:30:00 +0000 2021|It is past time for President Biden to visit the border and address the crisis him and his administration created. https://t.co/3OzRDV2H87|en|R|3|4
1445116516354035719|1080574793630527505|Mon Oct 04 20:00:01 +0000 2021|Biden and Democrats want Republicans to raise the debt ceiling so they can spend trillions of dollars on their liberal agenda. This cannot happen.|en|R|15|35
1445109987236368403|1080574793630527505|Mon Oct 04 19:34:04 +0000 2021|The Democrats’ spending plan would be a disaster for our economy.|en|R|4|19
1443621724759724037|1080574793630527505|Thu Sep 30 17:00:15 +0000 2021|Our country's credit cards are maxed out. Instead of the Democrats looking to pay the bill, they are searching for higher spending limits.|en|R|2|6
1443293465090134023|1080574793630527505|Wed Sep 29 19:15:51 +0000 2021|"Imagine giving this Democrat Congress a blank check of the American taxpayers money. 

Terrifying. We cannot allow this to happen."|en|R|31|104
1443283079695568897|1080574793630527505|Wed Sep 29 18:34:35 +0000 2021|"TUNE IN: I will live on @newsmax at 3:00 PM to discuss the transportation and infrastructure vote and the Democrats disastrous reconciliation bill.  

WATCH: https://t.co/aKnUt4DkaL"|en|R|7|13
1443276571989757962|1080574793630527505|Wed Sep 29 18:08:44 +0000 2021|A blatant lie. The Democrats disastrous reconciliation bill will lead us to over $5T in debt and increase taxes on every American. https://t.co/Ur5HKqu5fo|en|R|42|82
1443265523446423553|1080574793630527505|Wed Sep 29 17:24:50 +0000 2021|"The Bipartisan Addiction and Mental Health Task Force is committed to finding solutions to aiding Americans who are struggling with addiction and mental health. 

We must keep the health and wellbeing of all Americans at the forefront of everything we do. https://t.co/AMBNNKl9Ye"|en|R|3|3
1443208692770426880|1080574793630527505|Wed Sep 29 13:39:00 +0000 2021|"Kamala Harris owes all who support Israel an apology and explanation. Her foolish woke view is wrong, per usual. 

Go to Israel and learn something, Madame VP. 
https://t.co/TlVKnHJ8kZ"|en|R|5|10
1442956139533160454|1080574793630527505|Tue Sep 28 20:55:27 +0000 2021|So much for a Biden promise to not raise taxes on those making less than $400,000 a household. https://t.co/NeVKJ7lLli|en|R|24|36
1442928318601318401|1080574793630527505|Tue Sep 28 19:04:54 +0000 2021|We could only wish they would put Kamala Harris in charge of reconciliation, so we would be assured it wouldn’t get done.|en|R|4|15
1442902920693833729|1080574793630527505|Tue Sep 28 17:23:58 +0000 2021|"Today's hearing on Afghanistan clearly shows Biden personally ignored the military advice and intel. 

He owns the unmitigated disaster in Afghanistan. https://t.co/yEGJS1GTyr"|en|R|9|30
1442898938919460864|1080574793630527505|Tue Sep 28 17:08:09 +0000 2021|I will not facilitate the largest tax increase in U.S. history by voting on a transportation and infrastructure bill that is being held hostage for the Democrats monstrous reconciliation bill. @MorningsMaria https://t.co/fPTvnruj3j|en|R|48|149
1442874238105374725|1080574793630527505|Tue Sep 28 15:30:00 +0000 2021|"I spoke on the House Floor about Democrat Leadership threatening my support of the T&amp;I bill by linking it to the reconciliation bill that would be the largest expansion of government and tax increases the American people have ever seen. 
https://t.co/pWV00aKjAk"|en|R|1|2
1442866695769526272|1080574793630527505|Tue Sep 28 15:00:02 +0000 2021|"Democrats are putting my support of the transportation and infrastructure bill in jeopardy by linking it to the $3.5 trillion tax and spend bill. One should not be dependent upon the other. 
https://t.co/6bYj4gVU83"|en|R|0|1
1442858822750572545|1080574793630527505|Tue Sep 28 14:28:45 +0000 2021|September is National Recovery Month. Let’s continue to support those who are in recovery and break down the social stigma that surrounds addiction. https://t.co/3UkLePX08Q|en|R|2|6
1442785725724909572|1080574793630527505|Tue Sep 28 09:38:17 +0000 2021|TUNE IN: I will be on @MorningsMaria at 6:10 AM to discuss the House voting on the transportation and infrastructure bill this week.|en|R|3|20
1442457520933539842|1080574793630527505|Mon Sep 27 11:54:07 +0000 2021|"TUNE IN: I will be live with @RJHarrisWHP580 at 8:35 AM to discuss the border crisis and much more! 

LISTEN:https://t.co/1nyidNaWBr"|en|R|3|3
1442438614827380741|1080574793630527505|Mon Sep 27 10:38:59 +0000 2021|TUNE IN: I will be joining @FinnertyUSA on @newsmax at 7:40 AM this morning to discuss the House voting on the transportation and infrastructure bill this week.|en|R|3|9
