id|user|created_at|text|lang|label|retweet_count|favorite_count
1176513204119310336|935033864|Tue Sep 24 15:06:21 +0000 2019|"Are you registered to vote? 🇺🇸

If you aren't, today is the day!  Make your vote count.… https://t.co/mwLBrU0R4n"|en|R|3|10
1175091334966915072|935033864|Fri Sep 20 16:56:21 +0000 2019|I want to thank the people of Stanly County for coming together in support of our female student athletes. I wish t… https://t.co/v9bH6TH7A1|en|R|2|9
1175050291097604097|935033864|Fri Sep 20 14:13:15 +0000 2019|Our service members put their lives on the line to protect our country &amp; deserve our gratitude. I voted for biparti… https://t.co/Jf1ziuknQ1|en|R|0|9
1174844047158054913|935033864|Fri Sep 20 00:33:43 +0000 2019|I’m up next. Tune in 👀📺 https://t.co/1PzWoz6lho|en|R|0|5
1174812647163871232|935033864|Thu Sep 19 22:28:56 +0000 2019|Our North Stanly High School students deserve to have someone stand up for them and their First Amendment right to… https://t.co/G0OsJLC7wq|en|R|2|14
1174728548675981313|935033864|Thu Sep 19 16:54:46 +0000 2019|"You can count on my to always stand up for our rights! 🇺🇸

https://t.co/CLjteYEz10"|en|R|0|5
1174711943053152257|935033864|Thu Sep 19 15:48:46 +0000 2019|I enjoyed seeing @CityAlbemarleNC Mayor Gerald Michael and City Manager Michael Ferris. We had a great discussion o… https://t.co/avRTShAW8c|en|R|1|4
1174673491045621760|935033864|Thu Sep 19 13:15:59 +0000 2019|As Stanly Co's Congressman, I am concerned our students are being punished for exercising their First Amendment rig… https://t.co/t9SS5TacaG|en|R|9|16
1174364249361178624|935033864|Wed Sep 18 16:47:10 +0000 2019|Honored to have Gen. Michael X. Garrett, commanding general of @FORSCOM, stop by the office today. I look forward t… https://t.co/k883wAJhTx|en|R|2|23
1174336648156520448|935033864|Wed Sep 18 14:57:29 +0000 2019|As Stanly Co's Congressman, I was concerned when I found out North Stanly students were put on probation by @NCHSAA… https://t.co/QKrQRn9391|en|R|12|48
1174291009800462336|935033864|Wed Sep 18 11:56:08 +0000 2019|I’ll be on The Pat McCrory Show with @PatMcCroryNC and @BoThompsonWBT at 9:35 AM on @wbtradio. Hope you can join us… https://t.co/EEtlSY9sEN|en|R|2|7
1174093970957381632|935033864|Tue Sep 17 22:53:10 +0000 2019|As I told @toddstarnes @foxnewsradio today, I'm concerned our North Stanly High School students are being punished… https://t.co/2YbYgZ0ktG|en|R|8|23
1173969805008887808|935033864|Tue Sep 17 14:39:47 +0000 2019|Looking forward to joining @toddstarnes at 1:05 PM today! As the representative of Stanly County, I am appalled the… https://t.co/rrN2ai4xrI|en|R|2|11
1173960064429936643|935033864|Tue Sep 17 14:01:05 +0000 2019|Just sent @nchsaa a letter questioning the recent probation of North Stanly High School cheerleaders. I'm appalled… https://t.co/zfXTHzJWxi|en|R|30|110
1173647427255111680|935033864|Mon Sep 16 17:18:46 +0000 2019|Over the last year, soldiers of @18airbornecorps served in challenging circumstances leading Operation Inherent Res… https://t.co/43SZMKV7x8|en|R|1|7
1172579070867124224|935033864|Fri Sep 13 18:33:30 +0000 2019|"FRIDAY NIGHT LIGHTS! 🏈

Tonight @Pinecrest_MCS @Pinecrest_FB and @UnionPinesHs @UPHS_Football face off in the Battl… https://t.co/TJXpDvFhP4"|en|R|0|5
1172535026698903554|935033864|Fri Sep 13 15:38:29 +0000 2019|Our community health centers play a vital role in providing high-quality, affordable care. This grant will ensure… https://t.co/04upwKUYsj|en|R|0|4
1172204969145098240|935033864|Thu Sep 12 17:46:57 +0000 2019|"Good luck to both teams in the Battle of the Pines!

https://t.co/aCt8D4xda9"|en|R|0|2
1172141459278950400|935033864|Thu Sep 12 13:34:35 +0000 2019|I admire my constituent Rich &amp; his family for their courage, &amp; I'm glad to see a companion to my bill, HR 2422, int… https://t.co/7IbK3vIyA4|en|R|0|2
1171829286778654727|935033864|Wed Sep 11 16:54:08 +0000 2019|It was pleasure to sit down with @ncpork this morning! Pork 🥓 is a vital part of NC’s agricultural industry and cul… https://t.co/b7tUP3ym3E|en|R|1|9
1171787520822140928|935033864|Wed Sep 11 14:08:10 +0000 2019|We must #NeverForget the lives we lost in New York, at the Pentagon, on Flight 93, and those who have perished in o… https://t.co/HGlg1YrdMc|en|R|2|12
1171787352085356545|935033864|Wed Sep 11 14:07:30 +0000 2019|18 yrs ago, I was in DC with a group from @cabarruschamber &amp; @RowanCo_Chamber. I'll never forget how I felt watchin… https://t.co/7ULXzp7xzi|en|R|0|5
1171491188873891841|935033864|Tue Sep 10 18:30:39 +0000 2019|Happy birthday to the world’s best wife and mom! 🎉🎈🎂 https://t.co/4dshuZdOdA|en|R|1|29
1171430637967818754|935033864|Tue Sep 10 14:30:02 +0000 2019|If you are in crisis or concerned about someone, there are trained responders ready to help 24/7. Visit… https://t.co/XEcevFeiuf|en|R|0|4
1171430066468732928|935033864|Tue Sep 10 14:27:46 +0000 2019|Our service members &amp; veterans are strong. But some may face depression, post-traumatic stress &amp; crisis. Among vets… https://t.co/RDR4SaM7gP|en|R|2|6
1171069006159208448|935033864|Mon Sep 09 14:33:03 +0000 2019|#HurricaneDorian devastated the Bahamas before making its way up the east coast. Renee &amp; I are continuing to pray f… https://t.co/1mg2u05d6X|en|R|0|3
1170320650059288577|935033864|Sat Sep 07 12:59:21 +0000 2019|Renee &amp; I join our community in mourning the loss of SFC Elis A. Barreto Ortiz. We send our condolences and are pra… https://t.co/2MwkgxT3Nv|en|R|3|12
1169295056232169473|935033864|Wed Sep 04 17:04:00 +0000 2019|Before #HurricaneDorian reaches North Carolina, I wanted to share important contact information &amp; resources that ma… https://t.co/3i7t7zDzBr|en|R|1|4
1169277820603904000|935033864|Wed Sep 04 15:55:31 +0000 2019|A huge thank you to our National Guard troops, first responders, swift water rescue teams and many others for their… https://t.co/efK4xrggDM|en|R|0|7
1168912959046860800|935033864|Tue Sep 03 15:45:41 +0000 2019|Hurricane #Dorian is a powerful storm. Some of the biggest threats we face inland are flooding, high wind and power… https://t.co/SY7V13Df5z|en|R|0|3
1168882314195144710|935033864|Tue Sep 03 13:43:55 +0000 2019|President @realDonaldTrump, we shouldn’t even consider surrendering to these butchers. We should stop negotiations… https://t.co/DeMNorHHUL|en|R|0|3
1168517079659687939|935033864|Mon Sep 02 13:32:36 +0000 2019|Happy #LaborDay! This is a time to recognize our workers – you. It’s a time to honor the contributions of our incre… https://t.co/NREx4XKHR8|en|R|10|38
1168178501742149633|935033864|Sun Sep 01 15:07:13 +0000 2019|Make sure you and your family are prepared! Be aware of the storm, stock up your emergency kits, and keep an eye on… https://t.co/UH6ZyuxO7M|en|R|3|8
1166717118794096640|935033864|Wed Aug 28 14:20:12 +0000 2019|And a big thank you to Mayor @Rleewithers, Coach @dsteveyang, @RowanCountyNC Commissioners, and our entire communit… https://t.co/78pg506r4d|en|R|2|19
1166714734093230087|935033864|Wed Aug 28 14:10:43 +0000 2019|"🚨BREAKING NEWS🚨

After @RepTedBudd &amp; I sent a letter to @realDonaldTrump yesterday, he invited @RowanLLsoftball tea… https://t.co/08oZXh01SG"|en|R|13|59
1166440212043620353|935033864|Tue Aug 27 19:59:52 +0000 2019|We're so proud of our @RowanLLsoftball team for winning the Softball @LittleLeague World Series (for the 2nd time i… https://t.co/HEvWEhmkK7|en|R|13|79
1166346885440974848|935033864|Tue Aug 27 13:49:01 +0000 2019|I agree. Our young ladies deserve the same honor. https://t.co/Tr4IvsD3rv|en|R|2|12
1165625923451928576|935033864|Sun Aug 25 14:04:11 +0000 2019|Happy birthday, @82ndABNDiv! Thank you to our incredible paratroopers - past and present - and your families for yo… https://t.co/XNpw8BW2jS|en|R|3|13
1164158542321979393|935033864|Wed Aug 21 12:53:20 +0000 2019|I agree with @Liz_Cheney and am confidant @realdonaldtrump won’t dishonor our service members who lost their lives… https://t.co/XUAcsTAgWu|en|R|2|7
1162377982759133184|935033864|Fri Aug 16 14:58:01 +0000 2019|Today is #NationalAirborneDay, and it marks the 79th anniversary of the first official @USArmy parachute jump. A hu… https://t.co/dHubv9FeU1|en|R|18|47
1162354888803856384|935033864|Fri Aug 16 13:26:15 +0000 2019|#Airborne #ATW https://t.co/J7aWqeaypr|und|R|0|5
1162024850015346688|935033864|Thu Aug 15 15:34:48 +0000 2019|"🎵We are the champions!🎵

Congratulations to @RowanLLsoftball for winning the Softball @LittleLeague World Series! W… https://t.co/U49StBfG7B"|en|R|2|10
1161672754602631168|935033864|Wed Aug 14 16:15:42 +0000 2019|"Last night @RowanLLsoftball beat Oregon in the semi-final game for the @LittleLeague Softball World Series!

So pro… https://t.co/g9UQirU92X"|en|R|1|4
1161341061840744449|935033864|Tue Aug 13 18:17:40 +0000 2019|When @POTUS dials 911, the phone rings here at @FtBraggNC! Thank you to our incredible men and women in uniform who… https://t.co/P5pzWoAZc1|en|R|18|88
1161340712241307648|935033864|Tue Aug 13 18:16:17 +0000 2019|Great to meet with some @82ndABNDiv paratroopers at @FtBraggNC and learn more about their readiness operations. The… https://t.co/TMAqEX7obf|en|R|0|5
1161294701036822529|935033864|Tue Aug 13 15:13:27 +0000 2019|They've done it again! Tonight @RowanLLsoftball faces Oregon in the semi-final game for the Little League Softball… https://t.co/SeF1zORceG|en|R|0|2
1161286698346696704|935033864|Tue Aug 13 14:41:39 +0000 2019|"Way to go, @RowanLLsoftball! 

https://t.co/KDKjHkrEQz"|en|R|0|2
1161282395506651136|935033864|Tue Aug 13 14:24:33 +0000 2019|"I was glad to visit with friends &amp; receive the @USChamber #SpiritofEnterprise award by @RowanCo_Chamber.

While I’m… https://t.co/zG4WzRJoOz"|en|R|0|4
1160945329027633152|935033864|Mon Aug 12 16:05:10 +0000 2019|"I told @theaward awardees, ""Your talent, time and service are God’s gifts to you. What you do with it is your gift… https://t.co/Dk4SKFCWql"|en|R|1|6
1160940860084822016|935033864|Mon Aug 12 15:47:24 +0000 2019|I’ve been a friend and supporter of @theaward for many years, and it’s all because of these incredible young men an… https://t.co/f1FrbWFYlk|en|R|1|6
1160910600718946305|935033864|Mon Aug 12 13:47:10 +0000 2019|I could not agree more. The Taliban has not changed its hateful ideology or stopped its brutal targeting of civilia… https://t.co/angg1YKywL|en|R|6|13
1159852559319883780|935033864|Fri Aug 09 15:42:53 +0000 2019|“There is a rush to ‘do something’ without regard for whether or not the ‘something’ would actually make a differen… https://t.co/0iBbTocg2U|en|R|1|2
1159838813503365120|935033864|Fri Aug 09 14:48:16 +0000 2019|"Our All Americans are #AlwaysReady to jump, fight and win anywhere in the world! 🇺🇸

#Airborne #AllTheWay #AATW https://t.co/5U8JGU8CLX"|en|R|21|79
1158398614131097601|935033864|Mon Aug 05 15:25:26 +0000 2019|"Based in my district @FtBraggNC, the @82ndABNDiv is our nation’s Global Response Force. 

The Division was constitu… https://t.co/MSraKCEExl"|en|R|5|9
1158145843737833473|935033864|Sun Aug 04 22:41:01 +0000 2019|This vile racism and hate has no place in our country. It’s up to all of us to get serious about addressing the roo… https://t.co/2TZszGTt3l|en|R|5|27
1158145720077225985|935033864|Sun Aug 04 22:40:31 +0000 2019|My wife Renee and I are saddened by the horrific violence in El Paso and Dayton. Our hearts break for the victims a… https://t.co/DY7fFUeEFf|en|R|1|7
1157368996548812800|935033864|Fri Aug 02 19:14:06 +0000 2019|Russia made a mockery of the INF Treaty and denied every opportunity to comply. America and our allies will not tur… https://t.co/vIagec0h4D|en|R|1|6
1157341310589820930|935033864|Fri Aug 02 17:24:05 +0000 2019|I am committed to ensuring our community’s most vulnerable young children can get the education and services they n… https://t.co/N6lGcdMihr|en|R|0|4
1157284639037435906|935033864|Fri Aug 02 13:38:53 +0000 2019|"The economy under @realDonaldTrump continues to do well with more jobs and higher wages! July’s numbers:

📈 164,000… https://t.co/q4Qn46Fg4K"|en|R|425|1904
1157025922463293446|935033864|Thu Aug 01 20:30:51 +0000 2019|I want to thank the National Director of @HeadStartgov, Dr. Bergeron, for her leadership, and I want to commend her… https://t.co/8Vz5aZx1x3|en|R|0|3
1157025685401231362|935033864|Thu Aug 01 20:29:54 +0000 2019|Our community has come together in a big way to get this program back on track because we all care deeply about the… https://t.co/xbtJgThcDJ|en|R|0|5
1157024921471672321|935033864|Thu Aug 01 20:26:52 +0000 2019|I am committed to ensuring our community’s most vulnerable young children can get the education &amp; services they nee… https://t.co/kvz77c2Ufu|en|R|2|5
1157024905222938629|935033864|Thu Aug 01 20:26:48 +0000 2019|Today I hosted a community meeting with the National Director of @HeadStartgov, local leaders, parents, and the new… https://t.co/L9l7A7FLLQ|en|R|0|1
1156613727719952384|935033864|Wed Jul 31 17:12:56 +0000 2019|We send our sincere condolences and are praying for SPC Nance’s and PFC Kreischer’s loved ones. I also ask for ever… https://t.co/Xp3lP7CiGf|en|R|3|6
1156613631360098307|935033864|Wed Jul 31 17:12:33 +0000 2019|Renee &amp; I join our country in mourning the tragic deaths of SPC Nance &amp; PFC Kreischer. These brave men stepped up w… https://t.co/EtbTPLRXK9|en|R|2|6
1156279304390660096|935033864|Tue Jul 30 19:04:03 +0000 2019|Chancellor Dubois and Lisa have been tireless advocates for @unccharlotte and I want to express my sincere apprecia… https://t.co/IQxsFq61yc|en|R|0|4
1156278950504607745|935033864|Tue Jul 30 19:02:39 +0000 2019|As both an alumnus &amp; the first Member of Congress to graduate from @unccharlotte, it has truly been a privilege wor… https://t.co/NqWYFQGQu5|en|R|0|20
1156278490540494849|935033864|Tue Jul 30 19:00:49 +0000 2019|Chancellor Dubois has spent nearly 20 years serving our great university &amp; has done so with steadfast leadership, u… https://t.co/HmFhszjTVJ|en|R|0|2
1154800043062419456|935033864|Fri Jul 26 17:06:00 +0000 2019|Representing the men and women who serve at @FtBraggNC is the greatest honor. I enjoyed spending time with some of… https://t.co/0OqaBXxzhj|en|R|3|11
1154119981187174401|935033864|Wed Jul 24 20:03:40 +0000 2019|It was a privilege to speak with members of @NCNationalGuard @USNationalGuard this afternoon. We are incredibly ble… https://t.co/4s4IZkmgFs|en|R|0|12
1153741160571121665|935033864|Tue Jul 23 18:58:22 +0000 2019|Congrats to our new @DeptofDefense Sec., Mark Esper. A veteran himself, @EsperDOD has a terrific record of supporti… https://t.co/AxSEwNPiGC|en|R|1|12
1153714769548980225|935033864|Tue Jul 23 17:13:30 +0000 2019|Today's legislation is a good step, but we need to have a vote on the bipartisan Senate bill with teeth. I’m disapp… https://t.co/9uZqz46ftD|en|R|13|34
1153714515151900672|935033864|Tue Jul 23 17:12:30 +0000 2019|The toxic attack on Israel’s right to exist has no place in our society. I encourage my colleagues to support today… https://t.co/NRqGy3T7Uk|en|R|1|3
1153360439423709185|935033864|Mon Jul 22 17:45:31 +0000 2019|I can’t believe we will never have the benefit of Leanne's advice, her encouragement, her infectious laugh or her b… https://t.co/hvjWu7YOrQ|en|R|1|3
1153360386025910272|935033864|Mon Jul 22 17:45:19 +0000 2019|Beyond that, Leanne cared deeply for our community and went out of her way to help me transition into my current jo… https://t.co/vWrQkxB5O1|en|R|1|4
1153360270783389697|935033864|Mon Jul 22 17:44:51 +0000 2019|Renee and I are deeply saddened by the death of Leanne Powell, a dear friend of more than 15 years. Leanne’s compas… https://t.co/ZhG2LAcYzW|en|R|1|4
1153349299725635584|935033864|Mon Jul 22 17:01:15 +0000 2019|"Congratulations to Concord native and @SpidersCHS graduate, Cydney Clanton! 🏌🏼‍♀️

https://t.co/dLw6nPF7r1"|en|R|1|4
1151892429454422016|935033864|Thu Jul 18 16:32:10 +0000 2019|"Today I asked for unanimous consent to vote on the Born-Alive Abortion Survivors Protection Act. 

Today was the 74… https://t.co/IIDahQE4kj"|en|R|182|428
1151852551740018689|935033864|Thu Jul 18 13:53:43 +0000 2019|Enjoyed welcoming @VP to @FtBraggNC. Whether it's strengthening opportunities for #MilSpouses, ensuring troops are… https://t.co/YlebKuLk6E|en|R|1|17
1151597126956306432|935033864|Wed Jul 17 20:58:45 +0000 2019|As @FtBraggNC’s Congressman, I was proud to welcome @VP Pence to our incredible community. The men and women who se… https://t.co/cqX2p71XsW|en|R|3|14
1151553226187116544|935033864|Wed Jul 17 18:04:18 +0000 2019|Glad to welcome @VP Pence to @FtBraggNC! https://t.co/AzMr8wXRuy|en|R|173|1231
1151156753901522944|935033864|Tue Jul 16 15:48:52 +0000 2019|Joining @HelsinkiComm to examine the important role religious actors and interfaith institutions play in developing… https://t.co/XS9bRP0O1P|en|R|2|6
1150776247062028289|935033864|Mon Jul 15 14:36:52 +0000 2019|My wife Renee and I send our deepest condolences to SGM Sartor’s family and teammates. We pray they feel God’s comf… https://t.co/n5gyL84cD4|en|R|3|24
1149760435303800833|935033864|Fri Jul 12 19:20:23 +0000 2019|House Ds aren’t just abandoning decades of bipartisan tradition– they’re abandoning our troops &amp; their families. Th… https://t.co/vxKfV6bsuW|en|R|5|15
1149365859883900928|935033864|Thu Jul 11 17:12:29 +0000 2019|Today, @HouseCommerce Subcommittee on Health is working on several bipartisan bills on #surprisebilling, improving… https://t.co/hmilAD3BdR|en|R|0|5
1149346427350528000|935033864|Thu Jul 11 15:55:16 +0000 2019|"""NC lawmaker Hudson continues fight to help Fort Bragg soldier battling cancer""

@ABC11_WTVD: https://t.co/2WbHzxRmba"|en|R|1|1
1148952379854852096|935033864|Wed Jul 10 13:49:28 +0000 2019|We’re fortunate to have students like Bryson who work to better themselves while serving our community and helping… https://t.co/eS5zNXyKon|en|R|3|6
1148617726237261824|935033864|Tue Jul 09 15:39:40 +0000 2019|Mr. Perot is admired here at Fort Bragg because of his tremendous humanitarian efforts &amp; support for our service me… https://t.co/dZgfAvyI6F|en|R|2|3
1148617554115616769|935033864|Tue Jul 09 15:38:59 +0000 2019|I’m incredibly sad to hear about Ross Perot’s passing. Mr. Perot was an American entrepreneur, veteran and patriot… https://t.co/TINtN4jvbp|en|R|1|7
1148274865948024838|935033864|Mon Jul 08 16:57:16 +0000 2019|Great to join Up Front with @CabarrusMag to talk about our gratitude for America's men &amp; women in uniform. We also… https://t.co/vVzHSdGWUc|en|R|1|6
1146773675779219456|935033864|Thu Jul 04 13:32:04 +0000 2019|"Happy #IndependenceDay! 

As we celebrate #FourthOfJuly, join me in praying for our service members, veterans and m… https://t.co/JIE5NrSkE8"|en|R|4|21
1145774064461635584|935033864|Mon Jul 01 19:19:59 +0000 2019|I was shocked &amp; saddened to hear that my friend Sam passed away. Renee &amp; I are praying for his wife Shannon &amp; their… https://t.co/Z2mLdMhSPP|en|R|2|5
1145719308816912384|935033864|Mon Jul 01 15:42:24 +0000 2019|In this week's newsletter, I discussed celebrating Fourth of July, saying thank you to America's men and women in u… https://t.co/0iMpJb6K8C|en|R|2|5
1144675595546177536|935033864|Fri Jun 28 18:35:03 +0000 2019|I always enjoy visiting with constituents, hearing what's on your mind and showing you the @uscapitol, but these tw… https://t.co/Yda9qQewD5|en|R|1|9
1144361404746665989|935033864|Thu Jun 27 21:46:34 +0000 2019|Finally.. Pelosi allowed a vote &amp; the House passed the Senate’s bipartisan border &amp; humanitarian aid bill. But this… https://t.co/G85EybZIL8|en|R|3|10
1144334394703908865|935033864|Thu Jun 27 19:59:15 +0000 2019|Proud 🇺🇸 https://t.co/VFYJI4rgVL|en|R|0|3
1144304682329870338|935033864|Thu Jun 27 18:01:11 +0000 2019|We must do everything we can to help those who are suffering from invisible wounds. If you are a service member or… https://t.co/QyQZ5rbbH7|en|R|2|6
1144304106217050113|935033864|Thu Jun 27 17:58:53 +0000 2019|Many people struggle with #PTSD – particularly our service members. We’ve passed laws to address the tragedy of vet… https://t.co/Qdd4lSzEBl|en|R|2|6
1144272330790776834|935033864|Thu Jun 27 15:52:37 +0000 2019|Yesterday the Senate overwhelmingly passed a bipartisan border and humanitarian aid bill, 84-8. I’m joining my coll… https://t.co/UZRC6BVYIa|en|R|28|64
1144249253512040449|935033864|Thu Jun 27 14:20:55 +0000 2019|My wife Renee &amp; I join our country in mourning the deaths of Green Beret Master Sgt. Michael B. Riley &amp; Sgt. James… https://t.co/2PZf8XjWtX|en|R|0|8
1143948424242520064|935033864|Wed Jun 26 18:25:32 +0000 2019|Thank you @ABCGovAffairs @ABCCarolinas for presenting me with the Merit Shop Eagle Award. Growing up &amp; working summ… https://t.co/z2yjTSe7gJ|en|R|2|8
1143908789046976514|935033864|Wed Jun 26 15:48:02 +0000 2019|Good luck to my good friend and House GOP Whip @SteveScalise who is taking the field tonight as Team @GOP's leadoff… https://t.co/KAIBBcjsQP|en|R|0|16
1143887835193323522|935033864|Wed Jun 26 14:24:46 +0000 2019|I’ve worked hard to restore coverage and benefits for our Blue Water Vietnam veterans, and I’m thrilled President… https://t.co/oFvrq03qLs|en|R|1|3
1143589420030988289|935033864|Tue Jun 25 18:38:59 +0000 2019|It was an honor to meet the 2019 Stars of Life from @MecklenburgEMS - Joshua, Cynthia and Justin.  I will continue… https://t.co/eeXtnbse7W|en|R|6|11
1142165774112628737|935033864|Fri Jun 21 20:21:55 +0000 2019|However, I urge a democratic &amp; peaceful resolution to the current tensions. I’ll continue to support #Georgia’s dem… https://t.co/7cxroXXhND|en|R|2|4
1142165716008951808|935033864|Fri Jun 21 20:21:41 +0000 2019|As a @HelsinkiComm member, I’m following events at the Georgian Parliament in Tbilisi. Given #Russia’s illegal occu… https://t.co/9QJwK2FRNH|en|R|7|13
1142093412780392448|935033864|Fri Jun 21 15:34:23 +0000 2019|Great to meet you two today. Keep up to good work! https://t.co/yt7ikx8MnY|en|R|0|2
1141814859010588672|935033864|Thu Jun 20 21:07:30 +0000 2019|This is a great win for religious liberty, and I'm proud to have been a part of the amicus brief led by… https://t.co/yXzQsYcnPk|en|R|40|199
1141789720223133697|935033864|Thu Jun 20 19:27:37 +0000 2019|As a member of @theaward board, I was honored to speak to the 2019 Gold Medalists and their families this afternoon… https://t.co/c1OxAEFhlf|en|R|1|7
1141723075458850818|935033864|Thu Jun 20 15:02:48 +0000 2019|Job training programs at @RCCCedu &amp; other community colleges are 1 of the greatest assets we have for job growth. I… https://t.co/0z1lJzNoSa|en|R|1|4
1141463949470306304|935033864|Wed Jun 19 21:53:07 +0000 2019|Glad the House supported my amendment to increase funding to study &amp; tackle the root causes of school violence, inc… https://t.co/ctyzXcdKKw|en|R|3|19
1141405674494185477|935033864|Wed Jun 19 18:01:33 +0000 2019|Great to meet with Annie and Grace, two constituents from Southern Pines, in between a committee hearing and votes.… https://t.co/c0646yhhfm|en|R|3|5
1141345976415870976|935033864|Wed Jun 19 14:04:20 +0000 2019|"⬇️ Please share ⬇️

The Cape Fear Valley Blood Donor Center says critical Type O blood could be depleted within day… https://t.co/LSUsZ00qu3"|en|R|2|3
1140251354042122240|935033864|Sun Jun 16 13:34:42 +0000 2019|Being Lane’s Dad is the greatest blessing... Happy Father's Day to all the incredible dads out there! #FathersDay https://t.co/2aFzM1wzMt|en|R|1|10
1139545866367381504|935033864|Fri Jun 14 14:51:20 +0000 2019|Happy birthday, President @realDonaldTrump! 👍🏼 https://t.co/QcP9m2ejYR|en|R|4|11
1138833480887033856|935033864|Wed Jun 12 15:40:35 +0000 2019|As Vice-Chair of the @HelsinkiComm Ad Hoc Committee on Countering Terrorism, I’m holding today’s hearing to further… https://t.co/WpXfJejifv|en|R|3|14
1138794202890981376|935033864|Wed Jun 12 13:04:30 +0000 2019|Looking forward to chairing this important hearing today at 10:30 AM. Tune in here ⬇️⬇️⬇️ https://t.co/G36N42KEYF|en|R|2|3
1138562340142616576|935033864|Tue Jun 11 21:43:10 +0000 2019|Congrats to Command Sgt. Maj. Michael Grinston for his selection as the 16th Sergeant Major of the @USArmy. He has… https://t.co/Bz6sJbplfT|en|R|0|4
1138468277838065665|935033864|Tue Jun 11 15:29:23 +0000 2019|It is a privilege to nominate incredible high school students like Lance to our service academies. I applaud Lance… https://t.co/R5mTgfY8rF|en|R|1|5
1138130039571144705|935033864|Mon Jun 10 17:05:21 +0000 2019|Behind the scenes of today’s @uscapitol tour with @Team_Penske and @IndyCar #Indy500 winner @simonpagenaud. 🏆🏁 https://t.co/hKRXVDcijm|en|R|14|113
1138090939761811456|935033864|Mon Jun 10 14:29:59 +0000 2019|When real life superheroes show up to your superhero party 👍🏼👨🏿‍🚒👩🏼‍🚒 https://t.co/h55eCqopjM|en|R|0|7
1137056335462326272|935033864|Fri Jun 07 17:58:50 +0000 2019|Did you know #NationalDonutDay was created to honor the @SalvationArmyUS Donut Lassies who served donuts to soldier… https://t.co/qSq3SzlJFb|en|R|3|11
1137021364659982336|935033864|Fri Jun 07 15:39:52 +0000 2019|"Humbled to join @realDonaldTrump in paying tribute to a great American and #WWII hero! 🇺🇸

https://t.co/126LmuR9ch… https://t.co/IpsZSVezpQ"|en|R|1|3
1136975761401888768|935033864|Fri Jun 07 12:38:40 +0000 2019|Enjoyed catching up with @PatMcCroryNC and @BoThompsonWBT this morning on @wbtradio... but I think they might have… https://t.co/E2S28bGw9N|en|R|1|7
