id|user|created_at|text|lang|label|retweet_count|favorite_count
1075919382407192576|935033864|Fri Dec 21 01:02:25 +0000 2018|I voted yes on today's CR that includes @POTUS’s requested $5 B in border security. We have a crisis at our souther… https://t.co/nV84ld3dvG|en|R|23|84
1075906310342881282|935033864|Fri Dec 21 00:10:28 +0000 2018|Secretary Mattis is a patriot, and I am grateful for his incredible service to our country. As Fort Bragg’s Congres… https://t.co/57pbcuy4KL|en|R|8|41
1075835172078186497|935033864|Thu Dec 20 19:27:47 +0000 2018|I made a promise to my constituents that I would fight for common sense border security. We have a crisis at our so… https://t.co/dcZ3Tr60xe|en|R|841|3716
1075753812495867905|935033864|Thu Dec 20 14:04:30 +0000 2018|The impact of Concord-Padgett Regional Airport on our economy and community can’t be overstated. You can count on m… https://t.co/7yy46LbhzZ|en|R|1|6
1075486379319140352|935033864|Wed Dec 19 20:21:49 +0000 2018|A CR until Feb &amp; no border wall funding? Give me a break. Kicking the can down the road will not secure our border.… https://t.co/slaYOVuGfA|en|R|29|82
1075059148688101377|935033864|Tue Dec 18 16:04:09 +0000 2018|New year, new me... eting space. We’ve moved! Your new #NC08 Congressional office is 2112 Rayburn House Office Buil… https://t.co/p8ajbjWqMs|en|R|5|22
1073999645725089792|935033864|Sat Dec 15 17:54:04 +0000 2018|Congratulations to @MickMulvaneyOMB on being named Acting White House Chief of Staff. He’s smart and respected on a… https://t.co/UZKLnZFqpV|en|R|1|14
1072971891135127553|935033864|Wed Dec 12 21:50:08 +0000 2018|As we’ve seen this year, our farmers and rural communities face enormous uncertainty from natural disasters and unf… https://t.co/naI2T3YwUt|en|R|0|4
1072971824579907587|935033864|Wed Dec 12 21:49:52 +0000 2018|"BREAKING 📰 HOUSE PASSES 2018 FARM BILL, SENDING IT TO PRESIDENT TRUMP'S DESK

https://t.co/iJxbI5ireM https://t.co/CerVFsqktO"|en|R|0|3
1072924557428867072|935033864|Wed Dec 12 18:42:03 +0000 2018|"On the twelfth day of December, my true love gave to me...

🍩🍩🍩🍩
🍩🍩🍩🍩
🍩🍩🍩🍩 https://t.co/yZMVdjo6CX"|en|R|1|9
1072889601583403010|935033864|Wed Dec 12 16:23:08 +0000 2018|We’ve taken significant federal action to combat fentanyl – including cutting off foreign shipments and giving our… https://t.co/k7EO6GjNR0|en|R|2|6
1072603295028514817|935033864|Tue Dec 11 21:25:28 +0000 2018|There’s worldwide agreement that Nord Stream II is a terrible idea. We cannot allow Russia to dramatically increase… https://t.co/uaQQ0AagSk|en|R|0|2
1072531451986497537|935033864|Tue Dec 11 16:39:59 +0000 2018|Writing cards with @RedCross to send to our troops who are serving &amp; away from home this holiday season. We are gra… https://t.co/XG8uEQpXuT|en|R|3|9
1072221227601793024|935033864|Mon Dec 10 20:07:16 +0000 2018|🚨🚨 North Carolina residents impacted by Hurricane Florence have until 11:59 p.m. Thursday, Dec. 13, 2018 to registe… https://t.co/Hp9nCasmto|en|R|1|1
1072162481810882563|935033864|Mon Dec 10 16:13:50 +0000 2018|In times like this, we are grateful for the service of the @NCNationalGuard, @NCDOT crews, linemen, EMS, first resp… https://t.co/wg8NdwWkw0|en|R|2|13
1071113679276568576|935033864|Fri Dec 07 18:46:16 +0000 2018|TONIGHT #NC08's Seventy-First High School faces Scotland High School in the 4A East Regional. Let’s go, Falcons!… https://t.co/zIRVgZRd6v|en|R|0|2
1071111291132174337|935033864|Fri Dec 07 18:36:46 +0000 2018|TONIGHT #NC08's Pinecrest High School hits the road to take on Wake Forest for the final four of the North Carolina… https://t.co/8iR09oAnso|en|R|0|5
1071101280150544385|935033864|Fri Dec 07 17:56:59 +0000 2018|Today, we reflect on the selfless service of America’s men and women in uniform and we pay tribute to those we lost… https://t.co/eIz8nfI7Zo|en|R|1|4
1071046384357384193|935033864|Fri Dec 07 14:18:51 +0000 2018|Snow, sleet, freezing rain.. a winter storm is expected to impact NC this weekend. Time to get prepared! ❄️🌨️☃️ https://t.co/81FoN2O3m4|en|R|0|2
1070354298037518336|935033864|Wed Dec 05 16:28:45 +0000 2018|"Renee and I continue to mourn the passing of President George H.W. Bush and pray for the Bush family.

Watch the St… https://t.co/z1S05GdWOS"|en|R|0|3
1069929366086475776|935033864|Tue Dec 04 12:20:13 +0000 2018|TUNE IN: I’m joining @wbtradio at 7:50 this morning. 📻 https://t.co/l9GQrGWzA7|en|R|1|2
1069741470838599683|935033864|Mon Dec 03 23:53:36 +0000 2018|#Bush41 always answered the call to serve, &amp; he did so with the utmost decency, integrity &amp; patriotism. Just as imp… https://t.co/Ymx1hXpTj2|en|R|2|10
1069740875943677953|935033864|Mon Dec 03 23:51:14 +0000 2018|Renee and I continue to mourn the passing of President George H.W. Bush and pray for the Bush family. I was honored… https://t.co/uLb1ppcbns|en|R|0|4
1069708685516124161|935033864|Mon Dec 03 21:43:19 +0000 2018|Awaiting the arrival of #Bush41 #Remembering41 https://t.co/M5cBFSnWBB|en|R|1|2
1069699604009140224|935033864|Mon Dec 03 21:07:14 +0000 2018|On my way to the Capitol. Here’s the view from Cannon House Office Building of lights preparing for President Georg… https://t.co/AAZ1qiJwcq|en|R|1|5
1069695640219852805|935033864|Mon Dec 03 20:51:29 +0000 2018|Today at 5:00 p.m., the Bush family and friends, the vice president, members of Congress, and members of the admini… https://t.co/elWPqFhLx4|en|R|1|4
1069695490235740160|935033864|Mon Dec 03 20:50:53 +0000 2018|Former President George H.W. Bush will lie in state in the U.S. Capitol Rotunda starting this evening and members o… https://t.co/nPXERdwnRq|en|R|2|5
1069679399971274752|935033864|Mon Dec 03 19:46:57 +0000 2018|Happy birthday to the Queen City! @CLTgov turns 250 today, and I am incredibly proud to honor this special occasion… https://t.co/wNi2Y6scP3|en|R|4|11
1069609554210627585|935033864|Mon Dec 03 15:09:24 +0000 2018|President George H. W. Bush's service dog, Sully, lies next to the president’s casket as our nation mourns. Man's b… https://t.co/0P58O1MKuD|en|R|0|5
1068881608231530497|935033864|Sat Dec 01 14:56:48 +0000 2018|Renee and I are saddened to learn of the passing of President George H. W. Bush. We extend our deepest sympathy and… https://t.co/QOiBrDzGbw|en|R|4|17
1068527165061222401|935033864|Fri Nov 30 15:28:23 +0000 2018|The Security Forces Assistance Command (SFAC) &amp; the 2nd Security Force Assistance Brigade (SFAB) officially activat… https://t.co/qbjBq09Auz|en|R|0|5
1068208822269952002|935033864|Thu Nov 29 18:23:24 +0000 2018|I applaud @POTUS @realDonaldTrump for his sound judgement &amp; strong leadership regarding the INF Treaty &amp; Russian ag… https://t.co/7FnZXzdykn|en|R|1|6
1068164917797285889|935033864|Thu Nov 29 15:28:56 +0000 2018|"The Greatest Generation 🇺🇲️

https://t.co/0OhowNB9El"|en|R|0|1
1067919807348117509|935033864|Wed Nov 28 23:14:57 +0000 2018|We pray for God’s peace, comfort and healing and for full recoveries for the other Americans who were injured. Our… https://t.co/eddYmUGOyC|en|R|1|12
1067919707720830978|935033864|Wed Nov 28 23:14:33 +0000 2018|Renee &amp; I send our sincere condolences to the families of Sgt. 1st Class Eric M. Emond, Capt. Andrew P. Ross, and S… https://t.co/7Ys1Mhdm6F|en|R|1|3
1067444692583890944|935033864|Tue Nov 27 15:47:01 +0000 2018|Renee &amp; I join our country in mourning the loss of these service members. We pray for their families &amp; for the Amer… https://t.co/T3JyZoSZgN|en|R|2|6
1067109942459604992|935033864|Mon Nov 26 17:36:50 +0000 2018|With the kids out of school and our nation’s capital decorated for Christmas, now would be a great time to plan a t… https://t.co/ZnkoS0xaS2|en|R|0|4
1066337982498656256|935033864|Sat Nov 24 14:29:21 +0000 2018|SHARE if you are participating in Small Business Saturday! Shopping small makes a big difference - you can get a gr… https://t.co/yVVjQXMRGt|en|R|2|8
1065625090438717445|935033864|Thu Nov 22 15:16:34 +0000 2018|Renee, Lane &amp; I want to wish you and your family a happy Thanksgiving! As we count our blessings, please join us in… https://t.co/hpBHy89IGg|en|R|1|8
1064577342901751808|935033864|Mon Nov 19 17:53:12 +0000 2018|ICYMI: In this week's newsletter, I discussed my ongoing work on hurricane Florence recovery efforts and tackling G… https://t.co/nCO7uKlkN2|en|R|1|2
1063151022976196608|935033864|Thu Nov 15 19:25:30 +0000 2018|This Congress, the House has approved 70+ bills to improve care and support for veterans. There have been over 2 do… https://t.co/dClsKyo0fn|en|R|4|10
1062744263333740544|935033864|Wed Nov 14 16:29:11 +0000 2018|This morning I met with @NC_Governor and my colleagues in the North Carolina delegation to discuss ongoing Florence… https://t.co/axiY4I1zyM|en|R|1|6
1062380433999048704|935033864|Tue Nov 13 16:23:28 +0000 2018|"Heavy rain has caused water to pool in several roadways across Moore County. 

https://t.co/xoEDEzqBax?"|en|R|1|1
1061676727255138304|935033864|Sun Nov 11 17:47:11 +0000 2018|Proud to join @realdonaldtrump for the American Commemoration Ceremony to mark the 100th Anniversary of the end of… https://t.co/W3ZtBYoD16|en|R|4|17
1061619513819578368|935033864|Sun Nov 11 13:59:50 +0000 2018|To the men and women who answered America's call to service and your families, thank you. #VeteransDay https://t.co/mfi8OFQ5vV|en|R|1|7
1061272992976683008|935033864|Sat Nov 10 15:02:53 +0000 2018|Happy 243rd birthday to the @USMC! Thank you to all of our brave Marines and your families. #SemperFi https://t.co/RDB3h0XLWz|en|R|3|12
1060936772337762304|935033864|Fri Nov 09 16:46:52 +0000 2018|This week, we are celebrating service members, veterans, and military spouse entrepreneurs during Veterans Small Bu… https://t.co/tG0d5hfDv0|en|R|0|6
1060913713610399744|935033864|Fri Nov 09 15:15:14 +0000 2018|"""When dark falls, the people of a Matthews neighborhood listen for the lonely military call that signals a days’ en… https://t.co/N0MQyRG1x5"|en|R|3|9
1060559199833387008|935033864|Thu Nov 08 15:46:32 +0000 2018|Renee and I are saddened by this senseless act of violence. We join our community in praying for #ThousandOaks and… https://t.co/8qEbjcqoZz|en|R|1|6
1059848189640142849|935033864|Tue Nov 06 16:41:14 +0000 2018|Lane has an important message: make sure you get out and vote today! Men and women have served and died to protect… https://t.co/n4PHH8ixHB|en|R|3|35
1059500837792374784|935033864|Mon Nov 05 17:40:58 +0000 2018|Last week’s jobs report was great news. We saw the biggest jump in wages since 2009, more Americans joining the lab… https://t.co/KZj8V2lPG1|en|R|1|8
1059472540278624260|935033864|Mon Nov 05 15:48:32 +0000 2018|"The Department of Veterans Affairs (VA) motto reads: ""To care for him who shall have borne the battle and for his w… https://t.co/HV9qYIAm6H"|en|R|1|7
1059084957543481345|935033864|Sun Nov 04 14:08:25 +0000 2018|Join us in wishing Congressman Hudson a happy birthday! We hope it’s the #GoldStandard. -NC08 Staff https://t.co/88XrVOGiIz|en|R|2|15
1058756037388439554|935033864|Sat Nov 03 16:21:24 +0000 2018|As Kannapolis and Concord’s Congressman, I am looking forward to the #BattleForTheBell between @ALBrownFootball and… https://t.co/goMJxS3oUq|en|R|0|4
1058714411555262464|935033864|Sat Nov 03 13:36:00 +0000 2018|I was proud to welcome the @SecondLady to our community and share with her @Rriveterbags, one of the many incredibl… https://t.co/mA6t1vFhhw|en|R|4|10
1058480138315358208|935033864|Fri Nov 02 22:05:05 +0000 2018|"#MadeInAmerica #MadeInNC08 #MadeByYourCongressman

@Rriveterbags https://t.co/7BPQxkI6hF"|und|R|0|4
1058475441336533004|935033864|Fri Nov 02 21:46:25 +0000 2018|I enjoyed showing the @SecondLady an incredible small business in Moore County #NC08. I’m so proud of the folks at… https://t.co/q1USnFEzyo|en|R|0|1
1058437943566786561|935033864|Fri Nov 02 19:17:25 +0000 2018|Great day at @FtBraggNC with the @SecondLady, service members and military spouses #NC08 https://t.co/6yOc5jh29A|en|R|0|6
1058386055152484352|935033864|Fri Nov 02 15:51:14 +0000 2018|“Stellar!” https://t.co/JsDo3w6Smw|tr|R|2|7
1058375194467885056|935033864|Fri Nov 02 15:08:04 +0000 2018|I’m excited to welcome @SecondLady Pence to @FtBraggNC today to meet with military families. #NC08 #NCpol 🇺🇸 https://t.co/gWEuokInuq|en|R|2|5
1057699947099942912|935033864|Wed Oct 31 18:24:53 +0000 2018|"We're continuing to make good progress → Wages and salaries have increased by 3.1%—the highest level in a decade.

https://t.co/vOmRivKnW6"|en|R|3|8
1057677078039089152|935033864|Wed Oct 31 16:54:00 +0000 2018|ICYMI: With the most significant federal action against a drug crisis in history, we’re getting more resources to o… https://t.co/XMqVLWxAfc|en|R|2|3
1057641358511521792|935033864|Wed Oct 31 14:32:04 +0000 2018|Important information from @fema regarding Public Assistance Applicant Briefings in Stanly, Cabarrus and Rowan Coun… https://t.co/5fadWYfsQ8|en|R|1|1
1057297620820025344|935033864|Tue Oct 30 15:46:11 +0000 2018|The STOP School Violence Act also provides funding for technology and equipment – metal detectors, locks, lighting,… https://t.co/aC4PbiN3o8|en|R|0|7
1057297528679550977|935033864|Tue Oct 30 15:45:49 +0000 2018|Tackling the root causes of school violence &amp; protecting students remains a top priority. @POTUS signed the STOP Sc… https://t.co/F1z8X7O0g0|en|R|1|7
1057296506422812674|935033864|Tue Oct 30 15:41:45 +0000 2018|My wife Renee and I are continuing to pray for students, parents, and faculty of Butler High School. I also want to… https://t.co/VJRmeBJnyO|en|R|1|11
1056925844160086016|935033864|Mon Oct 29 15:08:52 +0000 2018|ICYMI: With the most significant federal action against a drug crisis in history, we’re getting more resources to o… https://t.co/xd2dorXqIP|en|R|1|4
1056167165752164352|935033864|Sat Oct 27 12:54:09 +0000 2018|Today is the DEA’s #TakeBackDay, a safe &amp; responsible way to dispose of excess prescription drugs. And, it’s an opp… https://t.co/00bBokdZ0H|en|R|5|9
1055789531876806656|935033864|Fri Oct 26 11:53:34 +0000 2018|"I’ll be with @990weeb this morning at 8:30 AM. Hope you can join us. You can listen online here ⬇️

https://t.co/XYDyKZr0Lb"|en|R|0|5
1055421225130954752|935033864|Thu Oct 25 11:30:03 +0000 2018|🔈I’m joining @BoThompsonWBT @wbtradio at 7:50 AM to discuss our ongoing work to combat the opioid crisis and yester… https://t.co/nsmcDFdCTI|en|R|2|7
1055400985244430337|935033864|Thu Oct 25 10:09:37 +0000 2018|Good morning! I'm joining @WPTF at 6:40 AM to talk about yesterday’s important bill signing and our ongoing efforts… https://t.co/74oJZPw4rl|en|R|0|2
1055172086254186502|935033864|Wed Oct 24 19:00:04 +0000 2018|I’m grateful for @POTUS @realDonaldTrump's strong leadership, and I’m hopeful this comprehensive package, including… https://t.co/tLVmy90TLr|en|R|0|4
1055171659521515522|935033864|Wed Oct 24 18:58:22 +0000 2018|BREAKING NEWS: With the most significant federal action against a drug crisis in history, we’re getting more resour… https://t.co/UbwBiT24jH|en|R|0|5
1055163510198599680|935033864|Wed Oct 24 18:25:59 +0000 2018|Thank you, @POTUS @realDonaldTrump and @FLOTUS, for your tremendous work and leadership to combat the opioid crisis… https://t.co/N0Wgs3kdnd|en|R|1|7
1055158839698472961|935033864|Wed Oct 24 18:07:25 +0000 2018|Great to see my good friend @SecWilkie at the @WhiteHouse today. We share the same goal of improving care for our v… https://t.co/mhRoQiDQ6H|en|R|0|4
1055150928641380353|935033864|Wed Oct 24 17:35:59 +0000 2018|At 2 PM, @realDonaldTrump will sign HR6, bipartisan legislation to combat the #opioidcrisis &amp; dedicate more resourc… https://t.co/BW8VJK4OtI|en|R|0|4
1055124511354482688|935033864|Wed Oct 24 15:51:01 +0000 2018|Opioid addiction continues to devastate families in #NC08. I'm on Facebook LIVE at the @WhiteHouse as we get ready… https://t.co/sxrKYM05z0|en|R|2|7
1055121945530957824|935033864|Wed Oct 24 15:40:49 +0000 2018|I’m here at the @WhiteHouse to join @POTUS @realDonaldTrump as we take historic action to combat the opioid crisis… https://t.co/Nx8Ro2WOQj|en|R|1|6
1055092099568279553|935033864|Wed Oct 24 13:42:13 +0000 2018|My bill, which is included in today's bipartisan package, to address #opioids with packaging and disposal is a comm… https://t.co/lXMIzF7GUA|en|R|2|5
1055091543600758784|935033864|Wed Oct 24 13:40:01 +0000 2018|Today @POTUS @realDonaldTrump is signing bipartisan opioids legislation, which includes 3 of my bipartisan bills th… https://t.co/786qOSFJZ7|en|R|2|8
1055091475409702917|935033864|Wed Oct 24 13:39:45 +0000 2018|Today's an important day in our ongoing fight to stop the #opioidcrisis. I’m proud of the bipartisan work we’ve don… https://t.co/uZR5AbLfSf|en|R|3|4
1054841984081367042|935033864|Tue Oct 23 21:08:21 +0000 2018|Today I stopped by @ConcordMillsNC, the largest outlet and value retail shopping destination in NC, to meet with wo… https://t.co/Xi0FzkqLx8|en|R|1|10
1054791662411616256|935033864|Tue Oct 23 17:48:24 +0000 2018|Important information from @fema regarding Public Assistance Applicant Briefings in Hoke, Cabarrus and Stanly Count… https://t.co/WafaEZ9EGI|en|R|4|4
1054734921330290689|935033864|Tue Oct 23 14:02:55 +0000 2018|I was honored to join “Opioids: Hidden Dangers, New Hope,” a new podcast series that provides a 360-degree view of… https://t.co/vXgFhBhLlu|en|R|3|9
1054460879788498946|935033864|Mon Oct 22 19:53:59 +0000 2018|Opioid addiction continues to devastate families in #NC08. Partnering with local stakeholders, my colleagues and th… https://t.co/s2Aap9WNuK|en|R|2|6
1054383713189093376|935033864|Mon Oct 22 14:47:21 +0000 2018|#TakeBackDay is a convenient &amp; responsible way to dispose of excess prescription drugs. And it’s an opportunity to… https://t.co/Tw8m5i2Ey9|en|R|0|4
1054383387685937153|935033864|Mon Oct 22 14:46:03 +0000 2018|Please share! As part of my ongoing efforts to combat the opioid and prescription drug crisis, I wanted to let you… https://t.co/ji6RAdzUfe|en|R|9|14
1053326962977112064|935033864|Fri Oct 19 16:48:12 +0000 2018|"Undoing years of military cuts is a top priority for me. So far, we have:

➡️Given our troops a well-deserved pay r… https://t.co/OnsNLpQQkk"|en|R|5|12
1052990124370391042|935033864|Thu Oct 18 18:29:43 +0000 2018|It was great to join @FayNC_Chamber and receive the “Spirit of Enterprise” award. Working with President Donald Tru… https://t.co/j8CAKVFsaM|en|R|0|7
1052931535043813376|935033864|Thu Oct 18 14:36:55 +0000 2018|Working with President Donald Trump, we’ve cut your taxes, gotten rid of burdensome red tape and unleashed the Amer… https://t.co/mfDluIUVQy|en|R|4|8
1052931438562168832|935033864|Thu Oct 18 14:36:32 +0000 2018|The good news continues... https://t.co/kmwlXnNSYK|en|R|4|13
1052616524731752448|935033864|Wed Oct 17 17:45:10 +0000 2018|Great to join the Montgomery County Farm Bureau. Agriculture remains a top industry in NC, and that’s a testament t… https://t.co/QBS2xASgZx|en|R|0|2
1052555063665860610|935033864|Wed Oct 17 13:40:57 +0000 2018|"ICYMI - @Reuters: U.S. regains crown as most competitive economy for first time since 2008

https://t.co/ijTgoIzLnJ"|en|R|3|6
1052221568204660737|935033864|Tue Oct 16 15:35:45 +0000 2018|".@CNBC: The U.S. economy is set to look good 'for quite some time.’ 

https://t.co/0dqvoWy8wP"|en|R|3|5
1051889706118651916|935033864|Mon Oct 15 17:37:03 +0000 2018|IMPORTANT: A new Disaster Recovery Center for folks to get help &amp; answers to questions about disaster assistance is… https://t.co/RI9TzBOd9X|en|R|1|4
1051801320590589952|935033864|Mon Oct 15 11:45:51 +0000 2018|"I’ll be with @990weeb this morning at 8:30 AM. Hope you can join us. You can listen online here ⬇️

https://t.co/VxuLSx5Rmb"|en|R|1|3
1051768252903374848|935033864|Mon Oct 15 09:34:27 +0000 2018|Good morning! I'll be joining @WPTF at 7:20 AM to talk about Pastor Andrew Brunson and the team effort to secure hi… https://t.co/X167zz7KMK|en|R|1|2
1051219308691492864|935033864|Sat Oct 13 21:13:08 +0000 2018|Happy birthday to the world’s greatest seapower, @USNavy! Today we salute our incredible Sailors for your service a… https://t.co/qKsokJUdFX|en|R|0|5
1051181495468138497|935033864|Sat Oct 13 18:42:53 +0000 2018|This is an incredible moment for the Brunson family and for America! Welcome home, Pastor Brunson. https://t.co/6yVWpjoTg7|en|R|1|9
1051122842555822080|935033864|Sat Oct 13 14:49:49 +0000 2018|My amendment to demand #PastorBrunson's release was adopted at an international @oscepa meeting in July. It sent a… https://t.co/YxhYlwmbPQ|en|R|1|9
1051121874774740993|935033864|Sat Oct 13 14:45:58 +0000 2018|What a great day for the Brunson family and for America! I am grateful for @realDonaldTrump’s leadership to bring P… https://t.co/ujOLpdpKhO|en|R|1|7
1050750225986580481|935033864|Fri Oct 12 14:09:10 +0000 2018|My amendment to demand #PastorAndrewBrunson's release was adopted at the international @oscepa meeting in July. It… https://t.co/nLqH7Jb3N9|en|R|9|12
1050748967510843393|935033864|Fri Oct 12 14:04:10 +0000 2018|NC Pastor Andrew Brunson has been freed. All we can say now is thank God. I’m glad this terrible chapter is closed,… https://t.co/2yO1uFKkUy|en|R|14|30
1050739789924843521|935033864|Fri Oct 12 13:27:42 +0000 2018|Pastor Andrew Brunson has been wrongfully imprisoned and his charges should have been dropped a long time ago. Pray… https://t.co/NPsxxcu4YF|en|R|4|9
1050397419073097728|935033864|Thu Oct 11 14:47:14 +0000 2018|"*MORE IMPORTANT FLOOD SAFETY TIPS* 

➡️If trapped in a building, go to the highest floor.
➡️DO NOT climb into a clo… https://t.co/xWwwbJQQHH"|en|R|2|6
1050397151510089730|935033864|Thu Oct 11 14:46:11 +0000 2018|"We have a high risk of flash flooding &amp; are expecting several rivers to flood

📢Follow local officials &amp;… https://t.co/mwQ2HQksd3"|en|R|4|4
1050052261362196480|935033864|Wed Oct 10 15:55:42 +0000 2018|"""Speaking in Washington, Lt. Gen. Laura Richardson, the deputy commanding general of U.S. Army Forces Command, said… https://t.co/zgmDMK3a9T"|en|R|1|6
1049752368986947591|935033864|Tue Oct 09 20:04:02 +0000 2018|These are numbers you don’t want to miss. While there is still more work to do, our economy is #BetterOffNow. https://t.co/3x30sOtIDW|en|R|23|49
1048279016967471104|935033864|Fri Oct 05 18:29:28 +0000 2018|"""In 2018, manufacturers are on track to record their highest confidence levels in the survey’s 20-year history, tha… https://t.co/y39jfiaK4R"|en|R|1|6
1048278880514166785|935033864|Fri Oct 05 18:28:55 +0000 2018|Today is national #ManufacturingDay and we pause to celebrate the contributions of our incredible manufacturing wor… https://t.co/xzxxKwisur|en|R|1|10
1048239640568897539|935033864|Fri Oct 05 15:53:00 +0000 2018|Great news ➡️ the unemployment rate fell to the lowest level since December 1969. Working with President Trump, we… https://t.co/lkCoQ6Jagr|en|R|6|21
1047874463344283648|935033864|Thu Oct 04 15:41:55 +0000 2018|This bipartisan opioid package, which includes 3 of my bills, advances treatment &amp; recovery, improves prevention, p… https://t.co/9oyKF9qBQO|en|R|4|12
1047587278107942912|935033864|Wed Oct 03 20:40:44 +0000 2018|Today Congress passed 3 of my bipartisan bills as part of HR 6. I’ve met countless people who became addicted to pa… https://t.co/AA1JIqBBwi|en|R|3|10
1047566935645462529|935033864|Wed Oct 03 19:19:54 +0000 2018|Folks need help now, &amp; getting responsible disaster relief funding was truly a bipartisan effort. This is just the… https://t.co/5WZpdJFbaA|en|R|3|8
1047545893531136000|935033864|Wed Oct 03 17:56:18 +0000 2018|Great to have @IvankaTrump at @NASCARTechUTI for a discussion on job training. We've made incredible progress to tr… https://t.co/ITMPsFKOM2|en|R|149|866
1047148023753658368|935033864|Tue Oct 02 15:35:18 +0000 2018|"""National wage growth is at the highest it’s been in nearly 17 months -- and, according to a new study released by… https://t.co/arSHfeRgTY"|en|R|2|5
1046783404493230080|935033864|Mon Oct 01 15:26:26 +0000 2018|In this week's newsletter, I discussed my efforts to get targeted disaster relief funding to aid North Carolina’s r… https://t.co/A2LhBdPkl9|en|R|1|4
1045823190881177600|935033864|Fri Sep 28 23:50:53 +0000 2018|Great news! Mike is the toughest guy I know! https://t.co/znPCvMiBH2|en|R|1|8
1045774660078641152|935033864|Fri Sep 28 20:38:03 +0000 2018|Learn more about my efforts here: https://t.co/TIQN0IPHwe|en|R|1|4
1045774567384453122|935033864|Fri Sep 28 20:37:41 +0000 2018|"🚨 @realDonaldTrump signed into law my amendment to increase funding for Special Forces 🚨

The men and women at… https://t.co/tRaGJ3dVDt"|en|R|1|9
1045715276594139136|935033864|Fri Sep 28 16:42:05 +0000 2018|I’ve met and spoken with countless people who became addicted to pain bills they took from the family medicine cabi… https://t.co/g3s5muIvIM|en|R|1|3
1045715133924864001|935033864|Fri Sep 28 16:41:31 +0000 2018|Today the House passed 3 of my bipartisan bills, including the SOUND Disposal and Packaging Act, as part of H.R. 6,… https://t.co/JPFoxbt503|en|R|2|4
1045419447501160450|935033864|Thu Sep 27 21:06:33 +0000 2018|Today the House passed 2 bills, part of Tax Reform 2.0, that would simplify &amp; expand family savings, make permanent… https://t.co/EdAmUBe4TN|en|R|31|79
1045364501044854784|935033864|Thu Sep 27 17:28:13 +0000 2018|As @FtBraggNC's Congressman, I'm fighting to fully fund our great military &amp; ensure we remain the world’s top fight… https://t.co/NEOkri4abs|en|R|3|9
