id|user|created_at|text|lang|label|retweet_count|favorite_count
1341488041467260940|935033864|Tue Dec 22 20:57:27 +0000 2020|Today, we laid @ConcordNCPolice Officer Jason Shuping to rest. Prayers continue for his family and the entire Conco… https://t.co/NRiiVq34Ud|en|R|3|24
1341207515154018305|935033864|Tue Dec 22 02:22:44 +0000 2020|After months of intentional stalling by Speaker Pelosi, Congress has finally passed a COVID-19 relief package that… https://t.co/7Z2UYgA7K4|en|R|5|10
1339553519926472710|935033864|Thu Dec 17 12:50:21 +0000 2020|Renee &amp; I are devastated to learn of the officer-involved shooting last night in Concord. Our thoughts and prayers… https://t.co/QLgGEZnoJe|en|R|4|26
1338492878826385408|935033864|Mon Dec 14 14:35:44 +0000 2020|"This is great news for North Carolina and our country!

Operation Warp Speed is a modern day miracle thanks to Pres… https://t.co/AJkQDv3iVH"|en|R|5|58
1337059337949368321|935033864|Thu Dec 10 15:39:22 +0000 2020|Join me and my @HouseGOP colleagues at 11:30am as we call on Speaker Pelosi and House Democrats to extend the… https://t.co/1Ed8iCtWVF|en|R|18|109
1336720305637756930|935033864|Wed Dec 09 17:12:10 +0000 2020|Another number to add to this list➡️ 𝟏.𝟐 𝐦𝐢𝐥𝐥𝐢𝐨𝐧 𝐣𝐨𝐛𝐬 were saved in North Carolina thanks to the Paycheck Protectio… https://t.co/3XMjcXUGZg|en|R|18|83
1336350412056780800|935033864|Tue Dec 08 16:42:21 +0000 2020|Just wrapped meeting with @HelsinkiComm. As a member and chair of @oscepa's Political Affairs and Security Committe… https://t.co/vhAn2vPJzX|en|R|3|6
1336025180049698817|935033864|Mon Dec 07 19:09:59 +0000 2020|Congress should have passed another round of COVID-19 relief months ago for workers and small businesses. But last… https://t.co/1Xv7ilrrWJ|en|R|45|151
1335947922203095043|935033864|Mon Dec 07 14:03:00 +0000 2020|"God bless those who are willing to sacrifice everything in service to our great nation. 🇺🇸

#GreatestGeneration… https://t.co/vHRKGVSBhm"|en|R|2|7
1334980958576136193|935033864|Fri Dec 04 22:00:37 +0000 2020|Thank you @SebGorka for supporting HR38 (Concealed Carry Reciprocity). I introduced this bill to protect law abidin… https://t.co/U8MStJJVrM|en|R|58|371
1334868412032495621|935033864|Fri Dec 04 14:33:24 +0000 2020|Yesterday, House Democrats continued to block a vote to extend the #PPP and instead voted on a Tiger King bill. Tod… https://t.co/azTf5m6UyY|en|R|256|750
1334617327422337026|935033864|Thu Dec 03 21:55:41 +0000 2020|"By increasing access to multi-cancer early detection screening tests through Medicare, we can save lives.

I look f… https://t.co/Hqr2fbb9WF"|en|R|7|14
1334537888336400387|935033864|Thu Dec 03 16:40:01 +0000 2020|I sent a letter to Sec. Miller calling the Defense Department’s delay in processing medical malpractice claims unac… https://t.co/aHsjpk5O7W|en|R|4|10
1334245541316792320|935033864|Wed Dec 02 21:18:20 +0000 2020|Congratulations to @cathymcmorris on being named Republican Leader of @HouseCommerce! I look forward to working tog… https://t.co/tZ1Dk4doVL|en|R|4|12
1331968753513467904|935033864|Thu Nov 26 14:31:12 +0000 2020|"Happy #Thanksgiving! 

As we count our blessings today, please join me in thanking our service members, veterans an… https://t.co/qfBm8Arpuf"|en|R|4|14
1331282313016201220|935033864|Tue Nov 24 17:03:32 +0000 2020|Thanks to President @realDonaldTrump's Operation Warp Speed, we will soon have a safe and effective COVID-19 vaccin… https://t.co/SNluzBcKSa|en|R|37|170
1330151867045777410|935033864|Sat Nov 21 14:11:32 +0000 2020|"Happy Birthday, North Carolina!
 
The Old North State became the 12th state to enter the Union on this date in 1789. https://t.co/ke0z44T8QH"|en|R|9|24
1329525800908021760|935033864|Thu Nov 19 20:43:46 +0000 2020|Congratulations to @RepJimBanks on being elected chairman of @RepublicanStudy! Looking forward to working together,… https://t.co/VWB6P7sNv0|en|R|4|17
1329440926767386629|935033864|Thu Nov 19 15:06:31 +0000 2020|On National #RuralHealthDay, we must recognize the unique health challenges rural areas face and recommit ourselves… https://t.co/kR8F51lcrt|en|R|3|7
1329193419898548227|935033864|Wed Nov 18 22:43:01 +0000 2020|The House has passed my Combating Pandemic Scams Act which I helped introduce to protect seniors and our most vulne… https://t.co/nZjZZm6vxx|en|R|3|9
1328787399409868805|935033864|Tue Nov 17 19:49:38 +0000 2020|I’m honored to join @HouseGOP's leadership team to coordinate our communications strategies so we can take our case… https://t.co/oAJtN6FCtz|en|R|22|142
1328452544117542912|935033864|Mon Nov 16 21:39:02 +0000 2020|The Lumbee Recognition Act has passed the US House. I'm proud to have sponsored this bill and worked to get it appr… https://t.co/HaigHPzKgI|en|R|12|52
1327646838011392000|935033864|Sat Nov 14 16:17:27 +0000 2020|Join Renee and me in praying for the families of these 5 soldiers, including our own CW3 Dallas Garza of Fayettevil… https://t.co/qTGJdcraNl|en|R|4|16
1327290215157948418|935033864|Fri Nov 13 16:40:21 +0000 2020|Iran's double dealing had to be addressed and President @realDonaldTrump has done just that - depriving Iran of bil… https://t.co/ITe8HqWCir|en|R|2|8
1326175606212620290|935033864|Tue Nov 10 14:51:18 +0000 2020|Happy Birthday, @USMC! Thank you for your 245 years of service, bravery, and commitment to protect our freedom and… https://t.co/zxDLhWugfg|en|R|2|11
1325838315413790724|935033864|Mon Nov 09 16:31:01 +0000 2020|Great news for America from North Carolina 8th District’s own, @pfizer! All thanks to dedicated employees like thos… https://t.co/EUmZ27xc8H|en|R|8|23
1325598020122112001|935033864|Mon Nov 09 00:36:11 +0000 2020|What a great moment! #NASCAR #NASCARPlayoffs #nascarchampion https://t.co/RvVhOJiecD|en|R|2|14
1325241526331576322|935033864|Sun Nov 08 00:59:36 +0000 2020|Election results remain unofficial &amp; the process is far from over. Americans deserve transparency &amp; I support Presi… https://t.co/WhN2D4nf95|en|R|2171|6118
1323428347666452480|935033864|Tue Nov 03 00:54:40 +0000 2020|My prayers are with those affected by the apparent terrorist attack in #Vienna. As Chairman of the Committee on Sec… https://t.co/EVjUvkaLYO|en|R|3|29
1322205023896555527|935033864|Fri Oct 30 15:53:37 +0000 2020|I’m honored to lead this effort to pass targeted solutions to combat COVID-19 and prepare for future pandemics, alo… https://t.co/N7IQV0nnyx|en|R|9|19
1321931703741538304|935033864|Thu Oct 29 21:47:33 +0000 2020|As Fort Bragg’s Congressman, it was an honor to be first to welcome @realDonaldTrump and @FLOTUS to base today. I a… https://t.co/dGCEnJbXNm|en|R|7|23
1321219286443134982|935033864|Tue Oct 27 22:36:39 +0000 2020|Religious freedom is a fundamental human right and America’s defining right. It is imperative that we continue to p… https://t.co/5Il1VsQxYi|en|R|4|17
1320750740785299461|935033864|Mon Oct 26 15:34:49 +0000 2020|God bless all our service members who are deployed and have been deployed. Thank you for your sacrifice!… https://t.co/dIzVWYxMz9|en|R|3|13
1316012843599228941|935033864|Tue Oct 13 13:48:06 +0000 2020|Starting off this morning at @KCS_NC’s Wonder Career Center with @ChipBuckwell to talk about improvements to their… https://t.co/e7AeOlfoT2|en|R|5|17
1313578346559741960|935033864|Tue Oct 06 20:34:17 +0000 2020|Proud to join @RepHolding, @PatrickMcHenry and other colleagues on cosponsoring a bill today to allow nonprofit fir… https://t.co/WTul50XXe9|en|R|1|9
1312030902508228609|935033864|Fri Oct 02 14:05:18 +0000 2020|Renee &amp; I offer our prayers to @POTUS @realDonaldTrump &amp; @FLOTUS. As with all Americans affected by this virus, we… https://t.co/o4edDZyFTS|en|R|7|17
1311707456662274048|935033864|Thu Oct 01 16:40:02 +0000 2020|Starting this month, the @DeptVetAffairs Caregiver Program is finally expanded to veterans injured before 9/11 than… https://t.co/A9jGLPppw1|en|R|5|11
1311358912650764293|935033864|Wed Sep 30 17:35:03 +0000 2020|Protecting electric grid security in and around @FtBraggNC is crucial to our national security, as well as the need… https://t.co/jiWbheUK0v|en|R|4|15
1311026813037162498|935033864|Tue Sep 29 19:35:24 +0000 2020|The House has passed my bill to advance American manufacturing as part of the COMPETE Act. I thank @HouseCommerce a… https://t.co/ayLBBhg8Wr|en|R|2|6
1310715012688863233|935033864|Mon Sep 28 22:56:25 +0000 2020|I wrote the bill to improve the disposal of unwanted Rx drugs that contribute to the #opioidcrisis- but I know ther… https://t.co/IcTDGVmqUg|en|R|2|7
1310682257498279936|935033864|Mon Sep 28 20:46:16 +0000 2020|After a tour of @CabarrusHealth, President @realDonaldTrump’s “Drug Czar” joined me for a roundtable discussion wit… https://t.co/ZFWnErBnJe|en|R|4|9
1310656904469897216|935033864|Mon Sep 28 19:05:31 +0000 2020|"Honored to host President @realDonaldTrump's ""Drug Czar"" in #NC08 today to discuss ways we can continue to combat t… https://t.co/wLFtiPhG28"|en|R|4|10
1309585894622584832|935033864|Fri Sep 25 20:09:42 +0000 2020|This week I met with my @OSCEPA leadership colleagues to address the current political turmoil in Belarus and pursu… https://t.co/cfE8WcgF6G|en|R|1|4
1308517264875028481|935033864|Tue Sep 22 21:23:21 +0000 2020|A waiver has been granted for NC to allow special needs students with an innovations waiver to have respite care du… https://t.co/zlUFFot8EG|en|R|1|4
1308413801851650048|935033864|Tue Sep 22 14:32:14 +0000 2020|Small businesses are the backbone of our local economies, creating jobs and giving back during times of prosperity… https://t.co/6IDR23GP6y|en|R|4|15
1308068254984933376|935033864|Mon Sep 21 15:39:09 +0000 2020|Proud to work with @SenThomTillis, @SenatorBurr, and @RepDanBishop to secure a $13.1 million grant award from… https://t.co/Y9Zh1ZXV1I|en|R|6|17
1307335114456797190|935033864|Sat Sep 19 15:05:55 +0000 2020|Happy birthday, Sgt. Cole! Thank you for your service and for continuing to make our community proud. 🇺🇸 https://t.co/tt0BENSjsL|en|R|5|17
1307136209500729346|935033864|Sat Sep 19 01:55:32 +0000 2020|Tonight I want to acknowledge Justice Ginsburg’s decades of service to our nation. My prayers are with her family at this time.|en|R|3|28
1306940812962529280|935033864|Fri Sep 18 12:59:06 +0000 2020|Today, we honor our service members, their families, and the commitment to bringing them home. Remember these heroe… https://t.co/51i8dZRocO|en|R|3|8
1306578274936672258|935033864|Thu Sep 17 12:58:30 +0000 2020|Happy #ConstitutionDay, America! May #WeThePeople continue to uphold the morals and values that have allowed us to… https://t.co/46xdlhY4Rs|en|R|4|12
1306302653291532288|935033864|Wed Sep 16 18:43:17 +0000 2020|Congratulations to Judy Rose on this well-deserved honor! As only the 3rd female Division I Athletic Director in NC… https://t.co/X6kj6wkwhG|en|R|1|7
1306270160194613249|935033864|Wed Sep 16 16:34:10 +0000 2020|ICYMI: A $3 million project will provide broadband internet service to 1,300 homes in Moore County, NC. Thank you P… https://t.co/4XXmBr8F6y|en|R|1|3
1305965191415332866|935033864|Tue Sep 15 20:22:19 +0000 2020|Honored to be here for the portrait unveiling for my friend and Former @HouseAgGOP Chairman, @ConawayTX11! He is a… https://t.co/Vss8tCUc9j|en|R|2|4
1305890083241955336|935033864|Tue Sep 15 15:23:52 +0000 2020|“Republicans helped build the greatest economy in a generation and the American way of life was thriving. We will d… https://t.co/xtBmJF8RN8|en|R|84|384
1305599996545433602|935033864|Mon Sep 14 20:11:10 +0000 2020|Proud to join my NC @HouseGOP colleagues and so many others to oppose any efforts to defund the police. Our law enf… https://t.co/7KVMzk7Hd8|en|R|1|7
1304415039408033793|935033864|Fri Sep 11 13:42:34 +0000 2020|Today, we honor the nearly 3,000 lives taken far too soon, and the first responders who sacrificed everything to sa… https://t.co/0i0yDmfY0S|en|R|4|10
1304154542028845056|935033864|Thu Sep 10 20:27:27 +0000 2020|Thank you @SecretarySonny and the @NCFarmBureau for joining me today in NC to hear directly from farmers in our reg… https://t.co/6hLZ0g2QSn|en|R|1|1
1304085056995176451|935033864|Thu Sep 10 15:51:20 +0000 2020|Connecting our rural communities to broadband has never been more important than right now. Thank you President… https://t.co/nHDgiXntTa|en|R|2|6
1304074113271693312|935033864|Thu Sep 10 15:07:51 +0000 2020|Honored to welcome @USDA @SecretarySonny to #NC08 to discuss rural broadband and other priorities for our farmers.… https://t.co/eAzjRg2d6p|en|R|4|11
1303362249218830336|935033864|Tue Sep 08 15:59:10 +0000 2020|September is #SuicidePrevention Month and an important time to recognize suicide as a public health issue. Because… https://t.co/d897nXsBVZ|en|R|5|10
1302931161656815617|935033864|Mon Sep 07 11:26:10 +0000 2020|Happy #LaborDay! Today we recognize the remarkable American workers who make up the greatest labor force in the wor… https://t.co/VSwKKLQSJv|en|R|2|8
1302233621475061762|935033864|Sat Sep 05 13:14:24 +0000 2020|This MSM “anonymous source” hit piece is garbage. @realDonaldTrump loves our military men and women and rebuilt our… https://t.co/hX9EI57AF8|en|R|489|1094
1301864587906764801|935033864|Fri Sep 04 12:47:59 +0000 2020|“There has been a lot of news lately about what’s happening with the @USPS. Like many of you, when I saw these head… https://t.co/1IPgK5ecGf|en|R|26|55
1301571505529200640|935033864|Thu Sep 03 17:23:23 +0000 2020|Proud to work closely with the Trump administration and my @HouseGOP colleagues to protect every baby’s right to li… https://t.co/28FlgYGKXm|en|R|119|582
1301519622794088454|935033864|Thu Sep 03 13:57:13 +0000 2020|Great to see so many in Germany calling for an end to Nord Stream 2 after Russia's poisoning of Navalny. As a membe… https://t.co/ttuYo1txz7|en|R|2|7
1301253965204598784|935033864|Wed Sep 02 20:21:36 +0000 2020|As Fort Bragg’s Congressman, it was an honor to welcome @SecArmy to Fayetteville to discuss priorities for our mili… https://t.co/5WOoeHqf1i|en|R|3|6
1301156485838368769|935033864|Wed Sep 02 13:54:15 +0000 2020|Let us never forget the sacrifices made by the #GreatestGeneration who bravely defended our country while in pursui… https://t.co/iFLGr3iOxx|en|R|10|38
1300828997471830018|935033864|Tue Sep 01 16:12:55 +0000 2020|Expanding access to health care for rural communities in North Carolina has remained a top priority for me. I appla… https://t.co/Ps8toFnU1q|en|R|1|2
1300530203685462019|935033864|Mon Aug 31 20:25:37 +0000 2020|On this #InternationalOverdoseAwarenessDay, find helpful resources below. We’ve made great progress to combat the… https://t.co/PApBHcHE9g|en|R|1|1
1299732698039230464|935033864|Sat Aug 29 15:36:37 +0000 2020|I applaud the statement this week by #Taiwan President Tsai Ing-Wen on the easing of restrictions on imports of US… https://t.co/k1M0XLQ1ne|en|R|12|55
1299085496845508608|935033864|Thu Aug 27 20:44:52 +0000 2020|I appreciate @SecretaryCarson visiting our community today for a roundtable discussion with local leaders about aff… https://t.co/QDmJ1tnr2v|en|R|24|86
1298791654149812224|935033864|Thu Aug 27 01:17:15 +0000 2020|Thank you @SecondLady for recognizing #nc08’s own R. Riveter tonight- an amazing business run by military spouses w… https://t.co/cAEU9NvtJs|en|R|16|66
1298695552130060289|935033864|Wed Aug 26 18:55:22 +0000 2020|Thank you President @realDonaldTrump for continuing to lead and provide vital support to our nation's most vulnerab… https://t.co/GIqbd9PqmK|en|R|0|4
1298609332670652416|935033864|Wed Aug 26 13:12:46 +0000 2020|#IRS Reminder: IRA owners, beneficiaries or workplace retirement plan participants who received a Required Minimum… https://t.co/3uNObBTVGc|en|R|1|1
1298341268918079491|935033864|Tue Aug 25 19:27:35 +0000 2020|I brought the EPA to #NC08 in 2018 to hear directly from our community on #PFAS &amp; #GenX. Today, I hosted… https://t.co/ESUGyYALqs|en|R|0|0
1298258069369974785|935033864|Tue Aug 25 13:56:58 +0000 2020|Tune in LIVE to our #PFAS Action Plan roundtable in Fayetteville with @EPAAWheeler where we are discussing updates… https://t.co/0i0uPh2ecP|en|R|4|3
1296553801386790912|935033864|Thu Aug 20 21:04:49 +0000 2020|As a delegate to the @oscepa, I joined members from across Europe to discuss strategies for contributing to a democ… https://t.co/hKXm1MeG8v|en|R|1|6
1296103020732854272|935033864|Wed Aug 19 15:13:35 +0000 2020|It was an honor to host @SecBrouillette at @FAYTECHCC  yesterday to discuss a program that connects veterans with j… https://t.co/NBXXrh98KO|en|R|4|6
1295780580483891200|935033864|Tue Aug 18 17:52:19 +0000 2020|Tune in to our program from @FAYTECHCC Community College as we join @ENERGY @SecBrouillette and @DukeEnergy to high… https://t.co/2MVa5OBoZP|en|R|2|2
1295751630621741058|935033864|Tue Aug 18 15:57:17 +0000 2020|It was an honor to host @ENERGY @SecBrouillette at @FtBraggNC this morning for a discussion with Lt. Gen. Kurilla o… https://t.co/STVfjYtqDa|en|R|7|17
1294380512799268865|935033864|Fri Aug 14 21:08:57 +0000 2020|Congratulations to Air Force Master Sgt. John Grimesey on being awarded the Silver Star today for heroic actions in… https://t.co/MWTlKXDXh4|en|R|3|8
1294038092547006465|935033864|Thu Aug 13 22:28:17 +0000 2020|I applaud President @realDonaldTrump for forging a historic peace deal between Israel and the UAE today. Thanks to… https://t.co/coRyntFDeA|en|R|2|18
1293622822154260480|935033864|Wed Aug 12 18:58:09 +0000 2020|Thank you President @realdonaldtrump for your leadership to support bus facilities and transportation in Fayettevil… https://t.co/O2A6gkrkIU|en|R|3|10
1293263083209723912|935033864|Tue Aug 11 19:08:41 +0000 2020|North Carolinians and Americans are hurting as a result of #COVID19 and it's up to Congress to ensure they have the… https://t.co/foie2nYsDz|en|R|1|2
1291730454467551232|935033864|Fri Aug 07 13:38:34 +0000 2020|"There is more to do, but I’m glad our efforts have helped lead to three straight months of job growth. 

Working to… https://t.co/qxOghu10vq"|en|R|2|9
1291698985426706432|935033864|Fri Aug 07 11:33:31 +0000 2020|As Fort Bragg’s Congressman, I know that freedom comes with a cost, and our veterans, soldiers and their families a… https://t.co/RdSyatuluB|en|R|15|50
1290696450935062529|935033864|Tue Aug 04 17:09:48 +0000 2020|Yesterday's Executive Order signed by President @realDonaldTrump will improve health care in rural communities &amp; ex… https://t.co/3kjuiET9oS|en|R|3|4
1290675168722001921|935033864|Tue Aug 04 15:45:14 +0000 2020|Proud to join @HouseCommerce colleagues @repgregwalden and @cathymcmorris in writing to @amazon, @Facebook and… https://t.co/o3k0RLMJ63|en|R|2|5
1290660884973584384|935033864|Tue Aug 04 14:48:28 +0000 2020|Please join me in wishing a Happy 230th Birthday to the @USCG! Thank you to all the Coast Guard men &amp; women – espec… https://t.co/pCsni9ApIY|en|R|2|6
1290092006035857408|935033864|Mon Aug 03 01:07:57 +0000 2020|I thank President @realDonaldTrump for signing a disaster declaration for North Carolina today as we prepare for… https://t.co/A8mwwmi41h|en|R|7|27
1289298722786930688|935033864|Fri Jul 31 20:35:44 +0000 2020|While the final regulation published today for the @DeptVetAffairs Program of Comprehensive Assistance for Family C… https://t.co/kPoDcQxhqz|en|R|2|4
1288952506773635076|935033864|Thu Jul 30 21:39:59 +0000 2020|As Fort Bragg's Congressman and a dad, I care deeply about our military and improving education. Amendments I secur… https://t.co/Wzh1P66rAA|en|R|1|5
1288868184062398464|935033864|Thu Jul 30 16:04:55 +0000 2020|It was great to join @VP @Mike_Pence  yesterday in NC to discuss how to safely reopen schools and the great progres… https://t.co/weZAxBeEv1|en|R|2|9
1288566177833324544|935033864|Wed Jul 29 20:04:51 +0000 2020|Following our first event on school safety with Sec. @BetsyDeVosED, @VP @Mike_Pence is now leading a discussion wit… https://t.co/rEVCWF4lny|en|R|63|302
1288530488357990403|935033864|Wed Jul 29 17:43:02 +0000 2020|Great to help welcome @VP @Mike_Pence back to North Carolina today! Look forward to discussing how to safely reopen… https://t.co/0rZG2E2baF|en|R|81|546
1288520439111847939|935033864|Wed Jul 29 17:03:06 +0000 2020|Join us tomorrow for a virtual town hall at 3:30 PM EST as we discuss measures to support our #veterans and their… https://t.co/DSkbArOT5e|en|R|1|2
1288466360973037568|935033864|Wed Jul 29 13:28:13 +0000 2020|Wishing a very #HappyBirthday to former North Carolina Senator, Elizabeth Dole! Thank you for your leadership, serv… https://t.co/wDMdvwNqED|en|R|1|4
1288151570304184326|935033864|Tue Jul 28 16:37:21 +0000 2020|"Addressing #pfas chemicals like GenX remains a top priority for me and our community. 

I applaud the Trump adminis… https://t.co/1EbuMuB9d7"|en|R|2|0
1288111298970976260|935033864|Tue Jul 28 13:57:20 +0000 2020|"Enjoyed a ‘high-level’ briefing yesterday at 35,000 feet on Air Force One!

Thank you Pres. @realDonaldTrump for co… https://t.co/yxgfXV8nuC"|en|R|5|20
1287797621805977605|935033864|Mon Jul 27 17:10:53 +0000 2020|President @realdonaldtrump has led the fight against #COVID. I look forward to joining the president today to highl… https://t.co/YUy2MMhpDo|en|R|273|1585
1286684881611825158|935033864|Fri Jul 24 15:29:15 +0000 2020|Protecting our community from the dangers of PFAS chemicals like GenX is a top priority. My amendments in today's b… https://t.co/YPr9BwAEBg|en|R|2|5
1286422232751837184|935033864|Thu Jul 23 22:05:35 +0000 2020|If you live in or travel through the Uwharrie National Forest, you know the reality of having to contend with dange… https://t.co/FbobiH7Bu4|en|R|3|9
1286334389752913920|935033864|Thu Jul 23 16:16:32 +0000 2020|I join our entire Fort Bragg community and country in mourning the loss of Sergeant Bryan Mount. Renee and I offer… https://t.co/M3dE5e6pzb|en|R|0|2
1286045690637037572|935033864|Wed Jul 22 21:09:20 +0000 2020|"Thank you @realDonaldTrump for your leadership to fight #COVID19.

Early travel bans &amp; PPE from Project Air Bridge… https://t.co/5s7i7yhaMH"|en|R|6|22
1285978031702581249|935033864|Wed Jul 22 16:40:29 +0000 2020|I join our entire community in mourning the shocking passing of Locust Police Chief Steven Smith. A native of Locus… https://t.co/kWGWMXoEqY|en|R|0|7
1285951957107122183|935033864|Wed Jul 22 14:56:53 +0000 2020|Congratulations and Go @USArmy! https://t.co/w9nolgBPVk|en|R|1|3
1285587570714345472|935033864|Tue Jul 21 14:48:56 +0000 2020|The @VAVetBenefits Administration Undersecretary Paul Lawrence will host a tele-town hall for North Carolina reside… https://t.co/ZnVXejRsNE|en|R|1|4
1285342629543149568|935033864|Mon Jul 20 22:35:38 +0000 2020|As Fort Bragg's Congressman, I'm proud to secure critical provisions in this year's #NDAA defense bill including in… https://t.co/FlRV5ZtoCG|en|R|2|8
1284519789399072769|935033864|Sat Jul 18 16:05:57 +0000 2020|Renee and I offer prayers to the family of Congressman John Lewis following his passing. His legacy and public serv… https://t.co/WtxfJxnveX|en|R|2|13
1284163038828998658|935033864|Fri Jul 17 16:28:21 +0000 2020|Last week, unemployment claims fell again for the 15th week in a row while retail sales rose 7.5%. I’m committed to… https://t.co/21VZe4xrxz|en|R|1|8
1283862389859942401|935033864|Thu Jul 16 20:33:41 +0000 2020|I’m committed to getting our community and country needed resources. I’ve co-sponsored the Strengthening America’s… https://t.co/8N4R6GwZY9|en|R|2|5
1283144760778264581|935033864|Tue Jul 14 21:02:05 +0000 2020|As Fort Bragg's Congressman, I’ve seen firsthand the difficult energy supply challenges both our military installat… https://t.co/6r2mgtqj8r|en|R|4|3
1282759853505744903|935033864|Mon Jul 13 19:32:36 +0000 2020|I'd like to congratulate Maureen Stover, a science teacher at Cumberland International Early College High School, w… https://t.co/DlGiBQEqw2|en|R|2|5
1282686856430329862|935033864|Mon Jul 13 14:42:32 +0000 2020|The @NCNationalGuard has stepped up to serve our state's communities in need during the #COVID19 pandemic. Living u… https://t.co/Zr2KhC7HTK|en|R|12|54
1282318546924642305|935033864|Sun Jul 12 14:19:00 +0000 2020|"On this day 158 years ago, the Medal of Honor was created. 

God bless all of our nation's heroes who have gone abo… https://t.co/2yDuiNbUca"|en|R|39|160
1280885989041410049|935033864|Wed Jul 08 15:26:32 +0000 2020|Faith leaders play critical roles in our communities, especially as we face new challenges from #COVID19. Today, I… https://t.co/mXyXDU9zTX|en|R|1|6
1280575158055514113|935033864|Tue Jul 07 18:51:24 +0000 2020|We owe all our servicemembers a great debt of gratitude for the safety and freedom we enjoy every day. As… https://t.co/CzCAeL29J1|en|R|1|7
1280248522441449475|935033864|Mon Jul 06 21:13:28 +0000 2020|As @FtBraggNC’s Congressman, I’m proud to help lead my colleagues urging the @DeptVetAffairs to expand burn pit reg… https://t.co/8PrFOWNVWS|en|R|3|6
1280148743170535426|935033864|Mon Jul 06 14:36:59 +0000 2020|I’m proud to have helped lead this effort to secure increased hazardous pay for our men and women in uniform. As… https://t.co/t9P0MIYmX2|en|R|3|6
1279375633206870017|935033864|Sat Jul 04 11:24:55 +0000 2020|Today, as we unite around the country to celebrate our freedoms, let us also honor all those who served and sacrifi… https://t.co/AFCE8Ig30Y|en|R|10|32
1278681773803802633|935033864|Thu Jul 02 13:27:46 +0000 2020|Today's #JobsReport shows a record-breaking 4.8 million jobs created last month as the unemployment rate fell to 11… https://t.co/m4KE94F6mz|en|R|4|9
