id|user|created_at|text|lang|label|retweet_count|favorite_count
1298650906028675073|20545793|Wed Aug 26 15:57:58 +0000 2020|Today marks the 100th anniversary of the #19thAmendment. Women of that time did not wait for change; they demanded… https://t.co/idgZ6BdIML|en|D|4|11
1298336168359022592|20545793|Tue Aug 25 19:07:19 +0000 2020|My heart goes out to the family and loved ones of this brave Oregonian in the wake of this incredible tragedy. We a… https://t.co/GnGVTLUb2a|en|D|4|19
1297304127333191683|20545793|Sat Aug 22 22:46:21 +0000 2020|"#SaveUSPS #DontMessWithUSPS 

https://t.co/rrmUlQRqNL"|und|D|4|14
1297230922228600837|20545793|Sat Aug 22 17:55:27 +0000 2020|I am here in DC for an emergency session of Congress to #SaveTheUSPS. Increases in delayed and undelivered mail are… https://t.co/rGDh7ANHhP|en|D|7|36
1296870480180318209|20545793|Fri Aug 21 18:03:11 +0000 2020|This $1 million dollar grant will help tribal families and seniors who have been devastated by the pandemic stay in… https://t.co/WTp59OqMKL|en|D|1|5
1296175698068025349|20545793|Wed Aug 19 20:02:22 +0000 2020|I am honored to be recognized by @FixtheDebt for going the extra mile to develop and endorse solutions to the natio… https://t.co/wLOxw5W2ai|en|D|7|12
1295402151712362497|20545793|Mon Aug 17 16:48:35 +0000 2020|I joined with my OR Democratic colleagues to call for an  end to the deliberate slowdown of America's mail. This is… https://t.co/vuTDXR8aei|en|D|12|35
1294323056958111744|20545793|Fri Aug 14 17:20:38 +0000 2020|Thank you to the NW Oregon Labor Council for stepping up to provide food boxes to Oregonians. Local unions have con… https://t.co/WtieN9DAb0|en|D|3|15
1292896467150163976|20545793|Mon Aug 10 18:51:53 +0000 2020|Catch me LIVE at 2pm today with Mark Mason on @1190KEX talking about Trump's Executive Order and the potential impa… https://t.co/UiTTKsztBi|en|D|1|3
1291782664761073665|20545793|Fri Aug 07 17:06:02 +0000 2020|This #PurpleHeartDay we remember and honor the brave men and women who were either wounded on the battlefield or pa… https://t.co/5oBxXR45Ga|en|D|1|4
1291488989099286529|20545793|Thu Aug 06 21:39:04 +0000 2020|The application period for Oregon fishing business seeking relief for COVID-19 impacts is now open. Follow this lin… https://t.co/V9JC4cjF9M|en|D|3|4
1291384871185715200|20545793|Thu Aug 06 14:45:20 +0000 2020|Americans shouldn’t have to choose between their health and their vote. Today as we celebrate 55 years of the Votin… https://t.co/KQTblZ77ih|en|D|9|55
1289224101710581762|20545793|Fri Jul 31 15:39:13 +0000 2020|Faster connectivity helps rural communities attract businesses and investment and enables those businesses to acces… https://t.co/DnwXUro7vV|en|D|4|19
1288612250849292289|20545793|Wed Jul 29 23:07:56 +0000 2020|This bipartisan legislation will have major positive impact on our coastal Oregon communities. Its passage is criti… https://t.co/UWiMjhKX6K|en|D|1|2
1288140136497254407|20545793|Tue Jul 28 15:51:55 +0000 2020|Thank you @RepNewhouse! https://t.co/x90JVefD5U|en|D|1|2
1287780914324480000|20545793|Mon Jul 27 16:04:30 +0000 2020|Last year, @HouseDemocrats made progress towards establishing a #LatinoMuseum in the heart of our nation’s capital.… https://t.co/PA5KDjMuPF|en|D|3|6
1286391534506713091|20545793|Thu Jul 23 20:03:36 +0000 2020|Small businesses are the lifeblood of Oregon’s economy and these funds will help hardworking business owners keep t… https://t.co/Vz8pb1N10v|en|D|1|4
1286045347186388993|20545793|Wed Jul 22 21:07:58 +0000 2020|Long-term care pharmacies provide medication for the nearly 2 million seniors in long-term care facilities. This bi… https://t.co/aH7eQJY60Z|en|D|5|7
1286038441017384964|20545793|Wed Jul 22 20:40:32 +0000 2020|Thanks to everyone who raised their voice in support of the #NoBanAct. TODAY the bill passed the House of Represent… https://t.co/eF8fng0tQQ|en|D|11|41
1285928965908189184|20545793|Wed Jul 22 13:25:31 +0000 2020|Today I’m voting YES to fully #FundLWCF so we can protect our treasured landscapes &amp; natural environment for our ch… https://t.co/Sg4IXHXD3P|en|D|2|12
1285708352325066753|20545793|Tue Jul 21 22:48:53 +0000 2020|While not a perfect bill, this year’s NDAA included pay raises for our brave service members and increased funding… https://t.co/78WwmuQ9xE|en|D|2|6
1285326688843378694|20545793|Mon Jul 20 21:32:17 +0000 2020|It should be up to elected city officials to request federal help with local law enforcement matters. We should let… https://t.co/TJExBPOe9z|en|D|8|29
1285310138493042695|20545793|Mon Jul 20 20:26:31 +0000 2020|ICYMI. Important new info on #PUA claims from @ORemployment: https://t.co/6jD5mkeg0t|en|D|1|1
1284606638566051840|20545793|Sat Jul 18 21:51:04 +0000 2020|Incredibly saddened to hear of the passing of #JohnLewis today. I was fortunate to attend his Congressional faith a… https://t.co/llo82Ihjbq|en|D|4|25
1278458131371171840|20545793|Wed Jul 01 22:39:05 +0000 2020|Investing in infrastructure means putting millions of people to work and bringing the US into the 21st century. It'… https://t.co/2n4ysRDXHq|en|D|2|14
1277654401004560384|20545793|Mon Jun 29 17:25:21 +0000 2020|Today I spoke on the House floor in support of the Patient Protection and Affordable Care Enhancement Act. We need… https://t.co/xvu0uZcNPS|en|D|18|45
1274054292987576322|20545793|Fri Jun 19 18:59:48 +0000 2020|This #JuneteenthDay marks 155 years since slavery was abolished in the United States. However, we still have signif… https://t.co/jRoOxVxIIn|en|D|2|4
1273661631206166531|20545793|Thu Jun 18 16:59:31 +0000 2020|It is a great day for our #Dreamers and our country. These young folks contribute so much to Oregon and have lived… https://t.co/Dq0IJTeakO|en|D|4|38
1272607897596366848|20545793|Mon Jun 15 19:12:21 +0000 2020|Today's #SCOTUS decision marks a huge step towards equality for #LGBTQ Americans. All Americans deserve equal prote… https://t.co/2rBaS4gGU6|en|D|9|25
1270728639726989319|20545793|Wed Jun 10 14:44:51 +0000 2020|As Oregon high school seniors begin to graduate, I wanted to give a special congratulations to you all. I know that… https://t.co/gj9yfWnUa7|en|D|1|17
1270025453609390080|20545793|Mon Jun 08 16:10:38 +0000 2020|Today is World Oceans Day! We must ensure we are committed to strengthening the health of our oceans and preserving… https://t.co/vYoim6bn3t|en|D|6|12
1268215774747000832|20545793|Wed Jun 03 16:19:37 +0000 2020|https://t.co/2V0aHX4MA8|und|D|1|6
1266386711795453954|20545793|Fri May 29 15:11:35 +0000 2020|I led a letter to @FTA_DOT requesting funds to replace 5 of the oldest buses that have been in use for over 15 year… https://t.co/Z7TUXRA8h3|en|D|2|6
1264923470837673985|20545793|Mon May 25 14:17:11 +0000 2020|I wanted to take a moment this #MemorialDay2020  to honor the brave men and women of the United States military who… https://t.co/hUt7vn30lD|en|D|5|22
1261359652287250434|20545793|Fri May 15 18:15:50 +0000 2020|This #HospitalWeek, we are extra grateful for the work that our doctors, nurses, health care administrators and all… https://t.co/1lYgijERSk|en|D|2|9
1260595718122885121|20545793|Wed May 13 15:40:14 +0000 2020|Important news for #Veterans who need assistance now: @IAVA has launched a nationwide consolidated-care program for… https://t.co/SaymPybztB|en|D|3|6
1258757232314941443|20545793|Fri May 08 13:54:45 +0000 2020|The seafood industry is critical to coastal communities in Oregon. Because of restaurant closures, the seafood indu… https://t.co/pmM88LwjcR|en|D|5|15
1258488557645242371|20545793|Thu May 07 20:07:08 +0000 2020|A huge win for Oregon's fisheries and tribes today. I have been advocating for our fishing communities since Day 1… https://t.co/cTaYUiDCkU|en|D|3|7
1258465582355267584|20545793|Thu May 07 18:35:50 +0000 2020|The Hispanic community makes up 13% of Oregon's population and they have been disproportionately affected #Covid_19… https://t.co/Qj87h2FS0o|en|D|6|10
1258429951805620229|20545793|Thu May 07 16:14:15 +0000 2020|It's #TeacherAppreciationWeek! Now more than ever, we are grateful for our teachers who have risen to the challenge… https://t.co/S2QM5tF4Rx|en|D|3|11
1258101684011761664|20545793|Wed May 06 18:29:50 +0000 2020|Today is #NationalNursesDay and I am so grateful for all of the nurses who have been working around the clock to ke… https://t.co/qUxzFBtfcC|en|D|3|5
1258058378112315392|20545793|Wed May 06 15:37:45 +0000 2020|I am proud to be a cosponsor of the “Coronavirus Community Relief Act” (HR 6467) which will provide $250 billion fo… https://t.co/TRJ9G1RR3I|en|D|3|6
1253782749342838788|20545793|Fri Apr 24 20:27:56 +0000 2020|Catch me live in 10 minutes on @1190KEX. I'll be talking all things #coronavirus and small business.|en|D|1|2
1253414957955211267|20545793|Thu Apr 23 20:06:27 +0000 2020|I'm back in DC to add $310 billion to the PPP Program, almost doubling the original funds and $60 million to the EI… https://t.co/f6bEnEFF0F|en|D|5|20
1253087092411969536|20545793|Wed Apr 22 22:23:38 +0000 2020|Happy #EarthDay. On the 50th anniversary of Earth Day, the coronavirus pandemic reminds us of how fragile and preci… https://t.co/Iqk29fEC2V|en|D|5|15
1252966276542103552|20545793|Wed Apr 22 14:23:33 +0000 2020|"Even though we’re indoors this #EarthDay, let's make time to celebrate &amp; take actions to protect our planet.

Try o… https://t.co/jtezUFYUXQ"|en|D|8|12
1251215235215745026|20545793|Fri Apr 17 18:25:33 +0000 2020|I know that these are tough times for parents and students alike. Especially our high school seniors who are missin… https://t.co/dLQ2lBwP5b|en|D|4|19
1250841727843348481|20545793|Thu Apr 16 17:41:22 +0000 2020|The @SBAgov needs to answer my questions right away about where these disaster funds are and exactly how many busin… https://t.co/vbk6EbhYtn|en|D|2|5
1250529198818672640|20545793|Wed Apr 15 20:59:29 +0000 2020|As we continue to social distance and fight #COVIDー19 we must ensure that this does not happen again. My bipartisan… https://t.co/W1gIEws6nl|en|D|4|12
1250439872763940866|20545793|Wed Apr 15 15:04:32 +0000 2020|Want to track the status of you economic impact payment? @IRSnews launched their online portal TODAY:… https://t.co/euAMrgmqXu|en|D|2|3
1250132440351494147|20545793|Tue Apr 14 18:42:54 +0000 2020|Do you have questions about your Economic Impact Payment? Are you a non-filer? Check out my Recovery Rebate guide b… https://t.co/VsVOgBVAOt|en|D|1|3
1250123752702173184|20545793|Tue Apr 14 18:08:23 +0000 2020|Do you live in a rural community affected by #Covid_19? Check out this helpful guide from @USDA with specific resou… https://t.co/yRaoBMxi33|en|D|0|3
1249707034515107840|20545793|Mon Apr 13 14:32:30 +0000 2020|As OR schools start another week of remote learning, I wanted to give a thank you to our teachers during this time.… https://t.co/lsW5LIrAW5|en|D|5|25
1248706894170120194|20545793|Fri Apr 10 20:18:18 +0000 2020|Today, 3,454 hospitals in Oregon received a total of $291 million in funding to enhance their coronavirus response… https://t.co/8wO0gM2tqi|en|D|5|23
1247589648374927361|20545793|Tue Apr 07 18:18:45 +0000 2020|Are you a higher ed student wondering how the CARES Act will affect you? Borrowers can expect the following to be i… https://t.co/JctZ8LSLyd|en|D|3|10
1247556474563428355|20545793|Tue Apr 07 16:06:56 +0000 2020|I wanted to share my immense gratitude for Oregon’s essential workers during this time. Our doctors, nurses, grocer… https://t.co/AgMAwoDwcp|en|D|3|24
1247250539609575425|20545793|Mon Apr 06 19:51:16 +0000 2020|"If you were not able to join me for my small business webinar this morning, you can watch the full hour below:

https://t.co/6Ai37P9lD2"|en|D|1|2
1247194156704960513|20545793|Mon Apr 06 16:07:13 +0000 2020|Getting started with my small business webinar now! https://t.co/vfA2PZAWE3|en|D|2|8
1246838422582497282|20545793|Sun Apr 05 16:33:39 +0000 2020|Tomorrow's webinar only has a handful of spots left, so sign up now! However, if you are unable to sign up, we will… https://t.co/o7cU0evnG6|en|D|2|2
1245765368511107072|20545793|Thu Apr 02 17:29:43 +0000 2020|Looking for a fun and educational activity for kids while #stayinghome? Check out @NOAAs new virtual sanctuaries at… https://t.co/Nev9sT8WvS|en|D|4|2
1245755840126234629|20545793|Thu Apr 02 16:51:51 +0000 2020|Wow! We have had an INCREDIBLE response to this webinar. Sign up now before it fills up! Thanks to those who have a… https://t.co/eL8g4MgGCv|en|D|1|2
1245457539996794888|20545793|Wed Apr 01 21:06:31 +0000 2020|Are you a small business owner or a non-profit director? Join me on Monday at 9am for a webinar to learn about SBA… https://t.co/JxVzuKy27E|en|D|7|4
1245416196951990273|20545793|Wed Apr 01 18:22:14 +0000 2020|ICYMI: @StateDept has issued a level 4 travel warning. Individuals who want to return to the United States should s… https://t.co/CIrVuDB8Ap|en|D|1|2
1245412128820994052|20545793|Wed Apr 01 18:06:04 +0000 2020|I have been hearing from constituents that there has been an increase in fraudulent calls during this time. Below i… https://t.co/POnVftIQVe|en|D|3|3
1245377195004084224|20545793|Wed Apr 01 15:47:15 +0000 2020|Today is #CensusDay2020.  Be sure to fill our your Census and count all children in your household. The fastest way… https://t.co/tr74PxMATS|en|D|6|7
1245077035170570243|20545793|Tue Mar 31 19:54:32 +0000 2020|If you are looking for accurate information on keeping your family safe and healthy or are a small business owner w… https://t.co/pzY4BvTyWu|en|D|1|9
1245067786482835459|20545793|Tue Mar 31 19:17:47 +0000 2020|ICYMI: Our own Tillamook County Commissioner, David Yamamoto wrote an op-ed that was published in the Washington Po… https://t.co/29sbs7IpNM|en|D|4|8
1244678110039232514|20545793|Mon Mar 30 17:29:21 +0000 2020|Thank you to all of the health care workers on the frontlines of #Covid_19. We are incredibly grateful to you! #NationalDoctorsDay|en|D|8|17
1243612012405575686|20545793|Fri Mar 27 18:53:03 +0000 2020|I just voted with my colleagues from both sides of the aisle on the historic CARES Act that will provide assistance… https://t.co/XYYYbk1xs2|en|D|2|26
1243227792134885376|20545793|Thu Mar 26 17:26:18 +0000 2020|Are you a small businesses owner who has been affected by the Coronavirus and need help accessing an SBA loan? My o… https://t.co/GQAetkzobV|en|D|5|7
1242943333120520193|20545793|Wed Mar 25 22:35:58 +0000 2020|"Stay home. Stay safe. And be kind to one another, it's the Oregon way.

Visit my website linked below for more info… https://t.co/M1cvsay95m"|en|D|4|23
1242133223049760769|20545793|Mon Mar 23 16:56:52 +0000 2020|If your work situation has changed, you may qualify for health insurance through the Oregon Health Plan (OHP). Elig… https://t.co/oq14rm36j1|en|D|5|7
1242109461550030850|20545793|Mon Mar 23 15:22:27 +0000 2020|If you are a small business owner who has been affected by #COVIDー19 and need assistance getting an emergency loan,… https://t.co/lpCIFRfOJd|en|D|8|10
1241804548743860225|20545793|Sun Mar 22 19:10:50 +0000 2020|Looking for a way to help your community right now? Check out this list from @OregonGovBrown with information about… https://t.co/anHwZ2TWAb|en|D|6|7
1241473297163923459|20545793|Sat Mar 21 21:14:34 +0000 2020|ICYMI: I have a designated #Covid_19 resource page on my website that is updated regularly with resources and guide… https://t.co/TOB5GtFB4x|en|D|3|6
1241150201051729926|20545793|Fri Mar 20 23:50:42 +0000 2020|If you’re working from home and practicing self distancing, consider fostering a shelter pet! https://t.co/Ms5AILulIZ|en|D|3|12
1241099886302564353|20545793|Fri Mar 20 20:30:46 +0000 2020|Good news! The SBA responded rapidly to the request I led on behalf of the Oregon delegation. This assistance will… https://t.co/Tp1fVEjAj5|en|D|1|12
1241087287112458241|20545793|Fri Mar 20 19:40:42 +0000 2020|Stranded in a foreign country due to #Covid_19 ? My staff and I are here to help! We have gotten constituents home… https://t.co/IDeiG3XVqh|en|D|5|11
1241072015475441671|20545793|Fri Mar 20 18:40:01 +0000 2020|Heads Up: @BobsRedMill a great 5th district, employee owned business is hiring right now due to an influx of orders… https://t.co/lVYVUAgaih|en|D|6|14
1241067432422359040|20545793|Fri Mar 20 18:21:48 +0000 2020|"Please share:

If you are struggling with food instability because of #Covid_19 the Oregon Food Bank has a great to… https://t.co/Ar7mnsZGbD"|en|D|15|15
1240771262693203972|20545793|Thu Mar 19 22:44:56 +0000 2020|Today I sent a letter to the Small Business Administration with the support of @RonWyden @SenJeffMerkley… https://t.co/cPKSjp3Age|en|D|10|26
1240708754322206726|20545793|Thu Mar 19 18:36:32 +0000 2020|Looking for something to do while you self distance? Fill out your Census! I just did. More info can be found at… https://t.co/jR6ODhB5hv|en|D|5|17
1240289655746105347|20545793|Wed Mar 18 14:51:12 +0000 2020|Hey 5th District-in order to protect the health and safely of Oregon families, we must work together and support one another!|en|D|4|26
1239976002240970753|20545793|Tue Mar 17 18:04:51 +0000 2020|Please share ! Where to Find School Meals in Oregon During COVID-19 Closures:  https://t.co/0a4YyNjDaq|en|D|20|16
1238828391572389890|20545793|Sat Mar 14 14:04:39 +0000 2020|Early this morning, I voted to pass a bipartisan relief package that will ensure that Americans have access to free… https://t.co/5Q9LbwRgig|en|D|7|34
1237754038269198337|20545793|Wed Mar 11 14:55:33 +0000 2020|Thanks for coming in and meeting with me today! https://t.co/kbCqab8j5s|en|D|2|5
1237481889096773632|20545793|Tue Mar 10 20:54:08 +0000 2020|Thanks for coming all the way from Oregon to meet with us and thank you for the work you do that keeps our communit… https://t.co/p65BWS7GGZ|en|D|2|5
1237156431444553730|20545793|Mon Mar 09 23:20:53 +0000 2020|There is a debt crisis in the veterinary community. In 2016, the average education debt for vets was $143,758 and o… https://t.co/CxxVcr9Hi9|en|D|5|10
1237116392379318272|20545793|Mon Mar 09 20:41:47 +0000 2020|This weekend was our 5th Annual Military Service Academy Information Day and it has been wonderful to watch this ev… https://t.co/Tg1u8YSqul|en|D|1|7
1235330197198688256|20545793|Wed Mar 04 22:24:04 +0000 2020|I just voted in support of this overwhelmingly bipartisan emergency spending measure to combat the Coronavirus. Thi… https://t.co/yqNhEVpjhG|en|D|5|17
1234856406874021889|20545793|Tue Mar 03 15:01:24 +0000 2020|Thank you very much @BPC_Bipartisan for inviting me to speak about the future of America's energy infrastructure an… https://t.co/Hc7VLFzJwI|en|D|3|10
1234578627586600960|20545793|Mon Mar 02 20:37:36 +0000 2020|"Recursos de coronavirus en español vinculados a continuación:

https://t.co/aiGBwnxrsh

https://t.co/n8uxie5alH

https://t.co/fH5W5Rfzpe"|es|D|2|2
1234545002585509891|20545793|Mon Mar 02 18:24:00 +0000 2020|I am proud to be a cosponsor of the No Ban Act. This bill will repeal all versions of the Muslim ban, the refugee b… https://t.co/s2X56VBmlS|en|D|4|29
1234516310584963073|20545793|Mon Mar 02 16:29:59 +0000 2020|Looking for resources on the Coronavirus? I have set up a web page below with federal, state and local guidance. I… https://t.co/Hq4O28Hgt6|en|D|5|9
1233878233084563457|20545793|Sat Feb 29 22:14:29 +0000 2020|I am closely monitoring the developing situation at Forest Hills Elementary School in Lake Oswego. I strongly urge… https://t.co/eNbcBSNwYr|en|D|1|24
1233476799637659654|20545793|Fri Feb 28 19:39:20 +0000 2020|Worried about the Coronavirus and how to prepare? Number one, don't panic! Read my op-ed below for more info about… https://t.co/mFdF0em7DO|en|D|0|4
1233140437034074112|20545793|Thu Feb 27 21:22:45 +0000 2020|I had a meeting today with a young Oregonian advocating for her sister who has Cystic Fibrosis. There is no cure fo… https://t.co/YqXaIXWIvb|en|D|16|62
1233092485355917312|20545793|Thu Feb 27 18:12:12 +0000 2020|This morning I testified in front of the @TransportDems to advocate for three critical infrastructure priorities in… https://t.co/f7y395e2zc|en|D|2|6
1233060387920269320|20545793|Thu Feb 27 16:04:40 +0000 2020|Watch me advocate for the reconstruction of the South Jetty into Tillamook Bay in front of the Committee on Transpo… https://t.co/3NlAZJgIAE|en|D|4|7
1233055596317941762|20545793|Thu Feb 27 15:45:37 +0000 2020|A huge shout-out to @PortOfPortland airport operations team! PDX was just named the #1 airport in the nation for on… https://t.co/zZdWJJc1Jo|en|D|3|20
1232774798641704968|20545793|Wed Feb 26 21:09:50 +0000 2020|#CareerTechEd prepares students of all ages for a wide range of high-wage, high-skill, in-demand careers. Expanding… https://t.co/W13DBm8YJz|en|D|2|5
1232730813785088002|20545793|Wed Feb 26 18:15:03 +0000 2020|My fantastic caseworkers are standing by at the Silverton Senior Center to assist with veteran's casework, issues w… https://t.co/RBEeSfangP|en|D|2|8
1232701288934182912|20545793|Wed Feb 26 16:17:44 +0000 2020|Thank you to the Northwest Credit Union Association for coming all the way across the country to meet with me this… https://t.co/lGshLNM0XG|en|D|6|14
1232695933479112705|20545793|Wed Feb 26 15:56:27 +0000 2020|Had a great meeting this morning with @DisabledAmeric4 representatives from Oregon. Thank you for the incredibly im… https://t.co/f1tFEkUpNo|en|D|2|4
1232393416333500418|20545793|Tue Feb 25 19:54:21 +0000 2020|My casework staff will be hosting mobile office hours at the Silverton Senior Center to offer constituents assistan… https://t.co/c2WJb0QloR|en|D|2|9
1230986955279626241|20545793|Fri Feb 21 22:45:35 +0000 2020|Volunteers, like Kathy and Kay, spend their time advocating for early cancer screening, preventative care and advan… https://t.co/pqGkol0Yxi|en|D|2|3
1230260487624916992|20545793|Wed Feb 19 22:38:52 +0000 2020|Marion County’s community leaders and I dived right into the issues. We talked about the growing homelessness issue… https://t.co/ShGHMSGu8l|en|D|2|7
1230244888928632832|20545793|Wed Feb 19 21:36:53 +0000 2020|Ms. Mowry’s third grade class at Queen of Peace School is learning about the US Government, it was my pleasure to a… https://t.co/CefmmV3f3g|en|D|2|6
1230172411057725441|20545793|Wed Feb 19 16:48:52 +0000 2020|It was my pleasure to speak at the SEDCOR Agriculture Breakfast this morning. I spoke with farmers about the work I… https://t.co/PlRzy9Jxla|en|D|2|2
1229893470396923904|20545793|Tue Feb 18 22:20:28 +0000 2020|Abuse of opioids is a problem across the US and Oregon. The RALI CARES educational trailer is traveling around the… https://t.co/AmG5Phz4mL|en|D|3|11
1229854687928565760|20545793|Tue Feb 18 19:46:21 +0000 2020|Clackamas County is the third largest county in Oregon. It was my pleasure to sit down with community leaders and t… https://t.co/ETrTE7gpxe|en|D|1|7
1228038574827851777|20545793|Thu Feb 13 19:29:46 +0000 2020|"Today I met with constituent representatives from 
@HRC to discuss the Every Child Deserves a Family Act, of which… https://t.co/Nyke63DWCX"|en|D|3|9
1228013176576495617|20545793|Thu Feb 13 17:48:51 +0000 2020|Happy #NationalCheddarDay! I am so proud to represent @TillamookDairy back home in Oregon and to advocate on behalf… https://t.co/FHUUyu1g7h|en|D|6|20
1228001601585078272|20545793|Thu Feb 13 17:02:51 +0000 2020|REMINDER: If you were not able to call in last night to my teletown hall, no problem! I am hosting another town hal… https://t.co/y7naz90EGs|en|D|1|8
1227991763991826433|20545793|Thu Feb 13 16:23:46 +0000 2020|We need the ERA so that our nation can achieve its economic and social potential and so that we can lead the world,… https://t.co/UP5ssqurxW|en|D|8|34
1227790419574054912|20545793|Thu Feb 13 03:03:41 +0000 2020|Thank you to the thousands of callers who spent your evening joining me for a telephone town hall. We talked about… https://t.co/pjD93JjMqy|en|D|1|11
1227732361305088002|20545793|Wed Feb 12 23:12:59 +0000 2020|"🎉 The Protecting America’s Wilderness Act just passed in the House! 🎉

This bill protects 1.3 MILLION ACRES of… https://t.co/BoqTjwIDBw"|en|D|6|30
1227685342582640640|20545793|Wed Feb 12 20:06:09 +0000 2020|"I spoke today with @KATUNews about my bipartisan approach to climate change. Watch below to learn more: 

https://t.co/q7CGpL0eNq"|en|D|3|6
1227680712435884032|20545793|Wed Feb 12 19:47:45 +0000 2020|Today I met with @NOSORH and was honored to receive their Legislator of the Year Award for my work on behalf of rur… https://t.co/1tMLUXqbWH|en|D|1|5
1227311219868131331|20545793|Tue Feb 11 19:19:31 +0000 2020|Great news for coastal veterans! I am proud to share that after working with VA and TriWest representatives, two ne… https://t.co/1DK8Hjhedj|en|D|1|8
1227253364708323330|20545793|Tue Feb 11 15:29:38 +0000 2020|REMINDER: I will be hosting a telephone town hall tomorrow night at 6pm PST. I look forward to hearing from you!… https://t.co/kS9EYajIQB|en|D|2|7
1225149647016157184|20545793|Wed Feb 05 20:10:12 +0000 2020|"Proud that I received a 100% perfect score for my support of our national parks!

#ActForParks https://t.co/qfMihp1bKW"|en|D|1|22
1225123603320012801|20545793|Wed Feb 05 18:26:43 +0000 2020|Today the House overwhelmingly passed HR 4305, a bill that I cosponsored to establish a VA pilot program that allow… https://t.co/1MLZHeClnq|en|D|42|148
1225080016087724033|20545793|Wed Feb 05 15:33:31 +0000 2020|I was honored to be invited to speak this morning about my work with Chemawa Indian School in Salem. I will always… https://t.co/VuWvVQ8nOK|en|D|8|16
1224762255386062852|20545793|Tue Feb 04 18:30:51 +0000 2020|Had a great meeting with the Oregon School Boards Association in DC today. Thank you for advocating for Oregon stud… https://t.co/SW4J7oCyca|en|D|1|7
