id|user|created_at|text|lang|label|retweet_count|favorite_count
1252329862217547782|310310133|Mon Apr 20 20:14:40 +0000 2020|Pleased to be able to report that Massachusetts Dept of Unemployment Assistance has recently updated their online system to activate the Pandemic Unemployment Assistance (PUA) program. https://t.co/U4Q0RW6And|en|D|2|2
1250571539344314370|310310133|Wed Apr 15 23:47:44 +0000 2020|Tomorrow at 3:30pm I will be hosting another Facebook Live video session on my page https://t.co/QaBDkdXLea -our focus will be the issuance of stimulus rebate checks, updated guidance from the IRS and the proposed details of our next COVID-19 stimulus package. More details below: https://t.co/8VzPgGBav0|en|D|2|1
1250506638869639170|310310133|Wed Apr 15 19:29:50 +0000 2020|(1/2) While the World Health Organization needs structural reforms, we cannot cut off all funding in the middle of a global pandemic. Places like Africa depend heavily on the WHO. https://t.co/eHLpsmx8pW|en|D|0|8
1250467767792349186|310310133|Wed Apr 15 16:55:23 +0000 2020|Great to speak with @boston25gene Gene Lavanchy on @boston25 this morning to discuss how America will move forward after this pandemic – opening up the economy must be based on science and the health conditions on the ground. https://t.co/CZxrxMAkn2|en|D|1|10
1250159504446164996|310310133|Tue Apr 14 20:30:27 +0000 2020|Social Security has released new guidance about COVID-19 Economic Impact Payments for Social Security and SSI beneficiaries – you can find their latest instructions regarding stimulus checks here: https://t.co/SqFs8Uqqye|en|D|6|8
1250070260365000705|310310133|Tue Apr 14 14:35:49 +0000 2020|After President Trump removed Acting Pentagon Inspector General Glenn Fine, who was tasked with safe-guarding $2 trillion dollars provided in the CARES Act, I have taken action to restore Mr. Fine’s eligibility as pandemic committee chair. https://t.co/M1uFbXrGe3|en|D|10|22
1249457404774924289|310310133|Sun Apr 12 22:00:33 +0000 2020|Margaret and I wish everyone a joyous and safe Easter.  Although things look different for many of us this Easter, it is the power of hope, faith and unity that will help us get through these difficult times. #HappyEaster|en|D|3|34
1249398798595559424|310310133|Sun Apr 12 18:07:40 +0000 2020|As Congress appropriates trillions of taxpayer dollars in response to the COVID-19 crisis, Americans need to ensure that these funds will be allocated fairly and efficiently. https://t.co/fzFSZYYYb5|en|D|2|4
1249010668239347713|310310133|Sat Apr 11 16:25:23 +0000 2020|1/3 US Postal workers, our clerks, letter cariers, mailhandlers and supervisors serve a critical role in our nationwide pandemic relief efforts—from processing and delivering essential medical supplies and protective equipment to facilitating “Vote-by-Mail” in the 2020 election.|en|D|13|37
1248782113660428289|310310133|Sat Apr 11 01:17:11 +0000 2020|Our deepest gratitude to Gary Coombe and @ProcterGamble /Gillette for working with me to distribute over 20,000 N95 masks and PPE throughout our area to the heroic nurses, doctors, first responders and healthcare workers who are on the frontlines of this pandemic.|en|D|8|46
1248675874515439617|310310133|Fri Apr 10 18:15:02 +0000 2020|Thanks to Joe Catalano with Quincy Access TV for inviting me to discuss my ongoing work acquiring additional PPE for our healthcare workers, the necessity to get resources to our critical USPS workers and other COVID-19 updates. Watch our interview here: https://t.co/TesLHhWLGy|en|D|2|5
1248274167637704707|310310133|Thu Apr 09 15:38:48 +0000 2020|(1/2) The health and readiness of our military forces is of the utmost importance and we cannot condemn those who take reasonable steps to protect the health and safety of their men and women in uniform in these unprecedented times. https://t.co/iU8r134JgF|en|D|3|9
1248035101470003201|310310133|Wed Apr 08 23:48:50 +0000 2020|(1/2) Margaret and I and our family offer our warmest wishes to all those who celebrate #Passover – a tradition that evokes strength, resilience and deliverance to the Jewish community.|en|D|2|7
1247982106069827585|310310133|Wed Apr 08 20:18:15 +0000 2020|More than 2,500 of our servicemembers and @DeptofDefense civilians have tested posted for COVID-19. In order to protect our military &amp; civilian personnel throughout this pandemic Congress must have a clear and complete understanding of available supplies. https://t.co/iU8r134JgF|en|D|2|3
1247958662200647685|310310133|Wed Apr 08 18:45:05 +0000 2020|(1/2) Within one week the number of #COVIDー19 cases on the USS Theodore Roosevelt ship grew from 8 to 173. After he reported his situation and sought to protect his crew, #CaptainCrozier was publicly attacked by Acting Secretary of the Navy Thomas Modly. https://t.co/xISStwnLIS|en|D|18|31
1247166278004957185|310310133|Mon Apr 06 14:16:26 +0000 2020|(1/2) Due to the extreme conditions of this COVID-19 pandemic, a “Stop Movement” order has been issued to many of our active military families and @DeptofDefense civilians, which halts all scheduled travel.|en|D|5|9
1246490687878705152|310310133|Sat Apr 04 17:31:53 +0000 2020|I support @GoIUPAT &amp; construction workers across the country &amp; will continue to fight for #WorkersFirst-as people continue to face layoffs &amp; uncertainly during this crisis we must ensure all workers are protected &amp; have access to healthcare &amp; crucial #COVID19 testing &amp; treatment|en|D|13|18
1246439630255394816|310310133|Sat Apr 04 14:09:00 +0000 2020|(1/3) While the President announced on March 5th that the coronavirus tests were here, a month has passed &amp; some hospitals &amp; health centers still have zero tests &amp; almost no personal protective equipment (PPE). While we don’t need politics we do need to hold people accountable...|en|D|14|29
1246133654834864136|310310133|Fri Apr 03 17:53:10 +0000 2020|(1/3) Amidst the uncertainty &amp; devastating effects of #COVID19Pandemic I believe it's important we highlight the positive events that occur along the way. I'm grateful to the @StateDept for their assistance in helping our office secure the return of many of our local students...|en|D|0|5
1246086358482980873|310310133|Fri Apr 03 14:45:13 +0000 2020|This week I spoke with @bloombergbaybiz Radio Boston about our ongoing efforts to mitigate the COVID-19 proactively and safely, as well as the importance of the upcoming Transportation and Infrastructure bill - https://t.co/SGb0AQ4hLH|en|D|2|2
1245748592192688129|310310133|Thu Apr 02 16:23:03 +0000 2020|I am proud to work alongside @MassGovernor Charlie Baker as Massachusetts continues to lead by example on how to safely and aggressively tackle #COVIDー19.  https://t.co/SBWoEGGuyZ|en|D|2|16
1245730145111072768|310310133|Thu Apr 02 15:09:45 +0000 2020|For the first time ever, you can fill out your #Census2020 form online at https://t.co/kx85yhnrIr. In these challenging times, Massachusetts is in desperate need of more federal funding.|en|D|5|10
1245423317730971652|310310133|Wed Apr 01 18:50:32 +0000 2020|For anyone in need of ideas to help overcome your boredom while you continue to #StayAtHome, here is a great collection of free online apps and resources, enjoy! https://t.co/tpm5jE5kBq|en|D|0|3
1244676948678324228|310310133|Mon Mar 30 17:24:44 +0000 2020|This evening at 6:30pm I will be hosting a telephone town hall about #COVIDー19 with Dr. Gabriela M. Andujar Vazquez, M.D., an infectious diseases control specialist from Tufts Medical Center. You can live stream the audio of the event here: https://t.co/6SeFRTWfga|en|D|2|9
1243906432359170048|310310133|Sat Mar 28 14:22:58 +0000 2020|Yesterday the House passed the bipartisan $2 trillion #CARESAct to help provide personal protective equipment for nurses, doctors, healthcare workers &amp; first responders &amp; financial relief to hard working American families during this public health crisis. https://t.co/2a80VwCtt7|en|D|6|14
1243630027088035841|310310133|Fri Mar 27 20:04:38 +0000 2020|Sincere thanks to our postal service workers, grocery store workers, package delivery people and all essential personnel who continues to help get us through this difficult time.|en|D|7|55
1243341134144962562|310310133|Fri Mar 27 00:56:41 +0000 2020|I will be joining my colleagues in the House tomorrow to vote on the $2 trillion Coronavirus Relief Act so we can help restock PPE stockpiles, help hospitals &amp; health centers &amp; aid American families, workers &amp; small businesses that are in desperate need of financial assistance.|en|D|5|26
1243286519525359618|310310133|Thu Mar 26 21:19:40 +0000 2020|Our country owes a great debt to our courageous nurses, doctors and healthcare workers, and our firefighters, police and EMS who continue to put their lives on the line to help get us through this crisis.|en|D|11|53
1242867146339860480|310310133|Wed Mar 25 17:33:13 +0000 2020|The Treasury Department and IRS have released new guidelines to provide some relief to tax filers who owe federal income tax in light of the COVID-19 pandemic. https://t.co/xgtJKAlwAT|en|D|3|3
1242821510055821313|310310133|Wed Mar 25 14:31:53 +0000 2020|This week we introduced H.R. 6321 in response to the COVID-19 pandemic, which includes my bill that will free up resources for the homeless and food pantries while providing $15 billion for Community Development Block Grants for low- and moderate-income communities.|en|D|3|14
1242513864983527425|310310133|Tue Mar 24 18:09:24 +0000 2020|Proud to cosponsor the Retirement Protection Act, which was introduced this week. This bill will help protect American in retirement during this crisis by suspending tax penalties on defined contribution retirement plans.|en|D|6|20
1242463972671901696|310310133|Tue Mar 24 14:51:09 +0000 2020|There are over 100 colleges and universities across Massachusetts whose students and employees have been severely impacted by this pandemic. https://t.co/eqLSTUkdoI|en|D|3|6
1242180447620214785|310310133|Mon Mar 23 20:04:31 +0000 2020|As Congress works to pass a third COVID-19 funding package, my MA Congressional colleagues and I urged there be funding included for HUD’s Community Development Block Grant (CDBG) program. https://t.co/5vBWnx7Bwi|en|D|3|4
1242097192896270338|310310133|Mon Mar 23 14:33:42 +0000 2020|I have met and spoken with the leaders of all of the community health centers in our district. They are doing incredible work despite being underfunded and in need of supplies, staff and equipment to help to battle the COVID-19 crisis. https://t.co/Vop4iS2LgA|en|D|5|22
1241843607499354112|310310133|Sun Mar 22 21:46:03 +0000 2020|The #FamiliesFirst Coronavirus Response Act provides emergency paid sick leave &amp; paid family leave to workers across the country that are currently being forced to choose between a paycheck &amp; their health. You can find more information about the bill here: https://t.co/Pe8KDGhYLa|en|D|5|8
1241712161380016130|310310133|Sun Mar 22 13:03:43 +0000 2020|(1/3) We are hearing from health care providers all over the 8th district who are ill equipped to deal with the current crisis. From a lack of swabs to conduct testing - to a shortage of personal protective equipment like masks and gowns -|en|D|7|21
1241104396412489728|310310133|Fri Mar 20 20:48:41 +0000 2020|(1/2) Social Security will continue to pay benefits throughout this pandemic. Please be aware that scammers are trying to use this situation to spread false information that payments are stopping, but that is not true.|en|D|4|11
1241086580263194626|310310133|Fri Mar 20 19:37:53 +0000 2020|Yesterday I sent a letter to the @HHSGov and @CDCGov with my colleagues on @OversightDems requesting a copy of the Administration’s plan for producing, distributing and conducting COVID-19 testing across the country. You can read our letter here: https://t.co/XvwUXlmP3Z|en|D|4|6
1241064795241144320|310310133|Fri Mar 20 18:11:19 +0000 2020|The Small Business Administration will be offering federal disaster relief loans of up to $2M to help provide relief to small businesses from the impact of the COVID-19 epidemic. Applicants may apply online https://t.co/DjzhVGbyYO or call SBA's Customer Service at 800-659-2955.|en|D|7|9
1241008436655128577|310310133|Fri Mar 20 14:27:22 +0000 2020|Yesterday I joined @kelleratlarge (from a safe distance) to discuss the COVID-19 pandemic and how we can best confront this crisis as a nation.  As a precaution, I urge everyone to act as if they already have the virus, which encourages social distancing and safe practices. https://t.co/1bxGloUZSI|en|D|3|7
1240820791706517504|310310133|Fri Mar 20 02:01:44 +0000 2020|Last night the #FamiliesFirst #Coronavirus Response Act was signed into law. The bipartisan house led effort will provide $1.08 B to Massachusetts in Medicaid funding.|en|D|6|13
1240681422639300610|310310133|Thu Mar 19 16:47:56 +0000 2020|(1/2) As we navigate this rapidly changing situation I encourage all veterans &amp; their families to visit the VA’s website https://t.co/eSvHETxBlQ to access the most current information and receive guidance from your local VA medical facilities about their current operating status.|en|D|4|8
1240272969827573760|310310133|Wed Mar 18 13:44:53 +0000 2020|Yesterday I met with my friend Quincy Mayor Koch, his staff, public health &amp; safety team, as well as leaders from South Shore Hospital &amp; Manet Health Center to discuss the City of Quincy’s ongoing strategy to fight the COVID-19 outbreak &amp; assess the need for additional resources. https://t.co/QdnhMKi4cD|en|D|3|8
1240084020446232576|310310133|Wed Mar 18 01:14:04 +0000 2020|Stop &amp; Shop will begin opening from 6:00am-7:30am exclusively for customers aged 60 and older this Thursday, March 19th. https://t.co/YyqNOupugh|en|D|4|15
1240078662768173057|310310133|Wed Mar 18 00:52:47 +0000 2020|Today I met with @CarneyHospital President Tom Sands in Dorchester to review the preparations for the nation’s first health care center designated for treating patients with COVID-19. https://t.co/H1j4ZWwuGA|en|D|10|23
1240051707058499584|310310133|Tue Mar 17 23:05:40 +0000 2020|Stop &amp; Shop has announced they will be opening exclusively for customers aged 60 and older from 6:00am-7:30am. Most stores will be open to the general public from 7:30am-8pm. Please plan your grocery shopping accordingly and adhere to CDC guidelines to practice social distancing.|en|D|13|43
1240005920098324480|310310133|Tue Mar 17 20:03:44 +0000 2020|(1/2) Effective today, all local Social Security offices will be closed to the public for in-person services to help protect employees, seniors and vulnerable people seeking benefits at this time.|en|D|3|2
1239932537293737984|310310133|Tue Mar 17 15:12:08 +0000 2020|My sincere thanks to Dr. Gabriela Andujar Vazquez, MD, a specialist in infectious diseases and infection control, from @TuftsMedicalCtr for sharing excellent advice and expertise yesterday about #COVID19 prevention and mitigation. https://t.co/TZbyfpLqWZ|en|D|6|9
1239581872063229952|310310133|Mon Mar 16 15:58:43 +0000 2020|Don’t forget to tune in to my Facebook page today at 1:30pm to watch my information session and discussion about #COVID19 with Dr. Vazquez from Tufts Medical Center (Dr. Teehan can no longer join us.) https://t.co/qRaNfheDzw https://t.co/OzLgHmTX3J|en|D|1|0
1238946171890143232|310310133|Sat Mar 14 21:52:40 +0000 2020|On Monday, March 16th at 1:30pm I will be live streaming a local information session and discussion about the #coronavirus on my Facebook page with Dr. Teehan from Steward Dedham Primary Care and Dr. Vazquez from Tufts Medical Center.  You can find all the details below: https://t.co/AdDy8UAczc|en|D|14|37
1238839304539066370|310310133|Sat Mar 14 14:48:01 +0000 2020|Last night the House passed the bipartisan #FamiliesFirst #Coronavirus Reponse Act, which will provide free testing for COVID-19, 2 weeks of paid sick leave, up to 3 months of paid family and medical leave and over $1 B to help provide food to low-income Americans and food banks.|en|D|4|19
1238613433035247616|310310133|Fri Mar 13 23:50:29 +0000 2020|Today I joined my Massachusetts Congressional colleagues and asked Secretary Perdue to immediately halt the Trump Administration’s attempt to cut eligibility for the Supplemental Nutrition Assistance Program. https://t.co/vmNkDvvOTR|en|D|9|32
1238517117181480960|310310133|Fri Mar 13 17:27:45 +0000 2020|As Congress works to pass #FamiliesFirst Act to alleviate the severe economic impacts of #coronavirus please follow all @CDCgov guidelines to help prevent spreading the illness – wash your hands, avoid touching your face &amp; maybe use an elbow bump instead of a handshake! Stay safe https://t.co/j4Q4ogr1cu|en|D|4|10
1238257347501400066|310310133|Fri Mar 13 00:15:32 +0000 2020|Pleased to see the @CDCgov awarded the state of MA an additional $11.65M in funding to help combat the #coronavirus outbreak. Congress also recently passed a #COVID19 response bill that provides an additional $8.3B with $100 million allocated to our local Community Health Centers|en|D|10|23
1238243210826264578|310310133|Thu Mar 12 23:19:21 +0000 2020|Looking for up-to-date information on [#COVID19/#coronavirus]? Take a look at this resource from @CDCgov: https://t.co/v5yx4eDnLn|en|D|3|7
1238197422486159362|310310133|Thu Mar 12 20:17:24 +0000 2020|"-Free #coronavirus testing
-Paid emergency leave
-Enhanced food security

This is how we confront this public health crisis. Congress must pass the #FamiliesFirst Act now!

https://t.co/hK2NGCVoA1"|en|D|11|30
1237847208382226434|310310133|Wed Mar 11 21:05:47 +0000 2020|Great time last night at the @IAFFNewsDesk reception where I met with firefighters from all over the 8th Congressional district, including IAFF General Secretary-Treasurer Edward “Edso” Kelly – thank you to every firefighter for all that you do to keep our communities safe! https://t.co/sSzWCi7Gws|en|D|10|27
1237795296337420289|310310133|Wed Mar 11 17:39:30 +0000 2020|THREAD --&gt; Today the @OversightDems held a hearing with some of our top public health officials to examine America’s preparedness and response to the #coronavirus outbreak.  America is at its best when we have a unity of purpose. https://t.co/XO4hiLpart|en|D|31|58
1237473706072584192|310310133|Tue Mar 10 20:21:37 +0000 2020|As a necessary precaution, I recommend everyone follow the CDC’s guidelines to help prevent the spread of the coronavirus (COVID-19) – you can read them all here: https://t.co/TrosnkTPGv https://t.co/EG64T2Z6bb|en|D|5|14
1237377503003643904|310310133|Tue Mar 10 13:59:20 +0000 2020|This morning I spoke with Gene Lavanchy @boston25gene on @Boston25 to discuss the upcoming Oversight hearing on the coronavirus &amp; our decision to cancel the St. Patrick’s Day Parade &amp; breakfast as a necessary precaution to limit risk to the general public. https://t.co/9EkVXXSEHP|en|D|8|9
1237048935698628612|310310133|Mon Mar 09 16:13:44 +0000 2020|Pleased to see the House passed H.R. 1140 last week, the Rights for Transportation Security Officers Act, which will help improve the security operation of the TSA by providing TSA officers and employees with the worker rights and protections they deserve.|en|D|2|11
1237033577835044866|310310133|Mon Mar 09 15:12:42 +0000 2020|Great time with a packed house full of friends and colleagues at the Corrib Pub in West Roxbury for State @SenatorMikeRush’s Annual St. Patrick’s Day Brunch yesterday – a fun morning with good food, company and excellent entertainment by the world famous Curragh's Fancy! https://t.co/YWJbAWCmiA|en|D|4|20
1236704575979171840|310310133|Sun Mar 08 17:25:22 +0000 2020|(1/3) Great time at the South Boston Allied War Veterans Chief Marshal’s Banquet last night where I enjoyed honoring two of our outstanding women veterans. @SBAWVC https://t.co/etHjbpMPSL|en|D|2|5
1236423399347494913|310310133|Sat Mar 07 22:48:04 +0000 2020|(1/3) Sincere thanks to Mayor @marty_walsh for a wonderful time at the Tommy and Eddie Butler Senior Salute to start the celebrations of St. Patrick’s Day.  Great to see so many seniors who came out to enjoy the food and entertainment! https://t.co/X3qH4FVPJ5|en|D|1|13
1236031529010311169|310310133|Fri Mar 06 20:50:55 +0000 2020|This week the @TransportDems Railroads, Pipelines and Hazardous Materials Subcommittee held a hearing on America’s rail system and its significant need for more investments.  https://t.co/OxL3EF0U6m|en|D|3|3
1235974028885716992|310310133|Fri Mar 06 17:02:26 +0000 2020|This week my @OversightDems Chair colleagues and I sent letters to the HHS and CDC seeking detailed information regarding the testing, diagnoses and costs of treating the novel coronavirus (COVID-19).  https://t.co/ifZem7IgVx|en|D|4|2
1235943810191982597|310310133|Fri Mar 06 15:02:21 +0000 2020|This week the House passed H.R. 6074, the Coronavirus Preparedness and Response Supplemental Appropriations Act, to provide $8.3 B in emergency funding for an effective and well-coordinated response to protect the health and safety of all Americans.|en|D|2|8
1235242093565616129|310310133|Wed Mar 04 16:33:59 +0000 2020|Yesterday @TransportDems Aviation Subcmte held a hearing on the safety of Airline Passengers. As the US works to contain coronavirus if an airline passenger later tests positive for COVID-19 the CDC will request passenger contact information from airlines. https://t.co/xCsZ66aaST|en|D|2|2
1234547611803299841|310310133|Mon Mar 02 18:34:22 +0000 2020|Pleased to see the House passed the bipartisan H.R. 473 last week, which would authorize the first outdoor monument honoring the women’s suffrage movement in Washington, D.C.  #womenshistorymonth2020|en|D|4|10
1233497267694440449|310310133|Fri Feb 28 21:00:40 +0000 2020|This week I introduced H.R. 5957, the K2 Veterans Toxic Exposure Accountability Act of 2020, with my colleague @RepMarkGreen which directs the Secretary of Defense to conduct a study regarding toxic exposures at K2 Air Base in Uzbekistan. https://t.co/TA3lQGZNMv|en|D|1|5
1233441709188616195|310310133|Fri Feb 28 17:19:54 +0000 2020|Yesterday the @OversightDems held a hearing on the Trump Administration’s assault on LGBTQ+ rights and how it has affected the LGBTQ+ community. https://t.co/tzFxZtJWSg|en|D|2|2
1233400406904123395|310310133|Fri Feb 28 14:35:47 +0000 2020|Proud to see the House passed the historic H.R. 35 this week, the #EmmettTill Antilynching Act, which will finally make the heinous act of lynching a federal crime. This overdue bill helps provide long awaited justice to the over 4,000 victims of lynching in the United States.|en|D|2|9
1233196856055910401|310310133|Fri Feb 28 01:06:56 +0000 2020|I am deeply saddened for everyone affected by the shooting in Milwaukee yesterday and send prayers to all the victims and their loves ones.|en|D|3|13
1233081372132171776|310310133|Thu Feb 27 17:28:03 +0000 2020|As Chairman of the @OversightDems National Security Subcommittee, I will be holding a hearing on the hazardous contaminations U.S. servicemembers may have been exposed to while deployed at the K2 base in Uzbekistan. https://t.co/VaQZ8SzhBo|en|D|2|3
1230883779117506560|310310133|Fri Feb 21 15:55:36 +0000 2020|Recent reports have found there are high levels of radon – a colorless, odorless, cancer causing gas – in federally-subsidized housing across the country, including many Housing Authorities in Massachusetts. https://t.co/xhwUxGJjbR|en|D|3|5
1229875807859937284|310310133|Tue Feb 18 21:10:17 +0000 2020|I had a very productive and informative trip to the Munich Security Conference, European Commission and NATO Headquarters. https://t.co/JDWbIcj7PS https://t.co/o7DJ2xxvCn|en|D|3|12
1228707736721985538|310310133|Sat Feb 15 15:48:47 +0000 2020|The United States has a responsibility to ensure our veterans receive the proper healthcare and benefits they deserve after serving our country.  https://t.co/tgTcDY0Vki|en|D|5|11
1228373875458805762|310310133|Fri Feb 14 17:42:08 +0000 2020|The @USCensusBureau is still hiring for the #Census2020 – if you or anyone you know is interested in this great job opportunity you can apply here: https://t.co/mJovLEe7Sw|en|D|3|5
1228025331501731841|310310133|Thu Feb 13 18:37:09 +0000 2020|Very proud to see the House passed H.J.Res.79 to facilitate the official ratification of the Equal Rights Amendment to the U.S. Constitution, which prohibits discrimination on the basis of sex. #ERAVote|en|D|4|11
1227739242777935873|310310133|Wed Feb 12 23:40:20 +0000 2020|Today the House passed H.R. 2546, the Protecting America’s Wilderness Act, to protect 1.3 million acres of wilderness and 1,000 miles of rivers to help protect clean water and air, which are also our best resources to help combat climate change. #KeepItWild|en|D|4|26
1227701539801903104|310310133|Wed Feb 12 21:10:31 +0000 2020|(1/3) Today the @OversightDems held a hearing on the new report issued by the nonpartisan GAO office which found major concerns with the Census Bureau’s preparation for the #2020census. https://t.co/69QiZ7ezNA|en|D|1|2
1227647624859258880|310310133|Wed Feb 12 17:36:17 +0000 2020|As Chair of FinTech TaskForce, I am looking into how technology is changing and influencing how Americans access financial services to help address bank diversity and inclusion, especially in communities that have been victims of discriminatory practices. https://t.co/vQHH4Djz9X|en|D|5|4
1227285060467949569|310310133|Tue Feb 11 17:35:34 +0000 2020|This morning the @TransportDems Aviation Subcommittee held a hearing on the future of America’s aviation maintenance and manufacturing workforce, where we examined how the industry has changed and the challenges we are facing to get more people to work in the aviation field.|en|D|2|2
