id|user|created_at|text|lang|label|retweet_count|favorite_count
1389550065627316225|24913074|Tue May 04 11:58:46 +0000 2021|For 10 years I’ve fought to take sexual assault cases out of the chain of command. For our brave servicemembers, we must not wait any longer. As Gen. Milley recognized, the status quo has failed. Let us now act to rebuild confidence in military justice. https://t.co/LIPCk3XOJh|en|D|33|140
1387919278477758470|24913074|Thu Apr 29 23:58:36 +0000 2021|IN ONE HOUR – my tele town hall to discuss the latest on COVID and on the filibuster. @AJentleson, author of “Kill Switch,” will share his perspective on the Senate rule he says is crippling our democracy. You can listen live at https://t.co/1qkhHDnC1k|en|D|11|51
1387825914986201089|24913074|Thu Apr 29 17:47:37 +0000 2021|There is real help for restaurants, caterers and food trucks now! The long-anticipated Restaurant Revitalization Fund will go live 5/3, w/ an opportunity to pre-register 4/30! I’m hosting a virtual workshop this Friday with @SBA_SF to answer your Qs. https://t.co/uNArQ7qsgt|en|D|13|31
1387814731130425345|24913074|Thu Apr 29 17:03:10 +0000 2021|TODAY at 6 pm PT, I will hold a tele town hall on the latest on COVID and on the filibuster. @AJentleson, author of “Kill Switch,” will share his perspective on the Senate rule he says is crippling our democracy. You can listen live at https://t.co/1qkhHDnC1k|en|D|16|54
1387585900679467008|24913074|Thu Apr 29 01:53:53 +0000 2021|FDR and the New Deal -- move over, here comes Joe Biden and the Real Deal!|en|D|136|706
1387584623157268480|24913074|Thu Apr 29 01:48:48 +0000 2021|So proud to have my virtual guest for the joint session be a child care worker. Child care is infrastructure that makes our economy run and keeps our children safe. @FootstepsCC CEO Karen Hass-Foletta is a hero of the pandemic recovery.|en|D|15|104
1387583480629014534|24913074|Thu Apr 29 01:44:16 +0000 2021|How refreshing it is to listen to a President who doesn’t put a pit in your stomach and instead puts hope in your heart.|en|D|252|1812
1387578989343019011|24913074|Thu Apr 29 01:26:25 +0000 2021|What an idea --American tax dollars going to pay for American products made by American workers.|en|D|91|514
1387577104334733322|24913074|Thu Apr 29 01:18:56 +0000 2021|This is a seismic transformation-reducing childhood poverty by 50 percent. If kids are our future, let's prove it.|en|D|47|283
1387574700201631745|24913074|Thu Apr 29 01:09:23 +0000 2021|Madame Speaker, Madame Vice President. Hearing @POTUS say that was thrilling to me and should be to every woman who dreams about a more equitable world.|en|D|118|937
1387542472893419520|24913074|Wed Apr 28 23:01:19 +0000 2021|TOMORROW at 6 pm PT, I will hold a tele town hall on the latest on COVID and on the filibuster. Adam Jentleson, author of “Kill Switch,” will share his perspective on the Senate rule he says is crippling our democracy. You can listen live at https://t.co/1qkhHDnC1k.|en|D|13|50
1387385743954399240|24913074|Wed Apr 28 12:38:32 +0000 2021|Proud to lead 150 Members in voicing strong support for international family planning. U.S. investments in reproductive care reduce maternal deaths, avert unsafe abortions and unintended pregnancies, &amp; expand contraceptive care. Let's double down on these life-saving investments! https://t.co/q0uierbWYI|en|D|24|123
1387210079833923588|24913074|Wed Apr 28 01:00:30 +0000 2021|Thx to @POTUS, we've made the largest investment in childcare since WW2! Proud to honor Footsteps CEO &amp; childcare provider Karen Haas-Foletta as my virtual guest to @POTUS' Joint Address. These unsung heroes help our children grow &amp; thrive as parents get back to work. #HelpIsHere|en|D|43|291
1385997023409803271|24913074|Sat Apr 24 16:40:15 +0000 2021|I applaud @POTUS's recognition of the #ArmenianGenocide for what for what it was - the first genocide of the 20st century. After co-leading the resolution for recognition, I'm proud that the U.S. now speaks with one voice to acknowledge the genocide of the Armenian people. https://t.co/LweVphwGYS|en|D|82|422
1385623560350220288|24913074|Fri Apr 23 15:56:15 +0000 2021|The best news I've heard in 10+ years of fighting to remove cases from the chain of command! It's in line w/my I am Vanessa Guillén Act, which I'm reintroducing soon. Kudos to the independent review panel for recognizing that we must restore faith in the military justice system! https://t.co/m9Op2Oa2l2|en|D|112|453
1385366451566043140|24913074|Thu Apr 22 22:54:35 +0000 2021|It's been 1 year since the murder of SPC Vanessa Guillén, a brave, talented young soldier who wanted to serve her country. As I told her family yesterday, I'll never give up my fight to pass the I Am Vanessa Guillén Act so that Vanessa’s memory lives on &amp; this never happens again https://t.co/XSPdWL4TQw|en|D|94|334
1385291794959765508|24913074|Thu Apr 22 17:57:56 +0000 2021|"Your ZIP code shouldn’t determine your health. But some communities have to fight polluters right in their back yards every day. 
 
This #EarthDay, I stand for #EnviroJusticeNow. We’ve got to protect Americans and the Earth, not prioritize polluter profits. https://t.co/xa4izQgAne"|en|D|18|58
1384722808693874690|24913074|Wed Apr 21 04:16:59 +0000 2021|What if 17yr old Darnella Frazier hadn’t videotaped George Floyd’s death? We would never have known. On average 3 people die each day by police.|en|D|308|1809
1384719619747766275|24913074|Wed Apr 21 04:04:18 +0000 2021|https://t.co/fFVUoIafuU|und|D|90|558
1384623604218880001|24913074|Tue Apr 20 21:42:46 +0000 2021|"Justice has been done in this case. More to come. 
 https://t.co/ZttOxIggDx"|en|D|17|167
1384522799079903235|24913074|Tue Apr 20 15:02:13 +0000 2021|Military families shouldn't have fewer rights than those they serve to protect, that includes access to contraception &amp; family planning counseling without cost barriers. Proud to intro my bill w/104 Members to ensure military families get the repro healthcare they need &amp; deserve! https://t.co/VN6RVEYgEA|en|D|116|561
1383610504841621511|24913074|Sun Apr 18 02:37:05 +0000 2021|We should listen to our neighbors to the north. https://t.co/cZVUfiP5ZF|en|D|2780|7783
1383243375537647622|24913074|Sat Apr 17 02:18:14 +0000 2021|This is grotesque and appalling. Azerbaijan’s latest display is a sickening theme park featuring caricature wax figures of dying Armenians and showcasing helmets of deceased soldiers. https://t.co/IO6FaDMSR8|en|D|62|179
1383087039340552194|24913074|Fri Apr 16 15:57:01 +0000 2021|The 11th Circuit's rejection of Courtney Wild's lawsuit challenging Epstein's 2007 plea deal sets a dangerous precedent - all perps have to do to bypass crime victims’ rights is cop a plea. Congress must pass the Courtney Wild Crime Victims' Rights Reform Act &amp; CVRA of 2020 NOW! https://t.co/GyMQm8E3yK|en|D|31|77
1382823238905032706|24913074|Thu Apr 15 22:28:46 +0000 2021|"Yet again a military commander self-investigates, comes up ""clean"" and only an OUTSIDE investigator exposes the truth. Forcing a Black servicemember to wear chains is beyond vile, it's inhuman. Those who tolerated this disgusting behavior must be discharged dishonorably. https://t.co/2INXyzawgD"|en|D|37|88
1382803291764105220|24913074|Thu Apr 15 21:09:30 +0000 2021|Azerbaijan holds 200 Armenian POWs, subjecting many to horrific abuse. The U.S. must insist that it release all POWs now. Shockingly, the U.S. sent Azerbaijan $100m in assistance while Armenia received $0. The U.S. must return to parity in assistance to Armenia &amp; Azerbaijan!|en|D|166|438
1382785803605188611|24913074|Thu Apr 15 20:00:01 +0000 2021|My MILPERS hearing on the @DeptofDefense Inspector General and Services Inspectors General is starting now. We need to take a hard look at the system: Are the IGs truly independent? Why are so few reprisal allegations substantiated? Watch it live here: https://t.co/NypM0epaSa|en|D|7|17
1382768753771941890|24913074|Thu Apr 15 18:52:16 +0000 2021|Women &amp; their families shouldn't have to live in poverty or have less $ for child care, rent, food, etc b/c their boss is getting their labor at bargain prices. We demand recognition of our equal value! The Paycheck Fairness Act is what women need to get equal pay for equal work. https://t.co/GVEel2vszX|en|D|48|180
1382749278788014082|24913074|Thu Apr 15 17:34:52 +0000 2021|".@FBI Director Wray has declined requests to meet with me regarding rampant sexual harassment &amp; assault at the FBI. Today I asked for answers. His response that the FBI has ""zero tolerance"" isn't good enough. As I told him, I’m staying on this until we get justice for survivors! https://t.co/wYD7HW5HVO"|en|D|69|266
1382386504094384132|24913074|Wed Apr 14 17:33:20 +0000 2021|Requiring servicewomen to pay more for uniforms than servicemen is blatant gender discrimination, pure &amp; simple. I'm proud to support @RepBrownley's legislation to end this unfair &amp; sexist ‘pink’ tax– an abuse I’ve fought my entire career to end –on America’s brave servicewomen. https://t.co/kedEBstnbu|en|D|100|437
1382376263894044674|24913074|Wed Apr 14 16:52:39 +0000 2021|Wishing all of my Muslim constituents and observers across the country a peaceful Ramadan. I hope that this next month allows you to connect with loved ones and time to reflect on this past year. #RamadanMubarak! https://t.co/qLTZk8r15Y|en|D|25|59
1382168610571968512|24913074|Wed Apr 14 03:07:30 +0000 2021|I ache for Daunte Wright's family. Being Black in America means a traffic stop could cost your life. Think about that. As a white American I have never feared for my life at a traffic stop. Police training is failing. Daunte’s mom should be planning his future, not his funeral. https://t.co/aBlrvQEOzK|en|D|48|246
1382044162850230276|24913074|Tue Apr 13 18:53:00 +0000 2021|For those who doubt the existence of systemic racism consider this: Black women in the US are nearly 3 times more likely to DIE from pregnancy or childbirth than white women. I'm cosponsoring the Black Maternal Health Momnibus to help end these injustices &amp; #SaveMoms now! https://t.co/10V6sI1a95|en|D|55|152
1382027459873366018|24913074|Tue Apr 13 17:46:37 +0000 2021|A heartbreaking reminder that the loss of Officer Billy Evans will reverberate throughout the lives of his children, family &amp; his law enforcement family forever. We can never repay the debt of gratitude we owe Officer Evans, but we can &amp; must honor his courage &amp; sacrifice. https://t.co/rkyAUaMtM0|en|D|15|72
1382015726106652674|24913074|Tue Apr 13 17:00:00 +0000 2021|"Don’t get sick as an American worker. You probably can’t afford it. 30 million private sector workers don't have the ""luxury"" of paid sick days, even amid a pandemic. I'm cosponsoring the #HealthyFamiliesAct b/c no one should have to choose between their wellbeing &amp; their job. https://t.co/bTEaytfRam"|en|D|29|80
1381990591215570944|24913074|Tue Apr 13 15:20:07 +0000 2021|Wishing our Sikh communities everywhere Happy Vaisakhi! The holiday of Vaisakhi honors human rights and religious freedom, values that all Americans hold dear. I will always stand side by side with our Sikh communities in the fight against persecution, discrimination, and hatred. https://t.co/CklNFPuZM3|en|D|13|71
1381950351918698499|24913074|Tue Apr 13 12:40:13 +0000 2021|"We cannot miss this moment to invest in care! 
If we had universal childcare:
-Women working full-time would increase by 17% &amp; 31% for those w.o. college degree
-Women's income would increase by $130Billion
-Women would have an extra $20k in savings
-Senior poverty would fall 21% https://t.co/zL485n250M"|en|D|33|100
1380177322146430976|24913074|Thu Apr 08 15:14:50 +0000 2021|Thank you @FLOTUS for fighting for military families &amp; recognizing the importance of childcare! 135 mil childcare facilities are in POOR or FAILING condition. 9,000 children are stuck on waitlists. Childcare is infrastructure &amp; our families deserve better! https://t.co/hJo0f4S7MD|en|D|31|131
1380149778454024204|24913074|Thu Apr 08 13:25:23 +0000 2021|A picture is worth a thousand words. First Erdogan withdraws from the Council of Europe Convention on Preventing &amp; Combating Violence Against Women, then shows a total lack of respect for European Commission President von der Leyen #GiveHerASeat https://t.co/UtgvKQKbqm|en|D|40|102
1379962194071281667|24913074|Thu Apr 08 01:00:00 +0000 2021|STARTING NOW – my tele town hall to discuss the impacts of COVID on Belle Haven &amp; East Palo Alto. San Mateo County Manager Mike Callagy will help answer questions about vaccine access &amp; other issues. You can listen live at https://t.co/1qkhHDFdpU or https://t.co/FxjkoLwXkq. https://t.co/F0BDlMtaxN|en|D|7|26
1379947097181581313|24913074|Thu Apr 08 00:00:00 +0000 2021|IN ONE HOUR – my tele town hall to discuss COVID impacts on Belle Haven &amp; East Palo Alto begins. San Mateo County Manager Mike Callagy will help answer questions about vaccine access &amp; other issues. You can listen live at https://t.co/1qkhHDFdpU or https://t.co/FxjkoLwXkq https://t.co/WLQXRtHPKY|en|D|7|40
1379818749717516288|24913074|Wed Apr 07 15:30:00 +0000 2021|TODAY at 6 pm PT, I will hold a tele town hall to discuss the impacts of COVID on our Belle Haven &amp; East Palo Alto communities. San Mateo County Manager Mike Callagy will help answer questions about vaccine access &amp; other issues. You can listen live at https://t.co/1qkhHDFdpU. https://t.co/voq3ZNvDko|en|D|6|32
1379615720728887297|24913074|Wed Apr 07 02:03:14 +0000 2021|Bravo @SecCardona for announcing concrete steps to restore the sanctity &amp; intent of Title IX &amp; ensure all students can learn free from sexual violence. Each day that DeVos' cruel Title IX rule is on the books is a day students are denied their civil rights. We won't stand for it! https://t.co/rLw6LIEdZu|en|D|28|138
1379456364125114370|24913074|Tue Apr 06 15:30:00 +0000 2021|TOMORROW at 6 pm PT, I will hold a tele town hall to discuss the impacts of COVID on our Belle Haven &amp; East Palo Alto communities. San Mateo County Manager Mike Callagy will help answer questions about vaccine access &amp; other issues. You can listen live at https://t.co/1qkhHDnC1k. https://t.co/Qz1QlgF7ov|en|D|16|39
1379290380504555520|24913074|Tue Apr 06 04:30:27 +0000 2021|I admired him and loved him. I had the good fortune to have him call me to share his thoughts on life and governance a few weeks before he died. It was his good bye call, as he referred to it. It will live in my heart for the rest of my life.|en|D|27|734
1379289856111603712|24913074|Tue Apr 06 04:28:22 +0000 2021|He loved the classroom and the over 10,000 students he taught gaining him the distinction of teacher of the year in San Mateo County. As a legislator he earned high praise and wrote the gospel on education reform during his years in the State Assembly.|en|D|10|121
1379289780899389443|24913074|Tue Apr 06 04:28:04 +0000 2021|He was a devout husband, father and grandfather, always looking to the future.|en|D|9|175
1379289180216303617|24913074|Tue Apr 06 04:25:41 +0000 2021|Gene Mullin was a man whose generous heart was always overflowing, whose ethics were those of a theologian and whose mind was like Sherlock Holmes, always probing, always asking tough questions about what is in the public’s best interest. https://t.co/GjaJxWU1hI|en|D|17|142
1379218092748849152|24913074|Mon Apr 05 23:43:12 +0000 2021|WEDNESDAY at 6 pm PT, I will hold a tele town hall on COVID impacts on our Belle Haven &amp; East Palo Alto communities. San Mateo County Manager Mike Callagy will help answer questions about vaccine access &amp; other issues. You can listen live at https://t.co/1qkhHDFdpU. https://t.co/ALnTv6DwBW|en|D|14|37
1379185955861581824|24913074|Mon Apr 05 21:35:30 +0000 2021|Women count, but I guess not in this new economy. Only 1/3 of the March job growth went to women. At this rate we'll need 15 months of record job growth to recover 4.6 million jobs lost by women since the pandemic. Women &amp; families can't wait. We need the American Jobs Plan NOW!|en|D|82|329
1378736618761293825|24913074|Sun Apr 04 15:50:00 +0000 2021|#Easter is a time to celebrate new beginnings, but we must remember that we are still battling a deadly pandemic. Our ability to safely spend time with our families and friends for future holidays means continuing to social distance today. Happy Easter to all who celebrate! https://t.co/B4hbSG3I6c|en|D|15|110
1378081594343370756|24913074|Fri Apr 02 20:27:10 +0000 2021|Deeply saddened by the loss of another Capitol Police officer &amp; that 2 other officers have been injured. They put their lives on the line every day &amp; have endured too much trauma already. We are forever indebted to them. My heart &amp; prayers go out to the officers &amp; their families. https://t.co/NzdDb1WtWG|en|D|20|147
1377427813163094021|24913074|Thu Apr 01 01:09:16 +0000 2021|.@SecYellen is exactly right. The fact that women’s labor force participation was higher when she came to Washington in the 90s than it is now speaks volumes. We must invest in social infrastructure to get women back to work - starting w/universal child care &amp; paid family leave! https://t.co/hnUyrxbvHP|en|D|19|112
1377366088321617921|24913074|Wed Mar 31 21:04:00 +0000 2021|This is America, no one should be discriminated against because of who they are. Everyone deserves equal rights &amp; access to healthcare. This #TransDayOfVisibility, we recognize the dignity &amp; worth of trans Americans &amp; recommit to ending discrimination against the trans community! https://t.co/4SeliHKEkE|en|D|10|69
1377336446470680576|24913074|Wed Mar 31 19:06:13 +0000 2021|The late John Lewis said it's never the wrong time to do the right thing &amp; the Pentagon was absolutely right to reestablish a policy of inclusion for our transgender servicemembers to serve openly &amp; proudly. Next, we must still establish nondiscrimination protections in law. https://t.co/0fu2javPWo|en|D|27|156
1376931474142859266|24913074|Tue Mar 30 16:17:00 +0000 2021|The times they are a changing. I applaud the Navy for elevating four servicewomen of color to commanders of warships, not only making history but recognizing and encouraging the contributions of our fighting women in the military and beyond.  https://t.co/HQxs2t136t|en|D|39|198
1376903348239097857|24913074|Tue Mar 30 14:25:14 +0000 2021|The only way to change the systematic racism and injustice inherent in our justice system is to make it more inclusive. I’m proud of these groundbreaking noms and the Biden-Harris Administration for staying true to its campaign vows and moral compass. https://t.co/RolhOspca5|en|D|32|156
1376600781483298819|24913074|Mon Mar 29 18:22:56 +0000 2021|Who wants to go to Georgia with me for the next Election Day and pass out water? https://t.co/IeFRuaTZQn|en|D|146|946
1376593904242425861|24913074|Mon Mar 29 17:55:37 +0000 2021|Another way to save the @USPS from extinction is to bring them into the 21st century &amp; let them ship alcohol. My bill fixes a Prohibition-era wrong by putting USPS on the same footing as FedEx &amp; UPS, which could bring in a boost of billions of dollars. https://t.co/rR40VbX8k8|en|D|88|418
1375938179019239424|24913074|Sat Mar 27 22:30:00 +0000 2021|"This past year has been challenging for everyone as we work to overcome the #COVID19 pandemic.

Now more than ever, we must remember the importance of family and community. 
 
We’re all in this together.
 
Chag Sameach to all who celebrate #Passover. https://t.co/4EcFspoiiL"|en|D|17|88
1375814635232894978|24913074|Sat Mar 27 14:19:05 +0000 2021|#ICYMI, @HouseDemWomen were joined by women’s equality warriors @PattyArquette, @MDuggan10, Mona Sinha, @MariaTeresa, @wendychunhoon, @joitweets, and @glyndacarr to raise awareness about the fight for #EqualPay. With these women on our side nothing can stand in our way! https://t.co/p6eMkAC6OJ|en|D|18|53
1375545707784937477|24913074|Fri Mar 26 20:30:27 +0000 2021|".@DeptofDefense gives lip service to providing over 200,000 children w/childcare. 135+ military childcare centers are ""poor"" or ""failing."" Only 8 projects have been funded in 10 yrs. It’s time to walk the walk. I think @POTUS &amp; @DrBiden get it. Let’s put military families first."|en|D|32|144
1375530494197178368|24913074|Fri Mar 26 19:30:00 +0000 2021|This year, the AAPI community has been terrorized by over 3,800 hate crimes &amp; incidents – 68% targeting Asian women! On today’s Nat'l Day of Action &amp; Healing, we must all do our part to ensure that our AAPI friends, family members &amp; neighbors aren't living in fear. #StopAsianHate https://t.co/LID7S97Uh0|en|D|12|38
1375514148465876993|24913074|Fri Mar 26 18:25:03 +0000 2021|Nina's op-ed shows those seeking to silence strong women have used deep fakes w/impunity in America &amp; worldwide. Not only have we lost countless brilliant women's and girls' voices in these attacks, they are a clear &amp; present danger to our national security. This is unacceptable! https://t.co/fNsnp1w7wf|en|D|10|31
1375510639523688449|24913074|Fri Mar 26 18:11:06 +0000 2021|.@POTUS's infrastructure proposal is a once-in-a-generation opportunity to make a real difference in the lives of our military families. We must dedicate $5 billion to Military Child Development Center facility construction &amp; repairs to benefit all families—military and civilian. https://t.co/F0NGBRNguR|en|D|34|108
1375477459433484289|24913074|Fri Mar 26 15:59:16 +0000 2021|Happy Birthday to our history making, glass ceiling shattering, warrior for women and justice, tireless advocate for children, and fierce fighter for all Americans -- especially the underserved -- @SpeakerPelosi! It’s an honor and privilege to serve in Congress with you. https://t.co/Myl5K4zEN0|en|D|63|329
1375191078433869825|24913074|Thu Mar 25 21:01:17 +0000 2021|Celebrating the great news and so proud to see California moving quickly to expand #COVID19 vaccine eligibility to those 50 and older as of April 1, and 16 and older starting April 15th! Democrats are making good on our promises to get shots in arms &amp; build America back better! https://t.co/SzFK3BhZM6|en|D|18|84
1375175448032915460|24913074|Thu Mar 25 19:59:10 +0000 2021|The fact that a successful businesswoman feels forced to quit this platform because of toxic hatred spewed at her speaks volumes about the problem of online misogyny. My heart &amp; support goes out to @chrissyteigen &amp; all women who face these attacks simply for speaking up online. https://t.co/NK9U3Ezm2b|en|D|37|250
1375170256805715975|24913074|Thu Mar 25 19:38:33 +0000 2021|My colleague @RepDonBacon &amp; I recently spoke w/ @ASP about the issue of military sexual assault &amp; the need for Congress to act. Though we may not agree on every point, this shows that bipartisanship is alive &amp; well and we can work across the aisle to address profound injustices. https://t.co/zcjTd1iu1T|en|D|9|22
1375154504627318785|24913074|Thu Mar 25 18:35:57 +0000 2021|.@HouseDemWomen wrote to @POTUS about the importance of social infrastructure. Investing in infrastructure is not just about roads &amp; bridges, it's also the childcare &amp; paid leave that enables our society to function. To Build Back Better we must prioritize the caregiving economy! https://t.co/U1LpUbaHwN|en|D|23|60
1375092608020582404|24913074|Thu Mar 25 14:30:00 +0000 2021|Friday’s day of action to #StopAsianHate can’t come soon enough. The Bay Area &amp; AAPI communities across the country are being terrorized by spikes in violent attacks &amp; hate crimes. Hatred spreads like a virus. We can stop it by standing w/our AAPI communities &amp; against racism! https://t.co/4ZskKxToWV|en|D|11|32
1375072577186582528|24913074|Thu Mar 25 13:10:24 +0000 2021|Bravo to @JenSiebelNewsom for getting @Twitter @Adobe @genentech @Mattel @Nextdoor &amp; 60 other companies to sign an Equal Pay Pledge to conduct an annual company-wide gender pay analysis. CA loses $78 billion/year to the pernicious gender wage gap. Businesses must lead by example! https://t.co/UNSRaNWoku|en|D|4|24
1374795405091860485|24913074|Wed Mar 24 18:49:01 +0000 2021|.@HouseGOP loves to argue that the gender wage gap is a farce, claiming the $10,000 difference in earnings is due to women's choices. It's so offensive, as if being pushed out of a job due to a lack of paid leave, pregnancy accommodations or sexual harassment is a choice! https://t.co/WOX7dc7xRL|en|D|50|148
1374767529411895302|24913074|Wed Mar 24 16:58:15 +0000 2021|Today’s @DeptofDefense IG report substantiating former Navy Auditor Gen Booth, a serial sexual predator, was unleashed to prey on at least 12 women for over 20 years w/no accountability is a sickening &amp; stunning indictment. Why are taxpayers footing the bill for his full pension? https://t.co/0TUaTefFZ3|en|D|77|145
1374756774893486080|24913074|Wed Mar 24 16:15:31 +0000 2021|"#EqualPayDay marks the extra 3 months women must work to earn what men made last yr. This is not about ""choices."" It's about discrimination &amp; weak laws. When there's no paid leave, affordable childcare, or pregnancy accommodations, you're not making a choice, you're being pushed."|en|D|36|141
1374743444623609861|24913074|Wed Mar 24 15:22:33 +0000 2021|"TY @mPinoe for testifying about the pernicious pay gap &amp; that no level of status will ""protect you from the clutches of inequity."" Women athletes &amp; all women deserve equality. That's why @HouseDemWomen intro'd the Even Playing Field Act in '19 to ensure equal wages &amp; investment!"|en|D|16|106
