id|user|created_at|text|lang|label|retweet_count|favorite_count
889612810757562368|20545793|Mon Jul 24 22:26:36 +0000 2017|Submitted #SolutionsOverPolitics, my plan to stabilize indv market &amp; improve ACA, to Dems Steering &amp; Policy Cmmte… https://t.co/wKDLmoDJcV|en|D|6|12
885266778917662720|20545793|Wed Jul 12 22:37:02 +0000 2017|Serious about affordable health care for everyone? Time to tackle real issues. My plan to stabilize the indv market… https://t.co/M3ldSsACMt|en|D|11|32
879457571769339905|20545793|Mon Jun 26 21:53:19 +0000 2017|Whether in the Senate or House #GOPrepeal is still bad for our health, bad for our economy &amp; will cost taxpayers ev… https://t.co/leLcarH3Dr|en|D|25|31
878277721960439808|20545793|Fri Jun 23 15:45:01 +0000 2017|A strong Medicaid = a strong CHIP. #TrumpCare’s cuts to Medicaid would mean 3 million children losing health insura… https://t.co/VzIBeI2gdJ|en|D|14|22
878273949607612420|20545793|Fri Jun 23 15:30:01 +0000 2017|CHIP stands on the shoulders of Medicaid. Medicaid covers 37 million low income children while CHIP covers 8.9 mill… https://t.co/Y9tOvCfr4b|en|D|7|14
877983981479706624|20545793|Thu Jun 22 20:17:47 +0000 2017|#CTE fulfills employer needs in high-skill, high-wage, high-demand areas and provides family-sustaining jobs… https://t.co/0qcRwk7HGc|en|D|3|11
877983226869960704|20545793|Thu Jun 22 20:14:48 +0000 2017|Check out this map of all the 'Farm to School' gardens in OR (there are more than 600!) including quite a few in ou… https://t.co/Txr59w3iu5|en|D|4|13
877608711627300869|20545793|Wed Jun 21 19:26:36 +0000 2017|My bipartisan, common sense bill to prevent wildfires &amp; blackouts is on the floor for a vote today. https://t.co/0KzZ8lgY5m|en|D|3|16
877229076427272193|20545793|Tue Jun 20 18:18:04 +0000 2017|It was an honor to visit the local VFW yesterday evening to talk with veterans about the issues they see in the com… https://t.co/S54SbkV1XT|en|D|1|3
876941700538740736|20545793|Mon Jun 19 23:16:08 +0000 2017|Thanks to @ProvHealth for opening Oregon’s first inpatient psychiatric unit for kids at their Willamette Falls hosp… https://t.co/OVZoQJPt3o|en|D|1|20
876854082199318528|20545793|Mon Jun 19 17:27:59 +0000 2017|Great conversation with the hardworking men and women of the Northwest Oregon Labor Council this morning. https://t.co/rEDldGGXhO|en|D|1|7
875735933592764416|20545793|Fri Jun 16 15:24:51 +0000 2017|Actually, it's a Shelby Cobra Mustang -- 662HP https://t.co/4yDt2Mrr4x|en|D|6|71
874981406614728704|20545793|Wed Jun 14 13:26:38 +0000 2017|Thankful every day for the courage of Capitol Police who keep us safe day in &amp; day out. Thoughts with @SteveScalise, the officers &amp; staff.|en|D|5|29
874676431720263681|20545793|Tue Jun 13 17:14:46 +0000 2017|Sign-up for my TeleTown Hall by NOON TODAY! Tomorrow at 6pm PT we will give you a call @ the phone # you provide.… https://t.co/t9J7drLd80|en|D|2|3
872543690782253057|20545793|Wed Jun 07 20:00:01 +0000 2017|NEXT WEEK: I'm hosting a Telephone Town Hall on Wednesday 6/14 at 6pm PT. Sign up to participate:… https://t.co/wIBIbz0voH|en|D|2|4
869251997362511874|20545793|Mon May 29 18:00:00 +0000 2017|On this day, we honor our service members who made the ultimate sacrifice for our country and salute their families… https://t.co/EDDCuY3dh7|en|D|7|21
868488810409201664|20545793|Sat May 27 15:27:22 +0000 2017|There shouldn't have to be any decision. Breaking from our G7 allies &amp; the entire world on climate change is in no… https://t.co/yPpMNAbUOV|en|D|21|57
867495813097951232|20545793|Wed May 24 21:41:33 +0000 2017|Forcing a vote on #GOPRepeal three weeks ago without knowing its real world effect was irresponsible &amp; reckless. No… https://t.co/01kCGOfgLa|en|D|55|87
867472846259445761|20545793|Wed May 24 20:10:18 +0000 2017|Job training programs help our workers stay competitive in the global economy. #Trumpbudget would slash them by 40%… https://t.co/AC2CYf21Bi|en|D|4|12
867106401797189632|20545793|Tue May 23 19:54:10 +0000 2017|Our servicemembers have earned certain basic benefits like knowing their families &amp; homes are taken care of while t… https://t.co/PWXVb6HeQr|en|D|8|19
865226673461108737|20545793|Thu May 18 15:24:48 +0000 2017|My @EnergyCommerce committee is marking up the FDA Reauthorization Act of 2017 this morning. Watch along here: https://t.co/7ezcUbcUWQ|en|D|1|3
864980350702845952|20545793|Wed May 17 23:06:00 +0000 2017|Good. We needed this months ago. https://t.co/6564TEKJbN|en|D|7|31
864950358426169345|20545793|Wed May 17 21:06:50 +0000 2017|Very pleased a bill I cosponsored to help students gain skills needed to succeed in the workforce passed unanimousl… https://t.co/NPrraeJhvv|en|D|1|19
862809651871703042|20545793|Thu May 11 23:20:25 +0000 2017|Thx for the note, Cloie. I agree this new law allowing “sportsmen” in Alaska to kill sleeping animals is wrong. Hop… https://t.co/9vIVszD0rC|en|D|3|18
862787024394350592|20545793|Thu May 11 21:50:31 +0000 2017|Thank you to Canby HS for your work to curb the opioid epidemic in our country, I’m proud to support the “Talk Abou… https://t.co/M1gpajj9Vi|en|D|7|25
862770000418963456|20545793|Thu May 11 20:42:52 +0000 2017|Rotary Club of Clackamas has done great work to support local students and homeless families. Thanks for your work… https://t.co/4k9ScMkomR|en|D|3|9
862443919325495297|20545793|Wed May 10 23:07:08 +0000 2017|Thanks to Lincoln City Rotary for supporting local orgs who help families struggling with homelessness, thanks for… https://t.co/J50ejY7mfd|en|D|2|7
862438113162833920|20545793|Wed May 10 22:44:04 +0000 2017|Great talk today at my 7th Annual Fishermen’s Roundtable. I will continue to fight for fishermen in Congress. https://t.co/sLJqZ3Tzp8|en|D|0|10
862368260649619456|20545793|Wed May 10 18:06:30 +0000 2017|Great touring Pacific Seafood’s community development project which will bring new growth to the Newport Waterfront. https://t.co/OleEOV4JLG|en|D|1|7
862341013804900352|20545793|Wed May 10 16:18:13 +0000 2017|Had a great conversation with local Lincoln County leaders yesterday to talk about what I can do to fight for the c… https://t.co/fqZYadXT5D|en|D|0|4
862150900370067456|20545793|Wed May 10 03:42:47 +0000 2017|Comey should've been fired months ago. Now that he's investigating the relationship between the administration &amp; documented (1/2)|en|D|17|49
862063137796882434|20545793|Tue May 09 21:54:03 +0000 2017|Thanks to Tillamook Rotary for helping local HS students pursue their college careers and for having me at your mee… https://t.co/9ZGTKT3PVM|en|D|0|4
862001191391244288|20545793|Tue May 09 17:47:53 +0000 2017|Thank you to local Tillamook County leaders for meeting with me today to talk about work that I can do to help you… https://t.co/HRk2VFRtD0|en|D|0|11
861705413980561408|20545793|Mon May 08 22:12:35 +0000 2017|Thank you to the students of Woodburn HS for meeting with me today to talk about the future of immigration policies… https://t.co/0UOWuRrHRy|en|D|0|10
860203386410553345|20545793|Thu May 04 18:44:03 +0000 2017|#Trumpcare is bad legislation that's going to strip healthcare from 400k Oregonians. I voted NO. #ProtectOurCare https://t.co/yTaScP7xkd|en|D|29|92
860149841338519553|20545793|Thu May 04 15:11:17 +0000 2017|I tried to delay vote w/o CBO score in committee. My motion was tabled w/o debate. Forcing vote w/o score = reckles… https://t.co/6FnJ8RSyFf|en|D|33|76
860124363340881920|20545793|Thu May 04 13:30:03 +0000 2017|I was a NO in March and I am a NO today. https://t.co/voFdK7VW1U|en|D|15|88
859519625146531840|20545793|Tue May 02 21:27:02 +0000 2017|I’m proud to continue to fight against discrimination towards LGBT Americans by cosponsoring the Equality Act.… https://t.co/k2D5MuMGnG|en|D|4|36
859481212427096065|20545793|Tue May 02 18:54:24 +0000 2017|Had a great discussion today with students from Inza Wood Middle School in Wilsonville. Stay curious &amp; keep up the… https://t.co/VoUrpHIaC1|en|D|1|6
857685287148953600|20545793|Thu Apr 27 19:58:02 +0000 2017|Even as a veterinarian of 30+ years, new puppies never get old! Thanks to the @Humane_Rescue for bringing by Oregon… https://t.co/xXY4UY9Kon|en|D|2|29
857668668922224640|20545793|Thu Apr 27 18:52:00 +0000 2017|I'll be on @1190KEX shortly today with @MarkMasonPDX, tune in! https://t.co/Q0CgSDY4Rn|en|D|1|4
856993008025206785|20545793|Tue Apr 25 22:07:09 +0000 2017|Congrats to our 2017 Congressional Art Competition winner, Tuesday Lewman, with “The Dynamic Personality Behind the… https://t.co/IXckvMNXBK|en|D|2|15
855884251039805440|20545793|Sat Apr 22 20:41:21 +0000 2017|Great time at local shops with @alonsoleon4HD22 today. Thanks to everyone who shops local to support their neighbors https://t.co/QXBUaYRZVx|en|D|5|11
855130739247108097|20545793|Thu Apr 20 18:47:10 +0000 2017|It’s #NationalParkWeek! Last year OR's 5 parks had 1.3 million visitors. Celebrate this weekend with free entry to… https://t.co/vJow9Q5jzx|en|D|17|28
852251289539026945|20545793|Wed Apr 12 20:05:16 +0000 2017|.@HerreraBeutler &amp; I have been working w. local communities on solutions to save our salmon from record # of predat… https://t.co/rSaDbLbdy0|en|D|4|8
851588781698420736|20545793|Tue Apr 11 00:12:41 +0000 2017|Very pleased the VA heard our concerns in a letter I sent them last week calling on the VA to stop removing vets fr… https://t.co/YyT6cEi26A|en|D|4|22
849403103602507776|20545793|Tue Apr 04 23:27:35 +0000 2017|I cosponsored the Paycheck Fairness Act because women and men in the same job should have the same pay. #EqualPayDay https://t.co/uEOq4mXTEZ|en|D|4|46
848248608721780736|20545793|Sat Apr 01 19:00:02 +0000 2017|#GoDucks ! https://t.co/tbVjEHLhyD|und|D|9|44
847840769448783873|20545793|Fri Mar 31 15:59:26 +0000 2017|I reintroduced my bill to reduce the salary of Members of Congress (including my own!) if the government shuts down… https://t.co/FnN4pXYK0P|en|D|19|77
845807168808902656|20545793|Sun Mar 26 01:18:38 +0000 2017|Thanks to everyone who came out in Newport, I will work to protect this community from Trump’s budget disaster. https://t.co/yej2LBLegg|en|D|9|75
845727665063636993|20545793|Sat Mar 25 20:02:42 +0000 2017|Great to see so many engaged people at my Tillamook town hall today. Thanks to everyone who came, including 2-year-… https://t.co/1vBn0FpJM8|en|D|3|30
845368047628103681|20545793|Fri Mar 24 20:13:43 +0000 2017|Still not so sure he’s read his own book… https://t.co/eLapU5lkhR|en|D|20|59
845330942919135236|20545793|Fri Mar 24 17:46:16 +0000 2017|Trump said last night that he’s ready to move on from repeal if this fails. Well, I am too. Vote NO, let’s make the… https://t.co/hCj1NPypTY|en|D|12|82
845075404750815233|20545793|Fri Mar 24 00:50:51 +0000 2017|Still on the floor. They're resorting to 'Martial Law' to force #GOPrepeal through!|en|D|8|22
844960217431523329|20545793|Thu Mar 23 17:13:09 +0000 2017|#GOPrepeal is as simple as 1-2-3: https://t.co/1rpX6OnPZs|en|D|8|19
844905037184860160|20545793|Thu Mar 23 13:33:53 +0000 2017|My GOP friends say @realDonaldTrump doesn't have the votes to pass #GOPrepeal bill today. Has he even read The Art of the Deal?|en|D|19|88
844656551734530054|20545793|Wed Mar 22 21:06:29 +0000 2017|You need health care to visit your doctor &amp; doctors need patients to have jobs. https://t.co/UcebAO833M|en|D|7|10
844255813963268096|20545793|Tue Mar 21 18:34:06 +0000 2017|#GOPrepeal bill changed in secret meeting to appease the far right. Made it even worse by cutting health care off sooner.|en|D|14|17
844214687323570177|20545793|Tue Mar 21 15:50:40 +0000 2017|Early this month, I reintroduced my bill to release this DoD study in full &amp; expedite consideration of suggestions… https://t.co/m1PCkcxrD5|en|D|5|11
842437570093060096|20545793|Thu Mar 16 18:09:03 +0000 2017|Incredibly disappointed @HouseGOP just voted down my bill to prohibit @POTUS's hiring freeze from affecting the VA. Our vets deserve better.|en|D|22|59
841456658974924800|20545793|Tue Mar 14 01:11:15 +0000 2017|CBO confirmed: #GOPrepeal doesn't give people freedom, it backs them into a corner. #PayMoreForLess My statement: https://t.co/p6tcRTjpdA|en|D|9|34
839958391783116800|20545793|Thu Mar 09 21:57:40 +0000 2017|After more than 27 hrs @HouseCommerce forced through #GOPrepeal &amp; we still don't know how much it would cost us. He… https://t.co/v8tpZw1VGQ|en|D|11|12
839879292016283648|20545793|Thu Mar 09 16:43:22 +0000 2017|Thanks for the coffee &amp; donuts as we go into our 25th consecutive hour of #GOPrepeal markup, @RepBonamici! https://t.co/haHB7ZRRM7|en|D|8|31
839862042257420289|20545793|Thu Mar 09 15:34:49 +0000 2017|We've been marking up the #GOPrepeal bill for more than 24 hours now. But what does the bill actually do?… https://t.co/YZnZGR7Olo|en|D|22|46
839620091188740097|20545793|Wed Mar 08 23:33:23 +0000 2017|Oregon had the 6th greatest reduction in uninsured low-income women since #ACA implementation #ProtectOurCare #InternationalWomensDay|en|D|19|48
839549898945138689|20545793|Wed Mar 08 18:54:28 +0000 2017|How can we seriously consider #GOPrepeal without knowing the effect it will have on our economy, pocket books &amp; hea… https://t.co/f09jblX85i|en|D|264|481
839517565844094976|20545793|Wed Mar 08 16:45:59 +0000 2017|Less than 48 hrs after receiving #GOPrepeal bill, we're already marking it up. Watch my opening statement here: https://t.co/2IQnFZeoQe|en|D|11|11
839504036772659200|20545793|Wed Mar 08 15:52:14 +0000 2017|The number of days between the bill's release &amp; markup: #ACA vs #GOPrepeal https://t.co/N77HY7yfFz|en|D|23|29
839486736740859904|20545793|Wed Mar 08 14:43:29 +0000 2017|TUNE IN NOW: I'm talking today's markup of the Republican Repeal bill with @KPAM860.|en|D|2|5
838150506077913088|20545793|Sat Mar 04 22:13:47 +0000 2017|Wishing luck to the students who attended our Service Academy Info Day in pursuit of an honorable career to serve &amp;… https://t.co/cz2r04Sqvd|en|D|1|12
837432629607743488|20545793|Thu Mar 02 22:41:12 +0000 2017|In 2009, everyone had more than enough time to read the entire Affordable Care Act. Here's the copy I annotated bac… https://t.co/Ckn2RNZ8Dp|en|D|21|44
837395850611539969|20545793|Thu Mar 02 20:15:03 +0000 2017|I'll be joining @MarkMasonPDX on @1190KEX at 2pm PT talking about ACA repeal, my bill to #LowerDrugCosts &amp; my call… https://t.co/k5xqwtwvnh|en|D|8|20
837360058992377857|20545793|Thu Mar 02 17:52:50 +0000 2017|So who exactly gets to see the bill that's going to take healthcare away from 400,000 Oregonians? #NoOneGetsACopy https://t.co/UoU4RcxAWL|en|D|21|38
837319484608299013|20545793|Thu Mar 02 15:11:36 +0000 2017|Inexcusable our new AG lied to Senate about his contact w/ Russian. We need special prosecutor in the Russian Probe. Sessions should resign.|en|D|93|200
836773045356408835|20545793|Wed Mar 01 03:00:15 +0000 2017|Finally! An hour in, he mentions our budget. But of course he only talks about the defense budget. No mention of anything else.|en|D|15|43
836765317015683072|20545793|Wed Mar 01 02:29:32 +0000 2017|25 mins into the speech &amp; still no mention of working with Congress. Zero acknowledgment at all of the law making bodies he's addressing.|en|D|35|85
836303788608729090|20545793|Mon Feb 27 19:55:35 +0000 2017|#ICYMI: Check out my interview on @KGWNews’ Straight Talk with Laurel Porter from this past weekend… https://t.co/Hre9kDSa3j|en|D|2|8
835263944373714946|20545793|Fri Feb 24 23:03:37 +0000 2017|Don’t miss me on @KGWNews’ Straight Talk with Laurel Porter this Saturday at 4:30pm, or Sunday at 6:30pm https://t.co/8WGjgieyXc|en|D|4|20
835213619159789570|20545793|Fri Feb 24 19:43:38 +0000 2017|Thanks to @nwdefense &amp; @sammedical for supporting our local national defense and security industries that bring so… https://t.co/XwJySuw0rR|en|D|5|9
834594734429569026|20545793|Thu Feb 23 02:44:25 +0000 2017|About 1000 showed up tonight in our state's capitol for our town hall. I'm humbled &amp; energized by everyone's enthus… https://t.co/p6Mkqwjc21|en|D|28|108
834539793497329669|20545793|Wed Feb 22 23:06:06 +0000 2017|Great meeting with Oregon Industrial Hemp Farmers Association today, thanks for paving the way for this new sustain… https://t.co/md8rA8uan1|en|D|3|33
834490750205362181|20545793|Wed Feb 22 19:51:13 +0000 2017|Thanks to @pdxstem for working to give all Oregon students access to the science and technology jobs of the future. https://t.co/xNFtZpKG3n|en|D|4|17
834236148381782018|20545793|Wed Feb 22 02:59:31 +0000 2017|We've got a great discussion going in Clackamas Co. tonight. At least 650 folks here. Great to see this level of in… https://t.co/HQMAONaZCL|en|D|34|104
834192448574349313|20545793|Wed Feb 22 00:05:52 +0000 2017|Thank you to @archdpdx for all that you do to support our refugees in Oregon and across the country https://t.co/mHhpsdQZNc|en|D|10|39
834169211723378688|20545793|Tue Feb 21 22:33:32 +0000 2017|Great talking to the AP Gov students at OC High School today about how Congress works. Stay involved, you’re the fu… https://t.co/tBZ5ppCwL7|en|D|9|34
833064549494427649|20545793|Sat Feb 18 21:24:00 +0000 2017|Insurers felt market coming together, but GOP plan creates chaos &amp; instability, with less competition &amp; higher costs https://t.co/xKvU3bie2X|en|D|10|20
832649393274642432|20545793|Fri Feb 17 17:54:19 +0000 2017|The mere idea of using our National Guard like this is outrageous &amp; serves only to tear families apart &amp; destroy Am… https://t.co/OlfxxAcn6A|en|D|53|68
831897913286651905|20545793|Wed Feb 15 16:08:13 +0000 2017|Colluding w/ a historic foreign enemy, Russia, is anything but nonsense. The American people deserve answers from t… https://t.co/d2WTEcou0F|en|D|59|115
831640415707107329|20545793|Tue Feb 14 23:05:00 +0000 2017|Wishing a happy 158th birthday to Oregon today! https://t.co/Xddgt4IeqE|en|D|11|53
830183508136120326|20545793|Fri Feb 10 22:35:47 +0000 2017|Thank you to the local leaders of Clackamas County who met with me today to talk about how I can best serve the com… https://t.co/Zoj09Uea80|en|D|5|23
830129448267677696|20545793|Fri Feb 10 19:00:58 +0000 2017|If @RepCummings &amp; @jasoninthehouse can come together to agree Conway's unethical comment is unacceptable its time @realDonaldTrump does too|en|D|12|46
829760603396923394|20545793|Thu Feb 09 18:35:18 +0000 2017|"SPOILER: Veterans. @realDonaldTrump says he ""loves vets"" but he needs to walk his talk, no #VAHiringFreeze! https://t.co/kyLJZZDiqF"|en|D|14|26
829755536316919809|20545793|Thu Feb 09 18:15:10 +0000 2017|Great talks today with Marion &amp; Polk county leaders, thanks for your advice on how I can best serve you in Congress https://t.co/7C6kuQRzr6|en|D|3|12
828668081895415809|20545793|Mon Feb 06 18:14:01 +0000 2017|I'll be hosting a Telephone Town Hall next week on Wednesday, Feb 15th at 6pm PT. Sign-up to participate here: https://t.co/D7MM2l44gf|en|D|8|11
827554814938771460|20545793|Fri Feb 03 16:30:17 +0000 2017|Looks like Trump's rewarding his Russian friends for turning election in his favor by giving US encryption info to their intelligence folks.|en|D|78|87
827308361842556930|20545793|Fri Feb 03 00:10:58 +0000 2017|In 2015, hedge fund manager Martin Shkreli bought a drug used to treat HIV+ patients. #LowerDrugCosts https://t.co/P9fXXP2k9R|en|D|6|7
827191604536627200|20545793|Thu Feb 02 16:27:01 +0000 2017|There are over 650,000 Oregonians with a pre-existing condition. #ProtectOurCare https://t.co/rnavwEWZ6M|en|D|17|33
827180025447223296|20545793|Thu Feb 02 15:41:00 +0000 2017|More than 300,000 Oregonians would lose their coverage if the ACA is repealed. #ProtectOurCare https://t.co/LZGxte7kqI|en|D|30|37
826846054138204163|20545793|Wed Feb 01 17:33:56 +0000 2017|When is Congress going to start to rein in @POTUS @realDonaldTrump legislating from the Oval Office? That's our job.(1/…)|en|D|28|87
826841262242353154|20545793|Wed Feb 01 17:14:53 +0000 2017|Did you know #Medicaid finances over half of all births in America? #ProtectOurCare https://t.co/GgVgGURAap|en|D|10|14
826491242309644292|20545793|Tue Jan 31 18:04:02 +0000 2017|Yesterday I reintroduced my bill to stop price gouging &amp; #LowerDrugCosts, like the EpiPen, by encouraging the produ… https://t.co/K5lehg6FyC|en|D|11|27
826490991230218240|20545793|Tue Jan 31 18:03:02 +0000 2017|The greed and abuse of power we’ve seen from certain unscrupulous drug companies in recent years is disgusting #LowerDrugCosts|en|D|5|25
826467580353220608|20545793|Tue Jan 31 16:30:00 +0000 2017|Medicaid expansion through the #ACA has helped cut the uninsured rate to 8.6%—the lowest level in US history… https://t.co/6Qdy1FaYtz|en|D|11|35
826073988162002944|20545793|Mon Jan 30 14:26:01 +0000 2017|Read my full statement from Friday on Trump's #MuslimBan here: https://t.co/fe8YPUormb|en|D|9|23
826073737195720705|20545793|Mon Jan 30 14:25:01 +0000 2017|Trump's #MuslimBan goes against everything we hold dear in the Constitution. This is dangerous to our own liberty.|en|D|38|152
825465444895072256|20545793|Sat Jan 28 22:07:53 +0000 2017|Thank you to @Habitat4mwv &amp; their volunteer veterans for helping this family build a home. Your commitment to servi… https://t.co/VRGK7GiqpM|en|D|1|12
825106483889188864|20545793|Fri Jan 27 22:21:30 +0000 2017|Tune in now as I join @MarkMasonPDX on @1190KEX News Radio! https://t.co/c7vPVhF9Bs https://t.co/behfx5Sbl6|en|D|1|8
825088560256712704|20545793|Fri Jan 27 21:10:16 +0000 2017|Honored to join @OregonGuard’s 1-189th Aviation Regiment at their mobilization. Thank you for your service. https://t.co/MbBh6oZxdB|en|D|2|11
825052745451368452|20545793|Fri Jan 27 18:47:57 +0000 2017|"ATTENTION: You can still go to https://t.co/7g4xPm3vWV &amp; shop for a plan.
Deadline is Jan 31. #CoverageMatters RT to spread the word!"|en|D|36|36
824667687288705024|20545793|Thu Jan 26 17:17:52 +0000 2017|I think this wall is a stupid idea and a rip off for the American taxpayer.|en|D|116|440
822239730494382081|20545793|Fri Jan 20 00:30:02 +0000 2017|Listen in now as I join Maggie and Carl on @KPAM860 to talk about the new Congress. https://t.co/CYNReAkyGq|en|D|2|2
822136796666589184|20545793|Thu Jan 19 17:41:01 +0000 2017|Your actions, not your words, @realDonaldTrump will show your willingness to advance positive policies for women. https://t.co/j4L09HCHGZ|en|D|20|55
821806930834374657|20545793|Wed Jan 18 19:50:15 +0000 2017|Happy to join the launch of Oregon HUB today! It will be exciting to see the benefits this new industry brings to o… https://t.co/qjPfp7ivbq|en|D|1|6
821450801885356036|20545793|Tue Jan 17 20:15:07 +0000 2017|TY to the students of North Salem HS for voicing your support for immigration reform. It's times like these when yo… https://t.co/ScrTG3F1FV|en|D|5|29
820000877138313217|20545793|Fri Jan 13 20:13:38 +0000 2017|Stunned by intelligence briefing this morning. Very concerned. FBI Director Comey should resign.|en|D|701|1275
819649288548614148|20545793|Thu Jan 12 20:56:33 +0000 2017|No on SECDEF waiver. We have this law for a reason. Civilian control of our military = FUNDAMENTAL principle of our democracy!|en|D|29|81
806563144390901760|20545793|Wed Dec 07 18:16:53 +0000 2016|Pleased to say that a bill I cosponsored which will help Veterans get better care from their doctors passed in the… https://t.co/XSWkAUo47X|en|D|3|39
806536255844458496|20545793|Wed Dec 07 16:30:02 +0000 2016|Today marks 75 years since the attack on Pearl Harbor. Thank you to all the men &amp; women who have bravely served our… https://t.co/VvBCM1HlbD|en|D|2|12
804077799346753536|20545793|Wed Nov 30 21:41:01 +0000 2016|For too long, Congress has been shirking its responsibility when it comes funding research that will lead to cures &amp; treatments at the NIH.|en|D|0|14
804077546132402176|20545793|Wed Nov 30 21:40:00 +0000 2016|I spoke on the House floor today about the 21st Century Cures Act. Watch my remarks here: https://t.co/dYlg1y4WbK|en|D|0|5
801523106552709122|20545793|Wed Nov 23 20:29:34 +0000 2016|We need a new direction and message in order to retake the majority in the House. @RepTimRyan gets my endorsement. https://t.co/W2yZPaHC9N|en|D|30|66
798631164714057728|20545793|Tue Nov 15 20:58:02 +0000 2016|I signed a letter strongly urging our President-elect to reconsider this appointment. Read the letter here: https://t.co/GFFQg43W28 (4/4)|en|D|16|66
798630907733307392|20545793|Tue Nov 15 20:57:00 +0000 2016|Bannon has a history of encouraging divisiveness &amp; I believe his appointment will only drive us further &amp; more dangerously apart. (3/4)|en|D|22|37
798630655143780353|20545793|Tue Nov 15 20:56:00 +0000 2016|However, the recent announcement that Steve Bannon will be kept on as chief strategist and senior counselor is deeply disturbing. (2/4)|en|D|14|29
798630404701888512|20545793|Tue Nov 15 20:55:00 +0000 2016|Like @POTUS and @HillaryClinton, I am rooting for unification and success in our country over these next four years. (1/4)|en|D|4|16
796461187378642944|20545793|Wed Nov 09 21:15:19 +0000 2016|Honored to speak with the young students at Molalla Middle School to pass down the importance of Veteran’s Day to o… https://t.co/VCoGOExkuw|en|D|0|10
794247634236149760|20545793|Thu Nov 03 18:39:27 +0000 2016|Great time speaking with South Salem High students today. Glad to talk to students so engaged in our democracy! https://t.co/rxFpktarTZ|en|D|0|4
793908669431816192|20545793|Wed Nov 02 20:12:31 +0000 2016|Thank you to the Center for Hope and Safety for providing women who have faced violence and abuse with necessary su… https://t.co/c0OXBdCGHm|en|D|0|5
793513331931881472|20545793|Tue Nov 01 18:01:35 +0000 2016|Looking forward to the opening of the @OurLegacyHealth Unity Center for Behavioral Health, Oregon’s first ER for me… https://t.co/5yDanOW9Tx|en|D|4|15
