id|user|created_at|text|lang|label|retweet_count|favorite_count
1434910948322648072|364415553|Mon Sep 06 16:06:44 +0000 2021|I hope that the Jewish community in Maryland, across America and around the world is able to safely celebrate the N… https://t.co/OVDkhfBdb4|en|D|3|19
1433860636077920257|364415553|Fri Sep 03 18:33:10 +0000 2021|I hope that you and your families have a restful #LaborDay weekend. In Congress, I will continue to fight for bette… https://t.co/BWJGdORqtB|en|D|14|57
1432810813975302146|364415553|Tue Aug 31 21:01:33 +0000 2021|Today, I joined @ChrisVanHollen and @SenatorCardin in announcing over $13 million in federal funding to help suppor… https://t.co/ht88RCTwFD|en|D|4|21
1432721061813145600|364415553|Tue Aug 31 15:04:54 +0000 2021|“We call on President Biden and his fellow elected Democrats to do more than merely give lip service to voting righ… https://t.co/mLPCFYAkbZ|en|D|4|10
1431005773367291905|364415553|Thu Aug 26 21:28:57 +0000 2021|Our hearts go out to the families of those who were killed and wounded today in the terrible bombing outside the Kabul airport.|en|D|7|27
1430580410073993221|364415553|Wed Aug 25 17:18:43 +0000 2021|GREAT NEWS: The House passed HR4, the John R. Lewis Voting Rights Advancement Act to #RestoreTheVote! With this bil… https://t.co/Sllx2S7sKm|en|D|6|24
1430555519031382016|364415553|Wed Aug 25 15:39:48 +0000 2021|"Happy 105th Birthday to the @NatlParkService!

To celebrate, entrance fees are waived at all National Parks across… https://t.co/nckowrlCX0"|en|D|3|11
1427648387877310477|364415553|Tue Aug 17 15:07:54 +0000 2021|Before it was gutted by SCOTUS, the Voting Rights Act kept the promise of our democracy alive by preventing states… https://t.co/nG3XUuIcgM|en|D|123|336
1427431748003147790|364415553|Tue Aug 17 00:47:03 +0000 2021|3/3 Above all, we salute our brave servicemembers for their unflagging defense of America’s interests around the globe.|en|D|1|10
1427430788350496768|364415553|Tue Aug 17 00:43:14 +0000 2021|2/3 In the coming days, Congress will need to be briefed on the intelligence that American officials had in hand le… https://t.co/lr7HxoAAql|en|D|2|9
1427430454836305921|364415553|Tue Aug 17 00:41:55 +0000 2021|1/3 At this moment, the main focus must be on the safe removal of U.S. personnel and the Afghan civilian allies who supported our mission.|en|D|3|25
1427304535375110146|364415553|Mon Aug 16 16:21:33 +0000 2021|Pleased to see President Biden’s announcement to permanently increase food assistance benefits. These additional re… https://t.co/GPewrPGufi|en|D|6|13
1427052987579568129|364415553|Sun Aug 15 23:42:00 +0000 2021|"We must keep up the fight for voting rights and democracy reform.
https://t.co/GeCR7taG22"|en|D|15|29
1426290812103561218|364415553|Fri Aug 13 21:13:23 +0000 2021|The wildfires in Greece continue to burn out of control. USAID must mobilize additional support to help extinguish… https://t.co/TzByJ6oZ5S|en|D|2|6
1426196660368072705|364415553|Fri Aug 13 14:59:15 +0000 2021|Until August 20, Maryland businesses can apply to the Shuttered Venue Operators Grant program, which provides billi… https://t.co/TCA4DStYEU|en|D|3|7
1425567218448969729|364415553|Wed Aug 11 21:18:05 +0000 2021|Today, the Maryland Congressional Delegation announced over $90 million in funding from the Federal Emergency Manag… https://t.co/lBC5ynvdqG|en|D|2|7
1425140032558481411|364415553|Tue Aug 10 17:00:36 +0000 2021|This week, the Baltimore Congressional Delegation called on the Attorney General to increase personnel and resource… https://t.co/dmvZA4OWSj|en|D|3|3
1424843921977487363|364415553|Mon Aug 09 21:23:57 +0000 2021|The wildfires in Greece are devastating. I am grateful to all who are responding to this crisis, including the U.S.… https://t.co/P2N46vBWMA|en|D|5|5
1423710482695872517|364415553|Fri Aug 06 18:20:04 +0000 2021|In 2013, the Supreme Court gutted the #VotingRightsAct – but it said Congress could enact new protections to ensure… https://t.co/f9Cp9W2hKb|en|D|10|13
1423676921930555395|364415553|Fri Aug 06 16:06:43 +0000 2021|To help us get to the other side of this pandemic, my colleagues and I are urging House leadership to provide fundi… https://t.co/G6cAMINYhs|en|D|3|12
1423403241983856650|364415553|Thu Aug 05 21:59:13 +0000 2021|Richard Trumka carried the voice of working people and the conviction that the power of organized labor can deliver… https://t.co/ezYyK37RK6|en|D|1|3
1423375889518170124|364415553|Thu Aug 05 20:10:31 +0000 2021|The Maryland Congressional Delegation announced more than $29.5 million in emergency funding to support Maryland’s… https://t.co/ZFd04iGvmO|en|D|2|9
1423321497473593350|364415553|Thu Aug 05 16:34:23 +0000 2021|Do you need health insurance? The American Rescue Plan significantly lowers the cost of plans offered through Maryl… https://t.co/RuXTNYPjaG|en|D|4|1
1423017577782157313|364415553|Wed Aug 04 20:26:43 +0000 2021|I was honored to participate in the National Night Out celebrations in Howard County and Montgomery County, part of… https://t.co/Km2c3BLw30|en|D|2|8
1422944943593725955|364415553|Wed Aug 04 15:38:06 +0000 2021|Happy Birthday, President @BarackObama! https://t.co/4rJZdY1jGZ|en|D|3|40
1422652997046349826|364415553|Tue Aug 03 20:18:00 +0000 2021|I am proud to stand with @CoriBush and urge the Biden Administration to extend the eviction moratorium, an essentia… https://t.co/xWaRo2jbE1|en|D|1|6
1421943652297883653|364415553|Sun Aug 01 21:19:19 +0000 2021|110 years ago today, Harriet Quimby became the first American woman to earn her pilot’s license. https://t.co/ej0UjBqZju|en|D|4|8
1421218401675005965|364415553|Fri Jul 30 21:17:26 +0000 2021|This week, I joined my colleagues in urging the DOJ to investigate the wrongful targeting of individuals of Asian d… https://t.co/rAjOIzvm5G|en|D|6|11
1420886669306339330|364415553|Thu Jul 29 23:19:15 +0000 2021|Today, I joined my colleagues in passing nine federal funding bills that will make historic investments in educatio… https://t.co/yjCZ8Vq4Zm|en|D|3|12
1420421746033938438|364415553|Wed Jul 28 16:31:49 +0000 2021|Do you need help paying rent and utilities? Federal rental assistance may be available. Search here to find a local… https://t.co/MQ55g7wBMg|en|D|5|7
1420415789061087239|364415553|Wed Jul 28 16:08:08 +0000 2021|This week, I’m joining my colleagues in passing federal spending bills that will create jobs, grow opportunity and… https://t.co/Q4JE9jDa6V|en|D|3|7
1418667783664066569|364415553|Fri Jul 23 20:22:11 +0000 2021|Today, I joined a bipartisan group of lawmakers in calling on Secretary of State Antony Blinken to improve the deli… https://t.co/jVXXpYkX9R|en|D|2|7
1418659693157920772|364415553|Fri Jul 23 19:50:02 +0000 2021|Today, I joined federal, state and local partners – along with community leaders and residents – to unveil… https://t.co/5SJFwNDD0C|en|D|1|10
1418321328113913858|364415553|Thu Jul 22 21:25:30 +0000 2021|During an @OversightDems Committee hearing yesterday, I urged my colleagues to think creatively about environmental… https://t.co/uxHzrmJWzc|en|D|1|4
1417932540032299012|364415553|Wed Jul 21 19:40:36 +0000 2021|This bipartisan effort will help reduce PFAS pollution and keep American families, service members and communities… https://t.co/aAeH6UFnLf|en|D|1|5
1417928725170167808|364415553|Wed Jul 21 19:25:26 +0000 2021|I urge the Biden Administration to use all means at its disposal to resist Turkey’s creeping partition of Cyprus an… https://t.co/DnbjCXXkHR|en|D|6|30
1417220197212033036|364415553|Mon Jul 19 20:30:00 +0000 2021|Sending warm wishes to Maryland’s Muslim community and to Muslims across the country during this year’s Eid Al-Adha… https://t.co/em3bIX0HDg|en|D|3|8
1417152400968896514|364415553|Mon Jul 19 16:00:36 +0000 2021|This new round of #AmericanRescuePlan funding will provide first responders in Maryland with the supplies and equip… https://t.co/S9xOaRLYLa|en|D|1|5
1415790827687878660|364415553|Thu Jul 15 21:50:12 +0000 2021|The Maryland Congressional Delegation just announced nearly $3 million in federal funding to strengthen maternal an… https://t.co/QiOC1mZXP4|en|D|2|2
1415749284734111747|364415553|Thu Jul 15 19:05:07 +0000 2021|Proud to join community leaders and residents in Howard County today to break ground on a brand-new solar energy pr… https://t.co/A8cVTKysgO|en|D|2|19
1415680117234290698|364415553|Thu Jul 15 14:30:16 +0000 2021|Starting TODAY, eligible families with children will receive monthly #ChildTaxCredit payments from the… https://t.co/JcER89cUfN|en|D|10|18
1415119901417746435|364415553|Wed Jul 14 01:24:10 +0000 2021|"Inaction is not an option. 

We must enact the #ForThePeopleAct: https://t.co/BUAPm73rBg. https://t.co/82JvSgJMgc"|en|D|11|39
1415096253894041601|364415553|Tue Jul 13 23:50:12 +0000 2021|Proud to announce the winner of the 2021 Congressional Art Competition from Maryland’s Third Congressional District… https://t.co/5QupJLdNf5|en|D|1|10
1415052219087527941|364415553|Tue Jul 13 20:55:14 +0000 2021|This new tranche of federal funding for Maryland’s Third Congressional District will help strengthen health care sy… https://t.co/A7MGFW3jGu|en|D|1|12
1414956547189481484|364415553|Tue Jul 13 14:35:04 +0000 2021|Good news for Marylanders. https://t.co/gLZt1LNH37|en|D|9|23
1414594261908066306|364415553|Mon Jul 12 14:35:28 +0000 2021|Beginning on Thursday, July 15, eligible families with children will begin receiving monthly #ChildTaxCredit paymen… https://t.co/45XgjtPh1b|en|D|3|2
1412408557631385607|364415553|Tue Jul 06 13:50:16 +0000 2021|This new infusion of #AmericanRescuePlan funding will help Maryland children and families access early intervention… https://t.co/vffZQlsaAf|en|D|2|3
1411708881923985415|364415553|Sun Jul 04 15:30:00 +0000 2021|Happy #July4th! 🎆 https://t.co/iUpX2BBsLo|en|D|1|10
1410667105905696769|364415553|Thu Jul 01 18:30:21 +0000 2021|We must enhance Clean Water Act protections for the Chesapeake Bay and for other waterways and wetlands across the… https://t.co/ABxQ6DSzKL|en|D|2|5
1410667059831357440|364415553|Thu Jul 01 18:30:10 +0000 2021|Today, @HouseDemocrats took another important step forward in our work to improve American infrastructure.… https://t.co/E5yxvOsnKI|en|D|1|7
1410618051075067906|364415553|Thu Jul 01 15:15:26 +0000 2021|"The Supreme Court just said that billionaires and big corporations can keep buying American elections.

Our only av… https://t.co/ky3OcG2YCZ"|en|D|41|61
1410609273759928327|364415553|Thu Jul 01 14:40:33 +0000 2021|"The ‘Big Lie’ invades the Supreme Court.
https://t.co/n1PGWwXVnq"|en|D|9|13
1410599086093262855|364415553|Thu Jul 01 14:00:04 +0000 2021|55 years ago today, Medicare became available to America’s seniors.|en|D|2|5
1410594144444026882|364415553|Thu Jul 01 13:40:26 +0000 2021|The Maryland Congressional Delegation just announced more than $2 million in federal funding to reimburse the Unive… https://t.co/Q1yaRnNMpS|en|D|1|6
1410589105411526656|364415553|Thu Jul 01 13:20:24 +0000 2021|The 26th Amendment was ratified 50 years ago today, expanding the franchise to Americans aged 18 and older. As we m… https://t.co/4hRxO9AdRf|en|D|8|13
1410263122959548418|364415553|Wed Jun 30 15:45:04 +0000 2021|Just joined my colleagues in the Maryland Congressional Delegation to announce nearly $8 million in federal… https://t.co/3w6nIYZfnd|en|D|3|3
1409990083873214472|364415553|Tue Jun 29 21:40:07 +0000 2021|Proud to secure $620,000 in federal funding for environmental restoration and protection efforts across Maryland’s… https://t.co/3DfVa3EL2Y|en|D|6|13
1409662931357167618|364415553|Tue Jun 29 00:00:07 +0000 2021|Today, on the third anniversary of the Capital Gazette shooting in Annapolis, we paid tribute to John McNamara, Ger… https://t.co/Y0pwvLIJYF|en|D|5|17
1409529764214419463|364415553|Mon Jun 28 15:10:58 +0000 2021|The Maryland Congressional Delegation just announced more than $98 million in federal funding through the… https://t.co/IvDzqmuzJQ|en|D|3|6
1409145881329287173|364415553|Sun Jun 27 13:45:33 +0000 2021|"📺 Tune in!

Will join @CapehartJ at 10:15 AM to discuss the path ahead for the #ForThePeopleAct. 

Inaction is not… https://t.co/4H5omOajgj"|en|D|3|8
1408541911795838991|364415553|Fri Jun 25 21:45:35 +0000 2021|As we mark the 8th anniversary of the Supreme Court's disastrous Shelby decision – which unleashed a torrent of Rep… https://t.co/DJZ8xraoHs|en|D|11|30
1408509312876613634|364415553|Fri Jun 25 19:36:03 +0000 2021|Beginning on July 15, most Maryland families with children will be eligible to receive a 2021 federal… https://t.co/7HAdVbCp36|en|D|3|4
1408166961767452679|364415553|Thu Jun 24 20:55:40 +0000 2021|We must improve health equity and invest in efforts to root out systemic racism in America. https://t.co/BFH5piU8MP|en|D|4|4
1407825830630334472|364415553|Wed Jun 23 22:20:08 +0000 2021|This new round of #AmericanRescuePlan funding makes a strong investment in our state’s early education system and i… https://t.co/TtabfDDmwJ|en|D|2|5
1407472236571811848|364415553|Tue Jun 22 22:55:05 +0000 2021|House and Senate Democrats remain united in our shared commitment to protect voting rights, strengthen government e… https://t.co/uy9Z43uUDW|en|D|6|24
1406616576804245513|364415553|Sun Jun 20 14:15:00 +0000 2021|To all the dads out there in Maryland and across the country – with us now or living always in our eternal memory –… https://t.co/HLF96Hdk8p|en|D|2|47
1406599016633282569|364415553|Sun Jun 20 13:05:13 +0000 2021|As we celebrate the 150th anniversary of the B&amp;P Tunnel’s initial groundbreaking, we must redouble our efforts to e… https://t.co/MfEaQZ6N59|en|D|2|4
1406318363240972292|364415553|Sat Jun 19 18:30:00 +0000 2021|On #Juneteenth – now an official federal holiday – we celebrate emancipation and recommit ourselves to justice, equ… https://t.co/CfU0n3Qmaf|en|D|1|4
1405606311522406400|364415553|Thu Jun 17 19:20:34 +0000 2021|Inaction is not an option. #ForThePeopleAct|en|D|2|9
1405549565210677250|364415553|Thu Jun 17 15:35:04 +0000 2021|"The ACA – here to stay.
 
An important victory for American families and millions of people with pre-existing condi… https://t.co/0GOx3qOApo"|en|D|2|7
1405525803299790857|364415553|Thu Jun 17 14:00:39 +0000 2021|The Maryland Congressional Delegation just announced more than $7 million in #AmericanRescuePlan funding to expand… https://t.co/fFQXcB13ws|en|D|3|8
1405323055610617857|364415553|Thu Jun 17 00:35:00 +0000 2021|Proud to join my colleagues in voting to make #Juneteenth a federal holiday. https://t.co/XaSLjPwgj4|en|D|3|13
1405163308748050443|364415553|Wed Jun 16 14:00:14 +0000 2021|I called on my colleagues in Congress to help shore up America’s health care system, provide more support to the na… https://t.co/nfwPOCBEqV|en|D|2|2
1404842469297209351|364415553|Tue Jun 15 16:45:20 +0000 2021|Thanks to the #AmericanRescuePlan, @IRSnews will start sending monthly #ChildTaxCredit payments to eligible familie… https://t.co/g0tO8C0d8u|en|D|1|9
1404838644343619594|364415553|Tue Jun 15 16:30:08 +0000 2021|Yesterday, Senator Ben Cardin and I held a conversation with small business owners from Maryland’s Third Congressio… https://t.co/8ZR23frRKF|en|D|2|4
1403457043919421444|364415553|Fri Jun 11 21:00:08 +0000 2021|In case you missed my telephone town hall yesterday evening, see below for a replay. https://t.co/0HSTG6wNwn|en|D|3|2
1402990203489247239|364415553|Thu Jun 10 14:05:05 +0000 2021|These important investments in Maryland’s roads, highways and public transportation networks will help connect more… https://t.co/hMgbIQtOyL|en|D|2|9
1402737831861231623|364415553|Wed Jun 09 21:22:15 +0000 2021|SCAM ALERT: Fraudsters claiming to be state employees are trying to take advantage of Marylanders. State officials… https://t.co/UhqTmg0Kf8|en|D|18|8
1402327091761324035|364415553|Tue Jun 08 18:10:07 +0000 2021|I just joined my colleagues to introduce the Women’s Health Protection Act (#WHPA), a bill to safeguard access to a… https://t.co/XGepPwTvRp|en|D|3|8
1402021455534112774|364415553|Mon Jun 07 21:55:37 +0000 2021|"📱📞 Please join my live telephone town hall on Thursday, June 10 at 5:30 PM.

To ask me a question or to just listen… https://t.co/FiEvI1Ik29"|en|D|6|6
1401638831263293443|364415553|Sun Jun 06 20:35:13 +0000 2021|To secure what Senator Manchin says he wants for our democracy, we need the #ForThePeopleAct and the John Lewis Vot… https://t.co/wcw1IpQCsW|en|D|224|896
1400807241926782978|364415553|Fri Jun 04 13:30:46 +0000 2021|"Gun violence is an American public health crisis.
 
On National Gun Violence Awareness Day, l call on my Senate col… https://t.co/AFOA6WxBNB"|en|D|19|61
1400471112669175814|364415553|Thu Jun 03 15:15:07 +0000 2021|.@RepGusBilirakis and I led a bipartisan effort calling on @USCIRF to work with global partners in a sustained and… https://t.co/B24Er5wKgl|en|D|7|10
1400466059149283340|364415553|Thu Jun 03 14:55:02 +0000 2021|Happy Birthday, @FLOTUS! https://t.co/vQzwTDpEdZ|en|D|1|11
1400229529982062593|364415553|Wed Jun 02 23:15:09 +0000 2021|.@GovLarryHogan’s abrupt and ill-informed decision to end federal financial assistance for Maryland families will m… https://t.co/vRvNCGiLhU|en|D|6|32
1399816847164334083|364415553|Tue Jun 01 19:55:18 +0000 2021|"Pleased to see the Biden administration’s commitment to the Chesapeake Bay. It’s a welcome change. 

Let’s make it… https://t.co/nEjnmlW7Sr"|en|D|4|18
1399780302617260041|364415553|Tue Jun 01 17:30:05 +0000 2021|The Maryland Congressional Delegation just announced nearly $28 million in federal #COVID19 relief funding to help… https://t.co/p3rgwd36Yh|en|D|1|2
1399741357707644936|364415553|Tue Jun 01 14:55:20 +0000 2021|"Happy #Pride! 🏳️‍🌈🏳️‍⚧️
 
Let’s take this opportunity to renew our fight for full equality. #LoveWins"|en|D|11|36
1399728732370358276|364415553|Tue Jun 01 14:05:10 +0000 2021|I recently joined dozens of my colleagues in calling on President Biden (@POTUS) to use the full force of the U.S.… https://t.co/oLD4bvlWwK|en|D|2|8
1399368820418957324|364415553|Mon May 31 14:15:00 +0000 2021|Today, we honor the soldiers, sailors, aviators and Marines who made the ultimate sacrifice in service of our natio… https://t.co/ltjcPvW8IA|en|D|2|16
1398381065203560450|364415553|Fri May 28 20:50:01 +0000 2021|It's now or never. We cannot miss this moment. #ForThePeopleAct https://t.co/K783TYbHvk|en|D|4|11
1398071746490679298|364415553|Fri May 28 00:20:53 +0000 2021|Help is here for Baltimore – and for Marylanders across our state. #AmericanRescuePlan https://t.co/En3tNLQ0tg|en|D|2|9
1398019942910464004|364415553|Thu May 27 20:55:03 +0000 2021|I am incredibly concerned about the recent rise in antisemitism across the United States. We must not allow this an… https://t.co/g4QqDR9ya0|en|D|4|6
1397967286015827975|364415553|Thu May 27 17:25:48 +0000 2021|This new funding from the #AmericanRescuePlan will help our public health workforce and higher education institutio… https://t.co/LxTHgFuyMZ|en|D|4|7
1397886710403457028|364415553|Thu May 27 12:05:37 +0000 2021|Yesterday, I joined Howard County officials, community leaders and volunteers in Laurel to distribute fresh and nut… https://t.co/XGIRr3ktix|en|D|2|9
1397677821057814531|364415553|Wed May 26 22:15:34 +0000 2021|"Yesterday, I held a Senior Forum on Medicare and Social Security. #SarbanesStandard 
https://t.co/YcK5Yj4ich"|en|D|2|3
1397631190392246275|364415553|Wed May 26 19:10:17 +0000 2021|This bipartisan effort will help lower home energy costs, reduce stormwater runoff and increase the tree canopy in… https://t.co/5OKochyqeJ|en|D|2|7
1397555627069685762|364415553|Wed May 26 14:10:01 +0000 2021|Beyond grateful for the women and men of the @USNationalGuard – especially those from Maryland – who defended the s… https://t.co/RmwkoD6aWE|en|D|1|4
1397539306915368973|364415553|Wed May 26 13:05:10 +0000 2021|Honored to join members of the NAACP Montgomery County Branch last night to discuss a wide range of important prior… https://t.co/ylvjOZ1dKu|en|D|2|3
1397524281224011781|364415553|Wed May 26 12:05:28 +0000 2021|Great to be with you! #ForThePeopleAct #HR1 #S1 https://t.co/11Yy1dYfaW|en|D|3|9
1397290183972868096|364415553|Tue May 25 20:35:14 +0000 2021|This bipartisan effort will help support the important work of @NOAA's Chesapeake Bay Office. https://t.co/uBlB22HnYI|en|D|3|7
1397270063959396359|364415553|Tue May 25 19:15:17 +0000 2021|We're live! Tune in! https://t.co/wOuIn8o5lO|en|D|1|1
1397179509342867458|364415553|Tue May 25 13:15:28 +0000 2021|Today marks the one-year anniversary of the brutal killing of George Floyd by police in Minnesota.|en|D|2|6
1396921594195369986|364415553|Mon May 24 20:10:36 +0000 2021|The Maryland Congressional Delegation just announced more than $36 million in #AmericanRescuePlan funding to suppor… https://t.co/fMGspbhFjc|en|D|2|4
1395820497477251074|364415553|Fri May 21 19:15:14 +0000 2021|Please join a Sarbanes Senior Forum on Medicare and Social Security (Virtual Edition) on Tuesday, May 25 from 2:30… https://t.co/tQrznhOrRJ|en|D|2|1
1395807885544890368|364415553|Fri May 21 18:25:07 +0000 2021|"Welcome news.
 
Additional steps must be taken to establish a lasting peace – one that improves the lives and livel… https://t.co/Jt8j33keB7"|en|D|2|7
1395737446999003142|364415553|Fri May 21 13:45:13 +0000 2021|"More than 60 percent of American adults have received their first #COVID19 vaccine. 
 
To find a vaccine near you:… https://t.co/vQQsszjBug"|en|D|2|9
1395415411215175690|364415553|Thu May 20 16:25:34 +0000 2021|Establishing an independent January 6 Commission is a patriotic undertaking that will provide a complete, detailed… https://t.co/RpH00kZJdK|en|D|6|16
1395091958360592391|364415553|Wed May 19 19:00:17 +0000 2021|Innovative medications are worthless if people can’t afford them. We must #LowerDrugPrices — now. https://t.co/Tsh3dr0Ry7|en|D|2|11
1395069315783675912|364415553|Wed May 19 17:30:18 +0000 2021|This latest round of #AmericanRescuePlan funding delivers urgently needed support to individuals in communities acr… https://t.co/ERMdUqwRgE|en|D|1|4
1394781194429116416|364415553|Tue May 18 22:25:25 +0000 2021|In Annapolis this morning, I joined @SecondGentleman Douglas Emhoff, @SenatorCardin, Mayor Gavin Buckley and severa… https://t.co/2J1vfq490k|en|D|5|18
1394757229883138048|364415553|Tue May 18 20:50:11 +0000 2021|Today’s vote sends a strong, bipartisan message about our commitment to combat the alarming rise in bigotry and vio… https://t.co/q0ovEmeJL9|en|D|3|5
1394719594456174595|364415553|Tue May 18 18:20:38 +0000 2021|Great to join @SecMartyWalsh in Baltimore today alongside members of the IUOE Local 37 to highlight our efforts to… https://t.co/YeQuSbxEOI|en|D|1|3
1394631454869622785|364415553|Tue May 18 12:30:24 +0000 2021|I join my colleagues in urging an immediate ceasefire and an end to the violence that is causing such terrible suff… https://t.co/0FXok2KDOV|en|D|6|15
1394447720002330627|364415553|Tue May 18 00:20:18 +0000 2021|For far too long, communities across the country – including many communities of color right here in Baltimore – ha… https://t.co/LUFfyaRipu|en|D|6|12
1394388523416014849|364415553|Mon May 17 20:25:05 +0000 2021|Enjoyed meeting virtually this afternoon with community leaders, representatives and volunteers from the… https://t.co/dtL6jK5inc|en|D|3|3
1393340359514759170|364415553|Fri May 14 23:00:03 +0000 2021|The Maryland Congressional Delegation just announced nearly $22.9 million in federal funding to modernize and renov… https://t.co/2vRlIR2uAa|en|D|2|7
1393229659714752517|364415553|Fri May 14 15:40:10 +0000 2021|Voter suppression and dark political money go hand in hand -- it's all part of a cynical, billionaire-funded effort… https://t.co/wmRlzarB9x|en|D|22|74
1393203231128494080|364415553|Fri May 14 13:55:09 +0000 2021|To protect the health and well-being of all Americans, we must clean up Superfund sites and build resiliency agains… https://t.co/CqZsTaIqtr|en|D|4|6
1392893732035436547|364415553|Thu May 13 17:25:19 +0000 2021|School-Based Health Centers (SBHCs) provide high-quality health care, mental health services, preventive care and s… https://t.co/JoL05bYWDF|en|D|2|2
1392891171786080256|364415553|Thu May 13 17:15:08 +0000 2021|Congressional Republicans must join Democrats in establishing an independent commission to examine the January 6 in… https://t.co/7cYSySzVBY|en|D|4|7
1392599392088121349|364415553|Wed May 12 21:55:42 +0000 2021|The escalation of violence in Jerusalem and the reckless and indiscriminate rocket attacks by Hamas – which have ta… https://t.co/OJBco4UvzB|en|D|30|153
1392244502090366977|364415553|Tue May 11 22:25:30 +0000 2021|The Maryland Congressional Delegation just announced more than $543.8 million in #AmericanRescuePlan funding for co… https://t.co/JyM8RajTGz|en|D|7|14
1392234564844724232|364415553|Tue May 11 21:46:01 +0000 2021|This past weekend, I joined fellow Marylanders in Towson to honor the memory of Howard Cooper, a 15-year-old lynchi… https://t.co/MBco3XIgpJ|en|D|3|22
1392164065770975234|364415553|Tue May 11 17:05:53 +0000 2021|MARYLAND HIGH SCHOOL STUDENTS: The deadline for the Third District Congressional Art Competition has been extended… https://t.co/xJ9EVV82vm|en|D|1|2
1392158944374689801|364415553|Tue May 11 16:45:32 +0000 2021|"The #ForThePeople Act (#HR1 #S1) will:

🗳️ Protect the right to vote
🛡️ Ensure the integrity of our elections
🕴️ Cr… https://t.co/IfojrFMXtM"|en|D|4|4
1391769019607359493|364415553|Mon May 10 14:56:06 +0000 2021|We must apply maximum pressure on the Erdogan regime to end its assault on religious freedom in Turkey. https://t.co/WxOx807H7r|en|D|2|7
