id|user|created_at|text|lang|label|retweet_count|favorite_count
1314556252094070785|364415553|Fri Oct 09 13:20:08 +0000 2020|"I just earned a 100 percent rating from @cleanh2oaction on its 2020 Congressional Scorecard.
 
I remain committed t… https://t.co/9CWBAeSqPC"|en|D|4|12
1314366215737933826|364415553|Fri Oct 09 00:45:00 +0000 2020|"#HR1 came about because we listened carefully to you – the American people. 

We hear your frustration with the sta… https://t.co/oVxcrbs7Fb"|en|D|7|22
1314265575972012033|364415553|Thu Oct 08 18:05:05 +0000 2020|Today, the Maryland Congressional Delegation announced $100,000 in federal funding for @marylandpubtv to develop pe… https://t.co/Z9iRa2hbVn|en|D|4|7
1314220518514581504|364415553|Thu Oct 08 15:06:03 +0000 2020|"Proud to earn a perfect score on the @HRC 2020 Scorecard.

I will always fight to make our country more just, fair… https://t.co/OkzTNFu3fg"|en|D|6|19
1314219227583336449|364415553|Thu Oct 08 15:00:55 +0000 2020|We must provide more resources to @IRSnews to help improve the delivery of tax credits, tax refunds and #COVID19 re… https://t.co/eO1hThPnTx|en|D|4|7
1314001461538365441|364415553|Thu Oct 08 00:35:36 +0000 2020|Lest we forget the Trump-Pence Administration’s malevolence and cruelty. https://t.co/ghLeTuJFo2|en|D|17|33
1313898131449290752|364415553|Wed Oct 07 17:45:00 +0000 2020|It’s time to fix our politics. It’s time to strengthen our democracy. It’s time to give Americans their power back.… https://t.co/mpMqwzYrZ1|en|D|5|9
1313569738161885184|364415553|Tue Oct 06 20:00:05 +0000 2020|The Baltimore Congressional Delegation just announced more than $8.3 million in federal funding for @JohnsHopkins t… https://t.co/1fDfzYtJJW|en|D|3|10
1313564788790890502|364415553|Tue Oct 06 19:40:25 +0000 2020|The President cares more about packing the courts than protecting Americans from #COVID19. https://t.co/8SKsHchrCc|en|D|16|15
1313497997540495360|364415553|Tue Oct 06 15:15:00 +0000 2020|#HR1 has been a long time coming. It was built on the foundation laid by heroes like @RepJohnLewis. It channels the… https://t.co/7zO7XpU0ks|en|D|44|85
1313116756844711943|364415553|Mon Oct 05 14:00:06 +0000 2020|🗳️ A friendly reminder about Maryland’s voter registration deadline on ***Tuesday, October 13.*** #SarbanesStandard https://t.co/cFBhTdNw7A|en|D|6|6
1312039666854526978|364415553|Fri Oct 02 14:40:07 +0000 2020|The success of solar installation programs in communities like Baltimore will help lower homeowners’ utility bills… https://t.co/BazPn2F3NB|en|D|7|10
1312034830641750016|364415553|Fri Oct 02 14:20:54 +0000 2020|People are sick and tired of Big Pharma's soaring drug prices. We're going to keep fighting to #LowerDrugCosts for… https://t.co/fklPyXOOeW|en|D|7|14
1311839718095675392|364415553|Fri Oct 02 01:25:36 +0000 2020|I just voted to pass a comprehensive bill that would provide immediate #COVID19 relief to American families, small… https://t.co/3P7B58sI2J|en|D|6|37
1311749074517921793|364415553|Thu Oct 01 19:25:25 +0000 2020|Today, the House took a tremendously important step forward to protect the long-term health of the Chesapeake Bay a… https://t.co/zRwRzujLVo|en|D|4|13
1311686055540781057|364415553|Thu Oct 01 15:15:00 +0000 2020|On #HispanicHeritageMonth, we come together to celebrate the history, culture and legacy of the Latinx community –… https://t.co/oveym4Hoz1|en|D|3|4
1311660970843033601|364415553|Thu Oct 01 13:35:19 +0000 2020|Big pharmaceutical companies are still a major culprit when it comes to price gouging. They must #LowerDrugCosts im… https://t.co/5W8UJV7CEA|en|D|4|6
1311475988224765952|364415553|Thu Oct 01 01:20:16 +0000 2020|The Trump Administration must end its politically motivated efforts to undermine America’s #COVID19 response, liste… https://t.co/XEGZ9fb3Ej|en|D|3|9
1311050649086369793|364415553|Tue Sep 29 21:10:07 +0000 2020|The Baltimore Congressional Delegation just announced more than $1.4 million in federal funding for @JohnsHopkins t… https://t.co/NFAcNs3Z63|en|D|7|16
1311048194013433857|364415553|Tue Sep 29 21:00:22 +0000 2020|Today, I led the U.S. House of Representatives in passing the School-Based Health Centers (SBHCs) Reauthorization A… https://t.co/V84gdKD0re|en|D|7|18
1310269335571755009|364415553|Sun Sep 27 17:25:27 +0000 2020|This moment of deep introspection and self-examination in the Jewish community comes at a critical time for Marylan… https://t.co/ZU3afINW6G|en|D|3|25
1309540715760943106|364415553|Fri Sep 25 17:10:11 +0000 2020|"More smoke and mirrors from President Trump.

As we speak, the Trump Administration, Congressional Republicans and… https://t.co/J2PLWZR5vT"|en|D|1|3
1309515563161579521|364415553|Fri Sep 25 15:30:14 +0000 2020|📨 MARYLANDERS: If you requested a mail ballot for the 2020 general election, it’s on the way! https://t.co/DQex75NFGO|en|D|7|27
1309504187424821250|364415553|Fri Sep 25 14:45:02 +0000 2020|"IMPORTANT CENSUS NEWS: We now have until Saturday, October 31 to complete the #2020Census.

If you haven’t already,… https://t.co/tgzk2OSDuS"|en|D|10|9
1309252547484450817|364415553|Thu Sep 24 22:05:06 +0000 2020|I just voted to pass the #CleanEconomyJobs and Innovation Act, an effort to boost our clean energy economy, create… https://t.co/2vWbeITUx2|en|D|2|10
1309208582609666049|364415553|Thu Sep 24 19:10:24 +0000 2020|Today, the Maryland Congressional Delegation announced $5.6 million in federal funding to upgrade MARC commuter tra… https://t.co/PItedaMIgZ|en|D|3|9
1309202225651122176|364415553|Thu Sep 24 18:45:09 +0000 2020|"‼️ There's only ***one week remaining*** to complete the #2020Census. ‼️
 
Please encourage your families, friends… https://t.co/4tVxEXg5M2"|en|D|4|3
1309190880490815490|364415553|Thu Sep 24 18:00:04 +0000 2020|The Baltimore Congressional Delegation just announced nearly $1 million in federal funding for @JohnsHopkins to exp… https://t.co/GOXRaSBCr9|en|D|1|4
1308935541635911680|364415553|Thu Sep 24 01:05:26 +0000 2020|Let’s call a spade a spade when it comes to Republican attacks on the Affordable Care Act. This has been a Republic… https://t.co/fargAdPF60|en|D|7|17
1308781947758415876|364415553|Wed Sep 23 14:55:06 +0000 2020|Proud to announce more than $240,000 in federal funding for the @baytrust to expand environmental education program… https://t.co/RI3P5X1mXB|en|D|2|3
1308450993554718720|364415553|Tue Sep 22 17:00:01 +0000 2020|The Maryland Congressional Delegation just announced $4 million in federal funding to provide reproductive health c… https://t.co/Js9Z0RppP0|en|D|3|6
1308443528205422594|364415553|Tue Sep 22 16:30:21 +0000 2020|"***MARYLANDERS***

📮 Where can you drop off completed mail ballots?

🗳️ Where can you vote early? 

🇺🇸 Where can yo… https://t.co/aFbrd9e3s0"|en|D|26|19
1308412003661287429|364415553|Tue Sep 22 14:25:05 +0000 2020|Pleased to announce $410,000 in federal funding to help Baltimore County firefighters purchase and install 30,000 s… https://t.co/RKLuCP4wYG|en|D|5|8
1308404507584401411|364415553|Tue Sep 22 13:55:18 +0000 2020|"Today is National Voter Registration Day!

Marylanders can register to vote by visiting: https://t.co/RJSr0Stukx.… https://t.co/8lKNOHH2zu"|en|D|6|8
1308051020845547523|364415553|Mon Sep 21 14:30:40 +0000 2020|"Proud to earn an A grade on the @ActForParks 2020 Congressional Scorecard.

I’ll always #ActForParks and… https://t.co/GE1cHFgP2N"|en|D|1|7
1308045854415167488|364415553|Mon Sep 21 14:10:08 +0000 2020|As we celebrate #NationalEstuariesWeek, let’s redouble our efforts to protect America’s waterways – including our n… https://t.co/7FTmLKO2Yz|en|D|1|5
1307386992695668741|364415553|Sat Sep 19 18:32:03 +0000 2020|We have lost a pillar of justice and equality. https://t.co/AhjTuidm9J|en|D|2|24
1307000272791769088|364415553|Fri Sep 18 16:55:22 +0000 2020|I hope that the Jewish community in Maryland, across America and around the world finds joyful and fulfilling ways… https://t.co/J3oIT797Tt|en|D|2|13
1306618163396775936|364415553|Thu Sep 17 15:37:00 +0000 2020|In every corner of the country, Americans have demanded that we clean up corruption in Washington, expand and prote… https://t.co/KBW09mw365|en|D|4|16
1306616466465320960|364415553|Thu Sep 17 15:30:16 +0000 2020|Yesterday, I joined more than 170 @HouseDemocrats to demand that the @DHSgov Inspector General open an immediate in… https://t.co/jkWc3SJMbX|en|D|20|64
1306262931726835712|364415553|Wed Sep 16 16:05:26 +0000 2020|Signing up for health insurance on @MarylandConnect can be more affordable than you think. https://t.co/AENMh5JxOB|en|D|4|5
1306255348341379073|364415553|Wed Sep 16 15:35:18 +0000 2020|IMPORTANT (PLEASE SHARE): Governor Hogan and @MD_Labor have announced that Marylanders who’ve been filing weekly un… https://t.co/1zHwf94fLl|en|D|5|3
1305876577721503744|364415553|Tue Sep 15 14:30:12 +0000 2020|The Maryland Congressional Delegation just announced $100,000 for the @MDSeaGrant program to address the impacts of… https://t.co/dBzvdVBwrK|en|D|1|13
1305646285630967810|364415553|Mon Sep 14 23:15:06 +0000 2020|Earlier today, I examined reports alleging that Postmaster General DeJoy engaged in an illegal campaign finance sch… https://t.co/mER3tTSP45|en|D|11|29
1305554524539686920|364415553|Mon Sep 14 17:10:29 +0000 2020|"Proud to co-sponsor the Ending Health Disparities During #COVID19 Act. 

This effort will play an important role in… https://t.co/2MBZNO0zkU"|en|D|3|3
1305544396176265218|364415553|Mon Sep 14 16:30:14 +0000 2020|"Roughly 12 million Americans are currently missing out on #CARESAct economic impact payments.

Most of the eligible… https://t.co/zXGHd723qO"|en|D|1|1
1305533039708196867|364415553|Mon Sep 14 15:45:06 +0000 2020|The Maryland Congressional Delegation just announced $1.5 million in federal funding to expand nanotechnology resea… https://t.co/cEfJQwAafX|en|D|2|9
1304506622933454849|364415553|Fri Sep 11 19:46:30 +0000 2020|The Baltimore Congressional Delegation just announced more than $12 million to help @JohnsHopkins expand research p… https://t.co/j3fPTQSS2R|en|D|2|8
1304471903051055104|364415553|Fri Sep 11 17:28:32 +0000 2020|The Baltimore Congressional Delegation proudly announced $10 million in federal funding to improve infrastructure a… https://t.co/HuW78UeQAo|en|D|5|6
1304443351144574977|364415553|Fri Sep 11 15:35:04 +0000 2020|We just secured more than $480,000 in federal funding for @MFRI_UMD to train thousands of firefighters across the s… https://t.co/aSyFYcuvXt|en|D|1|3
1304414399650816006|364415553|Fri Sep 11 13:40:02 +0000 2020|At an @OversightDems Committee hearing yesterday, I called on the Trump Administration to extend the response deadl… https://t.co/WyDIZOZHo7|en|D|3|8
1304408152188882945|364415553|Fri Sep 11 13:15:12 +0000 2020|Remembering the victims and their families. #NeverForget #911Anniversary https://t.co/L6I1qDHmNy|en|D|6|5
1304194390122954757|364415553|Thu Sep 10 23:05:48 +0000 2020|The Maryland Congressional Delegation just announced more than $20 million in emergency federal funding to help… https://t.co/poqxoMelCp|en|D|5|3
1304175368027475978|364415553|Thu Sep 10 21:50:12 +0000 2020|Yesterday, I led @EnergyCommerce Committee Members in passing the bipartisan School-Based Health Centers (SBHCs) Re… https://t.co/xePcamLaU2|en|D|2|6
1304164043591225346|364415553|Thu Sep 10 21:05:12 +0000 2020|The #COVID19 pandemic has altered many aspects of our day-to-day lives, including how to vote in the upcoming elect… https://t.co/n5cSgcmqHu|en|D|1|9
1303729892471779331|364415553|Wed Sep 09 16:20:03 +0000 2020|⬇️ By a leading *Republican* election lawyer. ⬇️ https://t.co/aC9uBv4UbK|en|D|5|7
1303727441563848704|364415553|Wed Sep 09 16:10:18 +0000 2020|Today, I joined my colleagues in pressing the Trump Administration to provide federal workers – including military… https://t.co/f4RTOAetPm|en|D|4|5
1303444291415666689|364415553|Tue Sep 08 21:25:10 +0000 2020|Just joined my colleagues in the Maryland Congressional Delegation to announce more than $2.6 million in federal fu… https://t.co/eyHMuAau8E|en|D|7|18
1303385147904008192|364415553|Tue Sep 08 17:30:09 +0000 2020|"#MoscowMitch (@senatemajldr)
 
❌ Anti-Voting Rights
❌ Anti-Election Security
✅ Pro-Corruption https://t.co/9yABPiW4yj"|en|D|6|11
1303314875083558915|364415553|Tue Sep 08 12:50:55 +0000 2020|If true, this conduct is illegal. https://t.co/CQ8vR8Q2ea|en|D|11|29
1302724505454784512|364415553|Sun Sep 06 21:45:00 +0000 2020|"I hope that you and your families (safely) enjoy the long #LaborDay weekend.

In Congress, I will continue fighting… https://t.co/Pk4oLjrqE8"|en|D|6|17
1301945684283842560|364415553|Fri Sep 04 18:10:14 +0000 2020|The Maryland Congressional Delegation just announced more than $50 million in federal funding to support our state'… https://t.co/rBPbHETLte|en|D|3|6
1301939366244253698|364415553|Fri Sep 04 17:45:08 +0000 2020|Proud to announce more than $3.9 million in federal funding to support projects throughout Maryland that will help… https://t.co/sDUPLGTFGN|en|D|3|19
1301603438778875904|364415553|Thu Sep 03 19:30:17 +0000 2020|Thousands of eligible Marylanders still haven't received unemployment insurance. @GovLarryHogan and Maryland Depart… https://t.co/vtXKjU0BCC|en|D|8|9
1301599609089921024|364415553|Thu Sep 03 19:15:04 +0000 2020|Sound familiar? https://t.co/cw1JrMnVa0|en|D|13|16
1301568186194759686|364415553|Thu Sep 03 17:10:12 +0000 2020|"Who's the only person in America openly encouraging people to commit voter fraud?

Yes, folks. It's the President o… https://t.co/ZhV4V8MeUf"|en|D|28|71
1301524248180252677|364415553|Thu Sep 03 14:15:36 +0000 2020|The decision to officially lift this outdated arms embargo will further cement the longstanding relationship betwee… https://t.co/QKnUWrD4JL|en|D|2|3
1301227262394667013|364415553|Wed Sep 02 18:35:29 +0000 2020|75 years ago today – the formal surrender of Imperial Japan aboard the USS Missouri. #WWII75 https://t.co/T1M4EPJ1zq|en|D|3|12
1300878824834560002|364415553|Tue Sep 01 19:30:55 +0000 2020|"How do we clean up the #CultureOfCorruption in Washington?

By passing #HR1 in the Senate and signing it into law. https://t.co/CoM5CkFctu"|en|D|220|496
1300849673910063105|364415553|Tue Sep 01 17:35:05 +0000 2020|"Today is #NationalPollWorkerRecruitmentDay.

We’re currently experiencing a national shortage of poll workers for t… https://t.co/zNszsPbJTY"|en|D|2|7
1300832080239132674|364415553|Tue Sep 01 16:25:10 +0000 2020|Proud to join the Baltimore Congressional Delegation in announcing more than $904,000 in federal funding for Baltim… https://t.co/qm47aVpk89|en|D|2|11
1300574231512653825|364415553|Mon Aug 31 23:20:34 +0000 2020|Today, I joined @OversightDems in issuing a subpoena to Postmaster General DeJoy and the @USPS Board of Governors,… https://t.co/dffUWNYXRu|en|D|23|68
1300543897924448257|364415553|Mon Aug 31 21:20:02 +0000 2020|The Baltimore Congressional Delegation today announced $1,650,000 in federal funding for science, technology, engin… https://t.co/s1kPZKBgow|en|D|1|4
1300138761859330049|364415553|Sun Aug 30 18:30:10 +0000 2020|What are they trying to hide? https://t.co/766P9PdTut|en|D|10|28
1299412787886723072|364415553|Fri Aug 28 18:25:25 +0000 2020|Today, the Maryland Congressional Delegation announced $3.4 million in #CARESAct funding to support Maryland small… https://t.co/6I3GDfGF2u|en|D|2|4
1299386313934856196|364415553|Fri Aug 28 16:40:13 +0000 2020|Under political pressure from the Trump Administration, the @uscensusbureau will end the #2020Census count four wee… https://t.co/HO7xsvCxnX|en|D|9|1
1299365035681165313|364415553|Fri Aug 28 15:15:40 +0000 2020|The 65th Anniversary of Emmett Till’s murder serves as an important reminder of our nation’s long and harrowing fig… https://t.co/ZHA8fpTtHG|en|D|2|7
1299356171317501952|364415553|Fri Aug 28 14:40:26 +0000 2020|I just co-sponsored a bill to prevent the Trump Administration, and future Administrations, from politicizing the… https://t.co/CzOGWV7FX4|en|D|58|187
1299062971822374919|364415553|Thu Aug 27 19:15:22 +0000 2020|Sounds, to me, like President Trump doesn’t want certain people to vote. 🤔 https://t.co/Lz3vYOXNC6|en|D|5|17
1298640093066883072|364415553|Wed Aug 26 15:15:00 +0000 2020|Two months ago today, we passed #DCStatehood to finally deliver full voting rights for the residents of Washington,… https://t.co/VXjblxiWqy|en|D|6|34
1298276553265225734|364415553|Tue Aug 25 15:10:25 +0000 2020|Proud to announce more than $1 million in federal funding for firefighters in Montgomery County and Prince George’s… https://t.co/L4y7CX0i4D|en|D|1|3
1298276524039319552|364415553|Tue Aug 25 15:10:18 +0000 2020|Proud to announce nearly $400,000 in federal funding for the Chestnut Ridge Volunteer Fire Company in Owings Mills. https://t.co/jDJjrG6IiB|en|D|1|3
1298267686938349573|364415553|Tue Aug 25 14:35:11 +0000 2020|Today, I joined Hellenic Caucus co-chairs @RepMaloney @RepGusBilirakis in co-sponsoring and introducing a resolutio… https://t.co/25x71YvmC4|en|D|14|49
1298266561807966213|364415553|Tue Aug 25 14:30:43 +0000 2020|I just requested an update from @SecPompeo on reports of Turkish territorial violations in the Exclusive Economic Z… https://t.co/0skHXtX4NS|en|D|78|218
1298023627435245569|364415553|Mon Aug 24 22:25:23 +0000 2020|Today, I pressed Postmaster General Louis DeJoy to commit, in writing, to treat all election mail as first-class ma… https://t.co/HC6Z1S9a0h|en|D|9|40
1297352989611622400|364415553|Sun Aug 23 02:00:31 +0000 2020|Today, we passed the Delivering for America Act (H.R. 8015), a bill to reverse the Trump Administration’s deliberat… https://t.co/gbUfxO2Cyh|en|D|11|37
1297159091123560448|364415553|Sat Aug 22 13:10:02 +0000 2020|Tune in! https://t.co/0C90ujx8h4|fr|D|24|60
1296916275843731459|364415553|Fri Aug 21 21:05:10 +0000 2020|The Baltimore Congressional Delegation just announced more than $840,000 in federal funding to improve the City of… https://t.co/0FgAUnEhft|en|D|3|9
1296477165089890304|364415553|Thu Aug 20 16:00:18 +0000 2020|➡️ Important public safety news for Marylanders: Beginning today, 911 emergency call centers across our state will… https://t.co/rGPGhlYyi9|en|D|8|8
1295784117636931591|364415553|Tue Aug 18 18:06:22 +0000 2020|We're outside of Postmaster General DeJoy's office right now, demanding that he end his attacks on the @USPS. https://t.co/2WVGP6tkGr|en|D|6|27
1295761215340326912|364415553|Tue Aug 18 16:35:22 +0000 2020|🚨 This bipartisan Senate Intelligence Committee report – which details Russia’s extensive efforts to interfere in o… https://t.co/eWjiUcc03T|en|D|8|19
1295747288535638016|364415553|Tue Aug 18 15:40:02 +0000 2020|Today, we celebrate the 100th Anniversary of the ratification of the #19thAmendment, which granted women the right… https://t.co/fAOlbl5NDl|en|D|4|8
1295495691830267904|364415553|Mon Aug 17 23:00:16 +0000 2020|"When you attack the @USPS, you are attacking American families – plain and simple. 

When you attack the Postal Ser… https://t.co/YM2KOKKTn4"|en|D|27|67
1295394795360333826|364415553|Mon Aug 17 16:19:21 +0000 2020|We're at the @USPS Baltimore Processing and Distribution Center to demand that the Trump Administration end its eff… https://t.co/uozJgZr9w2|en|D|1|13
1295371059089346561|364415553|Mon Aug 17 14:45:01 +0000 2020|The Maryland Congressional Delegation is urging the Trump Administration to extend school nutrition waivers for the… https://t.co/YzTkaWmEny|en|D|5|10
1295367284656152576|364415553|Mon Aug 17 14:30:02 +0000 2020|The #COVID19 outbreak and the country’s long overdue reckoning with institutional racism have dramatically laid bar… https://t.co/F6Qmp3I40t|en|D|12|34
1295106634767904768|364415553|Sun Aug 16 21:14:18 +0000 2020|"We will hold the Trump Administration accountable for undermining @USPS. 
 
Postmaster General DeJoy and USPS Board… https://t.co/qtWJyfS9a0"|en|D|30|93
1294389781879762952|364415553|Fri Aug 14 21:45:47 +0000 2020|85 years ago today, the Social Security Act was signed into law. I remain committed to protecting and enhancing… https://t.co/so6XMgu7eR|en|D|5|12
1294321659181228033|364415553|Fri Aug 14 17:15:05 +0000 2020|"TO: @realDonaldTrump 

FROM: The American People

SUBJECT: 🗣️ #DontMessWithUSPS 

https://t.co/5UcIiFVg9p"|en|D|48|80
1294291461920391168|364415553|Fri Aug 14 15:15:05 +0000 2020|"75 years ago today. #VJDay75
 
This #VJDay, let us pay tribute to the service and sacrifice of America’s veterans a… https://t.co/yX4knijE6H"|en|D|7|11
1294002161265922052|364415553|Thu Aug 13 20:05:31 +0000 2020|For months, I’ve been working closely with my colleagues in Congress to provide the USPS with the capabilities and… https://t.co/UktRLWUn3Z|en|D|11|21
1293927813779685377|364415553|Thu Aug 13 15:10:05 +0000 2020|"Trump couldn’t be clearer: He doesn’t care about Americans’ health or their right to vote.

During this public heal… https://t.co/kKoGHkExfM"|en|D|11|25
1293919065992564736|364415553|Thu Aug 13 14:35:19 +0000 2020|"President Trump and Postmaster General DeJoy must end their insidious, partisan efforts to undermine @USPS.

Americ… https://t.co/tLV9Q1tKCy"|en|D|59|118
1293913980977598464|364415553|Thu Aug 13 14:15:07 +0000 2020|I joined House Democrats in demanding that the Trump Administration fully explain its decision to abruptly curtail… https://t.co/v6tthk42Md|en|D|6|16
1293309279617929228|364415553|Tue Aug 11 22:12:15 +0000 2020|Today, I joined @SenatorCardin and Senator @ChrisVanHollen to announce more than $40,000 in new federal funding for… https://t.co/H9AFqor2WD|en|D|3|9
1293302489656287233|364415553|Tue Aug 11 21:45:16 +0000 2020|Proud to announce more than $1.2 million in federal funding to update Howard County’s bus fleet and bus stop announ… https://t.co/8TubrYyxFS|en|D|2|6
1293238383360323586|364415553|Tue Aug 11 17:30:32 +0000 2020|Voting by mail is safe and secure. https://t.co/R8CLNZ4oAS|en|D|9|19
1293218145608622081|364415553|Tue Aug 11 16:10:07 +0000 2020|📺 Tune in! https://t.co/Fay30Y447X|fr|D|1|0
1293216928492904456|364415553|Tue Aug 11 16:05:17 +0000 2020|The Maryland Congressional Delegation just announced in  $1,000,000 in federal funding for @BaltCoFire to purchase… https://t.co/mq7rfkLtz0|en|D|1|1
1292960235825639425|364415553|Mon Aug 10 23:05:16 +0000 2020|"The Trump Administration continues to line the pockets of special-interest polluters. #CultureOfCorruption
 
For th… https://t.co/IWZ9Fwx66O"|en|D|13|18
1292907344641372165|364415553|Mon Aug 10 19:35:06 +0000 2020|My thoughts are with the families of those impacted by this morning’s tragic gas explosion in Baltimore. Our commun… https://t.co/h1MLdpBGMy|en|D|3|3
1291848055680053248|364415553|Fri Aug 07 21:25:52 +0000 2020|Alongside a bipartisan group of colleagues, I urged newly appointed @USPS Postmaster General Louis DeJoy to end his… https://t.co/YALzPZ2Xjf|en|D|10|25
1291845455199051776|364415553|Fri Aug 07 21:15:32 +0000 2020|Marylanders without health insurance can #GetCovered during @MarylandConnect’s special #COVID19 open enrollment per… https://t.co/Odykr05mp7|en|D|18|17
1291719706097750016|364415553|Fri Aug 07 12:55:51 +0000 2020|MARYLANDERS: If you would like to vote by mail in the November election, please see below for a step-by-step guide. https://t.co/7UAoabM2Fh|en|D|53|74
1291465438870863872|364415553|Thu Aug 06 20:05:29 +0000 2020|We must commit additional resources to ensure a complete and accurate count in the #2020Census. https://t.co/TF9T2483s5|en|D|14|29
1291372300844052481|364415553|Thu Aug 06 13:55:23 +0000 2020|55 years ago today, the Voting Rights Act was signed into law. #VRA55 https://t.co/iUGsCScP0G|en|D|16|37
1290749861776809985|364415553|Tue Aug 04 20:42:02 +0000 2020|I joined @HouseDemocrats in expressing serious concern about recent actions by the Trump Administration to weaken f… https://t.co/kXxwbMV8HA|en|D|6|18
1290677650177040386|364415553|Tue Aug 04 15:55:06 +0000 2020|Happy Birthday, President @BarackObama. https://t.co/yTnlvx2gyX|en|D|8|36
1290670222119141376|364415553|Tue Aug 04 15:25:35 +0000 2020|This is a blatant attempt by President Trump to undermine the #2020Census, suppress participation and undercount co… https://t.co/0aiuiR6LuB|en|D|31|29
1290427780367343616|364415553|Mon Aug 03 23:22:12 +0000 2020|Democrats have a plan to fight corruption, modernize and secure our elections, ensure fair representation and end t… https://t.co/S9obuBMC8D|en|D|15|27
1290392662730776576|364415553|Mon Aug 03 21:02:39 +0000 2020|I joined @SenatorCardin and Senator @ChrisVanHollen in announcing more than $515,000 in federal funding for… https://t.co/XiL3itv4tU|en|D|3|7
1289235746319081474|364415553|Fri Jul 31 16:25:29 +0000 2020|This latest round of federal funding will invest millions of dollars in Maryland families, businesses, schools, hou… https://t.co/4sTNl2ddMM|en|D|3|5
1289182834050048001|364415553|Fri Jul 31 12:55:14 +0000 2020|Medicare and Medicaid – two of the most successful health care programs in American history – were established 55 y… https://t.co/X2jYu0lLoR|en|D|6|21
1288952508463714305|364415553|Thu Jul 30 21:40:00 +0000 2020|Extending warm wishes to Maryland’s Muslim community and to Muslims across the country during this year’s Eid Al-Ad… https://t.co/vX0ytpXlEK|en|D|1|7
1288923319689981952|364415553|Thu Jul 30 19:44:01 +0000 2020|This. Now. 👇 https://t.co/LSSolFchMs|en|D|1754|8476
1288918779741822976|364415553|Thu Jul 30 19:25:58 +0000 2020|"#StopCOVIDCorruption
https://t.co/44ozeEsOKY"|und|D|5|5
1288918687223894016|364415553|Thu Jul 30 19:25:36 +0000 2020|#StopCOVIDCorruption https://t.co/a4O4Wj1UCo|und|D|125|209
