id|user|created_at|text|lang|label|retweet_count|favorite_count
591299906314358786|20545793|Thu Apr 23 17:57:38 +0000 2015|Congratulations to @oregonstateuniv Professor Aaron Wolf on receiving the Heinz Award for Public Policy! http://t.co/5dQX8pZCkx|en|D|2|2
590959666370387968|20545793|Wed Apr 22 19:25:38 +0000 2015|The Oregon Coast is a special place-- one we need to protect for generations to come. #EarthDay http://t.co/Xo17u3k61Q|en|D|2|3
590941840104361985|20545793|Wed Apr 22 18:14:48 +0000 2015|It's #EarthDay! Celebrate by heading out to one of Oregon's beautiful parks → http://t.co/pA3p1ES4Sc http://t.co/9G5Oh7CdlM|en|D|1|1
590625203648077824|20545793|Tue Apr 21 21:16:36 +0000 2015|Introduced my constitutional amendment 2 return U.S. 2 one-person-one-vote system &amp; undo damage from Citizens United: http://t.co/2HClaONjON|en|D|4|2
590251071571894272|20545793|Mon Apr 20 20:29:56 +0000 2015|Congrats to @OSUBaseball's Andrew Moore on being named the PAC-12's Pitcher of the Week! http://t.co/nJmWINmwPO|en|D|0|1
589830394461061120|20545793|Sun Apr 19 16:38:19 +0000 2015|True bipartisanship yields real solutions, like the 'doc fix.' Read more in @thehill: http://t.co/8IF0NKDynN|en|D|1|1
588365594434609152|20545793|Wed Apr 15 15:37:43 +0000 2015|Proud to partner with the Oregon delegation to get the timber-aid provision over the finish line. #OregonFirst|en|D|1|1
588365095484448768|20545793|Wed Apr 15 15:35:44 +0000 2015|ICYMI: Senate passed legislation last night that includes provision for timber-dependent counties + will help Oregon: http://t.co/7eh9oasvEH|en|D|1|1
588047192889393152|20545793|Tue Apr 14 18:32:30 +0000 2015|"Median earnings for men in Oregon were $46,679
compared to just $37,555 for women—
an earnings ratio of just 80%. We need #EqualPayNow."|en|D|4|0
588045510264651777|20545793|Tue Apr 14 18:25:49 +0000 2015|As a father, I know my daughters deserve equal pay for equal work. We must pass the #PaycheckFairness Act so that all women get #EqualPayNow|en|D|6|2
588042245615521792|20545793|Tue Apr 14 18:12:51 +0000 2015|$435,049 – Amount of money lost throughout a woman’s working life-time as a result of the pay gap. #EqualPayDay|en|D|12|8
588041925049110528|20545793|Tue Apr 14 18:11:34 +0000 2015|2058 – The year women will finally see pay equity, based on the rate that the pay gap has been closing since 1960. #EqualPayDay|en|D|7|4
588041097009635330|20545793|Tue Apr 14 18:08:17 +0000 2015|#EqualPayDay symbolizes how long it takes women's earnings to catch up to what men made in the previous year -- 104 days is too long.|en|D|2|1
588004742057570305|20545793|Tue Apr 14 15:43:49 +0000 2015|Good luck to @RepBonamici in tonight's Capital Soccer Classic! Make Oregon proud!|en|D|0|1
587661449503223808|20545793|Mon Apr 13 16:59:42 +0000 2015|That's why I'm proud to be a @NoLabelsOrg Problem Solver- read about their latest efforts in @thedailybeast: http://t.co/yXpFoU1XcJ (2/2)|en|D|3|4
587660959226929152|20545793|Mon Apr 13 16:57:45 +0000 2015|"Couldn't agree more: ""some agreement between the parties is essential, or the alternative is more of the same: gridlock and stalemate"" (1/2)"|en|D|2|2
586217808452837377|20545793|Thu Apr 09 17:23:11 +0000 2015|Strong infrastructure is essential to keeping America competitive. We need to #StandUp4Transportation &amp; pass a long-term highway bill.|en|D|2|1
585898797810720770|20545793|Wed Apr 08 20:15:33 +0000 2015|Very proud to have served with @RepLoisCapps and am appreciative of her tireless service to the people of California.|en|D|0|1
585500728581611520|20545793|Tue Apr 07 17:53:46 +0000 2015|I'm a proud supporter of the #SmallBREWAct to help OR craft brewers create jobs and brew more delicious beer. #NationalBeerDay|en|D|21|42
585499384814686210|20545793|Tue Apr 07 17:48:26 +0000 2015|Oregon has reason to celebrate this #NationalBeerDay - @FullSailBrewing topped the list in @NYTimes nat'l taste test: http://t.co/KsrHimsbDA|en|D|8|7
585163392803069952|20545793|Mon Apr 06 19:33:19 +0000 2015|Happy #OpeningDay! I'm always excited for the start of baseball season &amp; the Annual Congressional Baseball Game. http://t.co/G4RHmENYVt|en|D|2|3
583721154550091777|20545793|Thu Apr 02 20:02:22 +0000 2015|Today on #AutismAwarenessDay, let's #LIUB for those affected by Autism and their families. http://t.co/GCZHwtJD6P|en|D|1|3
583691835152977923|20545793|Thu Apr 02 18:05:52 +0000 2015|RT if you agree that SCOTUS made the wrong decision in McCutcheon v. FEC and we need to give everyday people a bigger voice in politics.|en|D|6|3
583683151286906882|20545793|Thu Apr 02 17:31:22 +0000 2015|Our country deserves gov't by the people, not billionaire donors.1 year after McCutcheon, Congress must act on reform http://t.co/i5UQoQ7Qb0|en|D|3|0
583682402976935936|20545793|Thu Apr 02 17:28:23 +0000 2015|One year ago in McCutcheon v. FEC, SCOTUS gave big donors more influence in our elections. That's the wrong message to send to Americans.|en|D|0|0
582984735858769920|20545793|Tue Mar 31 19:16:07 +0000 2015|Kudos to Lake Oswego High's Robotics Team for advancing to the FIRST Tech Challenge World Championship in St. Louis. http://t.co/NiOxwGQhq0|en|D|1|2
582935509095284737|20545793|Tue Mar 31 16:00:30 +0000 2015|Congrats to the @trailblazers for securing a playoff berth last night! Looking forward to watching them move forward in the Western Conf.|en|D|1|5
582296918082002944|20545793|Sun Mar 29 21:42:58 +0000 2015|Catch my interview with @LauralPorter tonight on @KGWStraightTalk at 6:30 PM. http://t.co/ppFETc62wY|en|D|7|3
581820996434440192|20545793|Sat Mar 28 14:11:49 +0000 2015|About to be interviewed on @SXMPOTUS about the SGR bill Congress passed this week. Tune in on Sirius Channel 124! #NoLabelsRadio|en|D|1|1
581133404546199552|20545793|Thu Mar 26 16:39:35 +0000 2015|Big victory in the House today. Proud 2 vote 4 long-term solution 2 Medicare Dr. payments w/ SO MANY of my colleagues. #bipartisanshipworks|en|D|2|1
581109579477585920|20545793|Thu Mar 26 15:04:54 +0000 2015|Just spoke on the House floor about my strong support of the SGR bill we will vote on shortly. Catch it here: http://t.co/k6Y6OTSYIS|en|D|5|0
580801770886197250|20545793|Wed Mar 25 18:41:47 +0000 2015|Thanks @JonHuntsman &amp; @JoeLieberman 4 recognizing my @NoLabelsOrg effort 2 push 4 permanent Medicare payment reform. http://t.co/e854aPvZJp|en|D|4|2
580775393994608640|20545793|Wed Mar 25 16:56:58 +0000 2015|I urge our veterans to continue to reach out &amp; let me know if VA is meeting their needs as new rules go into place: http://t.co/T9shxLlKHk|en|D|1|1
580774556702531584|20545793|Wed Mar 25 16:53:39 +0000 2015|Folks in #OR5 know all too well that roads connecting isolated areas don't travel in straight line &amp; 40 mile rule was a problem for our vets|en|D|2|1
580772957322108928|20545793|Wed Mar 25 16:47:17 +0000 2015|I have heard from rural veterans around my district about the difficulties imposed by “as the crow flies” rules in traveling for VA care.|en|D|2|1
580772738387804160|20545793|Wed Mar 25 16:46:25 +0000 2015|I applaud the recently announced plan by the VA to ease restrictions on their interpretation of the 40-mile rule -- http://t.co/jgAPZaftME|en|D|2|2
580408605154873346|20545793|Tue Mar 24 16:39:29 +0000 2015|The long-term solution 2 the #DocFix will help bring stability 2 Medicare while allowing doctors 2 focus on quality rather quantity of care|en|D|5|6
580040331720310784|20545793|Mon Mar 23 16:16:06 +0000 2015|Great @Salem_Statesman article about the push for expanded career-based education in Salem. Read it here: http://t.co/xkTqWnjsxC|en|D|0|1
578971503754096640|20545793|Fri Mar 20 17:28:57 +0000 2015|Congratulations to the @SalemArtAssoc for being awarded a 10K grant from the Nat'l Endowment for the Arts!|en|D|1|2
578265086759927808|20545793|Wed Mar 18 18:41:54 +0000 2015|Met with students from my hometown of Canby today. Great discussion with a smart and engaged group of young people. http://t.co/F7N6x8Rphz|en|D|0|2
578247926583005184|20545793|Wed Mar 18 17:33:43 +0000 2015|Today is National Ag Day! As a former farmer, I know how important supporting U.S. agriculture &amp; our farmers is. http://t.co/e98ryk08vL|en|D|2|1
577948124595032064|20545793|Tue Mar 17 21:42:25 +0000 2015|I might be a little biased in my winner picks... #MarchMadness http://t.co/sjPgxlOdAP|en|D|2|1
577930380097019904|20545793|Tue Mar 17 20:31:54 +0000 2015|Devastated to learn about the loss of Nehalem Mayor Shirley Kalkhoven. She was a champion of OR coastal communities &amp; will be deeply missed.|en|D|2|3
577841306577330176|20545793|Tue Mar 17 14:37:57 +0000 2015|ICYMI: Joined @repjimcooper &amp; @RepRibble in pushing for redistricting reform to end gerrymandering. Read in @thehill: http://t.co/jhGNf4JKE7|en|D|1|2
577579211583565824|20545793|Mon Mar 16 21:16:29 +0000 2015|The 2015 Congressional Art Competition is upon us! Visit my website for more information on how to enter: http://t.co/kWBkxKToNN|en|D|0|1
577262158108614656|20545793|Mon Mar 16 00:16:38 +0000 2015|Congrats to the @Univ_Of_Oregon Ducks! Looking forward to them taking on Oklahoma State on Friday. #GoDucks #MarchMadness|en|D|3|3
575751231542554626|20545793|Wed Mar 11 20:12:45 +0000 2015|I had a wonderful tour at the HoneyComb Corporation today. Their work in agriculture and forestry mapping is fascinating!|en|D|0|2
575689201234108416|20545793|Wed Mar 11 16:06:16 +0000 2015|Thank you to the board members of the Clackamas County Business Alliance for allowing me to stop by this morning! http://t.co/MYT05PppP9|en|D|2|1
575444638103957504|20545793|Tue Mar 10 23:54:27 +0000 2015|I am hosting a Town Hall at the Salem Library from 6:00-7:00 pm tonight. I hope to see you there!|en|D|2|1
575426884718194689|20545793|Tue Mar 10 22:43:54 +0000 2015|I was saddened to hear of Dave Frohnmayer's passing, a true bipartisan leader. My thoughts are with Dave’s family during this difficult time|en|D|6|11
575378774222594050|20545793|Tue Mar 10 19:32:44 +0000 2015|Thank you to the Salem Radiology Consultants for allowing me to tour their practice today! http://t.co/Ecv61qJqvE|en|D|2|3
575341133699678209|20545793|Tue Mar 10 17:03:10 +0000 2015|I had a great discussion with local community leaders from Marion and Polk counties today! Thanks to all who joined! http://t.co/qaR6Wyuin2|en|D|0|1
574989181769924608|20545793|Mon Mar 09 17:44:38 +0000 2015|Thank you to all of the local community leaders in Clackamas County that attended the round-table discussion today! http://t.co/Nz1s7pzSTO|en|D|1|1
573967841235443712|20545793|Fri Mar 06 22:06:11 +0000 2015|I had a wonderful time touring the local bricklayers training center! Technical training is incredibly important for our future workforce.|en|D|3|1
573524217783803905|20545793|Thu Mar 05 16:43:23 +0000 2015|Thanks to the Pacific Northwest Waterways Association for inviting me to speak yesterday. Enjoyed your questions. http://t.co/9Yv2HfR0mt|en|D|0|2
573216851494371331|20545793|Wed Mar 04 20:22:01 +0000 2015|ICYMI: @RepRibble &amp; I wrote an op-ed on a bipartisan plan to modernize federal employee health plans &amp; save gov money http://t.co/mVGCpVMV6I|en|D|3|1
572871136460980224|20545793|Tue Mar 03 21:28:17 +0000 2015|About to speak on the House Floor w/ @BlueDogPress colleagues about bipartisan solutions to legislative gridlock. Watch live on @cspan|en|D|2|1
572806810266148864|20545793|Tue Mar 03 17:12:40 +0000 2015|Great to speak w/ veterinary students visiting DC w/ the @AVMAvets today! http://t.co/TBZ4amjztG|en|D|2|4
572551882654273536|20545793|Tue Mar 03 00:19:40 +0000 2015|Just voted for the Long-Term Care Veteran Choice Act, a bill that will increase veterans’ choices in healthcare.|en|D|0|2
572524195109867521|20545793|Mon Mar 02 22:29:39 +0000 2015|Today is National Read Across America Day-- take a little time and celebrate with your favorite book.|en|D|2|3
571430051734020097|20545793|Fri Feb 27 22:01:55 +0000 2015|Where the heck is the GOP's contingency plan for Health &amp; Human Services? http://t.co/tVPOK0pKKa|en|D|0|2
571046238927396865|20545793|Thu Feb 26 20:36:47 +0000 2015|Career &amp; technical education programs are vital to connecting students to a variety of careers, many w/ a high demand for skilled workers.|en|D|0|3
571045803286003712|20545793|Thu Feb 26 20:35:03 +0000 2015|My amendment w/ @RepJaredPolis to Elementary+Secondary Ed Act revives career &amp; technical ed by awarding competitive grants to local schools.|en|D|0|2
570655811510407171|20545793|Wed Feb 25 18:45:22 +0000 2015|I also urged @GinaEPA to finish work on a rule that’s currently hindering Oregon’s wood producing industry. Oregon’s waited far too long.|en|D|3|1
570655601698738176|20545793|Wed Feb 25 18:44:32 +0000 2015|Today at @HouseCommerce hearing, I pushed EPA Administrator Gina McCarthy to devote more attention to the Portland Harbor Superfund site.|en|D|1|1
570310368108675072|20545793|Tue Feb 24 19:52:42 +0000 2015|Funding the Dept. of Homeland Security is essential to maintaining our national security. I’m hopeful for a compromise before time runs out.|en|D|1|2
569944690071617538|20545793|Mon Feb 23 19:39:37 +0000 2015|ICYMI: I spoke about the need for immigration reform on Saturday in Salem. Read more in @ThePortlandTrib: http://t.co/aVOzUTymYm|en|D|3|1
569241850734751744|20545793|Sat Feb 21 21:06:47 +0000 2015|Thank you to @Causa for asking me to speak at your Immigration Action Day about my continued support for comprehensive immigration reform!|en|D|0|3
569217893553938432|20545793|Sat Feb 21 19:31:36 +0000 2015|I had a great time speaking with constituents at my Lake Oswego town hall this morning. Thanks to all who came out!|en|D|1|1
568829884337926144|20545793|Fri Feb 20 17:49:47 +0000 2015|Thank you to @OregonBizAssoc for inviting me to speak to your members yesterday on issues important to Oregon's economy!|en|D|1|4
568459280812281856|20545793|Thu Feb 19 17:17:08 +0000 2015|Thank you to the Oregon City Rotary Club for allowing me to speak with members yesterday! http://t.co/hlHRiKLZjO|en|D|0|1
567846119067230209|20545793|Wed Feb 18 00:40:39 +0000 2015|Lots of great questions were raised today at the town hall I co-hosted with Senator Merkley, thanks for the discussion Lincoln County!|en|D|1|1
563039731853062144|20545793|Wed Feb 04 18:21:47 +0000 2015|There's a time &amp; place for a debate on immigration reform, but funding for DHS is not the place. WATCH; http://t.co/Cg0tj5rwzK #or05 #orpol|en|D|0|1
562631216676229120|20545793|Tue Feb 03 15:18:29 +0000 2015|We could be working to balance the budget or tax reform, but the House is wasting another day trying to repeal #Obamacare. #OR05 #orpol|en|D|0|4
558719054832496642|20545793|Fri Jan 23 20:12:57 +0000 2015|I had a wonderful time supporting @PPCW at their annual luncheon today, while listening to Leslie Kantor speak! http://t.co/xGv0nw3001|en|D|2|1
558361587158118400|20545793|Thu Jan 22 20:32:30 +0000 2015|The Portland-Milwaukie light-rail is coming along. Proud to have played a role in this project. #or05 Via @Oregonian http://t.co/layMnYwCOj|en|D|2|3
557984406233952256|20545793|Wed Jan 21 19:33:43 +0000 2015|Finished my 1st @EnergyCommerce hearing today. Looking fwd to fighting for #or05 on this powerful committee. #orpol http://t.co/NHvHSYYbfs|en|D|1|4
557944595863334912|20545793|Wed Jan 21 16:55:32 +0000 2015|Spoke w/ @KOINNews this morning about the #SOTU &amp; my work w/ @NoLabelsOrg Problem Solvers.  Check it out here: http://t.co/ywKyP80V2t #OR05|en|D|3|2
554686003492184066|20545793|Mon Jan 12 17:07:03 +0000 2015|"Joined @RepJerryNadler &amp; 122 members to introduce ""Respect for Marriage Act,"" beginning the process to repeal DOMA. http://t.co/aE8OvquMnf"|en|D|2|4
552941330574626816|20545793|Wed Jan 07 21:34:21 +0000 2015|Among 1st bills passed in the House was a bill w/ @RepBonamici to update tsunami warning &amp; detection systems. http://t.co/aLPcLiDpZV|en|D|1|1
552507702925344771|20545793|Tue Jan 06 16:51:16 +0000 2015|Kicking off the 114th Congress very soon.  Looking forward to continuing to serve #OR05 in the House of Representatives.#orpol|en|D|1|3
529338817820786689|20545793|Mon Nov 03 18:26:23 +0000 2014|Thank you to the Wilsonville Wildcats in Mrs. Rott’s U.S. History class for allowing me to come and visit! http://t.co/VYfo9G35Gm|en|D|1|0
527902652588638208|20545793|Thu Oct 30 19:19:35 +0000 2014|I had a wonderful tour at the @PDXArtMuseum today. I always enjoy a chance to see the different exhibits they house! http://t.co/hgoVSI4xPL|en|D|4|4
527853924100108288|20545793|Thu Oct 30 16:05:57 +0000 2014|Thank you to the Westside Economic Alliance for allowing me to participate in their monthly breakfast forum today! http://t.co/SDUaWwDI2m|en|D|0|1
527157606268538880|20545793|Tue Oct 28 17:59:02 +0000 2014|I continue to fight to keep the Air Facility in Newport open with my colleagues and members of the Newport Community! http://t.co/c5cOiNlgBF|en|D|1|2
526770154500554752|20545793|Mon Oct 27 16:19:26 +0000 2014|I had a great time touring the new Tilikum Crossing Bridge in downtown Portland today! http://t.co/yOJlz4rxCI|en|D|1|1
525725542860222465|20545793|Fri Oct 24 19:08:31 +0000 2014|Y'day I witnessed first hand the work @OregonYouth does to reform juvenile offenders while visiting the MacLaren Youth Correctional Facility|en|D|0|1
525357600788213760|20545793|Thu Oct 23 18:46:27 +0000 2014|Thank you to the Waldo Middle School Mustangs and the McKay High School Royal Scots for asking me to stop by and speak with students!|en|D|1|1
523225424940527619|20545793|Fri Oct 17 21:33:57 +0000 2014|Thank you to my colleague @RepBecerra for joining me in Oregon for a day of discussions on immigration reform. http://t.co/UOixmdnwDX|en|D|6|3
522801810525143040|20545793|Thu Oct 16 17:30:39 +0000 2014|Thank you to @NWDefense for hosting a round-table today. I appreciated hearing from Oregon’s defense and security contractors.|en|D|0|1
522522083473907712|20545793|Wed Oct 15 22:59:07 +0000 2014|Today I attended a meeting to continue urging the @USCG to reverse its decision to close the helicopter rescue operations base in Newport|en|D|3|2
521753607675600896|20545793|Mon Oct 13 20:05:28 +0000 2014|Just finished a tour of Tillamook Bay Community College.  TBCC is a valuable resource for Oregon students!|en|D|1|1
521713811523661824|20545793|Mon Oct 13 17:27:20 +0000 2014|I had a great time touring the Port of Garibaldi's wharf revitalization project. Thx to port manager Michael Saindon for showing me around!|en|D|2|1
521008211118555136|20545793|Sat Oct 11 18:43:32 +0000 2014|Thank you to the Oregon Medical Association for inviting me to speak at their annual fall forum today http://t.co/uoT8EVlt7T|en|D|2|1
520318966502133760|20545793|Thu Oct 09 21:04:43 +0000 2014|A big thank you to the @MolallaChamber for inviting me to speak with members and provide a congressional update! http://t.co/ZOyvKw2Vd2|en|D|0|1
520271124815679488|20545793|Thu Oct 09 17:54:36 +0000 2014|I really enjoyed seeing the work Happy Trails Riding Center does to provide those with special needs a chance to ride http://t.co/ZReED5Gqk7|en|D|3|5
520238255695220736|20545793|Thu Oct 09 15:44:00 +0000 2014|I had the pleasure of sitting down with a group of veterans this morning to hear about concerns they have with the Dept. of Veterans Affairs|en|D|1|2
519995967534555136|20545793|Wed Oct 08 23:41:14 +0000 2014|Reduce, reuse, recycle is the name of the game here at @RecologyWZ. Thanks for the great tour today! http://t.co/fd9L0Y4HGf|en|D|4|4
519984410066964482|20545793|Wed Oct 08 22:55:18 +0000 2014|Thankfully, I had no trouble locating the @Garmin facility for my tour today. Thanks for showing me around! http://t.co/s8aSCXgVT0|en|D|0|4
519581707113340928|20545793|Tue Oct 07 20:15:07 +0000 2014|This pm I spoke with members of the Milwaukie Rotary Club. Thanks for inviting me to give a congressional update! http://t.co/Vui97NRQXw|en|D|0|2
519560678261415936|20545793|Tue Oct 07 18:51:33 +0000 2014|I was impressed by what I saw at the school based health center at Milwaukie High School, which provides comprehensive care to students.|en|D|0|1
519540870182621185|20545793|Tue Oct 07 17:32:50 +0000 2014|I had a wonderful time speaking with students in the constitutional law class at @WeAreLakeridge today! http://t.co/Gpee1iCDNB|en|D|8|11
514816971423379457|20545793|Wed Sep 24 16:41:45 +0000 2014|Thank you to @HVBA for hosting me at their monthly meeting today. I always appreciate meeting with local biz owners! http://t.co/oSQZYjNZec|en|D|1|1
508027321602039808|20545793|Fri Sep 05 23:02:06 +0000 2014|Thanks to @LandOLakesKtchn for the donation to the @OregonFoodBank! 40,000 lbs. of mac n' cheese will go a long way in feeding OR families!|en|D|1|7
508021994789830656|20545793|Fri Sep 05 22:40:56 +0000 2014|I was happy to welcome the opening of a new @Vaportland CBOC in Salem today. These centers provide medical care to veterans across Oregon.|en|D|0|3
507949459343675392|20545793|Fri Sep 05 17:52:43 +0000 2014|Today and every day, we honor the legacy of Tyrone Woods and the sacrifice he gave in serving our country. http://t.co/o4PLQxQdS0|en|D|0|2
506881017593225217|20545793|Tue Sep 02 19:07:06 +0000 2014|I had a great tour at @CascadeCoil today, seeing the different installations they create from woven wire fabric!|en|D|0|1
506870366908981248|20545793|Tue Sep 02 18:24:47 +0000 2014|Today I visited with doctors and staff at @ProvHealth to hear about the ways they work to keep Oregonians healthy! http://t.co/f2bBR7J9FR|en|D|0|4
502947666285051904|20545793|Fri Aug 22 22:37:22 +0000 2014|I had an amazing last stop for my #MadeinOregonTour at the Near Space Corporation. Their work is inspiring!|en|D|1|1
502915236362723328|20545793|Fri Aug 22 20:28:30 +0000 2014|I had a wonderful time visiting the employees of American Grounding Systems in Toledo as part of my #MadeinOregonTour today!|en|D|0|1
502876342619492352|20545793|Fri Aug 22 17:53:57 +0000 2014|Thanks to @fishpeoples for being part of my #MadeinOregonTour! I enjoyed touring their facility in Toledo!|en|D|0|1
502579221689286657|20545793|Thu Aug 21 22:13:18 +0000 2014|Today I spoke at the Oregon Coastal Economic Summit in Florence. It’s always a great way to connect with my constituents on the coast!|en|D|1|1
502553318884114432|20545793|Thu Aug 21 20:30:22 +0000 2014|Thanks to @MAKGrills for being part of my #MadeinOregonTour today! Is anyone else ready for a summer barbeque? #MakeitinAmerica|en|D|1|4
502148547064909824|20545793|Wed Aug 20 17:41:57 +0000 2014|Thank you to @GKMACHINEINC for being part of my #MadeinOregonTour today! It was great to see the agricultural equipment they develop!|en|D|1|1
502124809770524672|20545793|Wed Aug 20 16:07:38 +0000 2014|Thank you to our Oregon @UPS drivers with over 25 years of service without an accident! http://t.co/wENTnEdXuI|en|D|2|3
500414337711099904|20545793|Fri Aug 15 22:50:50 +0000 2014|Thank you to OIT and @WilsonvilleOR for sponsoring the High Tech Industry round table today. It was great to hear about the work they do!|en|D|1|3
500397350561796097|20545793|Fri Aug 15 21:43:19 +0000 2014|I had a great time touring @RockwellCollins as part of my #MadeinOregon tour. Their avionic equipment plays a large role in aviation today!|en|D|1|1
500061509587070976|20545793|Thu Aug 14 23:28:49 +0000 2014|I was honored to participate in the opening of the @VFW post in Lake Oswego today. Thank you for all the work you do on behalf of OR vets!|en|D|1|2
500005573543624704|20545793|Thu Aug 14 19:46:33 +0000 2014|Thanks to @Pacificfoods for being my #MadeinOregon stop today. It was great to tour their plant and see all the great foods they process!|en|D|2|4
499958448617172994|20545793|Thu Aug 14 16:39:17 +0000 2014|Thank you to @SEDCOR for hosting me at their monthly forum lunch yesterday. It's always a pleasure to check in with OR biz community leaders|en|D|0|0
499617788689154049|20545793|Wed Aug 13 18:05:37 +0000 2014|I was happy to host the @EximBankUS Global Access Forum as part of my #MadeinOregon tour. OR biz need the tools to access global markets|en|D|1|1
499283152150724609|20545793|Tue Aug 12 19:55:54 +0000 2014|I had a great time visiting with the owners and staff of BPM Physical Therapy in Salem today. I’m always thankful for the work PT’s do!|en|D|2|2
499228055639166976|20545793|Tue Aug 12 16:16:58 +0000 2014|For part 2 of my #MadeinOregonTour I visited GEM Equipment in Woodburn. They manufacture industrial fryers for restaurants #MadeInOregon|en|D|2|2
498923107659550721|20545793|Mon Aug 11 20:05:13 +0000 2014|I’m kicking off my #MadeinOregonTour with a visit to @StilwellBaker, an electronics manufacturing company in Lake Oswego! #MadeinOregon|en|D|2|2
498910232584945665|20545793|Mon Aug 11 19:14:03 +0000 2014|Thank you to @GDibeer for showing me the distribution side of the craft beer movement in Oregon today! http://t.co/c3S1pdgC2q|en|D|6|4
486623986890321920|20545793|Tue Jul 08 21:32:54 +0000 2014|I was proud to speak on the House floor before unanimous passage of my bill to help #veterinarians: https://t.co/ZzAYp2Xwta @AVMACAN @ASPCA|en|D|6|5
485054439363862528|20545793|Fri Jul 04 13:36:04 +0000 2014|Wishing all of you a happy and safe 4th of July! God Bless America! http://t.co/n4KWuwJ4Wd|en|D|0|1
481531991163432960|20545793|Tue Jun 24 20:19:07 +0000 2014|Had a great meeting with Director of #Oregon Department of Aviation about construction of the Aurora Airport tower http://t.co/n5VyyJWVqI|en|D|2|6
481122832110583808|20545793|Mon Jun 23 17:13:16 +0000 2014|A great article about a great American whose heroism in World War II was finally recognized. http://t.co/VZviBi2ujN http://t.co/J0svkwvblR|en|D|5|2
479372401705500672|20545793|Wed Jun 18 21:17:41 +0000 2014|I want to thank everyone for participating in last night's Tele-#TownHall. Your ideas help me better represent you! http://t.co/9pwpFBbNm7|en|D|2|2
