id|user|created_at|text|lang|label|retweet_count|favorite_count
1224842897805185025|24913074|Tue Feb 04 23:51:17 +0000 2020|Making the rounds at media row with my #SOTU guest Courtney Wild, a survivor &amp; silence breaker of the abuse inflicted on so many girls &amp; women by Jeffrey Epstein. We’re raising awareness about my bill named in her honor - the Courtney Wild Crime Victim’s Rights Reform Act of 2019 https://t.co/KPQzEPevkS|en|D|147|551
1224804122873954305|24913074|Tue Feb 04 21:17:13 +0000 2020|.⁦@HouseDemWomen⁩ are giving the #StateOfTheWomen address for @POTUS, whose words drip w/disdain. “Whack Job” “Nasty woman” “Low IQ” “You did a good job on her.” We demand equality, repro justice, to live free of violence and harassment. We are #WomenUnited! https://t.co/LNFHSVG7Cg|en|D|93|303
1224801048281223168|24913074|Tue Feb 04 21:05:00 +0000 2020|With @HouseDemWomen for the #StateOfTheWoman address NOW! On the centennial of the 19th amendment, we are letting the current occupant of the WH know that we are #WomenUnited demanding equality and respect. We will not go back on our hard-earned rights! https://t.co/FDGDn6rz6m|en|D|19|78
1224799792833777664|24913074|Tue Feb 04 21:00:00 +0000 2020|Proudly joining my @HouseDemWomen co-chairs for the #StateOfTheWoman address – we demand equal pay, affordable health care, paid family leave, repro freedom, an ERA &amp; safety from violence and discrimination NOW. https://t.co/FDGDn6rz6m|en|D|10|63
1224784690172678144|24913074|Tue Feb 04 20:00:00 +0000 2020|In ONE HOUR, I'll be joining my @HouseDemWomen co-chairs and members for our #StateOfTheWoman address. You can hear our plan for strengthening our union by advancing the rights of women &amp; all those disenfranchised or marginalized by this Administration at https://t.co/FDGDn6rz6m|en|D|23|100
1224689835799130113|24913074|Tue Feb 04 13:43:05 +0000 2020|How is rigging an election maybe wrong like stealing a cookie out of a cookie jar? Come on. Tiptoeing around a truly corrupt act (bribery) followed by a coverup is contemptible.  https://t.co/Z4pMdL44ot|en|D|101|361
1224440671680880645|24913074|Mon Feb 03 21:12:59 +0000 2020|Proud to bring Esptein silence breaker and survivor Courtney Wild to #SOTU2020. Together, we are taking a stand and fighting for the bipartisan Courtney Wild Crime Victims’ Rights Reform Act so that victims’ rights are more than just empty words! https://t.co/c6CeIEacHV|en|D|79|354
1224388485534142465|24913074|Mon Feb 03 17:45:37 +0000 2020|Thursday at 1 pm: @HouseDemWomen hearing on Honoring #MeToo Silence Breakers with Action: Ensuring Safe &amp; Dignified Workplaces for All w/ Drew Dixon, featured in the @OnTheRecordDoc that premiered at #SUNDANCE2020, Kimberly Lawson @fightfor15, @BurrowsCA @lizgiorgi @GillianAtLaw!|en|D|16|46
1224061127224635393|24913074|Sun Feb 02 20:04:49 +0000 2020|This Bay Area native is rooting for our home team, the San Francisco @49ers today! They are on an unstoppable golden streak thanks to an amazing team and coaching staff, including the first woman to coach at the #SuperBowl in @NFL history, Katie Sowers! Let's go #Niners!|en|D|18|137
1224025076103831555|24913074|Sun Feb 02 17:41:34 +0000 2020|“It’s a dispiriting moment for an American system that in many ways was founded on the insight that, because humankind is frail &amp; fallen &amp; fallible, no one branch of government can have too much power.” — Jon Meacham|en|D|111|509
1223397500188491776|24913074|Sat Feb 01 00:07:48 +0000 2020|This is a failure of courage, conviction, and character. It may serve Senate Republicans’ needs now, but at what catastrophic cost as history looks back and when voters head to the polls this year. #thisisnotnormal  https://t.co/BfqyM9YKVO|en|D|102|471
1223276508795588610|24913074|Fri Jan 31 16:07:01 +0000 2020|.@HouseDemWomen just sent a letter to @POTUS condemning his denigration of women. It's as if he relishes the opportunity to publicly humiliate any woman who fights back, speaks up or takes up space. Mr. President, you should not be the biggest bully on the playground! https://t.co/HJVmOt2dci|en|D|812|1913
1223007588318662657|24913074|Thu Jan 30 22:18:26 +0000 2020|“I think people are just now beginning to understand what the ramifications of that might be -- that it's not just one witness, it could entail months of delay while privilege claims are being litigated in the federal courts,” - Sen John Cornyn|en|D|38|195
1222969498166353920|24913074|Thu Jan 30 19:47:04 +0000 2020|Are Republicans so terrified of Trump that they’re going to fall into lockstep, or goosestep, w/someone who thinks he can do whatever he wants because he says it’s in the public interest? Have they given up all semblance of a free republic for the people? #thisisnotnormal|en|D|574|2790
1222966640045973506|24913074|Thu Jan 30 19:35:43 +0000 2020|For all those generals who say we have zero tolerance, explain to me why 122 sexual assaults occurred at our premier military academies last year? I have worked on this issue for 9 years and listened to their excuses. It’s time for heads to roll. https://t.co/TuZZxVAOCa|en|D|174|464
1222564369017593857|24913074|Wed Jan 29 16:57:14 +0000 2020|I wonder if Bolton knows anything incriminating about the President? https://t.co/kbWwF2bAdz|en|D|109|562
1222373018808324096|24913074|Wed Jan 29 04:16:52 +0000 2020|That’s 50 people who have suffered serious, debilitating injuries to protect our country &amp; who @POTUS  has belittled &amp; denigrated. I hope my colleagues on the House Armed Serices Committee will help educate Trump.  https://t.co/tAWKHiE7iQ|en|D|144|440
1222358022816702469|24913074|Wed Jan 29 03:17:17 +0000 2020|"Don't be fooled by @POTUS's ""Ruse of the Century."" Green-lighting any form of annexation, without even talking to Palestinian leadership, is a plan for conflict and oppression, not peace. We cannot be gas-lit by two aspiring autocrats using a photo op as a political distraction."|en|D|245|834
1222257828670377984|24913074|Tue Jan 28 20:39:09 +0000 2020|Words of the 45th President of the United States: “You did a good job on her,” “Grab ‘em by the pussy,” “I can do whatever I want.” Every woman in America should be outraged by these malevolent, and misogynistic men attacking a professional for doing her job! #thisisnotnormal|en|D|933|3053
1222194866916032513|24913074|Tue Jan 28 16:28:58 +0000 2020|"Stunned by the cavalier and grossly ignorant comments by @POTUS on the traumatic brain injuries our servicemembers suffered in Iraq bombing. ""Headaches?"" ""Small stuff?"" That’s rich coming from a draft dodger. How are those bone spurs? https://t.co/pRALNOj1GO"|en|D|133|440
1222001794286542848|24913074|Tue Jan 28 03:41:46 +0000 2020|"When Trump Administration officials are allowed to bar press simply for doing their job we are are no longer living up to our legacy as the world’s greatest Democracy, we are entering the chilling realm of an autocracy. #thisisnotnormal
https://t.co/XvMjVtPqPP"|en|D|327|890
1221947314392223745|24913074|Tue Jan 28 00:05:17 +0000 2020|"88 lbs of eyeglasses
15K lbs of human hair
12K pots &amp; pans
44K pairs of shoes
When soldiers liberated Auschwitz #OTD in 1945 they found warehouses filled w/people’s belongings, most of them already murdered by the Nazis in the Holocaust’s largest death camp.
#WeRemember"|en|D|179|468
1221897557560954882|24913074|Mon Jan 27 20:47:34 +0000 2020|Virginia's historic vote to become the 38th state to ratify the Equal Rights Amdt is official! @RepTomReed @RepMaloney @RepBrianFitz &amp; I are calling on the Archivist to certify now. We reject the DOJ's biased opinion &amp; we're ready for the House floor vote in 2 weeks for #ERANow!|en|D|62|206
1221897038725558273|24913074|Mon Jan 27 20:45:30 +0000 2020|"Congrats @billieeilish ! First woman ever to win best new artist, best song, best album, and best record of the year at the Grammys. Your talent and refusal to be anyone but yourself is inspiring to us all.
 
https://t.co/I8jdkg2AGK"|en|D|23|182
1221827880134619140|24913074|Mon Jan 27 16:10:41 +0000 2020|If Bolton doesn’t testify in the Senate this trial is rigged and nothing more than corrupt political theater by Moscow Mitch and the Republican controlled Senate.|en|D|661|2783
1221219561522913280|24913074|Sat Jan 25 23:53:27 +0000 2020|Looks like Secretary Pompeo has taken on the bullying techniques of his boss. His tactics towards a respected journalist are completely unbecoming for a public official. And then instead of apologizing, he accuses her of lying. This is not normal. https://t.co/eih8ful8Am|en|D|370|1190
1221214999781134336|24913074|Sat Jan 25 23:35:19 +0000 2020|Truly what kind of a country are we when a US Senator takes cheap shots at a Purple Heart recipient who has dedicated his life to protect us. Shame on you Sen. Blackburn. You’re better than that. https://t.co/DnISSkrKFP|en|D|10103|41780
1220942802378342400|24913074|Sat Jan 25 05:33:42 +0000 2020|Heard of the Teflon chemical? Discussing the film “Dark Waters” with @EWG’s Ken Cook and @BreastCancerAction’s Karuna Jaggar. https://t.co/MaoG449Uj0|en|D|13|48
1220857592563621888|24913074|Fri Jan 24 23:55:07 +0000 2020|.@POTUS, the “headaches” caused by missiles won’t just go away b/c you want to pretend your horrible Iran policy is cost-free. Iraq &amp; Afghanistan vets know the staggering long-term price of TBI &amp; debilitating CTE, signature wounds of those conflicts. Actions have consequences.|en|D|139|513
1220825942668578818|24913074|Fri Jan 24 21:49:21 +0000 2020|This is a hostage situation. Trump is willing to hold up ALL of CA’s federal health care funds - BILLIONS of $$ - unless California undermines abortion coverage. The cruelty has no bounds. Women and the most vulnerable are the casualties. We won’t stand for it!  #CaliforniaStrong https://t.co/UsdIcihvaJ|en|D|605|1378
1220769601438539776|24913074|Fri Jan 24 18:05:28 +0000 2020|Joining @ewg at 5:30 pm PT TODAY for a screening &amp; panel discussion of Dark Waters at Century Redwood City Downtown. This film features attorney Rob Bilott’s fight to hold PFAS manufacturers accountable for endangering public health. Looking forward to a great conversation!|en|D|9|45
1220743869542862848|24913074|Fri Jan 24 16:23:13 +0000 2020|What's it going to take?!? https://t.co/4Gzd5HYSYP via @ABC|en|D|210|530
1220733412362932231|24913074|Fri Jan 24 15:41:40 +0000 2020|Trump is not the only person on trial, the Senate is. Does the truth matter to them? Are they more afraid of Trump than executing their constitutional duty? Nothing less than our democracy is at stake. https://t.co/Xbvwt0OM6e|en|D|212|702
1220559310012334081|24913074|Fri Jan 24 04:09:51 +0000 2020|Very encouraged that hundreds of my constituents, including many students, turned out for my impeachment town hall with Professor Meyler because they care about our democracy. https://t.co/aUX8eYydZc|en|D|53|396
1220520976552607745|24913074|Fri Jan 24 01:37:31 +0000 2020|"My town hall on impeachment with Stanford Law Professor Bernadette Meyler will start at 7 p.m. tonight at South San Francisco High School. If you can't make it in person, you can watch the live stream here:
https://t.co/5KZICFmjPC"|en|D|51|179
1220402727358029837|24913074|Thu Jan 23 17:47:38 +0000 2020|Senate Republican’s perverse argument of “letting the voters decide” rather than impeaching makes them complicit in Trump’s efforts to subvert our democracy and hurts the very voters they say they are protecting! #thisisnotnormal|en|D|285|1066
1220398960566788097|24913074|Thu Jan 23 17:32:40 +0000 2020|Today is the 3rd anniversary of Trump's #GlobalGagRule forcing health care providers abroad to choose between providing comprehensive care &amp; keeping their funding. This Administration's assault on women's health care &amp; bodies literally has no bounds! The result is devastating⬇️|en|D|48|119
1220385518082494464|24913074|Thu Jan 23 16:39:15 +0000 2020|POTUS — I don’t lie...until I move my lips.|en|D|154|895
1220299476260225024|24913074|Thu Jan 23 10:57:21 +0000 2020|Thugs and organized crime cartels say things like “they are going to go through some things.” It’s not normal for the President of the United States to say something like that. Amb Yovanovitch deserves our undying respect for enduring threats from an ungrateful President.|en|D|329|1376
1220076657064710144|24913074|Wed Jan 22 20:11:57 +0000 2020|If @POTUS can defy congressional subpoenas we should shut the doors of the Capitol and return our salaries to the Treasury because Congress would be impotent and we would have a full blown autocrat in power who can do ANYTHING with impunity. I guess we should just “get over it.”|en|D|487|1487
1220053699164344320|24913074|Wed Jan 22 18:40:44 +0000 2020|Adam Schiff continues to masterfully and methodically lay out the damning case against the President. He is doing his job, it is time for the Senate to do theirs.|en|D|616|2923
1220027929704435712|24913074|Wed Jan 22 16:58:20 +0000 2020|On the 47th anniversary of #RoevWade, the fight for abortion rights is as critical as ever. SCOTUS will hear a case on Louisiana's draconian admitting privileges that would leave only 1 clinic &amp; 1 doctor to provide all abortions. Dozens of other states have equally backward laws. https://t.co/2uYwj9YVRk|en|D|80|222
1219719338674081792|24913074|Tue Jan 21 20:32:06 +0000 2020|Sekulow just told bald-faced lies to the Chief Justice of the Supreme Court. Republicans WERE allowed in the SCIF. I was there. Many Rs CHOSE not to show up.|en|D|11692|37289
1219672981875630087|24913074|Tue Jan 21 17:27:53 +0000 2020|Bolton's evidence will come out, it’s just a question of when. History AND voters will remember what the Senate does or doesn't do in the coming days. #SenateImpeachmentTrial|en|D|397|1566
1219272756237406208|24913074|Mon Jan 20 14:57:32 +0000 2020|This #MLKDay2020, let us look to Dr. King’s example as a beacon of light who inspires us to be our best despite those seeking to divide us. As Dr. King wisely intoned, “Darkness cannot drive out darkness; only light can do that. Hate cannot drive out hate; only love can do that.” https://t.co/m8eaSdA5k9|en|D|55|214
1218725088721276931|24913074|Sun Jan 19 02:41:18 +0000 2020|I get it. Members of Congress can receive classified briefings NOT in the foreign affairs committee BUT by attending fundraisers for POTUS. #thisisnotnormal|en|D|2465|8133
1218609347737112576|24913074|Sat Jan 18 19:01:23 +0000 2020|America-we are in deep trouble. When the US Archivist is willing to tamper with documents to avoid the ire of President Trump, we have crossed a red line in protecting the Constitution. What happens to the First Amendment if @POTUS doesn’t like what you are saying?|en|D|12847|41297
1218246966087507973|24913074|Fri Jan 17 19:01:25 +0000 2020|During a tantrum @POTUS called Mattis, w/40+ years of service, &amp; the joint chiefs “dopes and babies.” That's a 5x draft dodger who cried about bone spurs demeaning the service of men who have devoted their lives to protecting our country. #thisisnotnormal https://t.co/df9sPvpall|en|D|1986|5265
1218232391980011525|24913074|Fri Jan 17 18:03:30 +0000 2020|Bravo to my colleague and friend Ayanna Pressley for her bravery in speaking her truth. @RepPressley, by baring your soul, you inspire countless others and allow them to feel represented. TY! https://t.co/VcveJCYhhV|en|D|39|305
1218168103743447040|24913074|Fri Jan 17 13:48:03 +0000 2020|Remember this timeline: Parnas badmouths Ambassador Yovanovitch to Trump-April 2018; Trump “fires” her; Early May-Ukraine stops cooperating with Mueller investigation; around May 23, 2018-Parnas gives Trump PAC $325,000. Isn’t this a lot of quid pro quo? #ThisIsNotNormal|en|D|260|728
1217937684527812609|24913074|Thu Jan 16 22:32:26 +0000 2020|.@POTUS says he doesn’t know Parnas. That he takes thousands of pictures with people. But thousands of people don’t donate $325,000 to his super PAC using foreign money, which is illegal btw.|en|D|344|1129
1217839626024517634|24913074|Thu Jan 16 16:02:47 +0000 2020|This is the kind of evidence - first hand evidence - that Republicans have been begging for to prove that @POTUS broke the law when he withheld aid to Ukraine and that the President and Mitch McConnell wants to #CoverUp  https://t.co/4aApyUDOq7|en|D|298|742
1217804526465490949|24913074|Thu Jan 16 13:43:19 +0000 2020|Parnas becomes this year’s Michael Cohen-doing Trump’s dirty work and going to jail for it. Who wants to be next? https://t.co/mf52SBXkQp|en|D|327|1306
1217577736971210754|24913074|Wed Jan 15 22:42:08 +0000 2020|Today, the House voted to send the articles of impeachment to the US Senate. We implore our colleagues to undertake a real trial, not ⁦@senatemajldr⁩ Mitch McConnell’s sham #CoverUp https://t.co/008Mk21t6I|en|D|171|696
1217555258718720004|24913074|Wed Jan 15 21:12:49 +0000 2020|Today, we stand on the shoulders of giants who have fought for an Equal Rights Amendment affirming women’s equality &amp; prohibiting discrimination on the basis of sex. Virginia’s vote to be the 38th state to ratify proves there's no exp date on equality! https://t.co/mVNhAurW4x|en|D|111|422
1217265144633446405|24913074|Wed Jan 15 02:00:00 +0000 2020|Angry &amp; saddened to hear that a Sikh center in CA was defaced w/swastikas &amp; white power symbols. We must hold those responsible for this hateful act accountable, speak out against the political figures emboldening hatred, &amp; rid our country of the evil that is white supremacy.|en|D|66|330
1217252564401643520|24913074|Wed Jan 15 01:10:01 +0000 2020|"WNBA players will finally earn 6 figure salaries – a historic 1st for the league &amp; major win in the pay equity fight! Players will also have improved maternity &amp; childcare benefits + equitable revenue sharing. It’s time for @USWNT &amp; all other leagues to even the ""paying"" field!"|en|D|18|117
1217232808223084545|24913074|Tue Jan 14 23:51:31 +0000 2020|In 2020 are we really still ruminating about whether a woman can become President? Speaker Pelosi has proven to be the most effective speaker ever, more women serve in Congress and chair committees. Or look around the world —New Zealand, Australia, Finland, Namibia, Germany, Etc.|en|D|118|559
1217113885439819779|24913074|Tue Jan 14 15:58:57 +0000 2020|In yet another example of POTUS acting in violation of the Constitution he is raiding $7.2 BILLION slated for counter-narcotics &amp; military construction. @POTUS's ongoing defiance of Congress &amp; flagrant waste of taxpayer $ for his vanity wall project is why I voted no on DHS bill!|en|D|320|823
1216785139939926017|24913074|Mon Jan 13 18:12:38 +0000 2020|How is it okay for @POTUS to engage in name calling and tweeting fake images against the third highest ranking person in our government? I know, he does it to world leaders and 16-year-old Nobel winners. It is NOT okay and NOT normal. We have to demand he puts a stop to it!|en|D|11304|47786
1216773335520108546|24913074|Mon Jan 13 17:25:44 +0000 2020|.@EsperDOD admits that @POTUS's claims on Fox News on Friday that four embassies were being targeted as justification for Soleimani's assassination has no basis in fact and was based on his “belief.” When you can’t trust the Commander in Chief, then what???|en|D|208|782
1215737898160525313|24913074|Fri Jan 10 20:51:16 +0000 2020|Poor @POTUS, another fragile man struggling to come to grips with a strong, successful woman. It’s so hard when we push back! https://t.co/lAkvD8zICi https://t.co/NJX63Nmsd6|en|D|110|469
1215691680336224259|24913074|Fri Jan 10 17:47:37 +0000 2020|"The House just voted to regulate dangerous chemicals w/the PFAS Action Act, a strong 1st step in tackling ""forever” contaminants that go beyond our water &amp; air. We can’t stop until cookware, food wrappers, personal care products &amp; more are free of PFAS like Teflon &amp; safe to use!"|en|D|81|374
1215438335163891713|24913074|Fri Jan 10 01:00:55 +0000 2020|I just voted with 223 of my congressional colleagues to stop @POTUS's push for war that jeopardizes US interests in the Middle East, puts our troops and embassy staff at grave risk, and has galvanized hatred in the region against America. https://t.co/IoXHPjy44L|en|D|68|483
1215357325281824769|24913074|Thu Jan 09 19:39:01 +0000 2020|Why would Mnuchin refuse to disclose Secret Service expenses until after #2020Elections? Can you say wasteful spending and rampant corruption? @POTUS can. Remember, GAO found he blew $13M+ on the first 4 trips to Mar-a-Lago, costing $100M and counting. https://t.co/rqPFmXbXBo|en|D|461|847
1215015131257692165|24913074|Wed Jan 08 20:59:15 +0000 2020|This moment of calm is Congress's opportunity to stop a war. Let's not forget that @POTUS is the aggressor. He left the nuke deal, he killed Soleimani, and he can't be unchecked in the next crisis. We can prevent a war our people don't want. We must start w/ repeal of ‘02 AUMF.|en|D|237|926
1215002110879830018|24913074|Wed Jan 08 20:07:31 +0000 2020|.@TheJusticeDept issued a legal opinion that the Equal Rights Amendment push is dead. News flash @POTUS: There is no expiration date on equality. Women demand equality under the law &amp; an America free from sex discrimination - we'll stop at nothing less! https://t.co/A2SNIPUEt4|en|D|271|654
1214779906434854914|24913074|Wed Jan 08 05:24:33 +0000 2020|I pray for our soldiers and their families who are in harm’s way. We must de-escalate this confrontation.|en|D|56|505
1214700676061761540|24913074|Wed Jan 08 00:09:43 +0000 2020|Can you be any more clueless? Weinstein's attorney is comparing rape and workplace harassment to holding the door open for a woman. Really? I guess this is how you defend the indefensible. https://t.co/RqlDPlSO3R|en|D|56|355
1214674732362145792|24913074|Tue Jan 07 22:26:38 +0000 2020|Puerto Rico's largest earthquake in over a century &amp; resulting aftershocks have destroyed over 300k homes, caused a widespread blackout &amp; killed at least one person. Our fellow Americans desperately need help that the US govt has a responsibility to provide. #PrayForPuertoRico|en|D|372|915
1214355507680428032|24913074|Tue Jan 07 01:18:09 +0000 2020|First time EVER Eurasia Group lists US domestic policies as greatest risk to the world citing inevitable doubt in the outcome of our election &amp; US gov doing little to prevent outside interference. Our once envied institutions are teetering on the brink. https://t.co/HaDf9jmeS2|en|D|98|154
1214253023859335168|24913074|Mon Jan 06 18:30:55 +0000 2020|Thank you to @PattyArquette for using your #GoldenGlobes platform to highlight how @POTUS's rash actions have put us on the brink of war with Iran. There is no better time to remind us why targeting cultural sites is against the law of war. Congress must act to prevent conflict.|en|D|54|314
1214031448585277441|24913074|Mon Jan 06 03:50:27 +0000 2020|Iran TV announces it will no longer comply with 2015 no nukes deal at the same time Pompeo is on TV saying maximum pressure campaign is working. It would be laughable if not so delusional.|en|D|292|1095
1213257425807007744|24913074|Sat Jan 04 00:34:46 +0000 2020|Yesterday's airstrikes will not be judged by their deserving targets, but by @POTUS' overall strategy in the region, or lack thereof, the ability to prevent further escalation &amp; protect U.S. personnel, assets &amp; our allies in the days and weeks ahead. https://t.co/aoUgY5kVEg|en|D|80|274
1213160988075118593|24913074|Fri Jan 03 18:11:33 +0000 2020|Dear @POTUS: Get off the golf course and get into the Situation Room. This is a crisis that requires your full attention and full team. I assure you our adversaries are not deliberating on the fairway.|en|D|1344|5006
1211809096455708672|24913074|Tue Dec 31 00:39:37 +0000 2019|Lindsay Graham in 1999: “You don’t even have to be convicted of a crime to lose your job [as president] in this constitutional republic if this body determines that your conduct as a public official is clearly out of bounds in your role.”|en|D|295|993
1211808999898636288|24913074|Tue Dec 31 00:39:14 +0000 2019|"Hypocrisy knows no bounds. Mitch McConnell in 1999: ""There have been 15 impeachments in the history of the country. Two of them were cut short by resignations. In the other 13 impeachments, there were witnesses…It's not unusual to have a witnesses.”"|en|D|155|455
1211760019785449472|24913074|Mon Dec 30 21:24:36 +0000 2019|The recent rise in anti-Semitic violence is chilling &amp; demands swift action. The latest attack in a Rabbi’s home during a Hanukkah celebration underscores the evil nature of these crimes. The hatred &amp; intolerance must be shut down. I’m calling on @POTUS to be presidential and act|en|D|54|283
1211495415297691649|24913074|Mon Dec 30 03:53:10 +0000 2019|No greater orator has walked the House floor than John Lewis. No greater gentleman, no greater statesman ... John Lewis has never shrunk from a righteous fight &amp; will combat this one like any other—w/determination &amp; courage. He is a friend &amp; an inspiration, a confidante &amp; leader.|en|D|446|3068
1209937827770724353|24913074|Wed Dec 25 20:43:52 +0000 2019|As we celebrate the birth of Christ &amp; Hanukkah let us recommit to tolerance, justice &amp;, above all, kindness. Let us remember the child in the manger is replicated around the world today in Syria, Jordan, Lebanon, our border w/Mexico &amp; so many places. May we show our compassion. https://t.co/J3ggcr0qTH|en|D|45|436
1209181107326840838|24913074|Mon Dec 23 18:36:56 +0000 2019|Who talks like this? “I know windmills very much”. He’s losing it ... and his hair. https://t.co/wWKeai0qOR|en|D|341|1612
