id|user|created_at|text|lang|label|retweet_count|favorite_count
1507423769333227530|364415553|Fri Mar 25 18:26:47 +0000 2022|Wishing you a happy #MarylandDay! https://t.co/1yoS44vEyK|en|D|1|4
1507399034465624076|364415553|Fri Mar 25 16:48:30 +0000 2022|On this Greek Independence Day, we celebrate the history and heritage that unites Greeks around the world. As a Gre… https://t.co/GcIigKNqYs|en|D|3|15
1506716661608587277|364415553|Wed Mar 23 19:37:00 +0000 2022|Thank you, @mdvagov employees, for your service to veterans every day, especially during #COVID19. Your efforts do… https://t.co/pgc2PqnCs0|en|D|1|4
1506698542269833218|364415553|Wed Mar 23 18:25:00 +0000 2022|Congress and @POTUS have taken important steps to #StandWithUkraine and defend global democracy. In my… https://t.co/dQRKyNCBxC|en|D|3|9
1506680351539838976|364415553|Wed Mar 23 17:12:43 +0000 2022|Aviation noise causes annoyance, stress and sleep disruption and negatively affects the quality of life for many Ma… https://t.co/y3JeXcClul|en|D|1|3
1506665864468344842|364415553|Wed Mar 23 16:15:09 +0000 2022|12 years ago, the Affordable Care Act was signed into law to expand access to quality, affordable health care and p… https://t.co/GNuSwDeSX4|en|D|7|14
1506024098505261059|364415553|Mon Mar 21 21:45:00 +0000 2022|Many Ukrainians have fled their country in the face of Putin’s cruel attacks. I will continue to work with @POTUS a… https://t.co/EjnONzUNCm|en|D|1|13
1505997054761484289|364415553|Mon Mar 21 19:57:32 +0000 2022|Glad to see @POTUS sign this bill into law, @MHAonline! I was proud to support its passage in the House to bolster… https://t.co/yyPWBEi2W0|en|D|3|8
1504875449821933572|364415553|Fri Mar 18 17:40:41 +0000 2022|Rising prices are putting a strain on families, especially those who were already tightening budgets or just gettin… https://t.co/qXYuh63zcQ|en|D|2|5
1504856994813030404|364415553|Fri Mar 18 16:27:21 +0000 2022|Discrimination against Black Americans because of their natural hair is far too common in schools and workplaces. T… https://t.co/Q1eXDklP0W|en|D|6|15
1504853405080113158|364415553|Fri Mar 18 16:13:05 +0000 2022|Yesterday, I voted to pass legislation to revoke permanent normal trade relations with Russia and Belarus, which wi… https://t.co/AZtk18e1iT|en|D|8|24
1504594667815550982|364415553|Thu Mar 17 23:04:57 +0000 2022|Recent threats of violence have made it clear that more is needed to ensure HBCUs in Maryland and across the countr… https://t.co/RQ0X2iOb5n|en|D|2|2
1504584788660862976|364415553|Thu Mar 17 22:25:42 +0000 2022|During today’s @EnergyCommerce hearing, I highlighted that investing in early career researchers and cultivating di… https://t.co/cIjtEO2psU|en|D|1|1
1504218102460043268|364415553|Wed Mar 16 22:08:37 +0000 2022|Marylanders know the effects of climate change all too well. We must act quickly to confront the climate crisis, bu… https://t.co/7Tt6OGDFzJ|en|D|2|9
1504193435133165571|364415553|Wed Mar 16 20:30:36 +0000 2022|This morning, @ZelenksyyUa called on the United States to do more to protect freedom, democracy and the lives of in… https://t.co/a5dfDDizgf|en|D|2|9
1503816114182230017|364415553|Tue Mar 15 19:31:15 +0000 2022|Workplace disparities for women were exacerbated by #COVID19. Women lost their jobs, saw their hours cut or left th… https://t.co/WcHcY3X7W5|en|D|1|2
1503815979536687108|364415553|Tue Mar 15 19:30:43 +0000 2022|The gender pay gap leaves women – especially women of color – with fewer resources to provide for themselves and th… https://t.co/5X1ABD1jLS|en|D|2|5
1503764203613663239|364415553|Tue Mar 15 16:04:59 +0000 2022|The #AmericanRescuePlan jumpstarted our public health and economic recovery from #COVID19. One year later, its targ… https://t.co/cYENB5ccAi|en|D|3|5
1503472490491830272|364415553|Mon Mar 14 20:45:49 +0000 2022|This #AmeriCorpsWeek, thank you to @AmeriCorps members and @AmeriCorpsSr volunteers in Maryland for your dedication… https://t.co/OytSpKDv2H|en|D|3|8
1502304369789779978|364415553|Fri Mar 11 15:24:07 +0000 2022|I am pleased that the FY22 federal funding package upholds our commitments at home and abroad. It rises to the chal… https://t.co/OMUdGWzsZQ|en|D|1|3
1501991553027514375|364415553|Thu Mar 10 18:41:06 +0000 2022|The School Breakfast Program ensures that all students start each day with the necessary nutrition to learn and gro… https://t.co/oGcOs2ldVO|en|D|7|33
1501606748058099712|364415553|Wed Mar 09 17:12:01 +0000 2022|.@USPS owns and operates one of the world’s largest civilian vehicle fleets. I joined @GerryConnolly and 67 of our… https://t.co/rQWdsUkdZ3|en|D|12|35
1501558674648563715|364415553|Wed Mar 09 14:01:00 +0000 2022|Have you placed your second order for free, at-home COVID-19 rapid tests? Households are now eligible for two separ… https://t.co/I9BwMS8yuv|en|D|8|9
1501346935164313612|364415553|Tue Mar 08 23:59:37 +0000 2022|Expanding public transportation and upholding our #ActOnClimate commitments are two of my priorities – and I’m plea… https://t.co/AMv19FcB2q|en|D|2|4
1501337153212723204|364415553|Tue Mar 08 23:20:45 +0000 2022|Maintaining our infrastructure should be a given, but 273 bridges in Maryland are in poor condition. Yesterday’s ev… https://t.co/Xzwhq7Pji1|en|D|3|10
1501326833702346756|364415553|Tue Mar 08 22:39:45 +0000 2022|On this #InternationalWomensDay, we celebrate the leadership and accomplishments of women around the world, includi… https://t.co/T2FTA0aqId|en|D|1|7
1501324826807611395|364415553|Tue Mar 08 22:31:46 +0000 2022|Americans across the political spectrum are ready to step up and show solidarity with Ukraine. As I told… https://t.co/XHIsFmWY1z|en|D|1|7
1501295440003690503|364415553|Tue Mar 08 20:35:00 +0000 2022|Last month, HBCUs in Maryland and across the country faced a series of despicable bomb threats. Today, I’m voting f… https://t.co/U1ejlYZBfp|en|D|1|13
1501288579376504834|364415553|Tue Mar 08 20:07:44 +0000 2022|.@POTUS made the right decision to ban Russian oil and gas imports today. We must use every tool available to isola… https://t.co/9lJOZzfeWU|en|D|4|18
1501284763663011840|364415553|Tue Mar 08 19:52:34 +0000 2022|I joined @MasonMornings to talk about government funding, assistance for Ukraine and @POTUS’ ban on Russian oil and… https://t.co/JCMDRg3sf6|en|D|0|0
1500919210850979847|364415553|Mon Mar 07 19:40:00 +0000 2022|I joined the @SEEC #NatureAndOceans Task Force, introduced today to prioritize natural climate solutions. We must h… https://t.co/APue35YOjx|en|D|1|1
1500907264571494404|364415553|Mon Mar 07 18:52:32 +0000 2022|As we recognize 57 years since Bloody Sunday, we remember Congressman John Lewis and those who bravely marched acro… https://t.co/3iax52YBRv|en|D|3|17
1500890327560986624|364415553|Mon Mar 07 17:45:13 +0000 2022|The Infrastructure Investment and Jobs Act will create safer bridges, support a strong economy and make daily life… https://t.co/zOQQ4UAqBK|en|D|2|4
1499391646798016516|364415553|Thu Mar 03 14:30:00 +0000 2022|We owe it to toxic-exposed veterans to provide the care and benefits they've earned. Today, I am voting for the Hon… https://t.co/eAMB95AtzC|en|D|29|88
1499100980880699394|364415553|Wed Mar 02 19:15:00 +0000 2022|I’m pleased to receive a 100% score from @LCVoters today for my votes to #ActOnClimate, protect our clean air and w… https://t.co/XhCMFiWtoq|en|D|1|3
1499085846858936322|364415553|Wed Mar 02 18:14:52 +0000 2022|I joined @wbalradio to discuss last evening’s #SOTU. @POTUS highlighted our strong recovery from #COVID19, recogniz… https://t.co/CaFFoP6TkD|en|D|2|10
1499081733781831680|364415553|Wed Mar 02 17:58:31 +0000 2022|.@EnergyCommerce’s #SubOversight is hearing from health care workers about the frontlines of #COVID19. I’ll be aski… https://t.co/etlTVPWSgC|en|D|1|1
1498856600274182151|364415553|Wed Mar 02 03:03:55 +0000 2022|Nationwide, the fight to protect voting rights continues. We cannot wait to safeguard our democracy. #SOTU https://t.co/ho2uul3Opb|en|D|1|10
1498853954125455367|364415553|Wed Mar 02 02:53:24 +0000 2022|My guest to this evening’s #SOTU, Karim Peoples, sees this firsthand - investing in clean energy will cut costs, cr… https://t.co/bSrpr5xVNf|en|D|1|3
1498851352595816451|364415553|Wed Mar 02 02:43:04 +0000 2022|.@POTUS knows that many Americans are feeling pinched right now. Facing our challenges head-on is the way to succee… https://t.co/tSNyUOI7ay|en|D|4|12
1498849800736976896|364415553|Wed Mar 02 02:36:54 +0000 2022|Absolutely, @POTUS - the Infrastructure Investment and Jobs Act is rebuilding America and putting us on a path to c… https://t.co/p8lNxOZzGh|en|D|1|8
1498787836434202631|364415553|Tue Mar 01 22:30:40 +0000 2022|I supported the #AmericanRescuePlan to help families in Maryland and across the country recover from #COVID19. I am… https://t.co/3c0iMjGFVy|en|D|3|10
1498704940071636994|364415553|Tue Mar 01 17:01:16 +0000 2022|I’m pleased to announce that Karim Peoples will be my virtual guest for this evening’s #SOTU. Karim is a Constructi… https://t.co/IzaLJfJ7u0|en|D|7|12
1498679601656176644|364415553|Tue Mar 01 15:20:35 +0000 2022|The #AmericanRescuePlan has made the difference between recession and recovery during #COVID19. Today, I am joining… https://t.co/bmAlIuU3kk|en|D|11|29
1498410297333325832|364415553|Mon Feb 28 21:30:28 +0000 2022|It’s been over five months since I proudly supported House passage of the #WHPA, and yet abortion access remains im… https://t.co/zji4GTru3m|en|D|5|11
1498368489752567808|364415553|Mon Feb 28 18:44:20 +0000 2022|As a cosponsor of the Emmett Till #AntiLynchingAct, I will be voting to pass this long-overdue legislation to make… https://t.co/OGwHHO2xZ4|en|D|12|41
1498343388059480064|364415553|Mon Feb 28 17:04:36 +0000 2022|I joined @FOXBaltimore today to discuss the latest updates on Russia’s invasion of Ukraine. The United States and o… https://t.co/mupbA1lbZS|en|D|1|3
1497391884746080257|364415553|Sat Feb 26 02:03:40 +0000 2022|Proud that Baltimore’s very own @NiHaoBaltimore has won a @beardfoundation award for Best New Restaurant. Baltimore… https://t.co/CypLUNNkuN|en|D|4|9
1497289544240148492|364415553|Fri Feb 25 19:17:00 +0000 2022|One year ago, I voted to pass the #EqualityAct, urgently-needed legislation to codify equal protections for LGBTQ+… https://t.co/EiPUTMxMSW|en|D|3|17
1497253602292809738|364415553|Fri Feb 25 16:54:11 +0000 2022|Judge Ketanji Brown Jackson is an exceptionally qualified jurist, a dedicated public servant and a strong voice for… https://t.co/c0EPp2H0Ta|en|D|2|12
1496966918137331725|364415553|Thu Feb 24 21:55:00 +0000 2022|Thanks to the Infrastructure Investment and Jobs Act, @FAANews has announced its first round of funding for the Air… https://t.co/kiV0hF3QQI|en|D|1|4
1496949869570887680|364415553|Thu Feb 24 20:47:15 +0000 2022|Our country and our allies will not stand by as Putin invades the sovereign, democratic nation of Ukraine. We must… https://t.co/fxrtkXNuJm|en|D|4|25
1496552940336664581|364415553|Wed Feb 23 18:30:00 +0000 2022|During this National #PublicSchoolsWeek, we celebrate the public school teachers and staff who help Maryland's stud… https://t.co/TZ6hH9oL5l|en|D|2|6
1496527063192322051|364415553|Wed Feb 23 16:47:10 +0000 2022|🚨 Students, borrowers and college access professionals, tune in today at 2:00 PM for @FAFSA’s webinar on navigating… https://t.co/hf9WeRQGIE|en|D|2|3
1496223407452692483|364415553|Tue Feb 22 20:40:33 +0000 2022|We stand shoulder to shoulder with our allies in support of Ukraine, its people and its sovereignty. Vladimir Putin… https://t.co/3qZxEUKwxk|en|D|5|40
1496214909218136081|364415553|Tue Feb 22 20:06:47 +0000 2022|It was a pleasure to join the Suburban Orthodox Congregation Toras Chaim’s groundbreaking celebration this weekend.… https://t.co/HOH2UKIU6f|en|D|3|5
1494782524861689866|364415553|Fri Feb 18 21:15:00 +0000 2022|On #NationalCaregiversDay, thank you to the many professional and family caregivers in Maryland who support those i… https://t.co/X45LdPH8cv|en|D|2|10
1494773646946099204|364415553|Fri Feb 18 20:39:43 +0000 2022|Communities of color and low-income communities have long faced disproportionate harms from pollution. I'm a cospon… https://t.co/PeJTKLCGd8|en|D|2|2
1494397487536349185|364415553|Thu Feb 17 19:45:00 +0000 2022|Many Marylanders have struggled to receive their unemployment benefits throughout the #COVID19 pandemic. I joined i… https://t.co/8hxYkNzumG|en|D|1|3
1494385567374712833|364415553|Thu Feb 17 18:57:38 +0000 2022|My legislation to strengthen Chesapeake Bay restoration and environmental education has passed @NRDems! This is a c… https://t.co/Twc68A1t87|en|D|2|7
1494358889005043716|364415553|Thu Feb 17 17:11:37 +0000 2022|Apply for health coverage through @MarylandConnect before February 28! If you are uninsured, now is the time to sig… https://t.co/8XYp61ZJhA|en|D|3|3
1493243268292771840|364415553|Mon Feb 14 15:18:32 +0000 2022|Maryland has seen some of the worst postal backlogs in the country. Today, I am joining @OversightDems Subcommittee… https://t.co/VXecgR0fD5|en|D|10|36
1492234487702433803|364415553|Fri Feb 11 20:30:00 +0000 2022|Last week, I voted to pass the America COMPETES Act, which fixes supply chain issues by tapping into America’s powe… https://t.co/2YCXHLGK7S|en|D|2|2
1492230710173876239|364415553|Fri Feb 11 20:15:00 +0000 2022|The Infrastructure Investment and Jobs Act, which I helped to pass, is delivering $9.3 million to build electric ve… https://t.co/SjKdHCHiaQ|en|D|2|7
1492201321507741706|364415553|Fri Feb 11 18:18:13 +0000 2022|If you missed my telephone townhall this week, I answered your questions about what should be done to #ActOnClimate… https://t.co/IUl2qksoSp|en|D|1|1
1492198396089749504|364415553|Fri Feb 11 18:06:35 +0000 2022|Yesterday, I joined @EPAregion3 Administrator Ortiz for the announcement of a $1.8 million grant to modernize the P… https://t.co/fMwC8zrTwv|en|D|2|4
1491521568362668044|364415553|Wed Feb 09 21:17:07 +0000 2022|I proudly voted for the #GlobalRespectAct today. By denying visas to those who commit human rights abuses against L… https://t.co/fhCDO1lwiE|en|D|4|5
1491492757491400713|364415553|Wed Feb 09 19:22:38 +0000 2022|Great to see @BaltCoLoop off to a great start connecting the residents of Baltimore County! https://t.co/ruakYUyRbJ|en|D|1|4
1491474871959834627|364415553|Wed Feb 09 18:11:34 +0000 2022|Every American worker should be able to unionize for a better, fairer workplace – including here in Congress. I am… https://t.co/CiGRkxJ2Vt|en|D|1|6
1491207411033841667|364415553|Wed Feb 09 00:28:46 +0000 2022|Students should not have to fear for their safety at school - period. Standing with Catonsville High School and the… https://t.co/SOwbE0J0vs|en|D|2|12
1491151096169086979|364415553|Tue Feb 08 20:45:00 +0000 2022|I am proud to receive a 100% rating from @civilrightsorg for my votes to protect civil and human rights, support wo… https://t.co/QMu43WH520|en|D|1|21
1491124672804626443|364415553|Tue Feb 08 19:00:00 +0000 2022|The bipartisan #PostalServiceReformAct will help stabilize @USPS and deliver the resources it needs to provide high… https://t.co/d7PCkish4D|en|D|10|52
1491092291171532802|364415553|Tue Feb 08 16:51:20 +0000 2022|Today, @EnergyCommerce #SubHealth will hold a hearing on @POTUS’ proposed agency to advance biomedical research, AR… https://t.co/2CrBAXCK80|en|D|1|1
1491091977798303747|364415553|Tue Feb 08 16:50:05 +0000 2022|Fossil fuel companies spend MILLIONS of dollars to promote empty environmental pledges and BILLIONS to oppose clima… https://t.co/7J4TIxWdKA|en|D|26|31
1490779396931784712|364415553|Mon Feb 07 20:08:00 +0000 2022|Forced arbitration clauses silence survivors of sexual assault and harassment, blocking them from seeking justice.… https://t.co/xKXH5NtP7j|en|D|7|26
1490758856254836739|364415553|Mon Feb 07 18:46:22 +0000 2022|In Maryland, clean water is essential to our culture, economy and public health. I joined 120 @HouseDemocrats in ca… https://t.co/UZCu81nkcb|en|D|3|19
1489677077502586884|364415553|Fri Feb 04 19:07:46 +0000 2022|On #WorldCancerDay, we stand with those who have been impacted by cancer. To create a future without cancer, we mus… https://t.co/px2ODynDw8|en|D|1|6
1489663796498948098|364415553|Fri Feb 04 18:15:00 +0000 2022|Over 850,000 people are diagnosed with heart disease each year. On this #WearRedDay, join me in raising awareness a… https://t.co/LvRJfXXOTw|en|D|0|1
1489643915250569216|364415553|Fri Feb 04 16:56:00 +0000 2022|The Infrastructure Investment and Jobs Act is providing new @USDOT funding opportunities for Marylanders. Potential… https://t.co/upqFRC7XtT|en|D|1|0
1489638804428361732|364415553|Fri Feb 04 16:35:41 +0000 2022|Our country has endless potential to compete globally in innovation and technology. I am proud to support the… https://t.co/vYOFWRNU26|en|D|1|6
1488999418376474630|364415553|Wed Feb 02 22:15:00 +0000 2022|"Marylanders, join in celebrating #BlackHistoryMonth with local events:
https://t.co/rDMTnC1g1B"|en|D|1|3
1488999371622522880|364415553|Wed Feb 02 22:14:49 +0000 2022|Baltimore and the world came together to grieve Lt. Paul Butrim, Lt. Kelsey Sadler and Firefighter/Paramedic Kennet… https://t.co/RGrKrawG2y|en|D|2|1
1488980546692780038|364415553|Wed Feb 02 21:00:00 +0000 2022|The disruption of #COVID19 has exposed vulnerabilities and inefficiencies in our supply chain. This week, I’ll be v… https://t.co/fLWphlQpWP|en|D|2|4
1488952058266988547|364415553|Wed Feb 02 19:06:48 +0000 2022|February is National #SHBCAwarenessMonth. School-based health centers ensure all students can receive primary care… https://t.co/R7p0cWwsWS|en|D|5|9
1488611864762195968|364415553|Tue Feb 01 20:35:00 +0000 2022|The Infrastructure Investment and Jobs Act is rebuilding our crumbling infrastructure. I encourage state and local… https://t.co/nyXrxcXlzg|en|D|1|2
1488591731809476613|364415553|Tue Feb 01 19:15:00 +0000 2022|Far too many communities in Maryland and across the country have been afflicted by the scourge of gun violence. Dur… https://t.co/HCxcIwKwhn|en|D|5|13
1488574063974965248|364415553|Tue Feb 01 18:04:47 +0000 2022|Today marks the first day of #BlackHistoryMonth. Today and every day, let us celebrate the legacy and achievements… https://t.co/xSjR8vQsW2|en|D|1|1
1488535110525677568|364415553|Tue Feb 01 15:30:00 +0000 2022|Happy #LunarNewYear! Wishing you good fortune and good health in the #YearoftheTiger. https://t.co/WZsXLmoaFK|en|D|2|4
1488528437476212739|364415553|Tue Feb 01 15:03:29 +0000 2022|I am deeply concerned about the bomb threats targeting HBCUs, including Maryland campuses. I am closely monitoring… https://t.co/mpFwNiId8y|en|D|2|5
1488264827806130176|364415553|Mon Jan 31 21:36:00 +0000 2022|The #AmericaCOMPETES Act will strengthen our economic and national security by investing $45 billion in American re… https://t.co/3NweXQn1OM|en|D|4|6
1488256501768720389|364415553|Mon Jan 31 21:02:55 +0000 2022|82 years since the first #SocialSecurity check, millions of seniors and people with disabilities rely on Social Sec… https://t.co/MFZPvdL4Wl|en|D|8|20
1487145957724590080|364415553|Fri Jan 28 19:30:00 +0000 2022|The Infrastructure Investment and Jobs Act will provide $17 billion nationwide to #BuildBackBetter our ports, harbo… https://t.co/suPEp1rGmV|en|D|1|3
1487139814776479751|364415553|Fri Jan 28 19:05:36 +0000 2022|I was pleased to join @CASHMD’s Tax Prep Virtual Kickoff this morning. #EITC Awareness Day is a great opportunity t… https://t.co/apliZX1Jtr|en|D|1|2
1486822275064250373|364415553|Thu Jan 27 22:03:48 +0000 2022|On #HolocaustRemembranceDay, we come together to mourn the six million Jews who perished in the Holocaust and count… https://t.co/kTPG8t4IPp|en|D|0|3
1486806971873435650|364415553|Thu Jan 27 21:03:00 +0000 2022|I’m proud to cosponsor @RepSpeier and @RepManloney’s resolution recognizing the Equal Rights Amendment as the 28th… https://t.co/UYmMQgeT5E|en|D|7|28
1486801262607745026|364415553|Thu Jan 27 20:40:19 +0000 2022|An incredible demonstration that the #AmericanRescuePlan and #BuildBackBetter Agenda are working to help our econom… https://t.co/PIlyj2AP4A|en|D|1|7
1486720233167486986|364415553|Thu Jan 27 15:18:20 +0000 2022|I’m pleased to announce that @creativalliance and @OlneyTheatre have been awarded @NEA American Rescue Plan grants… https://t.co/IUZJuUBker|en|D|3|12
1486719232591085573|364415553|Thu Jan 27 15:14:21 +0000 2022|.@CASHMD is helping Marylanders through the complex tax filing process, making sure they know about tax credits and… https://t.co/GAdH5ORYWN|en|D|1|2
1486392311550521345|364415553|Wed Jan 26 17:35:17 +0000 2022|Glad to be with @ChrisVanHollen, @SenatorCardin , @MayorBMScott, local leaders and transit workers in Baltimore tod… https://t.co/9blgMi5Fdj|en|D|1|3
1486380914229743617|364415553|Wed Jan 26 16:50:00 +0000 2022|I’m proud that Maryland has been recognized as a @USGBC #Top10LEED state for 2021. Our state’s leadership in green… https://t.co/TlJSkZ0w6D|en|D|3|17
1486374840453980161|364415553|Wed Jan 26 16:25:52 +0000 2022|"Marylanders, sign up for your 2022 health insurance plan through @MarylandConnect by February 28!  #SarbanesStandard
https://t.co/FGJXrlOUVt"|en|D|2|1
1486113485041934355|364415553|Tue Jan 25 23:07:20 +0000 2022|.@MomsDemand is right to focus on ghost guns. These untraceable weapons evade background checks and detection by la… https://t.co/8smrTYSJbd|en|D|14|50
1486051252094095360|364415553|Tue Jan 25 19:00:02 +0000 2022|Today is National Poll Worker Recruitment Day! You can help voters in your community make their voices and votes he… https://t.co/ICX2IkO1lo|en|D|3|2
1486043440517304320|364415553|Tue Jan 25 18:29:00 +0000 2022|I’m proud to receive 100% on @NETWORKLobby’s 2021 Voting Record for my support of legislation that creates a better… https://t.co/VfceqMIcCn|en|D|6|28
1486038262493949958|364415553|Tue Jan 25 18:08:25 +0000 2022|The Clean Air Act is emphatically clear that @EPA has the authority to regulate greenhouse gases, tackle the climat… https://t.co/PCcezcdPJ8|en|D|8|16
1485765857355735042|364415553|Tue Jan 25 00:05:59 +0000 2022|Deeply saddened. My thoughts are with the families and friends of Lt. Paul Butrim, Kelsey Sadler and Kenny Lacayo w… https://t.co/jQ97AEZeND|en|D|3|17
1485706470159093766|364415553|Mon Jan 24 20:10:00 +0000 2022|Reminder: Every American household can now order free at-home #COVID19 tests right to their door. Every household i… https://t.co/KXsApNcBlb|en|D|2|3
1485693011715661829|364415553|Mon Jan 24 19:16:31 +0000 2022|I applaud @USOPM for raising the pay rate to $15 an hour for almost 70,000 federal employees. This is great news fo… https://t.co/VNTZeDFO4R|en|D|1|6
1485670807925891085|364415553|Mon Jan 24 17:48:17 +0000 2022|I’m closely monitoring this situation on S. Stricker Street. Three firefighters in serious condition and one still… https://t.co/CDpk3X980J|en|D|1|8
1484934941414764546|364415553|Sat Jan 22 17:04:13 +0000 2022|On this anniversary of #RoevWade, the fight for reproductive freedom is far from over. 49 years after the Supreme C… https://t.co/3dOulX2qVG|en|D|3|12
1484664626709213193|364415553|Fri Jan 21 23:10:05 +0000 2022|📁 Tax season starts on January 24, are you ready? The deadline to file FEDERAL taxes is April 18 this year, and dea… https://t.co/Jz3bsiOzj8|en|D|1|2
1484636880377417730|364415553|Fri Jan 21 21:19:50 +0000 2022|Twelve years ago today, the Supreme Court’s devastating decision in Citizens United unleashed wealthy donors, speci… https://t.co/ks3YPaz3Cq|en|D|10|36
1484275018964119557|364415553|Thu Jan 20 21:21:55 +0000 2022|.@NOAA’s Chesapeake Bay Office has been an essential partner in restoring and protecting the health of the Chesapea… https://t.co/xMIuifnmuO|en|D|2|3
1484178653168738304|364415553|Thu Jan 20 14:59:00 +0000 2022|Today, I’m testifying at a @NRDems hearing alongside Dr. Allison Colden of @ChesapeakeBay about my legislation to i… https://t.co/k4AyAt8y4u|en|D|3|11
1484163806469279745|364415553|Thu Jan 20 14:00:00 +0000 2022|The Infrastructure Investment and Jobs Act, which I supported, is already delivering historic levels of federal fun… https://t.co/0HZzgBa8aT|en|D|1|3
1484012154504232970|364415553|Thu Jan 20 03:57:23 +0000 2022|Minutes ago, the United States Senate failed to muster sufficient votes to change its rules, with the result that t… https://t.co/rSoAYodOdB|en|D|5|25
1483929763219574784|364415553|Wed Jan 19 22:30:00 +0000 2022|The Maryland Delegation is announcing $396 million in WIFIA loans to help upgrade Baltimore City’s aging water infr… https://t.co/ejZ5zZXiyN|en|D|1|8
1483910636878721024|364415553|Wed Jan 19 21:14:00 +0000 2022|The deadline for Maryland state individual income taxes has been extended three months to Friday, July 15 to assist… https://t.co/RJkwXj0A1l|en|D|2|3
1483901718677143562|364415553|Wed Jan 19 20:38:33 +0000 2022|As SCOTUS hears arguments in FEC v. Cruz today, a reminder that we should be strengthening campaign finance laws to… https://t.co/gBJ2SvNblN|en|D|6|16
1483858041334157315|364415553|Wed Jan 19 17:45:00 +0000 2022|I joined @OnTheRecordWYPR to discuss this pivotal moment in the fight to secure #VotingRightsForThePeople. The Free… https://t.co/iFP1LRRMqg|en|D|22|43
1483849910910959617|364415553|Wed Jan 19 17:12:42 +0000 2022|"Absolutely, @sisterquincy! A great day to celebrate @DollyParton and #FightForVotingRights.
https://t.co/kK3K2ska6U"|en|D|2|6
1483849003536113664|364415553|Wed Jan 19 17:09:05 +0000 2022|Today is a moment of truth for our democracy. For years, Americans have seen the escalating hyperpartisanship, gerr… https://t.co/OQ13OYea8B|en|D|8|49
