id|user|created_at|text|lang|label|retweet_count|favorite_count
1298755235758911491|24913074|Wed Aug 26 22:52:32 +0000 2020|"The GOP says it supports law and order and then flouts the law restricting federal employees from participating in political campaigns and limits how federal property can be used. Do as I say, not as I do. 

https://t.co/ZyR7v49Kwi via @voxdotcom"|en|D|83|218
1298711626783133696|24913074|Wed Aug 26 19:59:15 +0000 2020|Like his twin brother, Lt. Col. Yevgeny Vindman is a patriot who takes duty to country seriously. This Admin doesn’t just fail to do the same, it attacks anyone who dares shine the light on abuse of power &amp; corruption. DOD IG must immediately investigate his retaliation claims. https://t.co/V3AaBtK28R|en|D|47|155
1298675981125910529|24913074|Wed Aug 26 17:37:36 +0000 2020|Letetra Widman is the voice of true power &amp; grace. We will remember Jacob Blake as a father, cousin, son, uncle &amp;, most importantly, a human. A human life forever altered by being shot repeatedly in the back by police though he was unarmed. We demand justice. We demand change. https://t.co/og6wrC7qMB|en|D|47|167
1298646824635572224|24913074|Wed Aug 26 15:41:45 +0000 2020|It’s been almost two months since @SenatorGillibrand &amp; I asked the DOD IG for an investigation into the brutal killing of SPC Guillén &amp; the toxic culture at Ft Hood, w/one of the highest rates of violent crime in the military. We demand answers &amp; #JusticeforVanessaGuillen! https://t.co/wxk7awW6Pd|en|D|65|121
1298610530903642114|24913074|Wed Aug 26 13:17:32 +0000 2020|This #WomensEqualityDay, as we celebrate the 100th anniversary of the 19th Amendment and reflect on the ongoing fight and struggle for women's equality, let's recognize the role @POTUS has played in denigrating women with his words &amp; actions. Since 2017 he has:|en|D|418|853
1298325258718650368|24913074|Tue Aug 25 18:23:58 +0000 2020|Proud to see our Menlo Park firefighters helping out Santa Cruz. The fed disaster declaration - making public &amp; individual assistance available - is a good first step. But CA should not be expected to cover 25% of costs during these unprecedented times. https://t.co/pO4H2AgKHB|en|D|31|161
1297968459737956356|24913074|Mon Aug 24 18:46:10 +0000 2020|Trump's pulling another page straight from Putin's playbook. https://t.co/vs8Eht4pPh|en|D|84|295
1297924219922272258|24913074|Mon Aug 24 15:50:22 +0000 2020|Jacob Blake, an unarmed Black man, was shot in the back at point-blank range by police in front of his 3 children. No body cams worn-they must be mandated. This must be investigated. The Senate must pass the Justice in Policing Act. Blake &amp; his family are in my thoughts &amp; prayers https://t.co/3ZNz8k8zEA|en|D|60|210
1297908213640290304|24913074|Mon Aug 24 14:46:46 +0000 2020|At the @OversightDems hearing on PMG DeJoy's gutting of #USPS equipment &amp; OT amid a deadly pandemic, delaying mail, meds &amp; ballots! 65K mail-in primary ballots were rejected due specifically to delays. He must answer for this attack on our constitutionally-mandated postal service https://t.co/S89WJ4VF1z|en|D|44|129
1297885516151414785|24913074|Mon Aug 24 13:16:35 +0000 2020|"Bravo to New Orleans for eliminating the Pink Tax on menstrual products &amp; diapers. There’s so much more blatant price-gouging of women w/other goods &amp; services – bilking them of over $1,300 each year. Get it together, Congress. Pass my Pink Tax Repeal Act!
https://t.co/faTZKiPBga"|en|D|113|395
1297680777275224065|24913074|Sun Aug 23 23:43:01 +0000 2020|Looking forward to questioning PMG DeJoy and others about blatant attacks against the #USPS before the election at tomorrow’s @OversightDems hearing and recapping it with @RepRoKhanna. https://t.co/GalTm8oYEO|en|D|60|259
1297648610956410880|24913074|Sun Aug 23 21:35:12 +0000 2020|The swamp is filling up —seven of Trump’s 2016 campaign advisers have been convicted of or charged with crimes. This is not coincidental ... or normal.   https://t.co/62YAW1QdoY|en|D|131|386
1297622348514889736|24913074|Sun Aug 23 19:50:51 +0000 2020|"Fort Hood officials say the right words, but to fail to address sexual harassment/violence. It sends a clear message to predators, they have little to fear. That’s why I’m introducing a bill to make sexual harassment a criminal offense in the UCMJ. 

https://t.co/5IAFLeVxV3"|en|D|96|255
1297598120835133441|24913074|Sun Aug 23 18:14:34 +0000 2020|Now that we know what ⁦@POTUS⁩’ sister thinks of him, is DJT going to trot out his typical response “I barely knew her!”? https://t.co/eLNI8jFMOY|en|D|116|510
1297303927696822274|24913074|Sat Aug 22 22:45:33 +0000 2020|The #USPS is in our Constitution. It’s always been there for us. If some of our taxes go to shore it up, so be it. Believe me, we waste more than $6B a year in the Defense budget of $760 billion. My vote today reverses the sinister Trump efforts to slow mail ahead of the election|en|D|151|561
1297241033483444224|24913074|Sat Aug 22 18:35:38 +0000 2020|Remember this, the $25 billion in the #USPS bill was requested by the TRUMP-APPOINTED Board of Governors of the Postal Service. The coronavirus has wreaked havoc on the system.|en|D|99|291
1297229410634883072|24913074|Sat Aug 22 17:49:27 +0000 2020|The San Francisco facility has about 1000 employees but is short 200 because of the high cost of living in the Bay Area. A carrier here is paid the same as a carrier in Alabama. We need to change that. https://t.co/qEWe49uJER|en|D|49|209
1297229085958004736|24913074|Sat Aug 22 17:48:10 +0000 2020|I will continue to be a watchdog for USPS to make sure my constituents get their mail on time. In preparation for the Oversight Committee hearing on the postal service on Monday, I toured the sorting facility in San Francisco. https://t.co/b46EDIJ7lL|en|D|83|469
1296975109245329409|24913074|Sat Aug 22 00:58:57 +0000 2020|The chilling suggestion by @POTUS to have armed guards at polling places is yet another example of his malignant efforts to suppress the vote. This was tried in California. It didn’t work. The state turned from red to blue. https://t.co/pXkkuZEJ60|en|D|79|220
1296963743675551747|24913074|Sat Aug 22 00:13:47 +0000 2020|You know that VP Biden hit it out the park when the swamp can only explain it by saying it must have been taped. I’m looking forward to the debates. https://t.co/cqsFUZaoRJ|en|D|54|369
1296957004267888640|24913074|Fri Aug 21 23:47:00 +0000 2020|More than 500 wildfires are ravaging our state, destroying more than 771,000 acres, displacing thousands from their homes, fouling our air quality &amp; killing at least half a dozen people. @POTUS says, “you gotta clean your floors.” Yet again in the face of death he refuses to act.|en|D|296|793
1296588108922671104|24913074|Thu Aug 20 23:21:09 +0000 2020|Biden isn’t even in office yet and he’s already done more than Trump to protect us from cyberattacks. https://t.co/SZEwH9DsTV|en|D|586|1723
1296556359362764801|24913074|Thu Aug 20 21:14:59 +0000 2020|So Steven Bannon was arrested on a $28 million yacht owned by a Chinese fugitive stuck in a Connecticut swamp. This is B-list movie worthy.  https://t.co/BWqdqRmr7e|en|D|483|1491
1296505275545837568|24913074|Thu Aug 20 17:52:00 +0000 2020|"No wonder Trump is a fan of private prison contracts. With Bannon joining the list of at least 14 aides, donors &amp; advisers who have been indicted or imprisoned since then-candidate Trump declared he would only hire ""the best people,"" Mar-a-Lago could become the next Club Fed."|en|D|114|505
1296478323334426624|24913074|Thu Aug 20 16:04:54 +0000 2020|And the walls come tumbling down... https://t.co/CSk7kmlJDg|en|D|51|230
1296461713471090693|24913074|Thu Aug 20 14:58:54 +0000 2020|And can we all take a moment to relish the sweet irony that Bannon was taken into custody by US Postal Service Agents. Through rain, sleet, snow, and worse they deliver medication, paychecks, absentee ballots … and JUSTICE! https://t.co/XLnPRC92QW|en|D|556|1616
1296453446179135500|24913074|Thu Aug 20 14:26:03 +0000 2020|Just like Al Capone getting convicted for tax evasion after all the murders, Bannon gets charged with fraud after all his dastardly deeds. Justice prevails ....eventually. https://t.co/akIPCHtzYO|en|D|65|318
1296192322724679681|24913074|Wed Aug 19 21:08:26 +0000 2020|The @Lakers get it. The public gets it. Why is it more than 5 months since Breonna Taylor’s murder at the hands of police officers and not one of those officers, who blindly fired more than 20 rounds serving a no knock warrant at the wrong house, has been held to account? https://t.co/3ulfIZhS5o|en|D|57|176
1296167777393311745|24913074|Wed Aug 19 19:30:54 +0000 2020|If it looks like a cover-up, sounds like a cover-up, and smells like a cover-up, it’s a cover-up. #USPSsabotage  https://t.co/XxDr20I2UB|en|D|219|481
1296118186321104897|24913074|Wed Aug 19 16:13:50 +0000 2020|DeJoy says he's stopping his plan to gut the #USPS ... for now. What about equipment raided from distribution centers, mail boxes pillaged from communities, &amp; the damage done since he became Postmaster General? We need more than a tweet &amp; weak promise from this Trump flunkey. https://t.co/5iAoZ0tMvb|en|D|84|185
1295847205551534082|24913074|Tue Aug 18 22:17:04 +0000 2020|Due to the pandemic, Americans depend more than ever on the USPS for safe access to prescriptions, Social Security checks, paychecks, tax returns &amp; absentee ballots during the COVID-19 pandemic, yet DeJoy &amp; @POTUS have launched a campaign to gut this public service from Day One. https://t.co/tEIwvdffDW|en|D|18|52
1295846528053940225|24913074|Tue Aug 18 22:14:22 +0000 2020|More than 97,000 veterans are employed by the postal service &amp; even more, like my constituent Leo McArdle, need it for life-saving VA services. Our brave troops also use it to vote from 67 countries worldwide &amp; to keep in touch with loved ones. We must #ProtectTheUSPS for them. https://t.co/IYssv9F9JZ|en|D|32|114
1295845713188761600|24913074|Tue Aug 18 22:11:08 +0000 2020|DeJoy’s announcement today that he is halting his plans is a victory for the thousands constituents in my district, &amp; constituents everywhere, who made it clear - #DontMessWithUSPS. That’s proof that Americans have the power to make real change! https://t.co/0HXPKgOjaW|en|D|35|142
1295845081715363840|24913074|Tue Aug 18 22:08:37 +0000 2020|I’m at the Belmont Post Office talking about Postmaster General &amp; mega Trump donor Louis DeJoy’s bid to suppress votes by attacking the USPS - a hallmark of democracy enshrined in our Constitution &amp; lifeline for seniors, workers, veterans, our troops &amp; all Americans. #SaveTheUSPS https://t.co/BRIikyH6yG|en|D|23|112
1295829756278185992|24913074|Tue Aug 18 21:07:43 +0000 2020|Pregnancy discrimination still happens today. Gender pay disparity still happens to today. Violence against women is rampant. The courts have shown the patchwork of laws &amp; bills we’ve passed have loopholes that can be used to deny women justice. It’s time for the #ERANow! https://t.co/jusCs44zM5|en|D|24|72
1295785119479889924|24913074|Tue Aug 18 18:10:21 +0000 2020|Postmaster General Louis DeJoy will testify on Monday at the House Oversight Committee, and try and convince Americans he didn’t get the job because he gave @POTUS more than $1 million for his campaign. I'll be there with my @OversightDems colleagues holding his feet to the fire. https://t.co/gwtukivjt0|en|D|69|315
1295767918408597504|24913074|Tue Aug 18 17:02:00 +0000 2020|For anyone who still thinks Russia hacking the DNC and rigging the 2016 election in Trump’s favor is a hoax, please read this. https://t.co/ghVo4XsEnx|en|D|267|430
1295767417801465856|24913074|Tue Aug 18 17:00:01 +0000 2020|"Pathetic. Trump pardons a woman who has been dead for over 100 years to show his commitment to women. 

Suburban women aren’t dumb. We are all insulted. 

https://t.co/8NtWxYOy3p"|en|D|93|353
1295762630187945985|24913074|Tue Aug 18 16:40:59 +0000 2020|On the centennial of the ratification of the 19th Amendment, let me tell you the great story of Harry Burn. Today, 100 years ago… https://t.co/fEjEqRzNXm|en|D|15|52
1295744758674071556|24913074|Tue Aug 18 15:29:58 +0000 2020|Is the American outage meter so broken or are we so numb that a bipartisan Senate Intelligence Committee report that links Manafort to a Russian spy who hacked the DNC is not proof enough that Russia and Trump rigged the election in 2016?! https://t.co/RrqvQe99Yi|en|D|4618|8777
1295372518287650816|24913074|Mon Aug 17 14:50:49 +0000 2020|What were you wearing? Why were you drinking? Did you fight back hard enough? This is the nightmare survivors will be subjected to under the Title IX rule. These cruelly calculated changes may be in effect, but we won't stop fighting! https://t.co/YriH6qbXxJ|en|D|100|264
1294375695683133446|24913074|Fri Aug 14 20:49:48 +0000 2020|#MeToo &amp; Time's Up are not empty words, they're a mandate. @BetsyDeVosED, your unjust Title IX rule adds injury and trauma to survivors and presumes perpetrators are choir boys. We'll fight tooth &amp; nail until these changes are trashed. We'll show you how powerful survivors are.|en|D|83|319
1294325253242593280|24913074|Fri Aug 14 17:29:22 +0000 2020|A statue is great and all, but how about funding the Postal Service so that women can actually vote? https://t.co/G8X6F6sbwG|en|D|174|913
1294029772037558272|24913074|Thu Aug 13 21:55:14 +0000 2020|.@HouseDemWomen call on Kevin McCarthy to condemn the misogynistic slurs made by those in his own party - most recently toward the Speaker. These hateful slights disgrace the office we hold &amp; it's on us to set an example that vile personal attacks against women are not tolerated. https://t.co/UH7UqIwwkn|en|D|228|545
1293991514574594048|24913074|Thu Aug 13 19:23:12 +0000 2020|Imagine —a Black woman has to work an extra 8 months to equal what a white man made in one year. That’s a loss of $1,000,000 over a lifetime. There’s no racial justice without economic justice.|en|D|138|578
1293757376256860160|24913074|Thu Aug 13 03:52:50 +0000 2020|We have her back. https://t.co/iS4DfMnzIb|en|D|326|1634
1293566969543905281|24913074|Wed Aug 12 15:16:13 +0000 2020|By the way, Mr. President, suburban moms are concerned about sending their kids to school when COVID is still rampant. You can’t force them to do that. Kids DO come first, not you.|en|D|102|494
1293563838118363137|24913074|Wed Aug 12 15:03:46 +0000 2020|As a suburban woman I carry mace and am more concerned with men who try and grope women in dressing rooms.|en|D|471|2901
1293561509340119040|24913074|Wed Aug 12 14:54:31 +0000 2020|Real leaders know how to unite us. All this Divider in Chief knows is fear mongering and blatant racism. Oh, and newsflash @POTUS, the majority of suburban women are not housewives. https://t.co/p60bxAUqG5|en|D|72|319
1293309205776969729|24913074|Tue Aug 11 22:11:57 +0000 2020|The @PebbleMine could sound the death knell for the largest salmon fisheries in the world. @RepMaloney, @RepHarley &amp; I demand investigations into the rigged environmental review. Potential violations of the Clean Water Act &amp; NEPA could be disastrous for delicate ecosystems.|en|D|44|120
1292909873324109824|24913074|Mon Aug 10 19:45:09 +0000 2020|The best way to protect the @USPS from @POTUS' hatchet would be to announce a new forever stamp with his face on it.|en|D|245|1267
1292905189188358144|24913074|Mon Aug 10 19:26:32 +0000 2020|We need college football like I “need” a manicure. We need to feed America’s children and keep roofs over Americans’ heads. https://t.co/Wd3BXO8WBy|en|D|185|845
1292887226682990592|24913074|Mon Aug 10 18:15:10 +0000 2020|.@POTUS - you are no Abe Lincoln so cross off doing your nominee acceptance speech at the Gettysburg battlefield. Besides which didn’t you dodge the draft?|en|D|454|1648
1292497779344932865|24913074|Sun Aug 09 16:27:38 +0000 2020|Suspending the payroll taxes means two things: shortchanging Medicare and SSA and fast tracking their demise, or adding yet another hefty balloon payment to workers at the end of the year along with delayed rent or mortgage payments.|en|D|279|626
1292462167732752386|24913074|Sun Aug 09 14:06:08 +0000 2020|The king has signed edicts that profess to help workers and families. Illegal. He can’t appropriate. Desperate people do desperate things. That should worry all of us.|en|D|404|1487
1291867302061907973|24913074|Fri Aug 07 22:42:21 +0000 2020|The 11th Cir. granted a rehearing in Courtney Wild's case challenging Epstein's secret, obscenely lenient 2007 plea deal-there may be justice after all! But we can also strengthen the law to better protect victims’ rights w/my Courtney Wild Crime Victims' Rights Reform Act.|en|D|94|332
1291833074821533696|24913074|Fri Aug 07 20:26:20 +0000 2020|.⁦@POTUS⁩ can be charged with insurance and bank fraud, tax evasion, and so much more when he leaves office. He should be charged with reckless malfeasance and the preventable deaths of so many because he refused to act on Fauci’s early warnings.  https://t.co/p3bG3ateJ9|en|D|210|593
1291827332337086465|24913074|Fri Aug 07 20:03:31 +0000 2020|I was honored to speak at #DEFCONSafeMode today. In the spirit of those who helped pave the way for Americans to vote, the hackers at the #VotingVillage2020 are helping to ensure election integrity by getting into “good trouble.” Thanks @VotingVillageDC https://t.co/mVJ7rC8MKg|en|D|8|41
1291815511815331842|24913074|Fri Aug 07 19:16:33 +0000 2020|Another Trump crony appointed to a “new” post with no background or expertise because @POTUS knows that’s the only way he can rig the Census in order to steal billions of federal dollars owed to California for states he deems loyal. https://t.co/MPyjuZ4Win|en|D|75|150
1291752593497239553|24913074|Fri Aug 07 15:06:32 +0000 2020|"Contact tracing via mobile apps can play a key role in combating rising coronavirus cases, but only if people trust the safety of their data. My bill - HR 7472 - would incentivize states to only use apps that abide by the strictest privacy rules.
https://t.co/DQGe0I9yR4"|en|D|14|54
1291458267642826752|24913074|Thu Aug 06 19:36:59 +0000 2020|It’s been a year since the people of #Kashmir – including families of my constituents – have lived in lockdown under our democratic ally India. Detaining civilians (including children) and preventing access to tele-health, education and other critical services is inhumane!|en|D|130|327
1291423837679226882|24913074|Thu Aug 06 17:20:11 +0000 2020|100 US &amp; global women lawmakers are demanding Facebook take gender disinformation &amp; online violence against women seriously. Cyber campaigns against women undermine our democracies &amp; drive women to leave or avoid careers in public service - an injustice that hurts all. https://t.co/iq2zUxnIUy|en|D|92|230
1291363834167472128|24913074|Thu Aug 06 13:21:45 +0000 2020|Social media platforms, esp Facebook, must do a better job of ending the onslaught of misogyny &amp; hateful content on social media that has killed many promising public service careers for women. This is no secret. It's time to #EndTheHate - Follow us here https://t.co/axmq9QpgOJ|en|D|45|146
1291076154590466059|24913074|Wed Aug 05 18:18:36 +0000 2020|Even Trump crony Akard knows something's rotten in Denmark, resigning less than 3 months after taking on the job of State Dept IG &amp; making clear he wouldn't be a tool for @POTUS &amp; Pompeo to undermine ongoing investigations into Pompeo &amp; his wife. https://t.co/8VHmgVYwty|en|D|175|384
1290783321899728897|24913074|Tue Aug 04 22:55:00 +0000 2020|STARTING NOW: My 11th tele town hall on the federal response to COVID-19. I'm answering questions about @HouseDemocrats HEROES Act vs GOP's Heals Act, which slashes $400 from unemployment insurance per week. Watch it live at https://t.co/1qkhHDnC1k or https://t.co/WDNHosXUmC https://t.co/3Pep8L1LrX|en|D|28|65
1290768222438879233|24913074|Tue Aug 04 21:55:00 +0000 2020|IN ONE HOUR, join my 11th tele town hall on the federal response to COVID-19. I'm answering questions about @HouseDemocrats HEROES Act vs GOP's Heals Act, which slashes $400 from unemployment insurance per week! Watch it live at https://t.co/1qkhHDnC1k or https://t.co/WDNHosXUmC https://t.co/o1qmM046YW|en|D|12|23
1290761702418636801|24913074|Tue Aug 04 21:29:05 +0000 2020|"The Republican HEALS Act:
 
✅$377 million for White House improvements
 
The Democrats' HEROES Act:
 
✅SNAP nutrition assistance
✅Election grants &amp; vote-by-mail
✅Postal service funds
✅Eviction moratorium
✅State and local govt funds
✅$600/wk unemployment
 
Need I say more?"|en|D|301|589
1290719748976709647|24913074|Tue Aug 04 18:42:23 +0000 2020|Happiest of birthdays to our President who sang Amazing Grace to a nation in mourning, pulled us out of the wreckage of an economic recession, &amp; taught us to see the best in each other &amp; recognize our shared human dignity &amp; worth. Your leadership &amp; grace continue to inspire. https://t.co/Vwxz5mHmxQ|en|D|139|717
1290663790464266240|24913074|Tue Aug 04 15:00:01 +0000 2020|TODAY at 3:55 p.m. PT, join me for my 11th tele town hall on the federal response to COVID-19. I’ll answer questions about @HouseDemocrats HEROES Act vs the GOP's Heals Act, which slashes $400 from unemployment insurance per week! Watch live &amp; ask ?s at https://t.co/1qkhHDnC1k https://t.co/LF12PYrcFw|en|D|14|29
1290386522303275009|24913074|Mon Aug 03 20:38:15 +0000 2020|One year ago, a white supremacist accessed a gun &amp; laid waste to 23 lives. Our battles against racism &amp; gun violence are among the most critical of our time. We are fighting for an America that belongs to all &amp; is free from the gun lobby's clutches. We must never give up. #ElPaso|en|D|68|262
1290370723761070081|24913074|Mon Aug 03 19:35:29 +0000 2020|.@HouseDemWomen led 81 Members in an amicus brief supporting blocking @POTUS' Title IX rule that ignores the cost &amp; trauma borne by survivors &amp; makes schools less safe. If this goes into effect Aug 14, we turn back the clock on women’s ed advancement, w/all of us paying the price https://t.co/TXlk0UlCyZ|en|D|51|104
1290317353813716998|24913074|Mon Aug 03 16:03:24 +0000 2020|TOMORROW at 3:55 p.m. PT, join me for my 11th tele town hall on the federal response to COVID-19. I'll answer your questions about House Democrats HEROES Act vs the GOP's Heals Act, which cuts $400 from unemployment insurance per week. Sign up/watch live: https://t.co/1qkhHDFdpU https://t.co/4x0FJg4ehl|en|D|12|34
1289628846149390338|24913074|Sat Aug 01 18:27:31 +0000 2020|"The San Francisco Bay is our crown jewel and the lifeblood of our region, but it’s in peril. Read about why and about my restoration bill that just passed in the House. We have to save our bay!
https://t.co/DxujZO6730"|en|D|45|112
1289623288063262720|24913074|Sat Aug 01 18:05:26 +0000 2020|It’s been 2 yrs since Samar Badawi was arrested for having the courage to stand up for gender equality &amp; human rights in a country determined to silence her. Saudi Arabia must immediately release &amp; drop all charges against Samar &amp; end its persecution of women’s rights defenders! https://t.co/9Tb6KbeD8D|en|D|52|180
1289585626476503040|24913074|Sat Aug 01 15:35:47 +0000 2020|.@DeptofDefense outrageously banned LGBT Pride flags, equating symbols of diversity &amp; inclusion w/the hateful confederate battle flag. I joined @AnthonyBrownMD4 calling on @EsperDoD to revise policy to ensure servicemembers &amp; DoD civilian staff can display Pride flags w/ #pride! https://t.co/2n4kF5J2ye|en|D|23|62
1289312380158173188|24913074|Fri Jul 31 21:30:00 +0000 2020|Now that Ghislaine Maxwell is behind bars we've learned that she has over 15 bank accounts w/balances ranging from 100s of thousands of dollars to $20 mil. That money belongs to the victims, many of them children, when she trafficked &amp; assaulted them for sexual predator Epstein.|en|D|6082|21986
1289286256241778688|24913074|Fri Jul 31 19:46:11 +0000 2020|"I was blessed to walk the same halls as John Lewis, the finest Member of Congress to cross this threshold. He inspired us all to fight for change, saying, “You must be bold, brave, and courageous and find a way... to get in the way."" His inspiration will live on for eternity. https://t.co/PiazOufe5P"|en|D|30|238
1289235431138131968|24913074|Fri Jul 31 16:24:14 +0000 2020|.@HouseDemocrats just voted for an Approps bill to block Trump’s misogynistic #TitleIX rule! We won't stand for changes that make it harder for women to pursue an education free from sexual violence or reinforce false stereotypes that women lie about assault. Not on our watch.|en|D|98|385
1289185967669235713|24913074|Fri Jul 31 13:07:41 +0000 2020|If there’s any question that Congress is broken all we have to look at is the fact that 30 million people will lose desperately needed $600/wk unemployment today because Rs can’t be bothered. President Obama is right. Get rid of the filibuster!|en|D|126|529
1288941759892877312|24913074|Thu Jul 30 20:57:17 +0000 2020|One American per minute is dying in the U.S. due to the coronavirus. Let that sink in. Remember when @POTUS said there were only 15 cases in the U.S. and it would magically go away? It’s appalling and it was totally preventable. Wear a mask and please stay 6 feet apart.|en|D|124|402
1288920788452683777|24913074|Thu Jul 30 19:33:57 +0000 2020|Birth control is none of your boss' business. The fact that SCOTUS would condone discrimination &amp; allow employers &amp; schools to deny women contraception is backwards &amp; wrong. @HouseDemocrats Approps bill blocks Trump's misogynistic rule &amp; affirms our commitment to basic healthcare https://t.co/d40jfRyDe4|en|D|92|333
