id|user|created_at|text|lang|label|retweet_count|favorite_count
1262727399730491395|364415553|Tue May 19 12:50:47 +0000 2020|Nearly 31,000 Marylanders have signed up for health insurance during our state’s special open enrollment period in… https://t.co/fmqgFT2uP0|en|D|14|27
1262361212739825666|364415553|Mon May 18 12:35:41 +0000 2020|An important message for Baltimore voters: Mail ballots for the June 2 primary are running late. They should arrive… https://t.co/Nc56uJTRwT|en|D|5|10
1261471553608388610|364415553|Sat May 16 01:40:30 +0000 2020|I just voted to pass the #HeroesAct, a critical relief package to address the ongoing #COVID19 public health emerge… https://t.co/lzlxQvTRlK|en|D|3|20
1261427859085832202|364415553|Fri May 15 22:46:52 +0000 2020|Yesterday, I held a telephone town hall with Maryland Attorney General @BrianFrosh to talk about the ways that Mary… https://t.co/wgtYtPXHKW|en|D|5|12
1261404763565912067|364415553|Fri May 15 21:15:06 +0000 2020|In a democracy, voting is essential. Throughout our history – even in the worst of times – we’ve found a way to con… https://t.co/WBWPUhwf0F|en|D|12|25
1261399746280898560|364415553|Fri May 15 20:55:09 +0000 2020|The Maryland Congressional Delegation today announced more than $25 million in federal funding to help make home an… https://t.co/3jjtBI2Qkn|en|D|1|10
1261090229043302401|364415553|Fri May 15 00:25:15 +0000 2020|The Baltimore Congressional Delegation just announced more than $162,000 in federal funding for @JohnsHopkins to co… https://t.co/FbFxPVGm1N|en|D|3|8
1261078867046993921|364415553|Thu May 14 23:40:06 +0000 2020|The Trump Administration failed to adequately prepare for the #COVID19 pandemic and ignored the warnings of scienti… https://t.co/pS9qWjk77r|en|D|15|27
1261033849926103040|364415553|Thu May 14 20:41:13 +0000 2020|A friendly reminder to tune in to my telephone town hall tonight at 5:30 PM with Maryland Attorney General… https://t.co/zx3cZTgJSg|en|D|2|5
1260998373072609280|364415553|Thu May 14 18:20:15 +0000 2020|A little while ago, I asked @HHSgov whistleblower Dr. Rick Bright about what keeps him up at night when he thinks t… https://t.co/EwrtawVyhw|en|D|23|49
1260720901391343624|364415553|Wed May 13 23:57:40 +0000 2020|Maryland has eased its stay-at-home order but continues to advise all residents to stay at home when possible and o… https://t.co/WOAM8jDQmj|en|D|4|11
1260687457248477188|364415553|Wed May 13 21:44:46 +0000 2020|Here’s some positive and encouraging news on the climate front. https://t.co/xVXYzlyhrH|en|D|7|18
1260666156211372037|364415553|Wed May 13 20:20:08 +0000 2020|The Maryland Congressional Delegation today announced more than $205 million in federal funding to increase Marylan… https://t.co/eg2QTgkdIs|en|D|4|13
1260379408835190789|364415553|Wed May 13 01:20:42 +0000 2020|The Baltimore Congressional Delegation announced more than $4.2 million in new federal funding to reduce crime and… https://t.co/wKSMK8toZB|en|D|4|11
1260342927919853569|364415553|Tue May 12 22:55:44 +0000 2020|On Thursday, May 14 at 5:30 PM, I’ll be hosting a telephone town hall with Maryland Attorney General @BrianFrosh to… https://t.co/yUsk4mOdHM|en|D|2|6
1260273535664050176|364415553|Tue May 12 18:20:00 +0000 2020|As you may know, the Maryland State Board of Elections announced that our state’s primary election on June 2 will b… https://t.co/TZlulE8sgp|en|D|3|7
1260210638833549312|364415553|Tue May 12 14:10:04 +0000 2020|Just joined @SenWarren, @SenBlumenthal, @ChrisCoons and @RepJayapal in unveiling strong legislation to… https://t.co/o0V5AQ6baB|en|D|6|12
1260026420933169154|364415553|Tue May 12 01:58:03 +0000 2020|If you have not yet received your Economic Impact Payment and would like to receive it via direct deposit into your… https://t.co/NWfyiH3QQJ|en|D|8|11
1259833325885235202|364415553|Mon May 11 13:10:46 +0000 2020|Congratulations to @HCPSS Teacher Ann Strozyk for winning the @EPA Region 3 Presidential Innovation Award for Envir… https://t.co/Ti70XaqQZF|en|D|1|9
1259487103643090946|364415553|Sun May 10 14:15:00 +0000 2020|To all the Moms in Maryland and across the country, thank you. https://t.co/MZPieAmECs|en|D|3|16
1259202729685090304|364415553|Sat May 09 19:25:00 +0000 2020|From day one, state and local governments in Maryland and across the country have led our fight against #COVID19. I… https://t.co/fLcMa8QxFW|en|D|7|9
1258888412792344577|364415553|Fri May 08 22:36:01 +0000 2020|Today, the Maryland Congressional Delegation announced more than $16 million in federal funding to help protect Mar… https://t.co/ST1M05Z0Lx|en|D|5|11
1258870859219046403|364415553|Fri May 08 21:26:16 +0000 2020|The Maryland Congressional Delegation just announced nearly $7 million to help 18 Community Health Centers in Maryl… https://t.co/eIjANB7SSM|en|D|3|5
1258753706423656448|364415553|Fri May 08 13:40:44 +0000 2020|Today, we mark the 75th Anniversary of V-E Day. It should serve as a poignant reminder that, as Americans, we can o… https://t.co/7UPyuaIoey|en|D|5|8
1258742445149491201|364415553|Fri May 08 12:55:59 +0000 2020|On a press call yesterday, I underscored the urgent need to support state and local governments, which are fighting… https://t.co/hZE0XqWMga|en|D|1|3
1258533318917869570|364415553|Thu May 07 23:05:00 +0000 2020|Testing, testing, testing – the single-most important factor for reopening our economy and getting back to normal.… https://t.co/jMFgjmLZFQ|en|D|9|19
1258532875915280384|364415553|Thu May 07 23:03:14 +0000 2020|During #PublicServiceRecognitionWeek, we salute all federal employees for continuing to serve the American people d… https://t.co/ibLRKofazH|en|D|2|7
1258471776331411462|364415553|Thu May 07 19:00:27 +0000 2020|The State of Maryland has announced an amended stay-at-home order. https://t.co/HdL049G2lx|en|D|2|3
1258445978870448129|364415553|Thu May 07 17:17:56 +0000 2020|"Sharing some important news for Baltimore County residents aged 60 and older.

Starting next week, the county will… https://t.co/m9Wfl9QynG"|en|D|3|3
1258421514614996998|364415553|Thu May 07 15:40:44 +0000 2020|Our Delegation just announced more than $17 million for Maryland @AmeriCorps programs. These new federal resources… https://t.co/tsdtyEY2NN|en|D|4|11
1258364722740592640|364415553|Thu May 07 11:55:03 +0000 2020|Yesterday, the Delegation also announced more than $1.5 million in federal funding to support telehealth programs f… https://t.co/HrkC3mGf2k|en|D|1|1
1258363475027472385|364415553|Thu May 07 11:50:06 +0000 2020|Yesterday, the Maryland Congressional Delegation urged Congressional Leadership to expand and strengthen the Supple… https://t.co/Z1x2bXPbP7|en|D|5|9
1258065002780598282|364415553|Wed May 06 16:04:05 +0000 2020|#NationalNursesDay comes at a time when we could not be any more grateful for our nurses, who battle the #COVID19 v… https://t.co/LvjbJwp3Jf|en|D|2|3
1258023997784109056|364415553|Wed May 06 13:21:08 +0000 2020|Today, the Maryland Congressional Delegation urged Attorney General William Barr him to help stop the spread of… https://t.co/cMBCOdaMiC|en|D|3|5
1258021461002006531|364415553|Wed May 06 13:11:03 +0000 2020|Kudos to the Clarksville Youth Care Group for doing such a tremendous job to support Maryland’s health care workers. https://t.co/2Ghhkl00l2|en|D|3|11
1257828675375886337|364415553|Wed May 06 00:25:00 +0000 2020|A few words to salute our courageous health care workers – in Maryland and across the country. https://t.co/pJ1k0EQJfv|en|D|5|13
1257768285896167433|364415553|Tue May 05 20:25:02 +0000 2020|The Maryland Congressional Delegation today announced more than $46 million in #COVID19 relief funding for Maryland… https://t.co/G9YHnZ5snr|en|D|3|6
1257674020289478659|364415553|Tue May 05 14:10:27 +0000 2020|The #COVID19 crisis has created tremendous anxiety, stress and hardship for American families – especially when it comes to mental health.|en|D|2|6
1257430002477432840|364415553|Mon May 04 22:00:49 +0000 2020|I just co-sponsored the Protect Our Post Offices Act (H.R. 6425), an important effort led by @RepJoeNeguse to ensur… https://t.co/fD4Ss58wpR|en|D|18|51
1257400962756550656|364415553|Mon May 04 20:05:25 +0000 2020|Please join @CmHucker and I this evening for a conversation about the latest developments in the #COVID19 crisis. https://t.co/lFEX0McggQ|en|D|2|3
1256219638863671296|364415553|Fri May 01 13:51:15 +0000 2020|Proud to join @SenBlumenthal, @SenWarren and @RepJayapal to urge Congressional leaders to include strong oversight,… https://t.co/OITDqmLj24|en|D|30|89
1256216899043672065|364415553|Fri May 01 13:40:22 +0000 2020|The Maryland Congressional Delegation just announced the approval of new federal funding for our state to provide c… https://t.co/O11W4F6hpG|en|D|1|3
1256199245557829634|364415553|Fri May 01 12:30:13 +0000 2020|This year’s International Workers Day carries special meaning as we recognize the tremendous courage and sacrifice… https://t.co/Ys5iqEhzEH|en|D|3|5
1256025781844807681|364415553|Fri May 01 01:00:56 +0000 2020|Today, the Maryland Congressional Delegation discussed the status of Maryland’s ability to test for #COVID_19 with… https://t.co/30faNIATaE|en|D|4|9
1256013186580578311|364415553|Fri May 01 00:10:53 +0000 2020|More inspiring news from Baltimore, where a local farmers market has started delivering fresh groceries, toilet pap… https://t.co/wyhTVRcm0Z|en|D|8|22
1255913556761022464|364415553|Thu Apr 30 17:35:00 +0000 2020|As we approach the first of the month – when rent payments, mortgages and other bills come due – I wanted to share… https://t.co/zGjtw4V5Om|en|D|2|1
1255874590292746240|364415553|Thu Apr 30 15:00:10 +0000 2020|Today, the Maryland Congressional Delegation announced more than $9 million in #COVID_19 housing relief for low-inc… https://t.co/iBtsfCWE5f|en|D|4|7
1255609180712579078|364415553|Wed Apr 29 21:25:31 +0000 2020|The Maryland Congressional Delegation announced that  @USDA has approved Maryland’s plan to provide additional nutr… https://t.co/yEiMw2bWL4|en|D|2|6
1255520104651112452|364415553|Wed Apr 29 15:31:34 +0000 2020|I joined @SenatorCardin, @ChrisVanHollen and @Call_Me_Dutch to announce $200,000 in federal #CARESAct funding for… https://t.co/Kuz27vCOA9|en|D|2|3
1255300787250573314|364415553|Wed Apr 29 01:00:04 +0000 2020|On Friday at 1:30 PM, I’ll be hosting a telephone town hall to answer your questions about #COVID_19. To sign up fo… https://t.co/ETVFMaQ53g|en|D|3|8
1255249257247977473|364415553|Tue Apr 28 21:35:18 +0000 2020|The Maryland Congressional Delegation asked the Trump Administration to designate the National Capital Region – whi… https://t.co/4046QM9scK|en|D|5|9
1255158581894148096|364415553|Tue Apr 28 15:35:00 +0000 2020|In the latest edition of the #SarbanesStandard, I share how federal funding from the #CARESAct flowed to Maryland –… https://t.co/ZyKB2OMRIp|en|D|1|5
1255153548863500293|364415553|Tue Apr 28 15:15:00 +0000 2020|"If you:
 
🔘 Have children
🔘 Receive VA benefits or SSI benefits
🔘 And didn’t file a tax return last year
 
Then you… https://t.co/e6ON2Qu3cD"|en|D|25|28
1255151240259887109|364415553|Tue Apr 28 15:05:49 +0000 2020|Here’s another incredible story of Marylanders – this time, in our Chinese-American community – pitching in to help… https://t.co/DVMyGxBd91|en|D|6|11
1253860086465912833|364415553|Sat Apr 25 01:35:14 +0000 2020|Here’s a recap of the latest news and information regarding #COVID_19. #SarbanesStandard https://t.co/BgDA6vMKA2|en|D|4|5
1253798423674978310|364415553|Fri Apr 24 21:30:13 +0000 2020|Some good news for Maryland schools: We just announced $200 million in federal funding to help school districts pay… https://t.co/cbRXxDHEGy|en|D|1|5
1253793416309354497|364415553|Fri Apr 24 21:10:19 +0000 2020|Today, the Maryland Congressional Delegation urged the Trump Administration and @CMSGov Administrator @SeemaCMS to… https://t.co/iwBag4Qj8X|en|D|2|4
1253778356191010820|364415553|Fri Apr 24 20:10:28 +0000 2020|.@MD_Labor has launched a new, one-stop shop to apply for Unemployment Insurance online. See below. https://t.co/a1INUrjkh7|en|D|5|8
1253484145688424448|364415553|Fri Apr 24 00:41:23 +0000 2020|The Maryland Congressional Delegation asked the Trump Administration and @fema Administrator Peter T. Gaynor to inc… https://t.co/9rXampRwG7|en|D|2|6
1253477504561659906|364415553|Fri Apr 24 00:15:00 +0000 2020|It’s incredibly heartening to see so many Marylanders stepping up in our fight against #COVID_19 and supporting our… https://t.co/Vi2pDXl84y|en|D|3|15
1253451150680043520|364415553|Thu Apr 23 22:30:16 +0000 2020|I just voted to provide additional economic relief for small businesses, extend critical funding to hospitals, heal… https://t.co/9skTMZ46X1|en|D|3|6
1253424674983178247|364415553|Thu Apr 23 20:45:04 +0000 2020|The Maryland Congressional Delegation today expressed concern about recent reports that loan servicers are not allo… https://t.co/2qnVc9vLMu|en|D|2|1
1253385675602362368|364415553|Thu Apr 23 18:10:06 +0000 2020|The Maryland Congressional Delegation announced more than $422,000 in federal funding for @MDLegalAid, which will u… https://t.co/18FkVczxIp|en|D|0|3
1253371959452237825|364415553|Thu Apr 23 17:15:36 +0000 2020|Due to the #COVID_19 emergency, and given the logistical challenges posed by the closure of Maryland schools, my of… https://t.co/Di2g78GIFJ|en|D|1|4
1253087455143759872|364415553|Wed Apr 22 22:25:05 +0000 2020|Today, I spoke with @MD_Labor Secretary Tiffany P. Robinson to discuss the unprecedented challenges faced by Maryla… https://t.co/MpDC6eUn39|en|D|1|3
1253026170712580097|364415553|Wed Apr 22 18:21:33 +0000 2020|📞💻 Tomorrow, April 23, at 2:00 PM ➡️ @IRSnews will host a live webinar to answer your questions about Economic Impa… https://t.co/Dc42Xd7Q2N|en|D|4|3
1252957896704483330|364415553|Wed Apr 22 13:50:16 +0000 2020|This year, celebrating Earth Day will be – like everything else – quite different than normal. However, you can sti… https://t.co/vLlnIl7DZw|en|D|4|8
1252740245373759488|364415553|Tue Apr 21 23:25:23 +0000 2020|The Maryland Congressional Delegation asked state officials and Maryland retailers to ensure that Supplemental Nutr… https://t.co/x4MedF7dQj|en|D|3|8
1252730154649976832|364415553|Tue Apr 21 22:45:18 +0000 2020|The Maryland Congressional Delegation today urged President Trump and @GM to reopen the GM plant in White Marsh to… https://t.co/BkGzsNM0SN|en|D|4|8
1252707617966829569|364415553|Tue Apr 21 21:15:44 +0000 2020|Many Marylanders have called or emailed my office with questions about the economic impact payments available to th… https://t.co/Kp0MyXqqJq|en|D|6|8
1252658480718233619|364415553|Tue Apr 21 18:00:29 +0000 2020|On the occasion of #YomHaShoah – this sacred and somber remembrance – we honor the six million Jewish victims of th… https://t.co/tCKwF76mYO|en|D|2|1
1252336660718600197|364415553|Mon Apr 20 20:41:41 +0000 2020|Proud to join my colleagues to help ensure that all students have access to online learning. #COVID_19 https://t.co/xB5ApgYVc0|en|D|5|15
1252239631308984322|364415553|Mon Apr 20 14:16:08 +0000 2020|The Maryland Congressional Delegation just announced $1,665,000 in federal funding from the #CARESAct to help creat… https://t.co/r48tUewl6V|en|D|5|10
1251595146967334913|364415553|Sat Apr 18 19:35:11 +0000 2020|.@USTreasury and @DeptVetAffairs have announced that veterans and their beneficiaries who receive Compensation and… https://t.co/fYXuWww2ZM|en|D|4|7
1251247845887348742|364415553|Fri Apr 17 20:35:08 +0000 2020|The Maryland Congressional Delegation announced more than $45 million in COVID-19 economic relief for Maryland chil… https://t.co/kvwdtIFa0L|en|D|2|6
1250879229027389440|364415553|Thu Apr 16 20:10:23 +0000 2020|.@MarylandConnect’s #COVID_19 emergency open enrollment period has already helped more than 19,000 Marylanders sign… https://t.co/QpkUUzTEHU|en|D|3|3
1250855520031784964|364415553|Thu Apr 16 18:36:10 +0000 2020|The Maryland Congressional Delegation urged @GovLarryHogan to take steps to address the outbreak of #COVID_19 in Ma… https://t.co/nHtlSVDvid|en|D|4|17
1250793634699542529|364415553|Thu Apr 16 14:30:15 +0000 2020|Beginning on Saturday, Marylanders must wear masks or face coverings in grocery stores and other retail establishme… https://t.co/ZdpvbMXjNy|en|D|6|6
1250607536241328133|364415553|Thu Apr 16 02:10:46 +0000 2020|.@socialsecurity just announced that Supplemental Security Income (SSI) recipients will also receive a one-time eco… https://t.co/cjlCtPs6jx|en|D|13|13
1250606161600135169|364415553|Thu Apr 16 02:05:18 +0000 2020|Beginning today, Anne Arundel County @RecParks has set up donation trailers for the @aafoodbank at four county park… https://t.co/eQUZKKXoWk|en|D|3|5
1250604876410892289|364415553|Thu Apr 16 02:00:12 +0000 2020|I joined my colleagues in the Maryland Congressional Delegation to announce more than $45 million to help Maryland… https://t.co/k6O0QN4jc5|en|D|5|9
1250193500622278656|364415553|Tue Apr 14 22:45:32 +0000 2020|The Maryland Congressional Delegation just announced more than $107 million in federal funding for Maryland airport… https://t.co/NKMatWIbhE|en|D|6|7
1250172227737305088|364415553|Tue Apr 14 21:21:00 +0000 2020|The Maryland Congressional Delegation today pressed the @SecAzar of @HHSGov to send additional federal resources to… https://t.co/LsYIOVp3iu|en|D|6|11
1250129520264458248|364415553|Tue Apr 14 18:31:18 +0000 2020|Today, the Maryland Congressional Delegation offered support and assistance to @MD_Labor to help ensure that Maryla… https://t.co/37uQWr6koE|en|D|0|4
1250076480870236160|364415553|Tue Apr 14 15:00:32 +0000 2020|Here are some of the latest updates from the last week regarding the coronavirus crisis. #COVID_19 https://t.co/j0LuIAVTdm|en|D|3|4
1249763112770768896|364415553|Mon Apr 13 18:15:20 +0000 2020|The Maryland Congressional Delegation announced more than $170 million in federal funding for Maryland’s higher edu… https://t.co/QlZL2I3zGF|en|D|3|6
1249763029065105409|364415553|Mon Apr 13 18:15:00 +0000 2020|In these extraordinarily difficult times, local organizations like @Parts_of_Peace offer a lifeline of hope (and hy… https://t.co/MwK1L6Lloy|en|D|4|6
1248774125042184192|364415553|Sat Apr 11 00:45:27 +0000 2020|The Maryland Congressional Delegation announced more than $742 million for Maryland hospitals and health care provi… https://t.co/hvbjACwxTZ|en|D|6|16
1248748994676875266|364415553|Fri Apr 10 23:05:35 +0000 2020|Here’s a quick update on direct payments (rebates) for Maryland individuals and families.|en|D|7|8
1248702301671428102|364415553|Fri Apr 10 20:00:03 +0000 2020|More federal funding to help Maryland respond to #COVID_19. https://t.co/uH8g5ohSV7|en|D|3|4
1248693576776769537|364415553|Fri Apr 10 19:25:22 +0000 2020|The Maryland Congressional Delegation urged President Trump to swiftly approve a National Governors Association req… https://t.co/y9hU46cqdZ|en|D|17|29
1248347558394695694|364415553|Thu Apr 09 20:30:25 +0000 2020|To our nation’s doctors, nurses, health care professionals, first responders, grocery store workers, delivery drive… https://t.co/C1B5FOTarA|en|D|7|13
1248243035919413248|364415553|Thu Apr 09 13:35:05 +0000 2020|This year, we draw special strength from the observance of our faith traditions. The celebrations of Passover, East… https://t.co/qV98bfN9O9|en|D|4|23
1248069821604007942|364415553|Thu Apr 09 02:06:48 +0000 2020|"Rumors and misinformation about #COVID_19 have proliferated over social media platforms and across the internet.

T… https://t.co/bgE8uv2K2F"|en|D|9|10
1247998961790541824|364415553|Wed Apr 08 21:25:13 +0000 2020|The Maryland Congressional Delegation today urged the Trump Administration to immediately deliver funding authorize… https://t.co/tjwocLoXaY|en|D|8|13
1247941053509967872|364415553|Wed Apr 08 17:35:07 +0000 2020|Last week, I held a telephone town hall with representatives from @SBAgov and @MD_Labor to discuss the economic rel… https://t.co/9YeESEZPIF|en|D|2|3
1247884462647435265|364415553|Wed Apr 08 13:50:15 +0000 2020|My colleagues and I in the Maryland Congressional Delegation just announced $15,635,030 to help Maryland’s Communit… https://t.co/AgIeorsxaJ|en|D|6|14
1247616424081842177|364415553|Tue Apr 07 20:05:09 +0000 2020|As we address the public health and economic impacts of the #COVID_19 crisis, we must expand food assistance progra… https://t.co/NpyEIuYEA9|en|D|3|4
1247555996618276866|364415553|Tue Apr 07 16:05:02 +0000 2020|Great joining @JulieMason on @POTUSPressPool yesterday to discuss the #CARESAct and the ongoing federal response to… https://t.co/vffqpuf91Y|en|D|2|4
1247522032851529728|364415553|Tue Apr 07 13:50:05 +0000 2020|The Maryland Congressional Delegation announced $6.4 million in federal funding to support our state's health care… https://t.co/dXI6q6SiR0|en|D|3|9
1246577994975662080|364415553|Sat Apr 04 23:18:48 +0000 2020|.@LBHealth in Baltimore needs volunteers over the next several weeks to help make masks for health care providers.… https://t.co/RokIHgAxPl|en|D|10|5
1246229933363539968|364415553|Sat Apr 04 00:15:44 +0000 2020|"A quick video message to close out the week.

Be safe. Be well. https://t.co/jX1vnG6czW"|en|D|9|30
1246174397922230272|364415553|Fri Apr 03 20:35:03 +0000 2020|To fight #COVID_19 and to save lives, Marylanders are making significant sacrifices. I want to thank you and your f… https://t.co/c55y2ALgRc|en|D|3|14
1246138124813709312|364415553|Fri Apr 03 18:10:55 +0000 2020|As the number of #COVID_19 cases and deaths continue to rise, it’s incredibly important for all of us to follow the… https://t.co/mvs5RwNSbI|en|D|4|4
1245874909076693000|364415553|Fri Apr 03 00:45:00 +0000 2020|With the bipartisan #CARESAct, we delivered critical resources to our frontline health care workers. Moving forward… https://t.co/UY7kvOUb1v|en|D|6|14
1245847264448438272|364415553|Thu Apr 02 22:55:09 +0000 2020|The Maryland Congressional Delegation urged @fema to fulfill Maryland’s request for critical medical supplies to fi… https://t.co/FuyZYgRPUR|en|D|2|7
1245844710222110720|364415553|Thu Apr 02 22:45:00 +0000 2020|The #CARESAct provides $350 billion in forgivable loans and $10 billion in grants for small businesses and nonprofi… https://t.co/lEykNLf4BI|en|D|4|4
1245825836525199367|364415553|Thu Apr 02 21:30:00 +0000 2020|For many Marylanders, the #COVID_19 crisis presents several obstacles to accessing safe and nutritious meals. To le… https://t.co/MwvhBwtT0I|en|D|2|3
1245805726863368192|364415553|Thu Apr 02 20:10:05 +0000 2020|.@HouseDemocrats are working to put #FamiliesFirst as we respond to the coronavirus crisis. To learn more about the… https://t.co/t9trBGbDL2|en|D|3|4
1245532678952300544|364415553|Thu Apr 02 02:05:06 +0000 2020|The @StateDept has issued a Level 4 Global Travel Advisory, which strongly cautions Americans abroad that if they d… https://t.co/jPuI47Tpbn|en|D|11|14
1245508794458701825|364415553|Thu Apr 02 00:30:11 +0000 2020|If you’re looking for something to do while you stay at home and help stop the spread of the #coronavirus, I encour… https://t.co/guC5TFr2OI|en|D|4|8
1245497421850787840|364415553|Wed Apr 01 23:45:00 +0000 2020|UPDATE: @MarylandConnect – our state’s health insurance marketplace – has extended its coronavirus special open enr… https://t.co/IqRvGqlTTY|en|D|23|24
1245430742714322946|364415553|Wed Apr 01 19:20:02 +0000 2020|On Friday, April 3 at 12:30 PM, I’m hosting a telephone town hall to share information about the economic relief av… https://t.co/aH7g3xYHvs|en|D|2|9
1245020826954600448|364415553|Tue Mar 31 16:11:11 +0000 2020|The Maryland Congressional Delegation just announced $48,404,965 to help counties and cities in Maryland respond to… https://t.co/VO4pVHhAcY|en|D|9|10
1244741366464360451|364415553|Mon Mar 30 21:40:42 +0000 2020|I know that many Marylanders are interested in learning more about the one-time payments (rebates) that will be sen… https://t.co/nI7DL0E4Bz|en|D|6|12
1244650679957946369|364415553|Mon Mar 30 15:40:21 +0000 2020|The State of Maryland has issued a “Stay at Home” order for all residents. It will go into effect at 8:00 PM this e… https://t.co/6RLHMjPMkH|en|D|17|21
1244305839126646789|364415553|Sun Mar 29 16:50:04 +0000 2020|The Maryland Congressional Delegation just announced that the federal government will cover the full cost of deploy… https://t.co/wsGKL4q5cT|en|D|6|9
1243686986587820036|364415553|Fri Mar 27 23:50:58 +0000 2020|A few words on today's passage of the CARES Act, a bipartisan stimulus package that will deliver robust resources t… https://t.co/Vpfd0oKzPY|en|D|4|12
1243677932893212674|364415553|Fri Mar 27 23:15:00 +0000 2020|Yesterday, I joined the Maryland Congressional Delegation in announcing $1,194,822 in federal funding to help Commu… https://t.co/rRue8FRDFc|en|D|4|9
1243654213927829504|364415553|Fri Mar 27 21:40:45 +0000 2020|Here’s a brief recap of recent developments at the federal, state and local levels to address the coronavirus pande… https://t.co/iyFmJQdy7A|en|D|1|3
1243596173828591616|364415553|Fri Mar 27 17:50:07 +0000 2020|Over the last several weeks, Congress has acted swiftly to address the coronavirus crisis by helping shore up Ameri… https://t.co/ll69BOBbit|en|D|0|5
1243362129274482688|364415553|Fri Mar 27 02:20:06 +0000 2020|More good news for Maryland in our fight against the coronavirus. #COVID_19 https://t.co/Il0zNTzm35|en|D|1|6
1242998570271342592|364415553|Thu Mar 26 02:15:27 +0000 2020|As we celebrate #MarylandDay today – at a distance from one another, of course – let’s take this opportunity to rem… https://t.co/jKSeYYPFzM|en|D|3|18
