id|user|created_at|text|lang|label|retweet_count|favorite_count
1106014477370167296|310310133|Thu Mar 14 02:09:34 +0000 2019|Today I spoke on the House Floor in strong support of H.Res. 206 to acknowledge the loopholes in our financial transaction laws pose a national security threat to America.|en|D|4|26
1105643105661972480|310310133|Wed Mar 13 01:33:52 +0000 2019|Wells Fargo fired 5,300 employees for following company policy. Make no mistake 5,300 people don’t go rogue together, they were simply doing their jobs. Despite Wells Fargo’s criminal actions, they're the 12th biggest bank in the world. These megabanks must be held accountable. https://t.co/Ged5S9ZsVa|en|D|19|73
1105639836994756609|310310133|Wed Mar 13 01:20:53 +0000 2019|I am amazed at the willful and shameful conduct of Wells Fargo. They did not make a mistake. They did not have errors in business. They robbed their customers - the very people who came to their bank and trusted them with their money. There is something deeply sinister in that. https://t.co/PsTLcmGzkX|en|D|15|78
1105629754454147073|310310133|Wed Mar 13 00:40:49 +0000 2019|Today my @FSCDems colleagues and I spoke with #WellsFargo CEO Tim Sloan about Wells Fargo’s consumer abuses and damaging activities.|en|D|5|9
1105559943967576065|310310133|Tue Mar 12 20:03:25 +0000 2019|Advancements in our aircraft and guidance systems allow us to reroute commercial aircraft over Boston Harbor instead of over towns and neighborhoods. This would minimize noise and emission exposure to surrounding communities.|en|D|6|12
1105558764600602625|310310133|Tue Mar 12 19:58:44 +0000 2019|When I was President of the Iron Workers Union I was always worried about the safety of our men and women, and after the recent aviation tragedies I am nervous about the safety of my constituents who live beneath Logan Airport flight paths. https://t.co/CLmX2zl5nF|en|D|9|27
1105515669414649856|310310133|Tue Mar 12 17:07:29 +0000 2019|Today our @TransportDems Aviation Subcommittee held the first hearing on the future of U.S. Aviation and exploring the different ways the FAA, NASA and NAS can make our aviation system safer and better for the environment. #Aviation2050|en|D|5|10
1104875015361712128|310310133|Sun Mar 10 22:41:45 +0000 2019|Great to attend Representative Jamie Murphy’s Annual St. Patrick’s Day Breakfast in Weymouth. Always enjoy spending time with my friends  @Braintreemayor Joe Sullivan and Boston Mayor @marty_walsh https://t.co/aRYPCsZl9I|en|D|3|36
1104835376471031808|310310133|Sun Mar 10 20:04:15 +0000 2019|Wonderful time at Senator Mike Rush’s Annual St. Patrick’s Day Brunch at the Corrib Pub this morning. Great food, Irish Step dancers, music by the world-famous Curragh’s Fancy, and enjoyed seeing all my friends from West Roxbury, Dedham and Parkway Community. @SenatorMikeRush https://t.co/XUgdwek8Ex|en|D|7|22
1104438099461984256|310310133|Sat Mar 09 17:45:37 +0000 2019|Had a grand time at the Tom and Eddie Butler St. Patrick’s Senior Salute, a fun event with Corned Beef and Cabbage and Irish music. https://t.co/WlaRmTUtDV|en|D|1|23
1104097957417271296|310310133|Fri Mar 08 19:14:00 +0000 2019|(1/2) I have lived my entire life surrounded by strong women. As the only son I was blessed with a courageous Mom (who was a welder during WWII), five wonderful sisters who I remain thankful for their guidance... #InternationalWomensDay|en|D|3|29
1104075973803294720|310310133|Fri Mar 08 17:46:39 +0000 2019|My White House Ethics Transparency Act, included in #HR1 will ensure the American ppl know who is working behind closed doors in their government &amp; will stop fed agencies from being flooded w/former lobbyists &amp; consultants whose previous work present serious conflicts of interest|en|D|1|14
1104075091346894849|310310133|Fri Mar 08 17:43:09 +0000 2019|#HR1 includes my Bill, the White House Ethics Transparency Act, which will require the Trump and future Admins to promptly disclose waivers of executive branch ethics rules to the Office of Government Ethics – an independent agency that is authorized to ensure ethics compliance.|en|D|6|19
1104073601286897664|310310133|Fri Mar 08 17:37:13 +0000 2019|I'm proud to see #HR1 pass the House today, a bold ethics reform package created to end the culture of corruption that has overtaken our Nation's capital. We promised to restore our democracy &amp; bring transparency &amp; accountability to Washington &amp; this is a first step #ForThePeople|en|D|7|30
1103836337961140224|310310133|Fri Mar 08 01:54:25 +0000 2019|The Consumer Financial Protection Bureau is a critically important agency that must be fully empowered to serve as an independent watchdog &amp; protect American consumers. Today @FSCDems reviewed the many harmful decisions Trump Admin appointees have made at @CFPB. #ConsumersFirst|en|D|16|34
1103803794226380802|310310133|Thu Mar 07 23:45:06 +0000 2019|I represent a district that includes coastal towns regularly impacted by climate change &amp; have issues w/their water supply b/c of the age of those systems. It’s encouraging to hear concern &amp; commitment to our states’ revolving funds to address this issue. https://t.co/tlCl6mxAJs|en|D|6|18
1103789036605448192|310310133|Thu Mar 07 22:46:28 +0000 2019|Today the @TransportDems Water Resources and Environment Subcommittee held our first hearing on how Federal infrastructure investment can help communities modernize water infrastructure and address affordability challenges.|en|D|2|9
1103758753432768513|310310133|Thu Mar 07 20:46:08 +0000 2019|It’s disheartening over the last 2 years America's #drugcrisis has become a partisan issue, it wasn't always this way. To Dir. Carroll of @ONDCP I just had one request – please work with us to address the opioid epidemic because people are dying out there. https://t.co/oeZ9Wcp09y|en|D|2|11
1103741003624796160|310310133|Thu Mar 07 19:35:36 +0000 2019|Today @OversightDems are examining the Trump Administration’s response to the drug crisis and the urgency for bipartisan action. #DrugCrisis|en|D|4|41
1103673581869899776|310310133|Thu Mar 07 15:07:41 +0000 2019|This week the House is considering #HR1 which will strengthen our democracy by making it easier to vote, reducing influence of big money donors in politics &amp; fighting corruption to ensure public officials are working for the interest of the American people, not special interests.|en|D|13|29
1103484158200950785|310310133|Thu Mar 07 02:34:59 +0000 2019|(1/4) Today @OversightDems examined “GAO’s 2019 High Risk Report”, which determines those areas of government that pose the highest risk. I questioned the decision to grant top secret clearance to Jared Kushner.|en|D|14|36
1103027897470730240|310310133|Tue Mar 05 20:21:58 +0000 2019|Attended a series of briefings today at the International Monetary Fund HQ with Chairwoman Waters &amp; my @FSCDems colleagues to discuss how the US can help promote global financial stability &amp; sustainable growth. Thank you Dir. Christine Lagarde &amp; IMF officials for your hospitality|en|D|2|11
1103016872168050688|310310133|Tue Mar 05 19:38:10 +0000 2019|Thank you @NECouncil Pres. Jim Brett for hosting another wonderful New England Council Annual Congressional Roundtable this morning. Great to speak with everyone &amp; discuss important issues such as healthcare, infrastructure &amp; the upcoming agenda for Financial Services Committee. https://t.co/39g0fX9tT5|en|D|1|8
1102971265755897858|310310133|Tue Mar 05 16:36:56 +0000 2019|A belated congratulations to Ambassador Ray and Cathy Flynn and the entire Flynn family for receiving the Paraclete Center Founders’ Award for your selfless devotion to the South Boston community. https://t.co/NR2O5Ctt5c|en|D|1|27
1102758841396219904|310310133|Tue Mar 05 02:32:50 +0000 2019|Wonderful to attend the Boston Marine Industrial Park Business Association annual meeting at the Boston Design Center this evening. https://t.co/GUMbnC7J6y|en|D|2|11
1102582367179419649|310310133|Mon Mar 04 14:51:35 +0000 2019|I joined Fox News America’s News HQ Show to discuss Michael Cohen’s testimony to the Oversight Committee and our commitment to ensure President Trump obeys the rule of law. We will get to the truth. https://t.co/zEFNqfO613|en|D|3|9
1102343831620648960|310310133|Sun Mar 03 23:03:44 +0000 2019|Great to attend the Newmarket Business Association Annual Meeting and Charity Fundraiser last week. Thank you to Executive Director Sue Sullivan, President Michael Rothchild and John Fish &amp; Suffolk Construction for your kindness and hospitality. @NewmarketBoston https://t.co/Jnpg2UuS24|en|D|2|12
1102010606759088128|310310133|Sun Mar 03 00:59:37 +0000 2019|Wonderful time at the Annual Chief Marshal’s Banquet, and congratulations to this year’s Chief Marshal Lt. Colonel John Beatty, US Army who served our country for 23 years. Thank you @SBAWVC for hosting - great way to kick off the month of St. Patrick’s Day celebrations! https://t.co/dhPGud8uuC|en|D|4|29
1101919469620916228|310310133|Sat Mar 02 18:57:28 +0000 2019|(1/2) Great to be at the Jimmy Flaherty Kick-Off Breakfast this morning. It was an honor to present the Henry Knox Unsung Hero Award to my friend Fran Dempsey, who owns one of the most trustworthy, helpful and reliable auto repair shops in South Boston. https://t.co/1myPDciMA3|en|D|3|19
1101239406797697024|310310133|Thu Feb 28 21:55:09 +0000 2019|Proud to join my colleagues to pass #HR1112 which would enforce a new process that allows the FBI more time to conduct a thorough background check on firearm purchases, extending the hurried 3-day period to a 10-day investigation. Another commonsense Bill to combat gun violence.|en|D|7|64
1101230682314100737|310310133|Thu Feb 28 21:20:29 +0000 2019|Yesterday the House passed #HR8 which would require universal background checks on all potential gun sales so individuals who are a danger to themselves and others are no longer able to purchase a gun. This is the first major legislation passed to address gun control since 1994.|en|D|15|92
1100940881337692162|310310133|Thu Feb 28 02:08:55 +0000 2019|Tune in to CNN Prime Time with @ChrisCuomo to hear me discuss Michael Cohen’s testimony in the Oversight Committee today.|en|D|4|53
1100894472471306246|310310133|Wed Feb 27 23:04:30 +0000 2019|Republicans ran away from the truth, and now Democrats are trying to bring the truth to the American people. #CohenTestimony https://t.co/ZhQZwj6yP0|en|D|156|574
1100893478228242432|310310133|Wed Feb 27 23:00:33 +0000 2019|For two years, House Republicans refused to bring any of Trump’s convicted or indicted associates before the Oversight Committee, so today for the first time during the Trump administration, we have one witness who voluntarily is coming forward to testify. @OversightDems|en|D|145|630
1100830300786094080|310310133|Wed Feb 27 18:49:30 +0000 2019|Today the @OversightDems are hearing Michael Cohen’s testimony regarding conflicts of interest and illegal payments involving President Trump. The American people deserve to know the truth about their President’s actions and character. No more lies. https://t.co/0LW9TPofDu|en|D|75|312
1100575640020045824|310310133|Wed Feb 27 01:57:34 +0000 2019|Today in @TransportDems we pushed back on the use of the RNAV NextGen flight system used at Logan Airport, which forces tens of thousands of planes to use the exact same flight paths over the Towns of Milton, Hull, Dorchester &amp; South Boston when landing. https://t.co/jOX4FZa2EE|en|D|3|19
1100493001120497665|310310133|Tue Feb 26 20:29:12 +0000 2019|(1/2) Today @OversightDems voted to issue subpoenas to require DOJ, HHS and DHS to provide information about the children that were separated from their parents during the Trump Administration’s child separation policy.|en|D|33|103
1100470468828712965|310310133|Tue Feb 26 18:59:40 +0000 2019|Today @TransportDems are holding a hearing on how investing in federal infrastructure resiliency could help mitigate the impacts of climate change. During recent epic storms we have seen firsthand how the Commonwealth’s critical infrastructure has been threatened and undermined. https://t.co/ORcMNcVhED|en|D|3|6
1099356013713596416|310310133|Sat Feb 23 17:11:13 +0000 2019|Always enjoy joining Jim Braude and Margery Eagan on WGBH Boston Public Radio. This week we discussed the Mueller investigation, my priorities as Chairman of the National Security subcommittee and other Oversight Committee responsibilities: https://t.co/HaArriHfzy|en|D|3|20
1098975579083280384|310310133|Fri Feb 22 15:59:30 +0000 2019|Proud to join my colleagues as a cosponsor of the H.J. Resolution 46 to prevent the President from removing funding from existing programs for National Defense that were authorized by Congress and he already approved.|en|D|9|35
1098666566663712768|310310133|Thu Feb 21 19:31:36 +0000 2019|ABC Dallas News did a story about why a small town with no airport has over 1,000 registered aircrafts. My Bill, the Aircraft Ownership Transparency Act, would help address these serious national security risks posed by our aircraft registration system. https://t.co/YSbNc3lu1I|en|D|13|40
1098363071242874880|310310133|Wed Feb 20 23:25:37 +0000 2019|"Tune in to NECN's ""The Take"" with Sue O'Connell tonight at 7pm and 10:30pm where I will discuss global and national security issues."|en|D|0|0
1097972200760578049|310310133|Tue Feb 19 21:32:26 +0000 2019|Extremely concerned by multiple whistleblower reports that President Trump is actively planning to deliver Nuclear technology to Saudi Arabia.  This would violate federal law and put our National Security at grave risk. Borderline insanity. @RepCummings @OversightDems|en|D|162|364
1097895886519181313|310310133|Tue Feb 19 16:29:11 +0000 2019|(1/2) In response to the proposed Weymouth Compressor Station and the West Roxbury lateral pipeline, I have been in frequent discussions with the Pipeline and Hazardous Materials Safety Administration.|en|D|1|4
1097193514788626432|310310133|Sun Feb 17 17:58:13 +0000 2019|Great to take a moment to converse with Lt. General Christopher Cavoli, the Commanding General of the U.S. Army Europe, at the Munich Security Conference Sunrise Breakfast, where I spoke briefly to assembled ministers about the US commitment to NATO. https://t.co/KFvNKWvexh|en|D|4|24
1096871452471640064|310310133|Sat Feb 16 20:38:27 +0000 2019|(1/2) The Boston Housing Authority, Brockton Housing Authority and Quincy Housing Authority are among the first public housing authorities in New England.|en|D|2|23
1096253355343646720|310310133|Fri Feb 15 03:42:21 +0000 2019|Massachusetts lost over 1,500 lives to opioids last year, a tragic epidemic that has swept the entire Nation. I am pleased to report the Funding Bill that we passed tonight includes $347M for local grant programs to help address the opioid crisis.|en|D|7|27
1096237980791070721|310310133|Fri Feb 15 02:41:16 +0000 2019|(2/2) .. as well as disabled/handicapped housing and funding for our state and local law enforcement with $423M Byrne JAG grants and $303M for Community Oriented Policing Services (COPS) Program grants.|en|D|2|6
1096237526283632641|310310133|Fri Feb 15 02:39:28 +0000 2019|(1/2) Congress passed a strong, bipartisan funding bill tonight to prevent another senseless government shutdown. This Bill invests in critical needs such as national security, rebuilding roads and bridges, addressing the opioid abuse, creating senior housing...|en|D|3|16
1096091933167050752|310310133|Thu Feb 14 17:00:55 +0000 2019|(1/2) Today marks one year since the worst high school shooting in American history, where 14 students &amp; 3 staff members lost their lives in a senseless tragedy in Parkland, FL. We can honor them by passing common sense gun reforms to #EndGunViolence -|en|D|4|15
1096061557904211969|310310133|Thu Feb 14 15:00:13 +0000 2019|Climate change must become a bipartisan national security priority now. Rapidly rising sea levels threaten our power grid, our water systems and vital infrastructure. That is why I introduced my Bill, the Climate Change National Security Strategy Act, H.R. 1201.|en|D|2|13
1095852831750406151|310310133|Thu Feb 14 01:10:49 +0000 2019|Last month I signed on as a cosponsor of #HR8, the Bipartisan Background Checks Act of 2019. This is a first step to combat gun violence, which killed nearly 40,000 Americans last year. Requiring background checks on all firearm sales is a commonsense law we must implement now.|en|D|10|60
1095799005089546240|310310133|Wed Feb 13 21:36:56 +0000 2019|(1/2) @FSCDems held our first full hearing on homelessness in America. Despite our best efforts, Massachusetts still has over 1,000 homeless Veterans. The #EndHomelessness Act would provide grants to help states and local authorities better align..|en|D|2|7
1095762192023126019|310310133|Wed Feb 13 19:10:39 +0000 2019|I’m proud that my Democratic colleagues kept fighting and refused to surrender to someone who showed such blatant disrespect for America’s workers. https://t.co/5rk0fL6Bbk|en|D|2|25
1095760752537944065|310310133|Wed Feb 13 19:04:56 +0000 2019|It was the President’s reckless and irresponsible decision to shut the government down and use federal workers as hostages, forcing air traffic controllers and TSA employees to work without pay. https://t.co/63p2iQ5ohF|en|D|4|15
1095721732298690561|310310133|Wed Feb 13 16:29:53 +0000 2019|Today the Subcommittee on Aviation held our first hearing about the impacts of President Trump’s shutdown on U.S. Aviation where I spoke in strong support of H.R. 1108, which would allow the airline industry to operate during government shutdowns. @TransportDems|en|D|1|9
1095457198120099840|310310133|Tue Feb 12 22:58:43 +0000 2019|Today my colleagues and I took legislative action to address the spate of mass shootings in America and introduced the Keep Americans Safe Act. This Bill would prohibit the transfer, importation and possession of magazines able to hold more than 10 rounds of ammunition.|en|D|5|38
1095420245681061889|310310133|Tue Feb 12 20:31:53 +0000 2019|Proud to join my colleagues as a co-sponsor of the Family And Medical Insurance Leave Act, which would create a strong and inclusive national family and medical leave insurance program. #FAMILYAct|en|D|4|19
1095119572976496641|310310133|Tue Feb 12 00:37:07 +0000 2019|Very thankful for the support of my House colleagues today in passing my Bill, the Social Media Use in Clearance Investigations Act, which now heads to the Senate.|en|D|3|12
1094778858442838017|310310133|Mon Feb 11 02:03:14 +0000 2019|(1/2) Deeply saddened to learn of the passing of my friend and colleague Walter Jones (R-NC). Walter was a good and decent man and an exemplary public servant. A true gentleman and a credit to the people of North Carolina who chose to send him to Congress.|en|D|3|27
1094660831877517318|310310133|Sun Feb 10 18:14:14 +0000 2019|Wonderful time at the 31st Annual Lunar New Year Festival in Quincy, great turnout enjoying all the food and entertainment to celebrate the New Year of the Pig. https://t.co/2CAGYIwzPZ|en|D|2|17
1093942846627958784|310310133|Fri Feb 08 18:41:13 +0000 2019|Glad to see the Veterans’ Access to Child Care Act passed in the House this morning, which will make the VA’s child care pilot program permanent and expand it nationwide, ensuring lack of child care will never prevent our veterans from receiving critical VA services. @VABostonHC|en|D|6|17
1093924240779288576|310310133|Fri Feb 08 17:27:17 +0000 2019|Very saddened to learn of the passing of U.S. Rep. John D. Dingell.  John was a WWII Veteran and rendered distinguished service as member of Congress for 59 years.  Our prayers and thoughts go out to his wife, U.S. Rep. Debbie Dingell and to their family. @RepDebDingell|en|D|3|8
1093707000414900230|310310133|Fri Feb 08 03:04:03 +0000 2019|(1/2) Thank you Governor Walz, Mayor Garcetti and Former US DoT Secretary LaHood for your testimony and providing your thoughts on my proposal to have infrastructure priorities come from state and local governments as a way to strengthen the connection between local communities..|en|D|4|4
1093589155823652869|310310133|Thu Feb 07 19:15:47 +0000 2019|(1/2) Great to attend the first full Committee on Transportation and Infrastructure hearing, where we are tasked with rebuilding America’s infrastructure. According to the DoT, Massachusetts recently had 483 bridges that were classified as “structurally deficient”. https://t.co/92BIdLV4gs|en|D|2|8
1093250855632027650|310310133|Wed Feb 06 20:51:30 +0000 2019|I have heard firsthand from my constituents how debilitating airplane noise can be for those who live under flight paths, and the Air Traffic Noise and Pollution Expert Consensus Act is a first step to addressing this widespread problem. https://t.co/qUwFEYmh6o|en|D|1|6
1093250320489172993|310310133|Wed Feb 06 20:49:22 +0000 2019|Glad to see my Bill, H.R. 976, the Air Traffic Noise and Pollution Expert Consensus Act, was introduced in the House yesterday, which will require the FAA to sponsor an Expert Consensus Report on the health effects of airplanes flying over residential areas.|en|D|2|13
1093193322301177856|310310133|Wed Feb 06 17:02:53 +0000 2019|Early on the White House refused to say whether and when they had given ethics waivers to various lobbyists to go to work in the Trump administration, and my Bill, the White House Ethics Transparency Act in #HR1 will prevent this from happening in the future. #ForThePeople https://t.co/WmDLWahxvH|en|D|32|121
1093174249869721600|310310133|Wed Feb 06 15:47:06 +0000 2019|HR1 includes my Bill, the White House Ethics Transparency Act, to maximize transparency and accountability by requiring the Trump and future Administrations to promptly disclose waivers of executive branch ethics rules to the Office of Government Ethics. #ForThePeople #HR1 https://t.co/MbNxJ0GdP7|en|D|24|58
1093173953785401344|310310133|Wed Feb 06 15:45:55 +0000 2019|The Committee on Oversight and Reform held a hearing this morning on H.R.1, the #ForThePeople Act, to restore the promise of American democracy by making it easier to vote, ending the dominance of big money in politics and fighting to end corruption in our government. #HR1|en|D|6|26
1092594560222539776|310310133|Tue Feb 05 01:23:37 +0000 2019|(1/2) Very saddened to learn that Gary LaPierre has passed. A long time journalist with WBZ Radio, Gary was a class act - a true gentleman in what can be a tough business. In Politics, some days you’re pitching and on other days you’re catching.|en|D|5|25
1091453359461228546|310310133|Fri Feb 01 21:48:53 +0000 2019|(1/2) Great to get back to the Committee on Financial Services for the 116th Congress this week. I was appointed to the National Security, International Development and Monetary Policy Subcommittee and the Oversight and Investigation Subcommittee.|en|D|3|14
1091404624999968769|310310133|Fri Feb 01 18:35:14 +0000 2019|I am happy to see the House passed H.R.790, the Federal Civilian Workforce Pay Raise Fairness Act of 2019, to provide federal civilian employees a 2.6% pay increase. I spoke on the House Floor earlier this week to voice my strong support of the Bill: https://t.co/BI5fQwy6Yk|en|D|1|13
1091362709755609088|310310133|Fri Feb 01 15:48:41 +0000 2019|(1/3) In response to the fire that occurred at the Michigan Compressor Station, I have already contacted PHMSA for a full report on what the cause may have been and damages incurred.  The PHMSA review is in progress.|en|D|2|5
1091173233116790784|310310133|Fri Feb 01 03:15:46 +0000 2019|(1/2) Great to join Mayor Walsh, Councilors Flaherty and Flynn and Rep Biele at the Boston Sword and Tuna groundbreaking event at the Massport Marine Terminal. As one of the largest seafood distributors in the U.S... https://t.co/vmjiohTqbc|en|D|0|11
1090993779681751040|310310133|Thu Jan 31 15:22:41 +0000 2019|Yesterday we reintroduced the Paycheck Fairness Act, H.R. 7, to make equal pay a law and add protections to the Equal Pay Act of 1963 and the Fair Labor Standards Act. #PaycheckFairness #EqualPay|en|D|0|9
1090721498485178371|310310133|Wed Jan 30 21:20:44 +0000 2019|Proud to cosponsor the Social Security 2100 Act, H.R. 860, which will expand benefits, strengthen the system and cut taxes for over 10 million seniors throughout the 21st century. #SocialSecurity #Secure2100 https://t.co/dMlzah3Mx6|en|D|8|23
1090663998670934016|310310133|Wed Jan 30 17:32:15 +0000 2019|(1/3) This morning I spoke on the House floor in support of a very fair Bill to provide a modest 2.6% pay increase for federal civilian employees. Our TSA workers’ base starting salary is $28,000, which is less than I earned as an Ironworker apprentice boy in 1972.|en|D|8|30
1090429415882964994|310310133|Wed Jan 30 02:00:06 +0000 2019|(1/2) Great to meet the AARP members at our Oversight hearing today on Examining the Actions of Drug Companies in Raising Prescription Drug Prices. Thank you to all who testified on behalf of those affected by rising drug costs... https://t.co/aHfNUdlDYq|en|D|2|8
1090342060958380032|310310133|Tue Jan 29 20:12:59 +0000 2019|Wonderful to meet with 3 great Massachusetts District Attorneys; Jonathan Blodgett, Essex County; Michael O’Keefe, Cape and Islands; and Anthony Gulluni, Hampden to discuss loan forgiveness options for public service lawyers. https://t.co/A4HSqpQtXe|en|D|0|3
1090274168275382272|310310133|Tue Jan 29 15:43:12 +0000 2019|This morning in Congress we are convening the first hearing of the Committee on Oversight and Reform to fulfill our Constitutional responsibility to protect our democracy and ensure that the President is accountable to the people and that he follows the laws. It’s a new day.|en|D|12|77
