id|user|created_at|text|lang|label|retweet_count|favorite_count
1248690372949225475|1074129612|Fri Apr 10 19:12:39 +0000 2020|"If the Trump Admin is “inspired” by #DACA recipients who are essential workers then it should stop using them as political pawns. DACA is at risk because Trump terminated it.
Trump can drop the DACA case at SCOTUS &amp; extend protections while we recover from this crisis. https://t.co/0FFITqE8ZW"|en|D|1|5
1248351477585850369|1074129612|Thu Apr 09 20:46:00 +0000 2020|"ICYMI: check out the webinar hosted by @GDHCC where I discussed the #CARESAct and how the legislation will help North Texas small businesses. 

Please see here for our full #COVID19 talk 
---&gt; https: https://t.co/dxtFeENAbj"|en|D|1|0
1248327695005618178|1074129612|Thu Apr 09 19:11:29 +0000 2020|"🚨ATTENTION SMALL BUSINESSES AND NON-PROFITS🚨

Today at 4 PM, join me for a stimulus workshop w/ TX Rep. Lorraine Birabil, @SBAGOV, and the Texas Workforce Commission. 

To join online ⬇️
https://t.co/vsGox0PuO9

To join by phone ⬇️
DIAL: (253) 215-8782
MEETING ID: 61-229-2539"|en|D|2|1
1248310698901463042|1074129612|Thu Apr 09 18:03:57 +0000 2020|49% of Latinos have either taken a pay cut, been laid off, or lost their job due to the #COVIDー19 pandemic according to @pewresearch. Check out my website for unemployment information for job seekers and workers here: https://t.co/PpUbXnm6Mt|en|D|3|5
1248287401505689601|1074129612|Thu Apr 09 16:31:23 +0000 2020|Join me and the @arlingtontx at 1PM for a Facebook Live for updates on what’s going on at the Capitol and how we’re moving forward through this pandemic. Follow the link here to join: https://t.co/HarWssjfvw|en|D|2|2
1248055659322630147|1074129612|Thu Apr 09 01:10:31 +0000 2020|"This #Passover, let us be inspired by the strength and resilience of our Jewish community. 

Chag sameach to all who celebrate."|en|D|5|12
1248013317425127426|1074129612|Wed Apr 08 22:22:16 +0000 2020|If you or your family have COVID-19 symptoms, please do not fear from seeking help because you are not a citizen. Your local clinic, hospital, and public health offices are there to support you regardless of your status.|en|D|5|18
1247996512535080964|1074129612|Wed Apr 08 21:15:29 +0000 2020|We cannot turn our backs on the farm workers that put food on our tables. These essential workers deserve benefits and protection for feeding the nation. https://t.co/bwtczLdPR1|en|D|10|24
1247983071137316864|1074129612|Wed Apr 08 20:22:05 +0000 2020|HBCUS are critical to low-income and first- generation college students of color and their success. Yesterday, along with other members of Congress, I sent a letter requesting funds to strengthen and support these programs throughout this pandemic. Read our full letter here ⬇️ https://t.co/jQiEYGNkTO|en|D|2|6
1247956035228368900|1074129612|Wed Apr 08 18:34:39 +0000 2020|"I applaud today’s announcement that will secure critical funding that will help our health care clinics battle the COVID-19 pandemic, including those across our Dallas Fort Worth Metroplex. 

For more information about today’s announcement, visit here: https://t.co/DFFZNtYDIO https://t.co/LewVd0cMbx"|en|D|2|2
1247635564234498048|1074129612|Tue Apr 07 21:21:13 +0000 2020|Communities across our Metroplex are on the frontlines of this pandemic. I’m proud to support this legislation because it will ensure more funding for communities across North Texas and help fully address this health pandemic. Read my full statement here: https://t.co/NNojj4Ptyg|en|D|0|1
1247526393564377090|1074129612|Tue Apr 07 14:07:24 +0000 2020|"Charlie and I traveled to Germany together back in 2013. We were the only two members on the trip and got to know each other well. He is a great guy. Let’s all #StayAtHome  and practice #Physicaldistancing for Charlie today! #GuteBesserung
 
https://t.co/UVYWgm7VKq"|en|D|3|6
1247245056702103559|1074129612|Mon Apr 06 19:29:28 +0000 2020|The IRS will make about 60 million payments to Americans through direct deposit in mid-April. Please contact my office if you have any questions or concerns. The latest estimated timing from the IRS on economic impact checks ⬇️ https://t.co/TkZcA3c65C|en|D|9|7
1246197363418464262|1074129612|Fri Apr 03 22:06:19 +0000 2020|This afternoon, I sent a letter to small business owners in our district as Coronavirus relief loans become available today. Please check directly with your financial institution for more details. Read my full letter here: https://t.co/T3zGuBAYAn https://t.co/JNXBWzTKey|en|D|3|5
1246161757351149569|1074129612|Fri Apr 03 19:44:50 +0000 2020|The health of the Texas community is our priority. That is why I was proud to join the Texas delegation in urging our state officials to implement a vote-by-mail program for all elections in TX until the end of this year. Read our full statement here ⬇️ https://t.co/qHU2SWJ7s8|en|D|6|12
1245794931081383940|1074129612|Thu Apr 02 19:27:11 +0000 2020|"Texans must do everything they can to flatten the curve. I’m glad Governor Abbott listened to my colleagues and I and finally called for a much needed stay at home order that will help save lives.
https://t.co/H41s08vwpM"|en|D|1|8
1245743531689476096|1074129612|Thu Apr 02 16:02:57 +0000 2020|"Today at 2 pm CST, in partnership with @GDHCC, I will be participating in a webinar discussing the recently passed CARES Act (Coronavirus Aid, Relief and Economic Security Act) and how the legislation will help North Texas small businesses. 
Register here: https://t.co/Ehl6E1ZtNA"|en|D|1|1
1245456121986498566|1074129612|Wed Apr 01 21:00:53 +0000 2020|"Are you a North Texas small business owner that needs assistance? Make sure to join @GDHCC and I tomorrow for a discussion about the recently passed #CARESAct where we’ll answer your questions. 

Follow this link to register:
https://t.co/Ehl6E1ZtNA"|en|D|2|3
1245426194146877446|1074129612|Wed Apr 01 19:01:58 +0000 2020|We are proud to partner with @USCensusBureau to encourage a complete and accurate count for the #2020Census. Show that you support the 2020 Census by sharing this post or making the image your profile picture. Don’t forget to complete the census at https://t.co/JE0ELWa7pt! https://t.co/V9VKPTGVHu|en|D|1|3
1245407809807794177|1074129612|Wed Apr 01 17:48:55 +0000 2020|"Happy #CensusDay! 

Today is important, because whenever you complete your #2020Census, you should count everyone living (or sleeping) in your home most of the time as of April 1—whether you are related to them or not. 

Respond now at https://t.co/JE0ELWa7pt. https://t.co/EAGRsDVexn"|en|D|4|1
1245361332955877377|1074129612|Wed Apr 01 14:44:14 +0000 2020|"Today on #CensusDay, don’t miss your chance to ensure our community receives critical funding for hospitals, schools, and roads. The 2020 Census is our only chance in the next 10 yrs to get an accurate count of our communities.
Fill yours our TODAY at https://t.co/nqJDuKNnQc."|en|D|3|4
1245098505221390336|1074129612|Tue Mar 31 21:19:51 +0000 2020|This global crisis has shown us what we already knew: We are nothing without our workers. This #CesarChavezDay, let us thank and honor our nation’s workers—especially those on the front lines of this crisis. https://t.co/DaM9RE6mOv|en|D|2|3
1245065315303731201|1074129612|Tue Mar 31 19:07:58 +0000 2020|"The average woman in 2019 made just 81% of what her male counterpart earned.

Black women earned 67%.

Hispanic women earned 58%.

Now more than ever, we depend on our workers. ALL must receive #EqualPay. https://t.co/9rfDKjDyPM"|en|D|25|39
1245023665256828929|1074129612|Tue Mar 31 16:22:27 +0000 2020|"Our Constitution mandates that every person living in the U.S., not just citizens, must be counted through the census every ten years. 

Fill yours out today at https://t.co/nqJDuKNnQc. #WhyCensusMatters #Census2020"|en|D|8|5
1244757294451249155|1074129612|Mon Mar 30 22:44:00 +0000 2020|"If you have questions about the #CARESAct,  my office is here to help answer them.

For information and resources regarding COVID-19 and the CARES Act, check out my webpage here: https://t.co/PpUbXnm6Mt https://t.co/paGluREmrr"|en|D|3|1
1244736788217937920|1074129612|Mon Mar 30 21:22:31 +0000 2020|Our state’s leadership must be laser focused on combatting the Coronavirus pandemic. That is why I led a letter asking local officials to reconsider a ban stripping essential access to health care for Texas women. Read my full statement here: https://t.co/lPmTFQwfWj https://t.co/JchMviR2id|en|D|1|4
1244686224465571843|1074129612|Mon Mar 30 18:01:35 +0000 2020|"FACT: Legal protections ensure that data collected during the Census is kept confidential and cannot be traced back to any individual. Census data CANNOT be shared with other government agencies or outside groups. 

Fill yours out today at https://t.co/nqJDuKNnQc. #Census2020"|en|D|5|3
1243609582532005895|1074129612|Fri Mar 27 18:43:24 +0000 2020|I applaud the passage of the Families &amp; Workers-First Coronavirus legislation, which will bring urgently needed relief to families, workers and small businesses all across this country, including my great state of Texas. #CARESActStatement https://t.co/i4uP0k2MBV|en|D|13|26
1243243184651743234|1074129612|Thu Mar 26 18:27:28 +0000 2020|"I spoke to WFAA’s @JasonWhitely about the priorities of Congress during the coronavirus pandemic. We discussed rent relief, disaster checks, and resources for small businesses that need assistance during this trying time.  
Check out our conversation here: https://t.co/pGkVuyjylc"|en|D|4|4
1243175908028100610|1074129612|Thu Mar 26 14:00:08 +0000 2020|Small businesses are the backbone of our North Texas economy and we’re fighting to provide the resources they need during this tough time. Get more info about what help is available for small businesses in my resource guide below: https://t.co/04H3M1MUpD|en|D|5|5
1242964124562317312|1074129612|Wed Mar 25 23:58:35 +0000 2020|"On this National Medal of Honor Day, we celebrate the sacrifices of our Nation’s brave servicemembers and their brave efforts to keep our country safe.
https://t.co/uA9NxVrBp5"|en|D|1|0
1242940815665770498|1074129612|Wed Mar 25 22:25:57 +0000 2020|Our priority should be American workers and families impacted by the pandemic. That is why I joined over 50  of my colleagues to urge congressional leadership to include cash assistance to those living paycheck to paycheck. https://t.co/Dij845KObX|en|D|3|6
1242902908934344704|1074129612|Wed Mar 25 19:55:20 +0000 2020|"ATTENTION! Due to COVID-19, the Census Bureau has made adjustments to their #2020Census operations. For updated adjustments, read more here ⬇️
https://t.co/8XQX7b5iy3 https://t.co/W5UTWaxSD1"|en|D|0|1
1242880884015013889|1074129612|Wed Mar 25 18:27:49 +0000 2020|"There are now more COVID-19 drive-thru testing locations in the Metroplex. 

To find drive-thru screenings near you, click here: https://t.co/8Z0Lsm3oPN"|en|D|1|1
1242554682528202753|1074129612|Tue Mar 24 20:51:36 +0000 2020|"Is your small business impacted by COVID-19? If so, you may be eligible for economic assistance through the Small Business Administration. 

For more information, click here: https://t.co/HAtLZ0yo3c https://t.co/TmiNWg381h"|en|D|4|6
1242531518792249352|1074129612|Tue Mar 24 19:19:33 +0000 2020|To protect our most vulnerable, the Fort Worth and Tarrant County have issued a stay at home order. I urge our communities in these locations to avoid spreading COVID-19 by staying home when possible. https://t.co/BoagxT3LRs|en|D|2|4
1242513312090394624|1074129612|Tue Mar 24 18:07:13 +0000 2020|"COVID-19 testing sites in Dallas have lifted the age restriction &amp; updated testing criteria to include: shortness of breath, cough, and fever of 99.06 or higher. 

Locations:

- American Airlines Center, Parking Lot E, 2500 Victory Plaza

-Ellis Davis Field House, 9191 S Polk St"|en|D|34|39
1242212360607145984|1074129612|Mon Mar 23 22:11:20 +0000 2020|Today, on the 10th anniversary of the #AffordableCareAct, I joined 123 of my colleagues in sending a letter to President Trump urging him to protect the health care of all Americans during this global health crisis by ending the lawsuit that seeks to end the #ACA. https://t.co/6lcFtjLWS5|en|D|2|8
1242189374558740480|1074129612|Mon Mar 23 20:40:00 +0000 2020|Today, I introduced a bill that would provide relief to small businesses by granting flexibility to small business federal contractors and expediting the process so that affected contractors can begin generating revenue.  Full statement here: https://t.co/RJpbPmMMvd|en|D|5|8
1241113417467002880|1074129612|Fri Mar 20 21:24:32 +0000 2020|"🚨 Attention business owners in Texas 🚨
 
If your business suffered financially due to COVID-19, you may be eligible for a loan to help your business. More info can be found on SBA’s web page. https://t.co/xJkWqfwloc

Note: Site might be slow due to high volume of traffic. https://t.co/jZrvpkjCyr"|en|D|4|2
1241060536923684864|1074129612|Fri Mar 20 17:54:24 +0000 2020|Thank you to the hard  workers at our grocery stores ensuring our communities can access food during this emergency. https://t.co/wReOjycNWD|en|D|7|19
1240687771175419904|1074129612|Thu Mar 19 17:13:10 +0000 2020|CDC recomienda lavarse las manos para ayudar a prevenir la propagación del coronavirus. https://t.co/43ypGVLkkG|es|D|1|0
1240671553299402758|1074129612|Thu Mar 19 16:08:43 +0000 2020|The CDC recommends washing your hands to prevent the spread of coronavirus. https://t.co/tRf3DyEYUY|en|D|1|2
1240371626140631041|1074129612|Wed Mar 18 20:16:55 +0000 2020|As our country continues to fight COVID-19, I want to thank those at the front lines testing and treating patients. https://t.co/z4DzrQ7ZQI|en|D|9|22
1240352513636868096|1074129612|Wed Mar 18 19:00:58 +0000 2020|"#Census2020 is underway! Given the current public health crisis, one of the safest ways to respond is by phone now:
English: 844-330-2020
Spanish: 844-468-2020
Additional phone lines can be found here ⬇️ #WeCount
https://t.co/VXXU1a7VNl"|en|D|2|2
1240336657368432640|1074129612|Wed Mar 18 17:57:58 +0000 2020|"Thank you to those who dialed-in for our tele town hall. Our experts discussed preventing the spread of COVID-19 &amp; the importance of the #2020Census. I urge all communities in #DFW to stay informed. 

Please feel free to call our office if you have any questions. https://t.co/A0i6VEDK5s"|en|D|4|8
1240035180368130049|1074129612|Tue Mar 17 22:00:00 +0000 2020|"🚨 HAPPENING SOON 🚨
Live telephone town hall w/ experts to answer questions about COVID-19 &amp; the 2020 Census. 

Sign up and dial in here ⬇️ 
https://t.co/RSRNIfGHoq"|en|D|0|2
1240006875686543361|1074129612|Tue Mar 17 20:07:32 +0000 2020|Helping North Texas families and workers is a top priority of mine. That is why I support efforts like this that will help Americans across our country get the immediate financial assistance that they need during these times of economic insecurity. https://t.co/APNMwcI4l4|en|D|3|5
1239982331764428800|1074129612|Tue Mar 17 18:30:00 +0000 2020|While we are all dealing with the serious consequences of the Coronavirus, don’t forget that you will receive a #2020Census survey by March 20th.  Filling it out is vitally important to North Texas and I encourage you to do so when you can.|en|D|5|6
1239959285066543105|1074129612|Tue Mar 17 16:58:25 +0000 2020|"During this time of uncertainty, I urge the #DFW community to stay informed. Please join me at tonight's telephone town hall where we will answer questions about COVID-19 and the 2020 Census. 

Register here 👇
https://t.co/RSRNIfYiN0"|en|D|5|5
1239672916876439553|1074129612|Mon Mar 16 22:00:30 +0000 2020|Combatting COVID-19 and saving lives means we must ensure that no treatment option is overlooked. That's why I'm proud to lead a letter w/ @RepPerlmutter that calls on the FDA to repurpose existing drugs to fight against the virus. Full statement here: https://t.co/jz1epVPdRw|en|D|3|8
1239644311605727234|1074129612|Mon Mar 16 20:06:50 +0000 2020|"Tomorrow, I will be LIVE with professionals to talk to you about Coronavirus and the 2020 Census at 6:30 PM CT.

To join us, register here⬇️
https://t.co/RSRNIfYiN0 https://t.co/abIz3Oxbj4"|en|D|5|4
1239612776177434624|1074129612|Mon Mar 16 18:01:31 +0000 2020|Beginning today, @Parkland will offer drive-through COVID-19 testing by appointment for current Parkland patients who meet the medically necessary criteria. https://t.co/Kph14ulqOq|en|D|5|8
1238846698786611200|1074129612|Sat Mar 14 15:17:24 +0000 2020|"Proud to join my colleagues to pass essential legislation that will help North Texas workers and families get resources like paid sick leave, food assistance and free Coronavirus testing during this time of crisis. 

https://t.co/zjX2iUdRha"|en|D|5|9
1238552180434616322|1074129612|Fri Mar 13 19:47:05 +0000 2020|It is important to keep calm, work together and follow what the experts are saying so we can address this crisis and keep our Metroplex healthy. Read more here: https://t.co/L4cGZypQu4|en|D|3|2
1238528915280453633|1074129612|Fri Mar 13 18:14:38 +0000 2020|"Did you know that children have historically been undercounted in the Census?

We need to get it right in #Census2020 so that every child gets the education funding and resources they need for the next 🔟 years. It’s up to all of us to make sure #WeCount!
https://t.co/6hKmijAWbY"|en|D|4|10
1238504818198679554|1074129612|Fri Mar 13 16:38:53 +0000 2020|"To protect the health and safety of our visitors, we have temporary suspended our tour services. 

Check my website to see the status of the other tour sites in DC.  
https://t.co/JWddRyBpIv"|en|D|3|4
1238224841519570947|1074129612|Thu Mar 12 22:06:21 +0000 2020|Today, Census questionnaires will begin arriving via mail with information on how to respond to the 2020 Census.  Remember that an accurate count of the #2020Census ensures funding for medical assistance programs, preventive health services, and hospitals. https://t.co/UWo6Okf0SL https://t.co/O9s188wq8D|en|D|8|5
1238197354274185217|1074129612|Thu Mar 12 20:17:08 +0000 2020|"Being informed and changing our actions now will save lives in the days to come. Please prepare and stay informed. 

I’ve added resources in both English and Spanish to my web page here⬇️https://t.co/PpUbXnm6Mt"|en|D|15|47
1237850134173511682|1074129612|Wed Mar 11 21:17:24 +0000 2020|Today, #SCOTUS upheld an abusive policy that turns its back on both due process and asylum seekers seeking our country’s protection. Trump’s #MPP will continue to jeopardize those that are vulnerable to violence and uncertainty in Mexico. https://t.co/HeSPwkRNmF|en|D|2|7
1237782050536673289|1074129612|Wed Mar 11 16:46:52 +0000 2020|"I'm proud to lead a bipartisan group of fellow Texans @RepPeteOlson @RepFletcher @michaelcburgess to fight funding cuts for hospitals across TX that would jeopardize health care coverage for nearly 4 million Texans that rely on Medicaid. Read 👇 for more:
https://t.co/IMtEw4kjpu https://t.co/TDN8Cw2P6Z"|en|D|4|4
1237442629840900106|1074129612|Tue Mar 10 18:18:08 +0000 2020|Black moms are 3-4x more likely to die from pregnancy-related complications. No moms should lose their lives bringing life into this world. The Black Maternal Health Momnibus is a historic step to end America’s Black maternal health crisis and #SaveMoms. #Momnibus|en|D|5|10
1237421805054447616|1074129612|Tue Mar 10 16:55:23 +0000 2020|"According to the last census count, our district is one of the HARDEST to count in the country. Learn how you can be a leader in your community by joining my live #2020Census TeleTown Hall.  

Register here: https://t.co/RSRNIfYiN0 https://t.co/qkn2OL2vkn"|en|D|4|7
1237392798522863616|1074129612|Tue Mar 10 15:00:07 +0000 2020|"Keeping North Texans healthy and informed on #COVID19 is a top priority—that is why I've set up a page with everything you need to know about the virus. Learn how to prevent the spread of #COVID-19 here 👇 

https://t.co/PpUbXn4vnT"|en|D|4|10
1236751289301766144|1074129612|Sun Mar 08 20:30:59 +0000 2020|Leaders, trailblazers, artists, public servants, caretakers and so much more. Today and every day, we honor the women who have changed our lives and continue to push us forward. #IWD2020 https://t.co/qkX88jSQGT|en|D|1|4
1236652896978001920|1074129612|Sun Mar 08 14:00:01 +0000 2020|"1 year ago, my colleagues and I passed the #ForThePeopleAct--legislation that would bolster election security, voter access, &amp; campaign reform. A year later, along with 200+ other bipartisan bills, @senatemajldr still refuses to vote on critical legislation. 

We deserve better. https://t.co/eMLNnV74Nz"|en|D|23|23
1236305604492144640|1074129612|Sat Mar 07 15:00:00 +0000 2020|"It’s the sacrifice of those before us that allows us to move forward as a nation. 55 years ago today, nonviolent civil rights activists were attacked as they marched against segregation and voter suppression.
Today, we honor their sacrifice. #BloodySunday #Selma55 https://t.co/Y9L1HoTEW0"|en|D|4|6
1235945280526331904|1074129612|Fri Mar 06 15:08:12 +0000 2020|"The President’s attempt to use the #2020Census for political gain is a new low. 

Census data is used to determine federal funding for things like schools, local businesses, and hospitals—these ads could have disrupted the census count and hurt American families. 

Shame on them. https://t.co/3BdpmPGrQp"|en|D|2|1
1235671206864596992|1074129612|Thu Mar 05 20:59:08 +0000 2020|Tonight @realDonaldTrump is having a #TrumpTownHall to talk about news of the day, so friendly reminder that he is currently trying to dismantle the Affordable Care Act and rip away pre-existing condition protections – in the middle of a public health emergency. #DropTheLawsuit|en|D|61|120
1235576738718953472|1074129612|Thu Mar 05 14:43:45 +0000 2020|Congrats to our Metroplex’s own @JacobsConnects for winning this amazing contract that will bolster our national security and provide jobs both here in North Texas and across our country!|en|D|1|1
1235288897808224256|1074129612|Wed Mar 04 19:39:58 +0000 2020|"The #Census2020 will show where communities need new schools, new clinics, new roads, and more services for families, older adults, and children. 
 
Make sure you’re counted this decade! https://t.co/sRUCNRifgL"|en|D|6|6
1235256385232949250|1074129612|Wed Mar 04 17:30:46 +0000 2020|"Abortion care is health care. 

Abortion rights are human rights. 

I will never stop fighting to ensure that everyone has reproductive freedom and access to safe health care. 

#MyRightMyDecision

https://t.co/A5ItYZpQKO"|en|D|4|16
1234941254997348352|1074129612|Tue Mar 03 20:38:33 +0000 2020|"🚨 Voter suppression is real. If you encounter problems at the polls, call your local Dallas Fort Worth Metroplex-area county election department.🚨 

Make sure to dial 817-831-8683 for Tarrant County and 214-819-6389 for Dallas County."|en|D|23|33
1234885050589679618|1074129612|Tue Mar 03 16:55:13 +0000 2020|This shameful attempt to dismantle health care for millions of people will create uncertainty for families everywhere. I am proud to join @HouseDemocrats to defend the Affordable Care Act and ensure that Americans have access to affordable health care. https://t.co/wgSP9yiE4S|en|D|4|4
1234571780955791361|1074129612|Mon Mar 02 20:10:24 +0000 2020|184 years ago today, the Republic of Texas was born. Happy Texas Independence Day y'all! https://t.co/O2y7sp5U2r|en|D|6|10
1233866078926901248|1074129612|Sat Feb 29 21:26:11 +0000 2020|At the close of this #BlackHistoryMonth, I want to honor Representative Barbara Jordan—a fellow Texan, Civil Rights leader and trailblazer for women and African Americans entering politics. https://t.co/9B9qC63vfN|en|D|12|34
1233527298592256001|1074129612|Fri Feb 28 23:00:00 +0000 2020|Yesterday, I had the opportunity to meet young Latino leaders w/ Lulac advocating for DACA and immigration reform. It’s great to see the next generation engaging with government and advocating for good policy. https://t.co/V5QK0V2CWe|en|D|3|7
1233502209943449601|1074129612|Fri Feb 28 21:20:18 +0000 2020|For North Texans with questions about the #coronavirus, I encourage you to review CDC resources and follow these helpful steps below: https://t.co/xZVwANfktF https://t.co/sGknzHK1xm|en|D|8|5
1233409063544852482|1074129612|Fri Feb 28 15:10:11 +0000 2020|It was great meeting with retired NBA player and member of the NCAA Board of Governors @realgranthill33 &amp; former student-athlete/long-jump champion @Kspencer24 to discuss Student-athlete compensation. https://t.co/ApxLP033hy|en|D|1|2
1233126336308424708|1074129612|Thu Feb 27 20:26:43 +0000 2020|"Mitch McConnell has had one full year to bring #HR8 up for a vote, but he's failed to take meaningful steps to #EndGunViolence. 

Do your job, @senatemajldr. https://t.co/i0zUewQAQW"|en|D|50|104
1233120383789871104|1074129612|Thu Feb 27 20:03:04 +0000 2020|There is a lot at stake for the Black community in 2020, including an accurate count in the 2020 Census. We must make sure that we get this right because our community is facing oppressive and discriminatory tactics to eliminate our power. #BlackCensus2020|en|D|2|2
1232808189927862273|1074129612|Wed Feb 26 23:22:31 +0000 2020|My prayers go out to the Milwaukee community as they deal with this tragedy. It's been 1 yr since the House passed #HR8, a bipartisan bill requiring background checks on all gun sales. It's time for the Senate to vote on this bill and start saving lives. https://t.co/BYgzcXrBWr|en|D|6|6
