id|user|created_at|text|lang|label|retweet_count|favorite_count
1375474663187488771|1074129612|Fri Mar 26 15:48:09 +0000 2021|With COVID19, access to quality, affordable health coverage is more important than ever. Thanks to the enhancements to the ACA in the #AmericanRescuePlan, @HouseDemocrats are lowering families’ health costs and expanding access to affordable coverage to millions more Americans.|en|D|4|6
1375173125965504518|1074129612|Thu Mar 25 19:49:57 +0000 2021|With COVID19, access to quality, affordable health coverage is more important than ever. Thanks to the enhancements to the ACA in the #AmericanRescuePlan, @HouseDemocrats are lowering families’ health costs and expanding access to affordable coverage to millions more Americans.|en|D|2|5
1375148289952219142|1074129612|Thu Mar 25 18:11:16 +0000 2021|Happy National Medal of Honor Day! Today, we honor the valiant service of our nation’s Medal of Honor recipients. I look forward to the National Medal of Honor Museum’s future opening in Arlington, Texas! https://t.co/5wUShGrdX0|en|D|6|15
1375135364629868549|1074129612|Thu Mar 25 17:19:54 +0000 2021|"Want to know more about #AmericanRescuePlan #COVID19 relief package? 
 
Join my live telephone town hall to get your questions answered tonight 6 pm CT. 

Register here👇🏾
https://t.co/RSRNIfYiN0"|en|D|5|11
1375115360941318145|1074129612|Thu Mar 25 16:00:25 +0000 2021|"The spread of disinformation online is having deadly consequences in real life. Today, members of @EnergyCommerce are demanding answers from social media CEOs for the dangerous spread of extremism and disinformation because we need accountability. 

https://t.co/vXYCeg8day"|en|D|11|16
1375100799005626379|1074129612|Thu Mar 25 15:02:33 +0000 2021|"The COVID-19 pandemic has taken more than 500,000 lives. If you have been financially burdened by the death of a loved one, @FEMA will begin providing assistance for funeral expenses incurred after Jan. 20, 2020. 

More information here ⬇️
https://t.co/PpkYB35bi3"|en|D|6|6
1374828461806792706|1074129612|Wed Mar 24 21:00:23 +0000 2021|"HAPPENING TOMORROW!
 
Join my telephone town hall to learn more about the #AmericanRescuePlan and what it means for the Metroplex at 6 pm CT!
 
This discussion will be available in Spanish. Esta discusión estará disponible en español
 
Register here: https://t.co/RSRNIfYiN0 https://t.co/hXcWY8OOx0"|en|D|2|4
1374790769467392001|1074129612|Wed Mar 24 18:30:36 +0000 2021|"Great news for #TX33! 

The Special Enrollment Period for health insurance has been extended. You now have until August 15th to find an affordable health care plan.

Visit https://t.co/xpUeI4yDpq or https://t.co/15GLcZzOS0 to enroll in a plan that best meets your needs. https://t.co/fNp7h4iTg0"|en|D|0|1
1374787184855822337|1074129612|Wed Mar 24 18:16:21 +0000 2021|Millions across the state of Texas were left in the dark and cold during last month's massive grid failure. Today, I am proud to join my @EnergyCommerce colleagues to demand answers to ensure another crisis like this one never happens again to Texans across our state. https://t.co/iatsZVnwCf|en|D|9|16
1374769752435003393|1074129612|Wed Mar 24 17:07:05 +0000 2021|"On #EqualPayDay, we can’t ignore that working from home during COVID19 is a privilege 70% of workers don’t have. 

Low-wage Black &amp; Latinx employees, who already experience unfair pay, are least likely to be able to stay home &amp; stay employed. https://t.co/uMqyXBoGGj"|en|D|6|20
1374722318317027337|1074129612|Wed Mar 24 13:58:36 +0000 2021|"TODAY FROM 8 AM – 5 PM: The City of Fort Worth &amp; Medstar are hosting a community vaccine clinic. 

No appointment necessary! More info below ⬇️ https://t.co/FF6LokxRBL"|en|D|7|6
1374524936128184321|1074129612|Wed Mar 24 00:54:16 +0000 2021|After record voter turnout in 2020, we are now seeing a dangerous trend in states across the country to discredit and silence the voices of these very voters by pushing dangerous Jim Crow-style voter suppression laws.|en|D|6|38
1374471461448998925|1074129612|Tue Mar 23 21:21:47 +0000 2021|No American should go bankrupt just because of a pre-existing condition. On the 11th anniversary of the #AffordableCareAct, House Democrats recommit ourselves to the fight that gave us the majority: our pledge to #ProtectOurCare. https://t.co/Pki91CTBTc|en|D|2|7
1374394481659711489|1074129612|Tue Mar 23 16:15:54 +0000 2021|"This is good news for Texas! It will take all of us having access to the vaccine to crush #COVID19 once and for all.  

Now we must underscore our commitment to getting shots to minority Texans who are still being vaccinated at much lower rates than the rest of Texas. https://t.co/UoMRmII7Bz"|en|D|1|4
1374368134052904964|1074129612|Tue Mar 23 14:31:12 +0000 2021|"Last night, we lost another 10 innocent lives to a senseless act of gun violence. My prayers are with the Boulder community and the families that lost a loved one. 

Enough is enough. We must act now to #EndGunViolence. 

https://t.co/dRam0yZDHP"|en|D|3|8
1374076431735607298|1074129612|Mon Mar 22 19:12:05 +0000 2021|The #AmericanRescuePlan will get shots in arms, people in jobs, and stimulus checks in people’s bank accounts. If you are having trouble getting your payment, call my office at (214) 741-1387 or (817) 920-9086.|en|D|3|10
1374054067895418882|1074129612|Mon Mar 22 17:43:13 +0000 2021|"The #LIFTAmerica Act will modernize our infrastructure for the future, while also revitalizing our economy and creating good-paying jobs here at home. I'm proud to be an original sponsor of this vital legislation. 

It’s time we build back better. https://t.co/9Hrr1kqN9x"|en|D|5|3
1372708938026790917|1074129612|Fri Mar 19 00:38:09 +0000 2021|TX33 knows the importance of the people who help bring food to our tables. These workers put their health on the line &amp; often live in fear of deportation. I'm proud to support the Farm Workforce Modernization Act to provide stability for America’s farmworkers.|en|D|4|14
1372680074709889025|1074129612|Thu Mar 18 22:43:27 +0000 2021|Dreamers, TPS and DED holders are our neighbors, colleagues, and part of our communities. They contribute to our economy and make America stronger, more united, and more diverse. I am proud to vote for the Dream Act. #HomeIsHere https://t.co/8wfxuOWa8M|en|D|3|7
1372660593308672003|1074129612|Thu Mar 18 21:26:02 +0000 2021|"Immigrants play a vital role in economies &amp; communities across my home state of Texas. 

Today, we are advancing landmark bills that will ensure our proud immigrant communities can continue to pursue their American dream as they strengthen &amp; contribute to our nation. #HomeIsHere https://t.co/6EidNTFpj8"|en|D|7|8
1372647572792340484|1074129612|Thu Mar 18 20:34:18 +0000 2021|"🚨We are postponing this evening’s telephone town hall to next week Thursday, March 25th at 6:00 pm CT. 🚨
 
There are now 7 days to register if you haven’t done so.
 
We look forward to hearing from you next week! https://t.co/RSRNIfYiN0"|en|D|3|4
1372635862291390466|1074129612|Thu Mar 18 19:47:46 +0000 2021|"The #CLEANfuture Act ensures every worker has federal-level support during the transition to #netzero climate pollution:

- Creates an Office of Energy and Economic Transition

- New programs to support impacted communities

- Commits to leaving no neighborhood behind"|en|D|3|9
1372589129322614788|1074129612|Thu Mar 18 16:42:04 +0000 2021|"Gender-based violence causes lasting harm to families &amp; communities.
 
It must stop.
 
That is why I voted to pass VAWA reauthorization to ensure that every woman in Texas can live free from violence and fear."|en|D|3|23
1372332041728094210|1074129612|Wed Mar 17 23:40:30 +0000 2021|"TOMORROW AT 6:00 PM: Join me for a live telephone town hall on the #AmericanRescuePlan and the economic relief it delivers to families across our country.
 
Register here ⬇️
 
https://t.co/RSRNIfYiN0 https://t.co/0Bqitxs3t3"|en|D|3|3
1372309448698556422|1074129612|Wed Mar 17 22:10:43 +0000 2021|"Today’s vote to remove the arbitrary deadline for the #ERA is a vote for equality, striking a blow against centuries of sex discrimination. 

I’m proud to join my colleagues in passing this bipartisan bill for an equal future."|en|D|2|12
1372270459153174530|1074129612|Wed Mar 17 19:35:47 +0000 2021|"Proud to introduce the #SCALEAct with @RepMcKinley, @ChrisCoons and @SenBillCassidy. Our legislation is the nation’s first comprehensive, bipartisan #CO2 infrastructure bill that will reduce emissions and create good jobs across our country. 

https://t.co/XXGV17gb26"|en|D|7|13
1372222628686131200|1074129612|Wed Mar 17 16:25:43 +0000 2021|"I am devastated to hear about another senseless act of gun violence in our nation. My love and support are with the loved ones and communities of those killed. Acts of discrimination and misogyny have no place here. 

https://t.co/A4YMh1zmpS"|en|D|2|6
1371926854114934792|1074129612|Tue Mar 16 20:50:25 +0000 2021|"Economic hardship has been particularly acute among Black &amp; Hispanic workers. 

9.9% of Black &amp; 8.5% of Hispanic workers are unemployed, compared to 5.6% of white workers. 

The #AmericanRescuePlan will put people in jobs—lifting vulnerable communities &amp; reducing inequality."|en|D|3|13
1371843278010781700|1074129612|Tue Mar 16 15:18:19 +0000 2021|"Help is here with the #AmericanRescuePlan! 

⏰THIS THURSDAY AT 6 PM⏰: I will be hosting a live telephone town hall on this #COVID19 relief package and other topics that impact our Metroplex! 

⬇️Register to join at this link⬇️ 

https://t.co/RSRNIfYiN0"|en|D|4|6
1371595430325260289|1074129612|Mon Mar 15 22:53:28 +0000 2021|It will take all of us working together to get through these challenging times. This weekend, I went out in #TX33 to inform folks about available #COVID19 and winter storm resources that will help get us back on the right track. If you ever need help, please contact my office. https://t.co/COA6iPQb4W|en|D|2|13
1371547311218769927|1074129612|Mon Mar 15 19:42:15 +0000 2021|Today, @GovAbbott laid out his plan to suppress access to the ballot box in upcoming elections. As co-chair of the @CVRCaucus, I will continue to fight against attempts like this that will silence the voices of vulnerable communities &amp; rob Texans of their ability to safely vote. https://t.co/0CI8WWpCd4|en|D|3|13
1371493145792364550|1074129612|Mon Mar 15 16:07:01 +0000 2021|"Help is here with the #AmericanRescuePlan! The plan will get shots in arms, money in pockets, children in schools, &amp; people in jobs. 

Find out about the package and more helpful #COVID19 resources by clicking the link below. ⬇️

https://t.co/PpUbXnm6Mt"|en|D|13|27
1370181398909366274|1074129612|Fri Mar 12 01:14:36 +0000 2021|"It has been a busy few days! This week we continued our work #ForThePeople by: 

✔️ Passing the #PROAct to protect workers 
✔️ Passing bills to #EndGunViolence
✔️ Introducing legislation to expand broadband access
✔️ Passing the #AmericanRescuePlan to crush #COVID19 https://t.co/w7N9Ltc3Lq"|en|D|6|23
1370125502908862466|1074129612|Thu Mar 11 21:32:30 +0000 2021|"Expanding broadband access for low-income &amp; communities of color who have been disproportionately hurt by #COVID is critical. Proud to have provisions of my bill that will do this be included in @WhipClyburn’s Accessible, Affordable Internet for All Act.

https://t.co/jYfQBWlQb5"|en|D|8|10
1370087264240476171|1074129612|Thu Mar 11 19:00:33 +0000 2021|In Texas and across the country, the epidemic of gun violence exacts a deadly, daily toll, ending the lives of an average of 100 Americans each day. As a member of the @HouseGVP, I was proud to vote for #HR8 and #HR1446—two commonsense pieces of legislation to #EndGunViolence. https://t.co/yEM4Jtq5YX|en|D|2|9
1369790672677535744|1074129612|Wed Mar 10 23:22:00 +0000 2021|"💡Vaccines will be available for Texans who are 50 and older starting Monday, March 15th!💡
 
For more information on how you can register to receive the #COVID19 vaccine, visit: https://t.co/xG0IfYBWG8."|en|D|13|19
1369744547589328901|1074129612|Wed Mar 10 20:18:43 +0000 2021|"Help is on the way for Texans! Today, I was proud to pass the #AmericanRescuePlan—comprehensive legislation to beat #COVID19, safely reopen schools, deliver relief to working families, and foster an inclusive recovery.

Full statement here: https://t.co/VoLmsFFhGN"|en|D|4|10
1369726253541031941|1074129612|Wed Mar 10 19:06:01 +0000 2021|"Science tells us that masks and maintaining social distance are effective. Though #COVID19 restrictions are lifted in Texas, please continue to follow the @CDCgov guidelines to stay safe. 

https://t.co/C0dQREMgKQ"|en|D|3|5
1369663792326598659|1074129612|Wed Mar 10 14:57:49 +0000 2021|This is a rescue operation. Americans are dying, schools are shuttered, and workers are struggling with unemployment. Last night, I voiced why our nation needs the #AmericanRescuePlan. Today, we are going to deliver on our promise to keep fighting #ForThePeople by passing this. https://t.co/80EHXh75HM|en|D|5|12
1369385713435869192|1074129612|Tue Mar 09 20:32:50 +0000 2021|Unions are essential to rebuilding America's middle class and improving the lives of workers and their families. The Protecting the Right to Organize Act allows workers to exercise their basic right to join a union. #1u https://t.co/1CYfNQTh7J|en|D|12|17
1369378324468883456|1074129612|Tue Mar 09 20:03:29 +0000 2021|We need to work smarter not harder to ensure communities across our country can gain access to a fast, reliable internet connection—especially low-income Texans and people of color who already face obstacles when trying to access critically-needed broadband services. (1/2)|en|D|11|27
1369354563132792839|1074129612|Tue Mar 09 18:29:03 +0000 2021|"Low to moderate income Dallas homeowners in need of repairs due to the winter storm may be eligible for assistance!  

Visit the below link for more information ⬇️

https://t.co/xRlJOYPCK3"|en|D|3|1
1369097738978201600|1074129612|Tue Mar 09 01:28:32 +0000 2021|"Today, I am honored to join @RepBlakeMoore to introduce the National Medal of Honor Monument Act—legislation to pave the way for the creation of a monument in our nation’s capital recognizing the Medal of Honor and its brave recipients.
 
https://t.co/ERSS4vwrAg"|en|D|2|6
1368996168970207234|1074129612|Mon Mar 08 18:44:56 +0000 2021|I recently toured the Fair Park vaccination site with my colleagues @RepColinAllred, @RepEBJ, and @JudgeClayJ. I am proud to support the #AmericanRescuePlan that supports sites like this one and gets us back on the right track by ensuring the vaccine is more widely available. https://t.co/97Yw3Ww23U|en|D|5|26
1368995156402257928|1074129612|Mon Mar 08 18:40:54 +0000 2021|Leaders, trailblazers, artists, public servants, caretakers and so much more. Today and every day, we honor the women who have changed our lives and continue to push us forward. #Internationalwomensday|en|D|3|6
1368969536758812678|1074129612|Mon Mar 08 16:59:06 +0000 2021|56 years ago, John Lewis &amp; 600 other advocates who marched for voting rights were brutally attacked by police in Selma, AL. Dozens were hospitalized or injured. As we remember #BloodySunday, we must honor their legacy by creating a democracy that works for us all. #RestoreTheVRA https://t.co/etVua8PK2r|en|D|7|20
1367989041573036034|1074129612|Sat Mar 06 00:02:58 +0000 2021|🚨TOMORROW AT 10:30 AM🚨 I will be hosting a workshop with @fema and @SBAgov to discuss how you can apply for federal assistance if you or your business have been impacted by the Texas winter storm. Fill out this form if you would like to participate: https://t.co/jL62KoHPY6|en|D|2|6
1367908756462395396|1074129612|Fri Mar 05 18:43:56 +0000 2021|"Americans overwhelmingly support the #AmericanRescuePlan to put:
💉Shots in arms
💵Money in pockets
🏫Children in schools
🛠People in jobs https://t.co/zQQddFZ3CT"|en|D|5|7
1367876992369127424|1074129612|Fri Mar 05 16:37:43 +0000 2021|"During #WomensHistoryMonth we celebrate the incredible gains made by trailblazing women who came before us, and we double-down on the fight against systemic discrimination and harassment designed to reverse that progress. 

We won’t go back! https://t.co/O2FJX9osZH"|en|D|4|4
1367590071377952778|1074129612|Thu Mar 04 21:37:36 +0000 2021|"Stop with the blame games, Governor Abbott. Texans need help with power, water and vaccines, not your constant race-baiting.

https://t.co/Z6NQFQ98Xd"|en|D|17|41
1367534561698144263|1074129612|Thu Mar 04 17:57:01 +0000 2021|#TX33 ranks as a district with one of the highest uninsured rates in our country. This is unacceptable. Now more than ever, we must do our part in ensuring our friends, loved ones, and communities have the health care needed to overcome this pandemic. https://t.co/goOfoYzYlM https://t.co/bRQVVWOKMX|en|D|4|4
1367331115925659649|1074129612|Thu Mar 04 04:28:36 +0000 2021|"During #Election2020, we saw Americans literally risking their lives just to exercise their sacred right to vote. We must be focused on making it easier, not harder, for all to safely and effectively vote. That is why we passed the #ForThePeople Act!

https://t.co/yCEMV5r8wJ"|en|D|4|14
1367280952234430464|1074129612|Thu Mar 04 01:09:16 +0000 2021|Congress has a critical role to play to address this crisis of racial profiling and police brutality. Tonight we are passing the #JusticeInPolicing Act to transform the culture of policing, address systemic racism, and save lives. https://t.co/G8HFfwmfmn|en|D|29|78
1367241337536475136|1074129612|Wed Mar 03 22:31:51 +0000 2021|This Saturday, I will be hosting a workshop with @fema and @SBAgov to discuss how you can apply for federal assistance if you or your business have been impacted by the Texas winter storm. Please fill out this form if you would like to participate:  https://t.co/jL62KoHPY6 https://t.co/sZBBJXnVmg|en|D|0|5
1367232523290505217|1074129612|Wed Mar 03 21:56:50 +0000 2021|"Our educators and childcare workers put their lives on the line to help children across our country get the care and education they deserve. Thank you @POTUS for prioritizing them for the vaccine and your work to crush #COVID19.
 https://t.co/xckqTBytrh"|en|D|3|7
1367172574074048514|1074129612|Wed Mar 03 17:58:37 +0000 2021|The 2020 election underscored the need for comprehensive, structural democracy reform. We need to make it easier, not harder, to vote. That’s why I’m continuing the fight to expand voting rights in my position as co-founder of @CVRCaucus and why I am voting the #ForThePeople Act! https://t.co/oTbYghtJQl|en|D|8|10
1366856259845189638|1074129612|Tue Mar 02 21:01:41 +0000 2021|"Governor Abbott’s decision to rescind a statewide face mask order and reopen all businesses at 100% capacity is dangerous for Texas. (1/3)

https://t.co/MVNs0YMlHd"|en|D|16|26
1366818161400643588|1074129612|Tue Mar 02 18:30:18 +0000 2021|"If your business has 20 employees or less, you have exactly ONE week to apply for the PPP loans that the @SBAgov is offering due to the pandemic. The deadline is next Tuesday, March 9, 2021 at 4pm CT. Apply here: 

https://t.co/J5ja79y0G7"|en|D|6|3
1366433223513944066|1074129612|Mon Mar 01 17:00:42 +0000 2021|As Black History Month ends and Women’s History Month begins, I want to celebrate our nation’s first female Vice President—Kamala Harris. Our @VP is a trailblazer for women across the nation. Her leadership will help us crush the #COVID pandemic and move our country forward.|en|D|6|17
1366410871904366598|1074129612|Mon Mar 01 15:31:53 +0000 2021|This past weekend, I traveled around Fort Worth to share #COVID vaccine and storm relief resources to help our North Texas community overcome the pandemic and the aftermath of the dangerous winter weather. https://t.co/fsvr66GLIX|en|D|4|21
1365679253023555587|1074129612|Sat Feb 27 15:04:41 +0000 2021|"Rescuing America from the depths of this #COVID crisis is not a red state or blue state priority. It’s an American priority.

That’s why I voted for the #AmericanRescuePlan Act of 2021, so all Americans get the relief they need. 

My full statement here: https://t.co/hjw0PjmCCY"|en|D|7|16
1365443479535509505|1074129612|Fri Feb 26 23:27:48 +0000 2021|As a member of @HASCDemocrats, I support President Biden’s effort to protect our brave military personnel in the region and deter future attacks. https://t.co/NwLMnkm8tz|en|D|3|7
1365410051763163139|1074129612|Fri Feb 26 21:14:59 +0000 2021|"City of Dallas homeowners who need help paying for repairs from the severe snowstorm can apply for financial assistance! You can read more about the financial assistance program here ⬇️
https://t.co/DUO0xTzmUG"|en|D|6|7
1365383438182850560|1074129612|Fri Feb 26 19:29:13 +0000 2021|This is what real leadership looks like. I want to thank @POTUS and our First Lady for visiting the state of Texas and helping Texans get the much needed relief they need during this time. (1/2)|en|D|5|23
1365316597347454982|1074129612|Fri Feb 26 15:03:37 +0000 2021|If you are a dialysis patient that has been impacted by the power outages and need an AKF emergency grant, you can contact AKF directly at 800-795-3226. https://t.co/5ygDXx9V7F|en|D|6|4
1365089013170917380|1074129612|Thu Feb 25 23:59:17 +0000 2021|"Attention landlords and tenants, the Texas Rent Relief Program priority application deadline has been extended to March 8, 2021. Emergency funds are available to help renters pay rent and utility bills. 

Learn more here ⬇️
https://t.co/yIertodwr2"|en|D|8|8
1365064263816146946|1074129612|Thu Feb 25 22:20:56 +0000 2021|It’s been long enough. Discrimination against #LGBTQ people needs to end. We need the #EqualityAct to be federal law NOW.🏳️‍🌈 https://t.co/PAAyLVOdC3|en|D|6|21
1365041710783414272|1074129612|Thu Feb 25 20:51:19 +0000 2021|"Today during #BlackHistoryMonth,  we celebrate one of our own, the late Dionne Bagsby. Ms. Bagsby was a trailblazer who fought for the inclusion of minorities in all levels of government. 

We honor her commitment to our Tarrant County community. https://t.co/S8aN54d2KJ"|en|D|5|14
1365019885483491331|1074129612|Thu Feb 25 19:24:36 +0000 2021|"If you’re in the Fort Worth area and have home damages due to the severe winter storm, you may qualify for assistance with two programs created by the city. 

You can learn more about both programs here⬇️
https://t.co/KZprrbg07b"|en|D|5|6
1365003419887501314|1074129612|Thu Feb 25 18:19:10 +0000 2021|"Congrats to Secretary Jennifer Granholm on her confirmation to lead @ENERGY. I look forward to working with her to address pressing problems like modernizing our power grid and fighting the climate crisis.
 
https://t.co/OFqYAxY1xy"|en|D|9|19
1364718918372368387|1074129612|Wed Feb 24 23:28:40 +0000 2021|"Access to the vaccine is critical to beating this pandemic. That is why I led a letter w/ @RepEBJ &amp; @ColinAllredTX urging Gov. Abbott to rescind his decision to reduce vaccine supply in Dallas &amp; Tarrant County.

Read our full letter here👇🏾 https://t.co/h2vHooHFgd"|en|D|8|18
1364662786480046081|1074129612|Wed Feb 24 19:45:37 +0000 2021|Para aquellos que necesitan un seguro médico en estos tiempos difíciles, pueden obtener cobertura en https://t.co/15GLcZzOS0 desde ahora hasta el 15 de mayo. https://t.co/DQYQIO7G1U https://t.co/Bg1IFce7K6|es|D|2|2
1364615575289409540|1074129612|Wed Feb 24 16:38:01 +0000 2021|"For those who need health insurance in these challenging times, know that https://t.co/xpUeI4yDpq has you covered.  https://t.co/vBGkK2b6Cp 

Apply now through May 15. #MarketplaceSEP https://t.co/rpZyFiYy5M"|en|D|5|7
1364357650352394240|1074129612|Tue Feb 23 23:33:07 +0000 2021|"🚨ATTENTION TEXAS 🚨

Due to the severe winter storm, Texans will now have until June 15th to file taxes. 

You can read more here👇🏾
https://t.co/RcA4cwcWDj"|en|D|48|116
1364344581815488513|1074129612|Tue Feb 23 22:41:11 +0000 2021|During these challenging times, having health coverage is more important than ever. https://t.co/xpUeI4yDpq is available now through May 15 to get you the health coverage you need https://t.co/vBGkK2b6Cp #MarketplaceSEP https://t.co/5r9RcZ7k9S|en|D|6|7
1364294956211396609|1074129612|Tue Feb 23 19:23:59 +0000 2021|Today, we continue to celebrate #BlackHistoryMonth by highlighting @RUBYBRIDGES1960, the first African American student to integrate an elementary school in the South. She is an icon for civil rights and should be recognized for her bravery. https://t.co/YTqMtIZLh1|en|D|5|10
1364264197039796226|1074129612|Tue Feb 23 17:21:46 +0000 2021|If you're in the Fort Worth area and need water, here are a few water distribution sites. https://t.co/IANMfOiJXm|en|D|6|7
1364250015607185409|1074129612|Tue Feb 23 16:25:24 +0000 2021|"Need assistance with food after the severe winter storm? 

Food aid is being provided by the state government, places of worship, local nonprofits, food banks, and community-organized mutual aids.
 
You can learn more here👇🏾
https://t.co/DDdBGTXVlj"|en|D|5|6
1363993249535455235|1074129612|Mon Feb 22 23:25:07 +0000 2021|"Homeowners, renters, nonprofit organizations, and businesses who suffered losses caused by the severe winter storms that began February 11, 2021 may be eligible for low interest disaster loans from the @SBA. 

You can apply here: https://t.co/jjlMeEfAVb."|en|D|5|4
1363955388794740738|1074129612|Mon Feb 22 20:54:40 +0000 2021|"Many cities in North Texas are still under a boil water notice. There are water distribution sites around North Texas, giving out water to residents as supplies last. Check out the list of locations below for more information:

https://t.co/thKozMkCUm"|en|D|6|8
