id|user|created_at|text|lang|label|retweet_count|favorite_count
1520051366961496064|1074129612|Fri Apr 29 14:44:21 +0000 2022|"Last night, Oklahoma followed in the steps of Republican leaders in Texas &amp; other states across the country in passing a dangerous abortion ban.

Passing #WHPA is critical to combating these bans &amp; ensures that everyone has the right to access essential health care services. https://t.co/HRMTbpwvgq"|en|D|1|6
1519797643920162818|1074129612|Thu Apr 28 21:56:09 +0000 2022|"I was proud to stand in solidarity with the brave Ukrainian people by voting to further equip their fight for democracy. 

The passage of today's legislation will cut red tape to expedite the delivery of weapons, ammunition, and equipment that Ukraine urgently needs. https://t.co/FVCNFml7qj"|en|D|26|79
1519710119449214976|1074129612|Thu Apr 28 16:08:21 +0000 2022|We've seen the tragic impacts of the opioid and mental health public crises nationwide – that's why I'm proud to join my @NewDemCoalition colleagues in endorsing a slate of health care bills to increase access to care and create more health services.|en|D|3|5
1519404865872666625|1074129612|Wed Apr 27 19:55:23 +0000 2022|"April is #FinancialLiteracyMonth &amp; a good reminder for small biz’s to reach out to a local @SBAgov resource partner for free or low-cost financial counseling and training.

More here ➡️ https://t.co/2unkPG7oih ."|en|D|3|3
1519380207408455683|1074129612|Wed Apr 27 18:17:24 +0000 2022|"On #YomHaShoah, we commemorate the 6 million Jews, &amp; millions of others, who were brutally murdered during the Holocaust.

We must ensure that the memories of the lives lost at the hands of the Nazis are not forgotten &amp; continue to stand against antisemitism. #NeverForget"|en|D|2|5
1519350239580278784|1074129612|Wed Apr 27 16:18:19 +0000 2022|"🚨ATTENTION DALLAS COUNTY RESIDENTS🚨 If you have not received your #COVID vaccination or booster yet, you can stop by the Jaycee Zaragoza Recreation Center this Saturday from 11am-2pm to do so for free! 

More information ⬇️ https://t.co/xktyowUSDs"|en|D|1|2
1519314943329320961|1074129612|Wed Apr 27 13:58:04 +0000 2022|"I am relieved with the news that Trevor Reed has finally been freed and is reunited with his family here in Texas.

Thankful for the Biden Administration's work to end Trevor's wrongful Russian detention and ensure his safe return.
 
https://t.co/5JFwQ3gy2l"|en|D|2|4
1519070247600496646|1074129612|Tue Apr 26 21:45:44 +0000 2022|"Congress and @POTUS, together with our allies and partners, are committed to standing with the people of Ukraine as they courageously defend themselves and their nation against Putin’s horrific war. 🇺🇦
 
https://t.co/i0ZyxiQGlM"|en|D|2|1
1519022361978277890|1074129612|Tue Apr 26 18:35:27 +0000 2022|Thanks to the Bipartisan Infrastructure Law, Texas will receive over $60M to invest in electric vehicle charging infrastructure. Yesterday, I had the opportunity to join @NCTCOGtrans to see the firsthand impact of this law on the EV fleet here in North Texas! https://t.co/P155CccEol|en|D|3|3
1518646103964626946|1074129612|Mon Apr 25 17:40:20 +0000 2022|"I am praying for the loved ones of Texas National Guard SPC Bishop E. Evans. SPC Evans was a patriot who sacrificed his own life to save others. May his bravery and service never be forgotten. 

https://t.co/6PMDmWkrRp"|en|D|8|12
1518608819949121536|1074129612|Mon Apr 25 15:12:11 +0000 2022|"🚨The deadline to submit artwork for the 2022 Congressional Art Competition has been extended until this Friday!🚨

For submissions, email juan.galindo@mail.house.gov

More info can be found ⬇️:

https://t.co/GNMGwlihPT"|en|D|1|0
1517519880119099392|1074129612|Fri Apr 22 15:05:08 +0000 2022|"52 years ago today, people all over the world united under one purpose – to protect every person’s right to clean air, clean water, and a safe environment. 

Today, we continue to celebrate #EarthDay and fight for a clean and healthy environment for all. #EnvironmentalJustice https://t.co/SPUNXYPiC4"|en|D|5|5
1517253992249761794|1074129612|Thu Apr 21 21:28:35 +0000 2022|If you plan on traveling out of the country, follow these tips for applying for a passport to save money and avoid delays! https://t.co/H7jP3h0S8s|en|D|2|1
1517191490237255681|1074129612|Thu Apr 21 17:20:13 +0000 2022|"🚨ATTENTION HIGH SCHOOL ARTISTS IN #TX33🚨

🎨There are just a few hours left for you to submit your artwork to the 2022 Congressional Art Competition!🎨

For submissions, email juan.galindo@mail.house.gov

More info can be found ⬇️:

https://t.co/dyeGowROVY"|en|D|2|1
1516877963891036160|1074129612|Wed Apr 20 20:34:23 +0000 2022|"Two-thirds of Americans support reforming our outdated, out-of-touch cannabis laws.   

The House recently passed the #MOREAct to finally decriminalize marijuana. 

It's time for Senate to catch up and pass this legislation. Cannabis justice is racial justice."|en|D|2|9
1516831973662150658|1074129612|Wed Apr 20 17:31:38 +0000 2022|"Last week’s stunt at the border by @GovAbbott threatened Texas’ economic recovery &amp; hurt hardworking families across the state.

I was proud to join Texas Delegation members in an effort that finally got him to end this harmful directive &amp; get Texas back on the right track. https://t.co/8gA5KIQuqo"|en|D|5|8
1516488145570865156|1074129612|Tue Apr 19 18:45:23 +0000 2022|"🎨High school artists in #TX33, you have until this Thursday, April 21st to submit your work to the 2022 Congressional Art Competition.🎨

For submissions, email juan.galindo@mail.house.gov

More info can be found at this link and ⬇️: https://t.co/dyeGowROVY https://t.co/LdnQEDclEC"|en|D|1|0
1516464770370711567|1074129612|Tue Apr 19 17:12:30 +0000 2022|"The ability to secure FAIR &amp; AFFORDABLE HOUSING is linked to better outcomes for every person in nearly every facet of life including:
💵 Economic opportunity
🎓 Educational attainment
🌎 Environmental justice
⚕️ Healthcare
🏡 Living a healthy &amp; independent life
#FairHousingMonth"|en|D|10|15
1516128125897392135|1074129612|Mon Apr 18 18:54:48 +0000 2022|I will never stop fighting to ensure that Texans of all backgrounds, especially our children, can access affordable, comprehensive health care.|en|D|2|4
1516098376508616704|1074129612|Mon Apr 18 16:56:35 +0000 2022|"📁The filing deadline to submit 2021 tax returns or to request an extension is today! 📁

You can find more resources at https://t.co/KvIyXM4NiM."|en|D|3|6
1515687790209650689|1074129612|Sun Apr 17 13:45:03 +0000 2022|"#Easter is a time to come together and celebrate new beginnings.
 
Happy Easter to those who observe! https://t.co/OYRM9zOQlQ"|en|D|1|1
1514990374024105994|1074129612|Fri Apr 15 15:33:46 +0000 2022|"This weekend, let us continue to remember the values of forgiveness and strength.
 
Wishing a peaceful Good Friday to all who celebrate!"|en|D|2|1
1514960719116222465|1074129612|Fri Apr 15 13:35:56 +0000 2022|"People aren't political props.

@GovAbbott's latest border stunt undermines our values as a country.

He must end these inhumane charades, &amp; we must work together to find a comprehensive solution that will repair our immigration system while maintaining our national security. https://t.co/l1iXtdRUwC"|en|D|4|7
1514703389468278792|1074129612|Thu Apr 14 20:33:24 +0000 2022|To the Sikh community in Texas and across the country, I’m sending my wishes for a very happy #Vaisakhi to all those celebrating!|en|D|3|4
1514326340924841988|1074129612|Wed Apr 13 19:35:09 +0000 2022|"The deadline to file 2021 taxes is Monday, April 18, 2021. 
 
Don’t miss it! Here’s more info on how to file your taxes⤵️

https://t.co/1S92cYHTNM"|en|D|1|2
1513980739393667080|1074129612|Tue Apr 12 20:41:51 +0000 2022|"The F-35 strengthens our national security, enhances global partnerships, and powers economic growth both in the DFW Metroplex &amp; the nation.

It is essential that we continue to increase production numbers to ensure the US maintains air dominance. https://t.co/ZttOExu34V"|en|D|5|14
1513977144120070145|1074129612|Tue Apr 12 20:27:34 +0000 2022|Today’s attack in New York is heartbreaking. My thoughts are with all of those injured in the attack and the brave first responders who helped save lives and are working to apprehend the perpetrator. https://t.co/A0FXQCKQIt|en|D|2|2
1513890654258139138|1074129612|Tue Apr 12 14:43:53 +0000 2022|"Small businesses are the backbone of our economy, and  they are still hurting from COVID.
 
Last week, I was proud to vote in favor of a targeted restaurants &amp; small business relief package that will #ReplenishRRF with $42B and so much more! Learn more⬇️
https://t.co/suyxJgF7kF"|en|D|3|6
1513579194428674052|1074129612|Mon Apr 11 18:06:15 +0000 2022|This is the fifth anniversary of Black Maternal Health Week, a time to amplify the voices of Black mothers everywhere. As a proud member of the @BMHCaucus, I’m committed to advancing maternal health solutions through Congress and closing the health disparity gap for good! #BMHW22|en|D|9|5
1513562860256907266|1074129612|Mon Apr 11 17:01:21 +0000 2022|"Thank you, @POTUS. This decision will bolster public safety and is a decision that all Americans—regardless of party—can say is common sense.

https://t.co/exYUZW2vaI"|en|D|13|20
1513537477155373062|1074129612|Mon Apr 11 15:20:29 +0000 2022|"It was great to join our nation’s next generation of servicemembers at the North Texas U.S. Service Academies Forum. 

I cannot wait to see what these young men and women will accomplish in the future! https://t.co/Pq4hL59CaV"|en|D|1|1
1512463973060386818|1074129612|Fri Apr 08 16:14:46 +0000 2022|"🗓️MARK YOUR CALENDARS, #TX33🗓️

The deadline to file 2021 taxes is Monday, April 18, 2022. Don’t miss it!

More info here: https://t.co/KYugDfmcFO"|en|D|2|2
1512162687941287942|1074129612|Thu Apr 07 20:17:34 +0000 2022|"The #PostalServiceReformAct will finally put the @USPS on track to financial stability and ensure it provides the high quality of service Americans expect and deserve.

Yesterday’s bill signing is a win for the American people!👏 

https://t.co/ErUFBBcxp2"|en|D|2|3
1512144405972533251|1074129612|Thu Apr 07 19:04:55 +0000 2022|History has been made! Today, Judge Ketanji Brown Jackson became our nation's first Black woman to be confirmed by the Senate to the Supreme Court. https://t.co/NIZ3fPx54H|en|D|3|19
1512078081250406410|1074129612|Thu Apr 07 14:41:22 +0000 2022|Happy #NationalLibraryWeek! Thanks to the #AmericanRescuePlan, @TSLAC awarded American Rescue Plan Act Grants to two libraries in our district, the Cockrell Hill Public Library and the Fort Worth Public Library. Congratulations @COHILL_Library and @FtWorthLibrary!|en|D|5|12
1511791589164732423|1074129612|Wed Apr 06 19:42:57 +0000 2022|🚨A final report shows that more than 12% of mail-in ballots were rejected in Texas under the state's restrictive voter suppression law. This is further proof that we need to enact the #VRAA &amp; #FreedomToVote Act to preserve access to the ballot box in Texas and beyond. https://t.co/hMr2lODOuS|en|D|5|6
1511760255880990730|1074129612|Wed Apr 06 17:38:26 +0000 2022|"The census is a critical way to ensure our communities have equal representation &amp; can thrive.

That is exactly why I joined over 40 of my colleagues to call on the @USCensusBureau to ensure minority communities receive their fair share of resources.

Read our letter ⬇️ https://t.co/ZSi3paOZC4"|en|D|1|1
1511394177208225794|1074129612|Tue Apr 05 17:23:46 +0000 2022|President Biden’s Executive Order to strengthen the Affordable Care Act and #ProtectOurCare is a powerful step forward in @HouseDemocrats’ relentless work to lower families’ health costs! https://t.co/ORTdBUPahq|en|D|5|8
1511099435509592066|1074129612|Mon Apr 04 21:52:34 +0000 2022|I am horrified by the images that continue to come out of Bucha and other liberated areas of Ukraine. Putin must be held accountable for these war crimes, and we must continue to stand with our Ukrainian allies as they bravely fight to defend democracy.|en|D|5|8
1510986134775635974|1074129612|Mon Apr 04 14:22:21 +0000 2022|"🎨Attention teachers &amp; students!🎨We are now accepting submissions for the 2022 Congressional Art Competition in #TX33! Contact my district offices or visit the link below if you have questions. Good luck! 

https://t.co/GNMGwlihPT https://t.co/X7WUPMsM02"|en|D|3|2
1510728739897987075|1074129612|Sun Apr 03 21:19:34 +0000 2022|My prayers are with all of those involved in last night’s shooting in Oak Cliff. We must recommit ourselves to ending gun violence and saving lives. https://t.co/qn0J73ab0N|en|D|2|8
1509939797212770306|1074129612|Fri Apr 01 17:04:35 +0000 2022|"Every 90 seconds, one person in this country is arrested for a minor marijuana crime. 

Today, I proudly voted for the #MOREAct to finally put an end to the criminalization of marijuana in the U.S. and begin repairing the harm of decades of failed drug policy. https://t.co/kcSTK8V4rT"|en|D|3|9
1509903230200918076|1074129612|Fri Apr 01 14:39:17 +0000 2022|"Americans pay more than 10 times the price of insulin compared to other high-income countries. That is absolutely unacceptable and why I voted YES on the #AffordableInsulinNow Act, which will cap the cost of insulin at $35/month.

Read more here: https://t.co/fLqHuRmVkf"|en|D|3|4
1509628002719698949|1074129612|Thu Mar 31 20:25:38 +0000 2022|Equality, justice and dignity – those are the basic principles #CésarChávez fought for. His timeless vision of hope for a better world continues to inspire me to strengthen the American Dream every day. #CésarChávezDay|en|D|2|3
1509611637405278209|1074129612|Thu Mar 31 19:20:36 +0000 2022|"No American should have to choose between paying for lifesaving insulin and other basic necessities like food &amp; rent. 

That’s why I’m supporting the #AffordableInsulinNow Act to lower insulin prices to no more than $35 a month for Americans with diabetes. https://t.co/Vi8QT7SnMI"|en|D|5|12
1509564200603033606|1074129612|Thu Mar 31 16:12:06 +0000 2022|"Transgender Day of Visibility is an opportunity to lift up and celebrate trans people in Texas and beyond. Together, we can all fight back against discrimination and celebrate the joy and beauty of the trans community. #TransDayofVisibility

https://t.co/JZiUFzzGtB"|en|D|2|4
1509549784541061122|1074129612|Thu Mar 31 15:14:49 +0000 2022|Our #TX33 team is hard at work traveling across North Texas to meet with constituents and groups that are impacting our communities. Here are a few highlights from the last week: (1/2)|en|D|2|3
1509302027633020930|1074129612|Wed Mar 30 22:50:19 +0000 2022|Last night, I proudly voted for legislation to strengthen Texans' retirement security. By expanding retirement plan coverage &amp; providing more saving options, the Securing a Strong Retirement Act will ensure more people can retire with dignity &amp; stability after a lifetime of work.|en|D|5|11
1509251095956271114|1074129612|Wed Mar 30 19:27:56 +0000 2022|"My thoughts and prayers are with the loved ones of the 11 Israelis who were killed in terrorist attacks over the past week.

I strongly condemn these senseless acts of violence and remain committed to eradicating antisemitism both at home and abroad.

https://t.co/XelPcQdKHz"|en|D|2|7
1509227877690220552|1074129612|Wed Mar 30 17:55:40 +0000 2022|In 2021, I proudly voted for the #AmericanRescuePlan to give direct relief to help child care businesses across Texas thrive as we continue to recover from the #COVID. @TXWorkforce is now accepting applications for the Child Care Relief Fund on a rolling basis until May 31st.|en|D|2|2
1508916749235896327|1074129612|Tue Mar 29 21:19:21 +0000 2022|"Today, @POTUS signed @RepBobbyRush’s Emmett Till #AntilynchingAct into law. 

This bill will finally make lynching a federal hate crime and ensure that the full force of the U.S. government is always brought to prosecute those who commit this monstrous act. https://t.co/3nJdTL2cmB"|en|D|5|19
1508844969230053386|1074129612|Tue Mar 29 16:34:08 +0000 2022|🚨VACCINE UPDATE🚨 https://t.co/HJ4gfPeEq2|en|D|2|1
1508827327886761993|1074129612|Tue Mar 29 15:24:02 +0000 2022|"It was an honor to preside over the House floor proceedings last night. 

Great way to start another busy week back in DC delivering results #ForThePeople of #TX33! https://t.co/6zs5wHfTk7"|en|D|5|16
1508548557464346632|1074129612|Mon Mar 28 20:56:18 +0000 2022|The #BidenBudget makes critical investments to help build a better America—cutting costs for families and advancing the bipartisan Unity Agenda the President laid out in his State of the Union address.|en|D|1|4
1508450156554899461|1074129612|Mon Mar 28 14:25:17 +0000 2022|I was proud to recently announce that the Trinity River Project will receive $403M in new funding from the Bipartisan Infrastructure Law. Last week, I took an exciting tour where I saw how the funding that I fought for is ensuring the completion of this critical project. https://t.co/sW8c3TT1dN|en|D|6|15
1507410318393327622|1074129612|Fri Mar 25 17:33:20 +0000 2022|"I was proud to join a bipartisan group today to celebrate the groundbreaking of the National Medal of Honor Museum in Arlington, Texas, as we celebrate National Medal of Honor Day!

I remain committed to honoring our nation's brave heroes who have given up so much to protect us. https://t.co/PZdkgrGlDI"|en|D|3|9
1507375351399428108|1074129612|Fri Mar 25 15:14:24 +0000 2022|"Today is National Medal of Honor Day, a time to pay homage to the men and women who've received the highest military honor awarded by Congress.
 
Their selfless acts, bravery, and sacrifices will never be forgotten. https://t.co/hxt7RueNjU"|en|D|11|17
1507084911617916933|1074129612|Thu Mar 24 20:00:17 +0000 2022|"I recently joined the @TexasStandard to discuss the ongoing situation in Ukraine. I remain committed to standing with our Ukrainian allies to defend democracy and taking every potential action to limit the costs of Putin’s aggression on American families.

More 🔽 https://t.co/O1C0yVESJO"|en|D|2|3
1507056922192760834|1074129612|Thu Mar 24 18:09:04 +0000 2022|"Glad that @POTUS will allocate additional federal aid for the 2021 Texas winter storm recovery efforts. This funding will help communities across North Texas continue to rebuild and improve resilience for future natural disasters.

https://t.co/xvKM8gSoKF"|en|D|1|3
1506729143433674760|1074129612|Wed Mar 23 20:26:36 +0000 2022|"During this #WomensHistoryMonth, we honor Madeleine Albright⁠—our nation's first female Secretary of State. Albright was a trailblazer, diplomat, and inspiration to so many. May she Rest in Peace.

https://t.co/edpPV44zk2"|en|D|3|5
1506705749782765582|1074129612|Wed Mar 23 18:53:38 +0000 2022|"12 years ago today, the Affordable Care Act was signed into law, providing millions of Texans with access to quality, affordable health care.

I’m proud to support this life-saving law &amp; look forward to the work we will do to continue to lower families’ health costs. #ThxACA https://t.co/0EnuetSD3i"|en|D|41|162
1506384098469810181|1074129612|Tue Mar 22 21:35:30 +0000 2022|Proud to join my @EnergyCommerce colleagues to urge @NTIAgov for swift and sensible implementation of the Bipartisan Infrastructure Law that will help bridge the digital divide and ensure that everyone has the devices and skills to participate in the digital economy. https://t.co/nyjIfNh904|en|D|1|1
1506270404842864642|1074129612|Tue Mar 22 14:03:44 +0000 2022|"Earlier this year, I nominated Roy, Anthony, Luc, and Matthew of #TX33 to receive entry to a U.S. service academy.

And great news!! All four of them will be attending the academy of their choice this fall. I am so proud of them and all they will accomplish for North Texas. https://t.co/uzLP9fKdO9"|en|D|1|3
1505997772859846665|1074129612|Mon Mar 21 20:00:23 +0000 2022|"🗓️Mark your calendars, #TX33!🗓️ Join me for a telephone town hall tomorrow at 6:00 pm to answer your questions about my work in Congress and pressing topics that impact North Texas. 

RSVP here: https://t.co/RSRNIfYiN0"|en|D|2|3
1505977022228705289|1074129612|Mon Mar 21 18:37:56 +0000 2022|Judge Jackson is a former clerk for Justice Breyer, whom she is nominated to replace, she's is a top jurist with strong experience on the federal bench, currently serving on the U.S. Court of Appeals for the D.C. Circuit. Confirm Her. #CBCxKBJ #SheWillRise https://t.co/PzFJ7NCGPY|en|D|1|8
1505937887824596992|1074129612|Mon Mar 21 16:02:26 +0000 2022|"I am sending my deepest condolences to the loved ones of the four brave U.S. marines who lost their lives during a tragic accident in a heavy storm in Norway this past weekend.

https://t.co/Lemj9YFmIj"|en|D|1|7
1505927411489284097|1074129612|Mon Mar 21 15:20:48 +0000 2022|Severe weather including hail, thunderstorms, and possible tornadoes, is expected across North Texas today. Make sure to stay safe! https://t.co/YHdBfD0wd7|en|D|2|0
1504885605989294080|1074129612|Fri Mar 18 18:21:02 +0000 2022|Defense plays a vital role in our economy here in North Texas. Proud to join @BellFlight to discuss how we can bolster our national security and create good-paying jobs for Texans here in #DFW. https://t.co/tsXWbBfC2K|en|D|0|2
1504840269702774804|1074129612|Fri Mar 18 15:20:53 +0000 2022|A recent @AP article reported that over 20,000 mail ballots were discarded during our Texas primary. And it is all because of the enaction of #SB1—Texas' sweeping voter suppression law.|en|D|4|11
1504829018457137155|1074129612|Fri Mar 18 14:36:11 +0000 2022|I’m proud to support the #CROWNAct, which would ban discrimination against Black women and girls based on how their hair naturally grows out of their heads. Make no mistake, discrimination against Black hair is a form of racism. And racism is not welcome in our country.|en|D|5|18
1504522819832627200|1074129612|Thu Mar 17 18:19:27 +0000 2022|"BIG NEWS! @POTUS recently signed a bipartisan government funding package that includes over $13 million that I secured to directly benefit people across #DFW!

 Get more info on these North Texas projects ⬇️ https://t.co/2v0q6VOpQY"|en|D|4|17
1504134963368714247|1074129612|Wed Mar 16 16:38:15 +0000 2022|One year ago today, a gunman sought out 3 Asian-owned spas in Atlanta where he killed 8 people, including 6 Asian women. It was an act of hate &amp; one of over 11,000 anti-Asian hate incidents since the pandemic started. We must unite to reject xenophobia &amp; #StopAsianHate.|en|D|6|8
1504110376052477955|1074129612|Wed Mar 16 15:00:33 +0000 2022|"President Zelenskyy's speech was inspiring. He has shown the world what true leadership looks like in the face of adversity.

The United States will continue to #StandWithUkraine and provide critical aid as they bravely defend democracy."|en|D|3|5
1503859821048696836|1074129612|Tue Mar 15 22:24:56 +0000 2022|"Congratulations to Shalanda Young for making history by becoming the first Black woman to be confirmed as the Director of OMB. 

She is highly qualified and well-deserving of this role. I am proud to witness this amazing achievement! https://t.co/X2la9i5HAP"|en|D|1|4
1503784481181909000|1074129612|Tue Mar 15 17:25:33 +0000 2022|The #EqualPay Act was signed into law 59 years ago today. While we have made tremendous progress, our fight to close the gender pay gap still continues. That is why I’m proud to support the Paycheck Fairness Act. We must finally fulfill the promise of equal pay for equal work. https://t.co/8x3efW0t6G|en|D|2|2
1503772166793404426|1074129612|Tue Mar 15 16:36:37 +0000 2022|As the humanitarian crisis unfolds, we must welcome all asylum seekers equally regardless of race, religion, or nationality. Proud to join a group of my @HelsinkiComm colleagues to ensure this happens by protecting those fleeing Ukraine against incidents of racial discrimination. https://t.co/qtUbpaEGAE|en|D|4|5
1503473941872091140|1074129612|Mon Mar 14 20:51:35 +0000 2022|"The Violence Against Women Act has been a lifeline for many women across Texas. Last week, Congress reauthorized #VAWA, which will continue to protect people from domestic violence and provide critical violence prevention and response resources.

https://t.co/0MzbAZiF56"|en|D|1|0
1502323422046699522|1074129612|Fri Mar 11 16:39:50 +0000 2022|"It’s been a year since the #AmericanRescuePlan was passed, and we are Building a Better America: since the President took office:

✅ GDP grew last year at 5.7%
✅ 7.4 million jobs created
✅ Unemployment rate dropped from 6.4% to 3.8%"|en|D|3|5
1502013076085874691|1074129612|Thu Mar 10 20:06:38 +0000 2022|Last night, the House passed a bipartisan omnibus bill that addresses the significant challenges we face at home &amp; abroad.|en|D|2|6
1501984838362017793|1074129612|Thu Mar 10 18:14:25 +0000 2022|"Students need reliable internet access at home to succeed in the classroom. That’s why I proudly supported the #AmericanRescuePlan, which to date, has provided Texas schools &amp; libraries with $480 million to help get students online. 

More info here: https://t.co/tZivHYk337"|en|D|4|9
1501679146971410439|1074129612|Wed Mar 09 21:59:43 +0000 2022|The United States does not need to choose between defending our democratic values and protecting our economic interests. I commend the President for announcing action to stop importing Russian energy products into the United States.|en|D|3|20
1501628930800898055|1074129612|Wed Mar 09 18:40:10 +0000 2022|National School Breakfast Week recognizes the importance of having a nutritious breakfast for a successful school day. Thank you to all of the school staff that help ensure every student has access to quality food to fuel their days. #NSBW22 https://t.co/VEQtCPLjd2|en|D|2|3
