id|user|created_at|text|lang|label|retweet_count|favorite_count
1139641154948014082|1074129612|Fri Jun 14 21:09:59 +0000 2019|Had a great time today working with @SnappyCatfish. Supporting local business is one of my most important jobs in Congress (and getting to serve delicious food is a priority too!) #MarcMeansBusiness https://t.co/OmQyitE6Vz|en|D|0|6
1139612264351305729|1074129612|Fri Jun 14 19:15:11 +0000 2019|Working with @SnappyCatfish here in Dallas, getting these fish breaded and ready for the fryer! 🐟🐟🐟 #MarcMeansBusiness https://t.co/U5tSDCnvab|en|D|1|12
1139576179424419840|1074129612|Fri Jun 14 16:51:48 +0000 2019|Working a food truck for the first time during my Marc Means Business initiative! Come on down to @SnappyCatfish here in West Dallas to say hello and get some fish! #MarcMeansBusinness https://t.co/fm4puybySY|en|D|2|10
1139541977874219009|1074129612|Fri Jun 14 14:35:53 +0000 2019|"""It is your character, and your character alone, that will make your life happy or unhappy."" -  John McCain 

A good day to remember the example of Senator McCain indeed. #JohnMcCainDay https://t.co/ilyW2j1vHE"|en|D|76|173
1139531454323613696|1074129612|Fri Jun 14 13:54:04 +0000 2019|I stand with @bradybuzz and @AMarch4OurLives because it's past time we invest in gun violence research. #WeNeedtoKnow https://t.co/pJKSM54Z3b|en|D|25|79
1139309777010511873|1074129612|Thu Jun 13 23:13:12 +0000 2019|Thank you, next. https://t.co/et2DyOYTCm|en|D|12|42
1139250839086927874|1074129612|Thu Jun 13 19:19:00 +0000 2019|"It was a pleasure to welcome these @OWprogram delegates on behalf of Fort Worth (and to recommend some good BBQ spots). 

Looking forward to strengthening the friendship between Texas and Kazakhstan! https://t.co/PjcKwaXH8D"|en|D|2|6
1139246922231963649|1074129612|Thu Jun 13 19:03:27 +0000 2019|Under this Administration, it's more important than ever to #CelebrateImmigrants. America flourishes because of them. I will continue to stand with the @NewDemCoalition to demand immigration reform now. #ImmigrantHeritageMonth|en|D|8|14
1139155842689851399|1074129612|Thu Jun 13 13:01:32 +0000 2019|The integrity of our elections must be beyond partisanship. Any Trump campaign staff who become aware of any attempt by a foreign power to interfere better report it immediately to Congress and law enforcement. https://t.co/oMBb7143Ef|en|D|5|8
1138918155332575232|1074129612|Wed Jun 12 21:17:02 +0000 2019|My staff and I have been closely monitoring this past Sunday’s police-involved shooting in Fort Worth. During my discussion about the shooting today with Mr. David Cooke, the Fort Worth city manager, I made clear that... (1/2)|en|D|1|9
1138913365085044736|1074129612|Wed Jun 12 20:58:00 +0000 2019|I applaud my colleagues on @OversightDems for holding Secretary Ross and Attorney General Barr in contempt. We must ensure that the 2020 Census fairly counts people of every race and national origin – our equal representation in our democracy depends on it. #Census2020|en|D|18|101
1138887012315017216|1074129612|Wed Jun 12 19:13:17 +0000 2019|The full extent of the violent crackdown against protesters in #Sudan is still becoming clear. But what we do know is simply unacceptable. I urge my colleagues and the international community to not remain silent. https://t.co/71uCUq4ahN|en|D|1|2
1138854484380139521|1074129612|Wed Jun 12 17:04:02 +0000 2019|A tragic reminder that we are more than capable of repeating our mistakes. #NoKidsInCages https://t.co/g7xvgrUW5Y|en|D|4|8
1138823361298087936|1074129612|Wed Jun 12 15:00:22 +0000 2019|Today we remember the 49 people we lost 3 years ago in Orlando. They were mostly young, LGBTQ, and Latinx – and all of them are missed. For their sake, during both #Pride and #GunViolenceAwarenessMonth, we must fight for love, acceptance, and equality for all Americans. https://t.co/OFt31eIEpH|en|D|3|3
1138559091851350022|1074129612|Tue Jun 11 21:30:15 +0000 2019|I spoke on the House floor today to commemorate the life of Briuna Harps, a young woman from Fort Worth who lost her life to gun violence last month. In honor of Briuna, and everyone else we've lost to gun violence, now is the time to act. #EnoughIsEnough https://t.co/gM4ERIKJzb|en|D|5|11
1138501537695784960|1074129612|Tue Jun 11 17:41:33 +0000 2019|It was an honor to preside over the House floor and open the legislative day this morning. I am humbled every day to serve my DFW community here in D.C. #TX33 https://t.co/381oPTJxFG|en|D|3|11
1138486265010098177|1074129612|Tue Jun 11 16:40:52 +0000 2019|When the FCC repealed #NetNeutrality, my constituents made their support for the free and open internet very clear. I was proud to vote for the #SaveTheNet Act earlier this year, and now it is time for the Senate to take action!|en|D|2|3
1138468686203932675|1074129612|Tue Jun 11 15:31:01 +0000 2019|I am a proud co-sponsor of this important legislation. We must honor 9/11 heroes with deeds and not just words. #NeverForget https://t.co/elVA41RWVv|en|D|2|4
1138107301687156737|1074129612|Mon Jun 10 15:35:00 +0000 2019|"Last night, we received the news that a 20 year old African-American man was fatally shot by local law enforcement. This story sadly aligns with a troubling nationwide pattern of violent interactions between law enforcement and men of color. 
https://t.co/zBd7Y3Zi4O"|en|D|7|7
1138082901403295745|1074129612|Mon Jun 10 13:58:02 +0000 2019|Deeply concerned by this frightening incident. My thoughts and prayers are with the victims. https://t.co/jLfWGD51ef|en|D|2|6
1137694470105948160|1074129612|Sun Jun 09 12:14:33 +0000 2019|My heart goes out to the loved ones of Officer A.J. Castaneda and to the entire @GrandPrairiePD. https://t.co/7Y0FOichpo|en|D|2|8
1137515644067491841|1074129612|Sun Jun 09 00:23:58 +0000 2019|A profoundly humbling experience. Honored to join @SpeakerPelosi and my colleagues in paying our nation’s respects. https://t.co/K3JSnUls4h|en|D|1|8
1137110103511973888|1074129612|Fri Jun 07 21:32:29 +0000 2019|It’s been 100 days since we passed #HR8, the Bipartisan Background Checks Act. We must continue the fight for common sense gun legislation. On #NationalGunViolenceDay, I #WearOrange to honor and mourn all the lives we have lost to gun violence. #EnoughisEnough https://t.co/8Y10sA7X0f|en|D|2|7
1137033648824356864|1074129612|Fri Jun 07 16:28:41 +0000 2019|People of faith and good will are stepping up to offer shelter in a church to asylum seekers arriving this weekend. They make Dallas proud. This is how we should address the humanitarian challenge at our border – with compassion. https://t.co/FIGa2kLXje|en|D|2|6
1137024577442406401|1074129612|Fri Jun 07 15:52:38 +0000 2019|It’s time to rectify this injustice. It’s time for Waverly Woodson to receive his #MedalOfHonor. https://t.co/AXH7qb4WV8|en|D|24|39
1136697752921022465|1074129612|Thu Jun 06 18:13:57 +0000 2019|The story of the 320th Barrage Balloon Battalion is an example for all Americans. Today, I call on my colleagues to grant this unit the Congressional Gold Medal to rectify the injustice of their erasure. #DDay75 https://t.co/s88iaePMtx|en|D|23|38
1136677500405342208|1074129612|Thu Jun 06 16:53:29 +0000 2019|75 years ago today, the world hung in the balance. It was the courage, sacrifice, and determination of ordinary Americans of every race that won the day. A grateful nation must never forget. #DDay75 https://t.co/1bowzaJCap|en|D|3|7
1136662288050638848|1074129612|Thu Jun 06 15:53:02 +0000 2019|My thanks to your family, for its important contribution in defeating Nazi Germany. We must not forget. #DDay75 https://t.co/5hhpA9Hxjh|en|D|0|6
1136657299026644993|1074129612|Thu Jun 06 15:33:12 +0000 2019|Don’t forget the 320th Barrage Balloon Battalion, a segregated unit that hit the beaches of Normandy on D-Day. They’ve been wrongly overlooked for too long.  I’ll be thinking of them in particular as I visit the hallowed ground of Normandy today. #DDay75 https://t.co/Njc47dzkBC|en|D|360|1092
1136398122635149312|1074129612|Wed Jun 05 22:23:20 +0000 2019|I'm a gun owner, and this #GunViolenceAwarenessMonth we know we have to do something. Now is the time for sensible legislation. No one is trying to take anyone's guns away. But we must act to put an end to mass shootings. https://t.co/DoEGeupWTn|en|D|31|96
1136381174564249601|1074129612|Wed Jun 05 21:15:59 +0000 2019|Today, I called on every Presidential candidate to propose their plans to defend the right to vote of every American. Voting rights must be front and center in this campaign. https://t.co/CsWr7lBLyk|en|D|2|14
1136315390546644994|1074129612|Wed Jun 05 16:54:35 +0000 2019|Honored to receive this prestigious award from my friends at @ADL along with all my colleagues on the Bipartisan Taskforce for Combating Anti-Semitism. It is up to all Americans to speak out against hatred against any American. https://t.co/jpNp4gzqTf|en|D|2|10
1136292804156624896|1074129612|Wed Jun 05 15:24:50 +0000 2019|Our government is entrusted with safeguarding our rights. But if these reports are true, it appears that for millions of Texans their sacred right to vote was put in jeopardy by the Governor himself. Shameful. https://t.co/q61REjuhio|en|D|11|23
1136042387329953792|1074129612|Tue Jun 04 22:49:46 +0000 2019|We just passed the #DreamAndPromiseAct in the House! I’m proud to stand with #Dreamers, #TPS holders, and #DED holders today. https://t.co/C9CEzI4aqy|en|D|5|20
1136009609800486912|1074129612|Tue Jun 04 20:39:31 +0000 2019|Bigoted assumptions are inexcusable for a teacher entrusted with educating all our students. Fort Worth benefits greatly from the presence of Latino immigrants and their children. This teacher is not serving our diverse community and needs to go. https://t.co/bc05MAF8xX|en|D|3|9
1135950480797032449|1074129612|Tue Jun 04 16:44:34 +0000 2019|Today is the day. Soon, the House will vote on #HR6, the #DreamAndPromiseAct. And I’m excited to vote. Thank you to all who’s tireless advocacy made this day possible! #ProtectTheDream|en|D|9|31
1135686909831892992|1074129612|Mon Jun 03 23:17:14 +0000 2019|Inspiring. This #ImmigrantHeritageMonth we recognize the contributions of immigrants from every corner of the world in every corner of America. I am proud that Texas is home to so many. #CelebrateImmigrants https://t.co/c3TH6ubWHI|en|D|8|25
1135194792424628228|1074129612|Sun Jun 02 14:41:44 +0000 2019|I'm proud to stand up for my LGBT friends, relatives, and neighbors. This #PrideMonth, and every month after, let us all continue the fight for equality. 🏳️‍🌈|en|D|6|16
1134854985315995648|1074129612|Sat Jun 01 16:11:27 +0000 2019|I am heartbroken by the news of yet another mass shooting. How many more lives will be lost before we fix our nation’s gun laws? #EnoughIsEnough|en|D|4|19
1134478840649134080|1074129612|Fri May 31 15:16:47 +0000 2019|Bottom line: Texans can’t afford the President’s latest short sighted move. Let’s work to address immigration in a compassionate way that reflects America’s values. Not hurt regular Texans. https://t.co/f3HahaE1es|en|D|31|56
1134220122988654594|1074129612|Thu May 30 22:08:44 +0000 2019|More proof that voter suppression is real - and unacceptable. I call on the Senate to immediately bring #HR1 to a vote. https://t.co/jvt5ZwhXkS|en|D|7|10
1133480594204168192|1074129612|Tue May 28 21:10:07 +0000 2019|Today I sent a letter to @AjitPaiFCC to urge him to not implement a cap on Universal Service Fund Programs. This is an attack on low-income households across the country, but particularly those in rural America. This is a cruel proposal that deserves public accountability. https://t.co/NyZTkVy3Hm|en|D|3|7
1133456896323674115|1074129612|Tue May 28 19:35:57 +0000 2019|During Whitley’s tenure, the voting rights of tens of thousands of Texans were on the line. His resignation is long overdue. We must continue to work to protect every Texan’s right to vote – which is why I again call on the Senate to bring #HR1 to a vote. https://t.co/ucNpJgE85R|en|D|4|4
1133427680647557123|1074129612|Tue May 28 17:39:51 +0000 2019|.@RepColinAllred and I want to hear from you tonight! We're hosting a joint town hall in Dallas to answer your questions and share our priorities in Congress. Please come out and join us for a convo at 6PM CT at North Dallas High School. RSVP here ▶️https://t.co/Ip4iYZ5CXB https://t.co/Xwe28wH01g|en|D|6|10
1133033298886877184|1074129612|Mon May 27 15:32:43 +0000 2019|"This #MemorialDay, I want to honor the unsung heroes of the 320th all black Battalion for their crucial contribution to our victory on D-DAY.
Despite facing discrimination at home, these men proudly served their country. Proud to recognize their sacrifice on the House floor. https://t.co/3UJZ7YFvJy"|en|D|96|398
1132033208156131329|1074129612|Fri May 24 21:18:43 +0000 2019|Thanks for having me! @TrinityMetro is critically important in the DFW area. Thanks for all the work you do! https://t.co/5nQDXMOzXK|en|D|3|13
1131939923932667906|1074129612|Fri May 24 15:08:02 +0000 2019|Kicking off my MMB at @TrinityMetro early this morning. I’ll be meeting with TEXRail employees and getting a tour of the maintenance facility before I board the eastbound train from Mercantile Center Station. Come say hi if you see me on the train! https://t.co/Rl2ME62PIt|en|D|3|5
1131623552086618113|1074129612|Thu May 23 18:10:54 +0000 2019|Looking forward to joining forces with @RepColinAllred for our Dallas town hall. Join us on May 28th at 6:00PM CT at North Dallas High School for a great conversation as we answer your questions on the latest in Congress! RSVP ➡️https://t.co/qbersF5Bo0 https://t.co/LgSO3uUDTV|en|D|9|23
1131590477160079361|1074129612|Thu May 23 15:59:28 +0000 2019|The GOP created an undue burden on #GoldStar families w/ a tax provision that passed in the Trump’s tax scam, creating huge unexpected tax hikes for servicemember families. Before #MemorialDay, I’m proud to support the #SECUREAct to right this wrong for our military families. https://t.co/HkVimOMSVg|en|D|4|6
1131227305509101569|1074129612|Wed May 22 15:56:21 +0000 2019|The threat facing #Dreamers, #TPS, and #DED holders is a crisis created by the Trump Admin. #HR6 will shield these communities from deportation and keep families together. Let’s get this bill on the House floor for a vote. #DreamAndPromiseNow https://t.co/2O11VsFHB2|en|D|17|23
1130882298033954816|1074129612|Tue May 21 17:05:25 +0000 2019|Autonomy of your body is a basic human right. We must speak out and fight until women are guaranteed that right. #StopTheBans https://t.co/YQvg5HOio5|en|D|2|4
1130837167528402945|1074129612|Tue May 21 14:06:05 +0000 2019|Muhlaysia’s death is devastating for the black transgender community, but it’s also part of a much larger trend that shows the violence, discrimination, and fear transgender and LGBTQ communities continue to face. Our brothers and sisters are dying. #SayHerName https://t.co/k7uNCytPZ1|en|D|180|455
1130569217558945793|1074129612|Mon May 20 20:21:21 +0000 2019|Texas Dems contributed to #SB9 being struck down in the House today. But, HB2911 was approved with provisions that could open the door to another voter roll purge, increasing voter suppression efforts across the state. Thanks, @BetoORourke for the support – the fight continues! https://t.co/KifGOKVW3T|en|D|4|6
1130542396696092673|1074129612|Mon May 20 18:34:46 +0000 2019|Devastated to hear Muhlaysia, a 23-year-old transgender woman in Dallas, has been fatally shot. Earlier this year she faced an attack on her own life. She has shown courage, strength and great personal sacrifice in the fight for equality. I’ll be honoring her on the House floor. https://t.co/bebFnhjR8c|en|D|5|12
1129505130129305600|1074129612|Fri May 17 21:53:02 +0000 2019|SB9 is a GOP-backed bill in the Texas legislature designed to discriminate against minority citizens &amp; new voters. It would create criminal penalties for minor typos on voter registration forms. Let's call it what it is – straight-up voter suppression. https://t.co/zgGZJm2roG|en|D|4|8
1129446036458676224|1074129612|Fri May 17 17:58:13 +0000 2019|SUCCESS!! #HR5 has passed the House and is off to the Senate! The #EqualityAct will end the discrimination facing our #LGBTQ brothers &amp; sisters across America. https://t.co/ArwccmrRUj|en|D|2|15
1129422722604380161|1074129612|Fri May 17 16:25:35 +0000 2019|As we continue working to achieve justice for all Americans, we must remember how far we’ve come. 65 years after #BrownvBoard set the stage for desegregation across all sectors of our society, we remain committed to fight and ensure every American has an equal shot at success. https://t.co/q55dFuYuxe|en|D|1|4
1129123138606895107|1074129612|Thu May 16 20:35:08 +0000 2019|My bipartisan bill w/ @RepGregStanton to reauthorize the Energy Efficiency &amp; Block Grant Program is one step closer to getting a floor vote! This creates an opportunity for cities to innovate &amp; invest in infrastructure to reduce harmful emissions &amp; provide more good paying jobs. https://t.co/JYW3rTXMb0|en|D|5|11
1129083813471150080|1074129612|Thu May 16 17:58:53 +0000 2019|Thank you to Commissioner @JRosenworcel for laying out the truth in @EnergyCommerce. We need to stand up for our veterans, seniors, and low-income families that will lose vital broadband services if the FCC caps the number of people that benefit from programs like Lifeline. https://t.co/yzha4rnqIt|en|D|7|19
1129071810782420993|1074129612|Thu May 16 17:11:11 +0000 2019|Nearly 20% skip medical doses because of high prescription costs. That’s 1 in 5 Americans. Dallas-Fort Worth has the highest uninsured rate of any district, and affording medication is a huge part of helping our health centers. Today I cast my vote to lower RX drug prices! https://t.co/v2GnSYQLZY|en|D|7|6
1129035402436853760|1074129612|Thu May 16 14:46:31 +0000 2019|Funding the Energy Efficiency &amp; Block Grant program will help cities like Dallas have the resources to reduce harmful emissions, modernize infrastructure, create jobs for blue-collar workers, and contribute to the health of our communities. Glad to be leading this bill. https://t.co/0C70PMIsdf|en|D|4|3
1128708169117700096|1074129612|Wed May 15 17:06:12 +0000 2019|.@RepColinAllred and I opening up my annual Heath and Fitness Expo with aerobics! Throwing it down with a push-up challenge. Ex-NFL pro vs me. Take your bets. 1/3 https://t.co/MFH0i3vdn1|en|D|12|53
1128680251129778176|1074129612|Wed May 15 15:15:16 +0000 2019|What year are we in? GOP in AL voted to punish women. That’s what this vote represented, punishing women for exercising the right #RoevWade grants them to get an abortion. Not only would this bill throw them in prison for 99yrs, it refuses to take into account rapes or incest. https://t.co/XSWVlajYnF|en|D|5|10
1128326285871276032|1074129612|Tue May 14 15:48:44 +0000 2019|The West Point Class of 2019 has 32 black women graduating, the largest number of black women to graduate from the institution ever. Representation matters, and I’m proud these young women are leading the charge. Congratulations to all the graduates! https://t.co/a1dx8LJpDR|en|D|49|131
1128010678013444097|1074129612|Mon May 13 18:54:37 +0000 2019|We're asking our Republican colleagues to join us to make real &amp; lasting investments in our infrastructure. Dems are focused on growing the economy, creating good paying jobs for blue-collar workers, and modernizing our nation’s mass transit and roadways to #BuildForTomorrow. https://t.co/NNBYqPDZGA|en|D|1|5
1127629882991751169|1074129612|Sun May 12 17:41:29 +0000 2019|Happy Mother’s Day to all the mothers and mother figures that continue to inspire their children to dream bigger and aim higher. I’m thankful to my wife, Tonya, for being a great mother and example of grace and strength for our son. https://t.co/OvCgrW97Ea|en|D|6|25
1127286514172465152|1074129612|Sat May 11 18:57:03 +0000 2019|Congratulations to Grand Prairie resident, Holly Bartos from @LockheedMartin for being selected by @NSCsafety and @SafetyHealthMag as a recipient of the 2019 NSC Rising Stars of #Safety Award! Rising stars like Holly help keep our workers safe on the job. https://t.co/e6ANNMJ3pz|en|D|1|5
1126945064515710976|1074129612|Fri May 10 20:20:15 +0000 2019|#SmallBusinessWeek is a reminder of the positive changes we can make in our local businesses. Today, I want to share a bill I intro'd w/ @RepPeteStauber to protect small biz construction contractors by eliminating the costs many small businesses face for extra work ordered. https://t.co/K6vGEq7GJ3|en|D|0|2
1126892327816110080|1074129612|Fri May 10 16:50:42 +0000 2019|Honored to have presided on the House floor during the adoption of an amendment from my colleague, fellow Texas Dem @RepFletcher, that will bring much needed relief and resources to Texas residents who suffered under Hurricane Harvey. https://t.co/2Nmfmr1ACD|en|D|1|16
1126872113577693185|1074129612|Fri May 10 15:30:22 +0000 2019|We can rebuild our nation’s infrastructure &amp; close the unemployment gap in communities of colors by working w/ cities across the country to make long-lasting investments to improve our highways, bridges, and public transportation. This is not a partisan issue. Let’s get it done. https://t.co/bfxThevAgb|en|D|1|4
1126614442312126464|1074129612|Thu May 09 22:26:29 +0000 2019|#SmallBusinessWeek is a reminder of the positive changes we can make in our local businesses. Today, I want to share a bill I intro'd w/ @RepPeteStauber to protect small biz construction contractors by eliminating the costs many small businesses face for extra work ordered. https://t.co/rPaHckCl5c|en|D|0|2
1126554810461884417|1074129612|Thu May 09 18:29:31 +0000 2019|The Trump Administration is trying to make it legal once again to discriminate against Americans with pre-existing conditions. Today, I'm voting YES on H.R. 986 to protect the health care of over 130M Americans who could lose critical protections they have thanks to the #ACA. https://t.co/EX7haGViBf|en|D|2|11
1126518058049257473|1074129612|Thu May 09 16:03:29 +0000 2019|Join me and my friend, ex @NFL pro @RepColinAllred for my annual Health and Fitness Expo on May 15th! We'll be joined by healthy lifestyle advocates such as @OutdoorAfro and @TheFirstTeeDC that are encouraging Americans to stay active! https://t.co/kflNMiB8Gv|en|D|2|13
1126252257937436672|1074129612|Wed May 08 22:27:17 +0000 2019|Chronic diseases such as diabetes and obesity affect communities of color and poor people at a much higher rate. That's why today I intro'd a resolution to make May Health &amp; Fitness Month to ensure America's youth have the resources to enjoy healthy and active lives. https://t.co/RpYpWLTP3u|en|D|3|14
1126155217718992897|1074129612|Wed May 08 16:01:41 +0000 2019|My friend and @MachinistsUnion President, @IAMBobMartinez has dedicated his life to fighting for union workers in Texas and across the country. Proud a Fort Worth native is leading the charge on behalf of our working families! https://t.co/Z3sOUoMSC6|en|D|0|5
1125854186447560711|1074129612|Tue May 07 20:05:30 +0000 2019|Happy #TeacherAppreciationDay to all the educators in the DFW Metroplex that go above and beyond to empower and encourage our students to achieve their dreams. I’m thankful for all you do to help our children, our schools, and our communities. https://t.co/knxspgqcpd|en|D|2|5
1125800686074122242|1074129612|Tue May 07 16:32:54 +0000 2019|We need to #ActOnClimate now. I’m excited to lead efforts w/ @RepScottPeters on a Climate Playbook that includes three of my bills to incentive businesses to reduce their carbon footprint and make investments in technology to reduce emissions. https://t.co/lDjTJXwAui|en|D|5|16
1125781508051091457|1074129612|Tue May 07 15:16:42 +0000 2019|"I’ve been to the border and seen immigrant detention centers with my own eyes. No one should have to go through what these families endured under Trump’s #FamilySeparation policy. One year later, we must keep fighting #UntilEveryFamilyIsReunited.
https://t.co/Myn8ZIkLKs"|en|D|13|32
1125455122031685632|1074129612|Mon May 06 17:39:45 +0000 2019|Happy National #SmallBusinessWeek to the 2.7M small businesses in TX! Eliminating barriers to capital for minority-owned businesses is a key priority for North Texans and it’s always top-of-mind for me on @HouseSmallBiz to ensure @SBAgov continues to work for them! https://t.co/WcZNHtadvf|en|D|3|4
1125417207360630790|1074129612|Mon May 06 15:09:06 +0000 2019|On @MSNBC w/ @AlexWitt sharing the highlights of the 60+ jobs I've done across Dallas-Fort Worth since I've been elected to Congress, including being an @Uber driver last month. Favorite jobs include being a firefighter, UPS carrier, rancher, dry cleaner, roofer, and dog walker! https://t.co/x4vOu3vgun|en|D|5|13
1124333100648075264|1074129612|Fri May 03 15:21:14 +0000 2019|"We need legislation that will modernize, restore, &amp; rebuild our infrastructure in fast growing cities like DFW. Last week, I met with business leaders in Dallas about the need to address climate change and expand alternative mass transportation in Texas.
https://t.co/t9HjtJthTb"|en|D|2|7
1124094392514621440|1074129612|Thu May 02 23:32:42 +0000 2019|When bad weather leaves you stranded on the tarmac, best to be with a friend and fellow Texan. Cheers to our @AmericanAir takeoff, @RepRWilliams! https://t.co/ukZXJxd45E|en|D|6|15
1124058151752482817|1074129612|Thu May 02 21:08:42 +0000 2019|"Steps we must take to eliminate racial disparities in maternal &amp; infant mortality to ensure #BlackMamasMatter.
✔️Create access to quality affordable health care
✔️Grow diverse teams that integrate community health workers &amp; midwives 
✔️Build a more diverse health care force https://t.co/y41mPmtkCJ"|en|D|5|15
