id|user|created_at|text|lang|label|retweet_count|favorite_count
1199741927337447424|15356407|Wed Nov 27 17:29:00 +0000 2019|Many people who are connected with me on Twitter aren’t connected with me on Instagram! Follow me at RepRobWittman… https://t.co/HCs6HBbtnk|en|R|2|6
1199411499980058624|15356407|Tue Nov 26 19:36:00 +0000 2019|Did you know my office can schedule a tour for you? Or that we can help with social security problems and VA claims… https://t.co/ZGdJAaKGg0|en|R|2|8
1199085894420094977|15356407|Mon Nov 25 22:02:09 +0000 2019|This morning, I attended the Hampton Roads Chamber of Commerce Congressional Forum with @BobbyScott and… https://t.co/fdwxm5pP7K|en|R|2|5
1198642935702544386|15356407|Sun Nov 24 16:42:00 +0000 2019|Realistic training for possible dangerous situations is critical to keeping Americans serving overseas safe. The Di… https://t.co/uockNW7uvl|en|R|1|8
1198286336160980992|15356407|Sat Nov 23 17:05:00 +0000 2019|Today is National Adoption Day! As a child of adoption, I know firsthand the transformative power family can have.… https://t.co/EsCNDCRUX2|en|R|8|18
1198259408599502850|15356407|Sat Nov 23 15:18:00 +0000 2019|We are less than one week out from Thanksgiving, and I wanted to pass along this great information from the USDA on… https://t.co/7hwyxUpubK|en|R|6|11
1197616170108624914|15356407|Thu Nov 21 20:42:00 +0000 2019|Yesterday, we took a great step in addressing this critical issue facing waterfowl habitat throughout the nation by… https://t.co/ozpaMoeNqA|en|R|2|9
1197586699964080128|15356407|Thu Nov 21 18:44:54 +0000 2019|ICYMI: Yesterday, I and several colleagues introduced the new House Suburban Caucus aimed at increasing the quality… https://t.co/PGTCl3Y092|en|R|2|3
1197282366684880901|15356407|Wed Nov 20 22:35:35 +0000 2019|One of my key initiatives passed the House today: the reauthorization of the North American Wetlands Conservation A… https://t.co/8kZY2mtn9J|en|R|2|15
1197211684257124353|15356407|Wed Nov 20 17:54:43 +0000 2019|Today, I, along with several of my colleagues including Rep. Ann Wagner (R, MO-2), announced the new House Suburban… https://t.co/QjEhB41tNr|en|R|3|9
1196892547211309056|15356407|Tue Nov 19 20:46:35 +0000 2019|Today, House Democratic Leadership reaffirmed their commitment to budgeting by crisis, moving goalposts, and not do… https://t.co/LKTZMUbnIr|en|R|1|9
1196884763551977472|15356407|Tue Nov 19 20:15:39 +0000 2019|The U.S.-India tri-service exercise, TIGER TRIUMPH, is taking place in India from 13-21 Nov. The exercise is the fi… https://t.co/OM5Ai68k67|en|R|3|15
1196552424879775744|15356407|Mon Nov 18 22:15:03 +0000 2019|Attn FXBG drivers: Starting today George St will be restricted to one-way westbound traffic between Sophia St &amp; Car… https://t.co/Tb2UY8eGCj|en|R|2|1
1196486564819427328|15356407|Mon Nov 18 17:53:21 +0000 2019|Completing an audit of this magnitude is a huge undertaking, and I'm proud to report real progress has been made wi… https://t.co/WWSbBAZhzZ|en|R|1|8
1196449985690308608|15356407|Mon Nov 18 15:28:00 +0000 2019|November is National Alzheimer’s Awareness month. Research is still critical to bringing this disease to an end. I… https://t.co/c9sHWztAFL|en|R|2|4
1196101439279337474|15356407|Sun Nov 17 16:23:00 +0000 2019|As I have said for months, the time to pass the USMCA is now. More than one million American jobs are on the line,… https://t.co/chD8YHv8Ev|en|R|238|962
1195767991994081280|15356407|Sat Nov 16 18:18:00 +0000 2019|This week important veterans bills passed the House with my strong support. 9 vets bills passed on Tues including m… https://t.co/LWV3tMCYdZ|en|R|4|18
1195439896309186560|15356407|Fri Nov 15 20:34:16 +0000 2019|One of my top priorities in Washington is closing the digital divide, especially when it will increase accessibilit… https://t.co/Q6gLH5ISAD|en|R|1|1
1195402451211505665|15356407|Fri Nov 15 18:05:28 +0000 2019|House Dem Leadership has made it quite clear that they care about politics, not policy. We are elected to represent… https://t.co/lZ9GeYrhTY|en|R|3|22
1195035918089904128|15356407|Thu Nov 14 17:49:00 +0000 2019|Saturday, I was honored to officiate a pinning ceremony to recognize the service of Vietnam Vets in Fxbg. This even… https://t.co/xzakq779uf|en|R|1|4
1195029799359721473|15356407|Thu Nov 14 17:24:41 +0000 2019|Thanks so much to seniors and faculty from King George High School for stopping by for a quick visit on this chilly… https://t.co/lXfjK9TPbL|en|R|7|15
1195008855287222272|15356407|Thu Nov 14 16:01:27 +0000 2019|This is disappointing, upsetting, absolutely unacceptable. Another stopgap CR through 12/20 strongly signals anothe… https://t.co/9Mc1me7Iv6|en|R|10|29
1194726544989655043|15356407|Wed Nov 13 21:19:39 +0000 2019|Carriers continue to be a pivotal power projection platform for our @USNavy. November is National U.S. Navy… https://t.co/CJ6dxlT1ET|en|R|1|11
1194725944377905152|15356407|Wed Nov 13 21:17:16 +0000 2019|I am glad to see the repairs to the USS Truman are complete and that it will soon return to operation. Thank you to… https://t.co/cELZXyXp1j|en|R|1|3
1194274651867897856|15356407|Tue Nov 12 15:24:00 +0000 2019|Even though the 2020 Census does not start until next year, I wanted to give you an early warning of things to look… https://t.co/yAbzKntsqG|en|R|3|5
1193886343388188673|15356407|Mon Nov 11 13:41:00 +0000 2019|Today, we remember the countless men and women who, over the course of our history, have served our nation in unifo… https://t.co/SthTYxM48M|en|R|7|28
1193537293379760128|15356407|Sun Nov 10 14:34:00 +0000 2019|Happy birthday to our United States Marine Corps! I am so proud to represent the thousands of Marines who call VA01… https://t.co/8Q5YR7RQyX|en|R|2|13
1193202084553854976|15356407|Sat Nov 09 16:22:00 +0000 2019|Do you have the right ID? I wanted to make sure you knew about a new ID requirements for boarding domestic flights… https://t.co/Kq1Zqbj60k|en|R|2|7
1192521600773419009|15356407|Thu Nov 07 19:18:00 +0000 2019|I'm dedicated to the future success of our forces. I support the Commandant’s call for new capabilities that make t… https://t.co/mirGGVhG48|en|R|3|9
1191729049615425536|15356407|Tue Nov 05 14:48:41 +0000 2019|Friday, I participated in a Vets Forum hosted by Va Sen Bryce Reeves in Fredericksburg. Forums like the one we held… https://t.co/plLPSbJnWL|en|R|0|5
1191433758467133441|15356407|Mon Nov 04 19:15:18 +0000 2019|Read my statement here on the status of the Block V contract for our submarine program: https://t.co/E5wmr51CLr|en|R|0|1
1191383929435103235|15356407|Mon Nov 04 15:57:18 +0000 2019|This morning, I hosted the #VA01 Senior Resources Fair in Fredericksburg to connect seniors with resources availabl… https://t.co/sQ7T54U5FV|en|R|3|5
1191365468063510528|15356407|Mon Nov 04 14:43:56 +0000 2019|This weekend, I had the incredible honor to participate in the American First Policies: USMCA–A Better Deal for Ame… https://t.co/32KNIhHkM5|en|R|1|8
1191009134570684416|15356407|Sun Nov 03 15:08:00 +0000 2019|There are still a few weeks of fall left, so get out and enjoy everything Va has to offer this season! As we gear u… https://t.co/vGB0AmGMlu|en|R|1|13
1190622839486996480|15356407|Sat Nov 02 13:33:00 +0000 2019|ATTN SENIORS: Monday, I will be hosting the First District Senior Resources Fair at the Dorothy Hart Community Cent… https://t.co/l8Kxf8Gy0V|en|R|1|5
1190296438514888704|15356407|Fri Nov 01 15:56:00 +0000 2019|A great program to keep our Bay clean and thriving! I am a vocal supporter of our working waterfronts and the healt… https://t.co/86RjLocMaL|en|R|0|9
1189969247478435841|15356407|Thu Oct 31 18:15:51 +0000 2019|I am so glad to introduce this important piece of legislation with @BobbyScott and @RepSarbanes to protect our Bay… https://t.co/Hz7TtyNxcs|en|R|2|16
1189936894638985216|15356407|Thu Oct 31 16:07:18 +0000 2019|Check out my statement on today's #ImpeachmentResolution vote. https://t.co/VilZmNfwhv|en|R|16|47
1189904355014709249|15356407|Thu Oct 31 13:58:00 +0000 2019|ONE DAY LEFT in the Congressional App Challenge for Va’s First District! Our panel of judges are looking forward to… https://t.co/7YhK67TgaS|en|R|0|1
1189664757160316930|15356407|Wed Oct 30 22:05:55 +0000 2019|I offered a Motion to Recommit that would delay the implementation of HR 1373 until the Sec of Interior issues a re… https://t.co/M5k9wYYTPb|en|R|2|10
1189664502163345409|15356407|Wed Oct 30 22:04:54 +0000 2019|Uranium is essential to both our national and energy security. It supplies many critical military technologies and… https://t.co/4vKnc4RFMZ|en|R|2|5
1189618749604802560|15356407|Wed Oct 30 19:03:06 +0000 2019|Had a great time packing care packages today with @the_USO for our troops overseas. As we approach veterans day, it… https://t.co/J6If9g8ZYn|en|R|0|7
1189595561130889217|15356407|Wed Oct 30 17:30:58 +0000 2019|Ensuring that folks in our nation have access to affordable and impactful cures to life-threatening illnesses such… https://t.co/V6kUwxP15v|en|R|0|3
1189301538860290049|15356407|Tue Oct 29 22:02:37 +0000 2019|I just voted in favor of the PACT Act that will impose sanctions on Turkey – prohibiting the transfer of US defense… https://t.co/wQ93lDBn5z|en|R|4|19
1189264639814594561|15356407|Tue Oct 29 19:36:00 +0000 2019|Last night I was proud to support the Palliative Care and Hospice Education and Training Act. This bill promotes ed… https://t.co/Iq3dPYnNFT|en|R|0|8
1189203753716592642|15356407|Tue Oct 29 15:34:03 +0000 2019|I was saddened to hear today of the passing of former Governor of Virginia, Gerald Baliles. Gov. Baliles fought har… https://t.co/AnnCwzljyp|en|R|1|6
1189160875875287045|15356407|Tue Oct 29 12:43:41 +0000 2019|Yesterday, the Full Utilization of the Harbor Maintenance Trust Fund Act passed the House with my strong support. T… https://t.co/WaXS3JfIyh|en|R|1|5
1188917128646266886|15356407|Mon Oct 28 20:35:07 +0000 2019|There are over 19 million veterans in the U.S. #VeteranTreatmentCourtCoordinationAct will help state and local gove… https://t.co/bSH7Rewd3t|en|R|2|11
1188809389911633920|15356407|Mon Oct 28 13:27:00 +0000 2019|I agree w @USNavyCNO on the importance of training and maintenance to keep @USNavy the strongest and most capable i… https://t.co/BgRr9oJmD5|en|R|4|10
1188468644868739073|15356407|Sun Oct 27 14:53:00 +0000 2019|Attention Va Hunters: Muzzleloader season starts this Saturday. Click below for more information on state regulatio… https://t.co/PvxoSSDsei|en|R|1|11
1188302298482528256|15356407|Sun Oct 27 03:52:00 +0000 2019|Want to stay up to date with the latest news and information from Washington and around our area? Click below to si… https://t.co/KYxZlYPQBV|en|R|1|6
1187758465357189123|15356407|Fri Oct 25 15:51:00 +0000 2019|Tomorrow is Prescription Drug Take Back Day. If you have expired or unused prescription medications, please check w… https://t.co/ScD1jwfqWQ|en|R|1|5
1187714424938741760|15356407|Fri Oct 25 12:56:00 +0000 2019|Just ONE WEEK LEFT in the first Congressional App Challenge for Virginia’s First District! The deadline for student… https://t.co/rp5jPObaMW|en|R|0|3
1187360098496237570|15356407|Thu Oct 24 13:28:02 +0000 2019|This week, the House passed the Natl POW/MIA Flag Act, requiring the black POW/MIA flag to be flown on certain fede… https://t.co/Kuq5D7L31h|en|R|3|11
1187154485220655105|15356407|Wed Oct 23 23:51:00 +0000 2019|So glad to see these results from Va students! Ensuring our students are prepared for jobs of the future is somethi… https://t.co/koMgAfezqC|en|R|0|9
1187147079241609218|15356407|Wed Oct 23 23:21:34 +0000 2019|Today, Democratic Leadership brought the SHIELD Act up for a vote. This bill, which passed with exclusively Dem sup… https://t.co/oC840aIUT1|en|R|2|14
1187088308335251456|15356407|Wed Oct 23 19:28:02 +0000 2019|Great meeting today with @NASA_Langley Director Clay Turner. Va has played a critical role throughout the 60+ yr hi… https://t.co/0lvfv6mYip|en|R|4|23
1187083929259565056|15356407|Wed Oct 23 19:10:38 +0000 2019|Just tried to enter the room where the Intel Comm is interviewing witnesses for this partisan impeachment process.… https://t.co/wYycRw9dgM|en|R|577|1620
1187083078600134657|15356407|Wed Oct 23 19:07:15 +0000 2019|It is absolutely necessary for the Speaker to hold a vote in the full House to formally authorize an impeachment in… https://t.co/UPXbGSKNtb|en|R|41|98
1186642360911876096|15356407|Tue Oct 22 13:56:00 +0000 2019|There are only 10 DAYS LEFT for the Congressional App Challenge! We are looking for the best student coders, develo… https://t.co/xdFWBNrdVO|en|R|0|2
1186617699989893120|15356407|Tue Oct 22 12:18:00 +0000 2019|Our job as Members of Congress is to do the work of the people. We owe it to the American people to hold ourselves… https://t.co/WojTtw90Ex|en|R|36|130
1186285509598777345|15356407|Mon Oct 21 14:18:00 +0000 2019|ICYMI: Earlier this month, VDOT unveiled their latest solutions to the congestion along I-95 here in our area. The… https://t.co/zmyUIX5Y9G|en|R|3|9
1185575581708013569|15356407|Sat Oct 19 15:17:00 +0000 2019|ICYMI: The defense enterprise must be as adaptable as it asks Marines to be, and must have the intestinal fortitude… https://t.co/Emc2oWFlj3|en|R|0|7
1185225524999667713|15356407|Fri Oct 18 16:06:00 +0000 2019|This month is Domestic Violence Awareness Month. Domestic violence affects millions, both women and men, of every r… https://t.co/KXfOfERfPR|en|R|2|8
1184919175606755328|15356407|Thu Oct 17 19:48:40 +0000 2019|NASA is inviting students to submit essays to name NASA’s next Mars rover. Kindergarten through 12th Grade students… https://t.co/Rs2FwUiYtB|en|R|5|6
1184799265555668994|15356407|Thu Oct 17 11:52:12 +0000 2019|I am so deeply saddened to hear of the passing of my colleague from Maryland, @RepCummings. He will be missed, and… https://t.co/neOp6nARJh|en|R|2|32
1184507657153138690|15356407|Wed Oct 16 16:33:27 +0000 2019|Today is National Support Your Local Chamber Day to recognize and thank local chambers across the country for all t… https://t.co/3xafQyxvNr|en|R|2|6
1184494025895763969|15356407|Wed Oct 16 15:39:17 +0000 2019|.@VaDOT will hold public meetings throughout the state for the public to review and provide comments on transportat… https://t.co/uU68EFnfZE|en|R|0|2
1184109924248211456|15356407|Tue Oct 15 14:13:00 +0000 2019|This month was declared Passenger Rail Month by @GovernorVA; it's a great time to draw attention to the many import… https://t.co/J2k0vjpDtm|en|R|0|4
1183743006492389377|15356407|Mon Oct 14 13:55:00 +0000 2019|Cleaning up our vibrant Bay is something I care deeply about. That is why I take part each year in the Clean the Ba… https://t.co/Pf5TbzIhmX|en|R|1|11
1183369797557542912|15356407|Sun Oct 13 13:12:00 +0000 2019|Happy 244th birthday to the @USNavy! As Ranking Member of the Seapower and Projection Forces Subcommittee on HASC,… https://t.co/1Iq9Face31|en|R|2|16
1183052959275311104|15356407|Sat Oct 12 16:13:00 +0000 2019|This month is National Cybersecurity Awareness Month, a collaborative effort between government and industry to rai… https://t.co/6AFyf8kf1T|en|R|0|6
1182670438716985345|15356407|Fri Oct 11 14:53:00 +0000 2019|I'm so glad to see this program achieving real results for folks in our area. Homelessness continues be an issue th… https://t.co/2bTpzRF4Yz|en|R|1|7
1182391048829636615|15356407|Thu Oct 10 20:22:48 +0000 2019|Today is #WorldMentalHealthDay. Know that you are never alone and that there are always resources available to you.… https://t.co/jeopt6MJ8E|en|R|0|8
1182381977477046272|15356407|Thu Oct 10 19:46:45 +0000 2019|We must continue to support our partners in times of need. These aggressive actions by Turkey threaten to halt mome… https://t.co/8t9JKYntf4|en|R|0|11
1182291018110177280|15356407|Thu Oct 10 13:45:19 +0000 2019|Check out this behind the scenes video for an inside look at a day-in-the-life on Capitol Hill for the office of VA… https://t.co/0y1qzTFjFQ|en|R|7|49
1182093719509573632|15356407|Thu Oct 10 00:41:19 +0000 2019|At Lowery’s in Tappahannock - had a great meal with great folks on staff there! https://t.co/qkVn1MbhkE|en|R|1|27
1181960511056945152|15356407|Wed Oct 09 15:52:00 +0000 2019|October is Down Syndrome Awareness Month. The love and joy that is spread by people with Down Syndrome is immeasura… https://t.co/fst7ShfOn3|en|R|20|65
1181585607564414976|15356407|Tue Oct 08 15:02:16 +0000 2019|Check out my latest in War on the Rocks. As we move into the next decade of the 21st Century, we must continue to s… https://t.co/lVFbQSvSZt|en|R|0|4
1181568333726076930|15356407|Tue Oct 08 13:53:37 +0000 2019|In General Berger’s new Planning Guidance, he outlines his plan to solidify the Marine Corps’ place as the world’s… https://t.co/XaQZkmNWhN|en|R|0|9
1181567672485441536|15356407|Tue Oct 08 13:51:00 +0000 2019|Heading into Fall, many folks are ready to break out the fire pits on these now chilly Virginia nights. KNOW BEFORE… https://t.co/z2lzpPGCiO|en|R|2|2
1181305391348686850|15356407|Mon Oct 07 20:28:47 +0000 2019|As an avid outdoorsman and angler, I always enjoy getting out to meet other folks in our area who also enjoy the gr… https://t.co/ztIKHLKox5|en|R|4|18
1180899519786962944|15356407|Sun Oct 06 17:36:00 +0000 2019|It is once again that time across the Commonwealth where deer are abundant along the highways and byways. Please be… https://t.co/2QEe1NV2OJ|en|R|4|14
1180506933100453889|15356407|Sat Oct 05 15:36:00 +0000 2019|Through the art of fly fishing, this program helps in the physical and emotional rehabilitation of disabled active-… https://t.co/ihxglHZFXz|en|R|1|8
1180184979214651392|15356407|Fri Oct 04 18:16:40 +0000 2019|The decision by the DC Circuit Court to uphold the @FCC’s light-touch regulation and transparency provision is esse… https://t.co/nvMUdJjGb8|en|R|3|8
1180138047742107648|15356407|Fri Oct 04 15:10:11 +0000 2019|More great news today proving our economy is thriving! I will continue to support pro-growth, pro-America policies… https://t.co/5ZPT8gGuow|en|R|19|79
1180111074751926274|15356407|Fri Oct 04 13:23:00 +0000 2019|October marks National Crime Prevention Month, a time set aside to recognize the practice of crime prevention, whil… https://t.co/TFqHp4W4NJ|en|R|0|3
1179802143655698432|15356407|Thu Oct 03 16:55:25 +0000 2019|I agree with @McConnellPress and @GOPLeader, we must pass the #USMCANow - it will bring 176,000 jobs and $68 billio… https://t.co/AkzOzWfCTG|en|R|2|7
1179252670739156992|15356407|Wed Oct 02 04:32:00 +0000 2019|October is Breast Cancer Awareness Month. This horrible disease affects the lives of thousands of Americans and the… https://t.co/KomQizB71l|en|R|2|7
1179133240080322560|15356407|Tue Oct 01 20:37:26 +0000 2019|These are real results for real, hardworking Virginians thanks to commonsense tax policies. We need to be putting m… https://t.co/g5uWrvziwR|en|R|3|10
1179041527139426305|15356407|Tue Oct 01 14:33:00 +0000 2019|It is so great to see the progress on this impressive and important project to help veterans here in our area. Serv… https://t.co/5tiSYjyyYo|en|R|0|3
1179033977509810176|15356407|Tue Oct 01 14:03:00 +0000 2019|One month left in the First District Congressional App Challenge. The challenge is open to all middle and high scho… https://t.co/PedtjGQj1E|en|R|0|0
1179020132821209088|15356407|Tue Oct 01 13:07:59 +0000 2019|Yesterday, I spoke at the Prince William County Chamber’s Breakfast in Manassas on my multifaceted efforts in DC to… https://t.co/gxtElk8RcP|en|R|0|4
1178763516657971206|15356407|Mon Sep 30 20:08:17 +0000 2019|I would like to thank @MacTXPress for his tireless work for our nation and our armed forces. After 25 years represe… https://t.co/ByYMs2VD9Z|en|R|0|9
1178680145827258368|15356407|Mon Sep 30 14:37:00 +0000 2019|ICYMI: Last week, my bill, HR 1747, passed out of Natural Resources Committee and we're one step closer to making a… https://t.co/0yW7ji2sgL|en|R|0|5
1178335877438656512|15356407|Sun Sep 29 15:49:00 +0000 2019|Today is Gold Star Mother’s and Family’s Day, a day set aside to pay tribute to these brave men and women in unifor… https://t.co/9p7c3agcRJ|en|R|4|23
1178290578779525120|15356407|Sun Sep 29 12:49:00 +0000 2019|Today is National Urban Wildlife Refuge Day! I am pleased to once again introduce a resolution to recognize these i… https://t.co/D66271gooF|en|R|5|31
1178006960165142528|15356407|Sat Sep 28 18:02:00 +0000 2019|Here are some good guidelines to know this fall for folks heading out to enjoy Virginia State Parks. We are blessed… https://t.co/HWoGJzMaH5|en|R|1|6
1177582664305364992|15356407|Fri Sep 27 13:56:00 +0000 2019|I have cosponsored the Education Freedom Scholarships and Opportunity Act to give students and parents in Virginia… https://t.co/v3opmkMt3w|en|R|2|7
1177309664243068929|15356407|Thu Sep 26 19:51:11 +0000 2019|This month is #ChildhoodCancerAwarenessMonth; it serves as a great reminder to screen your children and talk with y… https://t.co/JaadGprffV|en|R|4|13
1177305096255942656|15356407|Thu Sep 26 19:33:02 +0000 2019|So great to have Alexis, Chelsea, and Pamela here in the office today from Jack &amp; Jill on the Hill to talk about ed… https://t.co/fV3Es9hFSu|en|R|0|11
1177236130753916928|15356407|Thu Sep 26 14:59:00 +0000 2019|Here are some good guidelines to know this fall for folks heading out to enjoy Virginia State Parks. We are blessed… https://t.co/5qJxs9DYpt|en|R|1|9
1176928824145170432|15356407|Wed Sep 25 18:37:52 +0000 2019|Spoke today in the @NatResources markup about several important pieces of legislation to better protect and preserv… https://t.co/xAY2k2cDQq|en|R|2|12
1176927875225858048|15356407|Wed Sep 25 18:34:06 +0000 2019|I had a great meeting today with Va Secretary of Transportation Shannon Valentine as we talked about our commitment… https://t.co/gElzxPQdyD|en|R|0|4
1176642437349040129|15356407|Tue Sep 24 23:39:52 +0000 2019|Without waiting for the call transcripts, House Democrats chose to rely on unconfirmed, secondhand accusations to l… https://t.co/qg576KtK5E|en|R|14|56
1176233753917743104|15356407|Mon Sep 23 20:35:54 +0000 2019|I'll continue to advocate for improvements in Va’s infrastructure. Improving Virginians' quality of life is vitally… https://t.co/7A0u5MulSy|en|R|0|6
1175451118991577088|15356407|Sat Sep 21 16:46:00 +0000 2019|As a former state health official who conducted field research in the Chesapeake Bay, I am aware of the ecological… https://t.co/4vZK7maGj2|en|R|1|9
1175072457088274434|15356407|Fri Sep 20 15:41:20 +0000 2019|The House should have stayed in Washington during August, as I requested, to work on legislation to complete the ap… https://t.co/QxjHKxL1NE|en|R|0|6
1175044942470598656|15356407|Fri Sep 20 13:52:00 +0000 2019|ICYMI: The 1st District Congressional App Challenge is underway! Share this information with the students and teach… https://t.co/0dThXO6PN3|en|R|0|2
1175041018099634176|15356407|Fri Sep 20 13:36:24 +0000 2019|Today is the National POW/MIA Recognition Day, a day set aside to remember all those brave men and women who, in se… https://t.co/iW57I0voK9|en|R|3|17
1174669870006489089|15356407|Thu Sep 19 13:01:35 +0000 2019|I would like to welcome the two newest Members of the House, both from our neighboring state North Carolina! I look… https://t.co/mu8oFwMyhK|en|R|3|16
1174427435909206016|15356407|Wed Sep 18 20:58:15 +0000 2019|As I’ve done in every session since I’ve been in Congress, I have urged leadership to fund our government with appr… https://t.co/SwhSUfFOca|en|R|0|5
1174424456791547905|15356407|Wed Sep 18 20:46:24 +0000 2019|Happy 72nd birthday to the United States Air Force! As a strong supporter of our military and the top Republican on… https://t.co/HorpIXgShn|en|R|2|13
1174109011832168448|15356407|Tue Sep 17 23:52:56 +0000 2019|It is an honor to once again be named by @GOPLeader to the Congressional conference committee to negotiate differen… https://t.co/Xi6J49BeGe|en|R|3|18
1174068002112888834|15356407|Tue Sep 17 21:09:59 +0000 2019|Today I had the chance to attend the 39th Annual Modern Day Marine Expo at Marine Corps Base Quantico right here in… https://t.co/AoI8a1P59C|en|R|0|14
1174024056875737089|15356407|Tue Sep 17 18:15:22 +0000 2019|This is great news for area commuters and all folks throughout our area! I have long been calling for increased att… https://t.co/tG9ulHQEG8|en|R|1|4
1173961434151182336|15356407|Tue Sep 17 14:06:31 +0000 2019|Today we celebrate the founding document of our great democracy, the Constitution of the United States of America,… https://t.co/YHjrcRfmqL|en|R|0|11
1173950416691826690|15356407|Tue Sep 17 13:22:44 +0000 2019|I am announcing the first Congressional App Challenge for Virginia’s First District! This challenge is aimed to fin… https://t.co/BGLqKkHann|en|R|0|0
1173703001539825664|15356407|Mon Sep 16 20:59:36 +0000 2019|Today I attended the September Management Roundtable for Richmond-area business  leaders with my colleague… https://t.co/gdB3uEtIH2|en|R|0|5
1173654404861440002|15356407|Mon Sep 16 17:46:30 +0000 2019|Last week, I testified before the House VA Committee, advocating for our nation’s veterans and the care and service… https://t.co/t0P99BGWY8|en|R|0|2
1172929000106160128|15356407|Sat Sep 14 17:44:00 +0000 2019|For years I have said that we should not budget by crisis. Yet, Democratic leadership has continually kicked the ca… https://t.co/wDyMrknozM|en|R|8|19
1172533896761761800|15356407|Fri Sep 13 15:34:00 +0000 2019|Small business optimism continues to grow thanks to commonsense policies that I and my colleagues have supported in… https://t.co/BeTjI3ocJG|en|R|0|4
