id|user|created_at|text|lang|label|retweet_count|favorite_count
1306952773062230017|15356407|Fri Sep 18 13:46:37 +0000 2020|ALERT: Absentee in-person voting starts today in Virginia. Click here for more information from the Virginia Depart… https://t.co/h5txae7K1o|en|R|8|9
1306691435417284611|15356407|Thu Sep 17 20:28:10 +0000 2020|Each week I’m posting videos sharing the history of our region. Today is #ConstitutionDay, and in the third install… https://t.co/h5XIgYcJHI|en|R|4|5
1306590271409356800|15356407|Thu Sep 17 13:46:10 +0000 2020|Happy #ConstitutionDay! Today we celebrate all the freedoms and rights we hold dear that are enshrined in our natio… https://t.co/M38zjR0mt7|en|R|3|18
1306232261751320577|15356407|Wed Sep 16 14:03:34 +0000 2020|Since the start of the pandemic, I have promised to keep you informed and fight for you. That's why I sent over 125… https://t.co/OeoYijOuey|en|R|7|16
1305939809177870336|15356407|Tue Sep 15 18:41:28 +0000 2020|Today, President Trump presided over the Abraham Accords—a peace deal where the UAE and Bahrain will form diplomati… https://t.co/nqRKNgjgvJ|en|R|3|5
1305884623549988865|15356407|Tue Sep 15 15:02:11 +0000 2020|This weekend, I was honored to be with @AmericanLegion Post 90 and the @HanoverSheriff Dept in #Beaverdam as we rem… https://t.co/cwyJhmSQMY|en|R|4|13
1305867740167704585|15356407|Tue Sep 15 13:55:05 +0000 2020|#DYK: The Census will influence areas including federal funding allowances for hospitals, fire departments, schools… https://t.co/8qAseXI4s1|en|R|2|2
1305597882767204352|15356407|Mon Sep 14 20:02:46 +0000 2020|URGENT IRS INFO: If you make less than $2000/week, click here for important info you should know about the latest p… https://t.co/gjoxELGT4G|en|R|4|5
1305593094608429056|15356407|Mon Sep 14 19:43:45 +0000 2020|Today I am back at it here in Washington after a weekend talking with folks across our region. Congress has 10 days… https://t.co/kburdf3ecm|en|R|3|50
1305506378467946502|15356407|Mon Sep 14 13:59:10 +0000 2020|Pleased to hear about new K-12 Bridge to Broadband Initiative that will help close the homework gap so more student… https://t.co/LK4AeyLDDP|en|R|2|9
1304439948616126464|15356407|Fri Sep 11 15:21:33 +0000 2020|(1/2) Incredibly honored to receive the Vincent T. Hirsch Award from @NavyLeagueUS in recognition of dedication to… https://t.co/sGnLCnpwgi|en|R|2|13
1304390561286303746|15356407|Fri Sep 11 12:05:18 +0000 2020|We all remember where we were 19 years ago today -- whether we were in the office, at school, on the job site, in t… https://t.co/NtmjNBsvkx|en|R|7|25
1304149606226374656|15356407|Thu Sep 10 20:07:50 +0000 2020|Today is #nationalsuicidepreventionday, a time to remind us to look out for and support our friends, family, and ne… https://t.co/F3Uhca4qDD|en|R|1|5
1304123066067415043|15356407|Thu Sep 10 18:22:23 +0000 2020|ALERT: This is BAD NEWS – China is now the world’s biggest shipbuilder. It is clear, we must do more to outpace our… https://t.co/A59G0TZyKo|en|R|37|94
1304120621828395008|15356407|Thu Sep 10 18:12:40 +0000 2020|Have you filled out your census questionnaire yet? The deadline is fast approaching on 9/30! Please be sure to fill… https://t.co/q3R4HEhZvo|en|R|2|4
1304109586740391941|15356407|Thu Sep 10 17:28:49 +0000 2020|As a lover of history, today I share with you the history of the Leedstown Resolves in the second installment of my… https://t.co/Zj1d3qyflH|en|R|1|15
1303789950186463232|15356407|Wed Sep 09 20:18:42 +0000 2020|ALERT: I wanted to provide you with the latest information from the Virginia Employment Commission on the Lost Wage… https://t.co/x62oW6hV8Q|en|R|5|5
1303760725563899904|15356407|Wed Sep 09 18:22:34 +0000 2020|(1/2) I recently had the honor to present my permanent Congressional Record remarks recognizing public servant Dr.… https://t.co/2nFwxVDz5M|en|R|0|6
1303698916987359232|15356407|Wed Sep 09 14:16:58 +0000 2020|(1/3) Last week, I hosted my 2nd virtual broadband Fireside Chat with @BrendanCarrFCC to discuss the @FCC’s efforts… https://t.co/zNQHeuNzNX|en|R|1|3
1303356330233733120|15356407|Tue Sep 08 15:35:38 +0000 2020|Have you filled out your census questionnaire yet? The deadline is fast approaching, fill out your information toda… https://t.co/MC0sD5ENQm|en|R|1|6
1303342685214908420|15356407|Tue Sep 08 14:41:25 +0000 2020|We must ensure that the most vulnerable among us have access to resources they need to remain safe and healthy duri… https://t.co/I0SsAag0VU|en|R|1|1
1302977867102420992|15356407|Mon Sep 07 14:31:46 +0000 2020|Today we recognize and celebrate all hardworking Americans. In 2020, we have faced unprecedented challenges and whi… https://t.co/Z0T0KN5tkB|en|R|3|7
1301903342063550466|15356407|Fri Sep 04 15:21:59 +0000 2020|As a native of our area, it’s important to me to understand our history to better enact measures on your behalf. Pl… https://t.co/J2zAURCGK1|en|R|2|10
1301232373707804675|15356407|Wed Sep 02 18:55:48 +0000 2020|It is clear from the original report from DC Mayor Bowser: remove or relocate monuments to our nation’s founding fa… https://t.co/a3RKIguPeR|en|R|6|18
1301224970371174401|15356407|Wed Sep 02 18:26:23 +0000 2020|Have you filled out your census questionnaire yet? The deadline is fast approaching! Be sure to fill out your infor… https://t.co/tmYN6vpyDV|en|R|1|3
1301199868766154755|15356407|Wed Sep 02 16:46:38 +0000 2020|Today marks the 75th anniversary of the end of the greatest conflict the world has ever known. As we recognize… https://t.co/rMn5SPKozH|en|R|4|12
1301190960831967232|15356407|Wed Sep 02 16:11:14 +0000 2020|Read my statement on DC Mayor Muriel Bowser’s plan to relocate the Washington Monument here: https://t.co/Qy7CZQIl0M|en|R|6|23
1300901315971895300|15356407|Tue Sep 01 21:00:17 +0000 2020|(1/2) Honored to speak at @CarolineHabitat Self-Help Dedication ceremony for five new homes here in the heart of Vi… https://t.co/LJSVveJ4IJ|en|R|1|3
1300859054395359238|15356407|Tue Sep 01 18:12:22 +0000 2020|(1/2) I have advocated for greater telehealth services for patients, especially seniors and those in rural areas, f… https://t.co/xINy3u9pNG|en|R|2|6
1300839953740566530|15356407|Tue Sep 01 16:56:28 +0000 2020|(1/2) Today @HHSGOV @FCC @USDA announced they have signed a MoU to work together on the Rural Telehealth Initiative… https://t.co/WrctIsN4ku|en|R|1|6
1300834891412787200|15356407|Tue Sep 01 16:36:21 +0000 2020|Recently new assistance funds have come to VA from FEMA, HHS, and more to help folks across #VA01 through these dif… https://t.co/8nz8RjsbXL|en|R|4|5
1300523145774936065|15356407|Mon Aug 31 19:57:35 +0000 2020|BREAKING: Pleased to report that following my request from late July, the USDA has announced that they will be exte… https://t.co/p7OnvkncJY|en|R|5|11
1300423551149895680|15356407|Mon Aug 31 13:21:49 +0000 2020|Have you filled out your Census yet? The Census has been a cornerstone of our democracy since the first national co… https://t.co/rvdDc804ZG|en|R|1|4
1299328025469890560|15356407|Fri Aug 28 12:48:36 +0000 2020|Today we celebrate the 57th Anniversary of the #IHaveADream speech by Rev. Dr. Martin Luther King, Jr. May we remem… https://t.co/yxEcH5hcOj|en|R|6|19
1299085948362395648|15356407|Thu Aug 27 20:46:40 +0000 2020|(1/3) Truly honored to receive the Spirit of Enterprise Award frm @USChamber. One of my top priorities in DC is spu… https://t.co/kbItkpEzmA|en|R|2|6
1299065689827926016|15356407|Thu Aug 27 19:26:10 +0000 2020|"(1/2) TONIGHT: I will be hosting a live Telephone Town Hall to answer your questions. Info: 

6p-7p tonight, Thurs,… https://t.co/pH7pMLUVwF"|en|R|2|2
1298687381793644546|15356407|Wed Aug 26 18:22:54 +0000 2020|URGENT IRS DEADLINE APPROACHING: IRA owners, beneficiaries or workplace retirement plan participants who received a… https://t.co/NwYJwW8nBn|en|R|1|3
1298623030739062784|15356407|Wed Aug 26 14:07:12 +0000 2020|I visited the #Westmoreland Co Museum to see their exhibit on the 100th Anniversary of Women’s Suffrage, which we c… https://t.co/xrXIoL7jkC|en|R|3|9
1298351680992489474|15356407|Tue Aug 25 20:08:57 +0000 2020|#DYK: Over 76.5% of housing units have been accounted for in the 2020 Census, with 12.1% counted by census takers a… https://t.co/sja4tqVHqj|en|R|2|4
1298349908228022273|15356407|Tue Aug 25 20:01:54 +0000 2020|I stopped by one of our many local natural resources in #Va01 yesterday to emphasize the importance of public acces… https://t.co/keHc65mfCG|en|R|4|18
1298338146351034369|15356407|Tue Aug 25 19:15:10 +0000 2020|Today we remember the life and legacy of Senator McCain, who passed away two years ago today. His life of service t… https://t.co/PbAZELytgs|en|R|12|86
1298319071688249345|15356407|Tue Aug 25 17:59:22 +0000 2020|Happy birthday to @NatlParkService! 104 years of celebrating our environment and the beautiful public lands all acr… https://t.co/BePfV4kRdl|en|R|3|17
1298263599635259402|15356407|Tue Aug 25 14:18:57 +0000 2020|Today I had the immense pleasure to address the socially distanced @fxbgchamber First Responders Appreciation Bfast… https://t.co/t0lopwMEnm|en|R|4|16
1297683051435175938|15356407|Sun Aug 23 23:52:03 +0000 2020|I am deeply saddened to hear of the passing of the great Virginian public servant, The Honorable John Hager. I send… https://t.co/F5SjsPBmHU|en|R|5|18
1296890815965405184|15356407|Fri Aug 21 19:24:00 +0000 2020|One of our highest civic duties we can do is to exercise our right to vote. I wanted to provide you with this impor… https://t.co/i2t0bwnTse|en|R|1|11
1296826199012933636|15356407|Fri Aug 21 15:07:14 +0000 2020|"(1/3) 
During COVID-19, I am working for you, here are a few of my actions on finding vital healthcare solutions:… https://t.co/Uy45Pkuqva"|en|R|3|15
1296819093291466752|15356407|Fri Aug 21 14:39:00 +0000 2020|Have you taken the Census yet? Respond today! The data collected impacts our localities in tangible ways for the ne… https://t.co/yVAMR6oNtB|en|R|3|6
1296450521910390786|15356407|Thu Aug 20 14:14:25 +0000 2020|https://t.co/wHPn9QnS2H|und|R|2|4
1296193459875971073|15356407|Wed Aug 19 21:12:57 +0000 2020|There are just 12 leg days remaining until the govt runs out of 💰. Congress still has vitally important work to avo… https://t.co/2sTXXV2Oip|en|R|3|16
1296130815206871040|15356407|Wed Aug 19 17:04:01 +0000 2020|Had the pleasure of talking with @fxbgchamber today about the economic impact of COVID-19 and the implications of C… https://t.co/0jaQ584J0c|en|R|1|2
1296077196507914240|15356407|Wed Aug 19 13:30:58 +0000 2020|Great news in the fight to end veteran homelessness: the VA announced more than $400M in grants under the Supportiv… https://t.co/F3mzwMUHke|en|R|2|11
1295798880186097670|15356407|Tue Aug 18 19:05:02 +0000 2020|(1/2) BREAKING: PMG DeJoy announced that he will suspend all operational reforms and initiatives until after the No… https://t.co/9JRW6Dcv1d|en|R|7|16
1295741746962468867|15356407|Tue Aug 18 15:18:00 +0000 2020|“Rep. Rob Wittman (R-Va, 1st District) is concerned about any slowdown in mail service, but, he said this bill is n… https://t.co/kjZ1O6znpN|en|R|7|16
1295728058440261634|15356407|Tue Aug 18 14:23:37 +0000 2020|Today we celebrate the 100th anniversary of the ratification of the #19thAmendment. We remember all those who came… https://t.co/Xl0DdvjcOh|en|R|3|12
1295445990120587264|15356407|Mon Aug 17 19:42:46 +0000 2020|I was honored today to present Army vet Bill Cline with the Bronze Star with V device for his heroic actions servin… https://t.co/A0JhZ0pVA9|en|R|1|16
1295394992136105984|15356407|Mon Aug 17 16:20:08 +0000 2020|This “dig once” rule proposed by @USDOTFHWA will improve coordination and streamline processes for the instillation… https://t.co/C4vtC9OAHa|en|R|2|5
1295394885487517700|15356407|Mon Aug 17 16:19:42 +0000 2020|(1/2) I recently went on the District of Conservation podcast to talk about my efforts to support our environment a… https://t.co/HWmUFwUvyn|en|R|4|4
1294960512015446017|15356407|Sun Aug 16 11:33:39 +0000 2020|ICYMI: The Commonwealth has announced a $70M grant program for small businesses and nonprofit organizations whose n… https://t.co/7sqKHrcb00|en|R|5|16
1294014557376196610|15356407|Thu Aug 13 20:54:46 +0000 2020|Don’t miss it! My next Tele-Townhall will be on Thursday, August 27 at 6 pm. You may either sign up here to join or… https://t.co/95kC9OVn7T|en|R|4|10
1293592079717679104|15356407|Wed Aug 12 16:56:00 +0000 2020|ICYMI: I sent a letter urging support of vital funds to expand rural internet service in four counties in #va01. I… https://t.co/ZAncYJQAXq|en|R|1|8
1293234188687204352|15356407|Tue Aug 11 17:13:52 +0000 2020|#ICYMI I sent letters to the Postmaster General &amp; Governor requesting additional information on @USPS' level of pre… https://t.co/9FIrHKfTwA|en|R|4|12
1292931839305420803|15356407|Mon Aug 10 21:12:26 +0000 2020|"""Wittman asked others in Congress to stand with him to remember the [Ralph Bunche HS] &amp; 'the heroes that participat… https://t.co/iUoVH4nR21"|en|R|1|2
1292898702294757377|15356407|Mon Aug 10 19:00:46 +0000 2020|Thanks to Sens Warner &amp; Kaine for introducing the senate companion to my Long Bridge Act of 2020 – I was proud to p… https://t.co/tfk00fc6MR|en|R|2|19
1291835992165449732|15356407|Fri Aug 07 20:37:56 +0000 2020|Please join me in honoring the brave men and women who have risked everything to defend our country… https://t.co/ALODWJ7liu|en|R|3|30
1291398123202457601|15356407|Thu Aug 06 15:38:00 +0000 2020|ICYMI: I recently penned an article highlighting my work to reduce congestion, improve the flow of goods, and great… https://t.co/0DUR7GrbdL|en|R|2|7
1291376724870148098|15356407|Thu Aug 06 14:12:58 +0000 2020|Another great step forward for my bill to ease traffic congestion in our region! I want to thank @MarkWarner and… https://t.co/PdKQ8HCTWu|en|R|12|54
1291104212659712006|15356407|Wed Aug 05 20:10:06 +0000 2020|(1/2) Working for you: Earlier this week I stopped by several locations in the #Woodbridge and #Manassas areas to s… https://t.co/8DiCjVU5Ex|en|R|2|12
1291101946322051080|15356407|Wed Aug 05 20:01:06 +0000 2020|Happy #NationalOysterDay! Growing up along the Bay, like many folks in #VA01, I know the important role our delicio… https://t.co/TgZRj2bxPK|en|R|5|17
1291081751196991489|15356407|Wed Aug 05 18:40:51 +0000 2020|ICYMI: Last week, I sent a letter to @USDA requesting the extension of the Summer Meals Program until Jan 1. With m… https://t.co/4LDbtqJtN5|en|R|2|8
1290785996469161984|15356407|Tue Aug 04 23:05:37 +0000 2020|Happy birthday to @USCG! I am proud to represent a region with such rich coastal history and the role of the Coast… https://t.co/oZ3OBRYklK|en|R|3|17
1290744032826724352|15356407|Tue Aug 04 20:18:52 +0000 2020|URGENT: Please register to receive my updates on vital issues that matter most to you by MIDNIGHT TONIGHT before I… https://t.co/PTnWEUPJvV|en|R|2|6
1290739540785803267|15356407|Tue Aug 04 20:01:01 +0000 2020|Today, the Great American Outdoors Act was signed into law by @realDonaldTrump. I am proud to have supported this e… https://t.co/wpaKHBOW8g|en|R|5|31
1290641235904995337|15356407|Tue Aug 04 13:30:24 +0000 2020|ALERT: @POTUS is expanding access to telehealth services to ensure rural Americans have access to vital healthcare… https://t.co/BHmPJ5ZZch|en|R|4|7
1290290084420259840|15356407|Mon Aug 03 14:15:03 +0000 2020|ALERT: Governor Northam has issued a State of Emergency ahead of Tropical Storm Isaias. Every storm has the potenti… https://t.co/SBQYzlRsHH|en|R|9|20
1290275314040557568|15356407|Mon Aug 03 13:16:21 +0000 2020|Each day Congress is in session, I make the drive from my home in Montross to DC. I have a great understanding of t… https://t.co/XUNtHskgD3|en|R|3|18
1289327115523874816|15356407|Fri Jul 31 22:28:33 +0000 2020|This week the House passed #WRDA with my support. VA’s coastal &amp; water infrastructure is vital to our long-term eco… https://t.co/Lx70px1srN|en|R|1|6
1289203919072051200|15356407|Fri Jul 31 14:19:01 +0000 2020|In VA01 economic incentives are needed to expand broadband access. I am proud to support the Mathews, Middlesex, Ca… https://t.co/CFLW5jjxwl|en|R|1|12
1289194751300837377|15356407|Fri Jul 31 13:42:35 +0000 2020|Congratulations to my colleague @RepBenCline! https://t.co/X4NhD6rrfx|en|R|1|5
1288912375949807616|15356407|Thu Jul 30 19:00:31 +0000 2020|Today is #NationalInternDay! I want to say “thank you” to all interns who have worked in my office over the years,… https://t.co/vDvSm7kZ2h|en|R|3|26
1288835707352604673|15356407|Thu Jul 30 13:55:52 +0000 2020|Did you miss my call? I have had nearly a dozen public telephone town halls throughout the COVID-19 pandemic to saf… https://t.co/vAl2RvE3tB|en|R|3|11
1288598721698172931|15356407|Wed Jul 29 22:14:10 +0000 2020|ALERT: @HHSGov recently announced that they will begin providing nursing homes with a Point of Care rapid response… https://t.co/j3HiiUMp45|en|R|1|4
1288533953457065986|15356407|Wed Jul 29 17:56:48 +0000 2020|(1/2) I'm in DC today working to achieve real results for the people of #VA01. I've been listening to you throughou… https://t.co/bskQQjwdtH|en|R|3|19
1287813360332013570|15356407|Mon Jul 27 18:13:26 +0000 2020|Bringing broadband service to the unserved in our area is one of my top priorities, especially through the COVID-19… https://t.co/983AyyhZdr|en|R|1|12
1287756775190650885|15356407|Mon Jul 27 14:28:35 +0000 2020|ICYMI: I supported a vital bill to help protect our nation’s public lands. Preserving our natural resources for fut… https://t.co/awCqyQuxlG|en|R|6|18
1286415750488633350|15356407|Thu Jul 23 21:39:50 +0000 2020|Today is #openingday, and our own Washington Nationals host the NY Yankees tonight, with Dr. Fauci throwing out the… https://t.co/T4YpfxEhob|en|R|1|7
1286400970038161412|15356407|Thu Jul 23 20:41:06 +0000 2020|This week, I supported the historic #GreatAmericanOutdoorsAct to improve our national parks and other recreational… https://t.co/GIrJC4yQg6|en|R|3|19
1286041365458059266|15356407|Wed Jul 22 20:52:09 +0000 2020|I sent a letter to Speaker Pelosi urging that Congress give up our August vacation until we complete critical legis… https://t.co/BJSeinaCI4|en|R|4|19
1286027137024172032|15356407|Wed Jul 22 19:55:37 +0000 2020|Today I hosted a listening session with school superintendents across #VA01 to hear issues facing their school dist… https://t.co/8cJhir9jKP|en|R|0|4
1286024163652767744|15356407|Wed Jul 22 19:43:48 +0000 2020|URGENT: A large portion of #VA01 is currently under a flash flood warning and other severe weather alerts. Do not t… https://t.co/8DtbRPi5Ie|en|R|1|5
1286010772074758144|15356407|Wed Jul 22 18:50:35 +0000 2020|Happy Birthday to former Senator and life-long public servant, Bob Dole. Your service to our nation is immeasurable… https://t.co/RBareZ73QK|en|R|1|5
1285983666120937472|15356407|Wed Jul 22 17:02:53 +0000 2020|Great news! I'm glad the Veteran Treatment Court Coordination Act, a bill I strongly supported, is on its way to… https://t.co/bTVAf9X34r|en|R|3|3
1285946916283518976|15356407|Wed Jul 22 14:36:51 +0000 2020|For the first time in its history, the VA National Guard has a woman commanding one of its infantry companies. Cong… https://t.co/qXNnREZgQA|en|R|3|13
1285704216183480323|15356407|Tue Jul 21 22:32:27 +0000 2020|I just voted in favor of the #FY21NDAA. I am glad that I was able to support such a bipartisan piece of legislation… https://t.co/IQg0m1fV4D|en|R|3|7
1285584081464500224|15356407|Tue Jul 21 14:35:04 +0000 2020|I have a bill before the House demanding that if we do not finish our approps process on time, Congress must stay i… https://t.co/GnFsDNY3z0|en|R|7|22
1285324711803617282|15356407|Mon Jul 20 21:24:26 +0000 2020|Congress’s job is to listen. During the COVID-19 crisis, I have had more than 30,000 inbound contacts from folks ac… https://t.co/KF2MnfQ0au|en|R|0|6
1285207698473197571|15356407|Mon Jul 20 13:39:27 +0000 2020|ALERT: Our area is expected to reach scorching temperatures today and throughout this week. Take caution and stay i… https://t.co/4DV0biGI02|en|R|4|11
1285202450937516034|15356407|Mon Jul 20 13:18:36 +0000 2020|As we recover from the economic impacts of COVID-19 we must ensure folks have access to resources they need to stay… https://t.co/swO814G1Uw|en|R|5|24
1284548183654359041|15356407|Sat Jul 18 17:58:47 +0000 2020|Read my statement on the passing of my friend and colleague @repjohnlewis: https://t.co/nJgEOeffTU|en|R|4|16
1284170051239718912|15356407|Fri Jul 17 16:56:13 +0000 2020|I call on my colleagues to support robust defense spending. We must address the defense budget to make it streamlin… https://t.co/FU6C8siSrI|en|R|2|3
1284168951853973504|15356407|Fri Jul 17 16:51:51 +0000 2020|Earlier this week, I testified on the importance of my bill, the Long Bridge Act. We live in one of the worst traff… https://t.co/HaqXcohERQ|en|R|3|12
1283840290734972938|15356407|Thu Jul 16 19:05:52 +0000 2020|While adversaries continue aggressive actions, we cannot cut our defense budget by nearly 50%, as suggested by some… https://t.co/2WBHSVuWCU|en|R|20|66
1283808475462733826|15356407|Thu Jul 16 16:59:27 +0000 2020|Thank you @FCC for taking the steps to establish 988 as the nationwide 3-digit hotline for suicide prevention start… https://t.co/o58TxhxHuN|en|R|4|6
1283802629903196160|15356407|Thu Jul 16 16:36:13 +0000 2020|(1/2) The latest jobs numbers show that our nation is slowly on the economic road to recovery. I will continue work… https://t.co/RWKNQ3DQQi|en|R|1|2
1283566814287540224|15356407|Thu Jul 16 00:59:10 +0000 2020|Great news: The first COVID-19 #vaccine tested in the US revved up people’s immune systems just the way scientists… https://t.co/DtksBW6wLm|en|R|6|14
1283440561089912838|15356407|Wed Jul 15 16:37:29 +0000 2020|Ensuring our vets, seniors, and students have access to the resources they need to succeed is vitally important to… https://t.co/q3fuMV2qsh|en|R|6|22
1283412442064785409|15356407|Wed Jul 15 14:45:45 +0000 2020|"Tw:
🚨ALERT🚨 @RiteAid will open an additional testing site in Gloucester July 16. Tests will be available at no cost… https://t.co/qFJuczojcD"|en|R|1|5
1282736207697453057|15356407|Mon Jul 13 17:58:38 +0000 2020|WATCH NOW: I am about to discuss important legislation I have introduced to reduce traffic congestion in our region… https://t.co/jlTMNBUnuq|en|R|4|12
1282695401578139649|15356407|Mon Jul 13 15:16:29 +0000 2020|Congratulations to LTJG Madeline Swegle on becoming the first Black female tactical jet pilot! Thousands of young w… https://t.co/UKhQUUEhAg|en|R|11|45
1281218066068713475|15356407|Thu Jul 09 13:26:05 +0000 2020|July is #NationalParks Month. #VA01 is blessed to have some of the best parks in the Country. Protecting the Great… https://t.co/XIIzEUgQeY|en|R|5|9
1280547411350491136|15356407|Tue Jul 07 17:01:08 +0000 2020|We must ensure that our nation’s nursing homes and long term care facilities are not left behind during these criti… https://t.co/2ikanbY4XM|en|R|1|13
1280205585183580161|15356407|Mon Jul 06 18:22:51 +0000 2020|(1/2) It is vitally important that we continue to hold exercises in the South China sea to deter China’s aggressive… https://t.co/kXcc5aGeHd|en|R|2|18
1279436233819787264|15356407|Sat Jul 04 15:25:43 +0000 2020|Happy Fourth of July! Today as you celebrate your freedoms, I hope you take a moment to reflect on those who have p… https://t.co/76vEZwPFh0|en|R|8|44
1279399309935439872|15356407|Sat Jul 04 12:59:00 +0000 2020|Happy Indepdence Day! Over the past 244 years of our country’s history, the United States has proven itself to be a… https://t.co/tdwfy9cDCf|en|R|3|15
1279087607922790400|15356407|Fri Jul 03 16:20:24 +0000 2020|(1/4) This week, I was proud to introduce the Long Bridge Act of 2020 with my colleague @RepDonBeyer. A new Long Br… https://t.co/Q6L6jgZCmL|en|R|3|19
1278794176247758853|15356407|Thu Jul 02 20:54:25 +0000 2020|ATTN SMALL BUSINESS OWNERS: The Paycheck Protection Program has been extended through August 8th to help support th… https://t.co/rgLLYHkgaB|en|R|3|4
1278724098110169088|15356407|Thu Jul 02 16:15:57 +0000 2020|(1/2) Our economy is resilient, and today’s numbers show that we are on the road to recovery. The road will be long… https://t.co/hJY7EFjn65|en|R|1|7
1278535782823796738|15356407|Thu Jul 02 03:47:39 +0000 2020|(1/6) Tonight, I was proud to support the #FY21NDAA, which is, on the whole, a good mark. It seeks to rapidly expan… https://t.co/QewFVMZgGk|en|R|2|7
1278362937271496704|15356407|Wed Jul 01 16:20:49 +0000 2020|ALERT: @GovernorVA announced bar seating will remain prohibited in restaurants as the Commonwealth moves into Phase… https://t.co/FYwPgr72M1|en|R|1|0
1278340514480259077|15356407|Wed Jul 01 14:51:43 +0000 2020|(1/2) Pleased to announce that the SPF provisions in the #FY21NDAA have passed, including several measures that I c… https://t.co/6rN0DwWhPG|en|R|2|5
1278338041640366082|15356407|Wed Jul 01 14:41:54 +0000 2020|(1/ ) HAPPENING NOW: I am delivering my opening remarks during this year’s #FY21NDAA debate on SPF provisions. https://t.co/qhQKMmgkEJ|en|R|1|6
1278337784315555841|15356407|Wed Jul 01 14:40:52 +0000 2020|(1/4) I am proud to join my colleagues in Washington today as we debate the #FY21NDAA. This year, I was honored to… https://t.co/6thxXsB73m|en|R|2|1
1277999819798216706|15356407|Tue Jun 30 16:17:55 +0000 2020|(1/3) As co-chair of the Congressional Public Health Caucus, this week I co-introduced a resolution to recognize Na… https://t.co/cJ1tff1Ara|en|R|1|2
1277996491077046275|15356407|Tue Jun 30 16:04:42 +0000 2020|(1/2) As we head into the full committee markup of #FY21NDAA, I will continue to advocate for measures that support… https://t.co/1w3Nq9Osrp|en|R|1|3
