id|user|created_at|text|lang|label|retweet_count|favorite_count
1457030020577308678|193794406|Sat Nov 06 17:00:01 +0000 2021|"The federal government should not be dictating to businesses that they must comply with a vaccine mandate or face fines.

President Biden vowed last year that he would not impose a vaccine mandate, and now he's going back on his word. https://t.co/BnPp3MzPDx"|en|R|11|40
1456972135319195650|193794406|Sat Nov 06 13:10:00 +0000 2021|"President Biden and his administration are fine with taxpayer-funded cash handouts to illegal immigrants.

Well, I know a lot of hard-working West Virginians who aren't, and I'm committed to stopping this mind-boggling proposal.
https://t.co/IeeEH1JSWU https://t.co/gHVbVdL74p"|en|R|21|103
1456803008055021575|193794406|Sat Nov 06 01:57:57 +0000 2021|So sad about the passing of Bob Kiss, who was House Speaker when I was first elected to @wvlegislature. Bob showed me great leadership, compassion, &amp; friendship. He taught me early on to value your friendships &amp; respect both sides. Thinking of his family during this time. https://t.co/Qto3qwW4V1|en|R|2|25
1456688639430340614|193794406|Fri Nov 05 18:23:30 +0000 2021|"Repealing the State And Local Tax (SALT) Cap would overwhelmingly benefit the wealthiest Americans in high-tax states.
 
Yet that’s exactly what Democrats have included in their reckless spending bill.
 
So much for looking out for the little guy. https://t.co/8mEozrNqLU"|en|R|105|239
1456634092863336448|193794406|Fri Nov 05 14:46:45 +0000 2021|"November is National #AlzheimersDiseaseAwarenessMonth— a time we recognize the more than 6 million Americans living with Alzheimer’s and the countless loved ones impacted by this disease.

It has never been more important to find a cure. https://t.co/U2QVGKrFGW"|en|R|4|13
1456381438857711624|193794406|Thu Nov 04 22:02:47 +0000 2021|"This #MilitaryFamilyAppreciationMonth, I’m thinking about our military families in West Virginia, and the sacrifices they make at home and abroad on behalf of our freedom.
 
You are always in my prayers. Thank you for everything you do. https://t.co/SJxa7RddNR"|en|R|3|35
1456346840727752706|193794406|Thu Nov 04 19:45:19 +0000 2021|"Increased energy prices are squeezing our businesses in West Virginia, yet Democrats continue pushing their reckless tax and spending spree that will only make matters worse.
 
This agenda is wrong for our country. https://t.co/p8jdzscows"|en|R|9|27
1456307896145387522|193794406|Thu Nov 04 17:10:33 +0000 2021|"Time for a quick update on President Biden’s priorities:
 
Help millions of Americans struggling with inflation? ❌
 
Taxpayer-funded cash payments to illegal immigrants? ✅
 
You can’t make this stuff up.
https://t.co/L4SHgYymss"|en|R|8|21
1456291271815876613|193794406|Thu Nov 04 16:04:30 +0000 2021|"Thank you to @FarmCreditVAs for meeting with me and for all you do to support our farmers in West Virginia.
 
Investments in rural infrastructure, clean drinking water, and reliable internet access are vital to the success of our growing agriculture economy. https://t.co/RrKPauE7SI"|en|R|3|22
1456016116548001792|193794406|Wed Nov 03 21:51:08 +0000 2021|There is nothing temporary about an inflation crisis that reaches 30-year highs every month. https://t.co/IHJbognVdE|en|R|5|33
1455962052166660099|193794406|Wed Nov 03 18:16:18 +0000 2021|Under any circumstance, rewarding illegal immigrants with cash handouts is unacceptable, let alone in President Biden’s inflation economy when millions of Americans are struggling to make ends meet. https://t.co/oBPG1CO0lL|en|R|10|31
1455900945032912902|193794406|Wed Nov 03 14:13:29 +0000 2021|"I have always promoted the safety/effectiveness of the COVID vaccines, but the federal government should NOT be dictating to businesses that they must comply w/ a vaccine mandate.
 
This dangerous precedent will impact millions of private employees. https://t.co/tXsYwfjZg2"|en|R|20|85
1455884708689104901|193794406|Wed Nov 03 13:08:58 +0000 2021|"I am glad that the Senate has passed a House companion bill to my legislation that aims to protect our veterans by improving the use of security cameras at VA hospitals.
 
This is a major step in providing our veterans with the safe and secure care they deserve."|en|R|7|27
1455668531115315204|193794406|Tue Nov 02 22:49:57 +0000 2021|It was great speaking with West Virginians in Braxton, Calhoun, Clay, Doddridge, Gilmer, Lewis, Randolph, and Upshur counties tonight during my teletownhall! Thanks for your thoughtful questions on inflation, the border crisis, and our Second Amendment rights. https://t.co/lVN4OEmV2i|en|R|2|37
1455645968205066242|193794406|Tue Nov 02 21:20:18 +0000 2021|Mike, our hearts are with you and your beautiful family tonight. Charlie and I are praying that God brings you strength, healing, and comfort as you remember Jean's incredible life. https://t.co/bNFsXerlrT|en|R|4|22
1455627141580828673|193794406|Tue Nov 02 20:05:29 +0000 2021|"American families evaluate their needs, set responsible budgets, and don’t spend beyond their means.
 
Why should their government act any different?
 
Retail, energy, and food prices are soaring. Now is not the time for another reckless tax and spending spree. https://t.co/tNBFnJ65jL"|en|R|4|32
1455552177057972225|193794406|Tue Nov 02 15:07:36 +0000 2021|Implementing community-based solutions is crucial in preventing substance use and addiction for kids in West Virginia. Learn more about a Drug-Free Community grant I recently announced for Elkview: https://t.co/ybp9Ms8Mk7|en|R|2|14
1455352750389272578|193794406|Tue Nov 02 01:55:09 +0000 2021|Heartbroken to learn of the passing of Brian Wallen, one of our brave coal miners from Logan County. Charlie and I send our prayers of peace and comfort to his family and loved ones, as well as his fellow coal miners tonight.|en|R|5|41
1455311104457035779|193794406|Mon Nov 01 23:09:40 +0000 2021|"Families are about to see their home heating bills skyrocket.
 
So, what are Democrats doing about it? Proposing tax INCREASES on natural gas.
 
You can’t make this up. https://t.co/lfNhErOeKW"|en|R|40|128
1455193018626199559|193794406|Mon Nov 01 15:20:26 +0000 2021|Happy Mountaineer Week, @WestVirginiaU! My father founded Mountaineer Week when he was WVU student body president in 1947, and I know he would be so proud to see it continuing today. Have a great week, Mountaineers! #LetsGo 💙💛 https://t.co/BV1CMmPZVR|en|R|6|87
1454810891766145027|193794406|Sun Oct 31 14:02:00 +0000 2021|Dyslexia is a common learning disability that can pose significant challenges to students and adults. The passage of our resolution will help us to continue raising awareness about the need for early screening, diagnosis, and evidence-based invention. https://t.co/O6XJyw6LKz|en|R|2|16
1454509167264342018|193794406|Sat Oct 30 18:03:03 +0000 2021|Congratulations, @BillBissett! https://t.co/7KoNWZX2dl|en|R|3|22
1454504371581079570|193794406|Sat Oct 30 17:44:00 +0000 2021|Our veterans have sacrificed so much and they are the reason we can enjoy the freedoms we have today. There is no reason WV entities wanting to assist our homeless veterans should be excluded from support that is both vital and available. https://t.co/8AHc5f8gWK|en|R|3|24
1454445232091590662|193794406|Sat Oct 30 13:49:00 +0000 2021|"It’s unacceptable that Democrats are holding the bipartisan infrastructure package hostage to try &amp; force passage of a partisan reckless tax &amp; spending spree.  

They’re using our infrastructure needs as leverage to achieve their green new deal priorities. https://t.co/Mw3Z5CTAyT"|en|R|5|44
1454190629743964164|193794406|Fri Oct 29 20:57:18 +0000 2021|"While American families struggle to heat their homes, put gas in their cars, and put food on the table, this is what the Biden administration is concerned about.
 
Despicable. https://t.co/2LwDE2RcP2"|en|R|11|35
1454140254626189314|193794406|Fri Oct 29 17:37:07 +0000 2021|"ICYMI: I spoke on the @SenateFloor about the impact of Democrats’ misguided climate proposals in their reckless tax &amp; spending spree.

These regressive, America-last energy policies only hurt middle-class Americans &amp; take away jobs from our communities. https://t.co/diCx5AlSIz"|en|R|4|23
1454095684865507334|193794406|Fri Oct 29 14:40:01 +0000 2021|"The Pentagon’s lax response and vague timeline to implement sexual assault reforms is unacceptable.

Proud to join @SenJoniErnst @SenGillibrand and a bipartisan group of our colleagues to highlight an issue that needs an immediate, substantial response. https://t.co/VeZ48sotf7"|en|R|5|35
1453873862911930373|193794406|Thu Oct 28 23:58:35 +0000 2021|Congratulations @DrGuptaMD on your confirmation to lead @ONDCP. Looking forward to continue working together to foster innovative solutions that can help pull our state and nation from the grip of the addiction crisis. https://t.co/8iyuVikCLb|en|R|2|16
1453864644183986180|193794406|Thu Oct 28 23:21:57 +0000 2021|"I had such a fun time participating in the @CWSoftballGame and all the festivities leading up to it.

The best part is that we raised over $500K for @YSCBuzz!

P.S. Press team, we’ll be back next year! https://t.co/ZkyhNaOnky"|en|R|13|74
1453824955783712771|193794406|Thu Oct 28 20:44:14 +0000 2021|"President Biden’s energy policy:

Russian pipelines ✅

American pipelines ❌ https://t.co/rAfLWbYwzp"|en|R|20|63
1453808377428160517|193794406|Thu Oct 28 19:38:22 +0000 2021|"This is great news for innovation and research development in West Virginia.

I advocated for this funding because I’m confident in @VertxPartners ability to spur economic development in our communities and move Appalachia forward. https://t.co/Gki3NooiGc"|en|R|2|9
1453776789684297737|193794406|Thu Oct 28 17:32:51 +0000 2021|"Congratulations to @IntuitBrad on his selection to be the 38th President of @MarshallU!
 
Brad is a Marshall alum and a West Virginian through and through. He will be a great addition to advancing higher education here in our state and I look forward to working with him. https://t.co/jNYxcPkT3y"|en|R|2|21
1453758480150577160|193794406|Thu Oct 28 16:20:05 +0000 2021|"West Virginia isn’t just one of the best places to visit in the country, it’s one of the best in the world!
 
Thank you @lonelyplanet for bringing to light our wild and wonderful best kept secret 🌎 🏞
https://t.co/qCgXqQQrVz"|en|R|2|14
1453737838265057289|193794406|Thu Oct 28 14:58:04 +0000 2021|Happy (early) Halloween from my 3-year-old grandkids! 🎃 https://t.co/shJcgKC4oY|en|R|3|52
1453536165840269313|193794406|Thu Oct 28 01:36:41 +0000 2021|Great turnout at the @CWSoftballGame tonight! Didn’t turn out our way, but it’s hardly a loss when you have support like this! 🥎 💕 https://t.co/XsmDzabyEi|en|R|14|81
1453469015297433603|193794406|Wed Oct 27 21:09:52 +0000 2021|"Busy day on Capitol Hill, but stopped for a quick pregame interview ahead of the @CWSoftballGame tonight.
 
Team Congress is ready! https://t.co/IH40bl2HPA"|en|R|6|32
1453421091628650503|193794406|Wed Oct 27 17:59:26 +0000 2021|Tune in! I’ll be speaking on the Senate floor soon about the harmful environmental provisions in the Democrats’ reckless tax and spending spree that will devastate states like West Virginia. 📺 https://t.co/IfgCRvM19Z|en|R|4|16
1453413994786603012|193794406|Wed Oct 27 17:31:14 +0000 2021|It’s time for the Biden administration to worry less about impressing their international friends, and quit throwing our workers, communities and energy economy in West Virginia to the wayside. https://t.co/pNP0tjT0al|en|R|31|110
1453392023071903750|193794406|Wed Oct 27 16:03:55 +0000 2021|"Since day one, @potus has implemented America-last energy policies that are devastating energy-producing states like mine.

I’ll be joining @SenJohnBarrasso and my @SenateGOP colleagues to discuss this and more NOW ⬇️ https://t.co/6MpDaNLCcx"|en|R|14|26
1453382983579209737|193794406|Wed Oct 27 15:28:00 +0000 2021|"I proudly appointed Michael Baylous to be our Southern District US Marshal because I was confident he could make this kind of impact in West Virginia.

CUFFED maintains justice in our communities, keeps residents safe, and is very deserving of this award! https://t.co/enXdZAjvnS"|en|R|1|12
1453358143363325960|193794406|Wed Oct 27 13:49:18 +0000 2021|"It’s a great day to play some softball! #TeamCongress is fired up for the @CWSoftballGame tonight.
 
Hope to make my teams back in WV proud! @wv_power @wvblackbears @go_whistlepigs @goridgerunners https://t.co/rbtKNkpZT9"|en|R|7|49
1453123495429300229|193794406|Tue Oct 26 22:16:53 +0000 2021|Programs like the #CEPP would have devastating impacts on our local economies and communities. This is just one of the harmful Green New Deal provisions in the Democrats’ reckless tax and spending spree. https://t.co/zAposCfiNh|en|R|2|10
1453048587814907915|193794406|Tue Oct 26 17:19:14 +0000 2021|The IRS should not be spying on the bank accounts of millions of everyday Americans. Instead of tackling the dozens of issues facing our country, Democrats are focused on growing the size of the federal government and intruding in our lives. https://t.co/6dMYXtoPgk|en|R|34|124
1453001579993391119|193794406|Tue Oct 26 14:12:26 +0000 2021|Adventure truly awaits at @NewRiverNPS! Although it’s one of our oldest features, our nation’s newest National Park is bringing overdue attention to the Mountain State. https://t.co/C47tlzcdBt|en|R|5|16
1452755867196084224|193794406|Mon Oct 25 21:56:04 +0000 2021|While @potus thinks of more ways to tax the middle-class, his inflation crisis is causing utility bills to go through the roof. https://t.co/j8aRG2y7Dt|en|R|34|105
1452710678481997834|193794406|Mon Oct 25 18:56:30 +0000 2021|No child should endure physical or psychological abuse. I applaud @ParisHilton for raising awareness to the issue and the opportunity to discuss issues facing children in congregate care facilities. https://t.co/BAotq6zhNA|en|R|17|114
1452637822670757899|193794406|Mon Oct 25 14:07:00 +0000 2021|The IRS has no business snooping on the personal finances of working Americans. Proud to join @SenatorTimScott and other @SenateGOP colleagues in introducing the “Prohibiting IRS Financial Surveillance Act,” to stop this federal overreach. https://t.co/l3OVS2E1YR|en|R|7|42
1452453027739312128|193794406|Mon Oct 25 01:52:41 +0000 2021|Had a fun time with Laura, Charles, and Charlie this evening where we saw West Virginia native Kathy Mattea at The @kencen with @MountainStage.  So proud of a great West Virginia tradition! 🎶 https://t.co/Nv2b6oqkny|en|R|7|54
1452364270667247621|193794406|Sun Oct 24 20:00:00 +0000 2021|"What does a year in Biden’s America look like?

America-last energy policy, skyrocketing inflation, and record numbers of arrests on our southern border. https://t.co/I6tQTcRYcK"|en|R|10|31
1452257566776463360|193794406|Sun Oct 24 12:56:00 +0000 2021|"Did you catch our very own @NewRiverNPS on @GMA Friday morning? 

West Virginia is a wild and wonderful place, and open to all who want to see what we’re about! https://t.co/4H5G9SJoHP"|en|R|9|45
1451984769437212672|193794406|Sat Oct 23 18:52:00 +0000 2021|During #HeadStartAwareness Month, I am thankful for the role that @NatlHeadStart plays in preparing the youth of our state for the future. Programs like this are a direct investment in the future of West Virginia. https://t.co/ccSRdL4ibM|en|R|3|22
1451888637776437248|193794406|Sat Oct 23 12:30:00 +0000 2021|"National Drug #TakeBackDay is an opportunity for individuals to contribute in our mission to end the addiction crisis in West Virginia.

Check out locations near you and play a part in preventing substance misuse in your community! https://t.co/qLV88Jk5Ql"|en|R|4|11
1451655026804408320|193794406|Fri Oct 22 21:01:43 +0000 2021|"West Virginia’s future depends on our ability to bring reliable internet connectivity to our rural communities. That’s why I personally advocated for these projects through UDSA’s ReConnect program.

Learn more about the five projects I announced today ⬇️ https://t.co/sO2hbOK8fQ"|en|R|3|8
1451634470805716994|193794406|Fri Oct 22 19:40:02 +0000 2021|Had the pleasure of meeting Erin Anderson, WV’s @CCSSO National Teacher of the year! Thank you for all you do for our state and the students at Tennerton Elementary School. 🍎📚 https://t.co/g6TssbVaw3|en|R|3|29
1451618956737929216|193794406|Fri Oct 22 18:38:23 +0000 2021|Great news from the @FCC! Access to telehealth is essential to the future of health care in WV, which is why I have long advocated for these services in our rural areas that face logistical challenges and unreliable internet access. https://t.co/wfJ7MUCudS|en|R|1|12
1451605911542407170|193794406|Fri Oct 22 17:46:33 +0000 2021|"The self-created border crisis has made every state a border state. 
Unfortunately, under President Biden there’s no end in sight. https://t.co/Rpde4rYueb"|en|R|8|33
1451342216358678533|193794406|Fri Oct 22 00:18:43 +0000 2021|Tune in to @GMA tomorrow at 8:00AM for a wild and wonderful segment on @NewRiverNPS! https://t.co/UQlWCyHkOL|en|R|11|46
1451277690204528640|193794406|Thu Oct 21 20:02:19 +0000 2021|The rise in consumer prices through September is just the tip of the inflation iceberg. This is not the time to spend $3.5 TRILLION we don’t have at the expense of middle-class taxpayers. https://t.co/tFWgm3HkXx|en|R|8|37
1451260336686997518|193794406|Thu Oct 21 18:53:22 +0000 2021|Nelson Bickley provided valuable counsel to students at @WVStateU and served many in our state as a respected lawyer. I will miss his humor and friendship, and send my prayers to his family and loved ones during this difficult time. https://t.co/03Wuuy5fG2|en|R|3|7
1451211986239373314|193794406|Thu Oct 21 15:41:14 +0000 2021|"So, how can we sum up the first year in President Biden’s America?
 
Failed policies and broken promises. https://t.co/Ow4xB9WXyt"|en|R|12|43
1451186718950916117|193794406|Thu Oct 21 14:00:50 +0000 2021|The Biden administration’s border crisis has now reached RECORD levels. No matter how far @potus tries to distance himself, this is a result of his empty rhetoric and disastrous policy. https://t.co/56piRqlG97|en|R|5|22
1450960534036168704|193794406|Wed Oct 20 23:02:03 +0000 2021|The @CWSoftballGame is officially ONE WEEK away! My teammates and I are ready to bring a victory back to Capitol Hill. #TeamCongress https://t.co/iaQfX6VQCi|en|R|14|89
1450937184207388678|193794406|Wed Oct 20 21:29:16 +0000 2021|"In President Biden’s America, we’re experiencing…

🔘Record high inflation
🔘Foreign policy disasters
🔘Out of control illegal immigration
 
I’ll be speaking on the @SenateFloor shortly about this and more – tune in! https://t.co/IfgCRvM19Z"|en|R|10|29
1450919733071654915|193794406|Wed Oct 20 20:19:55 +0000 2021|"West Virginia’s election laws are not broken, &amp; they certainly don’t need direction from bureaucrats in Washington, DC.

We just had our largest voter turnout in 60 years. The Freedom to Vote Act attempts to provide solutions to problems that do not exist. https://t.co/rc72zRfogx"|en|R|4|31
1450826953943040005|193794406|Wed Oct 20 14:11:15 +0000 2021|Happening now: My @EPWGOP and @EPWCmte colleagues and I will be holding a hearing regarding the federal response to PFAS chemical contamination in West Virginia and our country. WATCH LIVE ⬇️ https://t.co/tyGYEiJdvO|en|R|2|9
1450819647247458311|193794406|Wed Oct 20 13:42:13 +0000 2021|"Today’s record numbers show the crisis on our southern border is getting WORSE, not better.
 
We need action from @potus and we need it now. https://t.co/jkQXOCECss"|en|R|5|18
1450579746153189376|193794406|Tue Oct 19 21:48:56 +0000 2021|"The Freedom to Vote Act still harbors the same harmful provisions of the so-called “For the People Act,” and is nothing more than an attempted power grab by Senate Democrats.
 
West Virginia runs safe, fair elections, and it should stay that way."|en|R|20|68
1450501249053384709|193794406|Tue Oct 19 16:37:01 +0000 2021|Proud of the work done at @MarshallU and the diligence that made this achievement possible! https://t.co/peEr25XeW8|en|R|1|4
1450459385260617728|193794406|Tue Oct 19 13:50:40 +0000 2021|"Chemistry and other STEM fields are critical for WV’s next generation, which is why we must continue to increase opportunities for students who pursue careers in this world-changing field.

Proud to join my colleagues in designating #NationalChemistryWeek. https://t.co/8AJ9in1P0r"|en|R|2|15
1450233595793133570|193794406|Mon Oct 18 22:53:27 +0000 2021|"The cost of the Democrats’ $3.5 TRILLION reckless tax and spending spree will fall directly at the feet of hard working American families. 

This bill does not strengthen our middle-class. It simply funds liberal wish-list items and advances #GreenNewDeal provisions. https://t.co/MPrL2paMQV"|en|R|7|29
1450191184043909121|193794406|Mon Oct 18 20:04:56 +0000 2021|The so-called “Build Back Better” Biden economy means higher gas prices, disrupted supply chains, and more taxes. https://t.co/DVPaDYYZAj|en|R|9|44
1450158615877324802|193794406|Mon Oct 18 17:55:31 +0000 2021|"For many, the Eastern Panhandle is the first impression of our state &amp; we are proud to share West Virginia’s story with those who visit through Jefferson County.

From humble beginnings in 2010, I’m honored to help open the new &amp; beautiful welcome center today in Harpers Ferry! https://t.co/uWxaXr3KOG"|en|R|3|23
1450135038826328064|193794406|Mon Oct 18 16:21:50 +0000 2021|#CEPP would devastate West Virginia’s economy—and in turn destroy communities and families. But according to @RepCasten, that’s okay because “West Virginia is an irrelevant part of our economy.” https://t.co/YWsLusRgKy|en|R|24|56
1450087561876148227|193794406|Mon Oct 18 13:13:10 +0000 2021|Saddened to hear of Colin Powell's passing today. Not only did he make history throughout his decorated career, but his incredible personal story and life of service to our nation inspired countless Americans. Charlie and I are praying for his family and those who knew him. https://t.co/IUgR5Rpiz2|en|R|5|34
1449827558451675138|193794406|Sun Oct 17 20:00:01 +0000 2021|"President Biden’s disastrous economic policy is impacting every sector of our economy.
 
West Virginia residents should not be forced to pay more to keep their houses warm because of irresponsible spending from the White House. https://t.co/JWMiWlfoVx"|en|R|4|21
1449737964943130624|193794406|Sun Oct 17 14:04:00 +0000 2021|"Back in August, I wrote  @TSEcooperatives a support letter because of their innovative development of advance coal technologies.

Coal remains the lifeblood of WV’s energy economy, &amp; this funding will help us continue to strengthen this important sector. https://t.co/0lieckI10r"|en|R|7|16
1449467379960926211|193794406|Sat Oct 16 20:08:47 +0000 2021|Celebrating 100 years of the Charleston Department Store today with Mayor @AmySGoodwin and the Ogrin family. Congratulations! https://t.co/updPaDGDdY|en|R|4|39
1449444027607179269|193794406|Sat Oct 16 18:36:00 +0000 2021|"ICYMI: I hosted an @EPWGOP hearing in Beckley this week to examine the water infrastructure challenges facing rural communities in West Virginia &amp; across the country. 

@WVNS59News has more details ⬇ https://t.co/ufbUFUDrTS"|en|R|2|10
1449359974413467652|193794406|Sat Oct 16 13:02:00 +0000 2021|"In the past year…

🔘Used car prices are up 24%
🔘Beef is up 17%
🔘Major appliances are up 9%
🔘Furniture/bedding is up 11%

@potus said he wouldn’t raise taxes on the middle-class, but the results of his economic policies directly hurt working Americans. https://t.co/FOa5Oyd8fI"|en|R|11|30
1449185035567894532|193794406|Sat Oct 16 01:26:51 +0000 2021|"Stories like this are an important reminder to pay attention to your health.

@kasie — thinking of you and wishing you a speedy recovery. Hope to see you on the softball field soon! https://t.co/qCRwfvsQgU"|en|R|3|24
1449115390240514048|193794406|Fri Oct 15 20:50:06 +0000 2021|My full statement on @WVGovernor’s billion dollar broadband strategy announcement today: https://t.co/UKAS3wBCWV|en|R|2|25
1449094470901936133|193794406|Fri Oct 15 19:26:59 +0000 2021|"Since President Biden took office, illegal crossings at our southern border have skyrocketed and there is no end in sight.
 
The American people deserve transparency and action to finally address to this crisis. https://t.co/AeuC7QhqvH"|en|R|6|28
1449015155313020937|193794406|Fri Oct 15 14:11:49 +0000 2021|"#BreastCancer is the most common cancer among women in West Virginia. 

During #BreastCancerAwarenessMonth, I encourage all women in the Mountain State to learn more about available services and resources. https://t.co/sZmqQ8fh3G"|en|R|3|10
1448770191547117570|193794406|Thu Oct 14 21:58:25 +0000 2021|The Marmet Locks and Dam is critical to navigation and commerce on the Kanawha River. Maintaining and expanding this and other locks and dams on our rivers remains a top priority through my work on @EPWGOP.|en|R|1|10
1448716126888792064|193794406|Thu Oct 14 18:23:35 +0000 2021|"Americans rely on the infrastructure that supports our wastewater systems.

We are facing critical challenges in the resilience of these systems, w/ many of our small &amp; rural communities being disproportionately affected by the wide array of water infrastructure challenges."|en|R|3|9
1448651864254287882|193794406|Thu Oct 14 14:08:13 +0000 2021|"74 years ago today, West Virginia’s own @GenChuckYeager “pushed the envelope” and achieved what many deemed impossible by breaking the sound barrier.

Thinking about General Yeager’s legacy today, and the impact he made on aviation across the world ✈️ 🇺🇸 https://t.co/iCvG58fPAj"|en|R|7|57
