id|user|created_at|text|lang|label|retweet_count|favorite_count
1314220206596685825|193794406|Thu Oct 08 15:04:48 +0000 2020|West Virginia competed against 17 other states for this project and WON. Global companies are recognizing #WV as the perfect place to work, live, and play. https://t.co/zQ4pcCLwZd|en|R|12|71
1314217138878590976|193794406|Thu Oct 08 14:52:37 +0000 2020|https://t.co/6ovrDExbx7|und|R|15|49
1314207343454773257|193794406|Thu Oct 08 14:13:42 +0000 2020|HUGE NEWS FOR #WV! https://t.co/QlqInuRBJd|en|R|4|25
1314192947341033472|193794406|Thu Oct 08 13:16:29 +0000 2020|Join @WVGovernor and me for a major economic development announcement! ⬇️ https://t.co/mOjVw1TIVB|en|R|2|14
1313866945960308740|193794406|Wed Oct 07 15:41:05 +0000 2020|What a great story! I’m hopeful more people will find success like David with Williamson’s new #EnVision center. https://t.co/aXoIZ9cDsP|en|R|3|8
1313580811279642627|193794406|Tue Oct 06 20:44:05 +0000 2020|This is so cool! Another way to discover wild and wonderful West Virginia! #AlmostHeaven https://t.co/IgvfBBODKJ|en|R|4|15
1313504881584607232|193794406|Tue Oct 06 15:42:22 +0000 2020|.@NOAA’s facility in Fairmont continues to do impressive work supercomputing and predicting weather patterns. Thank you for all you do! Happy (belated) anniversary! https://t.co/kWAOqCoqOX|en|R|1|3
1313481542048591874|193794406|Tue Oct 06 14:09:37 +0000 2020|Volunteer Fire Departments across West Virginia are critical partners to the health and safety of our communities. They do so much during normal times, but they have been pushed to their limits through this pandemic.|en|R|3|13
1313217004942307328|193794406|Mon Oct 05 20:38:27 +0000 2020|ICYMI: https://t.co/v9FLDDUGe3|pl|R|1|3
1313202868879527941|193794406|Mon Oct 05 19:42:16 +0000 2020|Don’t forget your flu shot this year! Thanks to @KCHealth1 for making the process quick and easy! 💉 https://t.co/j3s0hDUWpS|en|R|3|24
1313176525311795202|193794406|Mon Oct 05 17:57:35 +0000 2020|In our meeting, Judge Barrett reiterated her belief that judges are not policy makers. I couldn’t agree more. I look forward to her confirmation hearings. https://t.co/Jjd3Oe4jVc|en|R|123|507
1313112815427817472|193794406|Mon Oct 05 13:44:26 +0000 2020|Welcome home, heroes! 🇺🇸 https://t.co/CHAoMJEV0i|en|R|4|44
1312739246420172800|193794406|Sun Oct 04 13:00:00 +0000 2020|Each year in the US, more than 250,000 women get breast cancer, and 42,000 women die from the disease. This October, wear pink and support the fight against breast cancer. Learn more about early detection here: https://t.co/BKOB5BU69F https://t.co/HZVxPYfmk5|en|R|6|27
1312120167690715137|193794406|Fri Oct 02 20:00:00 +0000 2020|There’s been a lot of news in Washington this week. Your weekly recap: https://t.co/SQhQgP8ue7|en|R|2|8
1312109258511544322|193794406|Fri Oct 02 19:16:39 +0000 2020|Loved meeting with @UCWV’s  impressive Presidential Scholars. These young people have a very bright future ahead of them. https://t.co/a3UIlOWYQY|en|R|3|12
1312036204343365638|193794406|Fri Oct 02 14:26:22 +0000 2020|#AlmostHeaven 😍 https://t.co/JoLO0pLfbZ|und|R|8|53
1312003145212604417|193794406|Fri Oct 02 12:15:00 +0000 2020|Happy birthday to West Virginia hero @WoodyWilliams45. Thank you for your service, and thank you for all the work you continue to do for our country’s veterans. https://t.co/Cvui1H6yUy|en|R|8|51
1311994845683224576|193794406|Fri Oct 02 11:42:01 +0000 2020|Praying @realDonaldTrump and @FLOTUS have a full and speedy recovery. https://t.co/yty9UhV2ON|en|R|40|329
1311758945279782912|193794406|Thu Oct 01 20:04:38 +0000 2020|GREAT NEWS! America’s Conservation Enhancement Act (ACE Act), legislation I cosponsored, is heading to @realDonaldTrump's desk. This bill is a huge win for our state’s natural resources and outdoor industry. https://t.co/NLfUnoAEnC|en|R|5|17
1311724058719944704|193794406|Thu Oct 01 17:46:00 +0000 2020|In one of my conversations with @VetAffairsOIG Michael Missal about the horrifying murders at the Clarksburg VAMC, he cited the lack of eye witnesses or security footage as a complicating factor in the Clarksburg investigation.|en|R|1|8
1311708104397148160|193794406|Thu Oct 01 16:42:37 +0000 2020|Too many West Virginia families have been affected by substance abuse. Help is available: https://t.co/ZVPQbrk09E https://t.co/Q3tTxuU9Jg|en|R|9|29
1311688856488546305|193794406|Thu Oct 01 15:26:08 +0000 2020|Praying for this Deputy Sheriff. Thank goodness he was wearing a vest. https://t.co/mfCy6o02qH|en|R|5|26
1311449455820931074|193794406|Wed Sep 30 23:34:50 +0000 2020|I’m not a big fan of continuing resolutions because I believe Congress should fund the government properly under regular order. However, Senate Democrats broke an agreement to allow us to proceed to marking up our bills as we do every year so here we are.|en|R|4|24
1311430027221794817|193794406|Wed Sep 30 22:17:38 +0000 2020|Judge Barrett has a strong record of commitment to the rule of law &amp; carefully considering the text &amp; history of the Constitution. When Judge Barrett was first nominated by @realDonaldTrump, she expressed her view that judges are not policy makers. I couldn’t agree w/ this more. https://t.co/vR3Vgxmwxo|en|R|51|254
1311364175734747139|193794406|Wed Sep 30 17:55:58 +0000 2020|“What I would implore our Senate colleagues—and really the rest of the nation—is to be rejoicing in the fact that we have an accomplished woman to consider.” https://t.co/6aXuHHh03P|en|R|12|82
1311333167509499906|193794406|Wed Sep 30 15:52:45 +0000 2020|WATCH: I’ll be joining my fellow @SenateGOP female colleagues to talk about Judge Amy Coney Barrett’s nomination to the Supreme Court. Tune in live here beginning at 12:15. ⬇️ https://t.co/Jw3zHpacoP|en|R|16|65
1311295940645527552|193794406|Wed Sep 30 13:24:49 +0000 2020|Happy birthday, Shelley! I’m so proud of you! 🥳😘🎂 https://t.co/DoHGplTBTO|en|R|3|37
1311001623079063554|193794406|Tue Sep 29 17:55:18 +0000 2020|Yesterday, I stopped by the Capon Bridge Industrial and Technology Park. This area was the recipient of a @US_EDA grant for an upgraded sewage system that will help attract business development in the region. https://t.co/lb2uI8zgQh|en|R|4|20
1310977490622525441|193794406|Tue Sep 29 16:19:25 +0000 2020|PLAY BALL: Today, I’m joining @MLB and @USABaseball for an announcement of a new format for the @AppyLeague, ensuring future summer nights watching baseball in Princeton and Bluefield. I’m so excited! ⚾️ More details: https://t.co/IU9xBbxazt https://t.co/37lrWInQJA|en|R|3|27
1310966569992966144|193794406|Tue Sep 29 15:36:01 +0000 2020|Awesome news! @wvuresearch's innovation continues to be highly recognized. Congrats! https://t.co/pNBHJgKdaC|en|R|1|6
1310937537670766592|193794406|Tue Sep 29 13:40:39 +0000 2020|It's the most wonderful time of the year! 🥰 #AlmostHeaven https://t.co/8ycLEVV9wO|en|R|9|41
1310724191046508549|193794406|Mon Sep 28 23:32:53 +0000 2020|Route 522 congestion has been an issue in Berkeley Springs for many years, both as a business development issue and as a traffic safety issue, with many large trucks cutting through from I-68 to I-81. In 2018, I announced a $20 million BUILD grant for this project from @USDOT. https://t.co/sVQZGwJ5dy|en|R|5|18
1310716021662273536|193794406|Mon Sep 28 23:00:26 +0000 2020|I met with Hampshire County community and business leaders in 2014 and heard a lot of concern about broadband. Six years later, with the help of #CapitoConnect, they are closing the digital divide. https://t.co/3IHPwaDDSw|en|R|1|16
1310706859196723201|193794406|Mon Sep 28 22:24:01 +0000 2020|Beautiful day in Romney. Glad I could learn more about how local leaders are working to close the #digitaldivide and how #CapitoConnect can continue to help. https://t.co/hjDnNtfwZA|en|R|2|27
1310681067423137792|193794406|Mon Sep 28 20:41:32 +0000 2020|Stopped by the Spring Valley Market while I was in Hampshire County to pick up some local goodies, including September Wonder apples. So good! 🍎🍏 #yum #eatlocal https://t.co/UajYFOTDqP|en|R|2|34
1310646688114249735|193794406|Mon Sep 28 18:24:55 +0000 2020|Romney is using a sidewalk improvement project as an opportunity to install #broadband infrastructure. This “dig once” approach saves time and money. That’s why I’ve supported the same types of infrastructure projects at the federal level. #CapitoConnect https://t.co/yOZGfAEH7V|en|R|1|17
1310591896092372992|193794406|Mon Sep 28 14:47:12 +0000 2020|https://t.co/Bd43AXe3rQ|und|R|1|6
1310376138456412160|193794406|Mon Sep 28 00:29:51 +0000 2020|Congrats to fellow Marshall County native Dr. Marin on this accomplishment! Cc: @JMHSMonarchs https://t.co/80fDQKOTb4|en|R|1|16
1310203923714711555|193794406|Sun Sep 27 13:05:32 +0000 2020|To the mothers hurting today, our hearts are with you. Thank you for your tremendous sacrifice for this country. 🇺🇸 https://t.co/hoLT14fsVD|en|R|7|45
1309974283213565953|193794406|Sat Sep 26 21:53:01 +0000 2020|My full statement regarding @realDonaldTrump’s nomination of Judge Amy Coney Barrett to serve on the U.S. Supreme Court: https://t.co/4WgFLnQXMw|en|R|271|1432
1309609362944598016|193794406|Fri Sep 25 21:42:58 +0000 2020|👀 LOOK! West Virginia leads the nation in #2020census responses. I am so proud! Way to go, #WV! Thank you so much for taking the time to complete the #2020census. If you’re part of that 0.1%, take it now: https://t.co/yzZ4uwo6Kf https://t.co/OBjlGr41MJ|en|R|9|47
1309595080685244417|193794406|Fri Sep 25 20:46:12 +0000 2020|Good news: #WV is receiving $908,926 from @HHSGov for #COVID19 vaccine preparedness. We must ensure that we have the infrastructural support for vaccine distribution, so when the vaccine is ready, we can quickly distribute it to those who need it the most.|en|R|2|13
1309531258540756992|193794406|Fri Sep 25 16:32:36 +0000 2020|A very good girl. 💛 Thank you, Toni. #ChildhoodCancerAwarenessMonth https://t.co/DL8aHKvRev|en|R|5|42
1309222098791993345|193794406|Thu Sep 24 20:04:07 +0000 2020|Special thanks to @WVaChamber for inviting me to talk more about #broadband and expanding economic growth in our state. #Coronavirus has highlighted the digital divide in America.|en|R|3|17
1309160509686546433|193794406|Thu Sep 24 15:59:23 +0000 2020|West Virginia’s mountainous forest lands are important to our tourism economy and scenic beauty, which is why we must do what we can to help support our landowners by making forest management affordable and sustainable. https://t.co/eJwnHaZya7|en|R|2|17
1309143371701772288|193794406|Thu Sep 24 14:51:17 +0000 2020|Just wrapped up a Zoom meeting with the #WV chapter of @NDSS. I appreciate all the work they and Steve Slack do here in #WV. https://t.co/fS6mbuEbRI|en|R|2|11
1309132104966565891|193794406|Thu Sep 24 14:06:30 +0000 2020|Awesome news! https://t.co/UIgUhgAZ4S|en|R|5|28
1308881229048053761|193794406|Wed Sep 23 21:29:37 +0000 2020|Great news for Paden City! This $5M investment builds on emergency funding I helped secure last year to address legacy PCE contamination by upgrading the water treatment facility.|en|R|2|16
1308763494540554240|193794406|Wed Sep 23 13:41:47 +0000 2020|https://t.co/KX0SyTQthg|und|R|1|2
1308485979913809921|193794406|Tue Sep 22 19:19:02 +0000 2020|#AlmostHeaven 🥰 https://t.co/PLJUMDuTwv|und|R|3|27
1308405376254185473|193794406|Tue Sep 22 13:58:45 +0000 2020|My statement regarding @realDonaldTrump's intent to fill the United States Supreme Court vacancy following the passing of Justice Ruth Bader Ginsburg: https://t.co/TTeBXnQss3|en|R|70|376
1308396605867986946|193794406|Tue Sep 22 13:23:54 +0000 2020|Don’t forget your flu shot this year! https://t.co/W1kTSbBREE|en|R|2|8
1308136252705845250|193794406|Mon Sep 21 20:09:21 +0000 2020|https://t.co/H0xJgy8bUy|und|R|2|5
1308076357595914242|193794406|Mon Sep 21 16:11:21 +0000 2020|#Alzheimers is an issue close to my heart. We’ve made huge strides in research, including research done at @WVUMedicine, led by @DoctorAliRezai. On #WorldAlzheimersDay, I want to send my heart to all patients &amp; families battling this disease. We’ll keep fighting until we #EndAlz. https://t.co/bEIjU5wKh9|en|R|6|20
1308059537157640193|193794406|Mon Sep 21 15:04:30 +0000 2020|https://t.co/lbN48lHDPG|und|R|1|6
1307673365478543360|193794406|Sun Sep 20 13:30:00 +0000 2020|REMINDER: I’ll be hosting my final virtual Academy Day event on Tuesday, September 22, with @RepMcKinley. RSVP here: https://t.co/SdQkXIySLl|en|R|4|11
1307481041167409152|193794406|Sun Sep 20 00:45:46 +0000 2020|Congrats to @HerdFB on the big win! 🏈 https://t.co/OqPCo5HtYW|en|R|3|36
1307303427483992064|193794406|Sat Sep 19 13:00:00 +0000 2020|"Many people, especially this year, feel anxious and isolated. @Help304WV is #WV's free emotional strength helpline.
Call: 1-877-HELP304 
Text: 1-877-435-7304 https://t.co/F598QHYYiX"|en|R|8|11
1307110058409504768|193794406|Sat Sep 19 00:11:37 +0000 2020|My statement on the passing of Supreme Court Justice Ruth Bader Ginsberg: https://t.co/sGTALqO1Sj|en|R|17|108
1307054285755166720|193794406|Fri Sep 18 20:30:00 +0000 2020|To our Jewish friends celebrating tonight, shana tova! #RoshHashanah https://t.co/Q5BMNJoXcW|en|R|3|21
1306740601568854016|193794406|Thu Sep 17 23:43:32 +0000 2020|I really appreciate my friend  @MarshalluPres calling to check in on me. I feel great! Like thousands of other West Virginians, I’m continuing to work — just at home. https://t.co/ApwP8JVq0z|en|R|5|76
1306702827797073922|193794406|Thu Sep 17 21:13:26 +0000 2020|I read the @newrepublic story about my friend and colleague @SenJoniErnst. She’s a survivor, a fighter, and one of the hardest working senators I know. All women, including conservative women, deserve better than this cynical and arrogant article. https://t.co/WjVl1I5xzx|en|R|6|20
1306684125982658566|193794406|Thu Sep 17 19:59:07 +0000 2020|GREAT NEWS! Today, @USACEHQ announced approximately $1 million to support the Chattaroy Sewer Project in Mingo County. The funding will address issues of storm water and sewer runoff affecting households due to antiquated infrastructure.|en|R|3|16
1306629271474114560|193794406|Thu Sep 17 16:21:08 +0000 2020|At a time when our country is having a necessary debate about the accountability of law enforcement, officers are increasingly under assault in America. Dangerous rhetoric about defunding the police has turned into targeted violence. https://t.co/DYJ8b73w3k|en|R|3|17
1306615107494047746|193794406|Thu Sep 17 15:24:52 +0000 2020|Lots of free testing going on across the state today. ⬇️ https://t.co/daic9LcWac|en|R|2|9
1306605197523812352|193794406|Thu Sep 17 14:45:29 +0000 2020|Happy #ConstitutionDay, West Virginia. On this day in 1787, delegates to the Constitutional Convention in Philadelphia signed the document that is the foundation of our country. Every day, we’re working to make a more perfect union. #WeThePeople https://t.co/RpKN3jwMPE|en|R|7|32
1306331077162733570|193794406|Wed Sep 16 20:36:13 +0000 2020|Given my recent negative #coronavirus test result, I asked @CDCDirector about the impact self-quarantining has had on the spread of the virus and if and when I should get tested again. His response: https://t.co/oJhqQHKBAA|en|R|4|11
1306296069555458048|193794406|Wed Sep 16 18:17:07 +0000 2020|As we’ve seen in Monongalia County, universities can have a major impact on the #coronavirus spread in a community. Today, I asked @HHS_ASH his recommendations when dealing with testing on college campuses: https://t.co/4bVHYCJAsS|en|R|3|14
1306278867766837253|193794406|Wed Sep 16 17:08:46 +0000 2020|Last week’s vote on a targeted #coronavirus relief package was really frustrating. We should be able to pass what we all agree on: money for schools, PPE, relief for small businesses, &amp; vaccine development. https://t.co/87OHIpg8e4|en|R|4|23
1306262123799023616|193794406|Wed Sep 16 16:02:14 +0000 2020|REMINDER: I’ll be hosting a virtual Academy Day with @RepAlexMooney tonight! RSVP here: https://t.co/BAPUa9EIUv|en|R|2|5
1306228621921656834|193794406|Wed Sep 16 13:49:06 +0000 2020|TUNE IN: I’ll be questioning @HHSGov and @CDCgov officials on the federal #coronavirus response. Watch live here at 10:00 a.m.: https://t.co/jeFlC4gZPy https://t.co/Gp60CJcB1O|en|R|3|3
1305975806506733569|193794406|Tue Sep 15 21:04:30 +0000 2020|Truly a historic day for lasting peace in the Middle East and a historic moment in American leadership. Huge congratulations to @realDonaldTrump and his team.🕊️ https://t.co/WJuXl2rI01|en|R|5|43
1305953920947281923|193794406|Tue Sep 15 19:37:32 +0000 2020|UPDATE: The test came back NEGATIVE. Despite my negative coronavirus test result, I will be following CDC recommendations &amp; the advice of the Capitol Attending Physician &amp; will be quarantining for 14 days as a precaution. Thank you for your prayers, calls, texts, &amp; kind comments. https://t.co/NxLGZgDsUn|en|R|10|77
1305940271419535366|193794406|Tue Sep 15 18:43:18 +0000 2020|First event tonight with @RepCarolMiller. Second event tomorrow with @RepAlexMooney. ⬇️  https://t.co/vJ0Q4y6j83|en|R|5|5
1305925052622426113|193794406|Tue Sep 15 17:42:50 +0000 2020|I sent a letter to @DEAHQ requesting information about how the DEA’s work to combat the opioid epidemic has been impacted by COVID-19 and how the agency has adjusted operations to address this challenge. More details: https://t.co/zm6o13yKys https://t.co/Zt9XCS7QEv|en|R|1|10
1305901834092130304|193794406|Tue Sep 15 16:10:34 +0000 2020|https://t.co/ebP2QGsI9G|und|R|8|17
1305881582981582848|193794406|Tue Sep 15 14:50:06 +0000 2020|I’ve always said if we can talk to people on the moon, surely we can get #broadband to rural Americans here on earth. I’m excited about the #RDOF program and what its investment could mean for West Virginia. #CapitoConnect https://t.co/pDnyaozLC8|en|R|8|26
1305673147258212352|193794406|Tue Sep 15 01:01:51 +0000 2020|Spoke on the phone earlier tonight with Martinsburg native Lorelai Crouse to thank her for the sweet note she wrote me recently. Lorelai is part of the @girlscouts and has big dreams for the future. Can’t wait to meet you soon, Lorelai! CC: @GSCNC https://t.co/jLr9yt5asd|en|R|3|25
1305625037395951616|193794406|Mon Sep 14 21:50:40 +0000 2020|“We cannot disadvantage parts of this country because you don’t have what I considered to be one of the essentials in order to do business, to have health care, and to learn: high speed broadband.”|en|R|1|21
1305603309831696385|193794406|Mon Sep 14 20:24:20 +0000 2020|Tune in! I’ll be speaking on the @SenateFloor around 4:30. Watch live here: https://t.co/IfgCRvM19Z https://t.co/84cuEJYr4K|en|R|1|7
1305580290333700097|193794406|Mon Sep 14 18:52:52 +0000 2020|ICYMI: https://t.co/l51HKikzM7|pl|R|1|4
1305550206314975239|193794406|Mon Sep 14 16:53:19 +0000 2020|TOMORROW: I’m hosting a virtual Academy Day with @RepCarolMiller. Interested in learning more about the U.S. Service Academies and the application process? Register here: https://t.co/5ZdOTzwi1z https://t.co/8VvuprwBux|en|R|2|6
1305532312579387395|193794406|Mon Sep 14 15:42:13 +0000 2020|Monday mood 😎 #LetsGo #HailWV https://t.co/NShjLhn3oU|en|R|2|8
1305506977292976128|193794406|Mon Sep 14 14:01:33 +0000 2020|#CapitoConnect https://t.co/YY4Xg8fO9W|und|R|1|8
1305129106963488769|193794406|Sun Sep 13 13:00:01 +0000 2020|Did you know @GreenBankObserv has at home activities for kids? https://t.co/p6CE70twZO|en|R|5|14
1304551544424026112|193794406|Fri Sep 11 22:45:00 +0000 2020|The Senate was back in session this week. Get all the details: https://t.co/SrtIXdZu7Y|en|R|2|7
1304469888438808583|193794406|Fri Sep 11 17:20:31 +0000 2020|Glad #WV was approved for more than $13 million to support workers who have lost wages due to COVID-19. This @fema funding will allow #WV to provide those unemployed with $300/week on top of their regular unemployment benefit.|en|R|4|22
1304442982301605888|193794406|Fri Sep 11 15:33:37 +0000 2020|This morning I joined @kanawhaus and Mayor @AmySGoodwin in a 9/11 remembrance ceremony at @YeagerAirport. This day is always a somber one, but we’re reminded of our strength in unity. #NeverForget https://t.co/YBKnGdpJAr|en|R|1|26
1304392999720218625|193794406|Fri Sep 11 12:15:00 +0000 2020|I hope all Americans take a moment today to be still and remember. We remember the thousands of lives cruelly cut short, the families changed forever, and the heroes who saved countless lives. #NeverForget https://t.co/QOsVzN1yO7|en|R|15|78
1304156811881316358|193794406|Thu Sep 10 20:36:28 +0000 2020|.@WVNationalGuard has been an invaluable asset in our state’s fight against #coronavirus. Thank you for always answering the call! https://t.co/hYlKgs4h8u|en|R|3|15
1304133045927251968|193794406|Thu Sep 10 19:02:02 +0000 2020|https://t.co/qeQndtkwBT|und|R|2|12
1304120004883996676|193794406|Thu Sep 10 18:10:13 +0000 2020|I’ve been in touch daily with West Virginians that still need help due to the challenges presented by #coronavirus. We had an opportunity to really deliver on this help today. Unfortunately, the Senate failed.|en|R|2|10
1304075132852371457|193794406|Thu Sep 10 15:11:54 +0000 2020|🚨 INFRASTRUCTURE NEWS: @SecElaineChao just called me to let me know #WV is receiving a $20 million BUILD grant to support an infrastructure repair project consisting of 19 bridges rated in poor condition along Interstate 79 in Harrison, Marion, and Mon counties.|en|R|9|44
1304051587854278659|193794406|Thu Sep 10 13:38:21 +0000 2020|**NEW SCAM ALERT** West Virginia, please be vigilant. https://t.co/aCfsXTieeE|en|R|31|24
1303820211305484288|193794406|Wed Sep 09 22:18:56 +0000 2020|Thanks for visiting #WV, @SecGeneScalia! https://t.co/rFMToingaZ|en|R|7|26
1303803825732583424|193794406|Wed Sep 09 21:13:50 +0000 2020|This week, the Senate is voting on another #coronavirus relief bill. This is a targeted approach to help schools, #smallbiz, and to enhance testing and vaccine development. Here’s why I’m voting yes: https://t.co/HilJ4rLjW6|en|R|9|40
1303746681255743490|193794406|Wed Sep 09 17:26:45 +0000 2020|BIG NEWS: As chair of the Homeland Security Appropriations Subcmte., I’m pleased to announce @CBP has awarded $9M to @USACEHQ to begin design &amp; construction for the Instructional Design Center (IDC)/Distance Learning Center (DLC) at the Advanced Training Center in Harpers Ferry. https://t.co/xYhJ3cGKth|en|R|7|24
1303719470461059072|193794406|Wed Sep 09 15:38:38 +0000 2020|Meet Quint and learn more about his summer interning on Capitol Hill. ⬇️ https://t.co/OkWmtwyqwg|en|R|1|7
1303702678334300161|193794406|Wed Sep 09 14:31:54 +0000 2020|HAPPENING TODAY ⬇️ https://t.co/0tW5llnRfo|en|R|2|6
1303420920506322950|193794406|Tue Sep 08 19:52:18 +0000 2020|🥰 #AlmostHeaven https://t.co/rHT2RydHqV|und|R|4|22
1303404999062556673|193794406|Tue Sep 08 18:49:02 +0000 2020|GOOD NEWS: The latest round of @fema funding will allow @workforcewv to continue to provide an additional $300/week of unemployment due to #coronavirus. This comes after @WVGovernor directed WorkForce to apply for this funding.|en|R|3|14
1303392210898034688|193794406|Tue Sep 08 17:58:13 +0000 2020|Best wishes to all teachers and students heading back to school. Thank you for being flexible and keeping a positive attitude going into this school year. 📚✏️🍎 https://t.co/K1TmIyTrF3|en|R|2|13
1303319561673093127|193794406|Tue Sep 08 13:09:32 +0000 2020|Worth the read. Learn more about how the Trump @EPA has prioritized Superfund cleanup sites like Minden. ⬇️ https://t.co/g53iIbDBM8|en|R|6|22
1302947223521472513|193794406|Mon Sep 07 12:30:00 +0000 2020|Happy #LaborDay, West Virginia. Thank you to all those who work to make our state and country a stronger place. https://t.co/vRuO9W1uLy|en|R|4|33
1302593140176703489|193794406|Sun Sep 06 13:03:00 +0000 2020|September is Childhood Cancer Month. I’m proud to be the sponsor of the Childhood Cancer STAR Act—legislation that @realDonaldTrump signed into law that will expand childhood cancer research and enhance the quality of life for childhood cancer survivors. https://t.co/QPwBk5c4R4|en|R|4|36
1302230000716754944|193794406|Sat Sep 05 13:00:01 +0000 2020|ICYMI: https://t.co/drpOfjY73v|pl|R|1|3
1301912390766931968|193794406|Fri Sep 04 15:57:56 +0000 2020|One of my summer interns, Lauren from Elkins, has a cute story about running into @SenatorRomney. 🏃‍♀️ Watch: https://t.co/5TTw88V8JS|en|R|2|9
1301891752568197120|193794406|Fri Sep 04 14:35:56 +0000 2020|“Seven-year-old Rose Goblinger said she used her money from the tooth fairy to donate because it felt right.” Even in these tough times, West Virginians always help each other. So impressed with these girls! #WestVirginiaProud https://t.co/BztVVGWtmH|en|R|3|12
1301608337734275074|193794406|Thu Sep 03 19:49:45 +0000 2020|Great day in Hamlin today! Several meetings, including one w/ @TMobile to talk about the connectivity progress we’ve made in this region, as well as the work that still needs to be done. #CapitoConnect https://t.co/ZBDmRvRC0Y|en|R|4|12
1301585216633479170|193794406|Thu Sep 03 18:17:52 +0000 2020|Special thanks to Lincoln EMS Director Trish Watson for speaking with me today about how #coronavirus has affected their service. https://t.co/1eOAn1bkk1|en|R|2|8
1301568194268860416|193794406|Thu Sep 03 17:10:14 +0000 2020|Lincoln Primary Care Center received a #telehealth grant from @FCC earlier this year. Today I learned more about how they’re using that funding to serve more people in the region. LPCC also is a #PPP success story. Their #PPP loan saved 155 jobs! https://t.co/BYuNwPfKFZ|en|R|3|9
