id|user|created_at|text|lang|label|retweet_count|favorite_count
1394797352012197891|193794406|Tue May 18 23:29:37 +0000 2021|"Just wrapped up a virtual reception for West Virginia students appointed to attend U.S. Service Academies. 

This recognition displays such dedication to both academics and service. Honored to play a role in the beginning of their journeys! https://t.co/tw8OI7xwaE"|en|R|4|46
1394668354963656708|193794406|Tue May 18 14:57:02 +0000 2021|Proud to join my colleagues in affirming our support for Israel as they do what is needed to protect their citizens from terrorist attacks. 🇺🇸🇮🇱 https://t.co/kNqPH61jSS|en|R|9|44
1394632728881025032|193794406|Tue May 18 12:35:28 +0000 2021|What a game! @HerdMSoccer are the 2020 #CollegeCup National Champions! #WeAreMarshall @MarshallU 🏆 https://t.co/HTmDk8pOBs|en|R|5|61
1394455338737360896|193794406|Tue May 18 00:50:35 +0000 2021|Got on my green for @HerdMSoccer! Good luck in tonight’s @NCAASoccer championship game. Let’s do this! #CollegeCup ⚽️🏆 https://t.co/eKZDoDJxSF|en|R|5|112
1394389745963347969|193794406|Mon May 17 20:29:56 +0000 2021|"Stopped by Almost Heaven Desserts in Morgantown on my way back to Washington. 

Thank you to Victoria for the great service! 🍪🧁🥧 https://t.co/poCFiFoutn"|en|R|6|74
1394326310655336453|193794406|Mon May 17 16:17:52 +0000 2021|"Today, @SecVetAffairs Denis McDonough joined us at the Clarksburg VAMC in light of the recent OIG report detailing the abject failures within the facility.

It is unacceptable and our veterans deserve far better. https://t.co/24L9SkPV8p https://t.co/jgnKJjD3cq"|en|R|1|10
1394277147171241986|193794406|Mon May 17 13:02:30 +0000 2021|"May is #BetterHearingAndSpeechMonth. 

Our hearing is something we often take for granted. This year, I re-introduced Ally’s Act, legislation to ensure insurance coverage for specific hearing aids, providing relief to those born w/ hearing loss. DETAILS: https://t.co/JVYLtHYUP7"|en|R|4|14
1394013163440558080|193794406|Sun May 16 19:33:32 +0000 2021|"With the new @CDCgov guidance ending mask-wearing for vaccinated individuals, there has never been a better time to get your COVID-19 vaccine. 
 
Register today! https://t.co/3XotVJwG0s"|en|R|6|23
1393939593024708611|193794406|Sun May 16 14:41:11 +0000 2021|BIG number 8 for our grandson, Charlie! 🎉🎂🥳 https://t.co/A8UOHbifY7|en|R|1|135
1393713345174323200|193794406|Sat May 15 23:42:10 +0000 2021|"During #NationalPoliceWeek, my thoughts are with the family of Cassie Johnson, the Charleston Police Officer we lost in the line of duty earlier this year.
 
Our police officers put their lives on the line every day for us. We should honor them for that service and sacrifice. https://t.co/nr20TwL2Dw"|en|R|7|54
1393664270924238853|193794406|Sat May 15 20:27:09 +0000 2021|"ICYMI: “West Virginia's Capito continues call for narrowed infrastructure bill” | @WVNews247
https://t.co/uVDlv8Ijvh"|en|R|2|18
1393625342548512771|193794406|Sat May 15 17:52:28 +0000 2021|Congratulations to all the graduates at @WestVirginiaU and @MarshallU receiving their diplomas this weekend. This celebration is the culmination of years of hard work. 🎓🎉|en|R|2|49
1393357601312813056|193794406|Sat May 15 00:08:34 +0000 2021|Let’s go Herd! Unbelievable win against UNC to make it to the NCAA Soccer National Championship. Can’t wait for Monday night @HerdMSoccer #CollegeCup 🏆⚽️😎 https://t.co/QgWlD2ciJD|en|R|16|112
1393313816314880001|193794406|Fri May 14 21:14:34 +0000 2021|Good luck @HerdMSoccer in your FINAL FOUR game tonight! You have made West Virginia and @MarshallU so proud this year. Let’s bring a trophy back to Huntington 🏆⚽️ #WeAre #BeatUNC https://t.co/uhZ6SwjGjg|en|R|9|74
1393288270516207626|193794406|Fri May 14 19:33:04 +0000 2021|"Investing in our nation’s infrastructure is something both sides agree on.
 
Let’s get it done. https://t.co/8m7Njfxfc7"|en|R|19|85
1393256870018752527|193794406|Fri May 14 17:28:17 +0000 2021|Our meeting at the White House yesterday was another positive and substantive discussion about how to address our nation’s infrastructure challenges in a bipartisan way. @WVMetroNews has more https://t.co/22jpQy8JoV|en|R|7|40
1393185680176603139|193794406|Fri May 14 12:45:24 +0000 2021|Joining @AmericaNewsroom at the top of hour. Watch live on @FoxNews ! 📺 🚨|en|R|2|26
1392978009154543616|193794406|Thu May 13 23:00:12 +0000 2021|Proud to join my @SenateGOP colleagues to recognize our brave law enforcement officers during #NationalPoliceWeek https://t.co/oc9JLG4kyI|en|R|4|17
1392954948044922884|193794406|Thu May 13 21:28:34 +0000 2021|"Today’s meeting with @potus was a step in the right direction.

We will continue to negotiate in good faith and focus on delivering the core infrastructure resources our communities need. https://t.co/A0mMLhkjTb"|en|R|11|66
1392847940453023750|193794406|Thu May 13 14:23:21 +0000 2021|"Joined @marcorubio and my @SenateGOP colleagues urging @potus to send Iran and the world one clear message: 

The United States stands firmly with our ally Israel.

🇺🇸🇮🇱 https://t.co/OkN79F1lEw"|en|R|21|101
1392844078392414208|193794406|Thu May 13 14:08:00 +0000 2021|Feel sick? Get a COVID-19 test. Sites are widely available and accessible across West Virginia. This is a small thing we can do to help stop the spread of COVID-19 in West Virginia. https://t.co/zI3SF54AkR|en|R|3|5
1392612386692083729|193794406|Wed May 12 22:47:21 +0000 2021|"Joined @SenShelby today to again urge the administration to finish previously approved wall construction projects and SECURE OUR BORDER 🇺🇸

https://t.co/JMmfmcpOyU"|en|R|2|28
1392602403296448517|193794406|Wed May 12 22:07:40 +0000 2021|"Since 1999, we honor the brave men and women of our Armed Services with #MilitaryAppreciationMonth through the month of May.
 
This month and every month, I could not be more thankful for the courageous Americans who put their lives on the line for freedom across this land. https://t.co/tgBrlTLlvh"|en|R|3|19
1392577564758130688|193794406|Wed May 12 20:28:58 +0000 2021|"Increasing opportunities for students to engage in STEM better prepares them for the future.

Proud to intro the Supporting STEM Learning Opportunities Act w/ @SenatorShaheen, bipartisan legislation that invests in our future by investing in our students. https://t.co/VEEB5QyVsb"|en|R|4|17
1392511220440260613|193794406|Wed May 12 16:05:21 +0000 2021|"Apprehensions at our southern border reached a 20-YEAR HIGH in April. 

As this crisis rages on, we need to strengthen our border security, not leave projects unfinished.

Learn more about the letter @SenShelby and I led today: https://t.co/R7CtL1rEhw https://t.co/wOvJy1uqRV"|en|R|6|22
1392468915637338120|193794406|Wed May 12 13:17:14 +0000 2021|Today is a great day to register and receive your COVID-19 vaccine! Learn more here #CommunityImmunityWV https://t.co/vLhkF4PLXf|en|R|1|4
1392246555579764736|193794406|Tue May 11 22:33:40 +0000 2021|"Simply put, politicizing the non-partisan @FEC is a horrible idea.
 
This alone exposes H.R. 1 as nothing more than a power grab by congressional Democrats. https://t.co/LU3YHG2jMk"|en|R|43|154
1392209100247871491|193794406|Tue May 11 20:04:50 +0000 2021|"The ironically named ""For the People Act"" would:
 
👎Federalize state elections
👎Ban state voter ID laws
👎Allow government funding of campaigns
👎Turn the @FEC into a partisan agency
👎Hand redistricting power to an unelected, unaccountable commission https://t.co/MY6h8A4xbH"|en|R|12|49
1392180204018311172|193794406|Tue May 11 18:10:00 +0000 2021|My full statement on the sentencing of Reta Mays for the senseless murders at the Clarksburg VA: https://t.co/ufles1u7PT|en|R|1|9
1392171319056379905|193794406|Tue May 11 17:34:42 +0000 2021|"If it isn’t broken, don’t fix it.
 
After record turnout in West Virginia and across our country in 2020, states don’t need Washington, D.C. to strip them of their authority and impose burdensome requirements to fix problems that do not exist. https://t.co/Ohbr81DJvh"|en|R|33|202
1392100755318915081|193794406|Tue May 11 12:54:18 +0000 2021|"Democrats are attempting to nationalize one of America’s most sacred functions: our elections.
 
In a NEW @FoxNews op-ed, I outline why the so-called ""For the People Act"" doesn't live up to its name 📝⤵️ https://t.co/0JPsPYxsIx"|en|R|22|55
1391892553851707392|193794406|Mon May 10 23:06:59 +0000 2021|"I was honored to address Green Bank Middle School students ahead of their meeting w/ the International @Space_Station last week!
 
West Virginia has always been a leader in space exploration in our country, and I’m confident that tradition will continue. @wchs8fox11 has more⬇️ https://t.co/mJ6rUXEfRe"|en|R|2|17
1391847857838333958|193794406|Mon May 10 20:09:23 +0000 2021|ICYMI: Last week, I met up with Mayor Fitzpatrick to view construction underway of a roundabout in Glenville. This is an example of infrastructure. Our focus should be on supporting projects like this in communities across our nation. https://t.co/3HNEQLXl2O|en|R|1|18
1391746423935447041|193794406|Mon May 10 13:26:19 +0000 2021|Good luck @HerdMSoccer in your Elite Eight game today! You make West Virginia so proud. ⚽️ https://t.co/iEj6R1uT3F|en|R|2|18
1391537647252918272|193794406|Sun May 09 23:36:43 +0000 2021|Missing my Mom today and every day. The dress I’m wearing in this photo? Not so much. #HappyMothersDay https://t.co/ECsutLt7Vj|en|R|3|105
1391403938943995906|193794406|Sun May 09 14:45:24 +0000 2021|"Happy Mother’s Day to all the loving, hardworking mothers across West Virginia!
 
Thinking about my mom today, and all she taught me about being a loving mother. https://t.co/72zsHCIFb4"|en|R|8|73
1391095201503059972|193794406|Sat May 08 18:18:35 +0000 2021|"“Gloomy day turns bright in Fayette County” | The Fayette Tribune
https://t.co/OvXqqTqMHR"|en|R|2|18
1390765374191423489|193794406|Fri May 07 20:27:59 +0000 2021|"Had a great week here at home in West Virginia! Check out some of the 📸 highlights:

https://t.co/37uSGPEEGC"|en|R|2|16
1390721421568004102|193794406|Fri May 07 17:33:19 +0000 2021|Our granddaughter is growing fast! Today is birthday #6 for her. Charlie and I are so excited to be spending it with her today at home! 🎂 🥳 🎉 https://t.co/0meMwCPqYY|en|R|1|115
1390683759406731265|193794406|Fri May 07 15:03:40 +0000 2021|Such a cool piece in the @WashingtonPost about one of my favorite places in West Virginia: Blenko Glass! https://t.co/4Ibvtrl9vr|en|R|2|7
1390447585001881601|193794406|Thu May 06 23:25:12 +0000 2021|"ICYMI: Today I joined the other members of WV’s congressional delegation urging @potus to approve our state’s request for a federal disaster declaration due to severe storms in February &amp; March in southern WV.
 
Learn more about our letter here: https://t.co/FWL1YfnNYe"|en|R|3|23
1390390423630360581|193794406|Thu May 06 19:38:03 +0000 2021|"Thank you to Buckhannon’s mayor Robbie Skinner for showing me around town today. 

It’s great to see communities in West Virginia on the move again! https://t.co/8Q2FTSSkRy"|en|R|4|65
1390357644414685185|193794406|Thu May 06 17:27:48 +0000 2021|"One of the first accomplishments of my #CapitoConnect initiative was securing crucial grant funding specifically for broadband in Upshur County.

Visited Micrologic in Buckhannon to check on progress today. Support for rural broadband has never been more important. https://t.co/D1BpGg8UMj"|en|R|4|24
1390313151699226624|193794406|Thu May 06 14:31:00 +0000 2021|Yesterday’s sign unveiling at @NewRiverNPS was the culmination of years of hard work. I can’t wait to see the benefits this designation will have on the region and the entire state of West Virginia! https://t.co/0zP7IbMrmV|en|R|1|22
1390103753345413120|193794406|Thu May 06 00:38:56 +0000 2021|"“West Virginia Sens. Manchin, Capito unveil sign for New River Gorge National Park” | @WVNews247

https://t.co/ebeG1Ao398"|en|R|5|35
1390046932085747715|193794406|Wed May 05 20:53:09 +0000 2021|"The designation of @NewRiverNPS as a National Park &amp; Preserve will also help businesses like Pinheads in Oak Hill expand operations &amp; opportunities in WV. 

Pinheads helped the local community throughout COVID-19 &amp; it was great to meet w/ Alison &amp; her family today! 🎳 https://t.co/wPWgjcBB05"|en|R|4|31
1389981441761681411|193794406|Wed May 05 16:32:54 +0000 2021|"👀 Check it out --&gt; We officially have a new sign here at @NewRiverNPS!
 
Can’t wait to see the impact our nation’s newest National Park will have on our great state! https://t.co/BDg9vqxIxI"|en|R|10|83
1389946078657748995|193794406|Wed May 05 14:12:23 +0000 2021|Today is the day! Thrilled to be @NewRiverNPS to officially mark the unveiling of America's newest national park right here in West Virginia! https://t.co/RQZc2BtmZx|en|R|18|136
1389927762786455555|193794406|Wed May 05 12:59:36 +0000 2021|"Last week, I joined @SenJoniErnst and @SenGillibrand to take a stand against sexual assault in our military and hold perpetrators accountable.
 
Learn more about the Military Justice Improvement and Increasing Prevention Act here: https://t.co/jELQgvlsfi"|en|R|4|25
1389686249888309254|193794406|Tue May 04 20:59:55 +0000 2021|West Virginia’s teachers play a critical role in shaping the future of our state. I’m proud to recognize them, especially in a year like this one. Happy #TeacherAppreciationDay to all the dedicated educators across the Mountain State! https://t.co/PE9pOK06EJ|en|R|2|35
1389633157088124928|193794406|Tue May 04 17:28:57 +0000 2021|"Like many other communities in West Virginia, Clendenin felt the full force of the 2016 flood.
 
It’s great to be here w/ Mayor Summers to see firsthand the progress made and economic development underway. Places like Clendenin show the true resiliency of West Virginians. https://t.co/HoRKR33OpD"|en|R|1|21
1389580779710210051|193794406|Tue May 04 14:00:49 +0000 2021|As we continue to recover from the economic damage caused by COVID, now is not the time to raise taxes. The GOP infrastructure framework would not include a tax increase. https://t.co/KDJ3pBYbt7|en|R|4|34
1389369629194264581|193794406|Tue May 04 00:01:47 +0000 2021|It’s time to get serious about infrastructure negotiations. https://t.co/EsFvDzZEZG|en|R|4|30
1389331595044216839|193794406|Mon May 03 21:30:39 +0000 2021|"Great news in our Eastern Panhandle today! When I was a member of the House of Representatives, I worked to secure funding for the Jefferson County Visitors Center. 

So glad to see its doors open today for visitors! https://t.co/aDdkKoNwSc"|en|R|1|8
1389257818117640194|193794406|Mon May 03 16:37:29 +0000 2021|"Catch up on the latest with my weekly newsletter! 🚨🗞
https://t.co/TBoA1346BN"|en|R|1|4
1388894215728517122|193794406|Sun May 02 16:32:40 +0000 2021|Heads up! I’ll be joining @MikeEmanuelFox around 1:00pm to talk about the progress on infrastructure negotiations. 🛣🌉🚰|en|R|2|17
1388867115562815496|193794406|Sun May 02 14:44:58 +0000 2021|"ICYMI: This week, I announced the approval of two projects from @NASA that will take place at @WestVirginiaU
 
Our state has a rich tradition in contributing to our understanding of outer space, and I’m thrilled to see WVU Continue that legacy.🔭🚀

https://t.co/apb1Mdg9mK"|en|R|2|33
1388639022411657225|193794406|Sat May 01 23:38:37 +0000 2021|"May 1st marks the beginning of Mental Health Awareness Month, and it’s never been more important to check up on one another.
 
Always remember that help and resources are available at 1-844-HELP4WV or https://t.co/lIaBbhkkf1."|en|R|9|30
1388583423682301953|193794406|Sat May 01 19:57:41 +0000 2021|"ICYMI from @WTOV9: “Capito optimistic on infrastructure, concerned about type of spending.”
https://t.co/Ju2Sk8ROpC"|en|R|1|13
1388518706704179204|193794406|Sat May 01 15:40:31 +0000 2021|Women shouldn’t be at a professional disadvantage or health risk if they become pregnant at some point during their careers. Proud to join my colleagues to introduce this legislation on behalf of women across our country. https://t.co/x4GT6rSTXb|en|R|3|25
1388238169875824643|193794406|Fri Apr 30 21:05:46 +0000 2021|"Happy Arbor Day, West Virginia! 🌲🌳🍂
 
Did you know that over 75% of our state is covered by forest? From yellow and green in spring and summer, to orange and red in the fall, our trees sure are beautiful in West Virginia. https://t.co/Fv852nReDg"|en|R|9|67
1388205728712822786|193794406|Fri Apr 30 18:56:51 +0000 2021|"“'We're all at the table' Sen. Capito says on infrastructure plan” | @wchs8fox11 

https://t.co/nya4yrILkW"|en|R|3|12
1388167310557556744|193794406|Fri Apr 30 16:24:12 +0000 2021|The overwhelming passage of our drinking water &amp; wastewater infrastructure bill yesterday is proof that we can bring ideas together from both sides of the aisle to deliver results for the American people. https://t.co/FCRGE7EaxN|en|R|5|35
1388117542485598216|193794406|Fri Apr 30 13:06:26 +0000 2021|"Jerry Gilbert has been an excellent leader for @MarshallU, and served the university and Huntington community well.
 
I look forward to working together through the remainder of his term, and wish him all the best in his future endeavors! @MarshalluPres https://t.co/M9lsf5M4kJ"|en|R|3|20
1387931110689185799|193794406|Fri Apr 30 00:45:37 +0000 2021|"Shameful.
 
Last night, @SenatorTimScott was smeared for sharing his perspective and upbringing with the American people.
 
If you know Senator Scott, you know he’s a wonderful man and a great public servant with a positive, smart vision for our country. https://t.co/PDDZ2dTj3y"|en|R|48|234
1387904837086597121|193794406|Thu Apr 29 23:01:13 +0000 2021|Had a constructive &amp; substantive call w/ @POTUS about infrastructure. We both expressed our mutual desire to work together &amp; deliver results for the American people. I stand ready to be a partner in advancing bipartisan infrastructure legislation—just as we’ve done in the past. https://t.co/6mmcIYbqRA|en|R|192|2019
1387870719187554306|193794406|Thu Apr 29 20:45:39 +0000 2021|"“Water bill introduced by Capito is first piece of federal infrastructure package to advance” | @WVMetroNews 

https://t.co/Un03Jt8Prb"|en|R|6|30
1387841716217073665|193794406|Thu Apr 29 18:50:24 +0000 2021|"The passage of our bipartisan water legislation today PROVES that infrastructure can be done on a bipartisan basis.
 
@EPWCmte and @EPWGOP have set the example. Let’s keep the momentum going! https://t.co/I0w27lwxMs"|en|R|3|27
1387750633759989762|193794406|Thu Apr 29 12:48:28 +0000 2021|"Throughout Sexual Assault Awareness Month, we honor the courage and strength of survivors in West Virginia and across the nation. 

We are always standing in your corner. 

The National Sexual Assault Hotline is 1-800-656-4673 #SAAM"|en|R|5|10
1387599859188965378|193794406|Thu Apr 29 02:49:21 +0000 2021|My statement on @potus’ joint address to Congress tonight. https://t.co/qBnyUOGeJt|en|R|21|84
1387557264601587721|193794406|Thu Apr 29 00:00:06 +0000 2021|Looking forward to @potus’ address tonight. My colleagues and I hope to hear his continued commitment toward unity and bipartisan agreement on critical issues facing our nation, such as rebuilding America’s infrastructure. #JointAddress|en|R|2|26
1387534865122402308|193794406|Wed Apr 28 22:31:05 +0000 2021|Good luck to my friend @SenatorTimScott as he prepares to give the Republican response tonight! Excited for Americans to hear your vision of positivity and opportunity for the future of our great nation 🇺🇸|en|R|9|149
1387497445169541131|193794406|Wed Apr 28 20:02:24 +0000 2021|"These are the core areas our infrastructure framework focuses on:
 
🛣Roads
🌉Bridges
🚆Rail
🚰Drinking Water &amp; Waste Water
🦺 Safety
🚢Ports &amp; Inland Waterways
✈️Airports
📶Broadband
💧Water Storage
 
More here: https://t.co/mBqNmk5WD6"|en|R|8|28
1387447593999945729|193794406|Wed Apr 28 16:44:18 +0000 2021|If the Biden administration is truly serious about their pledge for unity, bipartisan infrastructure legislation is the perfect opportunity to deliver. https://t.co/CXcjnsPGpX|en|R|4|25
1387397953598509061|193794406|Wed Apr 28 13:27:03 +0000 2021|"Students shouldn’t have to worry about whether or not they will fall behind in school just because they don't have access to the internet.
 
Closing the ""Homework Gap"" is exactly why I introduced the Every Child Connected Act 📚💻⬇️ https://t.co/sjd6775tMl"|en|R|1|15
1387382502474592256|193794406|Wed Apr 28 12:25:39 +0000 2021|Last week, the Senate confirmed Deanne Criswell to lead @FEMA, making her the first woman to head the agency in history. I commend the leadership of Administrator Criswell and look forward to working with her through my role on the Homeland Security Appropriations Subcommittee.|en|R|2|11
1387201847665086464|193794406|Wed Apr 28 00:27:48 +0000 2021|There is growing momentum toward bipartisan agreement on infrastructure. We need to take advantage of this moment and focus on the art of the possible. https://t.co/sQ5cO9l2eB|en|R|5|37
1387182173292220418|193794406|Tue Apr 27 23:09:37 +0000 2021|"As the larger infrastructure debate continues, @EPWGOP &amp; @EPWCmte crafted and unanimously passed the bipartisan Drinking Water and Waste Water Infrastructure Act of 2021.

I urge my colleagues to vote for this bill that makes critical investments in our nation’s water systems. https://t.co/20DIg1B4NY"|en|R|6|27
1387051379236085766|193794406|Tue Apr 27 14:29:53 +0000 2021|"When the White House asked for a proposal, we answered with our infrastructure framework.
 
It’s time to get to work and show the American people that we’re able to reach a compromise that moves our country forward. https://t.co/VoQtrioS6L"|en|R|21|81
1386829635565064193|193794406|Mon Apr 26 23:48:45 +0000 2021|"Amid the pandemic, drug overdoses continue to take the lives of our brothers and sisters, our daughters and sons, and our friends and neighbors.
 
Let's renew our commitment to combating the disease of addiction and reversing this trend in our state.
https://t.co/9W3dJNL9zG"|en|R|3|13
1386764653712265218|193794406|Mon Apr 26 19:30:32 +0000 2021|"The #RepublicanRoadmap creates an active conversation about infrastructure that includes all sides.
 
The American people are looking for us to come together and deliver a bipartisan plan to improve infrastructure for all states and communities. https://t.co/mBqNmk5WD6 https://t.co/o78DkNbG9G"|en|R|19|68
1386719925683867648|193794406|Mon Apr 26 16:32:48 +0000 2021|🚨 📺 Will be joining @BloombergTV’s Balance of Power with @DavidWestin to talk about our infrastructure framework. Make sure to tune in at 12:40! #RepublicanRoadmap|en|R|2|6
1386663272837959683|193794406|Mon Apr 26 12:47:41 +0000 2021|ICYMI: @NPR: “Countering Biden, Senate Republicans Unveil Smaller $568 Billion Infrastructure Plan” https://t.co/x7wr01yFso|en|R|9|18
1386458779231870986|193794406|Sun Apr 25 23:15:06 +0000 2021|"Awesome news from @WestVirginiaU and Dr. Ziemkiewicz!

Producing rare earth elements from acid mine drainage has been a priority of mine, and I’m thrilled to see WVU continuing as a leader in this space. https://t.co/IGNL4wtP6S"|en|R|3|12
1386431010368278536|193794406|Sun Apr 25 21:24:46 +0000 2021|"The Bluestone National Scenic River provides visitors with the chance to experience true Appalachia, as well as all of the scenery, plant life, and wildlife native to the region.
 
This unspoiled landscape is truly one of a kind. #NationalParkWeek https://t.co/iZRpTFn2uj"|en|R|3|17
1386396525375279104|193794406|Sun Apr 25 19:07:44 +0000 2021|"Honored to provide the commencement address for @FairmontState’s graduation ceremony today. 

These students have shown great resiliency finishing their education through the COVID-19 pandemic. Congrats Falcons! https://t.co/GoFti0MOpJ"|en|R|3|57
1386346627129122819|193794406|Sun Apr 25 15:49:27 +0000 2021|"ICYMI from @Register_Herald: “Capito pushes GOP infrastructure package” 

https://t.co/tbVRDSTYBy"|en|R|2|12
1386313327207501829|193794406|Sun Apr 25 13:37:08 +0000 2021|Coming up soon on #CNNSOTU to talk the @SenateGOP infrastructure framework with @DanaBashCNN! https://t.co/ttx0xWxiDX|en|R|2|13
1386115335619702784|193794406|Sun Apr 25 00:30:23 +0000 2021|The administration’s radical climate agenda would destroy the coal economy in West Virginia. This initiative is devastating to blue collar communities across Appalachia. https://t.co/x3JwGxQVsb|en|R|33|86
1386020673550651396|193794406|Sat Apr 24 18:14:14 +0000 2021|"Congress is supposed to negotiate and come together on the issues that our country is facing.
 
Our framework is a good faith effort in the right direction towards bipartisan consensus on infrastructure. https://t.co/yeEmo2dFEF"|en|R|3|35
1385977269123002372|193794406|Sat Apr 24 15:21:45 +0000 2021|"This view of @HarpersFerryNPS 😍

Where the Shenandoah and Potomac rivers meet at Harpers Ferry is actually the lowest elevation point in West Virginia.
 
Learn more about the history and excitement this town has to offer. #NationalParkWeek https://t.co/d8CXuMHjAc https://t.co/WCh8YpzX3M"|en|R|6|27
1385724354894381060|193794406|Fri Apr 23 22:36:46 +0000 2021|Remember that #TakeBackDay is happening tomorrow! Find a location near you ⬇️ https://t.co/ijIAK84H4f https://t.co/PKEvWd2Csd|en|R|2|7
1385695547647045635|193794406|Fri Apr 23 20:42:18 +0000 2021|"It’s important that West Virginians know the details of our #RepublicanRoadmap and what it means for crucial infrastructure projects across our state.
 
@WVMetroNews has more from our unveiling yesterday: https://t.co/9TVM3kM7Yj"|en|R|1|21
