id|user|created_at|text|lang|label|retweet_count|favorite_count
1520473307555848192|193794406|Sat Apr 30 18:41:00 +0000 2022|Bob &amp; Linda McKinny were featured in the late Anthony Bourdain’s “Parts Unknown” for their work at the Five Loaves &amp; Two Fish food bank in Welch &amp; were sent an Emmy when the show won the award for Outstanding Informational Series. I was honored to visit &amp; see the Emmy in person. https://t.co/FLgPeYoCdq|en|R|4|37
1520381200958906368|193794406|Sat Apr 30 12:35:00 +0000 2022|"Today is National Prescription Drug #TakeBackDay, which gives us an opportunity to play a part in combating the opioid epidemic that has torn apart our families and communities. 

Find a drop-off location near you here: https://t.co/EHKvZ3nMHF"|en|R|1|10
1520126931106250752|193794406|Fri Apr 29 19:44:37 +0000 2022|Five years ago, @SenJackReed and I introduced the STAR Act because it was past time we invest in and advance pediatric cancer research and child cancer treatment. https://t.co/ng9quSxuX4|en|R|2|10
1520088665875173379|193794406|Fri Apr 29 17:12:34 +0000 2022|This week, I had the opportunity to speak with Federal Reserve Chairman Jerome Powell about the effects of inflation on working families in West Virginia, and the impacts of higher prices on local governments, employers, and rural communities across our state.|en|R|3|2
1520052910016638976|193794406|Fri Apr 29 14:50:29 +0000 2022|Those on BOTH sides of the aisle agree: @potus, there is still time to rethink your decision to remove Title 42. https://t.co/EFOXUBdsxr|en|R|2|26
1519781303264153602|193794406|Thu Apr 28 20:51:13 +0000 2022|.@HuntingtonCity really is West Virginia’s “Jewel City,” and it was great to see all that is happening there and at @MarshallU! More on my visits last week: https://t.co/E2F3tnF9T8|en|R|2|14
1519714353825656833|193794406|Thu Apr 28 16:25:11 +0000 2022|"Mon County is a growing part of our state, but we need to make sure our infrastructure can support this expansion.
 
Today, I urged @SecretaryPete to make approval of the Harmony Grove Interchange between Westover &amp; the 68/79 split a DOT priority, because it IS a priority for WV. https://t.co/Ql9JI7TPpc"|en|R|9|27
1519671357159747587|193794406|Thu Apr 28 13:34:20 +0000 2022|With the Senate back in session, now is the perfect time to sign up for my newsletter! Sign up here: https://t.co/Kd5sfbAE5e|en|R|2|10
1519433064266571781|193794406|Wed Apr 27 21:47:26 +0000 2022|"Inflation continues to be one of the main concerns West Virginians share with me as I travel across the state.

Our residents and communities are hurting, and they want accountability from the Biden administration."|en|R|14|108
1519405459882622976|193794406|Wed Apr 27 19:57:45 +0000 2022|My message to @potus on his decision to remove Title 42: There is still time to rethink this. https://t.co/ovL2MKg5Zl|en|R|13|56
1519378199003680769|193794406|Wed Apr 27 18:09:25 +0000 2022|"Why are West Virginians concerned about the crisis on our southern border?
 
Because fentanyl is destroying our families and communities, and we know that ending Title 42 will only make matters worse. https://t.co/nxCBHfnXgt"|en|R|6|44
1519347320915124227|193794406|Wed Apr 27 16:06:44 +0000 2022|Joining my @SenateGOP colleagues in a press conference now – tune in here! https://t.co/a6oqU69NhZ|en|R|1|11
1519328037975863299|193794406|Wed Apr 27 14:50:06 +0000 2022|Good luck tonight @WheelingNailers as you bring the @ECHL playoffs back to Wheeling. West Virginia is behind you! #NailersArmy #KellyCupPlayoffs22 https://t.co/CZrTafwKga|en|R|9|91
1519311183798489088|193794406|Wed Apr 27 13:43:08 +0000 2022|Looking back on my visit with @HerdFB @HerdZone last week. Thanks for inviting me @CoachHuff! 💚🤍 https://t.co/lCXGnv5QPp|en|R|12|100
1519056394632192001|193794406|Tue Apr 26 20:50:41 +0000 2022|"Enjoyed seeing @VComdtUSCG Fagan today where I had the chance to congratulate her on being nominated to head the @USCG!

She is a true trailblazer and fantastic role model for young women across our country. https://t.co/1VyUasY924"|en|R|2|27
1519003762639216640|193794406|Tue Apr 26 17:21:33 +0000 2022|"Fentanyl is the leading cause of death for adults between 18-45 in our country, and we know a significant way it gets into our communities: through the U.S.-Mexico border.

The bottom line: securing our southern border and cutting off the supply will save lives in West Virginia. https://t.co/glT6eP1aDJ"|en|R|18|69
1518949095695654919|193794406|Tue Apr 26 13:44:19 +0000 2022|"Our Northern Panhandle has so much potential, particularly in the city of Weirton, which has been an economic hub for generations.
 
I will continue to fight for the resources they need to spur investment and redevelop this region of our state! https://t.co/YjzVmIz1yX"|en|R|1|17
1518706810286444549|193794406|Mon Apr 25 21:41:34 +0000 2022|"What will happen if @potus lifts Title 42?

It’s simple: A chaotic influx of illegal crossings on our already overwhelmed southern border."|en|R|27|124
1518677886550618112|193794406|Mon Apr 25 19:46:38 +0000 2022|Great news for @WestVirginiaU and @WVU_EcoCAR! https://t.co/j0VG2aBlp4|en|R|4|15
1518386804071837696|193794406|Mon Apr 25 00:29:59 +0000 2022|"For our counties to be successful, there needs to be opportunities for people to climb the economic ladder. Today I joined @NACoTweets leaders from across the US &amp; WV to talk about solutions &amp; resources that are on the way.

Thanks @GregPuckettWV for bringing this event to WV! https://t.co/VOgzLqY1q0"|en|R|5|30
1518232282989047810|193794406|Sun Apr 24 14:15:58 +0000 2022|Orrin Hatch was a wonderful person, friend, and senator. It was an honor to both know him and serve along side him in the Senate. My prayers are with his family, loved ones, and all those his legacy touched as they mourn his passing. https://t.co/bCnVmkDJpq|en|R|10|47
1517989600052097025|193794406|Sat Apr 23 22:11:38 +0000 2022|Although #NationalParkWeek is coming to an end, it’s still the perfect time to visit @NewRiverNPS! https://t.co/Jutj1mZ646|en|R|3|18
1517900549525540864|193794406|Sat Apr 23 16:17:46 +0000 2022|Good luck to @WVUFootball and @HerdFB in their spring football games today! 💙💛💚🤍|en|R|4|39
1517874256830414850|193794406|Sat Apr 23 14:33:18 +0000 2022|Fantastic facility for our incredibly deserving first responders. Thank you for showing me around! https://t.co/VZZtVHZEKn|en|R|2|11
1517862075292393474|193794406|Sat Apr 23 13:44:53 +0000 2022|"ICYMI: Had some productive stops in Jackson County on Monday where I discussed broadband, water system upgrades, and tourism. 

@WOWK13News has the details ⬇️ https://t.co/Q0tp5HtUK8"|en|R|1|10
1517634371917959170|193794406|Fri Apr 22 22:40:05 +0000 2022|"We Are…Marshall! 

Had a blast meeting with @CoachHuff and the @HerdFB team before their Green &amp; White game tomorrow. https://t.co/2zAdAQd3Gv"|en|R|13|158
1517568245326360578|193794406|Fri Apr 22 18:17:19 +0000 2022|In this day and age, cybersecurity has never been more important. It’s encouraging to see efforts underway at @MarshallU to strengthen our defense, and prepare our state and nation as we move into the future. https://t.co/C4qedpT2KK|en|R|2|21
1517552633552117760|193794406|Fri Apr 22 17:15:17 +0000 2022|Caught up on operations at @RCBI4Mfg and witnessed the impressive cutting-edge work being done in this facility — thank you for having me! https://t.co/Vd4UXs5r6O|en|R|3|22
1517529690931666946|193794406|Fri Apr 22 15:44:07 +0000 2022|"Our first responders in West Virginia are our heroes – and they work tirelessly to keep our communities and residents safe. The Compass Center is an essential resource for them.

Thank you to @HPDWV Chief Colder for showing me around! https://t.co/A2HvNaobRl"|en|R|2|17
1517257612940746753|193794406|Thu Apr 21 21:42:58 +0000 2022|"Every West Virginian deserves access to drinking water that is clean and reliable, and partners like @DigDeepH2O help us in making that mission a reality.

I look forward to continuing our work together to find innovative solutions on behalf of our communities in WV! https://t.co/PMqL6p6qeK"|en|R|1|25
1517224373350019073|193794406|Thu Apr 21 19:30:53 +0000 2022|The compassion and generosity that West Virginians have for those in their communities is unmatched. That was on full display as I met with Five Loaves &amp; Two Fishes in Welch today. Thank you for all that you do! https://t.co/DjcEUrug5b|en|R|2|18
1517185043818557440|193794406|Thu Apr 21 16:54:37 +0000 2022|"Major announcement in McDowell County today! 

The completion of the Elkhorn Phase II Water Project means reliable, safe drinking water for residents in southern WV that couldn’t be more deserving. https://t.co/cOBxJPOiyB"|en|R|1|22
1517143700341551104|193794406|Thu Apr 21 14:10:19 +0000 2022|"Enjoyed meeting with Wyoming County EDA Executive Director Christy Laxton and local leaders to discuss opportunities for growth in southern West Virginia.

They shared with me how improving our roads and investing in American energy will reap major dividends in the region. https://t.co/SJwskeeLF1"|en|R|2|20
1516916944040988672|193794406|Wed Apr 20 23:09:17 +0000 2022|"Enjoyed speaking at the @CarnegieSciCtr this morning about all things SPACE and how West Virginia is already playing a critical role through STEM careers and preparing the next generation to succeed in this field 🔭🚀🌖

Thanks for having me! https://t.co/uQcyr5oF1s"|en|R|1|19
1516872330001137664|193794406|Wed Apr 20 20:12:00 +0000 2022|It’s great to be in Follansbee today to announce a $10 million investment I secured to improve the city’s wastewater infrastructure. We must continue to invest in economic development opportunities, and this announcement will help in that effort. https://t.co/KxPaWEES62|en|R|2|28
1516854965813354498|193794406|Wed Apr 20 19:03:00 +0000 2022|"Received an update on construction progress of the Weirton Frontier Crossing, and spoke with leaders from @group_frontier about the impact this project will have in our Northern Panhandle. 

I look forward to continue helping make this investment a success! https://t.co/3N7h7PBSal"|en|R|2|17
1516839920077348872|193794406|Wed Apr 20 18:03:13 +0000 2022|Received an update from the Weirton Water Board leadership on the congressionally directed spending I helped secure for the city’s water treatment system. Investments like this will help make necessary updates and maintain clean drinking water for the community. https://t.co/wnpQxKCf2O|en|R|2|19
1516488933357637636|193794406|Tue Apr 19 18:48:31 +0000 2022|.@FlyCRW’s new U.S. Customs facility will help continue to build the international presence that will help West Virginia grow economically. Proud to join leaders today in Charleston to cut the ribbon and mark the official opening of this new and needed facility! https://t.co/XjBsYbHd4P|en|R|3|27
1516460850453917698|193794406|Tue Apr 19 16:56:55 +0000 2022|.@MarshallU’s Division of Aviation is helping drive the aerospace industry right here in West Virginia, and the Bill Noe Flight School is one of those driving forces. Great to see the school really taking off at @FlyCRW! 🛫 https://t.co/z3O2dLdrXK|en|R|7|68
1516184549369298954|193794406|Mon Apr 18 22:39:00 +0000 2022|"There were 221,303 illegal encounters on our southern border in March.

Think Biden’s border crisis is getting better? Think again. https://t.co/i9BXKNJ2NJ"|en|R|5|33
1516161016173899782|193794406|Mon Apr 18 21:05:29 +0000 2022|"Lots to talk about in Jackson County today!

Catch up on all my visits with a quick recap of the day ⬇️ https://t.co/n5GjArIZJ9"|en|R|3|19
1516136307004788741|193794406|Mon Apr 18 19:27:18 +0000 2022|"It was great to be in Ravenswood this afternoon to meet with Mayor Josh Miller about his vision for the future of the city. 

I look forward to working w/ Mayor Miller to expand recreational opportunities for his community! https://t.co/vbVan83up8"|en|R|3|13
1516105186795786249|193794406|Mon Apr 18 17:23:39 +0000 2022|"After meeting with Mayor Rader, it was clear that immediate improvements to Ripley’s sewer system are vital to the town’s future success.
 
I’m proud to have secured $3 million in direct spending to help make this project a reality! https://t.co/BLzp98lo1b"|en|R|3|20
1516079569694081034|193794406|Mon Apr 18 15:41:51 +0000 2022|"In Ripley today meeting w/ leaders from Jackson &amp; Roane counties about broadband.

I’ve received stories about connectivity issues from Spencer, Givens, Ravenswood, and many places in between. Through local efforts &amp; the bipartisan infrastructure law, critical support is coming! https://t.co/a8GZ9Icaxs"|en|R|2|17
1516066104887631874|193794406|Mon Apr 18 14:48:21 +0000 2022|"Love this story about Julie from St. Albans and how she’s leading a team in charge of restoring the Empire State Building’s dome 1,250 feet in the air. 

Talk about a West Virginia girl rising up! https://t.co/SAGFonSwxm"|en|R|1|16
1515661854126731265|193794406|Sun Apr 17 12:02:00 +0000 2022|Happy Easter, West Virginia! I hope you have a blessed day. https://t.co/PTgN3ZhVFT|en|R|3|53
1515394341182873602|193794406|Sat Apr 16 18:19:00 +0000 2022|"April is #FinancialLiteracyMonth!

After spending years on the Financial Services Committee, I saw firsthand the correlation between family participation in financial institutions and their overall success. We must work to increase opportunities for people across WV."|en|R|1|8
1515362380510769153|193794406|Sat Apr 16 16:12:00 +0000 2022|Pell Grants are an invaluable resource for students pursuing secondary education. That’s why I worked to increase maximum Pell Grant awards in the FY22 funding bill this year so our students have the resources they need to pursue their dreams.|en|R|5|39
1515316830352470017|193794406|Sat Apr 16 13:11:00 +0000 2022|April 16th marks the beginning of #NationalParkWeek. Our very own @NewRiverNPS might be the 63th National Park, but it’s Number 1 to us! https://t.co/LYaAgESfty|en|R|4|21
1515090086471294979|193794406|Fri Apr 15 22:10:00 +0000 2022|"While Congress and the @FCC move to connect every West Virginian to an online future, outdated regulations still stand in the way.

Learn more about an issue I raised with the FCC regarding the need for reforms to rules hindering broadband deployment: https://t.co/MXeLiTw7qS"|en|R|1|6
1515057445621616647|193794406|Fri Apr 15 20:00:18 +0000 2022|Happy birthday to my daughter-in-law, Laura and granddaughter, Celia. One of them turned 12!! 🎉 🥳 🎂 https://t.co/j56w6GlyCC|en|R|3|44
1514998734559580161|193794406|Fri Apr 15 16:07:00 +0000 2022|It is important that we continue to invest in the potential of our downtowns in West Virginia. Looking forward to the impact this funding will have in Iaeger! DETAILS: https://t.co/bq19bBGpqZ|en|R|2|6
1514944627991851011|193794406|Fri Apr 15 12:32:00 +0000 2022|"Good Friday reminds us of the sacrifice made for all of us on the cross, and of the unequivocal, limitless love of God.

I hope all West Virginians are able to spend this weekend with those who matter most in their lives."|en|R|3|56
1514706847864967168|193794406|Thu Apr 14 20:47:09 +0000 2022|"Alzheimer’s is a deeply personal issue for me, as it is for many Americans. 

Since 2015, we have increased funding for Alzheimer’s/dementias research by 500% because we believe in finding a cure. 

I was proud to help secure this increase in the recently passed funding bill."|en|R|3|51
1514613424772116493|193794406|Thu Apr 14 14:35:55 +0000 2022|"How important is accurate broadband mapping in our goal to close the #digitaldivide and allocating funding from the bipartisan infrastructure law? 

Here’s what you need to know ⬇ https://t.co/xwbwGNzdws"|en|R|6|11
1514352224658345987|193794406|Wed Apr 13 21:18:00 +0000 2022|"Simply put, ending Title 42 would turn the crisis on our southern border into a catastrophe. 

Learn more about the legislation I helped introduce last week to assist our Border Patrol agents on the ground and provide the direction our country needs. https://t.co/hIE4Ke28zM"|en|R|3|18
1514305164307480580|193794406|Wed Apr 13 18:11:00 +0000 2022|For four decades, Lou Scally has helped West Virginians prepare for the day as @WDVMTV’s weatherman. Thank you for your service to people across our state, and best of luck in the future! https://t.co/QlKRjLQPXC|en|R|3|8
1514276196984532997|193794406|Wed Apr 13 16:15:53 +0000 2022|Wishing our granddaughter (and @pawpatrol fan!) Macaulay a very happy birthday today! 🎈🥳 🎉 https://t.co/ia3LtDhFbC|en|R|1|31
1513995121263620097|193794406|Tue Apr 12 21:39:00 +0000 2022|"In order for our communities to thrive, we must connect them with reliable broadband service. 

Share your #CapitoConnect story with me here: https://t.co/Ac8p1kDWp7"|en|R|1|7
1513947908223246345|193794406|Tue Apr 12 18:31:23 +0000 2022|"Our veterans in West Virginia rely on our VAMC families for everything from primary care, to emergency services. 

Last week, my colleagues and I asked @potus to not cut critical VA medical services—especially for elderly veterans. DETAILS: https://t.co/xWK4jdSQO5"|en|R|2|9
1513862852448243714|193794406|Tue Apr 12 12:53:24 +0000 2022|"Month after month, the Biden economy continues to harm hardworking West Virginians.
 
The White House might be numb to record inflation at this point, but American families driving to work and putting food on the table certainly are not. https://t.co/3PUhBbRxhC"|en|R|18|73
1513531908097032199|193794406|Mon Apr 11 14:58:21 +0000 2022|Fantastic news! It’s important that the U.S. steps up to help our European Allies move from their reliance on Russian LNG. Energy security is national security, and I commend @DowNewsroom and all partners involved for making this a reality and supporting Europe’s energy needs. https://t.co/Y9UeSUmIHz|en|R|1|9
1513519990456012804|193794406|Mon Apr 11 14:11:00 +0000 2022|"Record-level gas prices are causing undue burdens on West Virginians as they travel to work, school, or across town for basic needs like groceries.

Efforts like supporting pipeline infrastructure projects could provide major relief. The Biden admin must unleash American energy. https://t.co/oBwopntANv"|en|R|21|74
1513195854647246875|193794406|Sun Apr 10 16:43:00 +0000 2022|"West Virginia continues to see benefits from the bipartisan infrastructure law.

This week, I announced $24 million is heading to our communities to improve our public transportation infrastructure! https://t.co/3vMB1ul36p"|en|R|3|26
1513142755127562241|193794406|Sun Apr 10 13:12:00 +0000 2022|ICYMI: I introduced legislation this week that would clarify @potus cannot use climate change as the basis to declare a national emergency. DETAILS: https://t.co/bXOhE7uGjm|en|R|8|53
1512868950912094210|193794406|Sat Apr 09 19:04:00 +0000 2022|One of the best ways to stay updated with my work in Washington is by reading my weekly newsletter! Sign up here and keep in touch with my efforts on behalf of West Virginians. https://t.co/Kd5sfbSeWM|en|R|2|12
1512787664960835589|193794406|Sat Apr 09 13:41:00 +0000 2022|Ashton has done a great job interning in my Washington, D.C. office over the last few months. Thank you for all your hard work on behalf of West Virginia! https://t.co/VSs6EylYKH|en|R|4|59
1512533886722531336|193794406|Fri Apr 08 20:52:34 +0000 2022|"Back in 2019, I helped set our Woody Williams VAMC in Huntington as a VA FARMS site, and I’m thrilled that additional funding was secured for the program in the FY22 Appropriations bill.
 
Agritherapy is a great resource for our veterans, and WV is a perfect place for it to grow! https://t.co/5nwhFT7qyR"|en|R|1|13
1512498258253385733|193794406|Fri Apr 08 18:31:00 +0000 2022|Tomorrow is the last day to participate in @WVDNR’s 2022 Gold Rush! Check out stocking locations and more information here ⬇ 🎣https://t.co/EcUdllvroY.|en|R|1|3
1512217862538252292|193794406|Thu Apr 07 23:56:48 +0000 2022|"Sending my congratulations to all of WV’s @SBAgov Small Business Persons of the Year award winners!
 
Small businesses make up 98% of our businesses in WV, and employ half of our workforce. Thank you all for making such an impact in your communities! https://t.co/ckDhkTWsZa"|en|R|1|11
1512099015948746765|193794406|Thu Apr 07 16:04:33 +0000 2022|"Ending Title 42 will add to the crisis on our southern border in ways we simply are not prepared to handle.
 
That’s why I’m joining my colleagues to introduce a bill that maintains this critical tool for our border patrol, and holds the Biden administration accountable."|en|R|35|188
1512092564635197442|193794406|Thu Apr 07 15:38:55 +0000 2022|"Today, I voted to pass two bills that end normal trade relations with Russia and their ally Belarus, and ban Russian energy imports to the U.S.

In order for @POTUS to restore imports from Russia, my @SenateGOP colleagues and I also ensured strict conditions would have to be met."|en|R|8|26
1512061192843546629|193794406|Thu Apr 07 13:34:15 +0000 2022|What will happen if @potus moves forward and ends Title 42 authority? I explain the consequences of this short-sighted, irresponsible decision in @TheHill ⬇ https://t.co/eaS5D0oGg9|en|R|3|7
1511837403601797122|193794406|Wed Apr 06 22:45:00 +0000 2022|"I launched my #CapitoConnect plan when I first came to the Senate in 2015 to help better connect WV.

We’ve come a long way since then, but our work doesn’t stop here. Tell me your story and help us get broadband to that last house, school, and business. https://t.co/Ac8p1kml0x"|en|R|2|7
1511774523896573955|193794406|Wed Apr 06 18:35:08 +0000 2022|"Gas prices in West Virginia have been trending up since @potus began targeting American energy production.

It’s time this administration encourage energy independence. My thoughts on this: https://t.co/Tm7ALIEtS9"|en|R|7|31
1511735734025310216|193794406|Wed Apr 06 16:01:00 +0000 2022|"We have to be realistic: The world has to have baseload energy.

That comes from nuclear, natural, gas, and WEST VIRGINIA COAL. https://t.co/lhDE8m4Taa"|en|R|14|76
1511721382983479301|193794406|Wed Apr 06 15:03:58 +0000 2022|Haley Bunn is an extremely capable and accomplished lawyer, as well as a great mother and West Virginian. She is a wonderful pick to join the bench of our state’s Supreme Court of Appeals. Well done, @WVGovernor! https://t.co/9X0QykuqlY|en|R|2|23
1511700752837844996|193794406|Wed Apr 06 13:42:00 +0000 2022|My work in Washington will always be about West Virginia! https://t.co/XzHX7XCFvV|en|R|1|9
1511475848515358724|193794406|Tue Apr 05 22:48:18 +0000 2022|Congratulations to Admiral Linda L. Fagan @VComdtUSCG on this historic nomination. Your leadership has been inspirational to women everywhere, and I’m confident in your ability to be commandant of the @USCG. https://t.co/ldV7rpl1vD|en|R|2|9
1511450600134914058|193794406|Tue Apr 05 21:07:59 +0000 2022|Had the privilege of hosting the WV National Beer Wholesalers Association members in my Washington D.C. office today. We discussed the importance of workforce recruitment and retention, as well as ways to improve transportation and distribution systems. Thank you for visiting! https://t.co/BE539HfZHB|en|R|1|9
1511423472014180352|193794406|Tue Apr 05 19:20:11 +0000 2022|"Energy independence has become a matter of national security, and we have the resources right here in West Virginia to help.

We can’t afford to wait any longer. https://t.co/dFAnyWwyqQ"|en|R|4|17
1511391094394789891|193794406|Tue Apr 05 17:11:31 +0000 2022|"Biden's policies have created a crisis on our southern border, and ending Title 42 will turn that crisis into a full-blown catastrophe.

Let’s not take away the only tool our border agents still have to do their jobs.

MORE on this in my op-ed in @TheHill:
https://t.co/eaS5D0oGg9"|en|R|7|15
1511345888702173185|193794406|Tue Apr 05 14:11:53 +0000 2022|It’s important for @MSHA_DOL to have a West Virginia perspective in its leadership, which is why I’m pleased to see the U.S. Senate confirm WV native Chris Williamson to be Assistant Secretary for Mine Safety. Congratulations, Chris! https://t.co/E7y5k7NQLm|en|R|1|7
1511312705814253568|193794406|Tue Apr 05 12:00:02 +0000 2022|12 years later, we continue to remember the lives and legacies of the 29 miners we lost during the Upper Big Branch Mine disaster. Charlie and I send prayers for peace and comfort to their families, loved ones, and communities today. https://t.co/KkVjBgjJCP|en|R|11|54
1511118667752345601|193794406|Mon Apr 04 23:09:00 +0000 2022|"Two things are certain from Russia’s barbaric exit from the town of Bucha:

1. Putin is a war criminal.
2. We must continue to provide the humanitarian assistance and lethal aid that Ukraine needs. 

https://t.co/hI7v41ercw"|en|R|5|22
1511094665013039107|193794406|Mon Apr 04 21:33:37 +0000 2022|Read my op-ed in the @IntelligencerWV detailing how the Biden administration’s domestic energy policies have led to record-high gas prices. https://t.co/Tm7ALIEtS9|en|R|5|13
1510985792008560642|193794406|Mon Apr 04 14:21:00 +0000 2022|In order to lower gas prices, we must invest in domestic energy production. The Biden administration’s plan to tap into the Strategic Petroleum Reserve is simply a shortsighted, Band-Aid fix. https://t.co/s21mzUntAh|en|R|7|35
1510743948293148678|193794406|Sun Apr 03 22:20:00 +0000 2022|The fact that the Biden administration is willing to end Title 42 while our country braces for a unprecedented surge of illegal crossings shows they aren’t serious about border security, and never have been. https://t.co/IQ8U1uQbkM|en|R|9|28
