id|user|created_at|text|lang|label|retweet_count|favorite_count
1375104075415629828|88784440|Thu Mar 25 15:15:34 +0000 2021|A fantastic piece by @LaVarrWebb about federalism. Give it a read. https://t.co/v1M60dHSQX|en|R|5|34
1374822074527723520|88784440|Wed Mar 24 20:35:00 +0000 2021|1/2 Today I proposed immediate, common-sense reforms that would help stem the flood of immigrants at our border and protect vulnerable women and children from the clutches of the cartels and coyotes. Sadly, it was blocked by Senate Democrats.  https://t.co/TpsD56jLHa|en|R|35|138
1374748728809111561|88784440|Wed Mar 24 15:43:33 +0000 2021|Earmarks let politicians funnel your money to their campaign donors as payoff. The Senate must hold the line against this legalized corruption. https://t.co/tvMoVlQFCZ|en|R|102|262
1374452797832273922|88784440|Tue Mar 23 20:07:37 +0000 2021|We are lucky to have so many incredible business leaders here in Utah. Our state and our communities are better off because of the work they do and the teams they lead. https://t.co/rubaFiwzyU|en|R|7|35
1374401372511113227|88784440|Tue Mar 23 16:43:17 +0000 2021|1/2 It’s almost never the wealthy and well-connected whose safety is impaired by restrictive gun-control laws.  This was true in England in 1671 when King Charles II prohibited commoners from owning guns, and it remains true in America today. https://t.co/sO2hirkUzV|en|R|43|178
1374359846875770880|88784440|Tue Mar 23 13:58:16 +0000 2021|Sen. Mike Lee (R-Utah) has reintroduced the Protecting American Jobs Act, a bill that would strip the National Labor Relations Board (NLRB) of its power to prosecute and adjudicate labor disputes. https://t.co/zZkApnvsmq|en|R|23|120
1374133920090963976|88784440|Mon Mar 22 23:00:31 +0000 2021|Congratulations, W0LV3R1NES, on your 1st place victory at the @AtlanticCouncil Cyber 9/12 competition. Your accomplishment highlights the exceptional work being done at @UVU and @UVU_CNSS https://t.co/9EcspdMiBK|en|R|5|22
1373103021786230786|88784440|Sat Mar 20 02:44:06 +0000 2021|The BYU law school brought my family to Utah, and has played a prominent role in every stage of my life. I’m grateful that my late father was able to play a role in its founding.  @BYULaw @jrclschair https://t.co/LGfCifvUDK|en|R|15|161
1372946537958023168|88784440|Fri Mar 19 16:22:17 +0000 2021|Revising Covid social distancing guidelines for kids in school to 3 feet with masks is a step in the right direction. Looking forward to seeing more schools re-open for in-person instruction. https://t.co/yugjrNZb8p|en|R|6|71
1372622590368493578|88784440|Thu Mar 18 18:55:02 +0000 2021|1/2 Spectrum access and targeted regulatory reform are essential for any future U.S. efforts to develop IoT devices, expand our Wi-Fi capabilities, or look to 5G and eventually 6G networks. Simply spending more federal government money, however, will not address those problems. https://t.co/CL8hVdhzsh|en|R|7|29
1372571181354782720|88784440|Thu Mar 18 15:30:45 +0000 2021|Sen. Mike Lee (R-Utah) reintroduced the “CBO Show Your Work” Act Wednesday, legislation designed to improve the legislative process by making the Congressional Budget Office more transparent and accountable. https://t.co/3ZycAyGe61 https://t.co/2LQgDVYd9T|en|R|27|100
1372318006722838536|88784440|Wed Mar 17 22:44:43 +0000 2021|Thank you @SecDebHaaland for keeping your commitment to visit Utah to meet with the people impacted by national monument designations. https://t.co/ZztxuqG2OT https://t.co/rEKHOTkOCN|en|R|6|63
1372268881885102083|88784440|Wed Mar 17 19:29:31 +0000 2021|Churches, synagogues, and mosques are sacred houses of worship, and should never be regulated like gas stations, stadiums, and other places of public accommodation.  The Equality Act ignores this distinction, and therefore threatens religious freedom. https://t.co/xnaS6CdWN0|en|R|88|407
1372215961567264769|88784440|Wed Mar 17 15:59:14 +0000 2021|1/2 I couldn’t be more excited about the work of the engineers taking place at my alma mater @BYU. https://t.co/J2VZXF3xcE|en|R|6|34
1371463040386863105|88784440|Mon Mar 15 14:07:24 +0000 2021|1/3 Prosecutors should have to show a suspect had a guilty mind, not just that they committed an illegal act, before an American citizen is put behind bars. https://t.co/gtvhUYi7GR|en|R|19|89
1370789671685431301|88784440|Sat Mar 13 17:31:40 +0000 2021|Another exemplary Utahn making a difference in their community. Congratulations Jason! https://t.co/AizXECK0fr|en|R|5|57
1370094069691645956|88784440|Thu Mar 11 19:27:35 +0000 2021|I was proud to join with Utah’s unified congressional delegation today to encourage a collaborative and permanent legislative solution to the Bears Ears-Escalante controversy. https://t.co/EPOCkNQJhP|en|R|5|40
1370044813609992194|88784440|Thu Mar 11 16:11:52 +0000 2021|Enjoyed connecting with Utahns from Utah’s 1st and 4th congressional districts! I want to extend a special thanks to both @RepBurgessOwens and @RepBlakeMoore for joining me in answering the questions from the people we represent. https://t.co/lLx5xzAojn|en|R|6|101
1369732143212019712|88784440|Wed Mar 10 19:29:25 +0000 2021|Utah is leading again. Great people, great policies, lead to great opportunity. https://t.co/iHL3vUijvL|en|R|7|114
1369697539025408000|88784440|Wed Mar 10 17:11:55 +0000 2021|1/2 Yesterday, Sens. Mike Lee (R-UT), @SenCoonsOffice (D-DE), @SenatorLankford (R-OK), @SenatorShaheen (D-NH), @SenatorTimScott (R-SC), @SenAmyKlobuchar (D-MN), @SenatorCollins (R-ME), and @SenCortezMasto (D-NV) introduced the Universal Giving Pandemic Response and Recovery Act. https://t.co/VSknqqbII7|en|R|15|71
1369423628585078790|88784440|Tue Mar 09 23:03:30 +0000 2021|Great initiative by Utahns continuing to make a difference. Great work Steele McKinney and @RyanQualtrics! https://t.co/h3m1NJiBUu|en|R|9|43
1369322189258907663|88784440|Tue Mar 09 16:20:25 +0000 2021|Further unilateral, executive action under the Antiquities Act will result in the same frustration Utahns have felt for 25 yrs. Utahns deserve a legislative solution that would serve both the nation and our state. Let’s end this historic cycle of disputes. https://t.co/nEr0y1gDRs|en|R|11|45
1368313126622437377|88784440|Sat Mar 06 21:30:46 +0000 2021|Sen. Mike Lee issued the following statement on the passage of the COVID spending package today in the Senate: https://t.co/B2ofCcEHda https://t.co/LoHmRgzJZR|en|R|110|445
1368226407000776704|88784440|Sat Mar 06 15:46:10 +0000 2021|Watch the Senate floor live as Democrats spend another almost $2T. Tick, tick, tick... https://t.co/sMEucggltQ|en|R|245|741
1367981940503117830|88784440|Fri Mar 05 23:34:45 +0000 2021|Pleased to announce that @LeeLons will be joining my staff as Comm's Director. Lee is one of the most respected members of the UT media, fair &amp; honest, &amp; a consummate professional. His experience makes him the ideal messenger for my team as he works to serve the people of Utah. https://t.co/iyaW2zab29|en|R|14|172
1367896967750254597|88784440|Fri Mar 05 17:57:06 +0000 2021|"Off to the floor to debate and vote on the $1.9T bill the Democrats call the American Rescue Plan.  In reality it is the ""Democrat Priorities Rescue Plan.""  Using this process to bypass a bipartisan approach is not what America needs. https://t.co/SlNRNrow24"|en|R|80|470
1367885124520525826|88784440|Fri Mar 05 17:10:02 +0000 2021|Join me for two live, interactive town hall events on Wednesday, 3/10. The first event will be at 5pm MT featuring @RepBurgessOwens &amp; the second event will take place at 6:15pm MT with @RepBlakeMoore. Register here: https://t.co/qj2h8XMHpO https://t.co/K6r6Rcc9sa|en|R|23|96
1367598541665947648|88784440|Thu Mar 04 22:11:15 +0000 2021|I’m gearing up to push back on the Biden administration’s reckless $1.9 trillion earmark wish list—only 1% of which goes for COVID vaccine production and distribution.  These supplies should help keep my colleagues going for a few days. https://t.co/aaEmUF9RKr|en|R|115|627
1367240093401047042|88784440|Wed Mar 03 22:26:55 +0000 2021|1/2 This bill is not about providing actual COVID relief for the American people. It’s about fulfilling a partisan wish list, through bad economic reasoning and blatant special-interest handouts. https://t.co/5hUziIAeOY|en|R|146|548
1367143282623590410|88784440|Wed Mar 03 16:02:13 +0000 2021|"Utahns have made hard decisions to ensure a prosperous economy.  In fact, the State is running a surplus.  Utah’s sacrifice and good governance should not go to bail out other states to the tune of $350 billion. 

What would you cut? https://t.co/d6oucalIkx"|en|R|97|461
1366832804831576068|88784440|Tue Mar 02 19:28:29 +0000 2021|1/2 An in-depth video by Fox 13 Utah on the reckless actions by the Biden Administration which completely disregard not only rural Utah, but rural America in general. https://t.co/fqaiCTtCcI|en|R|22|110
1366798175747588097|88784440|Tue Mar 02 17:10:53 +0000 2021|1/2 The FBI has repeatedly opposed efforts to rein in its domestic-surveillance authority under FISA, the PATRIOT Act, and other provisions of federal law. https://t.co/8TtliOEled|en|R|41|173
1366537333818990592|88784440|Mon Mar 01 23:54:24 +0000 2021|Banning earmarks in 2011 was the first step in reforming Congress’s dysfunctional budget process. Much more work needs to be done, but backsliding into the corrupt and corrupting earmarks racket should not be an option. https://t.co/05y2ftCwjR|en|R|14|105
1366511017501548544|88784440|Mon Mar 01 22:09:49 +0000 2021|The circumstances around this story are heartbreaking. Our joint team was happy to have played a part in helping this family during a trying time. Thank you for the kind words @TannerAinge https://t.co/plUx7JMF5i|en|R|8|41
1365422918214148098|88784440|Fri Feb 26 22:06:06 +0000 2021|Thank you @USAttyHuber for your service to Utah and the Nation. John’s commitment to service exemplifies the best of Utah. I wish him the best on his next endeavor. https://t.co/WjqruQAFm5|en|R|15|62
1365401061142499335|88784440|Fri Feb 26 20:39:15 +0000 2021|"Senator Mike Lee (R-UT) issued the following statement in response to the Biden administration’s airstrike in Syria last night:  
https://t.co/0lsuhjPJ5k https://t.co/tAE8utsBH2"|en|R|68|325
1365375142210191360|88784440|Fri Feb 26 18:56:16 +0000 2021|1/3 To honor and thank the men and women of the Utah National Guard for their dedication and selfless service in protecting the United States Capitol, I have entered their names into the Congressional Record. https://t.co/p7m7PxBCCx|en|R|8|92
1365354442057519109|88784440|Fri Feb 26 17:34:00 +0000 2021|.@marcorubio &amp; I have long said that the Child Tax Credit must be further increased to help working families. In the current pandemic relief bill under consideration, we would support increasing the Child Tax Credit to $3,500, &amp; $4,500 for young children. https://t.co/jzreI20hue|en|R|16|59
1365015657167941634|88784440|Thu Feb 25 19:07:48 +0000 2021|"Sens. Lee, @JerryMoran, and @SenatorBraun Introduce PROMISE Act to Hold Big Tech Accountable.
https://t.co/6Du76dDsv8 https://t.co/v3y9KnEnIm"|en|R|33|142
1364719244156563456|88784440|Wed Feb 24 23:29:57 +0000 2021|The Lee-@marcorubio plan would help address the parent penalty by nearly doubling the Child Tax Credit. The plan would also eliminate the stay-at-home parent penalty by turning the childcare credit into a “young child” enhancement that families of all stripes can access. https://t.co/iUWXUjgBLY|en|R|32|131
1364396691063939079|88784440|Wed Feb 24 02:08:15 +0000 2021|This week, members of my staff will be hosting mobile offices in the Uinta Basin. If you need help with federal agencies or want to express any concerns with a member of my staff, please stop by! https://t.co/P2US5TNned|en|R|6|44
1364295177238695939|88784440|Tue Feb 23 19:24:52 +0000 2021|Join me tomorrow at 6:00 PM MT for my #AccessLive event. Register now at https://t.co/qj2h8XMHpO or by texting SENMIKELEE to 833-898-5483. I look forward to answering your questions! https://t.co/oj4D6hg8Mi|en|R|6|17
1364273420209430530|88784440|Tue Feb 23 17:58:25 +0000 2021|1/2 There has been a consistent trend over the last 80 years – under both Republican and Democratic leadership, in both Congress and the White House – in which we have taken power away from the American people. https://t.co/8rSHdts1XA|en|R|55|239
1364248352150462464|88784440|Tue Feb 23 16:18:48 +0000 2021|Utah isn’t made more beautiful by national monument designations.  In some cases, those designations degrade the land and make the surrounding communities — already impoverished by federal land-management policies dictated by federal bureaucrats — poorer. https://t.co/cGCSpGKauo|en|R|29|218
1363980589695696898|88784440|Mon Feb 22 22:34:48 +0000 2021|The founders designed a leg branch in which U.S. Senators would be accntble to the states. Each year during Utah’s legislative session, I deliver my annual report to the Utah Leg &amp; people of Utah, &amp; it’s a responsibility I take seriously. Read it here: https://t.co/dE23S5BAKw|en|R|12|77
1363952174468890624|88784440|Mon Feb 22 20:41:54 +0000 2021|I was disappointed that Judge Garland declined to condemn dangerous, radical positions previously taken by fellow DOJ nominees, Vanita Gupta and Kristen Clarke. https://t.co/ME3NVfFbt9|en|R|160|681
1362929255697547272|88784440|Sat Feb 20 00:57:11 +0000 2021|This headline is not only misleading, but affirmatively deceptive.  The Salt Lake Tribune will stop at nothing to undermine and create divisions within the Republican Party.   https://t.co/Z80CxsWZlp|en|R|130|639
1362865289801699331|88784440|Fri Feb 19 20:43:00 +0000 2021|1/2 Congratulations to Provo/Orem, SLC, Ogden-Clearfield for being ranked as #1, #4, and #9 in the 2021 Best-Performing Large Cities Index, and to Logan and St. George for ranking as #2 and #4 in the 2021 Best-Performing Small Cities Index! https://t.co/UGdz6FFTjs|en|R|8|71
1362849754237952000|88784440|Fri Feb 19 19:41:16 +0000 2021|I had a productive conversation on ways to build on the success of the First Step Act as we make important reforms to our criminal justice system. I appreciate the collaboration with local leaders, building on their recent efforts of reform in Utah @erickhutchings @OdysseyHouseUT https://t.co/HueKU66PKx|en|R|8|68
1362779720073564162|88784440|Fri Feb 19 15:02:59 +0000 2021|When my father helped start the Law School at BYU, he was able to put together a stellar charter class—many of whom became legal practitioners I have looked up to throughout my career.  Hearing stories from a handful of them yesterday about their time with my dad was a treat. https://t.co/3xZBVw7whl|en|R|16|229
1362543759142060032|88784440|Thu Feb 18 23:25:21 +0000 2021|1/2 Today, I had the privilege to speak with the majority and minority caucuses of both the Utah House and Senate. This effort to be accountable to, and collaborative with state policymakers has been a priority of mine since I first took office. https://t.co/WzmNldjlzC|en|R|7|117
1362522883176738817|88784440|Thu Feb 18 22:02:24 +0000 2021|Congratulations to the men and women at @NASA. This is a great day for American space exploration and showcases what can be achieved through countless hours of hard work and collaboration. #NASAPerseverance https://t.co/wpwZRWgzB3|en|R|32|233
1362168666448678912|88784440|Wed Feb 17 22:34:52 +0000 2021|Rush Limbaugh was the voice of conservatism for a generation. He was the most important broadcaster in the history of radio, who drew millions of conservatives into a national political debate that was trying to leave them behind. He will be deeply missed.|en|R|168|1601
1361745361547759623|88784440|Tue Feb 16 18:32:48 +0000 2021|Congratulations on the well deserved award, James. Utah is lucky to have someone so dedicated to making a difference in young people's lives. From one @timpview_tbirds Thunderbird to another, congratulations! https://t.co/sbE1OTVE3A|en|R|7|66
1360767669528625153|88784440|Sun Feb 14 01:47:48 +0000 2021|Sen. Mike Lee (R-Utah) today issued the following statement after the Senate’s acquittal of former President Donald Trump. https://t.co/IWqInbOU3h|en|R|274|1692
1360412763382718468|88784440|Sat Feb 13 02:17:32 +0000 2021|Well done @GovCox, Sen Hinkins, Rep Brooks, and the entire legislature. The ability of Utahns to exercise their constitutional rights and liberties should always be promoted and defended. Your support of the 2nd amendment is commendable. @utahsenate @utahhousereps|en|R|87|633
1360306897912352774|88784440|Fri Feb 12 19:16:52 +0000 2021|Incredible work being done by 40 incredible Utahns. A state is only as good as the people who call it home. With men and women like these, it’s no wonder that Utah continues to grow and thrive. https://t.co/06ejFAjNi8|en|R|9|87
1360000373059166211|88784440|Thu Feb 11 22:58:51 +0000 2021|Thank you, Gideon George, for sharing your journey. You are truly an inspiration, and we are lucky to have you as part of our Utah story. We are all cheering you on! @BYUbasketball https://t.co/NjH5d1TrUP|en|R|11|164
1359981286555795458|88784440|Thu Feb 11 21:43:00 +0000 2021|Since day one, the Biden Admin has been treading on state authority. Pausing oil &amp; gas leasing. Holding up permits. Today they rolled back a requirement to get support from affected governors and counties before acquiring land under the LWCF. This is wrong. States MATTER.|en|R|224|1001
1359584235322019845|88784440|Wed Feb 10 19:25:16 +0000 2021|"1/2 “There can be no question that he was talking about the three Democrat politicians whose violent rhetoric had just been aired. ..."" https://t.co/gbM2Zg3M9m"|en|R|80|357
1359549137558069249|88784440|Wed Feb 10 17:05:48 +0000 2021|For those who are accusing me of giving Trump a “mulligan” because of a headline manufactured for more clicks – watch this clip. 1/3 https://t.co/bot4Cco2yx|en|R|142|467
1359370052689162242|88784440|Wed Feb 10 05:14:11 +0000 2021|To be perfectly clear, my reference to taking a “mulligan” was not referring to Trump, but to Democratic politicians whose inflammatory comments had just been played for me on the air.  I used the term only to avoid needlessly inflaming partisan passions. https://t.co/vjhTJyRdhV|en|R|57|302
1359369753899520000|88784440|Wed Feb 10 05:12:59 +0000 2021|To be perfectly clear, my reference to taking a “mulligan” was not referring to Trump, but to Democratic politicians whose inflammatory comments had just been played for me on the air.  I used the term only to avoid needlessly inflaming partisan passions.  https://t.co/6ydOLLIMOw|en|R|43|171
1359190435613319169|88784440|Tue Feb 09 17:20:27 +0000 2021|Welcome to Utah, MicroGem.  We are excited to have you.  Thank you for not only your commitment to bringing 500 jobs to Northern Utah, but also for helping our nation combat COVID-19. https://t.co/C3qjBdryqy|en|R|5|62
1359156181378490373|88784440|Tue Feb 09 15:04:20 +0000 2021|A well deserved award and recognition for one of the greatest to ever play football in my state. Sports can help bridge differences and motivate excellence. Alex has shown us both—I may bleed Cougar blue, but I am rooting for this Ute. https://t.co/lsndT1FlLr|en|R|14|106
1359010142474301440|88784440|Tue Feb 09 05:24:01 +0000 2021|I appreciate the discussion with @ShannonBream on unifying our nation and the upcoming impeachment. https://t.co/sBY126nIaR|en|R|30|137
1358862542756483072|88784440|Mon Feb 08 19:37:31 +0000 2021|With the tragic loss of these young men and women, my thoughts and prayers go out to their families and friends. To all Utahns, please be safe when going into the backcountry. @UACwasatch is an excellent resource for staying safe on Utah's mountains. https://t.co/FtgcLGRoYV|en|R|20|75
1358482890871496715|88784440|Sun Feb 07 18:28:55 +0000 2021|1/2 Parents play the most important role in caring for the health of their children. It is critical that they have information about the policies of the health organizations to which they bring their children for care https://t.co/x7WmOgrRE2|en|R|23|108
1357783020376231936|88784440|Fri Feb 05 20:07:53 +0000 2021|Thank you to my Democratic colleagues @Sen_JoeManchin @SenatorSinema @SenMarkKelly for making the HSA Amendment possible. https://t.co/jmi8WRdtah|en|R|17|94
1357768714934906880|88784440|Fri Feb 05 19:11:02 +0000 2021|The last thing we need during an economic crisis is to make things harder on small businesses. https://t.co/krc7h8DWTp|en|R|25|104
1357443888059871232|88784440|Thu Feb 04 21:40:17 +0000 2021|I commend the President’s announcement ending unconstitutional U.S. support for the war in Yemen. I am proud to have led the Yemen War Powers resolution with @BernieSanders for the last 4 years and today is a victory for restoring the war-making power to the legislative branch.|en|R|74|535
1357431540733517824|88784440|Thu Feb 04 20:51:13 +0000 2021|We need to localize more decisions so that all Americans, regardless of where they live, can live under policies that they are more likely to agree with. That's the beauty of federalism. That is the goal of the budget resolution amendments that I will be introducing this week. https://t.co/aVy3NjF2kk|en|R|49|237
1357107761377669122|88784440|Wed Feb 03 23:24:38 +0000 2021|The whole point of American foreign aid is to assist countries in times of need... And yet, for many years our foreign aid dollars have been used to impose violent cultural imperialism… by promoting and providing for the practice of abortion. https://t.co/1HonJxJS8X|en|R|62|234
1357077098691612673|88784440|Wed Feb 03 21:22:48 +0000 2021|At @JECRepublicans, I created the Social Capital Project to study the state of the American social fabric and identify ways to strengthen it. The Project just released 3 reports highlighting the opioid epidemic, school reopenings, and child care costs. View these reports below ↓|en|R|10|51
1357003291247394817|88784440|Wed Feb 03 16:29:31 +0000 2021|Government policy should be neutral toward the choices families make about balancing the competing demands of work and home life. But our current tax code strays from that neutrality. We need reform that treats American families w/children more equally. https://t.co/VQuppPv47q|en|R|13|86
1356997767525236737|88784440|Wed Feb 03 16:07:34 +0000 2021|The brave men and women of the U.S. Capitol Police risked life and limb defending us on January 6th. Today we honor Officer Sicknick who died in that fight. He is a hero and we will never forget his sacrifice.|en|R|70|641
1356714512917925893|88784440|Tue Feb 02 21:22:01 +0000 2021|"A $15 minimum wage is great for Big Tech companies like Amazon, but it is a job killer for small businesses. According to the CBO, a $15 minimum wage would force 1.3 million people out of work. How does killing jobs help the economy?
https://t.co/QFy0atS1kw"|en|R|97|419
1356644709653954560|88784440|Tue Feb 02 16:44:38 +0000 2021|The combination of Mr. Mayorkas’s expansive view of unlimited executive power coupled with his established track record of favoritism for partisan allies makes him a very dangerous choice to head the Department of Homeland Security for the American people. https://t.co/Qdi8lcAqLg|en|R|37|124
1356634888179482631|88784440|Tue Feb 02 16:05:37 +0000 2021|"Great work by our @JECRepublicans staff on the very real costs of distance learning. Our youngest children are both hurt the most by distance learning and are the least likely to contract and spread COVID. Let’s get these kids back in school!
https://t.co/QCySfD1WNj"|en|R|38|150
1356327383125663746|88784440|Mon Feb 01 19:43:42 +0000 2021|"Great deep dive by @Loisco on reform options for the Child Tax Credit. There is bipartisan agreement to expand the CTC and make it permanent. Let’s get it done!
https://t.co/UhG7UKpT0I"|en|R|11|56
1356322904888270848|88784440|Mon Feb 01 19:25:54 +0000 2021|"Thank you Farmers Feeding Utah (@FeedingUtah) for distributing Utah-based food to people in need in southern Utah! Your commitment to service is what makes Utah great.
https://t.co/r4O1IAcRUV"|en|R|17|105
1355262275742007299|88784440|Fri Jan 29 21:11:20 +0000 2021|A much deserving award for @spidadmitchell Good to see the NBA acknowledge his service. https://t.co/tIf7V1DckJ|en|R|6|66
1355227701259481092|88784440|Fri Jan 29 18:53:57 +0000 2021|“Thus, Lee said, while the question of Senate jurisdiction is a close call, the safe conclusion, the one that will avoid massive future problems, is to reject the notion that the Senate should hold the trial.” https://t.co/Bs6HfYSXpO|en|R|30|108
1355208410057363457|88784440|Fri Jan 29 17:37:18 +0000 2021|In a normal year, tens of thousands of Americans would be marching down Constitution Ave today. This year the #MarchForLife will instead be virtual. We cannot heal and unite if we do not honor and respect all of the American people – born, and unborn. https://t.co/AnIs0fObdP|en|R|13|81
1355202879796162565|88784440|Fri Jan 29 17:15:19 +0000 2021|What could go wrong? https://t.co/0CCB4hy6NT|en|R|93|294
1354921210715525130|88784440|Thu Jan 28 22:36:04 +0000 2021|There’s a lot of talk about antitrust legislation this Congress. One thing lost in many proposed reforms: the consumer welfare standard is not a get-out-of-jail-free card for Big Tech. We don’t need to change the law, we need to enforce it. 1/5|en|R|147|550
1354864122186371076|88784440|Thu Jan 28 18:49:13 +0000 2021|How many times will Big Tech companies disprove their own claims of having given the world useful, valuable services? This is what happens when competition is stifled. https://t.co/CvvjlWHIjf|en|R|140|401
1354861590869368837|88784440|Thu Jan 28 18:39:10 +0000 2021|We should investigate. https://t.co/1CRvL4fLs5|en|R|711|5656
