id|user|created_at|text|lang|label|retweet_count|favorite_count
1237759836668006400|88784440|Wed Mar 11 15:18:36 +0000 2020|"Congress must rein in FISA surveillance in the wake of abuses | Washington Examiner.                                       My friend Brett Tolman argues effectively for reform of FISA and the PATRIOT Act. https://t.co/scaWWgH2tw"|en|R|68|257
1237742817058881536|88784440|Wed Mar 11 14:10:58 +0000 2020|Thank you Matt for promptly reaching out to me earlier this week to confirm I was not in contact with the patient. https://t.co/01nbBWPBo2|en|R|15|111
1237558399891464192|88784440|Wed Mar 11 01:58:09 +0000 2020|Even where the House FISA / PATRIOT Act deal claims to offer modest protection for political candidates and elected officials, it doesn’t provide the same protection for the American people!  @realDonaldTrump has asked for real FISA reforms, not fake ones. Sad!|en|R|819|3236
1237525017753047040|88784440|Tue Mar 10 23:45:30 +0000 2020|The House FISA deal doesn’t fix what’s wrong with FISA.  It would not have stopped the spying that occurred against @realDonaldTrump.  I will do everything I can to oppose it in the Senate.  If it passes, @realDonaldTrump should veto it.|en|R|585|2150
1237520166847561728|88784440|Tue Mar 10 23:26:14 +0000 2020|I agree with @RandPaul. The reforms in this bill will not fix FISA. If the bill passes, @realDonaldTrump should veto it. https://t.co/qLVjugKq9U|en|R|658|1680
1237477115089600512|88784440|Tue Mar 10 20:35:10 +0000 2020|Great to meet with @terry_schow and American Legion leaders from Utah today to discuss issues facing veterans all over Utah and across the country. Grateful for their advocacy for all veterans! https://t.co/xtYvZfQPgS|en|R|9|43
1237429729650708480|88784440|Tue Mar 10 17:26:52 +0000 2020|Great meeting with @MayorJonPike and other @Cityofstgeorge leaders to talk about the Northern Corridor project and the expansion of the St. George airport today. Hope to meet with you all again in St. George soon! https://t.co/sD0EsYfYd1|en|R|5|35
1237181194049069056|88784440|Tue Mar 10 00:59:17 +0000 2020|Our Founding Fathers knew well the danger of a government with the power to snoop through the private communications of law-abiding Americans. They included the Fourth Amendment in the Bill of Rights to limit the government’s ability to spy on its citizens. 1/2|en|R|116|484
1237093442834042891|88784440|Mon Mar 09 19:10:35 +0000 2020|The #deepstate spied on @realDonaldTrump. PATRIOT Act §215 makes it easier for the feds to spy on Americans. FISA should be used to stop foreign terrorists, not spy on U.S. citizens. Absent major FISA reform, we should let 215 expire this week! #Veto215|en|R|2229|7315
1235974794820096001|88784440|Fri Mar 06 17:05:29 +0000 2020|Another good jobs report shows 237,000 jobs added in February. With unemployment falling to 3.5% that means more Americans going to work, providing for their families, and connecting with their communities. #JobsReport https://t.co/8dk36EmiFN|en|R|51|219
1235336278327152643|88784440|Wed Mar 04 22:48:14 +0000 2020|"We ought to support and value, women and babies everywhere.
 
In our laws, and through our lives, we ought to uphold the dignity of each and every human person – regardless of race, sex, appearance, abilities, or age. https://t.co/7QJsRL2kgl"|en|R|95|359
1234940008546566145|88784440|Tue Mar 03 20:33:36 +0000 2020|Great meeting with the Utah chapter of @AIPAC today in Washington. The U.S.-Israel relationship has never been stronger!!! https://t.co/l9trcqJmoA|en|R|18|80
1234937756335427584|88784440|Tue Mar 03 20:24:39 +0000 2020|An honor to meet Brig. Gen. Michael Turley today. The @UTNationalGuard is in good hands. https://t.co/PGtaCg8WjM|en|R|8|41
1234850903867494401|88784440|Tue Mar 03 14:39:32 +0000 2020|"The FBI improperly spied on the Trump campaign in 2016. We must ensure the bureau can’t do it in 2020 or ever again. Because if the FBI can unfairly target a presidential campaign, imagine what it can do to regular Americans.
https://t.co/XHmCnKWoBm"|en|R|271|751
1233444328103645186|88784440|Fri Feb 28 17:30:18 +0000 2020|"Great to see the @FCC freeing up mid-band spectrum, but if current license holders are not adequately compensated, it could stall swift transition of key bands and disincentivize the private sector from helping find the best uses for spectrum.
https://t.co/FeNFixnc3L"|en|R|9|34
1233163125622497281|88784440|Thu Feb 27 22:52:54 +0000 2020|The Case for FISA Reform https://t.co/Du4FdaQAkV|en|R|30|92
1233137180228431880|88784440|Thu Feb 27 21:09:49 +0000 2020|This was a lost opportunity we had this week to protect the dignity of human life. Not just unborn human life, but human beings that have been born. https://t.co/N5hYhI1eeZ|en|R|71|327
1233134707510063106|88784440|Thu Feb 27 20:59:59 +0000 2020|"We have only to remain loyal to that bedrock principle we claim to defend in the Declaration of Independence: the inalienable, fundamental right to life. The equal dignity, and immeasurable worth, of all human life.
https://t.co/U8mw1lxn9M"|en|R|36|103
1233130653459369985|88784440|Thu Feb 27 20:43:52 +0000 2020|I have signed a letter requesting that @realDonaldTrump have @EPA appeal the 10th Circuits incorrect decision to vacate 3 exemptions to the RFS for small refineries. Not doing so will raise gas prices and kill thousands of jobs, hurting the #bluecollarboom https://t.co/5eSNJIUKY2|en|R|19|68
1233123777497763841|88784440|Thu Feb 27 20:16:33 +0000 2020|Truly an honor to meet with Jennie Taylor and talk about military families here in DC today. She is such an inspirational leader and I look forward to working with her to make Utahns lives better. https://t.co/qOE33yGGaa|en|R|10|61
1232829941978365952|88784440|Thu Feb 27 00:48:57 +0000 2020|We are live now at https://t.co/qj2h8XMHpO or you can watch on my Facebook Live. Come engage and ask your questions for Senator Lee!|en|R|21|59
1232755243047362560|88784440|Wed Feb 26 19:52:08 +0000 2020|Strong statement from @Freedomworks on FISA reform: https://t.co/Tvzm3VtOfE|en|R|57|126
1232752587369259010|88784440|Wed Feb 26 19:41:34 +0000 2020|Three provisions of FISA are set to expire on March 15th. Congress should not reauthorize them without substantially reforming FISA. Our intelligence-gathering agencies need to focus on foreign agents and terrorists, and should not be spying on U.S. citizens. Do you agree?|en|R|1723|5540
1232734982738710529|88784440|Wed Feb 26 18:31:37 +0000 2020|Great meeting with @MountainAmerica in Utah last week and @UtahsCUs this week in DC. We will keep working together to reduce CFPB’s harm to Utah credit unions! https://t.co/brdfGHzlEd|en|R|9|37
1232435284681383937|88784440|Tue Feb 25 22:40:44 +0000 2020|Our federal government should not be in the business of punishing marriage. Instead, it should support policies that strengthen marriage and thus improve the likelihood of family stability for children. https://t.co/oqT9lAVbLF|en|R|52|205
1232431913702326272|88784440|Tue Feb 25 22:27:20 +0000 2020|At the Senate GOP lunch today I made a long case against a simple reauthorization of the FISA program. Some are arguing the program needs no reform and that DOJ can put in place internal quality control mechanisms. That’s not good enough. 1/|en|R|198|627
1232056407857467392|88784440|Mon Feb 24 21:35:12 +0000 2020|Great conversation with @MarandaFinney about an issue so important to American families. #PaidParentalLeave https://t.co/UsNxhP0Ov4|en|R|11|36
1230965971684192256|88784440|Fri Feb 21 21:22:12 +0000 2020|Thanks @realDonaldTrump for working to get us out of Afghanistan &amp; end the longest war in US history! While there’s a tough road ahead to get a permanent agreement, I applaud @realDonaldTrump, @SecPompeo, &amp; @EsperDoD for pursuing peace. It’s time to bring our troops home!|en|R|826|4561
1230170420604698624|88784440|Wed Feb 19 16:40:58 +0000 2020|"“A bipartisan compromise on paid leave would speak to the dignity of both new moms and newborn babies, as well as respecting the importance of post-natal health care and building strong families.”
https://t.co/Nd2Rgq8jLh"|en|R|28|113
1229863701252988933|88784440|Tue Feb 18 20:22:10 +0000 2020|I will be holding another town hall tomorrow at 2:30 pm in Draper. Looking forward to meeting you and answering your questions! https://t.co/SchZ0zqdt1|en|R|23|70
1229535421945786368|88784440|Mon Feb 17 22:37:42 +0000 2020|I will be holding a town hall tomorrow at 10:30 am in Farmington at the Davis County Library. Looking forward to answering your questions! https://t.co/ZU3XQpML5D|en|R|38|109
1228375390248427521|88784440|Fri Feb 14 17:48:09 +0000 2020|"Congressman Bishop is right. The so-called “Equal Rights Amendment” is really an “Abortion on Demand Amendment.”  Abortion isn’t equality, and the ERA is a bad idea on many levels.  
https://t.co/E2Qqy2Q5Tr"|en|R|43|189
1228345054982438914|88784440|Fri Feb 14 15:47:37 +0000 2020|Informative thread every American should read-&gt; https://t.co/cnbPkm6CKt|en|R|17|60
1228325945221664769|88784440|Fri Feb 14 14:31:41 +0000 2020|I will be holding a town hall today at 4:00 pm in Cedar City at the @leavittcenter . Looking forward to answering your questions! #utpol https://t.co/XOxc2tnZ88|en|R|14|57
1227629931741556742|88784440|Wed Feb 12 16:25:58 +0000 2020|“President Trump might be the only one that could make that hard choice because there would be a firestorm if anybody talks about actually ending this [war in Afghanistan].” https://t.co/DEGreIJPsf|en|R|37|179
1227304000598499329|88784440|Tue Feb 11 18:50:50 +0000 2020|"“There is no ethical reason why this medical standard of care should be abandoned for a subgroup of people because they might be less wanted than others. Wantedness does not determine humanness.” #EndInfanticide
https://t.co/zm2GVflWBD"|en|R|45|172
1225887975852138496|88784440|Fri Feb 07 21:04:03 +0000 2020|As Winston Churchill put it, “We shape our buildings; thereafter they shape us”. https://t.co/KkMbdr3TJw|en|R|114|616
1225492603594051590|88784440|Thu Feb 06 18:52:59 +0000 2020|“Mike Lee is a brilliant guy... He’s difficult… But he always has good reason for it.” Thank you for the shout out @realDonaldTrump ! https://t.co/WyeBerhroa|en|R|605|3326
1225207096255361024|88784440|Wed Feb 05 23:58:29 +0000 2020|Congratulations @realDonaldTrump.   I’m looking forward to your next five years in office. Those who voted to remove you were wrong.  Very wrong.|en|R|7442|50179
1225162071131770881|88784440|Wed Feb 05 20:59:34 +0000 2020|"This has been a trial of the Washington, D.C. establishment itself, but not necessarily in the way the House Managers intended. 1/3
https://t.co/9wt1BL6FEn"|en|R|49|266
1224427707427147778|88784440|Mon Feb 03 20:21:28 +0000 2020|Fantastic news out of @HHSgov. States can now use their Medicaid expansion dollars to enable new health insurance plans free of Obamacare’s burdensome regulations. This is a good step towards market driven health care. https://t.co/czKAqOF1r8|en|R|53|225
1223651243069001729|88784440|Sat Feb 01 16:56:05 +0000 2020|13 witnesses is more than enough. Let's move on to final arguments Monday and acquittal Wednesday. https://t.co/VYF78H5Hxg|en|R|138|677
1223643686828900354|88784440|Sat Feb 01 16:26:03 +0000 2020|Today, on the day of his funeral, we mourn the passing of Clayton Christensen and celebrate his time on this earth. As the man who pioneered the theory of disruptive innovation, he leaves behind a tremendous legacy in the business world. https://t.co/kt5YdoAmIJ|en|R|28|197
1223403410734690305|88784440|Sat Feb 01 00:31:17 +0000 2020|Just got off the phone to thank Mark Zuckerberg for agreeing to give the keynote speech at #SiliconSlopes #SSTS20 Thanks so much to @DaveElkington @RyanQualtrics @skonnard @joshjames and @clintbetts for all their hard work.|en|R|44|194
1223391827199479808|88784440|Fri Jan 31 23:45:15 +0000 2020|Mitt Romney is a good friend and an excellent Senator. We have disagreed about a lot in this trial. But he has my respect for the thoughtfulness, integrity, and guts he has shown throughout this process. Utah and the Senate are lucky to have him.|en|R|2515|24622
1223384114319052801|88784440|Fri Jan 31 23:14:36 +0000 2020|1/4 We have heard from 13 witnesses via video during this trial. We have heard hours of argument. We have received hundreds of pages of legal briefs and thousands of pages of supporting documents. We know what happened: President Trump directed his staff to ask President Zelensky|en|R|75|444
1223030120622981121|88784440|Thu Jan 30 23:47:58 +0000 2020|Would President Bush have been subject to impeachment charges based on his handling of NSA surveillance, detention of combatants, or use of waterboarding? https://t.co/L7FQibZPDR|en|R|128|487
1223029992688357378|88784440|Thu Jan 30 23:47:27 +0000 2020|Under the standard embraced by the House managers, would President Obama have been subject to impeachment charges based on his handling of the Benghazi attack, the Bergdahl swap, or DACA? https://t.co/PlfvH8HNxg|en|R|450|1978
1222640060471939072|88784440|Wed Jan 29 21:58:00 +0000 2020|"The USMCA is a huge win for all of Utah, especially the more than 120,000 Utahns whose jobs depend on trade with Mexico and Canada.
https://t.co/ru7gHYFxH9 https://t.co/yFTlY4sTAl"|en|R|78|259
1222607051723038723|88784440|Wed Jan 29 19:46:50 +0000 2020|The House Managers have argued aggressively that the president’s actions contravened U.S. foreign policy. Isn’t it the president’s place – certainly more than the place of career civil servants – to conduct foreign policy? https://t.co/U1Iu0ITTKi|en|R|655|2239
1221930508189405190|88784440|Mon Jan 27 22:58:30 +0000 2020|"It was an honor to share the stage with @realDonaldTrump Friday when he became the first president to speak at the #MarchForLife
https://t.co/3GgjZIUP4W"|en|R|2878|15681
1221911628385521665|88784440|Mon Jan 27 21:43:28 +0000 2020|Today the Utah State Legislature began its annual session. Members of my staff will be at the Capitol every day during the session from 10am - Noon to answer your questions or concerns. #utpol https://t.co/TmXpmY9be0|en|R|13|61
1220825346251116546|88784440|Fri Jan 24 21:46:59 +0000 2020|I celebrated the joy of life today with @realDonaldTrump and tens of thousands of others at the #MarchForLife rally. Then I had a unique commute as I marched, biked, and scootered to the Capitol for day 4 of the impeachment trial. https://t.co/IgzoC67AqQ|en|R|141|710
1220754840500031488|88784440|Fri Jan 24 17:06:49 +0000 2020|"Huge win for #ReligiousLiberty on this #MarchForLife day. HHS Office for Civil Rights has issued a notice of violation to California for their 2014 rule banning over 28,000 insurance policies that did not cover abortion. Californians deserve this freedom.
https://t.co/aI0gfKM4gV"|en|R|50|137
1220752229092798465|88784440|Fri Jan 24 16:56:26 +0000 2020|Fantastic news for the state of Utah and more proof the #TrumpEconomy is working. https://t.co/6J2uRXiVvq|en|R|77|289
1220745976790618113|88784440|Fri Jan 24 16:31:35 +0000 2020|Today, thousands of Americans are marching across Washington, across Utah, and across the country for the most important cause there is: the right to life. I stand with you, and encourage you to keep up this good fight. #MarchForLife https://t.co/iM0WPy76h8|en|R|71|363
1220463751645868034|88784440|Thu Jan 23 21:50:08 +0000 2020|Today is a great day for every American that is concerned about the high costs of housing and infrastructure in the United States. This revised Waters of the United States rule will bring common sense certainty to farm, business, and home owners. https://t.co/Jxm7eHZJnY|en|R|49|203
1220060494159077378|88784440|Wed Jan 22 19:07:44 +0000 2020|After 33 days of delay managers argued this was urgent. After hearing from 17 witnesses managers said they need more. After hours of speeches managers insulted the President, his counsel, and the Senate itself. I am taking notes and am unimpressed. https://t.co/AdHRXkPJB0|en|R|2577|11686
1219309203233394689|88784440|Mon Jan 20 17:22:22 +0000 2020|"""Yes, it is love that will save our world and our civilization, love even for enemies.""
https://t.co/tvcJES3lwe"|en|R|17|116
1218552660841746432|88784440|Sat Jan 18 15:16:08 +0000 2020|Thankful for Sandy Police Chief William O’Neil and his over 20 years of service to the community of Sandy. I hope his family finds peace during this difficult time.https://t.co/NctXpr3NI0|en|R|14|143
1218233256551702528|88784440|Fri Jan 17 18:06:56 +0000 2020|. @northropgrumman the state’s largest private sector employer in aerospace/defense, has announced an expansion in Weber County that will create up to 2,250 jobs! This is a big win for our state and will add more high paying jobs to our strong economy.https://t.co/CHPkmWgPEV|en|R|51|291
1217939175623753729|88784440|Thu Jan 16 22:38:22 +0000 2020|Great job @RepChipRoy, couldn't agree more! https://t.co/yY0FgAYe30|en|R|11|55
1217916619357327360|88784440|Thu Jan 16 21:08:44 +0000 2020|It is not an accident that religious freedom is protected in the First Amendment. Religious liberty is one of the founding principles of our nation. So thank you President Trump for doing all you can to protect Religious Freedom on Religious Freedom Day. https://t.co/yLcggVWc8h|en|R|36|221
1217887182603550727|88784440|Thu Jan 16 19:11:46 +0000 2020|It was great to meet with and welcome @SenatorLoeffler to the Senate today. I look forward to working with her on conservative priorities. https://t.co/o3m8PPQiba|en|R|26|148
1217840943983886340|88784440|Thu Jan 16 16:08:02 +0000 2020|We need to include the full cost of every new spending program and that includes the cost of servicing new debt. https://t.co/8kMFroWkNP|en|R|23|160
1217816672356196354|88784440|Thu Jan 16 14:31:35 +0000 2020|Congratulations @mrsbrenttaylor! Utah and the Army are very lucky to have you. https://t.co/5CitlTrwru|en|R|11|72
1216391858344955909|88784440|Sun Jan 12 16:09:53 +0000 2020|Enjoyed speaking with @jaketapper on @CNNSotu . President Trump’s Iran strategy is working but Congressional authorization is needed if Iran is to be attacked directly. https://t.co/3NzuaCkvkm|en|R|73|424
1214917959891800064|88784440|Wed Jan 08 14:33:08 +0000 2020|Thankfully, no Americans were harmed by last night’s missile attack. Whether further military action is warranted is a question that should be answered by Congress. 1/2|en|R|210|1942
1214578869044420613|88784440|Tue Jan 07 16:05:42 +0000 2020|There is little doubt that a “factious spirit” is driving this impeachment. The Founders saw it fit to guard against this by placing conviction not in the House or a Court, but in the Senate. Lets not confuse its key role with that of a jury in this trial https://t.co/awDKmzVRsC|en|R|78|268
1213514574021853184|88784440|Sat Jan 04 17:36:35 +0000 2020|Today marks 124 years since Utah was admitted to the union as the 45th state on January 4th, 1896. It’s a great honor to represent such a wonderful state. Happy Birthday Utah!|en|R|60|507
1213206402136596481|88784440|Fri Jan 03 21:12:01 +0000 2020|The death of Qasem Soleimani is a big victory for the safety of the American people. As always, I am anxious to learn about the legal justification for this action, and look forward to being briefed by the Pentagon and the White House.|en|R|119|785
1210227394360930309|88784440|Thu Dec 26 15:54:30 +0000 2019|"As we enjoy this season of giving, surrounded by family and friends, let’s consider the many ways that civil society has shaped our lives and communities and how we might give back.
https://t.co/duuuH0gh0B"|en|R|35|162
1209910509241171969|88784440|Wed Dec 25 18:55:19 +0000 2019|Merry Christmas from my family to yours! I hope your day is filled with peace, hope, and love. Happy Holidays! https://t.co/UIlXF6cTrH|en|R|159|1884
1207774418052812821|88784440|Thu Dec 19 21:27:15 +0000 2019|1. John F. Kennedy famously said “to govern is to choose.” But Congress’s defining dysfunction is that it doesn’t choose. We don’t budget. We don’t reform. We don’t prioritize. We just spend, and hope we’re retired or working as lobbyists or consultants https://t.co/NezguP7ofU|en|R|56|286
1206993788817879041|88784440|Tue Dec 17 17:45:18 +0000 2019|"“… the Department of Justice’s Inspector General report was a big win for the American people because it exposed the potential impact FISA could have on citizens.”
https://t.co/RBRRH9UWGu"|en|R|139|512
1206597865122009095|88784440|Mon Dec 16 15:32:03 +0000 2019|“Shifting our thinking from education as a state-delivered good to one that is state-guaranteed gives us the opportunity to engage religious and community groups in a more meaningful way.”https://t.co/4ZktRCEq0d|en|R|32|116
1205566619218567168|88784440|Fri Dec 13 19:14:15 +0000 2019|Prime Minister Johnson is due a hearty congratulations after his party’s historic win in yesterday’s parliamentary elections. I am confident he will get Brexit done for the British people.|en|R|28|264
1204863044855173120|88784440|Wed Dec 11 20:38:29 +0000 2019|"The DOJ IG report is a scathing indictment of the FBI, its agents, its lawyers, and its management. The behavior detailed in this report is, at minimum, so negligent that it calls into question the continued legitimacy of the entire FISA program.
https://t.co/OgpJjKlIR7"|en|R|501|1660
1204514554601988097|88784440|Tue Dec 10 21:33:43 +0000 2019|The First Step Act has changed lives and brought families back together. I was honored to meet with some of those families today. These are reformed people, committed to giving back to their communities and our nation. https://t.co/psYSvc3IVK|en|R|49|189
1204123548777930752|88784440|Mon Dec 09 19:40:00 +0000 2019|Utah is leading the nation with its pro-business, pro-family, low-tax policies. It is not surprising that the Beehive State has led the “Rich States, Poor States” index every year. https://t.co/EZAzdUnZhZ via @WSJ|en|R|28|119
1204110993019801601|88784440|Mon Dec 09 18:50:06 +0000 2019|My heart goes out to the family and friends of U.S. Army Chief Warrant Officer 2 Kirk T. Fuchigami Jr. who gave his life in service of our nation. He was a true patriot who loved his county and serving others. He paid the ultimate price, and we should remember his sacrifice. https://t.co/RbcPxrqaaX|en|R|19|76
1202676128873357314|88784440|Thu Dec 05 19:48:28 +0000 2019|I enjoyed speaking at Brookings this morning with my friend Sen. Chris Coons (D-DE). We talked about our new legislation designed to protect your privacy from unwarranted facial-recognition surveillance. https://t.co/FsD5fMIOsp|en|R|16|71
1202673823922970627|88784440|Thu Dec 05 19:39:18 +0000 2019|I had a great meeting yesterday with high school students from all over Utah.  We talked about everything from my teenaged dreams of the NBA, to law school, to the framers and impeachment. These bright young people help prove Utah has a very bright future. https://t.co/1i9ctyi228|en|R|22|131
1202334425989754881|88784440|Wed Dec 04 21:10:40 +0000 2019|David Barlow has the judicial temperament, more than perhaps any other potential candidate, for this or any other judgeship like this. I am honored to know him, and to vote for him. https://t.co/DZaEDiyT6Y|en|R|12|38
1201923111404392448|88784440|Tue Dec 03 17:56:15 +0000 2019|Fantastic news for Utah working families. Thousands of jobs secured for a decade to come. https://t.co/eDktQ7DrdD|en|R|36|155
1196827566054805505|88784440|Tue Nov 19 16:28:22 +0000 2019|Happy Birthday @ZionNPS!!! Truly a must visit destination for every American. #MightyFive https://t.co/y9ZipCCP0j|en|R|13|106
1196459157387448321|88784440|Mon Nov 18 16:04:26 +0000 2019|"""Mike Lee, Utah’s senior senator, has also been thinking about the barriers that inmates face when accessing higher education.""
https://t.co/hdMdewxZbb"|en|R|12|69
1194368630185697280|88784440|Tue Nov 12 21:37:26 +0000 2019|Congratulations @DixieState and the Atwood family for the successful ribbon cutting for the Atwood Innovation Plaza at @DixieState Friday!  It is clear that this will be a valuable resource for entrepreneurs new and old. https://t.co/SmG4EPMYYz|en|R|10|48
1193958016447664128|88784440|Mon Nov 11 18:25:48 +0000 2019|Happy to be here with @timpview_tbirds and @provocity to honor and commemorate the bravery of our men and women in uniform. I want to thank all veterans for their sacrifice and willingness to put their lives on the line in defense of our great nation. https://t.co/FgMkAlxmIz|en|R|19|80
1193947101073461251|88784440|Mon Nov 11 17:42:26 +0000 2019|Veteran’s Day is a time for us to remember those who have fought for the freedoms that we hold so dear. Thank you to every brave soldier, sailor, airman, marine, and coast guardsman who pledged themselves to defend our nation and our Constitution.|en|R|100|362
1192975733855002624|88784440|Sat Nov 09 01:22:34 +0000 2019|The American Bar Association is a left-leaning interest group.  It has every right to exist.  It should have no privileged status in the Senate Judiciary Committee.  #SuspendABA. https://t.co/9BlzbyOE8U|en|R|376|1176
1192587127818731520|88784440|Thu Nov 07 23:38:23 +0000 2019|This is an ignorant, bigoted story.  Why diminish the humanity of women and children who were singled out earlier this week and murdered in cold blood?  The Associated Press should be ashamed. https://t.co/GGOa2NPBDD|en|R|416|1810
1192488121230856192|88784440|Thu Nov 07 17:04:58 +0000 2019|On behalf of our nation and all Utahns, I thank General Burton for the sacrifices he has made to secure the freedoms we hold dear. I congratulate him on this occasion, and wish him many happy years ahead with his wife and children. https://t.co/uPRh82aVxN|en|R|10|61
