id|user|created_at|text|lang|label|retweet_count|favorite_count
958396549427613696|88784440|Tue Jan 30 17:48:38 +0000 2018|"Movies like @HBO's ""The Sentence"" are educating people on the need for #criminaljusticereform bills like the Smarter Sentencing Act. Mandatory minimums are harmful to families and communities, and I look forward to watching the film https://t.co/OX7qxPXzaT #utpol"|en|R|55|129
958166902299418626|88784440|Tue Jan 30 02:36:06 +0000 2018|I spoke tonight from the Senate floor on the Pain-Capable Unborn Child Protection Act https://t.co/eZknlypJsc|en|R|61|370
958061994279612416|88784440|Mon Jan 29 19:39:14 +0000 2018|Today, the Senate has the chance to pass legislation that protects children by banning elective abortion after 20 weeks. 20 weeks is 5 months. A baby at that stage can sleep, suck his thumb, &amp; survive outside the womb. That child deserves the right to choose life. #TheyFeelPain|en|R|791|2455
956624319026749443|88784440|Thu Jan 25 20:26:25 +0000 2018|Right now, the United States is just one of seven countries in the world that allow elective abortions after 20 weeks of pregnancy. On Monday, the Senate has the chance to change that by passing the Pain Capable Unborn Child Act. https://t.co/UhRUjypw92|en|R|328|808
956621028700155904|88784440|Thu Jan 25 20:13:21 +0000 2018|Happy to support such a great cause! https://t.co/zafcnGR3GA|en|R|18|75
956279483912384513|88784440|Wed Jan 24 21:36:10 +0000 2018|I talked to @kevcirilli of @BloombergTV today about the importance of the bipartisan #EarmarkEliminationAct. Watch here: https://t.co/wyvkKj5ZuS|en|R|35|55
954465747841028096|88784440|Fri Jan 19 21:29:02 +0000 2018|Congratulations to newly selected University of Utah President Ruth Watkins. I'm excited to work with Ruth and her team in her new capacity and know @UUtah will be in good hands under her leadership. While I may be a Cougar, I have no problem saying go Utes today!|en|R|18|107
954054640953413632|88784440|Thu Jan 18 18:15:26 +0000 2018|Retweet if you agree that Republicans in the Senate should make Democrats start voting on each of the appropriations bills passed by the House.|en|R|3955|4456
954023985418817541|88784440|Thu Jan 18 16:13:37 +0000 2018|Remember earmarks? Well, they’re trying to make a comeback. Earmarks can’t bring back the trust Congress has squandered, but here’s how we can, and it includes getting rid of earmarks for good. https://t.co/EKgTwfwrvh|en|R|117|287
953441572875591680|88784440|Wed Jan 17 01:39:19 +0000 2018|I issued the following statement after the Senate voted to invoke cloture on reauthorizing #FISA surveillance provisions tonight: https://t.co/jav29nWvoY|en|R|155|283
953325297956524033|88784440|Tue Jan 16 17:57:17 +0000 2018|I look forward to his deliberate devotion being applied to all as he takes on his new responsibilities as Pres. of the @LDSchurch https://t.co/Yz6qpG69CO|en|R|8|45
953325190448107520|88784440|Tue Jan 16 17:56:51 +0000 2018|Pres. Nelson is a dedicated servant who has spent decades tirelessly working alongside his brothers &amp; sisters both in &amp; out of the church to bring love &amp; peace into peoples’ lives.|en|R|11|116
951480060728528901|88784440|Thu Jan 11 15:44:58 +0000 2018|Rep. Goodlatte claims the Amash amendment would kill FISA reauthorization in Senate. He does not know that. Amash amendment is essential for my vote.|en|R|67|205
951459927305965568|88784440|Thu Jan 11 14:24:58 +0000 2018|I stand with @SenRandPaul. Americans deserve 4th Amendment protections. https://t.co/3qLdrr4Ykx|en|R|162|460
951222398807891968|88784440|Wed Jan 10 22:41:07 +0000 2018|"Saddened to hear about the passing of Dr. Cole. Here is my statement.
https://t.co/LrDhuygMHO"|en|R|7|21
950858166442643480|88784440|Tue Jan 09 22:33:47 +0000 2018|"Good read by @TerryEastland on what we’ve been working on with the Social Capital Project.
https://t.co/bvZHRTAJJ4"|en|R|6|17
950777578666778626|88784440|Tue Jan 09 17:13:34 +0000 2018|Delighted the Army publicly announced its stationing decision for the AH-64 Apache Battalion to stay in UT, allowing Utah’s airmen to continue their mission for our nation. It was great to congratulate MG Jeff Burton, UT National Guard Adjutant General this morning in DC https://t.co/8Xi6s0Y0Oj|en|R|8|83
949037714069966849|88784440|Thu Jan 04 21:59:57 +0000 2018|Happy Birthday Utah! https://t.co/eJv3hbi1Qy|en|R|15|99
948568620996726785|88784440|Wed Jan 03 14:55:57 +0000 2018|"My statement on the passing of @ThomasSMonson
https://t.co/c97EJb9yiw https://t.co/9J16eVqaYw"|en|R|21|87
948279571144695808|88784440|Tue Jan 02 19:47:22 +0000 2018|Sen. Hatch has been a tremendous servant to the people of Utah and he will be sorely missed. It has truly been an honor serving with him in the United States Senate and I know he will continue to do fantastic work for Utahns.|en|R|102|657
948271918850936832|88784440|Tue Jan 02 19:16:58 +0000 2018|Great speech by UN Amb. Nikki Haley supporting the people of Iran at the UN Security Council. As Americans, we must use all our resources including international organizations to support freedom around the world. #IranProtest https://t.co/7FlWzwfzIs|en|R|86|278
945459991162503168|88784440|Tue Dec 26 01:03:22 +0000 2017|Merry Christmas from my family to yours! I hope your day was filled with peace, hope and love. https://t.co/tuUgytxdaZ|en|R|36|445
943172601677000705|88784440|Tue Dec 19 17:34:06 +0000 2017|I'm live now on the @KSLNewsradio Doug Wright show talking about tax reform. Tune in! https://t.co/x7YCC1O227|en|R|7|44
942855033569316864|88784440|Mon Dec 18 20:32:12 +0000 2017|Just finished reading the final Tax Cuts and Jobs Act. It will cut taxes for working Utah families. I will proudly vote for it.|en|R|834|4230
941768728479436800|88784440|Fri Dec 15 20:35:36 +0000 2017|Sens. Rubio, Heller, and Scott have done a tremendous job fighting for working families this week and they have secured a big win. I look forward to reading the full text of the bill and, hopefully, supporting it.|en|R|155|769
941762506434990083|88784440|Fri Dec 15 20:10:53 +0000 2017|".@RepDeSantis and I agree. We need a higher education system that works better for more Americans and their families. The Higher Education Reform Opportunity (HERO) Act, introduced in the Senate this past week, does just that.
https://t.co/08GwWf29Rs"|en|R|47|133
941113693689049088|88784440|Thu Dec 14 01:12:44 +0000 2017|On my Access Live event, I discussed what the change to Bears Ears Monument will mean for Utah: #utpol https://t.co/Z6uGHU4sFD|en|R|17|53
941112199099113472|88784440|Thu Dec 14 01:06:47 +0000 2017|I host Access Live events so that I can reach almost ALL Utahns at once - on the phone, on my website, and online. Sign up to be part of future events here: https://t.co/qj2h8XMHpO https://t.co/knKpYE4G2F|en|R|5|28
941108720330858498|88784440|Thu Dec 14 00:52:58 +0000 2017|"""I don't believe Washington is irreparably broken."" Hear how I think it can be fixed: https://t.co/XPYv8QUgQ1"|en|R|65|163
941103916250468353|88784440|Thu Dec 14 00:33:53 +0000 2017|I'm expecting that we get the tax bill passed by Monday or Tuesday of next week. Join my live event happening now: https://t.co/qj2h8XMHpO https://t.co/w84PLKPt2A|en|R|30|148
941100370201280512|88784440|Thu Dec 14 00:19:47 +0000 2017|I just discussed the latest released report from my Social Capital Project about rise in unwed childbearing on my Access Live event. You can find report here: https://t.co/FRw5uPt7MB #utpol @leetownhall|en|R|8|33
941099979078275072|88784440|Thu Dec 14 00:18:14 +0000 2017|My December Access Live event is starting now! Join us here: https://t.co/voQW81Qq0o #utpol|en|R|5|14
941082764073463808|88784440|Wed Dec 13 23:09:50 +0000 2017|I'm holding an Access Live event tonight at 5:10 p.m. MT. You can join online here: https://t.co/voQW81Qq0o #utpol https://t.co/ydA3V1b9y2|en|R|8|27
940700547417591808|88784440|Tue Dec 12 21:51:02 +0000 2017|Good coverage on my work on criminal justice reform --&gt; Public Safety Is ‘the End Result We’re Trying to Achieve’  https://t.co/OClf2QUHSI via @pewtrusts|en|R|18|47
940699951197315072|88784440|Tue Dec 12 21:48:40 +0000 2017|My latest report for the Social Capital Project explores the rise in unwed childbearing over the past 60 years, examining trends that have interacted to accelerate the unwed share of births. Read it here: https://t.co/FRw5uPt7MB https://t.co/fmm3AMXGF5|en|R|39|52
938458273958842369|88784440|Wed Dec 06 17:21:02 +0000 2017|The RBI Act incentivizes states to reduce licensing restrictions to remove barriers faced by those near the bottom of the economic ladder: https://t.co/48DWQITarH https://t.co/hw0QkFlrvF|en|R|21|53
938433031555158016|88784440|Wed Dec 06 15:40:44 +0000 2017|Mitt Romney is a good man.  Whether you agree or disagree with him on any matter of public policy, you can’t credibly call into question his patriotism or moral character—especially on the basis of his religious beliefs or his outstanding service as a missionary.|en|R|1461|8989
938067991996063745|88784440|Tue Dec 05 15:30:12 +0000 2017|Thank you for your leadership on this issue @SecretaryZinke. https://t.co/7pRD9SuNgY|en|R|83|285
938058827227979776|88784440|Tue Dec 05 14:53:47 +0000 2017|After yesterday's historic reversal of Antiquities Act abuse in Utah, the next step is to exempt Utah from the Antiquities Act with the same exemptions enjoyed by Wyoming and Alaska. Greg Hughes and Wayne Niederhauser, are right on point here: https://t.co/unkSgFasjJ #utpol|en|R|38|113
937782212052873217|88784440|Mon Dec 04 20:34:37 +0000 2017|President Trump did the people of Utah a great favor today by rolling back harmful land use restrictions in southern Utah. #utpol https://t.co/RZFJd0K6pi|en|R|197|670
937759725634097152|88784440|Mon Dec 04 19:05:15 +0000 2017|Made it to Utah. Heading to State Capitol Building soon for announcement. #utpol https://t.co/N79NtSgKKH|en|R|28|159
937708786420154368|88784440|Mon Dec 04 15:42:51 +0000 2017|I’m honored to be accompanying @realDonaldTrump to Utah to support the actions he will be taking to reverse the abuse of the Antiquities Act in our state. #utpol https://t.co/A1kL0Jbwuf|en|R|178|789
937702411233320961|88784440|Mon Dec 04 15:17:31 +0000 2017|On my way to Utah for a big announcement with @senorrinhatch and @SecretaryZinke! #nomonument #utpol https://t.co/0Jtfhrw2G6|en|R|66|273
936869214983372801|88784440|Sat Dec 02 08:06:41 +0000 2017|Utah families are the big winners tonight thanks to the doubling of the child tax credit to $2,000.  https://t.co/PTfXQyodn6|en|R|54|232
936776601273905152|88784440|Sat Dec 02 01:58:40 +0000 2017|Editors of National Review support Rubio-Lee: https://t.co/2mFOGIKbRq|en|R|15|39
936697841275240450|88784440|Fri Dec 01 20:45:43 +0000 2017|Sens. Rubio, Lee Reaffirm Commitment to Child Tax Credit Expansion - Press Releases - United States Senator Mike Lee https://t.co/FSK32eg975|en|R|34|68
936285969719943168|88784440|Thu Nov 30 17:29:05 +0000 2017|Good analysis by @Rameshponnuru - The WSJ Flips Out On Rubio and Lee: https://t.co/BTTe7gdJHB #TaxReform|en|R|29|50
936252204977131520|88784440|Thu Nov 30 15:14:55 +0000 2017|It's looking like we are going to pass a tax reform bill out of the Senate. While details are still being worked out, I am working to make sure that this plan puts more money in the pockets of American families. #TaxReform https://t.co/xLnqltdxjl|en|R|65|368
936221008054439937|88784440|Thu Nov 30 13:10:57 +0000 2017|This is a good read! https://t.co/nEpv9hdkFL|en|R|88|354
936002887553114112|88784440|Wed Nov 29 22:44:13 +0000 2017|I joined @marcorubio on the Senate Floor to discuss our amendment to the GOP tax plan to increase the Child Tax Credit and make it refundable against payroll taxes. https://t.co/IM6FolZlZR|en|R|125|516
935943240422969344|88784440|Wed Nov 29 18:47:12 +0000 2017|Marco Rubio, Mike Lee look to boost child tax credit in Senate tax bill https://t.co/6UiT49iprS via @dcexaminer|en|R|51|214
932996345144717312|88784440|Tue Nov 21 15:37:17 +0000 2017|When it comes to overdose deaths, opioids are in a class of their own. My Social Capital Project is exploring the social impact of this crisis: https://t.co/hv1EBv367v https://t.co/d9Zf8EIGsY|en|R|103|175
932700157161897985|88784440|Mon Nov 20 20:00:20 +0000 2017|I support the US designating North Korea, as a state sponsor of terrorism. Despite all efforts, North Korea continues to antagonize the entire world with its missile testing and malign activities. https://t.co/UKrGofXBIO|en|R|43|166
930647837523742720|88784440|Wed Nov 15 04:05:09 +0000 2017|I am thrilled to hear that the revised Senate tax reform proposal will double the child tax credit to $2,000 per child. I eagerly await the release of more details. But if true, this could provide unprecedented tax relief for working moms and dads: https://t.co/LyGcz0sV6H|en|R|133|468
930567500525424641|88784440|Tue Nov 14 22:45:55 +0000 2017|With Social Capital Project, Sen. Lee Hopes to Measure America’s Coming Apart: https://t.co/lSDd9RcF2o|en|R|16|34
930098591439482880|88784440|Mon Nov 13 15:42:39 +0000 2017|Congratulations to Calvary Baptist Church for contributing to Utah's social fabric for 125 years: https://t.co/oimL0joTE8|en|R|9|71
929450220374675456|88784440|Sat Nov 11 20:46:15 +0000 2017|I would like to extend my heartfelt gratitude to all the veterans who have served our great nation and the family members who support them. #veterensday|en|R|44|434
929121651828187141|88784440|Fri Nov 10 23:00:38 +0000 2017|Having read the detailed description of the incidents, as well as the response from Judge Moore and his campaign, I can no longer endorse his candidacy for the US Senate.|en|R|11878|48218
928746314975891457|88784440|Thu Nov 09 22:09:11 +0000 2017|While @marcorubio and I are glad to see an increase to the child tax credit, like the House bill, the Senate #taxreform bill introduced today is simply not enough for working families: https://t.co/NWdr3CZsXv|en|R|82|273
928389422218964992|88784440|Wed Nov 08 22:31:01 +0000 2017|Congratulations to @CurtisUT on his win last night! I am excited to work with him to serve the people of Utah and the United States, and look forward to having some competition within the delegation on who has the best sock game. https://t.co/yMNlT56QwX|en|R|20|83
928319548922695694|88784440|Wed Nov 08 17:53:22 +0000 2017|The bipartisan fight to protect Americans from abusive civil asset forfeiture practices is heating up: https://t.co/ftDkxlViMo|en|R|83|191
928275283228200960|88784440|Wed Nov 08 14:57:28 +0000 2017|Why the change? We need #CBO transparency now. https://t.co/2DU3LBMaaO 2/2|en|R|29|59
928275152126824448|88784440|Wed Nov 08 14:56:57 +0000 2017|New CBO score lowers savings from mandate repeal from $416 billion to $338 billion. How convenient for Dems: https://t.co/2DU3LBMaaO 1/2|en|R|31|67
928018635347709953|88784440|Tue Nov 07 21:57:39 +0000 2017|Picture below basically sums up what it's like to rely on @USCBO analysis. How to fix --&gt; https://t.co/HhcrASeRr1 https://t.co/DoU1jvXP3m|en|R|37|108
927958979468242944|88784440|Tue Nov 07 18:00:36 +0000 2017|I met with @TheRealBuzz today. We boldly talked about the final frontier. It was awesome! https://t.co/MhaGeC1hR3|en|R|11|43
927923591269769216|88784440|Tue Nov 07 15:39:58 +0000 2017|Marco Rubio: #TaxReform Should Help American Families https://t.co/8Pd9TZdz6P|en|R|19|50
927563415194923008|88784440|Mon Nov 06 15:48:46 +0000 2017|As we look for ways to solve #OpoidCrisis, we need to keep the social components of this crisis in mind: https://t.co/SLnuF4kdK7|en|R|21|46
925783805243396096|88784440|Wed Nov 01 17:57:14 +0000 2017|how much more evidence do we need of the absolute cultural necessity of family repair? https://t.co/7uzC2FPOfr #opioidcrisis|en|R|46|117
925769176169500672|88784440|Wed Nov 01 16:59:06 +0000 2017|.@RepJBridenstine is one of the most heroic people I have known, and he is a great pick for leading @NASA: https://t.co/ufArSMfrte|en|R|10|36
925457701383131136|88784440|Tue Oct 31 20:21:24 +0000 2017|Learn more about how gender, education level, and other factors affect opioid overdose rates: https://t.co/U0Y7Y4Ydj6 https://t.co/pxrCuNn8oK|en|R|32|30
925417290966949888|88784440|Tue Oct 31 17:40:50 +0000 2017|Thank you @IvankaTrump for leading the fight for real working family tax relief! https://t.co/O9otb88Mf5|en|R|89|1350
925366954738831360|88784440|Tue Oct 31 14:20:49 +0000 2017|Want to understand the opioid crisis better? My JEC staff put together this huge new study to inform the discussion: https://t.co/U0Y7Y4Ydj6|en|R|35|62
924016829495955456|88784440|Fri Oct 27 20:55:54 +0000 2017|I appreciate @realDonaldTrump's and @SecretaryZinke's leadership &amp; willingness to listen to Utahns on abusive natl. monument designations.|en|R|70|431
924016276346998785|88784440|Fri Oct 27 20:53:42 +0000 2017|I spoke with @realDonaldTrump this morning. He confirmed he plans to follow @SecretaryZinke's recommendation to shrink #BearsEars &amp; GSENM!|en|R|55|199
923338159609573376|88784440|Wed Oct 25 23:59:06 +0000 2017|When we look at tax pay-fors, we shouldn't just be looking to raise taxes on anyone, we should find ways to make government smaller. https://t.co/x5iVBLCsX2|en|R|97|247
923336571268616192|88784440|Wed Oct 25 23:52:48 +0000 2017|Some are spending more on health insurance premiums than their mortgages. We need the free market to fix this. https://t.co/NKaM3uc3g5|en|R|256|697
923333037877858304|88784440|Wed Oct 25 23:38:45 +0000 2017|It's my job to call out abuses of power: https://t.co/1NyvbFX0md #utpol #leetownhall https://t.co/p4x5XqKMRS|en|R|32|71
923331676796801024|88784440|Wed Oct 25 23:33:21 +0000 2017|We have to pass comprehensive tax reform between now &amp; the end of the year, and I think we have a high chance of doing that. #utpol https://t.co/SZ2r3rhc78|en|R|45|138
923330295742558208|88784440|Wed Oct 25 23:27:51 +0000 2017|I held a press-conference with @IvankaTrump today. Hear what it was about: https://t.co/W399H82T6m|en|R|23|56
923325762555564037|88784440|Wed Oct 25 23:09:51 +0000 2017|My October Access Live event is starting now, you can join us here: https://t.co/1NyvbFX0md #utpol #leetownhall|en|R|9|13
921109362789060608|88784440|Thu Oct 19 20:22:40 +0000 2017|Big win for American families: Senate just passed a bipartisan amendment to budget that paves way for an expansion of the child tax credit.|en|R|75|423
920685940435234816|88784440|Wed Oct 18 16:20:08 +0000 2017|Reforming and expanding child tax credit is best way to deliver tax relief to lower- and middle-income families: https://t.co/QMhBFDPtaA|en|R|45|110
920675593989083138|88784440|Wed Oct 18 15:39:01 +0000 2017|Congress needs to make this change permanent - Scott Pruitt Ends EPA Welfare Payments to Environmental Groups: https://t.co/RxXyzYGOhj|en|R|143|376
920419073388875777|88784440|Tue Oct 17 22:39:42 +0000 2017|#TaxReform must benefit our ultimate entrepreneurial and investor class: America’s moms and dads. https://t.co/r9Zittyvmt|en|R|56|138
916374510584164352|88784440|Fri Oct 06 18:48:03 +0000 2017|Over the past week, I’ve introduced or cosponsored three criminal justice reform bills: https://t.co/wszHp7PwwS|en|R|56|155
916342040417447936|88784440|Fri Oct 06 16:39:01 +0000 2017|Utah's manufacturing sector is a middle class family-making machine: https://t.co/yz8vaX9uHX #manufacturingday #MFGDay2017|en|R|20|54
916016974429376518|88784440|Thu Oct 05 19:07:20 +0000 2017|"From the testimony of his life, it is clear that Elder Hales honored his father’s advice, and ""flew right:"" https://t.co/qaaMhz3waX"|en|R|13|61
915695831457640448|88784440|Wed Oct 04 21:51:13 +0000 2017|It was good to meet with @prezholland from @UVU about higher-ed reform. Legislation coming soon. #utpol https://t.co/S7AIwl724C|en|R|19|57
915606357390307328|88784440|Wed Oct 04 15:55:41 +0000 2017|Bipartisan criminal justice reform is how Congress is supposed to work – the time is now to get it done https://t.co/ZosCOTzF0a #FoxNews|en|R|40|90
915215462631378944|88784440|Tue Oct 03 14:02:24 +0000 2017|Support is growing for expanding the child tax credit: https://t.co/r0ZlzyQkfq|en|R|63|177
913840457284714496|88784440|Fri Sep 29 18:58:38 +0000 2017|Congratulations to former Utah Governor Jon M. Huntsman, Jr., who was confirmed as the next ambassador to Russia! https://t.co/6Sap2TV4hs|en|R|45|281
913435463930843138|88784440|Thu Sep 28 16:09:20 +0000 2017|Good background on why we need to pass Native Species Protection Act - https://t.co/yG3bAXAQAm via @KSLcom|en|R|16|31
913409318501912576|88784440|Thu Sep 28 14:25:26 +0000 2017|Welcome back! https://t.co/eGINCPyHxl|en|R|22|235
913392430875136000|88784440|Thu Sep 28 13:18:20 +0000 2017|Good move - Trump waives Jones Act shipping restrictions for Puerto Rico: https://t.co/4cCAVgHF37|en|R|80|305
913382988137861120|88784440|Thu Sep 28 12:40:48 +0000 2017|National Review is right: we need to double the child tax credit. https://t.co/V9NPjZEos1|en|R|53|142
913128035242713090|88784440|Wed Sep 27 19:47:43 +0000 2017|In order for tax reform to succeed, American families need to be first in line for relief: https://t.co/8U7CvLko45 @marcorubio|en|R|115|411
913060830983413760|88784440|Wed Sep 27 15:20:40 +0000 2017|"The ""CBO Show Your Work"" Act is now bicameral. @WarrenDavidson introduced in the House yesterday: https://t.co/v9IRO6OPwT"|en|R|29|47
912781774073233408|88784440|Tue Sep 26 20:51:48 +0000 2017|Noncommercial species found within borders of a single state shouldn't be subject to Endangered Species Act: https://t.co/QTxaUgJElz #utpol|en|R|24|57
912690701229608961|88784440|Tue Sep 26 14:49:54 +0000 2017|Republicans need to keep their promise to provide relief to American families who have been hit hardest by impact of #Obamacare. https://t.co/TrdZeTbhUC|en|R|110|393
910974028285956096|88784440|Thu Sep 21 21:08:28 +0000 2017|I am fully confident the Education Department will reject this Education Department OIG report: https://t.co/srttZs20jS|en|R|30|70
910972126290698241|88784440|Thu Sep 21 21:00:54 +0000 2017|Western Governors University has been a true leader in quality higher education innovation and I fully support them. https://t.co/srttZs20jS|en|R|18|62
910885815450046464|88784440|Thu Sep 21 15:17:56 +0000 2017|Good analysis of Restoring Board Immunity Act: https://t.co/iPvFvIzezv|en|R|16|26
910872465039089664|88784440|Thu Sep 21 14:24:53 +0000 2017|The House passed civil asset forfeiture reform with a strong bipartisan vote. The Senate needs to follow their lead: https://t.co/R8HgAig1lB|en|R|230|423
910180520738398209|88784440|Tue Sep 19 16:35:21 +0000 2017|I cannot imagine anyone as well-qualified to serve as U.S. Ambassador to Russia as my friend and former boss, Jon Huntsman Jr. https://t.co/muODSFYcE1|en|R|102|483
908382400429862912|88784440|Thu Sep 14 17:30:15 +0000 2017|Very good detailed analysis on why reducing parent tax penalty should be focus of tax reform: https://t.co/tcKYRtsNCa @RameshPonnuru @AEI|en|R|47|83
908119389123366922|88784440|Thu Sep 14 00:05:09 +0000 2017|Bipartisanship happens in DC &amp; I often participate actively in it. Join my next event by signing up here: https://t.co/ag6vt3vx4E #utpol https://t.co/bofDO7lmUN|en|R|12|38
908116970687660033|88784440|Wed Sep 13 23:55:32 +0000 2017|I answered a caller's question about North Korea. Have a question to ask? Join the conversation at https://t.co/ag6vt3vx4E #utpol https://t.co/dfRh9yuDXy|en|R|18|37
908115380882767872|88784440|Wed Sep 13 23:49:13 +0000 2017|Hear my thoughts on President Trump and join the conversation: https://t.co/ag6vt3vx4E #utpol https://t.co/eEpeRhWkGN|en|R|27|51
908113235257196544|88784440|Wed Sep 13 23:40:41 +0000 2017|I just answered a caller's question about the Medicare for all proposal: Join us here: https://t.co/ag6vt3vx4E #utpol https://t.co/Fy4GPLeqU2|en|R|20|41
908111373607034887|88784440|Wed Sep 13 23:33:18 +0000 2017|We just discussed immigration on my Access Live event. Come join us here: https://t.co/dooJug0JCN #utpol https://t.co/b59jBnRcqq|en|R|14|23
908108605852983297|88784440|Wed Sep 13 23:22:18 +0000 2017|My Access Live town hall is happening now. You can join us here: https://t.co/1NyvbFX0md #utpol #leetownhall|en|R|10|18
908108596755488768|88784440|Wed Sep 13 23:22:15 +0000 2017|In August, I met with many Utahns, but I want to hear from as many as possible. Join here: https://t.co/dooJug0JCN #utpol https://t.co/B7Uiejh9Z8|en|R|7|22
908027420921524224|88784440|Wed Sep 13 17:59:42 +0000 2017|I'm holding an Access Live event tonight. You can learn more about how to join the event here: https://t.co/1NyvbFX0md https://t.co/tBPirKBaYI|en|R|17|33
907792291875651584|88784440|Wed Sep 13 02:25:23 +0000 2017|When we send our armed forces into harm's way, we should do it in manner prescribed by Constitution: https://t.co/B4IQnbsV5L @SenRandPauI|en|R|120|449
907667124759535617|88784440|Tue Sep 12 18:08:00 +0000 2017|Utah has highest rate of volunteerism, and Americans overall do well when it comes to this social capital indicator: https://t.co/LXusOPHgfe|en|R|43|148
907666074803609600|88784440|Tue Sep 12 18:03:50 +0000 2017|"The latest report for the Social Capital Project: ""Volunteerism in America"" is now available: https://t.co/LXusOPHgfe @JECRepublicans"|en|R|8|21
905910725834657792|88784440|Thu Sep 07 21:48:42 +0000 2017|Happy 90th birthday, television! On this date in 1927. Philo T. Farnsworth transmitted 1st electronic TV signal: https://t.co/edjLkyGZIo https://t.co/ezpIx9GVPo|en|R|41|126
905890403051859968|88784440|Thu Sep 07 20:27:57 +0000 2017|The growing pattern of hostility toward people of faith who come before Senate for confirmation hearings is wrong: https://t.co/ecpWgwzxex|en|R|281|786
905163092585324545|88784440|Tue Sep 05 20:17:53 +0000 2017|Congress is finally working to defund civil asset forfeiture https://t.co/VLJRSOzCj3|en|R|90|269
