id|user|created_at|text|lang|label|retweet_count|favorite_count
1284237521518551040|43910797|Fri Jul 17 21:24:19 +0000 2020|"Congress must act to eradicate the systemic racism that oppresses and underinvests in our communities of color.
 
I'm joining @SenateDems on the #EconomicJusticeAct to address the disparities that Black and Brown communities have endured for generations. https://t.co/uvo05luyi0"|en|D|83|347
1283800803040518144|43910797|Thu Jul 16 16:28:57 +0000 2020|"Let's be clear - returning the U.S. to a gold standard is a terrible idea, AND it's dangerous for our economy.
 
But that's what Judy Shelton has spent her career advocating for.
 
She is not fit for the Federal Reserve Board. #StopShelton
https://t.co/YsPDG4a3Kx"|en|D|345|909
1283578464457699328|43910797|Thu Jul 16 01:45:28 +0000 2020|"Undermining the CDC and our public health isn’t new for the Trump Administration. 

They’ve tried each year to gut the CDC and strip it of its ability to do its job.

Only now, they’re doing it DURING a pandemic. 

https://t.co/Kb5DudFDvu"|en|D|251|777
1283445594888048640|43910797|Wed Jul 15 16:57:29 +0000 2020|"We're five months into a health and economic crisis. 18 million are out of work.
 
But instead of sending another stimulus check, or doing ANYTHING to help people pay their rent and bills -
 
The White House is telling workers to #FindSomethingNew.
 
That's it. That's their plan."|en|D|1230|3147
1283172714170245121|43910797|Tue Jul 14 22:53:09 +0000 2020|"This is what we can accomplish when we fight back against the Trump Administration’s cruel policies.
 
The Trump Admin is dropping its #StudentBan because people spoke out and made their voices heard.

https://t.co/zhvZ5SdqqP"|en|D|101|610
1283137761567006720|43910797|Tue Jul 14 20:34:16 +0000 2020|"Stunning.

Over five million laid-off workers have lost healthcare coverage during the pandemic.

Yet the Trump Administration is still working to kick families off their health insurance and rollback pre-existing condition protections.

https://t.co/K0uwXe8Swn"|en|D|234|511
1283125246648877058|43910797|Tue Jul 14 19:44:32 +0000 2020|"If you don't believe we need #RentReliefNow - take a look at the gap between renters' income and the cost of housing.
 
Corporations don’t pay workers at many essential jobs - retail sales workers, health aides - enough to afford a modest home.
 
Now we're in a pandemic. #OOR20 https://t.co/phfgoiGReD"|en|D|142|345
1283044845536370695|43910797|Tue Jul 14 14:25:03 +0000 2020|"THREAD: Judy Shelton's views are so dangerous, even principled conservatives are OPPOSED to her nomination.
 
""Shelton’s views on monetary policy are far outside the mainstream. Too far.

#StopShelton 
https://t.co/S1T306Vwz3"|en|D|129|346
1283038830984126474|43910797|Tue Jul 14 14:01:09 +0000 2020|"Judy Shelton, Trump nominee for the Fed, has DANGEROUS economic views. Her beliefs?

▶eliminating the Fed's independence and federal deposit insurance
▶returning the U.S. to a gold standard

We need sound economic policy, NOT fringe theories, at our central bank. #StopShelton https://t.co/q2k7AnZgTw"|en|D|379|868
1281724443690180608|43910797|Fri Jul 10 22:58:15 +0000 2020|"Even before this pandemic, Judy Shelton had dangerous ideas that - if given a place on the Federal Reserve - would threaten our economic stability.
 
Now more than ever, we need the Fed’s independence and stability - ideas she doesn't believe in.
https://t.co/7Zk7OUgUdd"|en|D|163|325
1281246298314866688|43910797|Thu Jul 09 15:18:16 +0000 2020|"Reminder: every President in the last 40 years has voluntarily released their tax returns.
 
The President needs to be straight with the people he serves. Truth will prevail.

https://t.co/PFq7gkYRbI"|en|D|436|1999
1280953139781345280|43910797|Wed Jul 08 19:53:22 +0000 2020|"My mother Emily Brown would have turned 100 today.

She dedicated her life to fighting for justice and to lifting up the voices of those with less privilege. Even after 11 years without her, She is one of my guiding lights in public service &amp; in life.
 
Happy 100th birthday, mom. https://t.co/hikLnuXw9L"|en|D|77|2160
1280667802605674496|43910797|Wed Jul 08 00:59:32 +0000 2020|"In his Mount Rushmore speech, President Trump declared that people who disagree with him want to ""destroy the very civilization that rescued billions from poverty, disease, violence, and hunger"".
 
No, Mr. President. It's clear who's destroying the legacy of America's leadership."|en|D|1151|4423
1280601704317308929|43910797|Tue Jul 07 20:36:53 +0000 2020|"We can't allow children and young people in foster care to fall through the cracks during this pandemic.

I introduced a bill w/ @SenKamalaHarris @SenBobCasey &amp; @SenCortezMasto to ensure child welfare agencies have the resources they need to continue supporting families. https://t.co/uNeXYAdc9D"|en|D|134|641
1280260675760201736|43910797|Mon Jul 06 22:01:45 +0000 2020|"My heart goes out to the family and friends of Officer Anthony Dia, who paid the ultimate sacrifice in the line of duty.

The Toledo Police Department and the community of Toledo have lost a hero. https://t.co/yDqRZdc2Om"|en|D|37|360
1279420152556249094|43910797|Sat Jul 04 14:21:49 +0000 2020|"Happy Independence Day!

Thank you to all of our veterans, servicemembers, and military families who have sacrificed so much for our country’s freedom.

No matter how you celebrate today, please have a safe Fourth of July."|en|D|75|753
1278673417043013632|43910797|Thu Jul 02 12:54:33 +0000 2020|"TODAY at 10:00AM - A conversation on the looming eviction crisis in Ohio. 

I'm joined by Aftab Pureval, Hamilton County Clerk of Courts, and Bill Faith, COHHIO. 

Watch it live:
https://t.co/6WU0F9a50t https://t.co/zUVgzYs4Sb"|en|D|15|77
1278498507192700931|43910797|Thu Jul 02 01:19:32 +0000 2020|"Masks save lives - but it only works if everyone in a shared space is wearing one.
 
I'm happy to see communities across Ohio developing plans for people to wear masks, so that EVERYONE stays safe.
 
Elected officials should be modeling this good behavior."|en|D|334|2105
1278466508629381121|43910797|Wed Jul 01 23:12:23 +0000 2020|"We must #BoostSNAPNow.
 
Hungry families across the country are wondering where their next meal will come from. Congress can provide quick relief NOW by passing a 15% increase in the maximum SNAP benefit. 

I’m live on the floor: https://t.co/VSD36aHxrI"|en|D|141|493
1278460201188851712|43910797|Wed Jul 01 22:47:19 +0000 2020|"On #NationalPostalWorkerDay, I want to thank the 25,000 postal workers in Ohio, so many of whom have risked their health to serve Ohioans everywhere.

Congress should provide them with proper protective equipment and include robust funding for the USPS in the next relief package."|en|D|242|1022
1278418495789838339|43910797|Wed Jul 01 20:01:35 +0000 2020|"LIVE: Senator Brown and his colleagues are DEMANDING action to help the millions of Americans facing eviction or struggling to pay their rent and their bills.

Senator Brown will ask for unanimous consent on his rental assistance bill. #RentReliefNow https://t.co/2dnqkECpew"|en|D|135|515
1278384489195077633|43910797|Wed Jul 01 17:46:28 +0000 2020|"TUNE IN: at 4PM, my colleagues and I are taking to the Senate floor to demand ACTION for the millions of people struggling to pay their rent and bills or at risk of losing their homes.

We cannot let this public health crisis turn into an eviction crisis.

Watch Live here!"|en|D|230|971
1278344763905839104|43910797|Wed Jul 01 15:08:36 +0000 2020|"TUNE IN AT 12:45PM - I'll be LIVE with @SenatorMenendez  to discuss the need for action on the Housing Crisis and Rental Assistance.

Watch it here👇

https://t.co/qh0JePf22M https://t.co/xBrkBYRJu5"|en|D|20|54
1278007420707647489|43910797|Tue Jun 30 16:48:07 +0000 2020|"If President Trump was briefed and did not act, we have a President who does nothing when U.S. servicemembers are murdered for Russian bounties.

I support @SenSchumer’s call for the Directors of National Intelligence and the CIA to immediately give us answers."|en|D|637|2429
1277972880676937729|43910797|Tue Jun 30 14:30:52 +0000 2020|"NEWSFLASH: four months into a pandemic, four months after public health officials said we should wear masks, Trump's HHS Secretary says he agrees. Even Leader McConnell is saying we should wear masks.

Finally, MOST people in high places, at least, are wearing masks. https://t.co/fNK1lSR6wS"|en|D|87|497
1277964105987485696|43910797|Tue Jun 30 13:56:00 +0000 2020|"Access to the banking system should be a public good, not turned over to the Big Tech companies who care foremost about their bottom lines instead of working Americans.

WATCH today's Banking Hearing on the Digitization of Money and Payments: 
https://t.co/34lkpcFMqJ"|en|D|36|128
1277721580894904320|43910797|Mon Jun 29 21:52:18 +0000 2020|"Facebook talks big game about the power of its tech to build connections.

But that apparently doesn't extend to people organizing for better working conditions and pay. They let slip the goal of FB’s new Workplace platform: help corporations bust unions.
https://t.co/db4DK1fkEw"|en|D|85|219
1277647112470233090|43910797|Mon Jun 29 16:56:23 +0000 2020|"OHIO BUSINESS OWNERS, Tuesday is the last day for the SBA to approve your PPP loan.

Apply now ASAP, if you haven’t already. https://t.co/7Qpqqt6DRi"|en|D|41|76
1277633167449632771|43910797|Mon Jun 29 16:00:59 +0000 2020|"We created the @CFPB after the 2008 crisis with the core mission of putting consumers first and protecting them from financial abuse.
 
Sadly, today's SCOTUS ruling puts corporations over consumers and strips the agency of its key independence.
https://t.co/ieDYYc7CqR"|en|D|108|217
1277608602174476290|43910797|Mon Jun 29 14:23:22 +0000 2020|"When you sign away your privacy rights to a corporation, you’ve also given the government permission to sift through your secrets.

My bill will give us the power to RECLAIM our privacy online - and put a stop to Big Tech mining and selling your data.
https://t.co/pvYUOoUSPq"|en|D|205|781
1276547843914899457|43910797|Fri Jun 26 16:08:17 +0000 2020|"President Trump's actions are nothing short of morally bankrupt.
 
He is actively working to kick 23 million Americans off their healthcare coverage DURING A PANDEMIC.
 
I will not stop fighting for quality healthcare coverage for all Americans.

https://t.co/ljafDTbnL1"|en|D|282|1031
1276215713280266242|43910797|Thu Jun 25 18:08:31 +0000 2020|"Today would have been Tamir Rice's eighteenth birthday.

But he was murdered by police in a Cleveland park at the age of twelve.

Our hearts break for the young man he might have been and the future he might have had. #TamirRice https://t.co/Q4eCVl8RND"|en|D|388|1656
1276195840076505096|43910797|Thu Jun 25 16:49:33 +0000 2020|"UPDATE: Senate Republicans have once again obstructed these nominations from moving forward.
 
#ExIm ensures American businesses and American workers stay competitive abroad with exports. It's too important to our nation’s small businesses to be left without a full board. https://t.co/8of7Qn7LNg"|en|D|71|192
1276190999371558914|43910797|Thu Jun 25 16:30:19 +0000 2020|"LIVE: I'm on the floor demanding Senate Republicans take up two important nominations that will help American manufacturers, particularly small businesses, weather this pandemic.
 
We need Paul Shmotolokha and Claudia Slacik on ExIm’s board. #ExIm https://t.co/oLQszV6Rwe"|en|D|42|195
1275877029276196865|43910797|Wed Jun 24 19:42:43 +0000 2020|"If Google holding on to your location data for a year and a half doesn't sound like a privacy win, that's because it's not.

Instead, let's adopt my new privacy proposal that completely rewrites the rules of how corporations can collect your data. 👇

https://t.co/uOl7YQQzRm https://t.co/lo34OCQ0gm"|en|D|81|373
1275509095878070272|43910797|Tue Jun 23 19:20:40 +0000 2020|"President Trump and many of my Republican colleagues want to blame China for everything, including the coronavirus.

China is no model of responsibility. But the President needs to stop blaming the Chinese for his own failures and do more at home to stop the spread of COVID-19. https://t.co/sVkGB9ftck"|en|D|201|951
1275482866424655873|43910797|Tue Jun 23 17:36:27 +0000 2020|"Corporate CEOS - what if the millions you spent on feel-good PR campaigns went straight to your workers instead?

Show them you care.

▶️$15/hr minimum wage
▶️paid sick days and paid family leave
▶️protect them on the job
▶️end the ""independent contractor"" business model https://t.co/VKrC8kGRZ7"|en|D|177|705
1275117978309349376|43910797|Mon Jun 22 17:26:31 +0000 2020|"Wear a mask. Stay safe. Protect others. 

Pass it on. https://t.co/SoS09Uvq98"|en|D|927|2449
1273988710770638852|43910797|Fri Jun 19 14:39:12 +0000 2020|"As we mark #Juneteenth, we must acknowledge the effects slavery has had on Black Americans for generations.

The racial injustices we see today are a direct result of slavery and its legacy of keeping Black Americans down."|en|D|114|671
1273691443996082180|43910797|Thu Jun 18 18:57:58 +0000 2020|"Dear corporate executives: 

Enough with the feel-good PR campaigns.

Put your money where your mouth is, and do right by your workers. 

That means fair pay, protections on the job and power in the workplace.
https://t.co/hGrXzBdS5V"|en|D|216|773
1273656446522195969|43910797|Thu Jun 18 16:38:54 +0000 2020|"Let's be honest: no one reads the Terms of Service before clicking ""I Agree"". 

We're constantly forced to sign away our data, giving companies the power to SELL and STORE our personal information.
 
It's time to end the Internet Data Grab.
https://t.co/q1DpHchE9u"|en|D|167|748
1273640057581318144|43910797|Thu Jun 18 15:33:47 +0000 2020|"This week's #SCOTUS decision protected our LGBTQ friends and neighbors from employment discrimination.
 
Now, we need to pass the #EqualityAct - to make sure they can't be denied any other opportunities because of who they are and who they love. https://t.co/THvbs9SscZ"|en|D|108|518
1273627615635570693|43910797|Thu Jun 18 14:44:21 +0000 2020|"800,000 #Dreamers are now safe from Pres. Trump's attempt to rip them away from their families and communities.
 
America is their home. Time for real immigration reform that recognizes that.

https://t.co/GC70jLWdRz"|en|D|496|1982
1273358958879748097|43910797|Wed Jun 17 20:56:48 +0000 2020|"Instead of helping families stay safe, McConnell is pushing through his right-wing protégé for a lifetime court appointment.
 
Justin Walker’s made it clear he WILL do McConnell's bidding and vote to take away Americans’ health care in the middle of a pandemic. #StopWalker https://t.co/hnVoLvPZkM"|en|D|1011|2272
1273073782350139392|43910797|Wed Jun 17 02:03:36 +0000 2020|"A peaceful protester in Bethel, Ohio was sucker-punched in the head right in front of police officers – and they did nothing about it. 

These officers’ inaction is shameful. This is why we need the Justice in Policing Act - to hold police accountable.
 https://t.co/Q6uOZMWVsy"|en|D|1858|4863
1272980944811630592|43910797|Tue Jun 16 19:54:42 +0000 2020|"Demanding justice for workers and people of color isn’t shameless. 
 
It’s the least people in positions of privilege can do. https://t.co/DhiCEhzWw9"|en|D|417|1695
1272976829134131201|43910797|Tue Jun 16 19:38:21 +0000 2020|"LIVE: I'm joining @SenDougJones and my colleagues in reading a portion of Dr. Martin Luther King's Letter from Birmingham Jail.
 
57 years on, his words are more relevant than ever in understanding how we achieve racial justice.
 
Watch 👇
https://t.co/cemXlP7LH1"|en|D|45|229
1272917154162192390|43910797|Tue Jun 16 15:41:13 +0000 2020|"Whenever we try to fix the systemic economic oppression that keeps Black Americans down, the people who perpetuated that system say ""we can't have government meddling in the economy.""

Government has ALWAYS intervened in the economy - on behalf of corporations and the wealthy. https://t.co/yQ97tyXeTC"|en|D|272|963
1272628794340360193|43910797|Mon Jun 15 20:35:23 +0000 2020|"If you don't have a place to call home or a roof over your head, everything else falls apart. 

We cannot achieve racial justice without addressing the housing inequality that disproportionately affects our Black and brown communities.

https://t.co/q4bPyMZQnU"|en|D|133|543
1272578529625022475|43910797|Mon Jun 15 17:15:39 +0000 2020|"Reminder: coronavirus continues to spread. Some businesses reopening does not mean ""business as usual"".
 
Please continue to wear a mask so we can all protect each other, especially the most vulnerable in our society. #InThisTogether"|en|D|384|1676
1272547562164289538|43910797|Mon Jun 15 15:12:36 +0000 2020|"Five years after the #SCOTUS ruling that guaranteed marriage equality, another hard fought victory in our ongoing fight for justice for LGBTQ Americans.
 
Happy Pride Month.

https://t.co/2DkTvcHFnN"|en|D|153|1107
1271531549394173953|43910797|Fri Jun 12 19:55:19 +0000 2020|"Awful. Again and again, meatpacking companies fought public health officials over COVID-19 outbreaks.
 
Worker protections are not a “nicety.” That attitude is exactly what’s wrong with corporate America and it's getting workers killed.

https://t.co/PIdW20WvPk"|en|D|244|557
1271155575183872001|43910797|Thu Jun 11 19:01:20 +0000 2020|"Few have been as wise, brave, and compassionate throughout this pandemic than Ohio's own Dr. Amy Acton. 

Without a doubt, her leadership saved countless lives in Ohio. 

On behalf of a grateful state - thank you for your service, Dr. Acton.

https://t.co/4R4uALvn3J"|en|D|982|4621
1271106298294210562|43910797|Thu Jun 11 15:45:32 +0000 2020|"How an elected official, let alone a DOCTOR, could be so ignorant of the health disparities that affect African-Americans is repugnant.
 
This is not about hand washing. It's about the racism rooted in our economic and health systems keeping Black communities down. https://t.co/JkzdGzLCsv"|en|D|670|2922
1270856031120359424|43910797|Wed Jun 10 23:11:03 +0000 2020|"Disturbing reports that #DOJ and #DHS are using facial recognition surveillance technology on peaceful #BlackLivesMatter and George Floyd protestors.
 
@SenBooker, @RonWyden and I are demanding answers - what personal data on protestors is being collected?
https://t.co/yDHN5PUNuP"|en|D|237|490
1270830503680184322|43910797|Wed Jun 10 21:29:37 +0000 2020|"WATCH: My Republican Colleagues have been silent on this President's actions for far too long. 

I'm live on the Senate floor.  https://t.co/Gmw4fKORsD"|en|D|654|2073
1270758022453878784|43910797|Wed Jun 10 16:41:36 +0000 2020|"LIVE: I'm going live to talk about the Justice in Policing Act at 12:45PM with Stephanie Hightower, President of the Columbus Urban League.

We need real police reform now. Tune in! 

https://t.co/w0sXFRbIX6"|en|D|25|148
1270428334233698305|43910797|Tue Jun 09 18:51:32 +0000 2020|"As Housing Secretary, Republican George Romney worked to implement the Fair Housing Act and address inequities in our housing system. President Nixon fired him for it.
 
Americans are waiting on my Republican colleagues and Secretary Ben Carson to show that same courage today. https://t.co/Nmn12zm5ni"|en|D|172|729
1270371560348700672|43910797|Tue Jun 09 15:05:57 +0000 2020|"I asked Housing Secretary Ben Carson, our top housing official in the Trump Administration, a simple question:
 
How many people does HUD expect will lose their homes as a result of this crisis?
 
He didn’t answer. Watch: https://t.co/twNUeg6H8l"|en|D|221|627
1270366476243996675|43910797|Tue Jun 09 14:45:44 +0000 2020|.@SecretaryCarson, whether or not you prefer to hear me, I hope you're hearing the demands to fix the inequities in our housing system from Americans across the country. https://t.co/DOpGAAfnt9|en|D|213|1022
1270361148735528960|43910797|Tue Jun 09 14:24:34 +0000 2020|"Before the pandemic, President Trump and his wealthy cabinet members didn’t realize or didn’t care that behind the rosy stock market data, this economy was already broken for millions of workers – 

and for Black and brown workers, it never worked to begin with. https://t.co/zcyyHhoVzZ"|en|D|180|666
1270067023654137858|43910797|Mon Jun 08 18:55:49 +0000 2020|"We have to rethink how we police.

No more chokeholds. No more unchecked police misconduct. No more excess military equipment. 

Instead, prioritize healthcare, housing, and education.

I'm joining @SenBooker, @SenKamalaHarris and @TheBlackCaucus on the #JusticeInPolicingAct. https://t.co/WiB2oQZ4Ex"|en|D|424|2035
1268990714563657729|43910797|Fri Jun 05 19:38:57 +0000 2020|"On National Gun Violence Awareness Day, we #WearOrange in solidarity with Black Americans, who suffer the most because Mitch McConnell and President Trump refuse to stand up to the gun lobby.
 
We need common sense gun safety laws. https://t.co/6173QJtTyc"|en|D|84|340
1268973731872980992|43910797|Fri Jun 05 18:31:28 +0000 2020|"13% unemployment isn't 'stupendous'. 

People being forced back to work without protections isn't 'joyful'. 

20 million Americans are still unemployed, and our President is completely out of touch with the workers he's betrayed. 

https://t.co/n9mdA80ljb"|en|D|298|1016
1268950033749151749|43910797|Fri Jun 05 16:57:18 +0000 2020|How dare you invoke George Floyd's name to prop up your self-congratulatory press conference. https://t.co/VMPz5NvuGj|en|D|1645|8246
1268633398400233474|43910797|Thu Jun 04 19:59:06 +0000 2020|"Our economy simply doesn’t work for our Black and brown communities like it should.
 
Inequality in housing and our financial institutions have held them back for decades.
 
Read this👇 https://t.co/AVSVG0UUVj"|en|D|90|408
1268604265628565505|43910797|Thu Jun 04 18:03:21 +0000 2020|"8 minutes, 46 seconds of silence. 

Our country must do better. 

(📷: Sarah Silbiger, Getty Images) https://t.co/Lr5FV9VOQg"|en|D|363|2475
1268266959612915712|43910797|Wed Jun 03 19:43:01 +0000 2020|"Overdraft fees disproportionately fall on Black &amp; brown consumers, one of many ways the banking system is set up to exploit them, not help them build wealth.

Let’s fix that, starting with my bill w/ @SenBooker to ban these abusive fees during this crisis.
https://t.co/Iw0CJUC601"|en|D|75|278
1268256218499493888|43910797|Wed Jun 03 19:00:20 +0000 2020|"Following my floor speech, the Senate's presiding officer invoked a decorum rule against impugning other Senators. 

I'll remind my Republican colleagues that Senate decorum delayed civil rights legislation for years. 

Are they afraid of the truth? 

Watch for yourself. https://t.co/w0qwEwCSOa"|en|D|960|2889
1268249803672236043|43910797|Wed Jun 03 18:34:50 +0000 2020|"Instead of uniting, this President divides. 

Instead of comforting, he stokes fear and points fingers.

Instead of healing, he rubs salt in the open wounds of Black Americans. 

President Trump has failed yet again. https://t.co/aRrMhxlaRx"|en|D|364|1451
1268197310032416768|43910797|Wed Jun 03 15:06:15 +0000 2020|WATCH: I'm live on the Senate floor speaking about George Floyd, the nationwide protests for justice, and the systems of oppression affecting our Black and brown communities.   https://t.co/KS4B6EepMP|en|D|357|1391
1267850523723673601|43910797|Tue Jun 02 16:08:15 +0000 2020|"President Trump co-opting a house of worship he doesn't attend and a Bible he doesn't read, all for a PR stunt - is absolutely repulsive, even by his standards. 

https://t.co/w82C3F6kc0"|en|D|903|4301
1267833313592475650|43910797|Tue Jun 02 14:59:51 +0000 2020|"It doesn’t matter if they're jogging in their neighborhoods, protesting injustice, or driving to the store.
 
Black men and women know that systemic racism puts their lives and the lives of their children at risk. All the time.
 
THIS is their EVERY day. https://t.co/qxLsS5y4xF"|en|D|128|555
1267827121616859142|43910797|Tue Jun 02 14:35:15 +0000 2020|"Whenever people bring up the ways the system has failed so many Americans, there are always naysayers who say, how can you be so negative?
 
My response to our country’s sunshine patriots: how can you be so pessimistic as to believe this is the best we can do? https://t.co/G7OXGm4ibk"|en|D|225|894
1267817924649082880|43910797|Tue Jun 02 13:58:42 +0000 2020|"HEARING: America continues to suffer because the president fails to lead.
 
It's time for Congress to fill the leadership void and pass a relief package that goes directly to workers.
 
Watch below at 10AM👇

https://t.co/2llssXIuxb"|en|D|39|226
1267502410106376200|43910797|Mon Jun 01 17:04:58 +0000 2020|"June 1. #RentIsDue for millions of Americans - but many are struggling to make ends meet.
 
The House already passed my Emergency Rental Assistance bill to help families pay their rent and utilities and stay in their homes.
 
The Senate needs to act. #RentReliefNow"|en|D|194|731
1267491850765639682|43910797|Mon Jun 01 16:23:00 +0000 2020|"Today, #WeRemember the 100,000 Americans and 2,155 Ohioans who have lost their lives to COVID-19.
 
These are our friends and neighbors, our parents and grandparents, our daughters and sons. Please join me in a moment of silence across the nation to honor their memory."|en|D|151|871
1267481376376356864|43910797|Mon Jun 01 15:41:23 +0000 2020|"An important watch.
 
Amazon is not treating its workers like Jordan and Courtenay as the heroes they are – it’s treating them like they're expendable.
 
@SenBooker and I questioned Amazon on the treatment and safety of its frontline workers last month. 👇
https://t.co/LkRnnrpXeM https://t.co/mwoQ70xaS6"|en|D|45|136
