id|user|created_at|text|lang|label|retweet_count|favorite_count
1186431748969811968|43910797|Mon Oct 21 23:59:06 +0000 2019|Today @senrobportman and I introduced a resolution condemning the horrific attack in Dayton, on August 4th, 2019. https://t.co/XNsBbAwpcV|en|D|18|128
1186390825456066560|43910797|Mon Oct 21 21:16:29 +0000 2019|"President Trump's and the GOP's tax scam did nothing for workers and families. If Congress makes a fix to the law that takes care of restaurant owners, we must take care of workers. 

We need to expand the EITC and CTC now. #WorkingFamilies https://t.co/xQywcXCYWL"|en|D|56|153
1186367286925561856|43910797|Mon Oct 21 19:42:57 +0000 2019|Had a great discussion, thanks for having me. https://t.co/2LSs4yFirQ|en|D|16|104
1185277584273219585|43910797|Fri Oct 18 19:32:52 +0000 2019|It was an honor for our office to attend the deployment ceremony for the 238th Aviation Regiment at the MAPS Air Museum in Canton this week. We wish these soldiers well on their deployment and thank them for their sacrifice and service. https://t.co/lXycGByaED|en|D|16|108
1185265362947977217|43910797|Fri Oct 18 18:44:18 +0000 2019|Congratulations to @Astro_Christina and @Astro_Jessica for completing the first-ever #AllWomanSpacewalk. https://t.co/565Jx3lCuZ|en|D|18|129
1185217387580329986|43910797|Fri Oct 18 15:33:40 +0000 2019|Great meeting the Lady Butchers of Cleveland, Melissa and Penny, and touring Saucisson this morning. https://t.co/ffOBlr22Vy|en|D|7|83
1184833987686129664|43910797|Thu Oct 17 14:10:10 +0000 2019|Connie and I are saddened by the passing of Rep. Elijah Cummings. A lot of members of Congress live in their districts, but Elijah was really 𝘰𝘧 his district. He always governed through the eyes of the people of Baltimore, and he was a fierce champion for civil rights.|en|D|93|791
1184546161195134976|43910797|Wed Oct 16 19:06:27 +0000 2019|"American workers spent their whole lives paying into pension plans on the promise of a secure retirement. 

Congress must do its job and pass a solution that keeps that promise. #APensionIsAPromise"|en|D|74|283
1184505585749893121|43910797|Wed Oct 16 16:25:13 +0000 2019|"HAPPENING NOW: Workers and retirees from across the country share their stories as they demand Congress to act to save the pensions they’ve earned. #APensionIsAPromise

https://t.co/TZUcGrEj1X"|en|D|53|180
1184490898601775105|43910797|Wed Oct 16 15:26:51 +0000 2019|WATCH LIVE: Sherrod joins workers, retirees, and @SenateDems to demand action to save the pensions workers earned. #APensionIsAPromise https://t.co/G9cUl3RJUL|en|D|46|188
1184278449499901952|43910797|Wed Oct 16 01:22:39 +0000 2019|Get well soon, @HardballChris. https://t.co/H0xINI4plS|en|D|37|309
1184225444343754754|43910797|Tue Oct 15 21:52:02 +0000 2019|"People give up dollars today for the promise of a secure retirement, with good health care and a pension.

I urge my colleagues in the Senate to act to pass a solution that honors work and keeps that promise. #APensionIsAPromise https://t.co/S6kE3je7f9"|en|D|142|498
1184192880249847811|43910797|Tue Oct 15 19:42:38 +0000 2019|"These workers want to do their jobs.
 
It’s been 30 days, @GM. It’s time to come to the table and agree to a contract that honors the Dignity of Work so that @UAW workers can get back to work. https://t.co/8I6P3Rvd67"|en|D|120|417
1183005508065812480|43910797|Sat Oct 12 13:04:26 +0000 2019|Large payment companies are wise to avoid legitimizing @facebook’s private, global currency. https://t.co/m05XU1bRtV|en|D|105|382
1182699451649003521|43910797|Fri Oct 11 16:48:17 +0000 2019|On National #ComingOutDay we celebrate the courage it takes for those in the LGBTQ community to live as their full selves and recommit to building a more just world where those who haven't come out can do so without fear. I see you and I'm fighting alongside you. https://t.co/X3DX4jE8ru|en|D|35|265
1182389985204461568|43910797|Thu Oct 10 20:18:34 +0000 2019|President Trump’s approach to foreign policy has betrayed our Kurdish allies while threatening the lives of innocent civilians. I join my colleagues in calling on the president to stand with our allies and demand President Erdogan end military action against the Kurds.|en|D|230|951
1182320742479863809|43910797|Thu Oct 10 15:43:26 +0000 2019|The Trump administration is pushing a case before the courts that would lead our country back to a time when a person with cancer could be denied health coverage or face premiums so high they had to choose between treatments &amp; paying for groceries. https://t.co/EVWWaLuCPS|en|D|83|156
1181961855021015040|43910797|Wed Oct 09 15:57:20 +0000 2019|"Just another reminder that President Trump and the GOP’s tax scam was a handout to corporations at the expense of workers.
 
We need to pass the #WorkingFamilies Tax Relief Act and put money where it belongs: in the pockets of American workers.
https://t.co/pnKYXq416T"|en|D|175|485
1181674834549514240|43910797|Tue Oct 08 20:56:49 +0000 2019|Another betrayal by President Trump — choosing corporations over American workers. Shameful. https://t.co/8y7vAXrevR|en|D|441|858
1181563646062804992|43910797|Tue Oct 08 13:35:00 +0000 2019|Wishing all those observing Yom Kippur an easy and meaningful fast. G’mar Chatimah Tovah.|en|D|26|172
1181285101323378689|43910797|Mon Oct 07 19:08:10 +0000 2019|"President Trump’s chaotic approach to foreign policy doesn’t serve our national security interests and doesn’t make the world safer. 

I support a well-organized withdrawal from Syria, instead of one that bolsters autocrats and betrays our allies."|en|D|133|704
1180568218248851459|43910797|Sat Oct 05 19:39:31 +0000 2019|Connie and I are honored to present our good friend, Dayton Mayor Nan Whaley, with the 2019 Canary Award for her resilience and strength in the fight to end gun violence. #DoSomething #OhioWomensSummit https://t.co/pej4kc4Jc9|en|D|120|822
1180526316464029708|43910797|Sat Oct 05 16:53:01 +0000 2019|Thank you for coming, @SenDuckworth. #OhioWomensSummit https://t.co/XHLiPnsmYe|en|D|21|126
1180505804228694016|43910797|Sat Oct 05 15:31:31 +0000 2019|Fireside chat: Pulitzer Prize-winning journalist, ⁦@ConnieSchultz⁩ interviewing ⁦@SenDuckworth⁩ on how she’s asserted her power throughout her career. #OhioWomensSummit https://t.co/pQtvJlFYQ9|en|D|34|278
1180484798416130048|43910797|Sat Oct 05 14:08:02 +0000 2019|Good morning, Cleveland. Connie and I are excited to be at our 5th Annual Women’s Leadership Summit: Asserting Your Power, with my friend @SenDuckworth. #OhioWomensSummit https://t.co/lAgGwrjfMY|en|D|63|636
1180172174226853889|43910797|Fri Oct 04 17:25:47 +0000 2019|"Manufacturing is one of our state’s most important industries, and Ohio workers continue to drive the success of the industry across the state. 

On National Manufacturing Day, we celebrate the innovation and skill of manufacturing workers in Ohio and honor the Dignity of Work."|en|D|33|200
1179886807133097984|43910797|Thu Oct 03 22:31:50 +0000 2019|Antibiotics do a world of good fighting infections &amp; illness, but now antibiotics are becoming less effective. Congress needs to act on the STAAR Act to stop the spread of deadly superbugs and to preserve antibiotics as a tool to fight disease. #ReachForTheSTAAR https://t.co/64Xy2WpvGO|en|D|46|250
1179873209333817350|43910797|Thu Oct 03 21:37:48 +0000 2019|This executive order isn’t pro-Medicare — it’s pro-insurance company. https://t.co/HWAb5fIsns|en|D|240|432
1179484378151436289|43910797|Wed Oct 02 19:52:44 +0000 2019|Honored to give the keynote address at the 2nd Annual My Brother’s Keeper (MBK) Ohio Statewide Conference in Columbus today. https://t.co/nsIq3A1Nt2|en|D|14|92
1179454093124886528|43910797|Wed Oct 02 17:52:23 +0000 2019|"On today’s #OhioWomenWednesday — meet one of our many amazing panelists: Kersha Deibel, President &amp; CEO of Planned Parenthood Southwest Ohio Region.
 
The Women’s Leadership Summit is this Saturday —don’t forget to register➡️ https://t.co/cP8E0A0UdS https://t.co/tsMW83IEbE"|en|D|16|51
1179055228487917568|43910797|Tue Oct 01 15:27:26 +0000 2019|WATCH: @jaden_reports exclusive interview with Sherrod. https://t.co/eUPhXnbvWb|en|D|7|29
1178770442389217282|43910797|Mon Sep 30 20:35:48 +0000 2019|It was an honor to talk with Ohio’s own, @jaden_reports, about the Dignity of Work. It’s inspiring to see that at the age of 11, he already understands the important role journalists play in our democracy, uncovering the truth. https://t.co/IismerA6Wt|en|D|104|728
1178749187158106112|43910797|Mon Sep 30 19:11:20 +0000 2019|"Week 3: Proud to still be standing alongside @UAW as they fight for fair wages, better working conditions, &amp; investment in their local communities.
 
We must keep the pressure on @GM to agree to a contract that honors the Dignity of Work. https://t.co/q2e3J86mG6"|en|D|98|412
1178734904642850817|43910797|Mon Sep 30 18:14:35 +0000 2019|The President promised to fight for American workers — but today’s swearing-in of Eugene Scalia as Secretary of Labor is just the latest proof that President Trump has betrayed workers. https://t.co/T6em6h17e9|en|D|247|593
1178662363882491906|43910797|Mon Sep 30 13:26:20 +0000 2019|Shana Tova to all who are celebrating Rosh Hashanah. Wishing you a joyous and peaceful new year.|en|D|38|303
1177584321223430145|43910797|Fri Sep 27 14:02:35 +0000 2019|"HBCUs and all MSIs have to overcome enough hurdles every day to educate their students — the United States Senate should not be one of them.

We need to pass the FUTURE Act now. https://t.co/G2Xtoh7IRz"|en|D|28|167
1177363235231739909|43910797|Thu Sep 26 23:24:04 +0000 2019|.@GM only reversed course and decided to give striking workers their health insurance after public pressure forced the company to do the right thing. This is further proof that we must keep fighting and holding GM accountable for how it treats workers. https://t.co/gTS9aYqfRB|en|D|80|364
1177340861534920704|43910797|Thu Sep 26 21:55:09 +0000 2019|For the first time in my life, I rooted for the Yankees. And then they laid down for Tampa Bay. Is there no justice?|en|D|44|767
1177325512819118091|43910797|Thu Sep 26 20:54:10 +0000 2019|For 50 years, @NARAL has helped lead the fight for reproductive freedom for all. Their work is more important now than ever. #NARAL50|en|D|38|199
1177297641681620992|43910797|Thu Sep 26 19:03:25 +0000 2019|Another example of the Trump Administration proposing a self-initiated, flawed rule that will take food assistance away from millions of Americans, disproportionately affecting children, seniors, and working families. Shameful. https://t.co/jY522BGPUY|en|D|80|160
1177281822029430784|43910797|Thu Sep 26 18:00:33 +0000 2019|"We need a Secretary of Labor who will actually fight for labor — not a corporate lawyer.
 
Eugene Scalia’s nomination is just President Trump’s latest betrayal of American workers. #SecretaryOfCorporateInterests https://t.co/BEO4TRxkxR"|en|D|140|480
1177260282349051908|43910797|Thu Sep 26 16:34:58 +0000 2019|Our intelligence officials are the best in the world, and when one of them is so worried about our country that they risk their career and reputation, I take that very seriously.|en|D|130|1091
1177249028284792834|43910797|Thu Sep 26 15:50:15 +0000 2019|Our staff had a great time at the Mahoning Valley Skilled Trades Expo today. Our factories, engineering facilities, &amp; construction sites are innovative &amp; high-tech, &amp; they’ll employ thousands of Ohioans in the years ahead. I hope Ohioans will explore career options like these. https://t.co/HnpqGv66JZ|en|D|4|33
1176975918641946624|43910797|Wed Sep 25 21:45:00 +0000 2019|President Trump loves to say that he’s on the side of workers, but if he really cared about these workers, he wouldn’t have robbed thousands of Ohioans and millions of Americans of their overtime pay. https://t.co/a2Et1aiD9L|en|D|261|1017
1176940619496853504|43910797|Wed Sep 25 19:24:44 +0000 2019|Eugene Scalia has spent his career helping corporations skirt the rules at workers’ expense. We can’t have a Secretary of Labor with a long record undermining workers and defending corporations who have trampled on their rights. #SecretaryOfCorporateInterests|en|D|87|322
1176898576775036930|43910797|Wed Sep 25 16:37:41 +0000 2019|"Leading up to this year’s Ohio Women’s Leadership Summit, we’re back with #OhioWomenWednesday — first up, meet our host: Dee Perry.
 
If you haven’t registered for the conference yet, head over to https://t.co/cP8E0A0UdS now. https://t.co/HhQSkezqdB"|en|D|9|23
1176873832864452610|43910797|Wed Sep 25 14:59:21 +0000 2019|"Today, in front of the House Judiciary Committee, Mayor @nanwhaley called on leaders to #DoSomething on gun violence for the people of Dayton and every community torn apart by gun violence.

Thank you for your leadership in this fight, Mayor. https://t.co/C82ZU91x1u"|en|D|160|780
1176539673000235008|43910797|Tue Sep 24 16:51:31 +0000 2019|People who work 50 or 60 hours a week should be paid the wages they’ve earned — period. The Trump administration is breaking its promise to hardworking Americans by failing to stand up for workers and expanding the overtime rule. https://t.co/gQvhKJDWH4|en|D|78|223
1176512586151550976|43910797|Tue Sep 24 15:03:53 +0000 2019|"“Democrats will continue providing solutions to protect American jobs and secure the best possible deal for American workers.”
 
If you missed Rep. @rosadelauro’s and my letter to the @washingtonpost, you can read it below ⬇ https://t.co/0uHYW9veTo"|en|D|17|83
1176278459460571136|43910797|Mon Sep 23 23:33:33 +0000 2019|"All workers have the right to stand up for fair wages, better working conditions, and investment in their local communities.
 
Honored to walk the picket line with @UAW in Parma today. https://t.co/quZrnyM2Vh"|en|D|88|412
1176217261939527682|43910797|Mon Sep 23 19:30:22 +0000 2019|".@GM has forgotten that it was taxpayers who saved their company. 

GM needs to agree to a contract that honors the Dignity of Work, and recognizes that it’s workers driving the auto industry’s success. https://t.co/4n9YYkbv2i"|en|D|240|1024
1176160700424687617|43910797|Mon Sep 23 15:45:37 +0000 2019|.@GM: @UAW deserves better. https://t.co/74qivct2iA|en|D|22|89
1175483043143962629|43910797|Sat Sep 21 18:52:51 +0000 2019|"Renegotiating NAFTA is not about politics. It is about the livelihoods of American workers.
 
Read Rep. @rosadelauro’s and my letter to the editor on NAFTA here:  https://t.co/Q35fR7bSrH"|en|D|46|115
1175154055208939520|43910797|Fri Sep 20 21:05:34 +0000 2019|Always great visiting Governor Taft and his students at @univofdayton. Thanks for having me. https://t.co/QpqJXv20Ej|en|D|12|83
1175121163124654085|43910797|Fri Sep 20 18:54:52 +0000 2019|"I was a senior in high school when I organized a rally for the first Earth Day in Mansfield, Ohio.
 
It’s inspiring to see young people organizing here at home — and across the world — to demand their leaders to act on climate change. I stand with you. #ClimateStrike https://t.co/sqL1ismymb"|en|D|81|617
1175094445697576966|43910797|Fri Sep 20 17:08:42 +0000 2019|"Today we honor and remember the servicemembers who were prisoners of war and those who never returned home to their families — thank you for your sacrifice.
 
We are also thinking of the families who live with the pain of not knowing whether their loved one will return. https://t.co/jl9OH4oDo8"|en|D|38|113
1174774949304774657|43910797|Thu Sep 19 19:59:08 +0000 2019|"Thousands of @UAW workers in Ohio and around the country are going without their paychecks and health insurance to demand @GM respect the work they do to make their company successful.

Workers are fed up. https://t.co/UO1kf4UDRd"|en|D|181|543
1174742835725262851|43910797|Thu Sep 19 17:51:32 +0000 2019|"CLEVELAND: @SenDuckworth has a special message for you!

Our fifth annual Ohio Women’s Leadership Summit will be in Cleveland on Saturday, October 5th. https://t.co/PYZi4SqdUi"|en|D|30|102
1174442791902089218|43910797|Wed Sep 18 21:59:16 +0000 2019|"Bryan Paulson’s 4-year-old daughter, Chesney, had a doctor’s appointment scheduled for next week for her hearing.

But because @GM canceled their worker’s health insurance without notice, her parents won’t know if the tubes in her ears are okay. https://t.co/gkHYO0CJNb"|en|D|54|161
1174402305183145985|43910797|Wed Sep 18 19:18:23 +0000 2019|Do something, President Trump and Mitch McConnell. #EndGunViolence https://t.co/6bO8rjinst|en|D|260|944
1174116975502643200|43910797|Wed Sep 18 00:24:35 +0000 2019|"HAPPENING NOW: Sherrod joins Senator @ChrisMurphyCT and Senate Democrats on the floor to keep up the pressure on Mitch McConnell and President Trump to take action on gun violence. #EndGunViolence

https://t.co/6bOJ5nomi1"|en|D|626|2621
1174091300582363136|43910797|Tue Sep 17 22:42:34 +0000 2019|TONIGHT: I’ll be playing #Hardball at 7:15 p.m. ET with @HardballChris talking about autoworkers and commonsense gun legistlation — tune in.|en|D|11|67
1174071414661496833|43910797|Tue Sep 17 21:23:33 +0000 2019|"This is Randy from @UAW Local 14 in Toledo. His son has a doctors appointment today, but Randy doesn’t know if he can go because @GM cut off his insurance without warning — health insurance he worked hard to earn. 

These dirty tactics have to stop. https://t.co/6VI5BBoIuV"|en|D|195|387
1173967112160907267|43910797|Tue Sep 17 14:29:05 +0000 2019|"President Trump’s attacks on women’s health has real consequences. 

Two Planned Parenthood clinics in Cincinnati will be forced to close their doors — this will be devastating for so many Southwest Ohio women. #SaveTitleX https://t.co/OrctHBvexM"|en|D|174|474
1173733093930360833|43910797|Mon Sep 16 22:59:11 +0000 2019|"Let’s be clear: Autoworkers are the engine behind GM’s success.
 
GM needs to agree to a contract that honors the Dignity of Work and recognizes the autoworkers, communities, and families who all help drive the success of the auto industry in Ohio and across the country. https://t.co/qI5Vr6Re54"|en|D|256|927
1173717111212052480|43910797|Mon Sep 16 21:55:40 +0000 2019|"WATCH LIVE: Sherrod hosts #WorkingFamilies Facebook Live Townhall 

https://t.co/6WU0F8Su8V"|en|D|2|12
1173698933274681352|43910797|Mon Sep 16 20:43:26 +0000 2019|Don’t forget to tune in to our #WorkingFamilies Facebook Live Townhall at 5:45 pm ET. You can join us here➡️ https://t.co/6WU0F8Su8V #NoTaxBillWithoutWorkingFamilies|en|D|2|16
1173659707451551744|43910797|Mon Sep 16 18:07:34 +0000 2019|My statement on @UAW strike, as autoworkers push for fair compensation and better working conditions: https://t.co/1NmjL6GrfC|en|D|77|284
1172645883101335552|43910797|Fri Sep 13 22:58:59 +0000 2019|Don’t forget to submit your questions for the #WorkingFamilies Facebook Live Townhall to questions@brown.senate.gov or you can reply below with your questions! ⬇️ #NoTaxBillWithoutWorkingFamilies https://t.co/rjdHciFosY|en|D|18|25
1172613577737420800|43910797|Fri Sep 13 20:50:37 +0000 2019|Yesterday, @senrobportman and I introduced legislation to rename NASA’s Plum Brook Station, the agency’s test facility in Sandusky, Ohio, after Neil Armstrong. https://t.co/vAZeiQ1OYy|en|D|12|103
1172214171276075008|43910797|Thu Sep 12 18:23:31 +0000 2019|No more tax bills that don’t put money in the pockets of workers and families. It’s time for Congress to act on the #WorkingFamilies Tax Relief Act. https://t.co/AKNYzy6DJy|en|D|27|100
1171906386147627008|43910797|Wed Sep 11 22:00:30 +0000 2019|ICYMI: Sherrod’s hosting a #WorkingFamilies Facebook Live Townhall, Monday, September 16th at 5:45 p.m. Eastern Time. Email your questions to questions@brown.senate.gov! https://t.co/wrLKe0EPmr|en|D|21|23
1171880320406360065|43910797|Wed Sep 11 20:16:55 +0000 2019|Yesterday, Sherrod announced that the @USDA has made disaster relief funds available for Ohio farmers hit by natural disasters in 2018 and 2019. https://t.co/EGstEnNXpm|en|D|10|31
1171861733578858496|43910797|Wed Sep 11 19:03:04 +0000 2019|Always enjoy meeting with Ohio’s Community Health Centers. Thank you for all the work you do every day to keep Ohioans healthy. Know that I am with you and will continue to fight to get funding extended as quickly as possible. https://t.co/Duq7vYOIVJ|en|D|15|89
1171810353434353665|43910797|Wed Sep 11 15:38:54 +0000 2019|"Today we remember those whose lives were taken 18 years ago, the first responders &amp; ordinary citizens who dropped everything to help fellow Americans in need.

We also thank our brave servicemembers who responded to the call to serve our nation that day &amp; every day since. https://t.co/loCYSSaEjL"|en|D|51|239
1171473842121740289|43910797|Tue Sep 10 17:21:43 +0000 2019|.@NLRB’s decision to deny @Boeing South Carolina flight technicians from forming a union is simply wrong. I stand with the @MachinistsUnion in their ongoing fight to bring justice and collective bargaining rights to workers at the South Carolina facility.|en|D|55|169
1171189153763135488|43910797|Mon Sep 09 22:30:28 +0000 2019|Allowing politicians to make reckless decisions about women’s health care has consequences and today’s example is the closure of these two critical health centers in Cincinnati. https://t.co/jUwmHbzr13|en|D|276|593
1171151583985459201|43910797|Mon Sep 09 20:01:11 +0000 2019|Join me for a Facebook Live Townhall 9/16 at 5:45PM ET. President Trump’s tax scam left #WorkingFamilies out. We can’t allow him to do it again. No more tax bills unless they put money in the pockets of workers &amp; families. Share your story. https://t.co/K52Ow5reDh|en|D|19|34
1171137499474944000|43910797|Mon Sep 09 19:05:13 +0000 2019|WATCH LIVE: Sherrod joins Dayton Mayor @nanwhaley, Senators Schumer and Stabenow, Speaker Pelosi, and Representatives Escobar and Thompson in calling on Mitch McConnell to bring the House-passed Bipartisan Background Checks Act to the Senate floor for a vote. https://t.co/xeOrngLsNJ|en|D|60|282
1171094641246134274|43910797|Mon Sep 09 16:14:55 +0000 2019|Thank you to Ohio veterans for sharing your stories with me in Geauga County today. Ohio veterans have sacrificed so much for our country and we need to ensure they get the quality education, job opportunities, and health care they've earned. https://t.co/4ddDDGeMLu|en|D|20|98
1170123596758429697|43910797|Fri Sep 06 23:56:19 +0000 2019|"Happy National Read a Book Day. 📚 I just finished ""The Tattooist of Auschwitz"" by Heather Morris.

Reply below with what books you’re reading."|en|D|178|1496
1170029191150129152|43910797|Fri Sep 06 17:41:11 +0000 2019|Meet the newest addition to our family, Walter. https://t.co/dU26OoKbwA|en|D|23|241
1169751090851713024|43910797|Thu Sep 05 23:16:07 +0000 2019|President Trump’s housing plan will make mortgages more expensive and harder to get. I’m urging the President: Make it easier for working people to buy or rent their homes, not harder.  https://t.co/6X6CcEa2PX|en|D|134|317
1169356404135800838|43910797|Wed Sep 04 21:07:46 +0000 2019|"This is a step in the right direction to help end gun violence. 

Now, it’s time for the President and Mitch McConnell to act.  
https://t.co/p757VRVHfK"|en|D|33|215
1169271669476777984|43910797|Wed Sep 04 15:31:04 +0000 2019|BREAKING: Sherrod announces $55.5M grant to address Ohio opioid crisis. The funds will be used to expand access to addiction treatment such as medication-assisted treatment (MAT). https://t.co/8528MNfrEy|en|D|33|163
1169209210019729408|43910797|Wed Sep 04 11:22:53 +0000 2019|The President’s decision to go around Congress and take funding away from our military to support his vanity project is reckless and irresponsible. https://t.co/SoxOcrLTqR|en|D|413|1238
1168973259733458953|43910797|Tue Sep 03 19:45:18 +0000 2019|I will never stop fighting to protect women’s freedom to make their own health care decisions. Thank you for letting me join the discussion. https://t.co/KxUXx7zkIa|en|D|133|684
1168897686629572608|43910797|Tue Sep 03 14:45:00 +0000 2019|🚨 Today is the LAST day to apply for federal disaster relief aid. Apply online at https://t.co/yI4wSDVj4x or call 1-800-621-3362 for more information. 🚨|en|D|36|33
1168601233533427713|43910797|Mon Sep 02 19:07:00 +0000 2019|REMINDER: Tomorrow, September 3rd, is the LAST day to apply for federal disaster relief aid. Head over to ➡️  https://t.co/yI4wSEcUt7 to apply online or call 1-800-621-3362 for more information.|en|D|24|35
1168511391571091459|43910797|Mon Sep 02 13:10:00 +0000 2019|"Happy Labor Day to all American workers.
 
I want to particularly thank all of you who aren’t able to spend the day with families and friends because you don’t have the day off. You’re working hard to support your families, often for too little pay."|en|D|1126|5530
1167962870602010624|43910797|Sun Sep 01 00:50:22 +0000 2019|My statement on today’s events in Texas: https://t.co/3LGnkubZd6|en|D|398|1371
1167533699082194950|43910797|Fri Aug 30 20:25:00 +0000 2019|Don’t forget — the deadline to apply for federal assistance is Tuesday, September 3rd. Ohioans can apply online at https://t.co/yI4wSEcUt7 or by calling 1-800-621-3362 for more information.|en|D|13|24
1167506529551077382|43910797|Fri Aug 30 18:37:02 +0000 2019|"25 days ago, I looked President Trump in the eye during his visit to Dayton and I implored the President to call McConnell and ask him to hold a vote.

The President still has not found the courage to stand up to the NRA. https://t.co/fbOCxHXxm8"|en|D|1441|3905
